"hep-th/9607200","Peter Cho","Peter Cho and Per Kraus","Symplectic SUSY Gauge Theories with Antisymmetric Matter","21 pages, Revtex","Phys.Rev. D54 (1996) 7640-7649","10.1103/PhysRevD.54.7640","CALT-68-2062","hep-th hep-ph",,"  We investigate the confining phase vacua of supersymmetric $Sp(2\NC)$ gauge
theories that contain matter in both fundamental and antisymmetric
representations. The moduli spaces of such models with $\NF=3$ quark flavors
and $\NA=1$ antisymmetric field are analogous to that of SUSY QCD with
$\NF=\NC+1$ flavors. In particular, the forms of their quantum superpotentials
are fixed by classical constraints. When mass terms are coupled to
$W_{(\NF=3,\NA=1)}$ and heavy fields are integrated out, complete towers of
dynamically generated superpotentials for low energy theories with fewer
numbers of matter fields can be derived. Following this approach, we deduce
exact superpotentials in $Sp(4)$ and $Sp(6)$ theories which cannot be
determined by symmetry considerations or integrating in techniques. Building
upon these simple symplectic group results, we also examine the ground state
structures of several $Sp(4) \times Sp(4)$ and $Sp(6) \times Sp(2)$ models. We
emphasize that the top-down approach may be used to methodically find dynamical
superpotentials in many other confining supersymmetric gauge theories.
","[{""version"":""v1"",""created"":""Thu, 25 Jul 1996 20:53:34 GMT""}]","2009-10-30"
"hep-th/9607201","John Schwarz","John H. Schwarz","Lectures on Superstring and M Theory Dualities","67 pages, latex, 1 figure; Lectures given at the ICTP Spring School
  (March 1996) and the TASI Summer School (June 1996), TASI96","Nucl.Phys.Proc.Suppl.55B:1-32,1997","10.1016/S0920-5632(97)00070-4",,"hep-th",,"  These lectures begin by reviewing the evidence for S duality of the
toroidally compactified heterotic string in 4d that was obtained in the period
1992--94. Next they review recently discovered dualities that relate all five
of the 10d superstring theories and a quantum extension of 11d supergravity
called M theory. The study of p-branes of various dimensions (some of which are
D-branes) plays a central role. The final sections survey supersymmetric string
vacua in 6d and some of the dual constructions by which they can be obtained.
Special emphasis is given to a class of N=1 models that exhibit
``heterotic-heterotic duality.''
","[{""version"":""v1"",""created"":""Thu, 25 Jul 1996 23:44:00 GMT""},{""version"":""v2"",""created"":""Mon, 23 Sep 1996 19:53:09 GMT""}]","2010-11-19"
"hep-th/9607202","Michael P. Mattis","N. Dorey (Swansea), V.V. Khoze (Durham), M. Mattis (Los Alamos)","Multi-Instanton Calculus in N=2 Supersymmetric Gauge Theory II: Coupling
  to Matter","40 pages, uses harvmac.tex","Phys. Rev. D 54, 7832 (1996)","10.1103/PhysRevD.54.7832","SWAT/125, DTP/9672","hep-th hep-ph",,"  We further discuss the N=2 superinstantons in SU(2) gauge theory, obtained
from the general self-dual solutions of topological charge n constructed by
Atiyah, Drinfeld, Hitchin and Manin (ADHM). We realize the N=2 supersymmetry
algebra as actions on the superinstanton moduli. This allows us to recast in
concise superfield notation our previously obtained expression for the exact
classical interaction between n ADHM superinstantons mediated by the adjoint
Higgs bosons, and moreover, to incorporate N_F flavors of hypermultiplets. We
perform explicit 1- and 2-instanton checks of the Seiberg-Witten prepotentials
for all N_F and arbitrary hypermultiplet masses. Our results for the low-energy
couplings are all in precise agreement with the predictions of Seiberg and
Witten except for N_F=4, where we find a finite renormalization of the coupling
which is absent in the proposed solution.
","[{""version"":""v1"",""created"":""Fri, 26 Jul 1996 01:29:50 GMT""}]","2016-08-24"
"hep-th/9607203","Kasper Peeters","F. De Jonghe, K. Peeters and K. Sfetsos","Killing-Yano Supersymmetry in String Theory","13 pages, LaTeX","Class.Quant.Grav. 14 (1997) 35-46","10.1088/0264-9381/14/1/007","THU-96/29, NIKHEF-96/013","hep-th",,"  The presence of Killing-Yano tensors implies the existence of non-standard
supersymmetries in point particle theories on curved backgrounds. In a string
theoretical context these are symmetries of the modes describing the
particle-like behavior of the string. In the presence of isometries we show
that, in addition to these, one can also define a new type of non-standard
supersymmetry among a mixture of particle and winding modes. The interplay with
T-duality is also examined and illustrated by explicit examples.
","[{""version"":""v1"",""created"":""Fri, 26 Jul 1996 13:57:02 GMT""}]","2009-10-30"
"nucl-th/9607051","Guy Chanfray","G. Chanfray","Pions in the nuclear medium","13 pages, latex, 8 figures eps (talk given at the Workshop, MESON'96,
  Cracow, Poland, 14 May 96)","Acta Phys.Polon.B27:3203-3220,1996",,"LYCEN 9623","nucl-th",,"  We discuss various aspects of pion physics in the nuclear medium. We first
study s-wave pion-nucleus interaction in connection with chiral symmetry
restoration and quark condensate in the nuclear medium. We then adress the
question of p-wave pion-nucleus interaction and collective pionic modes in
nuclei and draw the consequences for in medium $\pi\pi$ correlations especially
in the scalar-isoscalar channel. We finally discuss the modification of the rho
meson mass spectrum at finite density and/or temperature in connection with
relativistic heavy ion collisions.
","[{""version"":""v1"",""created"":""Fri, 26 Jul 1996 08:21:46 GMT""}]","2011-04-15"
"nucl-th/9607052",,"E.G. Lanza, M.V. Andres, F. Catara, Ph. Chomaz and C. Volpe","Role of anharmonicities and non-linearities in heavy ion collisions. A
  microscopic approach","33 pages, 9 figures, uses epsfig.sty and espart.sty","Nucl.Phys. A613 (1997) 445-471","10.1016/S0375-9474(96)00444-7","INFNCT/10-96","nucl-th",,"  Using a microscopic approach beyond RPA to treat anharmonicities, we mix
two-phonon states among themselves and with one-phonon states. We also
introduce non-linear terms in the external field. These non-linear terms and
the anharmonicities are not taken into account in the ""standard"" multiphonon
picture. Within this framework we calculate Coulomb excitation of 208Pb and
40Ca by a 208Pb nucleus at 641 and 1000MeV/A. We show with different examples
the importance of the non-linearities and anharmonicities for the excitation
cross section. We find an increase of 10 % for 208Pb and 20 % for 40Ca of the
excitation cross section corresponding to the energy region of the double giant
dipole resonance with respect to the ""standard"" calculation. We also find
important effects in the low energy region. The predicted cross section in the
DGDR region is found to be rather close to the experimental observation.
","[{""version"":""v1"",""created"":""Fri, 26 Jul 1996 13:35:45 GMT""}]","2009-10-30"
"nucl-th/9607053","Kouichi Hagino","K. Hagino, N. Takigawa, M. Dasgupta, D.J. Hinde and J.R. Leigh","Validity of the linear coupling approximation in heavy-ion fusion
  reactions at sub barrier energies","Latex file, 15 pages, 6 figures","Phys.Rev.C55:276-284,1997","10.1103/PhysRevC.55.276",,"nucl-th",,"  The role of higher order coupling of surface vibrations to the relative
motion in heavy-ion fusion reactions at near-barrier energies is investigated.
The coupled channels equations are solved to all orders, and also in the linear
and the quadratic coupling approximations. Taking $^{64}$Ni + $^{92,96}$Zr
reactions as examples, it is shown that all order couplings lead to
considerably improved agreement with the experimentally measured fusion cross
sections and average angular momenta of the compound nucleus for such heavy
nearly symmetric systems. The importance of higher order coupling is also
examined for asymmetric systems like $^{16}$O + $^{112}$Cd, $^{144}$Sm, for
which previous calculations of the fusion cross section seemed to indicate that
the linear coupling approximation was adequate. It is shown that the shape of
the barrier distributions and the energy dependence of the average angular
momentum can change significantly when the higher order couplings are included,
even for systems where measured fusion cross sections may seem to be well
reproduced by the linear coupling approximation.
","[{""version"":""v1"",""created"":""Fri, 26 Jul 1996 14:16:13 GMT""}]","2008-11-26"
"nucl-th/9607054","Dieter Kiderlen","D.Kiderlen, V.M.Kolomietz, S.Shlomo","Nuclear Shape Fluctuations in Fermi-Liquid Drop Model","23 pages, revtex, file and 3 figures, accepted for publication in
  Nuclear Physics A","Nucl.Phys. A608 (1996) 32-48","10.1016/0375-9474(96)00274-6",,"nucl-th",,"  Within the nuclear Fermi-liquid drop model, quantum and thermal fluctuations
are considered by use of the Landau-Vlasov-Langevin equation. The spectral
correlation function of the nuclear surface fluctuations is evaluated in a
simple model of an incompressible and irrotational Fermi liquid. The dependence
of the spectral correlation function on the dynamical Fermi-surface distortion
is established. The temperature at which the eigenvibrations become overdamped
is calculated. It is shown that, for realistic values of the relaxation time
parameter and in the high temperature regime, there is a particular eigenmode
of the Fermi liquid drop where the restoring force is exclusively due to the
dynamical Fermi-surface distortion.
","[{""version"":""v1"",""created"":""Fri, 26 Jul 1996 15:32:35 GMT""}]","2009-10-30"
"nucl-th/9607055","David Blaschke","H.-J. Schulze, D. Blaschke","Dilepton Enhancement by Thermal Pion Annihilation in the CERES
  Experiment","9 pages, RevTex, 4 eps figures, To appear in Phys. Lett. B","Phys.Lett. B386 (1996) 429-436","10.1016/0370-2693(96)00908-2","MPG-VT-UR 85/96","nucl-th",,"  We compare the recent CERES data on dielectron production in 200 GeV/u S+Au
collisions with the theoretical predictions due to pion annihilation in a
thermal hadronization and a string fragmentation scenario. Both models yield
similar results for the dilepton mass spectrum. A satisfactory description of
the experimental spectrum requires an in-medium reduction of the rho-mass and a
freeze-out temperature of about 150 MeV in the thermal model. We emphasize and
discuss the influence of experimental acceptance and resolution corrections.
","[{""version"":""v1"",""created"":""Fri, 26 Jul 1996 15:44:11 GMT""}]","2016-09-08"
"patt-sol/9607004","Patrick Buechel","P. Buechel, M. Luecke, D.Roth, R. Schmitz","Pattern selection in the absolutely unstable regime as a nonlinear
  eigenvalue problem: Taylor vortices in axial flow","15 pages (LateX-file), 8 figures (Postscript)","Phys. Rev. E, 53, 4764-77 (1996)","10.1103/PhysRevE.53.4764",,"patt-sol nlin.PS",,"  A unique pattern selection in the absolutely unstable regime of a driven,
nonlinear, open-flow system is analyzed: The spatiotemporal structures of
rotationally symmetric vortices that propagate downstream in the annulus of the
rotating Taylor-Couette system due to an externally imposed axial through-flow
are investigated for two different axial boundary conditions at the in- and
outlet. Unlike the stationary patterns in systems without through-flow the
spatiotemporal structures of propagating vortices are independent of parameter
history, initial conditions, and system's length. They do, however, depend on
the axial boundary conditions, the driving rate of the inner cylinder and the
through-flow rate. Our analysis of the amplitude equation shows that the
pattern selection can be described by a nonlinear eigenvalue problem with the
frequency being the eigenvalue. Approaching the border between absolute and
convective instability the eigenvalue problem becomes effectively linear and
the selection mechanism approaches that one of linear front propagation.
PACS:47.54.+r,47.20.Ky,47.32.-y,47.20.Ft
","[{""version"":""v1"",""created"":""Fri, 26 Jul 1996 09:09:02 GMT""}]","2009-10-30"
"quant-ph/9607022","Brif Constantin","C. Brif (1), A. Vourdas (2) and A. Mann (1) ((1) Technion, Haifa, (2)
  University of Liverpool)","Analytic representations based on SU(1,1) coherent states and their
  applications","LaTeX, 15 pages, no figures, to appear in J. Phys. A. More
  information on http://www.technion.ac.il/~brif/science.html","J.Phys.A29:5873-5886,1996","10.1088/0305-4470/29/18/017",,"quant-ph",,"  We consider two analytic representations of the SU(1,1) Lie group: the
representation in the unit disk based on the SU(1,1) Perelomov coherent states
and the Barut-Girardello representation based on the eigenstates of the SU(1,1)
lowering generator. We show that these representations are related through a
Laplace transform. A ``weak'' resolution of the identity in terms of the
Perelomov SU(1,1) coherent states is presented which is valid even when the
Bargmann index $k$ is smaller than one half. Various applications of these
results in the context of the two-photon realization of SU(1,1) in quantum
optics are also discussed.
","[{""version"":""v1"",""created"":""Fri, 26 Jul 1996 09:09:20 GMT""}]","2008-11-26"
"quant-ph/9607023","Lev Vaidman","Lev Vaidman","Emergence of Weak Values","12 pages, LaTeX, to appear in ""Quantum Interferometry"" VCH Publishers
  (1996), edited by F. De Martini",,,,"quant-ph",,"  Various quantum measurement procedures are analyzed and it is shown that
under certain conditions they yield consistently {\em weak values} which might
be very different from the eigenvalues, the allowed outcomes according to the
standard quantum formalism. The weak value outcomes result from peculiar
quantum interference of the pointer variable of the measuring device.
","[{""version"":""v1"",""created"":""Fri, 26 Jul 1996 15:22:22 GMT""}]","2007-05-23"
"supr-con/9607006","Andreas Schoenenberger","A. Sch\""onenberger, A. Larkin, E. Heeb, V. Geshkenbein, G. Blatter","Strong Pinning and Plastic Deformations of the Vortex Lattice","12 pages, TeX type, Postscript figures",,"10.1103/PhysRevLett.77.4636",,"supr-con cond-mat.supr-con",,"  We investigate numerically the dynamically generated plastic deformations of
a 3D vortex lattice (VL) driven through a disorder potential with isolated,
strong pinning centers (point-like or extended along the field direction). We
find that the VL exhibits a very peculiar dynamical behavior in the plastic
flow regime, in particular, topological excitations consisting of three or four
entangled vortices are formed. We determine the critical current density $j_c$
and the activation energy for depinning $U_c$ in the presence of a finite
density of strong pinning centers.
","[{""version"":""v1"",""created"":""Fri, 26 Jul 1996 14:13:11 GMT""}]","2009-10-30"
