"cond-mat/9607193","Shubashree Desikan","D.Shubashree and R.Shankar (Institute of Mathematical Sciences,
  Madras, India)","Field Theory of Quantum Antiferromagnets : From the Triangular to the
  Kagome Lattice","Revised version, Sections 5-7 Replaced by a Detailed Field Theoretic
  analysis of the Deformed Triangular Lattice Antiferromagnet and a discussion
  of the Relevant Order Parameters, 2 Figures replaced, 35 pages, 3 Figures",,,"IMSC 96/02/04","cond-mat",,"  We analyse a family of models, that interpolates between the Triangular
lattice antiferromagnet (TLAF) and the Kagome lattice antiferromagnet (KLAF).
We identify the field theories governing the low energy, long wavelength
physics of these models. Near the TLAF the low energy field theory is a
nonlinear sigma model of a SO(3) group valued field. The SO(3) symmetry of the
spin system is enhanced to a $SO(3)_R \times SO(2)_L$ symmetry in the field
theory. Near the KLAF other modes become important and the field takes values
in $SO(3) \times S_2$. We analyse this field theory and show that it admits a
novel phase in which the $SO(3)_R$ spin symmetry is unbroken and the $SO(2)_L$
symmetry is broken. We propose this as a possible mechanism by which a gapless
excitation can exist in the KLAF without breaking the spin rotation symmetry.
","[{""version"":""v1"",""created"":""Fri, 26 Jul 1996 15:26:54 GMT""},{""version"":""v2"",""created"":""Tue, 8 Apr 1997 07:47:26 GMT""}]","2008-02-03"
"cond-mat/9607194","Swapan K. Pati","Y. Anusooya, Swapan K Pati and S. Ramasesha","The Density Matrix Renormalization Group Studies of Metal-Halogen Chains
  within a Two-Band Extended Peierls-Hubbard Model","12 pages revtex; 15 eps figures available upon request",,,,"cond-mat",,"  The phase diagram of halogen-bridged mixed-valent metal complexes ($MX$) has
been studied using a two-band extended Peierls-Hubbard model employing the
recently developed Density Matrix Renormalization Group method. We present the
energies, charge and spin density distributions, bond orders, charge-charge and
spin-spin correlations, in the ground state for different parameters of the
model. The effect of bond alternation and site-diagonal distortion on the
ground state properties are considered in detail. We observe that the
site-diagonal distortion plays a significant role in deciding the nature of the
ground state of the system. We find that while the $CDW$ and $BOW$ phases can
coexist, the $CDW$ and $SDW$ phases are exclusive in most of the cases. We have
also studied the doped $MX$ chains both with and without bond alternation and
site-diagonal distortion in the $CDW$ as well as $SDW$ regimes. We find that
the additional charge in the polarons and bipolarons for hole doping are
confined to a few sites, in the presence of bond alternation and site-diagonal
distortion. For electron doping, we find that the additional charge(s) is(are)
smeared over the entire chain length and although energetics imply a
disproportionation of the negatively charged bipolaron, the charge and spin
density distributions do not reflect it. Positively charged bipolaron
disproportionates into two polarons in the $SDW$ region. There is also bond
order evidence for compression of bond length for the positively charged
polaronic and bipolaronic systems and an elongation of the bonds for systems
with negatively charged polarons and bipolarons.
","[{""version"":""v1"",""created"":""Fri, 26 Jul 1996 06:15:53 GMT""}]","2007-05-23"
"cond-mat/9608022","Kay Wiese","Kay Joerg Wiese and Francois David","New Renormalization Group Results for Scaling of Self-Avoiding Tethered
  Membranes","97 pages, 120 .eps-files","Nucl. Phys. B 487 (1997) 529-632","10.1016/S0550-3213(96)00588-3","Saclay T96/089","cond-mat",,"  The scaling properties of self-avoiding polymerized 2-dimensional membranes
are studied via renormalization group methods based on a multilocal operator
product expansion. The renormalization group functions are calculated to second
order. This yields the scaling exponent nu to order epsilon^2. Our
extrapolations for nu agree with the Gaussian variational estimate for large
space dimension d and are close to the Flory estimate for d=3. The interplay
between self-avoidance and rigidity at small d is briefly discussed.
","[{""version"":""v1"",""created"":""Fri, 26 Jul 1996 12:38:33 GMT""}]","2009-10-28"
"gr-qc/9607064","Nils Andersson","Nils Andersson","Evolving test-fields in a black-hole geometry","13 pages, 6 postscript figures","Phys. Rev. D 55, 468 (1997)","10.1103/PhysRevD.55.468","Preprint no WUGRAV 96-6","gr-qc",,"  We consider the initial value problem for a massless scalar field in the
Schwarzschild geometry. When constructed using a complex-frequency approach the
necessary Green's function splits into three components. We discuss all of
these in some detail: 1) The contribution from the singularities (the
quasinormal modes of the black hole) is approximated and the mode-sum is
demonstrated to converge after a certain well defined time in the evolution. A
dynamic description of the mode-excitation is introduced and tested. 2) It is
shown how a straightforward low-frequency approximation to the integral along
the branch cut in the black-hole Green's function leads to the anticipated
power-law fall off at very late times. We also calculate higher order
corrections to this tail and show that they provide an important complement to
the leading order. 3) The high-frequency problem is also considered. We
demonstrate that the combination of the obtained approximations for the
quasinormal modes and the power-law tail provide a complete description of the
evolution at late times. Problems that arise (in the complex-frequency picture)
for early times are also discussed, as is the fact that many of the presented
results generalize to, for example, Kerr black holes.
","[{""version"":""v1"",""created"":""Thu, 25 Jul 1996 16:28:30 GMT""}]","2016-08-24"
"gr-qc/9607065","Madore","J. Madore","Fuzzy Space-Time","17 pages LaTex",,"10.1139/cjp-75-6-385","LPTHE Orsay 96/64","gr-qc",,"  A review is made of recent efforts to define linear connections and their
corresponding curvature within the context of noncommutative geometry. As an
application it is suggested that it is possible to identify the gravitational
field as a phenomenological manifestation of space-time commutation relations
and to thereby clarify its role as an ultraviolet regularizer.
","[{""version"":""v1"",""created"":""Fri, 26 Jul 1996 09:08:06 GMT""}]","2009-10-28"
"gr-qc/9607066","Fernando Barbero","A. Tiemblo and R. Tresguerres","Time Evolution in Dynamical Spacetimes","27 pages, TeX",,,,"gr-qc",,"  We present a gauge--theoretical derivation of the notion of time, suitable to
describe the Hamiltonian time evolution of gravitational systems. It is based
on a nonlinear coset realization of the Poincar\'e group, implying the time
component of the coframe to be invariant, and thus to represent a metric time.
The unitary gauge fixing of the boosts gives rise to the foliation of spacetime
along the time direction. The three supressed degrees of freedom correspond to
Goldstone--like fields, whereas the remaining time component is a Higgs--like
boson.
","[{""version"":""v1"",""created"":""Fri, 26 Jul 1996 08:48:44 GMT""}]","2007-05-23"
"gr-qc/9607067","Martin Rainer","M. Rainer","The moduli space of local homogeneous 3-geometries","lecture presented at Pac. Conf. Grav. Cosm. (Feb. 1996, Seoul), 5
  pages, latex (+3 figures available as hardcopy)",,"10.1007/978-94-011-5812-1_37","IPM-96-Seoul","gr-qc",,"  For a canonical formulation of quantum gravity, the superspace of all
possible 3-geometries on a Cauchy hypersurface of a 3+1-dimensional Lorentzian
manifold plays a key role. While in the analogous 2+1-dimensional case the
superspace of all Riemannian 2-geometries is well known, the structure of the
superspace of all Riemannian 3-geometries has not yet been resolved at present.
  In this paper, an important subspace of the latter is disentangled: The
superspace of local homogenous Riemannian 3-geometries. It is finite
dimensional and can be factored by conformal scale dilations, with the flat
space as the center of projection. The corresponding moduli space can be
represented by homothetically normalized 3-geometries.
  By construction, this moduli space of the local homogenous 3-geometries is an
algebraic variety. An explicit parametrization is given by characteristic
scalar invariants of the Riemannian 3-geometry.
  Although the moduli space is not locally Euclidean, it is a Hausdorff space.
Nevertheless, its topology is compatible with the non-Hausdorffian topology of
the space of all Bianchi-Lie algebras, which characterize the moduli modulo
differences in their anisotropy.
","[{""version"":""v1"",""created"":""Fri, 26 Jul 1996 13:07:40 GMT""}]","2016-01-27"
"hep-lat/9607058","Rudolf H. Fiebig","H.R. Fiebig, R.M. Woloshyn","Light hadron masses with an $O(a^2)$ improved NNN action","Talk presented at LATTICE96(improvement)","Nucl.Phys.Proc.Suppl. 53 (1997) 886-889","10.1016/S0920-5632(96)00810-9",,"hep-lat",,"  Meson and baryon masses in the light (u,d and s) sector are calculated using
tadpole-improved gauge field and fermion actions. These are corrected to order
$O(a^2)$ on the classical level using next-nearest-neighbour terms. The
results, obtained at lattice spacings of 0.4 and 0.27fm, are compared to Wilson
action calculations.
","[{""version"":""v1"",""created"":""Thu, 25 Jul 1996 19:45:50 GMT""}]","2009-10-28"
"hep-lat/9607061","Ettore","Paolo Rossi and Ettore Vicari (University of Pisa)","Classical improvement of lattice actions and quantum effects: a unified
  view","10 pages, revtex","Phys.Lett. B389 (1996) 571-576","10.1016/S0370-2693(96)01320-2","IFUP-TH 42/96","hep-lat",,"  The possibility of removing the one-loop perturbative effects of lattice
artifacts by a proper choice of the lattice action is explored, and found to
depend crucially on the properties of the physical quantity considered. In this
respect the finite-space-volume mass gap m(L) is an improved observable. We
find an explicit momentum space representation of the one-loop contribution to
m(L) for arbitrary lattice actions in the case of two-dimensional O(N) sigma
models. We define a ``tree perfect'' Symanzik action and find that it formally
removes all one-loop lattice artifacts in m(L). On-shell improved actions do
not share this property.
","[{""version"":""v1"",""created"":""Fri, 26 Jul 1996 10:13:16 GMT""}]","2009-10-28"
"hep-lat/9607062","Martin Guertler","M. G\""urtler, E.-M. Ilgenfritz, J. Kripfganz, H. Perlt and A. Schiller","Detailed Phase Transition Study at M_H <= 70 GeV in a 3-dimensional
  $SU(2)$--Higgs Model","Talk presented at LATTICE96(electroweak), 4 pages, 5 figures","Nucl.Phys.Proc.Suppl. 53 (1997) 619-622","10.1016/S0920-5632(96)00735-9","HUB-EP-96/33","hep-lat",,"  We study the electroweak phase transition in an effective 3-dimensional
theory for a Higgs mass of about 70 GeV by Monte Carlo simulations. The
transition temperature and jumps of order parameters are obtained and
extrapolated to the continuum using multi-histogram techniques and finite size
analysis.
","[{""version"":""v1"",""created"":""Fri, 26 Jul 1996 12:18:11 GMT""}]","2009-10-28"
"hep-lat/9607063","Martin Guertler","M. G\""urtler, E.-M. Ilgenfritz, J. Kripfganz, H. Perlt and A. Schiller","Physics of the Electroweak Phase Transition at M_H <= 70 GeV in a
  3-dimensional SU(2)-Higgs Model","Talk presented at LATTICE96(electroweak), 4 pages, 5 figures","Nucl.Phys.Proc.Suppl. 53 (1997) 615-618","10.1016/S0920-5632(96)00734-7","HUB-EP-96/34","hep-lat",,"  Physical parameters of the electroweak phase transition in a 3d effective
lattice SU(2)-Higgs model are presented. The phase transition temperatures,
latent heats and continuum condensate discontinuities are measured at Higgs
masses of about 70 and 35 GeV. Masses and Higgs condensates are compared to
perturbation theory in the broken phase. In the symmetric phase bound states
and the static force are determined.
","[{""version"":""v1"",""created"":""Fri, 26 Jul 1996 13:08:36 GMT""}]","2009-10-28"
"hep-lat/9607064","J. Stack","John D. Stack","Polyakov Loops and Magnetic Screening from Monopoles in SU(2) Lattice
  Gauge Theory","5 pages, four Postscript figures, Latex","Nucl.Phys.Proc.Suppl. 53 (1997) 524-527","10.1016/S0920-5632(96)00707-4",,"hep-lat",,"  We present results from magnetic monopoles in $SU(2)$ lattice gauge theory at
finite temperature. The lattices are $16^{3}\times N_{t}$, for
$N_{t}=4,6,8,12$, at $\beta=2.5115$. Quantities discussed are: the spacial
string tension, Polyakov loops, and the screening of timelike and spacelike
magnetic currents.
","[{""version"":""v1"",""created"":""Fri, 26 Jul 1996 14:16:56 GMT""}]","2009-10-28"
"hep-lat/9607065","Massimo D'elia","B. Alles, M. D'Elia and A. Di Giacomo","Topological susceptibility through the deconfining phase transition","Talk presented at LATTICE96(topology). 3 pages, 2 postscript figures,
  uses espcrc2.sty included","Nucl.Phys.Proc.Suppl.53:541-543,1997","10.1016/S0920-5632(96)00712-8","IFUP-TH 43/96","hep-lat",,"  We present a measurement of the topological susceptibility in SU(3)
Yang-Mills theory through the deconfinement phase transition. An improved
operator is used for the topological charge density. A drop by an order of
magnitude is observed from the confined to the deconfined phase.
","[{""version"":""v1"",""created"":""Fri, 26 Jul 1996 14:57:02 GMT""}]","2008-11-26"
"hep-lat/9607066","Massimo Campostrini","Massimo Campostrini, Paolo Rossi, Andrea Pelissetto, and Ettore Vicari","Critical behavior of the correlation function of three-dimensional O(N)
  models in the symmetric phase","3 pages, requires espcrc2.sty","Nucl.Phys.Proc.Suppl. 53 (1997) 690-692","10.1016/S0920-5632(96)00755-4","IFUP-TH 45/96","hep-lat",,"  We present new strong-coupling series for O(N) spin models in three
dimensions, on the cubic and diamond lattices. We analyze these series to
investigate the two-point Green's function G(x) in the critical region of the
symmetric phase. This analysis shows that the low-momentum behavior of G(x) is
essentially Gaussian for all N from zero to infinity. This result is also
supported by a large-N analysis.
","[{""version"":""v1"",""created"":""Fri, 26 Jul 1996 15:06:15 GMT""}]","2009-10-28"
"hep-ph/9607433","Eligio Lisi","John N. Bahcall (Princeton, Inst. Advanced Study) and E. Lisi
  (Princeton, Inst. Advanced Study & Bari U. & INFN, Bari)","Tests of electron flavor conservation with the Sudbury Neutrino
  Observatory","31 pages (RevTeX) + 10 figures (postscript). Requires epsfig.sty.
  Gzipped figures also available at ftp://ftp.sns.ias.edu/pub/lisi/snopaper .
  To appear in Phys. Rev. D","Phys.Rev.D54:5417-5433,1996","10.1103/PhysRevD.54.5417","IASSNS-AST-96-33","hep-ph astro-ph nucl-ex nucl-th",,"  We analyze tests of electron flavor conservation that can be performed at the
Sudbury Neutrino Observatory (SNO). These tests, which utilize $^8$B solar
neutrinos interacting with deuterium, measure: 1) the shape of the recoil
electron spectrum in charged-current (CC) interactions (the CC spectrum shape);
and 2) the ratio of the number of charged current to neutral current (NC)
events (the CC/NC ratio). We determine standard model predictions for the CC
spectral shape and for the CC/NC ratio, together with realistic estimates of
their errors and the correlations between errors. We consider systematic
uncertainties in the standard neutrino spectrum and in the charged-current and
neutral current cross-sections, the SNO energy resolution and absolute energy
scale, and the SNO detection efficiencies. Assuming that either matter-enhanced
or vacuum neutrino oscillations solve the solar neutrino problems, we calculate
the confidence levels with which electron flavor non-conservation can be
detected using either the CC spectrum shape or the CC/NC ratio, or both. If the
SNO detector works as expected, the neutrino oscillation solutions that
best-fit the results of the four operating solar neutrino experiments can be
distinguished unambiguously from the standard predictions of electron flavor
conservation.
","[{""version"":""v1"",""created"":""Thu, 25 Jul 1996 16:08:48 GMT""}]","2009-10-07"
"hep-ph/9607434","Jonathan R. Ellis","John Ellis, N.E. Mavromatos and D.V. Nanopoulos","CPT and Superstring","15 pages, LaTeX, 4 figures (included)",,,"CERN-TH/96-189","hep-ph gr-qc hep-th",,"  We discuss the possibility that CPT violation may appear as a consequence of
microscopic decoherence due to quantum-gravity effects, that we describe using
a density-matrix formalism motivated by our studies of non-critical string
theory. The maximum possible order of magnitude of such decohering
CPT-violating effects is not far from the sensitivity of present experiments on
the neutral kaon system, and we review a simple parametrization for them. We
also review a recent data analysis carried out together with the CPLEAR
collaboration, which bounds any such decohering CPT-violating parameters to be
$\lappeq 10^{-19}$ GeV.
","[{""version"":""v1"",""created"":""Thu, 25 Jul 1996 19:18:15 GMT""}]","2007-05-23"
"hep-ph/9607435","Patrick Huet","Patrick Huet (University of Washington)","CPT Violation from Planck Scale Physics","6 pages, uses LaTeX, typographical errors corrected and references
  added",,,"UW/PT 96-11","hep-ph",,"  I address the phenomenology of CPT violation in the neutral kaon system under
the assumption that it originates from Planck scale physics. This assumption
opens the door to a new set of CPT violating parameters whose phenomenology is
distinct from the $\Delta$ parameter usually considered in the Hamiltonian. The
origin of these parameters reflects a possible departure from a $S$-matrix
evolution. Existing bounds on CPT violation are near the expected range based
on naive dimensional analysis. This provides a strong incentive to pursue the
quest of CPT violation in near-future kaon experiments. (Talk given at the
Workshop on K Physics, Orsay, France, May 30 - June 4, 1996.)
","[{""version"":""v1"",""created"":""Thu, 25 Jul 1996 20:55:44 GMT""},{""version"":""v2"",""created"":""Fri, 26 Jul 1996 22:02:32 GMT""},{""version"":""v3"",""created"":""Mon, 29 Jul 1996 20:39:52 GMT""}]","2008-02-03"
"hep-ph/9607436","Huabin Tang","Hua-Bin Tang","A New Approach to Chiral Perturbation Theory for Matter Fields","12 pages, RevTex, one figure, revised version with more details",,,"NUC-MINN-96/11-T","hep-ph nucl-th",,"  I propose a prescription for separating the high- and low-energy
contributions in effective field theories. This prescription allows a
relativistic treatment of matter fields in chiral perturbation theory while the
power counting remains valid.
","[{""version"":""v1"",""created"":""Thu, 25 Jul 1996 22:25:21 GMT""},{""version"":""v2"",""created"":""Tue, 24 Sep 1996 22:55:06 GMT""}]","2008-02-03"
"hep-ph/9607437","Joe Sato","Jiro Arafune and Joe Sato","CP and T violation test in neutrino oscillation","12 pages + 2 eps figures, Latex, In order to avoid misunderstanding
  we have refined our English and rewritten the parts which might be
  misleading. Several typographical errors are corrected","Phys.Rev. D55 (1997) 1653-1658","10.1103/PhysRevD.55.1653","ICRR-Report-369-96-20","hep-ph",,"  We examine how large violation of CP and T is allowed in long base line
neutrino experiments. When we attribute only the atmospheric neutrino anomaly
to neutrino oscillation we may have large CP violation effect. When we
attribute both the atmospheric neutrino anomaly and the solar neutrino deficit
to neutrino oscillation we may have a sizable T violation effect proportional
to the ratio of two mass differences; it is difficult to see CP violation since
we can't ignore the matter effect. We give a simple expression for T violation
in the presence of matter.
","[{""version"":""v1"",""created"":""Fri, 26 Jul 1996 05:28:59 GMT""},{""version"":""v2"",""created"":""Mon, 16 Sep 1996 14:50:55 GMT""},{""version"":""v3"",""created"":""Tue, 24 Sep 1996 09:24:00 GMT""}]","2009-10-28"
"hep-ph/9607439","Tran Tuan Anh","Hoang Ngoc Long","SU(3)_LxU(1)_N Model for Right-Handed Neutrino Neutral Currents","6 pages, Latex, no figures, Accepted for publication in Phys. Rev. D","Phys.Rev.D54:4691-4693,1996","10.1103/PhysRevD.54.4691",,"hep-ph",,"  A model based on the $\mbox{SU(3)}_L\otimes \mbox{U(1)}_N$ gauge group, in
which neutrinos have right-handed neutral currents is considered. We argue that
in order to have a result consistent with low-energy one, the right-handed
neutrino component must be treated as correction instead of an equivalent spin
state.
","[{""version"":""v1"",""created"":""Fri, 26 Jul 1996 07:39:20 GMT""}]","2008-11-26"
"hep-ph/9607440",,"B.G.Zakharov (Landau Institute for Theoretical Physics, Moscow)","Fully quantum treatment of the Landau--Pomeranchuk--Migdal effect in QED
  and QCD","E-mail: bgz@landau.ac.ru, kph169@aix.sp.kfa-juelich.de","JETP Lett.63:952-957,1996","10.1134/1.567126",,"hep-ph",,"  For the first time a rigorous quantum treatment of the
Landau-Pomeranchuk-Migdal effect in QED and QCD is given. The rate of photon
(gluon) radiation by an electron (quark) in medium is expressed through the
Green's function of a two-dimensional Schr\""odinger equation with an imaginary
potential. In QED this potential is proportional to the dipole cross section
for scattering of $e^{+}e^{-}$ pair off an atom, in QCD it is proportional to
the cross section of interaction with color centre of the color singlet
quark-antiquark-gluon system.
","[{""version"":""v1"",""created"":""Fri, 26 Jul 1996 13:53:19 GMT""}]","2011-05-05"
"hep-ph/9607441","Bryan Webber","B.R. Webber (Cavendish Laboratory, Cambridge University)","Deep Inelastic Scattering -- Theory and Phenomenology","20 pages LaTeX, 10 figures, uses epsfig.sty, procl.sty (included).
  Talk at DIS96, Rome, April 1996",,,"Cavendish-HEP-96/2","hep-ph",,"  Recent developments in theory and phenomenology relevant to deep inelastic
lepton scattering are reviewed, concentrating on the following topics:
Predicted behaviour of non-singlet and polarized structure functions at small
$x$; Theoretical studies of saturation and unitarity effects at small $x$ in
quarkonium scattering; Renormalons and higher twist contributions;
Next-to-leading-order calculations of jet cross sections; Forward jet
production as a probe of small-$x$ dynamics.
","[{""version"":""v1"",""created"":""Fri, 26 Jul 1996 15:46:46 GMT""}]","2007-05-23"
"hep-ph/9607442","Werner Vogelsang","L.E. Gordon (Argonne) and W. Vogelsang (Rutherford)","Inclusive Prompt Photon Production in Polarized pp Collisions at HERA-N","19 Pages, LaTeX, 4 figures as eps - files","Phys.Lett.B387:629-636,1996","10.1016/0370-2693(96)01062-3","ANL-HEP-PR-96-15, RAL-TR-96-057","hep-ph",,"  We present a NLO study of inclusive polarized prompt photon production in a
conceivable fixed target $pp$ mode of HERA with longitudinally polarized
protons at $\sqrt{s}=39$ GeV. We analyze the sensitivity of the corresponding
double spin asymmetry to the proton's polarized gluon distribution $\Delta g$
and estimate the expected statistical precision in its determination. The main
theoretical uncertainties in the predictions are examined.
","[{""version"":""v1"",""created"":""Fri, 26 Jul 1996 15:47:36 GMT""}]","2014-11-17"
"hep-th/9607197",,"Giampiero Esposito","Non-Local Boundary Conditions for Massless Spin-1/2 Fields","11 pages, Plain-Tex","Phys.Rev. D55 (1997) 3886-3888","10.1103/PhysRevD.55.3886","DSF preprint 96/36","hep-th",,"  This paper studies the 1-loop approximation for a massless spin-1/2 field on
a flat four-dimensional Euclidean background bounded by two concentric
3-spheres, when non-local boundary conditions of the spectral type are imposed.
The use of $\zeta$-function regularization shows that the conformal anomaly
vanishes, as in the case when the same field is subject to local boundary
conditions involving projectors. A similar analysis of non-local boundary
conditions can be performed for massless supergravity models on manifolds with
boundary, to study their 1-loop properties.
","[{""version"":""v1"",""created"":""Thu, 25 Jul 1996 16:55:49 GMT""}]","2009-10-30"
"hep-th/9607198",,"Jacek Pawe{\l}czyk","New rigid string instantons in $R^4$","12 pages, Latex, one figure","Phys.Lett. B387 (1996) 287-293","10.1016/0370-2693(96)01041-6","UW-IFT-8/96, April 1996","hep-th",,"  New rigid string instanton equations are derived. Contrary to standard case,
the equations split into three families. Their solutions in $R^4$ are discussed
and explicitly presented in some cases.
","[{""version"":""v1"",""created"":""Thu, 25 Jul 1996 18:32:37 GMT""}]","2009-10-30"
"hep-th/9607199","Rabin Banerjee","R. Banerjee","Gauge Independent Lagrangian Reduction of Constrained Systems","LaTex 9 pages",,,,"hep-th",,"  A gauge independent method of obtaining the reduced space of constrained
dynamical systems is discussed in a purely lagrangian formalism. Implications
of gauge fixing are also considered.
","[{""version"":""v1"",""created"":""Thu, 25 Jul 1996 18:46:54 GMT""}]","2007-05-23"
