"astro-ph/9607132","Curtis S. Gehman","Curtis S. Gehman, Fred C. Adams, Richard Watkins","Linear Graviational Instability of Filamentary and Sheet-like Molecular
  Clouds with Magnetic Fields","22 pages AASTeX 4.0, 11 postscript figures",,"10.1086/178098","UM AC 96-04","astro-ph",,"  We study the linear evolution of small perturbations in self-gravitating
fluid systems with magnetic fields. We consider wave-like perturbations to
nonuniform filamentary and sheet-like hydrostatic equilibria in the presence of
a uniform parallel magnetic field. Motivated by observations of molecular
clouds that suggest substantial nonthermal (turbulent) pressure, we adopt
equations of state that are softer than isothermal. We numerically determine
the dispersion relation and the form of the perturbations in the regime of
instability. The form of the dispersion relation is the same for all equations
of state considered, for all magnetic field strengths, and for both geometries
examined. We demonstrate the existence of a fastest growing mode for the system
and study how its characteristics depend on the amount of turbulence and the
strength of the magnetic field. Generally, turbulence tends to increase the
rate and the length scale of fragmentation. While tending to slow the
fragmentation, the magnetic field has little effect on the fragmentation length
scale until reaching some threshold, above which the length scale decreases
significantly. Finally, we discuss the implications of these results for star
formation in molecular clouds.
","[{""version"":""v1"",""created"":""Thu, 25 Jul 1996 16:24:42 GMT""}]","2015-06-24"
"astro-ph/9607133","George Davies","George Davies and Lawrence M. Widrow","Test-Bed Simulations of Collisionless, Self-Gravitating Systems Using
  the Schr\""odinger Method","14 pages, 10 postscript figures, submitted to ApJ",,,,"astro-ph",,"  The Schr\""odinger Method is a novel approach for modeling numerically
self-gravitating, collisionless systems that may have certain advantages over
N-body and phase space methods. In particular, smoothing is part of the
dynamics and not just the force calculation. This paper describes test-bed
simulations which illustrate the viability of the Schr\""odinger Method. We
develop the techniques necessary to handle ``hot'' systems as well as
spherically symmetric systems. We demonstrate that the method can maintain a
stable, equilibrium star cluster by constructing and then evolving a Plummer
sphere. We also consider nonequilibrium initial conditions and follow the
system as it attempts to reach virial equilibrium through phase mixing and
violent relaxation. Finally we make a few remarks concerning the dynamics of
axions and other bosonic dark matter candidates. The Schr\""odinger Method, in
principle, provides an exact treatment of these fields. However such ``scalar
field'' simulations are feasible and warrented only if the deBroglie wavelength
of the particle is comparable to the size of the system of interest, a
situation that is almost certainly not the case for axions in the Galaxy.
Therefore the Schr\""odinger Method treats axions in the same way as other
collisionless particles. We challenge recent claims in the literature that
axions in the Galaxy form soliton stars.
","[{""version"":""v1"",""created"":""Thu, 25 Jul 1996 19:02:03 GMT""}]","2007-05-23"
"astro-ph/9607134","Geza Gyuk","Geza Gyuk (Univ. Chicago)","Gravitational Microlensing and the Structure of the Inner Milky Way","32 pages, Sixteen figures available at
  ftp://astro.uchicago.edu/pub/astro/gyuk/micromap/",,,,"astro-ph",,"  We analyze the first-year MACHO collaboration observations of microlensing
towards the Galactic center using a new direct likelihood technique that is
sensitive to the distribution of the events on the sky. We consider the full
set of 41 events, and calculate the direct likelihood against a
simply-parameterized Galactic model consisting of either a gaussian or
exponential bar and a double exponential disk. Optical depth maps are
calculated taking into account the contribution of both disk lenses and
sources. We show that based on the presently available data, a slope in the
optical depth has been clearly detected ($3\sigma$) in Galactic latitude and
that there are indications of a small slope in Galactic longitude. We discuss
limits that can be set on the mass, angle and axis ratio of the Galactic bulge.
We show that based on microlensing considerations alone, $M_{Bulge}>1.5\times
10^{10}\Msol$ at the 90\% confidence level and that the bulge inclination angle
is less than $30 \deg$ also at the 90\% confidence level. The mostly likely bar
mass is $M_{Bulge}=3.5\times10^{10}\Msol$. Such a high mass would imply a low
MACHO fraction for the halo. We consider disk parameters and show that there
are two degeneracies between the effects of a disk and those of a bar on the
optical depths. Finally, we discuss how to break these degeneracies and
consider various strategies for future microlensing observations.
","[{""version"":""v1"",""created"":""Thu, 25 Jul 1996 20:32:33 GMT""}]","2007-05-23"
"astro-ph/9607135","Rene Mendez","R. A. Mendez, R. M. Rich, W. F van Altena, T. M. Girard, S. van den
  Bergh, S. R. Majewski","A Large Proper-Motion Survey in Plaut's Low-Extinction Window","Tex type, 8 pages, 2 postscript figures. To appear in 4th ESO/CTIO
  Workshop on THE GALACTIC CENTER, La Serena, Chile, 10-15 March 1996,
  published by the Astronomical Society of the Pacific, ASP Conference Series",,,,"astro-ph",,"  We present preliminary results from the deepest and largest photographic
proper-motion survey ever undertaken of the Galactic bulge. Our first-epoch
plate material (from 1972-3) goes deep enough (V_lim = 22) to reach below the
bulge main-sequence turnoff. These plates cover an area of approximately 25
arc-min X 25 arc-min of the bulge in the low-extinction (A_v = 0.8 mag) Plaut
field at l= 0 deg, b= -8 deg, approximately 1 kpc south of the nucleus. This is
the point at which the transition between bulge and halo populations likely
occurs and is, therefore, an excellent location to study the interface between
the dense metal-rich bulge and the metal-poor halo. In this conference we
report results based on three first-epoch and three second-epoch plates
spanning 21 years. It is found that it is possible to obtain proper-motions
with errors less than 0.5 mas/yr for a substantial number of stars down to V=
20, without color restriction. For the subsample with errors less than 1 mas/yr
we derive proper-motion dispersions in the direction of Galactic longitude and
latitude of 3.378 +/- 0.033 mas/yr and 2.778 +/- 0.028$ mas/yr respectively.
These dispersions agree with those derived by Spaenhauer et al. (1992) in
Baade's window.
","[{""version"":""v1"",""created"":""Thu, 25 Jul 1996 20:40:29 GMT""}]","2007-05-23"
"astro-ph/9607136",,"Elisabete M. de Gouveia Dal Pino and Mark Birkinshaw","3-D Simulations of Protostellar Jets in Stratified Ambient Media","33 pp, LaTeX file, 13 figures upon request. To appear in the
  Astrophys. J., vol 471, nov. 10th",,"10.1086/178011",,"astro-ph",,"  We present fully three-dimensional hydrodynamical simulations of radiative
cooling jets propagating into stratified isothermal ambient media with
power-law density and pressure distributions. The parameters used are mainly
suitable for protostellar jets but results applicable to extragalactic jets are
also presented. Comparisons are made with previous simulations of jets through
homogeneous media. We find that for radiative cooling jets propagating into
regions where the ambient medium has an increasing density (and pressure)
gradient, the ambient gas tends to compress the cold, low-pressure cocoon of
shocked material that surrounds the beam and destroy the bow shock-like
structure at the head. The compressing medium collimates the jet and promotes
the development of Kelvin-Helmholtz instabilities which cause beam focusing,
wiggling and the formation of internal traveling shocks, $close$ $to$ $the$
$head$, via pinching along the beam. This remarkably resembles the structure of
some observed systems (e.g. Haro 6-5B northern and HH 24G jets). These effects
are larger for jets with smaller density ratio between jet and environment
$\eta $ (tested for $\eta $=1, 3, and 10) and larger Mach number $M_a=v_j/c_a$
(tested for $M_a=$12 and 24, where $v_j$ is the jet velocity and $c_a$ the
ambient sound speed). In an ambient medium of decreasing density (and
pressure), the beam is poorly collimated and relaxes, becoming faint. This
could explain ''invisible'' jet sections, like the gap between the parent
source and collimated beam (e.g., in HH30 jet). Although, on average, jets
propagating into an increasing (decreasing) density environment are decelerated
(accelerated) by the increasing (decreasing) ram pressure of the ambient
medium, we find that their propagation velocities have an oscillating pattern.
","[{""version"":""v1"",""created"":""Thu, 25 Jul 1996 20:56:16 GMT""}]","2009-10-28"
"astro-ph/9607137","Michael Efroimsky","Alex Lazarian and Michael Efroimsky","Cross-Section Alignment of Oblate Grains","24 pages, Post Script file. To appear in The Astrophysical Journal,
  Vol. 466, p. 274 - 281, July 1996","Astrophys.J. 466 (1996) 274-281","10.1086/177508",,"astro-ph physics.space-ph",,"  This paper provides a quantitative account of a recently introduced mechanism
of mechanical alignment of suprathermally rotating grains. These rapidly
rotating grains are essentially not susceptible to random torques arising from
gas-grain collisions, as the timescales for such torques to have significant
effect are orders of magnitude greater than the mean time between crossovers.
Such grains can be aligned by gaseous torques during the short periods of
crossovers and/or due to the difference in the rate at which atoms arrive at
grain surface. The latter is a result of the difference in orientation of a
grain in respect to the supersonic flow. This process, which we call
cross-section alignment, is the subject of our present paper. We derive
expressions for the measure of cross-section alignment for oblate grains and
study how this measure depends upon the angle between the interstellar magnetic
field and the gaseous flow and upon the grain shape.
","[{""version"":""v1"",""created"":""Thu, 25 Jul 1996 23:03:48 GMT""}]","2009-10-28"
"astro-ph/9607138","Monica Valluri","M. Valluri, G. C. Anupama","H-alpha Imaging of the Hickson Compact Group 62","18 pages, 3 Postscript figures, uses aaspp4.sty, To appear in the
  Astronomical Journal, October 1996",,"10.1086/118106",,"astro-ph",,"  We report results of a search for optical emission line gas in the Hickson
compact group 62. From narrow band (H-alpha) imaging observations we estimate
10^4 Msun of ionized hydrogen gas within the central regions of three of the
galaxies in the group. There has been considerable interest in this group since
ROSAT detected an extended halo of diffuse X-ray emission, possibly with a
cooling flow at the center. The optical emission line luminosities from the
three galaxies are comparable to each other (~10^{39} ergs/s) and resemble
those seen in normal X-ray luminous early type galaxies. There is no evidence
for any excess emission in the galaxy which lies at the center of the X-ray
cooling flow. We find that the most likely source of excitation for the
emission line nebulosities is photoionization by young stars.
","[{""version"":""v1"",""created"":""Fri, 26 Jul 1996 14:10:36 GMT""}]","2009-10-28"
"atom-ph/9607006","George Bertsch","G.F. Bertsch and V. Visuthikraisee","Spin-rotation coupling in ferromagnetic clusters","14 pages REVTex, 9 postscript figures",,,,"atom-ph physics.atom-ph",,"  We examine the magnetic response of free clusters considering the spin
direction and the cluster orientation as the only active degrees of freedom.
The average magnetization in small fields approaches the Langevin value for
paramagnets, depending on the degree to which the Hamiltonian preserves
symmetries. Superparamagnetic behavior is not achievable within models
considering only these degrees of freedom.
","[{""version"":""v1"",""created"":""Thu, 25 Jul 1996 16:51:41 GMT""}]","2008-02-03"
"chao-dyn/9607014","Greg Eyink","Gregory L. Eyink and Francis J. Alexander","Turbulence Fluctuations and New Universal Realizability Conditions in
  Modelling","4 pages, LaTeX (Version 2.09), 3 figures, Postscript, Submitted to
  Phys. Rev. Lett",,"10.1103/PhysRevLett.78.2563",,"chao-dyn nlin.CD",,"  General turbulent mean statistics are shown to be characterized by a
variational principle. The variational functionals, or ``effective actions'',
have experimental consequences for turbulence fluctuations and are subject to
realizability conditions of positivity and convexity. An efficient
Rayleigh-Ritz algorithm is available to calculate approximate effective actions
within PDF closures. Examples are given for Navier-Stokes and for a 3-mode
system of Lorenz. The new realizability conditions succeed at detecting {\em a
priori} the poor predictions of PDF closures even when the classical 2nd-order
moment realizability conditions are satisfied.
","[{""version"":""v1"",""created"":""Fri, 26 Jul 1996 14:28:06 GMT""}]","2009-10-28"
"cmp-lg/9607027","Ilyas Cicekli","Ilyas Cicekli and H. Altay Guvenir","Learning Translation Rules From A Bilingual Corpus","8 pages, Latex, uses nemlap.sty","Published in Proceedings of NEMLAP-2",,,"cmp-lg cs.CL",,"  This paper proposes a mechanism for learning pattern correspondences between
two languages from a corpus of translated sentence pairs. The proposed
mechanism uses analogical reasoning between two translations. Given a pair of
translations, the similar parts of the sentences in the source language must
correspond the similar parts of the sentences in the target language.
Similarly, the different parts should correspond to the respective parts in the
translated sentences. The correspondences between the similarities, and also
differences are learned in the form of translation rules. The system is tested
on a small training dataset and produced promising results for further
investigation.
","[{""version"":""v1"",""created"":""Fri, 26 Jul 1996 10:36:59 GMT""}]","2008-02-03"
"cmp-lg/9607028","Mark Stevenson","Yorick Wilks, Mark Stevenson (University of Sheffield, UK)","The Grammar of Sense: Is word-sense tagging much more than
  part-of-speech tagging?","8 pages, LaTeX",,,"CS-96-05","cmp-lg cs.CL",,"  This squib claims that Large-scale Automatic Sense Tagging of text (LAST) can
be done at a high-level of accuracy and with far less complexity and
computational effort than has been believed until now. Moreover, it can be done
for all open class words, and not just carefully selected opposed pairs as in
some recent work. We describe two experiments: one exploring the amount of
information relevant to sense disambiguation which is contained in the
part-of-speech field of entries in Longman Dictionary of Contemporary English
(LDOCE). Another, more practical, experiment attempts sense disambiguation of
all open class words in a text assigning LDOCE homographs as sense tags using
only part-of-speech information. We report that 92% of open class words can be
successfully tagged in this way. We plan to extend this work and to implement
an improved large-scale tagger, a description of which is included here.
","[{""version"":""v1"",""created"":""Fri, 26 Jul 1996 11:08:42 GMT""}]","2008-02-03"
"cond-mat/9607180","Steve Strong","William Bialek (NECI), Curtis G. Callan (Princeton) and S. P. Strong
  (NECI)","Field Theories for Learning Probability Distributions","12 pages, REVTEX","Phys.Rev.Lett. 77 (1996) 4693-4697","10.1103/PhysRevLett.77.4693","NECI-TN-96-002N","cond-mat adap-org hep-th nlin.AO",,"  Imagine being shown $N$ samples of random variables drawn independently from
the same distribution. What can you say about the distribution? In general, of
course, the answer is nothing, unless we have some prior notions about what to
expect. From a Bayesian point of view we need an {\it a priori} distribution on
the space of possible probability distributions, which defines a scalar field
theory. In one dimension, free field theory with a constraint provides a
tractable formulation of the problem, and we also discus generalizations to
higher dimensions.
","[{""version"":""v1"",""created"":""Thu, 25 Jul 1996 16:28:30 GMT""}]","2009-10-28"
"cond-mat/9607181","Jane' Kondev","Jane' Kondev (Brown University)","Loop models, Marginally Rough Interfaces, and the Coulomb Gas","LaTex, 7 pages, 1 PostScript figure; uses epsf.sty. To appear in the
  proceedings of the symposium''Exactly soluable models in Statistical
  Mechanics'', March 1996, Northeastern University, Boston",,"10.1142/S0217979297000204",,"cond-mat hep-th",,"  We develop a coarse-graining procedure for two-dimensional models of
fluctuating loops by mapping them to interface models. The result is an
effective field theory for the scaling limit of loop models, which is found to
be a Liouville theory with imaginary couplings. This field theory is {\it
completely specified} by geometry and conformal invariance {\it alone}, and it
leads to exact results for the critical exponents and the conformal charge of
loop models. A physical interpretation of the Dotsenko-Fateev screening charge
is found.
","[{""version"":""v1"",""created"":""Thu, 25 Jul 1996 19:03:23 GMT""}]","2015-06-25"
"cond-mat/9607182","Franco Nori","J. Groth, C. Reichhardt, C. J. Olson, Stuart Field, Franco Nori","Vortex Plastic Motion in Twinned Superconductors",,"Phys. Rev. Lett. 77 (1996) 3625-3628","10.1103/PhysRevLett.77.3625",,"cond-mat.mtrl-sci cond-mat.supr-con",,"  We present simulations, without electrodynamical assumptions, of
$B(x,y,H(t)), M(H(t))$, and $J_c(H(t))$, in hard superconductors, for a variety
of twin-boundary pinning potential parameters, and for a range of values of the
density and strength of the pinning sites. We numerically solve the overdamped
equations of motion of up to 10^4 flux-gradient-driven vortices which can be
temporarily trapped at $\sim 10^6$ pinning centers. These simulations relate
macroscopic measurements (e.g., M(H), ``flame'' shaped $B(x,y)$ profiles) with
the underlying microscopic pinning landscape and the plastic dynamics of
individual vortices.
","[{""version"":""v1"",""created"":""Thu, 25 Jul 1996 19:09:16 GMT""}]","2009-10-28"
"cond-mat/9607183",,"J.P. Rodriguez","Magnetic Properties of the Skyrmion Gas in Two Dimensions","11 pages of plain TeX, 1 postscript figure, accepted for publication
  in Physical Review B (rapid communications)",,"10.1103/PhysRevB.54.R8345",,"cond-mat",,"  The classical ferromagnet is analyzed in two dimensions via a mean-field
treatment of the CP$^1$ model valid in the limit of low temperature and of weak
magnetic field. At high skyrmion densities, we find that the magnetization
begins to decrease linearly with temperature, but it then crosses over to a
Curie-law at higher temperature. The comparison of these results with recent
Knight-shift experiments on the quantum Hall state is fair.
","[{""version"":""v1"",""created"":""Thu, 25 Jul 1996 21:44:18 GMT""}]","2009-10-28"
"cond-mat/9607184","Carlo Carraro","Carlo Carraro and David R. Nelson","Pinning and Tribology of Tethered Monolayers on Disordered Substrates","revtex, preprint style, 27 pages. This submission is a revision of
  cond-mat/9607184. The revisions affect only Appendix B, Appendix C, and Eqs.
  2.27, 2.28, 2.32",,"10.1103/PhysRevE.56.797",,"cond-mat",,"  We study the statistical mechanics and dynamics of crystalline films with a
fixed internal connectivity on a random substrate. Defect free triangular
lattices exhibit a sharp transition to a low temperature glassy phase with
anomalous phonon fluctuations and a nonlinear force-displacement law with a
continuously variable exponent, similar to the vortex glass phase of directed
lines in 1+1 dimensions. The periodicity of the tethered monolayer acts like a
filter which amplifies particular Fourier components of the disorder. However,
the absence of annealed topological defects like dislocations is crucial: the
transition is destroyed when the constraint of fixed connectivity is relaxed
and dislocations are allowed to proliferate.
","[{""version"":""v1"",""created"":""Thu, 25 Jul 1996 21:44:33 GMT""},{""version"":""v2"",""created"":""Wed, 25 Dec 1996 20:13:59 GMT""}]","2009-10-28"
"cond-mat/9607185","Mahito Kohmoto","H. Hiramoto and Mahito Kohmoto","Quasiperiodic Modulated-Spring Model","REV TeX file",,"10.1143/JPSJ.65.3915",,"cond-mat",,"  We study the classical vibration problem of a chain with spring constants
which are modulated in a quasiperiodic manner, {\it i. e.}, a model in which
the elastic energy is $\sum_j k_j( u_{j-1}-{u_j})^2$, where $k_j=1+\Delta
cos[2\pi\sigma(j-1/2)+\theta]$ and $\sigma$ is an irrational number. For
$\Delta < 1$, it is shown analytically that the spectrum is absolutely
continuous, {\it i.e.}, all the eigen modes are extended. For $\Delta=1$,
numerical scaling analysis shows that the spectrum is purely singular
continuous, {\it i.e.}, all the modes are critical.
","[{""version"":""v1"",""created"":""Fri, 26 Jul 1996 09:59:55 GMT""}]","2009-10-28"
"cond-mat/9607186","Marco Ferrero","M. E. Ferrero, G. Parisi and P. Ranieri","Fluctuations in a Spin Glass model with 1RSB","7 pages, latex source file",,,,"cond-mat",,"  We discuss Gaussian fluctuations in a spin glass model with one replica
symmetry breaking. We show how non-perturbative fluctuations of the break-point
parameter can be included in the longitudinal propagator within linear response
theory.
","[{""version"":""v1"",""created"":""Fri, 26 Jul 1996 14:38:55 GMT""}]","2007-05-23"
"cond-mat/9607187","Castellano Claudio","Claudio Castellano and Marco Zannetti","The approach to scaling in phase-ordering kinetics","4 pages, LaTeX, 6 postscript figures. Will appear in Phys. Rev. Lett",,"10.1103/PhysRevLett.77.2742",,"cond-mat",,"  The influence of the initial fluctuations on the onset of scaling in the
quench to zero temperature of a two dimensional system with conserved order
parameter, is analyzed in detail with and without topological defects. We find
that the initial fluctuations greatly affect the way scaling is reached, while
the number of components of the order parameter does not play a significant
role. Under strong initial fluctuations the preasymptotic linear behavior is
replaced by the mean field behavior of the large-N model, producing the
multiscaling to standard-scaling crossover also in the physically interesting
cases of systems with a small number of components.
","[{""version"":""v1"",""created"":""Fri, 26 Jul 1996 07:55:26 GMT""}]","2009-10-28"
"cond-mat/9607188","Henk Stoof","M. Bijlsma and H.T.C. Stoof","Renormalization Group Theory of the Three-Dimensional Dilute Bose Gas","48 pages of ReVTeX and 13 postscript figures. Submitted for
  publication in Physical Review A",,"10.1103/PhysRevA.54.5085","THU-96/30","cond-mat atom-ph",,"  We study the three-dimensional atomic Bose gas using renormalization group
techniques. Using our knowledge of the microscopic details of the interatomic
interaction, we determine the correct initial values of our renormalization
group equations and thus obtain also information on nonuniversal properties. As
a result, we can predict for instance the critical temperature of the gas and
the superfluid and condensate density of the Bose-Einstein condensed phase in
the regime $na\Lambda_{th}^2\ll 1$.
","[{""version"":""v1"",""created"":""Fri, 26 Jul 1996 13:12:00 GMT""}]","2009-10-28"
"cond-mat/9607189","Masahito Ueda","Masahito Ueda","Transmission spectrum of a tunneling particle interacting with dynamical
  fields: real-time functional-integral approach","RevTeX3.0, 18 pages, two figures (not included) are available upon
  request from the author. Accepted for publication in Phys. Rev. B15",,"10.1103/PhysRevB.54.8676",,"cond-mat",,"  A real-time functional-integral method is used to derive an effective action
that gives the transmission spectrum of a tunneling particle interacting with a
bath of harmonic oscillators. The transmission spectum is expressed in terms of
double functional integrals with respect to the coordinate of the particle
which are evaluated by means of stationary-phase approximation. The equations
of motion for the stationary-phase trajectories are solved exactly for an
arbitrary spectral density function of the bath, and the obtained solutions are
used to find the transmission spectra for specific examples. For a bath with
single frequency $\omega$, an analytic expression of the transmission spectrum
is obtained which covers from sudden tunneling ($\omega T_0\ll 1$) to adiabatic
one ($\omega T_0\gg 1$), where $T_0$ is the time it would take a classical
particle to traverse the inverted bare potential barrier. For a bath with Ohmic
spectrum, the differential tunneling conductance at low bias voltage $V$ and
for $\eta T_0\ll 1$ is found to obey a power law $\sim(eVT_0/\hbar)^{\eta
T_0S_0/2\pi\hbar}$, where $\eta$ is the friction coefficient and $S_0$ is the
tunneling exponent in the absence of interaction.
","[{""version"":""v1"",""created"":""Fri, 26 Jul 1996 14:47:23 GMT""}]","2009-10-28"
