"astro-ph/9612077","J. Wampler","E. J. Wampler","Do Quasars Lens Quasars?","6 pages, aas style, ams symbols, ApJL (accepted)",,"10.1086/310505",,"astro-ph",,"  If the unexpectedly high frequency of quasar pairs with very different
component redshifts is due to the lensing of a population of background quasars
by the foreground quasar, typical lens masses must be $\sim10^{12}M_{\sun}$ and
the sum of all such quasar lenses would have to contain $\sim0.005$ times the
closure density of the Universe. It then seems plausible that a very high
fraction of all $\sim10^{12} M_{\sun}$ gravitational lenses with redshifts
$z\sim1$ contain quasars. Here I propose that these systems have evolved to
form the present population of massive galaxies with M$_{\rm B}\leq-22$ and $M
>5\times10^{11} M_{\sun}$.
","[{""version"":""v1"",""created"":""Mon, 9 Dec 1996 02:50:47 GMT""}]","2016-08-30"
"astro-ph/9612078","Mail","Vladimir V. Usov","Physical processes in pulsar magnetospheres and non-thermal
  high-frequency emission","8 pages, latex, no figures. To be published in the Proceedings of the
  IAU Colloquium No 160, Pulsars: Problems and Progress, Sydney, 8-12 January
  1996 (invited paper)",,,,"astro-ph",,"  The energy source of a pulsar's non-thermal emission is the rotational energy
loss of the neutron star. The rotational energy of the neutron star is
transformed into the pulsar radiation by a long sequence of processes. The
processes of this sequence are discussed.
","[{""version"":""v1"",""created"":""Mon, 9 Dec 1996 10:26:20 GMT""}]","2007-05-23"
"astro-ph/9612079","Daniel Kunth","A. R. Petrosian, J. Boulesteix, G. Comte, D. Kunth, E. Le Coarer","An Interferometric Study of the Blue Compact Dwarf Galaxy IZW18","18 pages, figures will be sent on request; accepted in Astron.
  Astrophys. main Journal",,,,"astro-ph",,"  We present high spatial resolution observations of the blue compact dwarf
galaxy IZW18 performed in the Halpha line with a scanning Fabry-Perot
interferometer at the CFH telescope. Morphological structure of the galaxy in
Halpha and in the red continuum is investigated. We also analyse the velocity
field of the ionized gas. Besides the two compact HII components of the main
body we find a population of small HII regions in its surroundings whose
diameter distribution and Halpha luminosity function are consistent with those
observed in dwarf Irregular galaxies. In the main body of the galaxy besides of
the NW and SE red continuum peaks which are displaced with respect to the
Halpha maxima, three new red condensations have been discovered. They have no
clear Halpha counterparts. The velocity field in IZW18 shows peculiar motions
superimposed on a quite regular background implying solid-body rotation with a
gradient of about 70km/sec/ kpc. The Halpha line profiles exhibit an asymmetric
structure, except for the NW main compact component. At least part of this
asymmetry could result from accreted and/or expelled surrounding gas from the
main star-forming core(s) of the galaxy. Contrary to previous suggestions that
the south-west and north-east extensions of this galaxy are diffused emission
produced by bipolar emitting gas we provide evidence that they are HII regions
powered by star formation sites. The redshift of the Zwicky's ""flare"" has been
measured for the first time and corresponds to the same velocity as IZW18. In
such a context the optical ridge that appears to be an isolated morphological
structure has a shape that may result from the gravitational interaction with
the Zwicky's ""flare"" if this latter is a neighbour extreme dwarf object.
","[{""version"":""v1"",""created"":""Mon, 9 Dec 1996 10:56:13 GMT""}]","2007-05-23"
"astro-ph/9612080","Rob Fender","R. P. Fender (University of Sussex, UK), P. Roche, G. G. Pooley,, D.
  Chakrabarty, A. K. Tzioumis, M. A. Hendry, R. E. Spencer","A deep search for radio emission from three X-ray pulsars : are radio
  emission and X-ray pulsations anticorrelated ?","LaTeX, 4 pages, 3 figures. To appear in `Proceedings of 2nd INTEGRAL
  workshop : The Transparent Universe', ESA SP-382, in press",,,,"astro-ph",,"  We present results from a deep search for radio emission from the X-ray
pulsar systems GX 1+4, GS 0834-430 and 4U 0115+63 which have variously been
suggested to possess radio jets and to be good candidates for propellor
ejection mechanisms. None of these sources is detected at their optical
positions, to 3 sigma limits of a few hundred micro-Jy. This places upper
limits on their radio luminosities and thus on the internal energy and numbers
of any relativistic electrons which are three to four orders of magnitude below
those of radio-bright X-ray binaries such as SS 433 and Cyg X-3. Spectral and
structural information on the proposed `radio lobes' of GX 1+4 make their
association with the source unlikely. The lack of detected radio emission from
any X-ray pulsar system is discussed statistically, and it is found that X-ray
pulsations and radio emission from X-ray binaries are strongly anti-correlated.
","[{""version"":""v1"",""created"":""Mon, 9 Dec 1996 15:36:25 GMT""}]","2016-08-30"
"astro-ph/9612081","F. Haardt","Gabriele Ghisellini, Francesco Haardt, Roland Svensson","The Synchrotron Boiler: a Thermalizer in Seyfert Galaxies","2 pages, 1 figure.ps. Latex (memsait.sty). To apper in the
  Proceedings of ""Dal Micro al Mega Parsec: Secondo Congresso Nazionale sui
  Nuclei Galattici Attivi (From Micro to Mega Parsecs: Second Italian National
  Workshop on Active Galactic Nuclei)""",,,,"astro-ph",,"  There are difficulties in understanding what keeps the plasma thermalized in
compact sources, especially during rapid variations of the emitted flux.
Particle-particle collisions are too inefficient in hot rarefied plasmas, and a
faster process is called for. Synchrotron absorption is such a process. We show
that relativistic electrons can thermalize in a few synchrotron cooling times
by emitting and absorbing cyclo-synchrotron photons. The resulting equilibrium
distribution is a Maxwellian at low energies, with a high energy power law tail
when Compton cooling is important. Assuming that the particles emit completely
self absorbed synchrotron radiation while they at the same time Compton scatter
ambient UV photons, we calculate the time dependent behavior of the
distribution function, and the final high energy spectra.
","[{""version"":""v1"",""created"":""Mon, 9 Dec 1996 13:50:05 GMT""}]","2016-08-30"
"astro-ph/9612082","F. Haardt","Francesco Haardt","Models for X-ray Emission from Radio Quiet AGNs","8 pages, 1 figure.ps. Latex (memsait.sty). To apper in the
  Proceedings of ""Dal Micro al Mega Parsec: Secondo Congresso Nazionale sui
  Nuclei Galattici Attivi (From Micro to Mega Parsecs: Second Italian National
  Workshop on Active Galactic Nuclei)""",,,,"astro-ph",,"  The current status of understanding of the X-ray emission from Seyfert
galaxies involves thermal Comptonization of soft photons by mildrelativistic
electrons and positrons. I review observational and theoretical arguments
supporting such a view, discussing current models proposed for the structure of
the innermost part of the accretion flow: extended coronae, small scale flaring
blobs, advection dominated accretion disks and small scale cold cloudlets.
","[{""version"":""v1"",""created"":""Mon, 9 Dec 1996 14:00:32 GMT""}]","2007-05-23"
"chao-dyn/9612015","Berglund","N. Berglund, H. Kunz (Institut de Physique Th\'eorique, EPF-Lausanne,
  Switzerland)","Chaotic hysteresis in an adiabatically oscillating double well","4 pages RevTeX, 3 PS figs, uses psfig.sty. Submitted to Phys. Rev.
  Letters. PS file also available at
  http://dpwww.epfl.ch/instituts/ipt/berglund.html","Phys. Rev. Letters 78:1691-1694 (1997)","10.1103/PhysRevLett.78.1691",,"chao-dyn nlin.CD",,"  We consider the motion of a damped particle in a potential oscillating slowly
between a simple and a double well. The system displays hysteresis effects
which can be of periodic or chaotic type. We explain this behaviour by
computing an analytic expression of a Poincar'e map.
","[{""version"":""v1"",""created"":""Mon, 9 Dec 1996 15:39:28 GMT""}]","2010-12-09"
"chao-dyn/9612016","Berglund","N. Berglund, (Institut de Physique Th\'eorique, EPF-Lausanne,
  Switzerland)","Classical Billiards in a Magnetic Field and a Potential","6 pages LaTeX, 4 ps figs, uses psfig.sty. Proceedings of the 3rd
  Summer School/Conference in Maribor, Slovenia, 1996, submitted to Open
  Systems and Information Dynamics. PS file also available at
  http://dpwww.epfl.ch/instituts/ipt/berglund.html","Nonlinear Phenomena in Complex Systems 3:61-70 (2000)",,,"chao-dyn nlin.CD",,"  We study billiards in plane domains, with a perpendicular magnetic field and
a potential. We give some results on periodic orbits, KAM tori and adiabatic
invariants. We also prove the existence of bound states in a related scattering
problem.
","[{""version"":""v1"",""created"":""Mon, 9 Dec 1996 15:40:11 GMT""}]","2010-12-10"
"cond-mat/9612070","Benjamin P. Lee","Benjamin P. Lee (NIST) and John Cardy (Oxford)","Comment on Renormalization Group Study of the A+B->0 Diffusion-Limited
  Reaction","2 pages, revtex, 1 figure","J. Stat. Phys. 87, 951 (1997)","10.1007/BF02181256",,"cond-mat.stat-mech",,"  A recent argument of Oerding shows that our calculation of the quantity
Delta, which determines the amplitude of the asymptotic decay of the particle
density in d < 2 < 4, was in error. Instead it is simply given by Delta = n_0,
the initial density, for uncorrelated initial conditions.
","[{""version"":""v1"",""created"":""Sun, 8 Dec 1996 19:26:51 GMT""}]","2009-10-28"
"cond-mat/9612071","Yoshino Hajime","Hajime Takayama, Hajime Yoshino and Koji Hukushima","Aging Processes within One `Pure State' of the SK Model","12 pages, LaTex, 14 PostScript figures. Submitted to Journal of
  Physics A. A minor error was fixed",,,,"cond-mat.dis-nn",,"  Monte Carlo simulations on the SK model have been done to investigate aging
processes after a rapid quench from $T=\infty$ to the spin-glass phase. The
time range of simulations is taken care of so that the system does not surmount
free-energy barriers between the pure states which are considered to diverge in
the thermodynamic limit. We simulate time evolutions of extensive energy of the
system, Parisi's overlap distribution function, auto-correlation and
clones-correlation functions, distribution functions of the two correlations,
and magnetization induced by the field applied after a certain waiting time.
The data simulated exhibit a rich variety of aging phenomena. Most of them can
be interpreted in a unified way, though qualitatively, by the scenario of
``growth of quasi-equilibrium domains'' which we will introduce in this work.
More surprisingly, they suggest strongly that a basin of attraction of one
dominant pure state spans almost an entire phase space of the system with a
common time-reversal symmetry.
","[{""version"":""v1"",""created"":""Mon, 9 Dec 1996 05:33:55 GMT""},{""version"":""v2"",""created"":""Tue, 10 Dec 1996 05:34:36 GMT""}]","2008-02-03"
"cond-mat/9612072","Harek Haugerud","H. Haugerud, G. Uimin and W. Selke","From microscopic description to statistical mechanics of Cu-O chain
  fragments in the high-Tc superconductors REBa_2Cu_3O_{6+x}","21 pages, RevTex, 21 ps-figures",,"10.1016/S0921-4534(97)00002-6",,"cond-mat.supr-con cond-mat.str-el",,"  The oxygen deficient CuO_x planes of the high-Tc superconductors
REBa_2Cu_3O_{6+x} (RE denotes a rare-earth atom or yttrium) are studied.
Starting from the Emery model for the Cu-O chain fragments, an extended ASYNNNI
model is proposed to describe the statistical mechanics of the CuO_x planes.
The model is analysed by using Monte Carlo techniques, computing especially the
charge transfer to the CuO$_2$ planes regulating the high-Tc superconductivity,
and the concentration of differently coordinated Cu ions.Results are compared
to experimental data for various RE cases.
","[{""version"":""v1"",""created"":""Mon, 9 Dec 1996 11:16:39 GMT""}]","2015-06-25"
"cond-mat/9612073","Thomas Christen/CHCRC/ABB","Thomas Christen","Generalized thermodynamic potentials for mesoscopic conductors in the
  presence of transport","4 pages, RevTeX; will appear in Phys. Rev. B","Phys. Rev. B 55 7606 (1997)","10.1103/PhysRevB.55.7606",,"cond-mat.mes-hall",,"  It is shown that the nonequilibrium steady-state of a phase-coherent
conductor can be described by a generalized thermodynamic potential based on
the concept of partial densities of states. This is possible due to the fact
that dissipation takes place only in the contacts for the emitted carriers.
Long-range Coulomb interaction is included, and charge conservation and gauge
invariance are satisfied. The theory is illustrated for a mesoscopic capacitor
with leakage.
","[{""version"":""v1"",""created"":""Mon, 9 Dec 1996 11:19:29 GMT""}]","2009-10-28"
"cond-mat/9612074","Grigori Volovik","G.E. Volovik","Comment on Vortex Mass and Quantum Tunneling of Vortices","10 pages, no figures, version accepted in JETP Letters","Pisma Zh.Eksp.Teor.Fiz. 65 (1997) 201-206; JETP Lett. 65 (1997)
  217-223","10.1134/1.567299",,"cond-mat.supr-con",,"  Vortex mass in Fermi superfluids and superconductors and its influence on
quantum tunneling of vortices are discussed. The vortex mass is essentially
enhanced due to the fermion zero modes in the core of the vortex: the bound
states of the Bogoliubov qiasiparticles localized in the core. These bound
states form the normal component which is nonzero even in the low temperature
limit. In the collisionless regime $\omega_0\tau \gg 1$, the normal component
trapped by the vortex is unbound from the normal component in the bulk
superfluid/superconductors and adds to the inertial mass of the moving vortex.
In the d-wave superconductors, the vortex mass has an additional factor
$(B_{c2}/B)^{1/2}$ due to the gap nodes.
","[{""version"":""v1"",""created"":""Mon, 9 Dec 1996 12:06:40 GMT""},{""version"":""v2"",""created"":""Wed, 11 Dec 1996 16:54:55 GMT""},{""version"":""v3"",""created"":""Sat, 28 Dec 1996 16:09:11 GMT""},{""version"":""v4"",""created"":""Thu, 9 Jan 1997 15:29:00 GMT""}]","2009-10-28"
"cond-mat/9612075","Grigori Volovik","T.W.B. Kibble and G.E. Volovik","On Phase Ordering Behind the Propagating Front of a Second-Order
  Transition","LaTeX file, 9 pages, no figures, submitted to JETP Lett","JETP Lett. 65 (1997) 102-107; Pisma Zh.Eksp.Teor.Fiz. 65 (1997)
  96-101","10.1134/1.567332","IMPERIAL/TP/96-97/09","cond-mat hep-ph",,"  In a real system the heating is nonuniform and a second-order phase
transition into a broken symmetry phase occurs by propagation of the
temperature front. Two parameters, the cooling rate $\tau_Q$ and the velocity
$v_T$ of the transition front, determine the nucleation of topological defects.
Depending on the relation of these parameters two regimes are found: in the
regime of fast propagation defects are created according to the Zurek scenario
for the homogeneous case, while in the slow propagation regime vortex formation
is suppressed.
","[{""version"":""v1"",""created"":""Mon, 9 Dec 1996 12:58:19 GMT""}]","2009-10-28"
"cond-mat/9612077","Diptiman Sen","Diptiman Sen (McMaster University, Canada)","Quantization of the Derivative Nonlinear Schrodinger Equation","11 pages, LaTeX. I have learnt that similar work has been published
  earlier, see Refs. 13-14",,,,"cond-mat.stat-mech hep-th nlin.SI solv-int",,"  We study the quantum mechanics of the derivative nonlinear Schrodinger
equation which has appeared in many areas of physics and is known to be
classically integrable. We find that the N-body quantum problem is exactly
solvable with both bound states (with an upper bound on the particle number)
and scattering states. Quantization provides an alternative way to understand
various features of the classical model, such as chiral solitons and
two-soliton scattering.
","[{""version"":""v1"",""created"":""Mon, 9 Dec 1996 14:02:47 GMT""},{""version"":""v2"",""created"":""Tue, 10 Jun 1997 14:28:18 GMT""}]","2008-02-03"
"cond-mat/9612078","Cynthia J. Olson","C. J. Olson, C. Reichhardt, J. Groth, Stuart B. Field, and Franco Nori","Plastic Flow, Voltage Bursts, and Vortex Avalanches in Superconductors","4 pages, Latex, 4 figures included. Movies available at
  http://www-personal.engin.umich.edu/~nori","Physica C 290, 89 (1997).","10.1016/S0921-4534(97)01635-3",,"cond-mat.supr-con",,"  We use large-scale parallel simulations to compute the motion of
superconducting magnetic vortices during avalanches triggered by small field
increases. We find that experimentally observable voltage bursts correspond to
pulsing vortex movement along branched channels or winding chains, and relate
vortex flow images to features of statistical distributions. As pin density is
increased, a crossover occurs from interstitial motion in narrow easy-flow
winding channels with typical avalanche sizes, to pin-to-pin motion in broad
channels, characterized by a very broad distribution of sizes. Our results are
consistent with recent experiments.
","[{""version"":""v1"",""created"":""Mon, 9 Dec 1996 15:03:35 GMT""}]","2015-06-25"
"cond-mat/9612079","Pierre Ledoussal","Pierre Le Doussal, Leticia F. Cugliandolo and Luca Peliti","Dynamics of particles and manifolds in a quenched random force field","5 pages, Latex file","Europhys. Lett. vol 39 p 111 (1997)","10.1209/epl/i1997-00323-8","LPTENS-96/63, LPTL/LFC96/03","cond-mat.dis-nn",,"  We study the dynamics of a directed manifold of internal dimension D in a
d-dimensional random force field. We obtain an exact solution for $d \to
\infty$ and a Hartree approximation for finite d. They yield a Flory-like
roughness exponent $\zeta$ and a non trivial anomalous diffusion exponent $\nu$
continuously dependent on the ratio $g_{T}/g_{L}$ of divergence-free ($g_{T}$)
to potential ($g_{L}$) disorder strength. For the particle (D=0) our results
agree with previous order $\epsilon^2$ RG calculations. The time-translational
invariant dynamics for $g_{T} >0$ smoothly crosses over to the previously
studied ultrametric aging solution in the potential case.
","[{""version"":""v1"",""created"":""Mon, 9 Dec 1996 14:51:09 GMT""}]","2015-06-25"
"cond-mat/9612091","Nikolai V. Prokofev","N.V. Prokof'ev, B.V. Svistunov, and I.S. Tupitsyn","Exact Quantum Monte Carlo Process for the Statistics of Discrete Systems","4 pages, latex, no figures, English translation of the paper:","Pis'ma v Zh.Eks.Teor.Fiz., 64(12), 853 (1996)","10.1134/1.567243",,"cond-mat",,"  We introduce an exact Monte Carlo approach to the statistics of discrete
quantum systems which does not rely on the standard fragmentation of the
imaginary time, or any small parameter. The method deals with discrete objects,
kinks, representing virtual transitions at different moments of time. The
global statistics of kinks is reproduced by explicit local procedures, the key
one being based on the exact solution for the biased two-level system.
","[{""version"":""v1"",""created"":""Mon, 9 Dec 1996 13:01:26 GMT""}]","2009-10-28"
"gr-qc/9612019","Robin W. Tucker","R. W. Tucker and C. Wang (Lancaster University)","Dark Matter Gravitational Interactions","40 pages, 4 Postscript figures","Class.Quant.Grav.15:933-954,1998","10.1088/0264-9381/15/4/015",,"gr-qc",,"  We argue that the conjectured dark mater in the Universe may be endowed with
a new kind of gravitational charge that couples to a short range gravitational
interaction mediated by a massive vector field. A model is constructed that
assimilates this concept into ideas of current inflationary cosmology. The
model is also consistent with the observed behaviour of galactic rotation
curves according to Newtonian dynamics. The essential idea is that stars
composed of ordinary (as opposed to dark matter) experience Newtonian forces
due to the presence of an all pervading background of massive gravitationally
charged cold dark matter. The novel gravitational interactions are predicted to
have a significant influence on pre-inflationary cosmology. The precise details
depend on the nature of a gravitational Proca interaction and the description
of matter. A gravitational Proca field configuration that gives rise to
attractive forces between dark matter charges of like polarity exhibits
homogeneous isotropic eternal cosmologies that are free of cosmological
curvature singularities thus eliminating the horizon problem associated with
the standard big-bang scenario. Such solutions do however admit dense hot
pre-inflationary epochs each with a characteristic scale factor that may be
correlated with the dark matter density in the current era of expansion. The
model is based on a theory in which a modification of Einsteinian gravity at
very short distances can be expressed in terms of the gradient of the Einstein
metric and the torsion of a non-Riemannian connection on the bundle of linear
frames over spacetime. Indeed we demonstrate that the genesis of the model
resides in a remarkable simplification that occurs when one analyses the
variational equations associated with a broad class of non-Riemannian actions.
","[{""version"":""v1"",""created"":""Mon, 9 Dec 1996 14:32:10 GMT""}]","2010-11-30"
"hep-lat/9612008","Wolfhard Janke","Wolfhard Janke (JGU Mainz) and Ramon Villanova (UPF Barcelona)","Three-Dimensional 3-State Potts Model Revisited With New Techniques","25 pages, LaTeX + 9 postscript figures. Submitted to Nucl. Phys. B.
  See also http://www.cond-mat.physik.uni-mainz.de/~janke/doc/home_janke.html","Nucl.Phys. B489 (1997) 679-696","10.1016/S0550-3213(96)00710-9","KOMA-96-32","hep-lat",,"  We report a fairly detailed finite-size scaling analysis of the first-order
phase transition in the three-dimensional 3-state Potts model on cubic lattices
with emphasis on recently introduced quantities whose infinite-volume
extrapolations are governed `only' by exponentially small terms. In these
quantities no asymptotic power series in the inverse volume are involved which
complicate the finite-size scaling behaviour of standard observables related to
the specific-heat maxima or Binder-parameter minima. Introduced initially for
strong first-order phase transitions in q-state Potts models with ``large
enough'' q, the new techniques prove to be surprisingly accurate for a q value
as small as 3. On the basis of the high-precision Monte Carlo data of Alves `et
al.' [Phys. Rev. B43 (1991) 5846], this leads to a refined estimate of $\beta_t
= 0.550,565(10)$ for the infinite-volume transition point.
","[{""version"":""v1"",""created"":""Sun, 8 Dec 1996 21:45:38 GMT""}]","2016-09-01"
"hep-ph/9612288","Fyodor V. Tkachov","Fyodor V. Tkachov","On dimensional regularization and mathematical rigour","3p, PS. 23-nov-98: maintenance","VIII Int. Workshop on High Energy Physics. Zvenigorod, Russia.
  15-21 September 1993. Ed. B.Levtchenko. INP MSU: Moscow, 1994, p.92",,,"hep-ph hep-th",,"  The controversy concerning the phenomenon of breakdown of dimensional
regularization in the problems involving asymptotic expansions of Feynman
diagrams in non-Euclidean regimes is discussed with some pertinent
bibliographic comments.
","[{""version"":""v1"",""created"":""Sun, 8 Dec 1996 16:02:08 GMT""},{""version"":""v2"",""created"":""Mon, 9 Dec 1996 18:17:47 GMT""},{""version"":""v3"",""created"":""Sun, 8 Nov 1998 04:41:26 GMT""},{""version"":""v4"",""created"":""Mon, 23 Nov 1998 10:25:52 GMT""}]","2008-02-03"
"hep-ph/9612289",,"I. A. Shushpanov","Electromagnetic Form Factors of the Transition $\pi+\gamma^* \to A_1$","8 Tex pages, 6 Postscript figures",,,,"hep-ph",,"  Corrections due to gluon condensate to electromagnetic form factors of the
transition $\pi+\gamma^* \to A_1$ are calculated by standard QCD sum rules
technique. The obtained results are compared to the corresponding light-cone
QCD sum rules.
","[{""version"":""v1"",""created"":""Sun, 8 Dec 1996 19:57:01 GMT""}]","2007-05-23"
"hep-ph/9612290",,"A. Widom and Y. N. Srivastava","Charged Lepton Oscillations and (g-2) Measurements","Plain TeX, No figures",,,,"hep-ph",,"  Traditional analysis of $g=2(1+\kappa )$ experiments for charged leptons use
a classical spin vector picture. For muons, we here employ a more exact Dirac
quantum four component spinor theory. Survival probabilities (including wave
packet effects) are computed. These oscillate with the frequency $\Omega
=(\kappa eB/Mc)$ as has been assumed in previous muon $(g-2)$ experimental
analyses; i.e. muon survival probability oscillations are already at the root
of previous succesful $(g-2)$ measurements. Further oscillations should also be
observed if mixed neutrino mass matrices were to enter into the reactions (e.g.
$\pi^+ \to \mu^+ +\nu_\mu$) producing muons.
","[{""version"":""v1"",""created"":""Sun, 8 Dec 1996 18:43:20 GMT""}]","2007-05-23"
"hep-ph/9612291","Agustin Nieto","Agustin Nieto (Ohio State University)","Perturbative QCD at High Temperature","LaTeX, 27 pages, 15 figures. Final version","Int.J.Mod.Phys. A12 (1997) 1431-1464","10.1142/S0217751X97001043","OHSTPY-HEP-T-96-019","hep-ph",,"  Recent developments of perturbation theory at finite temperature based on
effective field theory methods are reviewed. These methods allow the
contributions from the different scales to be separated and the perturbative
series to be reorganized. The construction of the effective field theory is
shown in detail for phi^4 theory and QCD. It is applied to the evaluation of
the free energy of QCD at order g^5 and the calculation of the g^6 term is
outlined. Implications for the application of perturbative QCD to the
quark-gluon plasma are also discussed.
","[{""version"":""v1"",""created"":""Sun, 8 Dec 1996 23:28:40 GMT""},{""version"":""v2"",""created"":""Tue, 25 Mar 1997 17:41:44 GMT""}]","2009-10-30"
