"astro-ph/9612138","Edward Kolb","Edward W. Kolb","Inflation in the Postmodern Era","21-page LaTeX file for proceedings of the Erice School
  ``Astrofundamental Physics.'' Four postscript figures, figi.ps (i=1 to 4),
  included using epsf",,,"FERMILAB--Conf-96/437-A","astro-ph",,"  In this lecture I will review some recent progress in improving the accuracy
of the calculation of density perturbations resulting from inflation.
","[{""version"":""v1"",""created"":""Fri, 13 Dec 1996 16:25:06 GMT""}]","2007-05-23"
"astro-ph/9612139","Daniele Galli","F. Palla, D. Galli","Post-T Tauri stars: a false problem","6 pages (LaTeX), no Figures to be published in The Astrophysical
  Journal Letters",,"10.1086/310496","Arcetri Preprints 38/96","astro-ph",,"  We consider the problem of the apparent lack of old T Tauri stars in low-mass
star forming regions in the framework of the standard model of low-mass star
formation. We argue that the similarity between molecular cloud lifetime and
ambipolar diffusion timescale implies that star formation does not take place
instantaneously, nor at a constant rate. We conclude that the probability of
finding a large population of old stars in a star forming region is
intrinsically very small and that the post-T Tauri problem is by and large not
existent.
","[{""version"":""v1"",""created"":""Fri, 13 Dec 1996 17:00:11 GMT""}]","2009-10-28"
"astro-ph/9612140",,"William H. Waller, Theodore P. Stecher, and Ultraviolet Imaging
  Telescope Science Team","The UIT Survey of the Ultraviolet Sky Background","latex; 3 pages; uses style file crckapb.sty; to be published in ``New
  Horizons from Multi-Wavelength Sky Surveys,'' IAU Symposium 179, Barry
  Lasker, Marc Postman, editors, Kluwer Academic Publishers",,,,"astro-ph",,"  When viewed from above the Earth's atmosphere, the nighttime ultraviolet sky
background is profoundly dark - up to 100 times fainter than the equivalent
visible background as measured by groundbased telescopes. Because the UV
background is so faint, its measured strength and spatial distribution remain
controversial topics. Estimates range from a few hundred photons/(sec cm^2 sr^2
A) (~27 mag/arcsec^2) with no obvious spatial distribution to several thousand
``photon units'' with a strong gradient toward the Galactic midplane. Herein,
we summarize recent results from an analysis of UV images obtained by the
Ultraviolet Imaging Telescope - where relatively high nighttime UV intensities
are found near the Galactic midplane which then diminish to levels of ~300
photon units or less at high Galactic latitude.
","[{""version"":""v1"",""created"":""Fri, 13 Dec 1996 18:45:08 GMT""}]","2007-05-23"
"astro-ph/9612141","Andrei Linde","Juan Garcia-Bellido and Andrei Linde","Tilted Hybrid Inflation","4 pages, revtex, no figures","Phys.Lett.B398:18-22,1997","10.1016/S0370-2693(97)00211-6","CERN-TH/96-358, SU-ITP-96-60","astro-ph gr-qc hep-ph hep-th",,"  We propose a new version of the hybrid inflation scenario that produces a
significantly tilted n>1 spectrum of curvature perturbations. This may happen
in supersymmetric models where the inflaton field acquires a mass proportional
to the Hubble constant, and in the models where this field non-minimally
couples to gravity. A large tilt of the spectrum in this scenario is often
accompanied by a considerable contribution of tensor perturbations to the
temperature anisotropies. We also show that under certain conditions the
spectrum of density perturbations in this scenario may have a minimum on an
intermediate length scale.
","[{""version"":""v1"",""created"":""Fri, 13 Dec 1996 18:51:07 GMT""}]","2009-09-29"
"astro-ph/9612142","Mike Nowak","M.A. Nowak, R.V. Wagoner, M.C. Begelman, and D.E. Lehr","The 67 Hz Feature in the Black Hole Candidate GRS 1915+105 as a Possible
  ``Diskoseismic'' Mode","4 Pages, Latex (emulateapj.sty included), to Appear in ApJ Letters,
  Vol. 477, Final Version with Updated References",,"10.1086/310534",,"astro-ph",,"  The Rossi X-ray Timing Explorer (RXTE) has made feasible for the first time
the search for high-frequency (~ 100 Hz) periodic features in black hole
candidate (BHC) systems. Such a feature, with a 67 Hz frequency, recently has
been discovered in the BHC GRS 1915+105 (Morgan, Remillard, & Greiner). This
feature is weak (rms variability ~0.3%-1.6%), stable in frequency (to within ~2
Hz) despite appreciable luminosity fluctuations, and narrow (quality factor Q ~
20). Several of these properties are what one expects for a ``diskoseismic''
g-mode in an accretion disk about a 10.6 M_sun (nonrotating) - 36.3 M_sun
(maximally rotating) black hole (if we are observing the fundamental mode
frequency). We explore this possibility by considering the expected luminosity
modulation, as well as possible excitation and growth mechanisms---including
turbulent excitation, damping, and ``negative'' radiation damping. We conclude
that a diskoseismic interpretation of the observations is viable.
","[{""version"":""v1"",""created"":""Fri, 13 Dec 1996 23:07:28 GMT""},{""version"":""v2"",""created"":""Fri, 24 Jan 1997 22:59:07 GMT""}]","2009-10-28"
"astro-ph/9612143",,"Marek Kutschera","Hadron Physics and the Structure of Neutron Stars","Talk given at the Meeting of Astrophysics Commission of Polish
  Academy of Arts and Sciences, Cracow, June 1996, TeX, 19 pages, 3 figures",,,"INP Cracow 1735/PH","astro-ph",,"  The equation of state of hadronic matter in neutron stars is briefly
reviewed. Uncertainties regarding the stiffness and composition of hadronic
matter are discussed. Importance of poorly known short range interactions of
nucleons and hyperons is emphasized. Condensation of meson fields and the role
of subhadronic degrees of freedom is considered. Empirical constraints on the
equation of state emerging from observations of neutron stars are discussed.
Implications of possible black hole remnant of SN1987A for the equation of
state are also discussed.
","[{""version"":""v1"",""created"":""Sat, 14 Dec 1996 11:14:13 GMT""}]","2007-05-23"
"astro-ph/9612144","Andrew P. Gould","Andrew Gould and Jordi Miralda-Escude","Signatures of Accretion Disks in Quasar Microlensing","11 pages plus 1 postscript figure",,"10.1086/310739","OSU-TA-33/96","astro-ph",,"  We propose that relative variability on short time-scales of the multiple
images of a lensed quasar, after removal of the time delay, may be caused by
hot spots or other moving structures in the accretion disk crossing microlens
caustics caused by stellar mass objects in the lensing galaxy. Such variability
has been reported in the two images of 0957+561. The short durations would be
due to the high rotation speed of the disk (v/c ~ 0.1), rather than planetary
mass objects in the slowly moving (v/c ~ 0.001) lens. This interpretation could
be confirmed by finding periodicity, or correlations of the spectral and flux
variations due to the Doppler effect in the disk. We also propose another
signature of stationary accretion disks (with no intrinsic variability): the
gradient of the magnification over the accretion disk should cause a relative
color change between the images whose sign and amplitude are correlated with
the time derivative of the flux difference between the images. Other color
terms induced by the radial variation of disk colors are of second order in the
magnification gradient. The methods proposed here can be used first to verify
that accretion disks near supermassive black holes are the source of the
continuum radiation from quasars, and then to study them.
","[{""version"":""v1"",""created"":""Sat, 14 Dec 1996 13:51:30 GMT""}]","2009-10-28"
"chao-dyn/9612021","Michael Isichenko","M. B. Isichenko (University of California, San Diego)","Nonlinear Landau damping in collisionless plasma and inviscid fluid","4 pages. 1 tex (revtex), 1 bbl, and 7 eps files to make 4 figures
  with psfig. Submitted to PRL","Phys. Rev. Lett. 78(12) 2369 (1997)",,,"chao-dyn nlin.CD",,"  The evolution of an initial perturbation in Vlasov plasma is studied in the
intrinsically nonlinear long-time limit dominated by the effects of particle
trapping. After the possible transient linear exponential Landau damping, the
evolution enters into a universal regime with an algebraically damped electric
field, $E\propto1/t$. The trick used for the Vlasov equation is also applied to
the two-dimensional (2D) Euler equation. It is shown that the stream function
perturbation to a stable shear flow decays as $t^{-5/2}$ in the long-time
limit. These results imply a strong non-ergodicity of the fluid element motion,
which invalidates Gibbs-ensemble-based statistical theories of Vlasov and 2D
fluid turbulence.
","[{""version"":""v1"",""created"":""Sat, 14 Dec 1996 01:29:41 GMT""}]","2008-02-03"
"chao-dyn/9612022","Naoko Nakagawa","N. Nakagawa (1), T. S. Komatsu (2) ((1) Department of Pure and Applied
  Sciences, College of Arts and Sciences, University of Tokyo, (2) Research
  Institute of Electrical Communication, Tohoku University, Sendai, Japan)","Collective motion occurs inevitably in a class of populations of
  globally coupled chaotic elements","6 pages, 9 Postscript figures, uses revtex.sty","Phys. Rev. E, 57 (1998) 1570","10.1103/PhysRevE.57.1570",,"chao-dyn nlin.CD",,"  We discovered numerically a scaling law obeyed by the amplitude of collective
mo tion in large populations of chaotic elements. Our analysis strongly
suggests that such populations generically exhibit collective motion in the
presence of interaction, however weak it may be. A phase diagram for the
collective motion, which is characterized by peculiar structures similar to
Arnold tongues, is obtained.
","[{""version"":""v1"",""created"":""Sat, 14 Dec 1996 11:37:02 GMT""},{""version"":""v2"",""created"":""Sat, 5 Aug 2000 06:01:59 GMT""}]","2009-10-28"
"cond-mat/9612128","Loic Turban","L. Turban (1), F. Igloi (2 and 3) ((1) Henri Poincare University,
  Nancy, (2) Research Institute for Solid State Physics, Budapest, (3)
  University of Szeged)","Off-Diagonal Density Profiles and Conformal Invariance","8 pages, Plain TeX, macros included, minor corrections","J. Phys. A 30 (1997) L105-L111","10.1088/0305-4470/30/5/006",,"cond-mat.stat-mech",,"  Off-diagonal profiles of local densities (e.g. order parameter or energy
density) are calculated at the bulk critical point, by conformal methods, for
different types of boundary conditions (free, fixed and mixed). Such profiles,
which are defined by a non-vanishing matrix element of the appropriate operator
between the ground state and the corresponding lowest excited state of the
strip Hamiltonian, enter into the expression of two-point correlation functions
on a strip. They are of interest in the finite-size scaling study of bulk and
surface critical behaviour since they allow the elimination of regular
contributions. The conformal profiles, which are obtained through a conformal
transformation of the correlation functions from the half-plane to the strip,
are in agreement with the results of a direct calculation, for the energy
density of the two-dimensional Ising model.
","[{""version"":""v1"",""created"":""Sat, 14 Dec 1996 11:12:29 GMT""},{""version"":""v2"",""created"":""Mon, 16 Dec 1996 13:41:21 GMT""},{""version"":""v3"",""created"":""Thu, 9 Jan 1997 11:05:26 GMT""},{""version"":""v4"",""created"":""Thu, 4 Sep 1997 15:00:53 GMT""},{""version"":""v5"",""created"":""Fri, 19 Sep 1997 15:06:57 GMT""}]","2009-10-28"
"cond-mat/9612129","Jochen Rau","Jochen Rau (MPI-PKS Dresden)","Transport theory yields renormalization group equations","11 pages REVTeX, twocolumn, no figures; revised version with
  additional examples, to appear in Phys. Rev. E","Phys. Rev. E 55 (1997) 5147","10.1103/PhysRevE.55.5147",,"cond-mat.stat-mech hep-th",,"  We show that dissipative transport and renormalization can be described in a
single theoretical framework. The appropriate mathematical tool is the
Nakajima-Zwanzig projection technique. We illustrate our result in the case of
interacting quantum gases, where we use the Nakajima-Zwanzig approach to
investigate the renormalization group flow of the effective two-body
interaction.
","[{""version"":""v1"",""created"":""Fri, 13 Dec 1996 16:36:28 GMT""},{""version"":""v2"",""created"":""Tue, 18 Feb 1997 14:57:17 GMT""}]","2009-04-30"
"cond-mat/9612130","Mark Auslender","M. Auslender","Long-time asymptotic of temporal-spatial coherence function for light
  propagation through time dependent disorder","12 pages, Latex, no figures, to be publication in Phys. Lett. A","Phys. Lett. A 228, 187-194 (1997)","10.1016/S0375-9601(97)00104-7",,"cond-mat.dis-nn",,"  Long-time asymptotic of field-field correlator for radiation propagated
through a medium composed of random point-like scatterers is studied using
Bete-Salpeter equation. It is shown that for plane source the fluctuation
intensity (zero spatial moment of the correlator) obeys a power-logarithmic
stretched exponential decay law, the exponent and preexponent being dependent
on the scattering angle. Spatial center of gravity and dispersion of the
correlator (normalized first and second spatial moments, respectively) prove to
weakly diverge as time tends to infinity. A spin analogy of this problem is
discussed.
","[{""version"":""v1"",""created"":""Fri, 13 Dec 1996 17:26:38 GMT""}]","2013-07-16"
"cond-mat/9612131","Holger J. Kaufmann","O. V. Dolgov, H. J. Kaufmann, E. K. H. Salje, and Y. Yagil","Evidence for strong electron-phonon coupling and polarons in the optical
  response of La_{2-x}Sr_xCuO_4","22 pages, REVTeX, 12 figures in ps-file",,"10.1016/S0921-4534(97)00149-4",,"cond-mat.supr-con",,"  The normal state optical response of La_{2-x}Sr_xCuO_4 is found to be
consistent with a simple multi-component model, based on free carriers with
strong electron-phonon interaction, localized polaronic states near 0.15 eV and
a mid-infrared band at 0.5 eV. Normal state reflectance and absorbance of
La_{1.83}Sr_{0.17}CuO_4 are investigated and their temperature dependence is
explained. Both, the ac and dc response are recovered and the quasi-linear
behavior of the optical scattering rate up to 3000- 4000 cm^{-1} is found to be
consistent with strong electron-phonon interaction, which also accounts for the
value of T_c. Although not strictly applicable in the superconducting state,
our simple model accounts for the observed penetration depth and the optical
response below T_c can be recovered by introducing a small amount of additional
carriers. Our findings suggest that the optical response of La_{2-x}Sr_xCuO_4
could be explained both, in the normal and superconducting state, by a simple
multi-fluid model with strong electron-phonon interaction if the gap symmetry
and the temperature dependence of the 0.5 eV mid-infrared band are adequately
taken into account.
","[{""version"":""v1"",""created"":""Fri, 13 Dec 1996 17:56:14 GMT""}]","2016-08-31"
"cond-mat/9612132","Dan Duffy","Daniel Duffy and Adriana Moreo","Specific Heat of the 2D Hubbard Model","6 pages, RevTex, 11 figures embedded in the text, Submitted to Phys.
  Rev. B",,"10.1103/PhysRevB.55.12918",,"cond-mat.str-el",,"  Quantum Monte Carlo results for the specific heat c of the two dimensional
Hubbard model are presented. At half-filling it was observed that $c \sim T^2$
at very low temperatures. Two distinct features were also identified: a low
temperature peak related to the spin degrees of freedom and a higher
temperature broad peak related to the charge degrees of freedom. Away from
half-filling the spin induced feature slowly disappears as a function of hole
doping while the charge feature moves to lower temperature. A comparison with
experimental results for the high temperature cuprates is discussed.
","[{""version"":""v1"",""created"":""Fri, 13 Dec 1996 19:20:33 GMT""},{""version"":""v2"",""created"":""Mon, 16 Dec 1996 02:51:44 GMT""}]","2009-10-28"
"cond-mat/9612133","Paul Crowell","P. A. Crowell, F. W. Van Keuls and J. D. Reppy (Cornell University)","Onset of Superfluidity in 4He Films Adsorbed on Disordered Substrates","15 pages (RevTex), 21 figures (postscript)",,"10.1103/PhysRevB.55.12620","MSC Report No. 8151","cond-mat.supr-con",,"  We have studied 4He films adsorbed in two porous glasses, aerogel and Vycor,
using high precision torsional oscillator and DC calorimetry techniques. Our
investigation focused on the onset of superfluidity at low temperatures as the
4He coverage is increased. Torsional oscillator measurements of the 4He-aerogel
system were used to determine the superfluid density of films with transition
temperatures as low as 20 mK. Heat capacity measurements of the 4He-Vycor
system probed the excitation spectrum of both non-superfluid and superfluid
films for temperatures down to 10 mK. Both sets of measurements suggest that
the critical coverage for the onset of superfluidity corresponds to a mobility
edge in the chemical potential, so that the onset transition is the bosonic
analog of a superconductor-insulator transition. The superfluid density
measurements, however, are not in agreement with the scaling theory of an onset
transition from a gapless, Bose glass phase to a superfluid. The heat capacity
measurements show that the non-superfluid phase is better characterized as an
insulator with a gap.
","[{""version"":""v1"",""created"":""Sat, 14 Dec 1996 09:29:03 GMT""}]","2009-10-28"
"cond-mat/9612134","Takano Hiroshi","Hiroshi Takano, Masaru Onoda, Ikuo Ichinose, Tetsuo Matsui","Instability of the Non-Fermi-Liquid Fixed Point in the Dissipative Gauge
  Theory of Fermions (I)Impurity Effects","33 Pages, Latex, 3 ps-figures included",,,,"cond-mat.str-el hep-th",,"  We study a dissipative gauge theory of nonrelativistic fermions in 2+1
dimensions at zero temperature by the Wilsonian renormalization-group method.
In this theory, we incorporate in the fermion propagator a new term of the form
$ i \kappa \cdot\sign(\omega)$ (where $\kappa$ is a parameter and $\omega$ is
the fermion frequency), which is usually induced by impurity effects. In the
previous papers, we studied this system for $\kappa = 0$, and showed that there
exists a non-Fermi-liquid infrared fixed point. In this paper, we address the
question whether this non-Fermi-liquid behavior remains stable or not in the
presence of impurity effects, i.e., the $\kappa$ term. Our results show that
the non-Fermi-liquid fixed point is unstable for $\kappa \neq 0$ and an
effective gauge coupling constant tends to vanish at low energies. However, in
intermediate energy scales, the behavior of correlation functions for $\kappa
\neq 0$ is controlled by the non-Fermi-liquid fixed point at $\kappa=0$, i.e.,
a crossover phenomenon appears. Physical implications of this phenomenon are
discussed.
","[{""version"":""v1"",""created"":""Sat, 14 Dec 1996 13:54:43 GMT""}]","2008-02-03"
"cond-mat/9612135","Uwe Gunsenheimer Nb6","Uwe Gunsenheimer (Fakultaet fuer Physik und Astronomie, Lehrstuhl fuer
  theoretische Festkoerperphysik, Ruhr-Universitiaet Bochum, Germany), and A.D.
  Zaikin (Institut fuer Theoretische Festkoerperphysik, Universitaet Karlsruhe,
  Germany, I.E. Tamm Department of Theoretical Physics, P.N. Lebedev Physics
  Institute, Moscow)","Ballistic Transport in Superconducting Weak Links in a Microwave Field","4 pages, RevTeX, 3 figures as eps-files",,,,"cond-mat.supr-con",,"  Nonequilibrium effects and their impact on a charge transport in
superconducting ballistic weak links biased by an ac voltage are investigated
within the framework of the Keldysh technique. We demonstrate that the
microwave field destroys the phase coherence during the multiple Andreev
reflection cycle and leads to the effective cooling of subgap quasiparticles
accelerated due to multiple Andreev reflection. For small bias voltages this
effect results in a strong supression of both the excess current and the
conductance of the weak link. In the opposite limit of large bias voltages the
excess current remains unaffected. We also demonstrate that a simple Boltzmann
kinetic approach becomes inadequate if an ac voltage bias is applied to the
weak link.
","[{""version"":""v1"",""created"":""Sat, 14 Dec 1996 14:52:48 GMT""}]","2008-02-03"
"cond-mat/9612136",,"T. Aste, K. Y. Szeto and W. Y. Tam","Statistical properties and shell analysis in random cellular structures","23 Pages Postscript, 4 figures",,"10.1103/PhysRevE.54.5482",,"cond-mat.dis-nn",,"  We investigate the statistical properties of two dimensional random cellular
systems (froths) in term of their shell structure. The froth is analyzed as a
system of concentric layers of cells around a given central cell. We derive
exact analytical relations for the topological properties of the sets of cells
belonging to these layers. Experimental observations of the shell structure of
two-dimensional soap froth are made and compared with the results on two kinds
of Voronoi constructions. It is found that there are specific differences
between soap froths and purely geometrical constructions. In particular these
systems differ in the topological charge of clusters as a function of shell
number, in the asymptotic values of defect concentrations, and in the number of
cells in a given layer. We derive approximate expressions with no free
parameters which correctly explain these different behaviors.
","[{""version"":""v1"",""created"":""Sat, 14 Dec 1996 15:14:49 GMT""}]","2009-10-28"
"gr-qc/9612035","Carlo Rovelli","Michael P Reisenberger, Carlo Rovelli","``Sum over Surfaces'' form of Loop Quantum Gravity","Seriously revised version. LaTeX, with revtex and epsfig","Phys.Rev.D56:3490-3508,1997","10.1103/PhysRevD.56.3490",,"gr-qc hep-th math.QA q-alg",,"  We derive a spacetime formulation of quantum general relativity from
(hamiltonian) loop quantum gravity. In particular, we study the quantum
propagator that evolves the 3-geometry in proper time. We show that the
perturbation expansion of this operator is finite and computable order by
order. By giving a graphical representation a' la Feynman of this expansion, we
find that the theory can be expressed as a sum over topologically inequivalent
(branched, colored) 2d surfaces in 4d. The contribution of one surface to the
sum is given by the product of one factor per branching point of the surface.
Therefore branching points play the role of elementary vertices of the theory.
Their value is determined by the matrix elements of the hamiltonian constraint,
which are known. The formulation we obtain can be viewed as a continuum version
of Reisenberger's simplicial quantum gravity. Also, it has the same structure
as the Ooguri-Crane-Yetter 4d topological field theory, with a few key
differences that illuminate the relation between quantum gravity and TQFT.
Finally, we suggests that certain new terms should be added to the hamiltonian
constraint in order to implement a ``crossing'' symmetry related to 4d
diffeomorphism invariance.
","[{""version"":""v1"",""created"":""Fri, 13 Dec 1996 23:25:40 GMT""},{""version"":""v2"",""created"":""Thu, 22 May 1997 08:14:11 GMT""},{""version"":""v3"",""created"":""Sat, 24 May 1997 12:56:37 GMT""}]","2014-11-17"
"hep-lat/9612010","Akira Ukawa","S. Aoki, T. Kaneda, A. Ukawa, T. Umemura (University of Tsukuba)","Finite-Temperature Phase Structure of Lattice QCD with the Wilson Quark
  Action for Two and Four Flavors","Poster presented at LATTICE96(finite temperature); 4 pages, Latex,
  uses espcrc2 and epsf, seven ps figures included","Nucl.Phys.Proc.Suppl. 53 (1997) 438-441","10.1016/S0920-5632(96)00682-2",,"hep-lat",,"  We present further analyses of the finite-temperature phase structure of
lattice QCD with the Wilson quark action based on spontaneous breakdown of
parity-flavor symmetry. Results are reported on (i) an explicit demonstration
of spontaneous breakdown of parity-flavor symmetry beyond the critical line,
(ii) phase structure and order of chiral transition for the case of $N_f=4$
flavors, and (iii) approach toward the continuum limit.
","[{""version"":""v1"",""created"":""Sat, 14 Dec 1996 02:32:02 GMT""}]","2009-10-28"
"hep-lat/9612011","Akira Ukawa","A. Ukawa (University of Tsukuba)","Finite-Temperature QCD on the Lattice","Review presented at LATTICE96(finite temperature); 14 pages, Latex,
  uses espcrc2 and epsf, seven ps figures included","Nucl.Phys.Proc.Suppl. 53 (1997) 106-119","10.1016/S0920-5632(96)00604-4","UTHEP-355","hep-lat",,"  Recent developments in finite-temperature studies of lattice QCD are
reviewed. Topics include (i) tests of improved actions for the pure gauge
system, (ii) scaling study of the two-flavor chiral transition and restoration
of $U_A(1)$ symmetry with the Kogut-Susskind quark action, (iii) present
understanding of the finite-temperature phase structure for the Wilson quark
action. New results for finite-density QCD are briefly discussed.
","[{""version"":""v1"",""created"":""Sat, 14 Dec 1996 04:33:27 GMT""}]","2009-10-28"
