"hep-ph/9612350","Luis Bettencourt","Luis M. A. Bettencourt, Pablo Laguna, Richard A. Matzner","Non-intercommuting Cosmic Strings","Reference to URL with Animations corrected. To appear in Physical
  Review Letters. 4 pages, 2 figures, RevTeX, available through anonymous ftp
  from ftp://euclid.tp.ph.ic.ac.uk/papers or on WWW at
  http://euclid.tp.ph.ic.ac.uk/Papers","Phys.Rev.Lett. 78 (1997) 2066-2069","10.1103/PhysRevLett.78.2066","IMPERIAL/TP/95-96/64,HD-THEP-96-49,CGPG-96/12-2","hep-ph astro-ph gr-qc",,"  We perform the numerical field evolution for the collision of two Abelian
type I cosmic strings. We present evidence that, for collisions at small but
characteristic relative velocities and angles, these cosmic strings do not
exchange ends and separate. Rather, local higher winding number bound states
are formed close to the collision point, which promote multiple local
scatterings at right angles and prevent intercommutation from happening. This
constitutes the simplest example of the breakdown of the intercommutation rule,
usually assumed in the construction of effective models for cosmic string
network evolution.
","[{""version"":""v1"",""created"":""Fri, 13 Dec 1996 17:39:28 GMT""},{""version"":""v2"",""created"":""Thu, 13 Feb 1997 12:54:18 GMT""},{""version"":""v3"",""created"":""Mon, 17 Feb 1997 10:59:17 GMT""}]","2009-10-30"
"hep-ph/9612354","Glennys Farrar","Glennys R. Farrar (Rutgers Univ.)","Determining the Gluonic Content of Isoscalar Mesons","Invited talk ICHEP96, Warsaw, Poland, July 29, 1996 based on work
  done in collaboration with M. B. Cakir, F. E. Close and Z. P. Li",,,"RU-96-92","hep-ph",,"  The gluonic widths of four leading glueball candidates are determined from
their production in radiative quarkonium decays, allowing quantitative
estimation of their glue content. Lattice predictions for the scalar and tensor
channels seem to be in reasonable agareement with present data (allowing for
mixing with $q \bar{q}$ states). However there is a glueball-like-state in the
pseudoscalar spectrum whose mass is considerably lower than expected from
lattice estimates.
","[{""version"":""v1"",""created"":""Fri, 13 Dec 1996 18:25:23 GMT""}]","2007-05-23"
"hep-ph/9612355","Glennys Farrar","Glennys R. Farrar (Rutgers Univ.)","Phenomenology of ``inos'' in the Light Gaugino Scenario and Possible
  Evidence for a $\sim 53$ GeV Chargino","Invited talk at ICHEP96, Warsaw, July, 1996. Based on contributed
  paper pa11-048 and RU-96-71 (hep-ph/9608387)",,,"RU-96-93","hep-ph",,"  The tree-level-massless gaugino scenario predicts that the lighter chargino
mass is less than m_W and that gluino and lightest neutralino masses are $\lsi
1$ GeV. In this case the dominant decay mode of charginos and non-LSP
neutralinos is generically to three jets. The excess of ""4j"" events with total
invariant mass $\sim 105$ GeV observed in LEP running at 130-136 GeV is noted
to be consistent with pair production of $\sim 53$ GeV charginos. Data at 161
and 172 GeV from Fall, 1996, cannot conclusively test this hypothesis (because
cuts to eliminate $W^+W^-$ background reduce the efficiency significantly) but
is suggestive that the signal persists.
","[{""version"":""v1"",""created"":""Fri, 13 Dec 1996 18:25:56 GMT""}]","2007-05-23"
"hep-ph/9612356","Jon Pumplin","Jon Pumplin (Michigan State University)","Diffractive Photoproduction of Z0","14 pages (REVTeX) + 1 Figure (epsf)",,,"MSUHEP/61222","hep-ph",,"  The two gluon exchange model of the pomeron is used to compute the
photoproduction reaction $\gamma p \to Z^0 p$. The predicted cross section is
too small to be observed at HERA, but may be detectable at an eventual Next
Linear Collider.
","[{""version"":""v1"",""created"":""Fri, 13 Dec 1996 18:35:42 GMT""}]","2007-05-23"
"hep-ph/9612357","F. Simkovic","Amand Faessler, Sergey Kovalenko, Fedor Simkovic, and Joerg Schwieger","Dominance of Pion-exchange in R-parity Violating Supersymmetry
  Contributions to Neutrinoless Double Beta Decay","6 pages, RevTex, 2 Postscript figures, to appear in Phys. Rev. Lett","Phys.Rev.Lett. 78 (1997) 183-186","10.1103/PhysRevLett.78.183",,"hep-ph nucl-th",,"  We present a new contribution of the R-parity violating supersymmetry (SUSY)
to neutrinoless double beta decay via the pion exchange between decaying
neutrons. The pion coupling to the final state electrons is induced by the
R-parity violating SUSY interactions. We have found this pion-exchange
mechanism to dominate over the conventional two-nucleon one. The latter
corresponds to direct interaction between quarks from two decaying neutrons
without any light hadronic mediator like pion. The constraints on the certain
R-parity violating SUSY parameters are extracted from the current experimental
neutrinoless double beta decay half-life limit. These constraints are
significantly stronger than those previously known or expected from the ongoing
accelerator experiments.
","[{""version"":""v1"",""created"":""Fri, 13 Dec 1996 19:50:51 GMT""}]","2009-10-30"
"hep-ph/9612358","Masayasu Harada","Masayasu Harada (Syracuse U.), Akihiro Shibata (KEK,Japan)","The Pion Decay Constants and the Rho-Meson Mass at Finite Temperature in
  the Hidden Local Symmetry","We added a comment on the correction to the rho-meson mass from the
  omega-pi loop. This is the final version to be published in Phys. Rev. D. 19
  pages (LaTeX-RevTeX), 7 PostScript figures","Phys.Rev.D55:6716-6724,1997","10.1103/PhysRevD.55.6716","SU-4240-652 & KEK preprint 96-150","hep-ph nucl-th",,"  We study the temperature dependence of the pion decay constant and rho-meson
mass in the hidden local symmetry model at one loop. Using the standard
imaginary time formalism, we include the thermal effect of rho meson as well as
that of pion. We show that the pion gives a dominant contribution to the pion
decay constant and rho-meson contribution slightly decreases the critical
temperature. The rho-meson pole mass increases as T^4/m_\rho^2 at low
temperature dominated by the pion-loop effect. At high temperature, although
the pion-loop effect decreases the rho-meson mass, the rho-loop contribution
overcomes the pion-loop contribution and rho-meson mass increases with
temperature. We also show that the conventional parameter a is stable as the
temperature increases.
","[{""version"":""v1"",""created"":""Fri, 13 Dec 1996 20:04:06 GMT""},{""version"":""v2"",""created"":""Tue, 18 Mar 1997 00:39:32 GMT""}]","2009-12-30"
"hep-ph/9612360","Fred Hawes","Frederick T. Hawes (SCRI/Florida State University), Tom Sizer
  (University of Adelaide, Australia), and Anthony G. Williams (University of
  Adelaide, Australia)","Subtractive Renormalization of Strong-Coupling Quenched QED in Four
  Dimensions","7 pages including 4 .eps files comprising 3 figures; uses sprocl.sty.
  To appear in the proceedings of the International Workshop on Perspectives of
  Strong Coupling Gauge Theories, Nagoya, Japan, 13--16 November, 1996",,,"ADP-96-45/T239, FSU-SCRI-96-135","hep-ph hep-th",,"  We study renormalized quenched strong-coupling QED in four dimensions in
arbitrary covariant gauge, in the Dyson-Schwinger equation formalism. Above the
chiral critical coupling, we show that there is no finite chiral limit. This
behaviour is found to be independent of the detailed choice of proper vertex,
provided that the vertex is consistent with the Ward-Takahashi identity and
multiplicative renormalizability. The finite solutions previously reported lie
in an unphysical regime of the theory with multiple solutions and oscillating
mass functions. This study is consistent with the assertion that strong
coupling QED$_4$ does not have a continuum limit in the conventional sense.
","[{""version"":""v1"",""created"":""Fri, 13 Dec 1996 22:32:28 GMT""}]","2007-05-23"
"hep-th/9612153","Martin Cederwall","Martin Cederwall","Aspects of D-brane actions","9 pages, latex2e, needs espcrc2.sty. Contribution to the proceedings
  of the 30th Int. Symposium Ahrenshoop on the theory of elementary particles,
  Buckow, Germany, August 27-31, 1996","Nucl.Phys.Proc.Suppl. 56B (1997) 61-69","10.1016/S0920-5632(97)00310-1","Goteborg-ITP-96-20","hep-th",,"  A couple of issues concerning the effective dynamics of D-branes in string
theory are discussed. Primarily, I am concerned with linearization of the
actions by introduction of non-propagating fields and a full super- and
kappa-symmetric description of D-branes.
","[{""version"":""v1"",""created"":""Sat, 14 Dec 1996 11:39:35 GMT""}]","2009-10-30"
"hep-th/9612156",,"A. A. Andrianov (Sankt-Petersburg State University) and R.Soldati
  (Universita di Bologna and INFN, Sezione di Bologna)","Dynamical Lorentz Symmetry Breaking from 3 + 1 Renormalizable Model with
  Wess-Zumino Interaction","7 pages, LaTeX, Talk at XI QFTHEP Workshop, 1996, St.-Petersburg",,,,"hep-th",,"  We study the renormalizable abelian vector-field models in the presence of
the Wess-Zumino interaction with the pseudoscalar matter. The renormalizability
is achieved by supplementing the standard kinetic term of vector fields with
higher derivatives. The appearance of fourth power of momentum in the
vector-field propagator leads to the super-renormalizable theory in which the
beta-function, the vector-field renormalization constant and the anomalous mass
dimension are calculated exactly. It is shown that this model has the infrared
stable fixed point and its low-energy limit is non-trivial. The modified
effective potential for the pseudoscalar matter leads to the occurrence of the
quantum dynamical breaking of Lorentz symmetry.
","[{""version"":""v1"",""created"":""Fri, 13 Dec 1996 20:45:43 GMT""}]","2007-05-23"
"hep-th/9612157","Nathan Seiberg","Tom Banks, Nathan Seiberg and Stephen Shenker","Branes from Matrices","17 pages. A number of new conceptual issues added. Some misprints
  corrected","Nucl.Phys.B490:91-106,1997","10.1016/S0550-3213(97)00105-3","RU-96-117","hep-th",,"  Various aspects of branes in the recently proposed matrix model for M theory
are discussed. A careful analysis of the supersymmetry algebra of the matrix
model uncovers some central charges which can be activated only in the large
$N$ limit. We identify the states with non-zero charges as branes of different
dimensions.
","[{""version"":""v1"",""created"":""Fri, 13 Dec 1996 20:00:25 GMT""},{""version"":""v2"",""created"":""Wed, 15 Jan 1997 18:53:10 GMT""}]","2009-09-15"
"hep-th/9612158","Martin Reuter","M. Reuter","Weyl-Invariant Quantization of Liouville Field Theory","11 pages, latex",,,,"hep-th",,"  Liouville field theory is quantized by means of a Wilsonian effective action
and its associated exact renormalization group equation. For $c<1$, an
approximate solution of this equation is obtained by truncating the space of
all action functionals. The Ward identities resulting from the Weyl invariance
of the theory are used in order to select a specific universality class for the
renormalization group trajectory. It is found to connect two conformal field
theories with central charges $25-c$ and $26-c$, respectively.
","[{""version"":""v1"",""created"":""Sat, 14 Dec 1996 09:50:31 GMT""}]","2007-05-23"
"hep-th/9612161","Mohammad Reza Rahimi Tabar","A. R. Rastegar, M. R. Rahimi Tabar, P. Hawaii","Turbulence With Pressure","13 pages ,latex , no figures",,,,"hep-th",,"  We investigate the exact results of the Navier-Stokes equations using the
methods developed by Polyakov. It is shown that when the velocity field and the
density are not independent, the Burgers equation is obtained leading to exact
N-point generating functions of velocity field. Our results show that, the
operator product expansion has to be generalized both in the absence and the
presence of pressure. We find a method to determine the extra terms in the
operator product expansion and derive its coefficients and find the first
correction to probablity distribuation function. In the general case and for
small pressure, we solve the problem perturbatively and find the probablity
distribuation function for the Navier-Stokes equation in the mean field
approximation.
","[{""version"":""v1"",""created"":""Sat, 14 Dec 1996 15:19:41 GMT""},{""version"":""v2"",""created"":""Wed, 18 Dec 1996 22:05:07 GMT""}]","2008-02-03"
"nucl-th/9612033","Sourav Sarkar","Sourav Sarkar, Pradip Roy, Jane Alam, Sibaji Raha and Bikash Sinha","Dissipative Effects in Photon Diagnostics of Quark Gluon Plasma","Plain latex file","J.Phys.G23:469-477,1997","10.1088/0954-3899/23/4/007","VECC-NTH-96017","nucl-th",,"  The effects of dissipation on the space time evolution of matter formed in
ultra-relativistic heavy ion collision is discussed. The thermal photon spectra
for RHIC and LHC energies with viscous flow is considered. The effects of
viscosity in the thermal single photon spectra is seen to be important in QGP
phase as compared to the hadronic phase. Recently available data from WA80
group at SPS energies for $S+Au$ collision are compared with theoretical
calculations. The experimental data do not appear to be compatible with the
formation of matter in the pure hadronic phase.
","[{""version"":""v1"",""created"":""Fri, 13 Dec 1996 23:07:39 GMT""}]","2008-11-26"
"nucl-th/9612034","Jorge G. Hirsch","Jorge G. Hirsch, Peter O. Hess and Osvaldo Civitarese","Single- and double-beta decay Fermi-transitions in an exactly solvable
  model","29 pages, 9 figures included in a Postsript file. Submitted to
  Physcal Review c","Phys.Rev.C56:199-211,1997","10.1103/PhysRevC.56.199",,"nucl-th",,"  An exactly solvable model suitable for the description of single and
double-beta decay processes of the Fermi-type is introduced. The model is
equivalent to the exact shell-model treatment of protons and neutrons in a
single j-shell. Exact eigenvalues and eigenvectors are compared to those
corresponding to the hamiltonian in the quasiparticle basis (qp) and with the
results of both the standard quasiparticle random phase approximation (QRPA)
and the renormalized one (RQRPA). The role of the scattering term of the
quasiparticle hamiltonian is analyzed. The presence of an exact eigenstate with
zero energy is shown to be related to the collapse of the QRPA. The RQRPA and
the qp solutions do not include this zero-energy eigenvalue in their spectra,
probably due to spurious correlations. The meaning of this result in terms of
symmetries is presented.
","[{""version"":""v1"",""created"":""Fri, 13 Dec 1996 21:41:03 GMT""}]","2008-11-26"
"nucl-th/9612035","Nimai C. Mukhopadhyay","Nimai C. Mukhopadhyay (1 and 2) and K. Junker (2) ((1) RPI, (2) PSI)","A Precise Determination of the Pion-Nuclear Coupling Parameter from Weak
  Processes in ^3He","to be published in Phys. Rev. Lett","Phys.Rev.Lett. 77 (1996) 5342-5345","10.1103/PhysRevLett.77.5342","RPI-96-N111","nucl-th",,"  We utilize precise weak interaction experiments on atomic muon capture and
beta decay in the A = 3 nuclei, and take into account the effects of nuclear
""anomalous thresholds"" to extract the pseudoscalar pi-^3He-^3H coupling
parameter, G^{eff}(m_\pi^2) = 45.8+- 2.4. This is an order of magnitude
improvement in precision over that from the use of pion-nuclear scattering data
and dispersion relations.
","[{""version"":""v1"",""created"":""Fri, 13 Dec 1996 22:20:45 GMT""}]","2009-10-30"
"nucl-th/9612036","F. Simkovic","G. Pantis, F. Simkovic, J.D. Vergados, and Amand Faessler","Neutrinoless Double Beta Decay within QRPA with Proton-Neutron Pairing","16 RevTex pages","Phys.Rev.C53:695-707,1996","10.1103/PhysRevC.53.695",,"nucl-th",,"  We have investigated the role of proton-neutron pairing in the context of the
Quasiparticle Random Phase approximation formalism. This way the neutrinoless
double beta decay matrix elements of the experimentally interesting A= 48, 76,
82, 96, 100, 116, 128, 130 and 136 systems have been calculated. We have found
that the inclusion of proton-neutron pairing influences the neutrinoless double
beta decay rates significantly, in all cases allowing for larger values of the
expectation value of light neutrino masses. Using the best presently available
experimental limits on the half life-time of neutrinoless double beta decay we
have extracted the limits on lepton number violating parameters.
","[{""version"":""v1"",""created"":""Sat, 14 Dec 1996 10:19:12 GMT""}]","2008-11-26"
"nucl-th/9612037","F. Simkovic","F. Simkovic, J. Schwieger, M. Veselsky, G. Pantis, and Amand Faessler","Non-collapsing renormalized QRPA with proton-neutron pairing for
  neutrinoless double beta decay","15 pages, RevTex, 2 Postscript figures, to appear in Phys. Lett. B","Phys.Lett. B393 (1997) 267-273","10.1016/S0370-2693(96)01622-X",,"nucl-th",,"  Using the renormalized quasiparticle random phase approximation (RQRPA), we
calculate the light neutrino mass mediated mode of neutrinoless double beta
decay of Ge76, Mo100, Te128 and Te130. Our results indicate that the simple
quasiboson approximation is not good enough to study the neutrinoless double
beta decay, because its solutions collapse for physical values of g_pp. We find
that extension of the Hilbert space and inclusion of the Pauli Principle in the
QRPA with proton-neutron pairing, allows us to extend our calculations beyond
the point of collapse, for physical values of the nuclear force strength. As a
consequence one might be able to extract more accurate values on the effective
neutrino mass by using the best available experimental limits on the half-life
of neutrinoless double beta decay.
","[{""version"":""v1"",""created"":""Sat, 14 Dec 1996 12:16:00 GMT""}]","2009-10-30"
"q-alg/9612019","Marco Tarlini","F. Bonechi, R. Giachetti, R. Maciocco, E. Sorace and M.Tarlini","Cohomological Properties of Differential Calculi on Hopf Algebras","Universita' e I.N.F.N di Firenze, Italy. Latex2e, needs heron2e.sty
  (included). Proocedings of the Symposium on Quantum Groups of the
  International Colloquium GROUP21, Goslar 1996",,,,"q-alg math.QA",,"  In this report we give an intrinsic treatment of the results we developed in
a previous work connecting the differential calculi on Hopf algebras to the
Drinfeld double. In the first place we recover that bicovariant bimodules are
in one to one correspondence with the Drinfeld double representations; we then
introduce a Hochschild cohomology of the algebra of functions and discuss the
main result stating that each differential calculus is associated to a
1-cocycle satisfying an additional invariance condition with respect to a
natural action. Defining a Hochschild cohomology of the double, the above
invariance becomes a condition with respect to the enveloping algebra component
of the double that must be added to the 1-cocycle relation.
","[{""version"":""v1"",""created"":""Sat, 14 Dec 1996 10:52:52 GMT""}]","2008-02-03"
