"astro-ph/9612153","Yu Gao","Yu Gao, Robert A. Gruendl, K.Y. Lo (Lab. for Astronomical Imaging,
  Univ. of Illinois), C.Y. Hwang (ASIAA, Taiwan), and S. Veilleux (U. of
  Maryland)","Pre-Starbursts in Luminous IR Galaxies ?","4 pages including one postscript figure. Contribution to the
  Conference proceedings of the 7th Annual Astrophysics Conference in Maryland,
  STAR FORMATION, NEAR AND FAR, eds. Stephen S. Holt and Lee G. Mundy",,"10.1063/1.52748",,"astro-ph",,"  We present first results of our on-going BIMA Key Project: imaging the
CO(1-0) emission from a sample of 10 luminous IR galaxies (LIRGs) that are at
various merging stages, with special emphasis on systems apparently in the
early/intermediate stages of merging. We present here CO images with $\sim 5''$
resolution. An important result is the recognition of a plausible pre-starburst
phase in some early LIRG mergers (e.g., Arp 302 and NGC 6670). Our initial
analysis suggests that a merger-induced starburst phase may not begin before
the nuclear separation between the merging galaxies reaches roughly 10 kpc. The
surface gas density seems to increase from a few times $10^2 \Msun pc^{-2} to
>10^3 \Msun pc^{-2}$ while the prominent CO extent systematically decreases as
merging progresses.
","[{""version"":""v1"",""created"":""Mon, 16 Dec 1996 17:53:02 GMT""}]","2009-10-28"
"astro-ph/9612154","Ulrich Kolb","A. R. King and U. Kolb (University of Leicester, U.K.)","The Formation of Low-Mass Transient X-Ray Binaries","Accepted for publication in ApJ, 19 pages, 4 figures",,"10.1086/304083",,"astro-ph",,"  We consider constraints on the formation of low-mass X-ray binaries
containing neutron stars (NLMXBs) arising from the presence of soft X-ray
transients among these systems. We show that in short-period systems driven by
angular momentum loss these constraints require the secondary at the beginning
of mass transfer to have a mass > 1.2 M_sun, and to be significantly
nuclear-evolved. As a consequence a comparatively large fraction of such
systems appear as soft X-ray transients even at short periods, as observed.
Moreover the large initial secondary masses account for the rarity of NLMXBs at
periods less than 3 hr. In contrast, NLMXB populations forming with large kick
velocities would not have these properties, suggesting that the kick velocity
is generally small compared to the pre-SN orbital velocity in a large fraction
of systems. We derive constraints on progenitor system parameters and on the
strength of magnetic braking.
","[{""version"":""v1"",""created"":""Mon, 16 Dec 1996 17:57:59 GMT""}]","2009-10-28"
"astro-ph/9612155","Ed Brown","Lars Bildsten, Edward F. Brown, Christopher D. Matzner, and Greg
  Ushomirsky (University of California at Berkeley)","Lithium Depletion in Fully Convective Pre-Main Sequence Stars","13 pages, LaTex with 2 postscript figures, uses aaspp4.sty and
  epsfig.sty, to appear in the Astrophysical Journal",,"10.1086/304151",,"astro-ph",,"  We present an analytic calculation of the thermonuclear depletion of lithium
in contracting, fully convective, pre-main sequence stars of mass M < 0.5
M_sun. Previous numerical work relies on still-uncertain physics (atmospheric
opacities and convection, in particular) to calculate the effective temperature
as a unique function of stellar mass. We assume that the star's effective
temperature, T_eff, is fixed during Hayashi contraction and allow its actual
value to be a free parameter constrained by observation. Using this
approximation, we compute lithium burning analytically and explore the
dependence of lithium depletion on T_eff, M, and composition. Our calculations
yield the radius, age, and luminosity of a pre-main sequence star as a function
of lithium depletion. This allows for more direct comparisons to observations
of lithium depleted stars. Our results agree with those numerical calculations
that explicitly determine stellar structure during Hayashi contraction. In
agreement with Basri, Marcy, and Graham (1996), we show that the absence of
lithium in the Pleiades star HHJ 3 implies that it is older than 100 Myr. We
also suggest a generalized method for dating galactic clusters younger than 100
Myr (i.e., those with contracting stars of M > 0.08 M_sun) and for constraining
the masses of lithium depleted stars.
","[{""version"":""v1"",""created"":""Mon, 16 Dec 1996 19:21:02 GMT""}]","2009-10-28"
"astro-ph/9612156","Rachel Somerville","Rachel S. Somerville and Joel R. Primack (UC Santa Cruz)","Favored Variants of Cold Dark Matter Cosmologies","10 pages, 3 figures, Latex, uses psfig, to appear in the proceedings
  of ``Identification of Dark Matter'', University of Sheffield, UK (World
  Scientific, 1996)",,,,"astro-ph",,"  We discuss variants of Cold Dark Matter (CDM) dominated cosmological models
that give good agreement with a range of observations. We consider models with
hot dark matter, tilt, $\Omega < 1$, or a cosmological constant. We also
discuss the sensitivity of the results to other parameters, such as the Hubble
parameter and the baryon fraction. We obtain constraints by combining the COBE
data, cluster abundances, abundance of damped Lyman-$\alpha$ systems at
$z\sim3$, the small-angle Cosmic Microwave Background anisotropy, and the
small-scale non-linear power spectrum. We present non-linear power spectra from
a new suite of N-body simulations for the ``best-bet'' models from each
category.
","[{""version"":""v1"",""created"":""Mon, 16 Dec 1996 20:12:49 GMT""}]","2007-05-23"
"astro-ph/9612157","Piero Madau","Piero Madau","Cosmic Star Formation History","10 pages, 3 figures, LaTeX with AIP ""aipproc"" style file. Review
  Presented at the 1996 7th Annual October Astrophysics Conference in Maryland,
  ``Star Formation Near and Far''",,"10.1063/1.52821",,"astro-ph",,"  I review some recent progress made in our understanding of galaxy evolution
and the cosmic history of star formation. Like bookends, the results obtained
from deep ground-based spectroscopy and from the Hubble Deep Field imaging
survey put brackets around the intermediate redshift interval, $1<z<2$, where
starbirth probably peaked at a rate 10 times higher than today. The steady
decline observed since $z\sim 1$ is largely associated with late-type galaxies.
At $z\gtrsim 2.5$, the Lyman-break selected objects may represent the
precursors of present-day spheroids, but appear, on average, quite
underluminous relative to the expectations of the standard early-and-rapidly
forming picture for spheroidal systems. The observed ultraviolet light density
accounts for the bulk of the metals seen today in ``normal'' massive galaxies.
","[{""version"":""v1"",""created"":""Tue, 17 Dec 1996 00:58:57 GMT""}]","2009-10-28"
"astro-ph/9612158","Paolo Molaro","Luca Pasquini and Paolo Molaro","Lithium observations in 47 Tuc","latex file, l-aa.sty, 3 ps figures, accepted by A&A","Astron.Astrophys.322:109,1997",,,"astro-ph",,"  We present high resolution observations (FWHM=15 km/sec) of the Li region in
5 stars belonging to the old (14 Gyrs), metal rich ([Fe/H]=-0.7) globular
cluster 47Tuc. At the ESO NTT telescope we obtained EMMI spectra for three V
about 17.4 magnitude stars located at the turnoff with Teff on the Spite
plateau. In two of the turnoff stars the lithium line is clearly detected and
the mean lithium content [Li] = 2.37$+/- 0.08 +/- 0.07 is derived. This value
is slightly higher than the Spite plateau at [Li]=2.19 +/- 0.016 for field halo
stars obtained with the same Teff scale by Bonifacio and Molaro (1996). For the
third turnoff star only an upper limit could be derived: [Li] < 2.19. This
upper limit may suggest the presence of some dispersion on the plateau stars of
47Tuc as it is observed in field stars of similar metallicity. When compared
with field dwarfs of [Fe/H] about -0.7 the Li content of 47Tuc turnoff stars is
among the highest observed. Considering the extreme age of 47Tuc this suggests
that no significant depletion affected these stars and it implies a mild Li
Galactic enrichment between the epoch of Pop II formation and the formation of
47Tuc stars with metallicities up to about -0.7. Spallation reactions, as
deduced from Be observations, can account for such an increase. The remaining
two stars are evolved, and only upper limits could be placed at [Li]<0.7 and
<-0.7. These very low values imply some extra depletion mechanism in addition
to dilution as it is observed in evolved field stars by Pilachowki et al (1993)
and in NGC6397 by Pasquini and Molaro (1996).
","[{""version"":""v1"",""created"":""Tue, 17 Dec 1996 10:23:27 GMT""}]","2011-05-23"
"astro-ph/9612159","Dan Maoz","Dan Maoz, Hans-Walter Rix, Avishay Gal-Yam, and Andrew Gould","A survey for large image-separation lensed quasars","LaTex, ApJ, submitted",,"10.1086/304503",,"astro-ph",,"  The statistics of gravitationally lensed quasars with multiple images in the
0.1''-7'' range have been measured in various surveys. Little is known,
however, about lensed-quasar statistics at larger image separations, which
probe masses on the scale of galaxy clusters. We extend the results of the HST
Snapshot Survey for Lensed Quasars to the 7''-50'' range for a sub-sample of 76
quasars that is free of known selection effects. Using a combination of
multicolor photometry and spectroscopy, we show that none of the point sources
in the entire field of view of the HST observations of these quasars are lensed
images. Large-separation quasar lensing is therefore not common. We carry out a
detailed calculation of the expected statistics of large-separation lensing for
this quasar sample, incorporating realistic input for the mass profiles and
mass function of galaxy clusters. We find that the observational null results
are consistent with the expected effect of galaxy clusters, even if these have
existed in their present form and number since z of about 2. The rarity of
large-separation lensed quasars can rule out some extreme scenarios, e.g. that
the mass-function of clusters has been severely underestimated, or that large
mass concentrations that are not associated with galaxies (i.e. ``failed''
clusters) are common. The rareness of wide lensing also sets limits on the
cosmological constant that are independent of limits derived from galaxy
lensing. The lensing statistics of larger quasar samples can probe the
structure, number, and evolution of clusters, as well as the geometry of space.
","[{""version"":""v1"",""created"":""Tue, 17 Dec 1996 10:43:51 GMT""}]","2009-10-28"
"astro-ph/9612160","Rob Fender","R. P. Fender (Sussex University, UK), S. J. Bell Burnell, E. B.
  Waltman","The radio-jet X-ray binaries","14 pages, two postscript figures, LaTeX. To appear in Vistas in
  Astronomy, Vol 41, Number 1, 1997, in press",,"10.1016/S0083-6656(96)00054-2",,"astro-ph",,"  We review the observational properties, from radio to X-rays, of the eight
systems for which there is strong evidence for the formation of a radio jet in
a X-ray binary system.
","[{""version"":""v1"",""created"":""Tue, 17 Dec 1996 12:05:01 GMT""}]","2009-10-28"
"astro-ph/9612161","Hector Cuevas Larenas","Laerte Sodre Jr. and Hector Cuevas (IAG/USP, Brazil)","Global regularities in integrated galaxy spectra","12 pages, Accepted for publ. in MNRAS",,"10.1093/mnras/287.1.137",,"astro-ph",,"  We have investigated some statistical properties of integrated spectra of
galaxies from Kennicutt (1992a) spectrophotometric atlas. The input for the
analysis are galaxy spectra sampled in 1300 bins between 3750 \AA~ and 6500
\AA. We make use of Principal Component Analysis (PCA) to analyse the
1300-dimensional space spanned by the spectra. Their projection onto the plane
defined by the first two principal components, the principal plane, shows that
normal galaxies are in a quasi-linear sequence that we call spectral sequence.
We show that the spectral sequence is closely related to the Hubble
morphological sequence. These results are robust in the sense that the reality
of the spectral sequence does not depend on data normalization. The existence
of this sequence suggests that a single parameter may describe the spectrum of
normal galaxies. We have investigated this hypothesis with Bruzual & Charlot
(1995) models of spectral evolution. We show that, for single age models (15
Gyr), the spectral sequence can be parametrized by the characteristic star
formation time-scales of the different morphological types. By examining the
projection of evolutionary tracks of normal galaxies onto the principal plane,
we verify that the spectral sequence is also an evolutive sequence, with galaxy
spectra evolving from later to earlier spectral types. Considering the close
correspondence between the spectral and morphological sequences, this lead us
to speculate that galaxies may evolve morphologically along the Hubble
sequence, from Sm/Im to E.
","[{""version"":""v1"",""created"":""Tue, 17 Dec 1996 11:27:34 GMT""}]","2015-06-24"
"astro-ph/9612162","Nicola Menci","A. Cavaliere (II Universita' di Roma) and N. Menci (Osservatorio
  Astronomico di Roma)","Faint Blue Galaxies and Merging: the Evolution of the Luminosity
  Function","TeX, 19 pages, 7 postscript figures and 1 postscript Table.
  Astrophysical Journal, in press",,"10.1086/303957",,"astro-ph",,"  We probe to what extent not only the counts of the faint blue galaxies and
their redshift distribution but also their z-resolved luminosity functions can
be explained in terms of binary merging (aggregations). We present a dynamical
theory of such interactions. On this basis we find that ``minimal
aggregations'' taking place within large scale structures and triggering
starbusts yield rates and timing such as to explain the observations of the
local, flat luminosity function and of its progressive rising and steepening
for redshifts out to $z\approx 1$. Correspondingly, we predictfaint blue counts
still rising up to $m_B\sim 28 -29$, redshift distributions shifting toward
larger z with increasing $m_B$; in addition, we predict an upturn of the faint
end of the luminosity function more pronounced in clusters than in the field.
We propose that our picture provides the differential dynamics missing in the
canonical hierarchical theories. This reconciles with the observations the
steep luminosity functions predicted at high z by such theories.
","[{""version"":""v1"",""created"":""Tue, 17 Dec 1996 14:04:04 GMT""}]","2016-08-30"
"chao-dyn/9612023","Holger Dullin","Holger R. Dullin (University of Bremen, Germany)","Linear stability in billiards with potential","22 pages, LaTex, 4 Figures","Nonlinearity, 11:151--173, 1998","10.1088/0951-7715/11/1/010",,"chao-dyn nlin.CD",,"  A general formula for the linearized Poincar\'e map of a billiard with a
potential is derived. The stability of periodic orbits is given by the trace of
a product of matrices describing the piecewise free motion between reflections
and the contributions from the reflections alone. For the case without
potential this gives well known formulas. Four billiards with potentials for
which the free motion is integrable are treated as examples: The linear
gravitational potential, the constant magnetic field, the harmonic potential,
and a billiard in a rotating frame of reference, imitating the restricted three
body problem. The linear stability of periodic orbits with period one and two
is analyzed with the help of stability diagrams, showing the essential
parameter dependence of the residue of the periodic orbits for these examples.
","[{""version"":""v1"",""created"":""Mon, 16 Dec 1996 20:05:54 GMT""}]","2008-02-03"
"chao-dyn/9612024","Hermann Riecke","Glen D. Granzow and Hermann Riecke","Double Phase Slips and Spatio-Temporal Chaos in a Model for
  Parametrically Excited Standing Waves","25 pages REVTEX including 21 postscript figures",,,,"chao-dyn cond-mat.soft nlin.CD nlin.PS patt-sol",,"  We present results of numerical simulations of coupled Ginzburg-Landau
equations that describe parametrically excited waves. In one dimension we focus
on a new regime in which the Eckhaus sideband instability does not lead to an
overall change in the wavelength via the occurrence of a single phase slip but
instead leads to ``double phase slips''. They are characterized by the phase
slips occurring in sequential pairs, with the second phase slip quickly
following and negating the first. The resulting dynamics range from transient
excursions from a fixed point resembling those seen in excitable media, to
periodic solutions of varying complexity and chaotic solutions. In larger
systems we find in addition localized spatio-temporal chaos, where the solution
consists of a chaotic region with quiescent regions on each side. We explain
the localization using an effective phase diffusion equation which can be
viewed as arising from a homogenization of the chaotic state. In two dimensions
the double phase slips are replaced by fluctuating bound defect pairs.
","[{""version"":""v1"",""created"":""Mon, 16 Dec 1996 21:49:59 GMT""}]","2008-02-03"
"cmp-lg/9612003",,"Morena Danieli, Elisabetta Gerbino (CSELT - Torino, Italy)","Metrics for Evaluating Dialogue Strategies in a Spoken Language System","6 pages, LaTex, uses aaai.sty; presented at the 1995 AAAI Spring
  Symposium Series (Symposium: Empirical Methods in Discourse Interpretation
  and Generation)",,,,"cmp-lg cs.CL",,"  In this paper, we describe a set of metrics for the evaluation of different
dialogue management strategies in an implemented real-time spoken language
system. The set of metrics we propose offers useful insights in evaluating how
particular choices in the dialogue management can affect the overall quality of
the man-machine dialogue. The evaluation makes use of established metrics: the
transaction success, the contextual appropriateness of system answers, the
calculation of normal and correction turns in a dialogue. We also define a new
metric, the implicit recovery, which allows to measure the ability of a
dialogue manager to deal with errors by different levels of analysis. We report
evaluation data from several experiments, and we compare two different
approaches to dialogue repair strategies using the set of metrics we argue for.
","[{""version"":""v1"",""created"":""Tue, 17 Dec 1996 12:46:45 GMT""}]","2008-02-03"
"cond-mat/9612147","Milica Milovanovic","M. Milovanovic and N. Read","Invariant structure of the hierarchy theory of fractional quantum Hall
  states with spin","21 pages, LaTex, Submitted to Phys. Rev. B",,"10.1103/PhysRevB.56.1461",,"cond-mat.mes-hall cond-mat.str-el",,"  We describe the invariant structure common to abelian fractional quantum Hall
systems with spin. It appears in a generalization of the lattice description of
the polarized hierarchy that encompasses both partially polarized and
unpolarized ground state systems. We formulate, using the spin-charge
decomposition, conditions that should be satisfied so that the description is
SU(2) invariant. In the case of the spin- singlet hierarchy construction, we
find that there are as many SU(2) symmetries as there are levels in the
construction. We show the existence of a spin and charge lattice for the
systems with spin. The ``gluing'' of the charge and spin degrees of freedom in
their bulk is described by the gluing theory of lattices.
","[{""version"":""v1"",""created"":""Mon, 16 Dec 1996 18:05:10 GMT""}]","2009-10-28"
"cond-mat/9612148","Sutapa Mukherji","Sutapa Mukherji and Thomas Nattermann","Steric repulsion and van der Waals attraction between flux lines in
  disordered high Tc superconductors","Latex, 4 pages, 1 figure (Phys. Rev. Lett. 79, 139 (1997))",,"10.1103/PhysRevLett.79.139",,"cond-mat.stat-mech cond-mat.supr-con",,"  We show that in anisotropic or layered superconductors impurities induce a
van der Waals attraction between flux lines. This attraction together with the
disorder induced repulsion may change the low B - low T phase diagram
significantly from that of the pure thermal case considered recently by Blatter
and Geshkenbein [Phys. Rev. Lett. 77, 4958 (1996)].
","[{""version"":""v1"",""created"":""Mon, 16 Dec 1996 20:48:46 GMT""},{""version"":""v2"",""created"":""Thu, 22 May 1997 17:53:10 GMT""},{""version"":""v3"",""created"":""Fri, 21 Nov 1997 19:01:42 GMT""}]","2009-10-28"
"cond-mat/9612149","Wen-Chin Wu","W. C. Wu and J. P. Carbotte (McMaster University)","C-axis Raman spectra of a normal plane-chain bilayer cuprate and the
  pseudogap","23 pages, 6 figures, submitted to Phys. Rev. B",,"10.1103/PhysRevB.56.6327",,"cond-mat",,"  We investigate the Raman spectra in the geometry where both incident and
scattered photon polarizations are parallel to the $\hat{z}$-direction, for a
plane-chain bilayer coupled via a single-particle tunneling $t_\perp$. The
Raman vertex is derived in the tight-binding limit and in the absence of
Coulomb screening, the Raman intensity can be separated into intraband
($\propto t_\perp^4$) and interband ($\propto t_\perp^2$) transitions. In the
small-$t_\perp$ limit, the interband part dominates and a pseudogap will appear
as it does in the conductivity. Coulomb interactions bring in a two-particle
coupling and result in the breakdown of intra- and interband separation.
Nevertheless, when $t_\perp$ is small, the Coulomb screening ($\propto
t_\perp^4$) has little effect on the intensity to which the unscreened
interband transitions contribute most. In general, the total Raman spectra are
strongly dependent on the magnitude of $t_\perp$.
","[{""version"":""v1"",""created"":""Mon, 16 Dec 1996 22:35:18 GMT""}]","2016-08-31"
"cond-mat/9612150","Elliott Lieb","Elliott Lieb","Stability of Matter in Magnetic Fields","Review article, 8 pages, Tex, Zeits. f. Physik (in press)","Zeits f. Phys. B, 933 (1997) 271-274","10.1007/s002570050372","EHL 3 Dec, 1996","cond-mat.stat-mech hep-th",,"  The proof of the stability of matter is three decades old, but the question
of stability when arbitrarily large magnetic fields are taken into account was
settled only recently. Even more recent is the solution to the question of the
stability of relativistic matter when the electron motion is governed by the
Dirac operator (together with Dirac's prescription of filling the ``negative
energy sea""). When magnetic fields are included the question arises whether it
is better to fill the negative energy sea of the free Dirac operator or of the
Dirac operator with magnetic field. The answer is found to be that the former
prescription is unstable while the latter is stable. This paper is a brief,
nontechnical summary of recent work with M. Loss, J.P. Solovej and H.
Siedentop.
","[{""version"":""v1"",""created"":""Tue, 17 Dec 1996 00:32:07 GMT""}]","2009-10-28"
"cond-mat/9612151","Hans-Guenther Doebereiner","H.-G. D\""obereiner (MPI Colloids and Interfaces, Teltow, Germany), E.
  Evans (Physics, UBC, Vancouver), M. Kraus (MPI), U. Seifert (MPI), M. Wortis
  (Physics, SFU, Burnaby)","Mapping vesicle shapes into the phase diagram: A comparison of
  experiment and theory","submitted to PRE, LaTeX, 26 pages, 11 ps-fig",,,,"cond-mat.soft q-bio",,"  Phase-contrast microscopy is used to monitor the shapes of micron-scale
fluid-phase phospholipid-bilayer vesicles in aqueous solution. At fixed
temperature, each vesicle undergoes thermal shape fluctuations. We are able
experimentally to characterize the thermal shape ensemble by digitizing the
vesicle outline in real time and storing the time-sequence of images. Analysis
of this ensemble using the area-difference-elasticity (ADE) model of vesicle
shapes allows us to associate (map) each time-sequence to a point in the
zero-temperature (shape) phase diagram. Changing the laboratory temperature
modifies the control parameters (area, volume, etc.) of each vesicle, so it
sweeps out a trajectory across the theoretical phase diagram. It is a
nontrivial test of the ADE model to check that these trajectories remain
confined to regions of the phase diagram where the corresponding shapes are
locally stable. In particular, we study the thermal trajectories of three
prolate vesicles which, upon heating, experienced a mechanical instability
leading to budding. We verify that the position of the observed instability and
the geometry of the budded shape are in reasonable accord with the theoretical
predictions. The inability of previous experiments to detect the ``hidden''
control parameters (relaxed area difference and spontaneous curvature) make
this the first direct quantitative confrontation between vesicle-shape theory
and experiment.
","[{""version"":""v1"",""created"":""Tue, 17 Dec 1996 13:58:00 GMT""}]","2016-08-15"
