"cond-mat/9612152","Cyril Malyshev","C. Malyshev","Higher Corrections to the Mass Current in the Weakly Inhomogeneous
  A-phase of Helium-3","20 pages, LaTeX, no figures","Phys.Rev.B, Vol.59, No.10 (1999), 7064-7075","10.1103/PhysRevB.59.7064","PDMI Preprint-14/1996, St.-Petersburg (1996)","cond-mat.soft",,"  Two new general representations (the series and the integral) for the mass
current $\vj$ in weakly inhomogeneous superfluid A-phase of Helium--3 are
obtained near zero of temperature by solving the Dyson-Gorkov equation. These
representations result in additional correcting contribution to the standard
leading expression for $\vj$ which is of first order in gradients of the
orbital angular momentum vector $\hl$. The total supplementary term is found as
integral, and, provided the London limit holds, the procedure is advanced to
expand it at T=0 asymptotically by the Laplace method in powers of gradients of
$\hl$. Three special static orientations of $\hl$ with respect to its curl are
considered to calculate the higher correcting terms up to third order.
Coefficients at the quadratic terms are estimated numerically, new cubic
contributions are found which contain the logarithm of the London parameter.
","[{""version"":""v1"",""created"":""Tue, 17 Dec 1996 15:09:24 GMT""},{""version"":""v2"",""created"":""Fri, 25 Jul 1997 16:48:51 GMT""},{""version"":""v3"",""created"":""Mon, 5 Mar 2001 14:57:28 GMT""},{""version"":""v4"",""created"":""Wed, 14 Mar 2001 16:33:43 GMT""}]","2019-01-17"
"cond-mat/9612153","Giorgio Fast Mantica","Giorgio Mantica (Istituto di Scienze Matematiche, Universit\`a di
  Milano a Como, Como Italy)","Quantum Intermittency in Almost-Periodic Lattice Systems Derived from
  their Spectral Properties","13 pages, Latex, 6 postscript figures. Accepted for publication in
  Physica D",,"10.1016/S0167-2789(96)00287-4",,"cond-mat.mes-hall",,"  Hamiltonian tridiagonal matrices characterized by multi-fractal spectral
measures in the family of Iterated Function Systems can be constructed by a
recursive technique here described. We prove that these Hamiltonians are
almost-periodic. They are suited to describe quantum lattice systems with
nearest neighbours coupling, as well as chains of linear classical oscillators,
and electrical transmission lines.
  We investigate numerically and theoretically the time dynamics of the systems
so constructed. We derive a relation linking the long-time, power-law behaviour
of the moments of the position operator, expressed by a scaling function
$\beta$ of the moment order $\alpha$, and spectral multi-fractal dimensions,
D_q, via $\beta(\alpha) = D_{1-\alpha}$. We show cases in which this relation
is exact, and cases where it is only approximate, unveiling the reasons for the
discrepancies.
","[{""version"":""v1"",""created"":""Tue, 17 Dec 1996 14:58:32 GMT""}]","2016-08-31"
"cond-mat/9612154","Jean-Louis Barrat","Jean-Louis Barrat, James Badro, Philippe Gillet","Strong to fragile transition in a model of liquid silica","5 pages, latex, 6 postscript figures",,,,"cond-mat.mtrl-sci",,"  The transport properties of an ionic model for liquid silica at high
temperatures and pressure are investigated using molecular dynamics
simulations. With increasing pressure, a clear change from ""strong"" to
""fragile"" behaviour (according to Angell's classification of glass-forming
liquids) is observed, albeit only on the small viscosity range that can be
explored in MD simulations.. This change is related to structural changes, from
an almost perfect four-fold coordination to an imperfect five or six-fold
coordination. (submitted to ""Molecular Simulation"")
","[{""version"":""v1"",""created"":""Tue, 17 Dec 1996 15:46:27 GMT""}]","2008-02-03"
"cond-mat/9612155","Dima Shepelyansky","Francesco Benvenuto, Giulio Casati and Dima L. Shepelyansky","Dynamical Localization: Hydrogen Atoms in Magnetic and Microwave fields","revtex, 11 pages, 3 figures, to appear in Phys. Rev. A, Feb (1997)",,"10.1103/PhysRevA.55.1732",,"cond-mat",,"  We show that dynamical localization for excited hydrogen atoms in magnetic
and microwave fields takes place at quite low microwave frequency much lower
than the Kepler frequency. The estimates of localization length are given for
different parameter regimes, showing that the quantum delocalization border
drops significantly as compared to the case of zero magnetic field. This opens
up broad possibilities for laboratory investigations.
","[{""version"":""v1"",""created"":""Tue, 17 Dec 1996 15:58:42 GMT""}]","2009-10-28"
"gr-qc/9612041","Mariano Cadoni","Mariano Cadoni","Trace anomaly and Hawking effect in 2D dilaton gravity theories","4 pages, LaTex file uses espcrc2.sty, Talk given at the Second
  Conference on Constrained Dynamics and Quantum Gravity, Santa Margherita
  Ligure, Italy, September 1996, to appear in the Proceedings","Nucl.Phys.Proc.Suppl. 57 (1997) 188-191","10.1016/S0920-5632(97)00372-1","INFNCA-TH9626","gr-qc hep-th",,"  We investigate the classical and semiclassical features of generic 2D,
matter-coupled, dilaton gravity theories. In particular, we show that the mass,
the temperature and the flux of Hawking radiation associated with 2D black
holes are invariant under dilaton-dependent Weyl rescalings of the metric. The
relationship between quantum anomalies and Hawking radiation is discussed.
","[{""version"":""v1"",""created"":""Mon, 16 Dec 1996 16:30:07 GMT""}]","2009-10-28"
"gr-qc/9612042","W. Robert Wood","W. R. Wood and G. Papini","A Geometric Approach to the Quantum Mechanics of de Broglie and Vigier","12 pages, Latex, to be published in the ""The Present Status of the
  Quantum Theory of Light"", proc. of symposium in honour of J-P. Vigier, York
  University, Aug. 27-30, 1995",,,"Regina-97-01","gr-qc quant-ph",,"  Following de Broglie and Vigier, a fully relativistic causal interpretation
of quantum mechanics is given within the context of a geometric theory of
gravitation and electromagnetism. While the geometric model shares the
essential principles of the causal interpretation initiated by de Broglie and
advanced by Vigier, the particle and wave components of the theory are derived
from the Einstein equations rather than a nonlinear wave equation. This
geometric approach leads to several new features, including a solution to the
de Broglie variable mass problem.
","[{""version"":""v1"",""created"":""Mon, 16 Dec 1996 19:28:24 GMT""}]","2007-05-23"
"gr-qc/9612043","Hitoshi Kitada","Hitoshi Kitada (Dept. of Math. Sci. University of Tokyo)","Quantum Mechanics and Relativity --- Their Unification by Local Time ---","31 pages, AmSTeX","Spectral and Scattering Theory, ed. by A. G. Ramm, Plenum Press,
  New York, 39-66 (1998)",,"KIMS-1996-12-08","gr-qc",,"  A quantum-mechanical Hamiltonian with a gravitational potential is derived in
the framework of local times. This Hamiltonian is the one used by E. H. Lieb
(Bull. Amer. Math. Soc. 22(1990), 1-49) in his explanation of stability and
instability of cold stars. Our procedure deriving the Hamiltonian is based on
an analysis of the process of the observation with the background of the notion
of quantum-mechanical local times compatible with general theory of relativity.
","[{""version"":""v1"",""created"":""Tue, 17 Dec 1996 03:57:16 GMT""},{""version"":""v2"",""created"":""Sun, 9 Feb 1997 18:26:02 GMT""},{""version"":""v3"",""created"":""Fri, 16 May 1997 16:37:53 GMT""},{""version"":""v4"",""created"":""Thu, 22 May 1997 01:49:44 GMT""},{""version"":""v5"",""created"":""Thu, 5 Jun 1997 13:37:19 GMT""}]","2008-02-03"
"gr-qc/9612044","Yasufumi Kojima","Yasufumi Kojima (Dept. of Phys., Hiroshima University)","Gravitational Correction in Neutrino Oscillations","5 pages, Latex file without figures , accepted for publication in
  Modern Physics Letters A","Mod.Phys.Lett. A11 (1996) 2965-2970","10.1142/S0217732396002939",,"gr-qc",,"  We investigate the quantum mechanical oscillations of neutrinos propagating
in weak gravitational field. The correction to the result in the flat
space-time is derived.
","[{""version"":""v1"",""created"":""Tue, 17 Dec 1996 05:23:51 GMT""}]","2015-06-25"
"gr-qc/9612045","Dr. Luca Salasnich, . D.","Luca Salasnich","On the Limit Cycle of an Inflationary Universe","Latex, 11 pages, 3 figures (available upon request), to be published
  in Nuovo Cimento B","Nuovo Cim. B112 (1997) 873-880",,"Preprint 43/96, Dep. Pure and Appl. Math., Univ. Padova","gr-qc chao-dyn hep-th nlin.CD",,"  We study the dynamics of a scalar inflaton field with a symmetric
double--well potential and prove rigorously the existence of a limit cycle in
its phase space. By using analytical and numerical arguments we show that the
limit cycle is stable and give an analytical formula for its period.
","[{""version"":""v1"",""created"":""Tue, 17 Dec 1996 09:29:09 GMT""}]","2009-09-25"
"gr-qc/9612046","Alberto Saa","Alberto Saa and Marcelo Schiffer","Bound states due to an accelerated mirror","Final version to appear in PRD","Phys.Rev. D56 (1997) 2449-2452","10.1103/PhysRevD.56.2449",,"gr-qc",,"  We discuss an effect of accelerated mirrors which remained hitherto
unnoticed, the formation of a field condensate near its surface for massive
fields. From the view point of an observer attached to the mirror, this is
effect is rather natural because a gravitational field is felt there. The
novelty here is that since the effect is not observer dependent even inertial
observers will detect the formation of this condensate. We further show that
this localization is in agreement with Bekenstein's entropy bound.
","[{""version"":""v1"",""created"":""Tue, 17 Dec 1996 12:46:52 GMT""},{""version"":""v2"",""created"":""Wed, 28 May 1997 12:50:48 GMT""}]","2009-10-28"
"hep-ex/9612015","Jan Czyzewski","BEBC WA21/WA59 Collaborations: W. Burkot, T. Coghen, J. Czyzewski, W.
  Wittek, M. Aderholz, J. Guy, G.T. Jones, U.F. Katz, P. Marage, D.R.O.
  Morrison, G. Myatt, N. Schmitz, W. Venus","Nuclear Attenuation of Fast Hadrons Produced in Charged-Current Neutrino
  and Antineutrino Interactions in Neon","14 pages + 7 figures, ps file","Z.Phys. C70 (1996) 47-53",,,"hep-ex",,"  The production of hadrons in charged-current (anti)neutrino interactions is
studied with the bubble chamber BEBC exposed ot the CERN (anti)neutrino
wide-band beam. Fast-hadron production in a neon target is found to be
attennuated as compared to that in a hydrogen target. This feature is discussed
within the theoretical models based on the idea of a hadron formation length.
The experimental results favour the `constituent' over the `yo-yo' length
concept, and suggest a quark cross-section in the order of 3mb.
","[{""version"":""v1"",""created"":""Mon, 16 Dec 1996 18:05:10 GMT""}]","2012-08-27"
"hep-ex/9612016","Jan Czyzewski","Jan Czyzewski (Institute of Physics, Jagellonian University) (for
  EHS/NA22 Collaboration)","Correlations in transverse momentum in pion-proton and kaon-proton
  collisions at 250 GeV/c","Talk presented at the 7th Workshop on Multiparticle Production
  ``Correlations and Fluctuations'', Nijmegen, The Netherlands, 30th June-6th
  July, 1996. Latex, 7 pages, uses epsfig.sty, pennames.sty (included), 1 eps
  figure",,,"TPJU-24/96","hep-ex",,"  We have measured the second-order normalized differential factorial moments
as a function of the difference of transverse momentum ($\Delta p_T$) in $\p^+
p$ and $K^+ p$ collisions at 250 GeV/$c$. The second-order differential
factorial moments for like-charged pairs reveal a strong increase with
decreasing $\Delta p_T$. In a small central rapidity window this increase is
described by a simple power law. Such a behavior, if interpreted as originating
from Bose-Einstein correlations, may indicate a structure of the transverse
spatial distribution of the source similar to that recently predicted by
Bia\l{}as and Peschanski for color-dipole emission in onium-onium scattering.
The power of the rise obtained in the fit agrees with the predicted value.
","[{""version"":""v1"",""created"":""Mon, 16 Dec 1996 19:27:21 GMT""}]","2007-05-23"
"hep-lat/9612015","Andrea Ruben Levi","I. Dasgupta, A. R. Levi, V. Lubicz, and C. Rebbi","QCDF90: Lattice QCD with Fortran 90","LaTeX file, 8 pages, no figures. More information available at:
  http://hep.bu.edu/~leviar/qcdf90.html","Nucl.Instrum.Meth. A389 (1997) 121-124","10.1016/S0168-9002(97)00060-0","BU-HEP-96-38","hep-lat",,"  We have used Fortran 90 to implement lattice QCD. We have designed a set of
machine independent modules that define fields (gauge, fermions, scalars,
etc...) and overloaded operators for all possible operations between fields,
matrices and numbers. With these modules it is very simple to write high-level
efficient programs for QCD simulations. To increase performances our modules
also implements assignments that do not require temporaries, and a machine
independent precision definition. We have also created a useful compression
procedure for storing the lattice configurations, and a parallel implementation
of the random generators. We have widely tested our program and modules on
several parallel and single processor supercomputers obtaining excellent
performances.
","[{""version"":""v1"",""created"":""Mon, 16 Dec 1996 16:05:48 GMT""}]","2009-10-28"
"hep-ph/9612368","Cbyang","C.B. Yang and X. Cai","On the Polarization Dependence of Electromagnetic Vertex for Proton","4 pages, in revtex",,,,"hep-ph",,"  The polarization dependence of the electromagnetic vertex for polarized
proton is discussed. Such a dependence is shown to be a result of gluon
polarization and gluon interactions with the constituents within proton. One
more form factor is introduced to give such a dependence in the electromagnetic
vertex for proton. Due the polarization dependence of the vertex, a nonzero
single-spin asymmetry for unpolarized lepton scattering off transversely
polarized proton is predicted.
","[{""version"":""v1"",""created"":""Mon, 16 Dec 1996 17:16:53 GMT""}]","2007-05-23"
"hep-ph/9612373","L. B. Okun","L. B. Okun","LEP, Top and the Standard Model","7 pages, LaTeX, uses sprocl.sty, Plenary talk at the Second Sakharov
  Conference. Lebedev Physical Institute, Moscow, May 20-24, 1996",,,,"hep-ph",,"  A simple way of deriving and analyzing electroweak radiative corrections to
the Z boson decays is presented in the framework of the Standard Model. The
talk is based on a review article by the authors ""Electroweak radiative
corrections in Z decays"" published in Uspekhi Fizicheskikh Nauk, 166 (1996)
539-574, in the May issue dedicated to 75th birthday o f A.D.Sakharov. The
English translation of the article may be found on WWW (hep-ph/9606253).
","[{""version"":""v1"",""created"":""Mon, 16 Dec 1996 16:37:33 GMT""}]","2007-05-23"
"hep-ph/9612374",,"Thomas R. Hemmert, Barry R. Holstein and Joachim Kambor","Delta(1232) and the Polarizabilities of the Nucleon","36 page standard latex file plus 4 figures","Phys.Rev.D55:5598-5612,1997","10.1103/PhysRevD.55.5598","ZU-TH-34/96,TRI-PP-96-68","hep-ph nucl-th",,"  Previous calculations of the polarizabilities of the nucleon within the
framework of heavy baryon chiral perturbation theory have included the
contribution of the $\Delta$(1232) only its effect on various contact terms or
have been performed in chiral SU(3) where systematic errors are difficult to
control. Herein we perfrom a corresponding calculation in chiral SU(2) wherein
$\Delta$(1232) is treated as an explicit degree of freedom and the expansion is
taken to third order in soft momenta, the pion mass and the quantity
$M_\Delta-M_N$, collectively denoted by $\epsilon$. We present the results of a
systematic $O(\epsilon^3)$ calculation of forward Compton scattering off the
nucleon, extract the electric polarizability $\bar{\alpha}_E$, the magnetic
polarizability $\bar{\beta}_M$ and the spin polarizability $\gamma$ and compare
with available information from experiments and from previous calculations.
Concluding with a critical discussion of our results, we point out the
necessity of a future $O(\epsilon^4)$ calculation.
","[{""version"":""v1"",""created"":""Mon, 16 Dec 1996 17:08:23 GMT""}]","2008-11-26"
"hep-ph/9612375","Sarira Sahu","Sarira Sahu","Cerenkov radiation of longitudinal photons by neutrinos","11 pages, 2 figures available on request","Phys.Rev. D56 (1997) 1688-1691","10.1103/PhysRevD.56.1688","PRL-TH-96","hep-ph",,"  In a relativistic plasma neutrino can emit plasmons by the Cerenkov process
which is kinematically allowed for a range of frequencies for which refractive
index is greater than one. We have calculated the rate of energy emission by
this process. We compute the energy deposited in a stalled supernova shock wave
by the Cerenkov process and find that it is much smaller than the Bethe-Wilson
mechanism.
","[{""version"":""v1"",""created"":""Mon, 16 Dec 1996 17:53:45 GMT""}]","2009-10-30"
"hep-ph/9612376","Jorge L. Lopez","J. Ellis, J. Lopez, and D. Nanopoulos","Supersymmetry, Supergravity and R_b revisited in the light of LEP 2","11 pages, LaTeX, 4 figures (included)","Phys.Lett.B397:88-93,1997","10.1016/S0370-2693(97)00156-1","CERN-TH/96-354, DOE/ER/40717-37, CTP-TAMU-64/96","hep-ph",,"  A previous study of supersymmetric models has indicated that they are
unlikely to make a large contribution to R_b. We revisit this analysis, taking
into account the improved lower limits on sparticle masses provided recently by
LEP 2 and the Tevatron, finding that a generic supersymmetric model cannot
contribute more than about one-and-a-half current experimental standard
deviations to R_b. We then specialize this analysis to minimal supergravity
models with universal high-energy boundary conditions, and find a much more
stringent upper bound R^{susy}_b < 0.0003. We discuss in detail why such models
can only attain values of R^{susy}_b that are considerably smaller even than
those obtainable in more general supersymmetric models.
","[{""version"":""v1"",""created"":""Mon, 16 Dec 1996 20:11:39 GMT""}]","2009-09-11"
"hep-ph/9612377",,"J. Hewett (SLAC), T. Rizzo (SLAC), M. Doncheski (Penn State-Mont Alto)","Constraints on Light Gluinos from Tevatron Dijet Data","Includes new dijet analysis from D0. LaTex, 16 pages, 4 figs","Phys.Rev.D56:5703-5708,1997","10.1103/PhysRevD.56.5703","SLAC-PUB-7372","hep-ph",,"  The effects of light, long-lived gluinos on $2\to 2$ processes at hadron
colliders are examined. Such particles can mediate single squark resonant
production via $q\glu\to\sq\to q\glu$ which would significantly modify the
dijet data sample. We find that squark masses in the range $130<m_{\tilde q}<
694, 595, 573$ GeV are excluded for gluino masses of $0.4, 1.3, 5.0$ GeV from
existing UA2 and Tevatron data on dijet bump searches and angular
distributions. Run II of the Tevatron has the capability of excluding this
scenario for squark masses up to $\sim 1$ TeV.
","[{""version"":""v1"",""created"":""Tue, 17 Dec 1996 00:40:12 GMT""},{""version"":""v2"",""created"":""Tue, 7 Jan 1997 22:13:16 GMT""}]","2008-11-26"
"hep-ph/9612378","C. G. Papadopoulos","G.J. Gounaris and Costas G. Papadopoulos","Studying Trilinear Gauge Couplings at Linear Collider Energies","17 pages, LaTeX, version to appear in Zeitschrift fur Physik","Eur.Phys.J.C2:365-372,1998","10.1007/s100520050147","DEMO-HEP-96/04, THES-TP 96/11","hep-ph",,"  We study the sensitivity of the processes `e+ e- -> lepton (l) neutrino (v)
quark (u) antiquark (d)', where the lepton is an electron or a muon, on the
non-standard trilinear gauge couplings (TGC), using the optimal observables
method at Linear Collider energies. Our study is based on the four-fermion
generator ERATO. Taking into account all possible correlations between the
different trilinear gauge coupling parameters, we show that they can be
measured with an accuracy of $10^{-3}$ to $10^{-4}$ for typical Linear Collider
energies and luminosities.
","[{""version"":""v1"",""created"":""Tue, 17 Dec 1996 12:15:46 GMT""},{""version"":""v2"",""created"":""Wed, 9 Apr 1997 10:36:24 GMT""},{""version"":""v3"",""created"":""Sat, 26 Jul 1997 15:22:49 GMT""}]","2011-09-13"
"hep-ph/9612379","Kai Zuber","K. Zuber","Neutrino oscillations and dark matter","9 pages, including 3 eps-figures. Talk presented at Workshop Dark96
  (Aspects of Dark Matter in Astro- and Particle Physics), Sep. 96 Heidelberg,
  Germany",,,,"hep-ph astro-ph",,"  The significance of light massive neutrinos as hot dark matter is outlined.
The power of neutrino oscillation experiments with respect to detect such
neutrinos in the eV-region is discussed. Present hints for neutrino
oscillations in solar, atmospheric and LSND data are reviewed as well as future
experiments and their potential.
","[{""version"":""v1"",""created"":""Tue, 17 Dec 1996 09:31:37 GMT""}]","2007-05-23"
"hep-ph/9612381","Hegyi Sandor","S. Hegyi","Comments on ""Modified negative binomial description of the multiplicity
  distributions in lepton-nucleon scattering""","3 pages LaTeX",,,,"hep-ph",,"  A few remarks on hep-ph/9612213 are given.
","[{""version"":""v1"",""created"":""Tue, 17 Dec 1996 11:59:29 GMT""}]","2007-05-23"
"hep-ph/9612382",,"M.Genovese, J.-M.Richard, S. Pepin and Fl. Stancu","Study of Multiquarks Systems in a Chiral Quark Model","10 pages, sprocl.sty, proceeding of ""3th Diquark meeting"" Turin
  october 96",,,"ISN 96.130","hep-ph nucl-th",,"  We discuss the stability of multiquark systems within the recent model of
Glozman et al. where the chromomagnetic hyperfine interaction is replaced by
pseudoscalar-meson exchange contributions. In this model the (u,d) diquark S=0
I=0 is strongly bound (more than for the chromomagnetic interaction) and this
leads to a bound heavy tetraquark QQ\bar q\bar q where the light quarks are in
the S=0 I=0 configuration. We study the stability of other multiquark systems
as well.
","[{""version"":""v1"",""created"":""Tue, 17 Dec 1996 12:23:04 GMT""}]","2007-05-23"
"hep-ph/9612383","Paolo Ciafaloni","P. Ciafaloni and D. Espriu","The Effective Lagrangian of the Two Higgs Doublet Model","16 pages, LaTeX, 2 figures","Phys.Rev. D56 (1997) 1752-1760","10.1103/PhysRevD.56.1752","UAB-FT-405, UB-ECM-PF-96/23","hep-ph",,"  We consider the two Higgs doublet model extension of the Standard Model in
the limit where all physical scalar particles are very heavy; too heavy, in
fact, to be experimentally produced in forthcoming experiments. The symmetry
breaking sector can thus be described by an effective chiral Lagrangian. We
obtain the values of the coefficients of the O(p^4) operators relevant to the
oblique corrections and investigate to what extent some non-decoupling effects
may remain at low energies.
","[{""version"":""v1"",""created"":""Tue, 17 Dec 1996 14:50:10 GMT""}]","2009-10-30"
"hep-ph/9612384","Steve Godfrey","Stephen Godfrey","Search Limits for Extra Neutral Gauge Bosons at High Energy Lepton
  Colliders","Latex2e file uses snow2e.cls, epsfig, 3 postscript figures, to appear
  in the Proceedings of the 1996 DPF/DPB Summer Study on New Directions for
  High Energy Physics - Snowmass96, Snowmass, CO, 25 June - 12 July, 1996","ECONF C960625:NEW138,1996",,"OCIP/C-96-6","hep-ph",,"  We study and compare the discovery potential for heavy neutral gauge bosons
(Z') at the various $e^+e^-$ and $\mu^+\mu^-$ colliders that have been
proposed. Typical search limits for the e^+e^- colliders are 2-10 times sqrt{s}
with the large variation reflecting the model dependence of the limits. The
search limits for the mu^+ mu^- colliders are slightly lower. Polarization and
flavour tagging are important in realizing the highest discovery limits
possible. Because the search limits are based on indirect inferences of
deviations from standard model predictions, they are sensitive to systematic
errors.
","[{""version"":""v1"",""created"":""Tue, 17 Dec 1996 14:43:12 GMT""}]","2011-04-15"
"hep-ph/9612386","Frans Klinkhamer","F. R. Klinkhamer","Electroweak defects","Expanded version of published paper, 12 pages LaTeX, includes
  Postscript figures and style file",,,"KA-TP-26-1996","hep-ph astro-ph",,"  A brief, non-technical review is given of certain defect-like configurations
in the electroweak standard model, which may have played an important role in
the physics of the early universe.
","[{""version"":""v1"",""created"":""Tue, 17 Dec 1996 14:22:52 GMT""},{""version"":""v2"",""created"":""Wed, 18 Dec 1996 14:04:08 GMT""},{""version"":""v3"",""created"":""Wed, 21 Jan 1998 12:44:02 GMT""}]","2008-02-03"
"hep-th/9612167","Anders Westerberg","Anders Westerberg","On higher-dimensional loop algebras, pseudodifferential operators and
  Fock space realizations","6 pages, LaTeX, requires espcrc2.sty and amsfonts.sty. Contribution
  to the proceedings of the 30th Int. Symposium Ahrenshoop on the theory of
  elementary particles, Buckow, Germany, August 27-31, 1996","Nucl.Phys.Proc.Suppl.56B:275-280,1997","10.1016/S0920-5632(97)00336-8","Goteborg-ITP-96-15","hep-th",,"  We discuss a previously discovered [hep-th/9401027] extension of the
infinite-dimensional Lie algebras Map(M,g) which generalizes the Kac-Moody
algebras in 1+1 dimensions and the Mickelsson-Faddeev algebras in 3+1
dimensions to manifolds M of general dimensions. Furthermore, we review the
method of regularizing current algebras in higher dimensions using
pseudodifferential operator (PSDO) symbol calculus. In particular, we discuss
the issue of Lie algebra cohomology of PSDOs and its relation to the Schwinger
terms arising in the quantization process. Finally, we apply this
regularization method to the algebra of the above reference with partial
success, and discuss the remaining obstacles to the construction of a Fock
space representation.
","[{""version"":""v1"",""created"":""Mon, 16 Dec 1996 19:41:55 GMT""}]","2010-11-19"
