"q-alg/9612022","Juan Carlos Perez Bueno","J. A. de Azcarraga, M. del Olmo, J. C. Perez Bueno and M. Santander","Graded contractions and bicrossproduct structure of deformed
  inhomogeneous algebras","LaTeX file, 20 pages. Trivial changes. To appear in J. Phys. A","J.Phys.A30:3069-3086,1997","10.1088/0305-4470/30/9/018","DAMTP/96-100","q-alg math.QA",,"  A family of deformed Hopf algebras corresponding to the classical maximal
isometry algebras of zero-curvature N-dimensional spaces (the inhomogeneous
algebras iso(p,q), p+q=N, as well as some of their contractions) are shown to
have a bicrossproduct structure. This is done for both the algebra and, in a
low-dimensional example, for the (dual) group aspects of the deformation.
","[{""version"":""v1"",""created"":""Tue, 17 Dec 1996 09:39:01 GMT""},{""version"":""v2"",""created"":""Tue, 25 Feb 1997 16:20:02 GMT""}]","2008-11-26"
"q-alg/9612023","B. Pareigis","Bodo Pareigis (University of Munich, Germany)","On Lie Algebras in the Category of Yetter-Drinfeld Modules","21 pages, NLaTeX with bezier.sty, amsart.sty",,,,"q-alg math.QA",,"  The category of Yetter-Drinfeld modules over a Hopf algebra (with bijektive
antipode over a field) is a braided monoidal category. Given a Hopf algebra in
this category then the primitive elements of this Hopf algebra do not form an
ordinary Lie algebra anymore.
  We introduce the notion of a (generalized) Lie algebra in the category of
Yetter-Drinfeld modules such that the set of primitive elements of a Hopf
algebra is a Lie algebra in this sense. It has n-ary partially defined Lie
multiplications on certain symmetric submodules of n- fold tensor products.
They satisfy antisymmetry and Jacobi identities. Also the Yetter-Drinfeld
module of derivations of an associative algebra in the category of Yetter-
Drinfeld modules is a Lie algebra. Furthermore for each Lie algebra in the
category of Yetter-Drinfeld modules there is a universal enveloping algebra
which turns out to be a (braided) Hopf algebra in this category.
","[{""version"":""v1"",""created"":""Tue, 17 Dec 1996 08:35:12 GMT""}]","2008-02-03"
"q-alg/9612024",,"Minoru Hirayama and Shiori Kamibayashi","Fermion Representation of Quantum Group","LaTex,15Pages",,"10.1143/PTP.97.691",,"q-alg math.QA",,"  The spinor representation of the quantum group $U_q(su(N))$ is given in terms
of a set of fermion creation and annihilation operators. It is shown that the
$q$-fermion operators introduced earlier can be identifi ed with the
conventional fermion operators. Algebra homomorphisms mapping the fermion
operators to their t ensor products are discussed. The relation of the
coproduct of the quantum group to the above algebra homo morphisms is obtained.
","[{""version"":""v1"",""created"":""Tue, 17 Dec 1996 10:01:12 GMT""},{""version"":""v2"",""created"":""Tue, 18 Mar 1997 08:46:22 GMT""},{""version"":""v3"",""created"":""Wed, 19 Mar 1997 09:01:33 GMT""}]","2009-10-30"
"quant-ph/9612039",,"Lorenza Viola and Roberto Onofrio","Testing the equivalence principle through freely falling quantum objects","10 Pages; Plain REVTeX. To be published in Phys. Rev. D","Phys.Rev.D55:455-462,1997","10.1103/PhysRevD.55.455",,"quant-ph gr-qc",,"  Free fall in a uniform gravitational field is revisited in the case of
quantum states with and without classical analogue. The interplay between
kinematics and dynamics in the evolution of a falling quantum test particle is
discussed allowing for a better understanding of the equivalence principle at
the operational level.
","[{""version"":""v1"",""created"":""Mon, 16 Dec 1996 16:58:24 GMT""}]","2009-12-30"
"quant-ph/9612040","Hagen Kleinert","H. Kleinert","Quantum Equivalence Principle","Lectures presented at the 1996 Cargese Summer School on FUNCTIONAL
  INTEGRATION: BASICS AND APPLICATIONS. Author's institution under
  (http://www.physik.fu-berlin.de/~kleinert/institution.html) Paper can be read
  in HTML format under
  (http://www.physik.fu-berlin.de/~kleinert/kleiner_re252/preprint.html)",,,,"quant-ph",,"  A simple mapping procedure is presented by which classical orbits and path
integrals for the motion of a point particle in flat space can be transformed
directly into those in curved space with torsion. Our procedure evolved from
well-established methods in the theory of plastic deformations, where crystals
with defects are described mathematically as images of ideal crystals under
active nonholonomic coordinate transformations.
  Our mapping procedure may be viewed as a natural extension of Einstein's
famous equivalence principle. When applied to time-sliced path integrals, it
gives rise to a new ""quantum equivalence principle"" which determines short-time
action and measure of fluctuating orbits in spaces with curvature and torsion.
The nonholonomic transformations possesses a nontrivial Jacobian in the path
measure which produces in a curved space an additional term proportional to the
curvature scalar R, thus canceling a similar term found earlier by DeWitt. This
cancelation is important for correctly describing semiclassically and quantum
mechanically various systems such as the hydrogen atom, a particle on the
surface of a sphere, and a spinning top. It is also indispensable for the
process of bosonization, by which Fermi particles are redescribed by those
fields.
","[{""version"":""v1"",""created"":""Tue, 17 Dec 1996 12:29:18 GMT""},{""version"":""v2"",""created"":""Wed, 18 Dec 1996 07:55:33 GMT""},{""version"":""v3"",""created"":""Thu, 13 Feb 1997 08:26:22 GMT""}]","2008-02-03"
"quant-ph/9612041","Fernando Lombardo","Mario Castagnino, and Roberto Laura","Minimal Irreversible Quantum Mechanics","30 pages, latex, no figures, email of first author
  castagni@iafe.uba.ar",,,,"quant-ph",,"  It is demonstrated that, making minimal changes in ordinary quantum
mechanics, a reasonable irreversible quantum mechanics can be obtained. This
theory has a more general spectral decompositions, with eigenvectors
corresponding to unstable states that vanish when $t \to \infty .$ These
''Gamov vectors'' have zero norm, in such a way that the norm and the energy of
the physical states remain constant. The evolution operator has no inverse,
showing that we are really dealing with a time-asymmetric theory. Using
Friedrichs model reasonable physical results are obtained, e. g. : the
remaining of an unstable decaying state reappears, in the continuous spectrum
of the model, with its primitive energy.
","[{""version"":""v1"",""created"":""Tue, 17 Dec 1996 13:47:55 GMT""}]","2007-05-23"
