"hep-th/9612170","Sergei Ketov","Sergei V. Ketov (ITP, University of Hannover)","Mixed (open/closed) N=(2,2) string theory as an integrable deformation
  of self-duality","9 pages, LaTeX","Phys.Lett. B395 (1997) 48-53","10.1016/S0370-2693(97)00038-5","DESY 96--259 and ITP-UH-25/96","hep-th",,"  The exact effective field equations of motion, corresponding to the
perturbative mixed theory of open and closed (2,2) world-sheet supersymmetric
strings, are investigated. It is shown that they are only integrable in the
case of an abelian gauge group. The gravitational equations are then stationary
with respect to the Born-Infeld-type effective action.
","[{""version"":""v1"",""created"":""Mon, 16 Dec 1996 16:51:10 GMT""}]","2009-10-30"
"hep-th/9612171","Sergei Ketov","Sergei V. Ketov (ITP, University of Hannover)","Self-duality and F theory","9 pages, LaTeX; Talk given at the 4th Nordic Meeting `Supersymmetric
  Field and String Theories', (G""oteborg, Sweden, 9--11 September 1996), and at
  the `mitteldeutsche' Workshop (Lutherstadt Wittenberg, Germany, 29--30
  November 1996)",,,"ITP-UH-26/96","hep-th",,"  The (2,2) world-sheet supersymmetric string theory is discussed from the
viewpoint of string/membrane unification. The effective field theory in the
closed string target space is known to be the 2+2 dimensional (integrable)
theory of self-dual gravity (SDG). A world-volume supersymmetrization of the
Pleba'nski action for SDG naturally implies the maximal N=8 world-volume
supersymmetry, while the maximal supersymmetrization of the dual covariant
K""ahler-Lorentz-Chern-Simons action for SDG implies gauging a self-dual part of
the super-Lorentz symmetry in 2+10 dimensions. The proposed OSp(32|1)
supersymmetric action for the M-brane may be useful for a fundamental
formulation of uncompactified F theory, with the self-duality being playing the
central role both in the world-volume and in the target space of the M-brane.
","[{""version"":""v1"",""created"":""Mon, 16 Dec 1996 17:04:25 GMT""}]","2007-05-23"
"hep-th/9612172","Guruswamy Sathya","Sathya Guruswamy, Andreas W.W. Ludwig","Relating c<0 and c>0 Conformal Field Theories","23 pages, harvmac","Nucl.Phys. B519 (1998) 661-681","10.1016/S0550-3213(98)00059-5","IC/96/273","hep-th",,"  A `canonical mapping' is established between the c=-1 system of bosonic
ghosts and the c=2 complex scalar theory and, a similar mapping between the
c=-2 system of fermionic ghosts and the c=1 Dirac theory. The existence of this
mapping is suggested by the identity of the characters of the respective
theories. The respective c<0 and c>0 theories share the same space of states,
whereas the spaces of conformal fields are different. Upon this mapping from
their c<0 counterparts, the (c>0) complex scalar and the Dirac theories inherit
hidden nonlocal sl(2) symmetries.
","[{""version"":""v1"",""created"":""Mon, 16 Dec 1996 23:23:30 GMT""}]","2009-10-30"
"hep-th/9612173","Quesne Christiane","C. Quesne","An exactly solvable three-particle problem with three-body interaction","LaTeX, 15 pages, no figures, slightly shortened version to appear in
  Phys. Rev. A, one error corrected","Phys.Rev. A55 (1997) 3931-3934","10.1103/PhysRevA.55.3931",,"hep-th math-ph math.MP",,"  The energy spectrum of the three-particle Hamiltonian obtained by replacing
the two-body trigonometric potential of the Sutherland problem by a three-body
one of a similar form is derived. When expressed in appropriate variables, the
corresponding wave functions are shown to be expressible in terms of Jack
polynomials. The exact solvability of the problem with three-body interaction
is explained by a hidden sl(3,\R) symmetry.
","[{""version"":""v1"",""created"":""Tue, 17 Dec 1996 08:26:36 GMT""},{""version"":""v2"",""created"":""Tue, 13 May 1997 06:39:23 GMT""}]","2009-10-30"
"hep-th/9612174","Ingemar Bengtsson","Ingemar Bengtsson (Stockholm)","Manifest Duality in Born-Infeld Theory","15 pages, Latex","Int.J.Mod.Phys.A12:4869-4880,1997","10.1142/S0217751X97002590","USITP 96-16","hep-th",,"  Born-Infeld theory is formulated using an infinite set of gauge fields, along
the lines of McClain, Wu and Yu. In this formulation electromagnetic duality is
generated by a fully local functional. The resulting consistency problems are
analyzed and the formulation is shown to be consistent.
","[{""version"":""v1"",""created"":""Tue, 17 Dec 1996 14:54:36 GMT""}]","2014-11-18"
"hep-th/9612175",,"Minoru Hirayama, Hui-Min Zhang and Takeshi Hamada","Induced Gauge Structure of Quantum Mechanics on $S^D$","LaTex,15Pages","Prog.Theor.Phys. 97 (1997) 679-690","10.1143/PTP.97.679",,"hep-th",,"  The Ohnuki-Kitakado (O-K) scheme of quantum mechanics on $S^D$ embedded in
$R^{D+1}$ is investigated. Generators satisfying the O-K algebra are written
down explicitly in term of the induced gauge potential. A direct method is
developed to obtain the generators in covariant form. It is seen that there
exists an induced gauge configuration which is trivial on $S^D$ but might cause
a nontrivial physical effect in $R^{D+1}$. The relation of the O-K scheme to
extended objects such as the 't Hooft-Polyakov monopole is discussed.
","[{""version"":""v1"",""created"":""Tue, 17 Dec 1996 10:12:41 GMT""},{""version"":""v2"",""created"":""Tue, 18 Mar 1997 08:59:56 GMT""},{""version"":""v3"",""created"":""Wed, 19 Mar 1997 09:27:05 GMT""}]","2016-09-06"
"hep-th/9612176","Chand Devchand","C. Devchand and J. Nuyts","Self-duality in Generalized Lorentz Superspaces","6 pages, Latex","Phys.Lett. B404 (1997) 259-263","10.1016/S0370-2693(97)00571-6",,"hep-th",,"  We extend the notion of self-duality to spaces built from a set of
representations of the Lorentz group with bosonic or fermionic behaviour, not
having the traditional spin-one upper-bound of super Minkowski space. The
generalized derivative vector fields on such superspaces are assumed to form a
superalgebra. Introducing corresponding gauge potentials and hence covariant
derivatives and curvatures, we define generalized self-duality as the Lorentz
covariant vanishing of certain irreducible parts of the curvatures.
","[{""version"":""v1"",""created"":""Tue, 17 Dec 1996 15:37:11 GMT""}]","2009-10-30"
"hep-th/9612177","Jouko Mickelsson","Edwin Langmann and Jouko Mickelsson","Vacuum Polarization Renormalization and the Geometric Phase","5 pages in AMSTEX format. This is a talk given by Jouko Mickelsson at
  ""XXI. Colloquium on Group Theoretical Methods in Physics"" in Goslar, July
  1996",,,,"hep-th",,"  As an application of the renormalization method introduced by the second
author we give a causal definition of the phase of the quantum scattering
matrix for fermions in external Yang-Mills potentials. The phase is defined
using parallel transport along the path of renormalized time evolution
operators. The time evolution operators are elements of the restricted unitary
group $U_{res}$ of Pressley and Segal. The central extension of $U_{res}$ plays
a central role.
","[{""version"":""v1"",""created"":""Tue, 17 Dec 1996 12:29:07 GMT""}]","2007-05-23"
"hep-th/9612178",,"Andreas Recknagel (ETH Zuerich)","From path representations to global morphisms for a class of minimal
  models","50 pages, Plain TeX, 2 figures","Commun.Math.Phys. 201 (1999) 365-409","10.1007/s002200050559","ETH-TH/96-44","hep-th",,"  We construct global observable algebras and global DHR morphisms for the
Virasoro minimal models with central charge c(2,q), q odd. To this end, we pass
{}from the irreducible highest weight modules to path representations, which
involve fusion graphs of the c(2,q) models. The paths have an interpretation in
terms of quasi-particles which capture some structure of non-conformal
perturbations of the c(2,q) models. The path algebras associated to the path
spaces serve as algebras of bounded observables. Global morphisms which
implement the superselection sectors are constructed using quantum symmetries:
We argue that there is a canonical semi-simple quantum symmetry algebra for
each quasi-rational CFT, in particular for the c(2,q) models. These symmetry
algebras act naturally on the path spaces, which allows to define a global
field algebra and covariant multiplets therein.
","[{""version"":""v1"",""created"":""Tue, 17 Dec 1996 15:54:36 GMT""}]","2009-10-30"
"hep-th/9612179","Reinhold W. Gebert","R. W. Gebert (IAS, Princeton, U.S.A.)","Beyond the Frenkel-Kac-Segal construction of affine Lie algebras","6 pages, LaTeX209 with twoside, fleqn, amsmath, amsfonts, amssymb,
  amsthm style files; contribution to Proceedings of the 30th Int. Symposium
  Ahrenshoop on the Theory of Elementary Particles, Buckow, Germany, August
  27-31, 1996","Nucl.Phys.Proc.Suppl. 56B (1997) 263-268","10.1016/S0920-5632(97)00334-4",,"hep-th",,"  This contribution reviews recent progress in constructing affine Lie algebras
at arbitrary level in terms of vertex operators. The string model describes a
completely compactified subcritical chiral bosonic string whose momentum
lattice is taken to be the (Lorentzian) affine weight lattice. The main feature
of the new realization is the replacement of the ordinary string oscillators by
physical DDF operators, whereas the unphysical position operators are
substituted by certain linear combinations of the Lorentz generators. As a side
result we obtain simple expressions for the affine Weyl translations as Lorentz
boosts. Various applications of the construction are discussed.
","[{""version"":""v1"",""created"":""Tue, 17 Dec 1996 15:57:13 GMT""}]","2009-10-30"
"hep-th/9612180",,"S.A. Gogilidze and Yu.S. Surovtsev","Dynamical Systems with First- and Second-Class Constraints and the
  Second Noether Theorem","9 pages, LaTex",,,,"hep-th",,"  Dynamical systems, described by Lagrangians with first- and second-class
constraints, are investigated. In the Dirac approach to the generalized
Hamiltonian formalism, the classification and separation of the first- and
second-class constraints are presented with the help of passing to an
equivalent canonical set of constraints. The general structure of second-class
constraints is clarified. The method of constructing the generator of symmetry
transformations in the second Noether theorem is given. It is proved that
second-class constraints do not contribute to the transformation law of the
local symmetry which entirely is entirely stipulated by all the first-class
constraints.
","[{""version"":""v1"",""created"":""Tue, 17 Dec 1996 15:53:03 GMT""}]","2007-05-23"
"math/9612229","Wolfgang M. Ruppert","Wolfgang M. Ruppert","Small generators of number fields",,,,"ANT-0052","math.NT",,"  This is a revised version of ANT-0045.
  If K is a number field of degree n with discriminant D, if K=Q(a) then
H(a)>c(n)|D|^(1/(2n-2)) where H(a) is the height of the minimal polynomial of
a. We ask if one can always find a generator a of K such that
d(n)|D|^(1/(2n-2))>H(a) holds. The answer is yes for real quadratic fields.
","[{""version"":""v1"",""created"":""Tue, 17 Dec 1996 00:00:00 GMT""}]","2008-02-03"
"nucl-th/9612039","Dr. Dinesh Kumar Srivastava","Dipali Pal, Pradip Kumar Roy, Sourav Sarkar, Dinesh Kumar Srivastava,
  and Bikash Sinha","Soft Electromagnetic Radiations from Relativistic Heavy Ion Collisions","Revtex file","Phys.Rev.C55:1467-1476,1997","10.1103/PhysRevC.55.1467","VECC-NTH-96012, (to appear in Phys. Rev. C)","nucl-th",,"  The production of low mass dileptons and soft photons from thermalized Quark
Gluon Plasma (QGP) and hadronic matter in relativistic heavy ion collisions is
evaluated. A boost invariant longitudinal and cylindrically symmetric
transverse expansion of the systems created in central collision of lead nuclei
at CERN SPS, BNL RHIC, and CERN LHC, and undergoing a first order phase
transition to hadronic matter is considered. A large production of low mass (M<
0.3 GeV) dileptons, and soft photons (p_T< 0.4 GeV) is seen to emanate from the
bremsstrahlung of quarks and pions. We find an increase by a factor of 2--4 in
the low mass dilepton and soft photon yield as we move from SPS to RHIC
energies, and an increase by an order of magnitude as we move from SPS to LHC
energies. Most of the soft radiations are found to originate from pion driven
processes at SPS and RHIC energies, while at the LHC energies the quark and the
pion driven processes contribute by a similar amount. The study of the
transverse mass distribution is seen to provide interesting details of the
evolution. We also find a unique universal behaviour for the ratio of M^2
weighted transverse mass distribution for M= 0.1 GeV to that for M= 0.2 and 0.3
GeV, as a function of M_T, for SPS, RHIC, and LHC energies, in the absence of
transverse expansion of the system. A deviation from this universal behaviour
is seen as a clear indication of the flow.
","[{""version"":""v1"",""created"":""Mon, 16 Dec 1996 18:31:03 GMT""}]","2016-09-08"
"nucl-th/9612041","Jouni A. Niskanen","J.A. Niskanen and M. Vestama (University of Helsinki)","Charge dependence of $NN\to d\pi$","10 pages plus 2 figures, submitted to Phys. Lett. B","Phys.Lett. B394 (1997) 253-259","10.1016/S0370-2693(97)00005-1","HU-TFT-96-38 (revised)","nucl-th",,"  We calculate the isospin symmetry violating effects to the reactions
$pp\rightarrow d\pi ^+$ and $np\rightarrow d\pi ^0$ arising from the different
hadron masses and from the Coulomb interaction between the positive pion and
the deuteron. These effects are large enough in the cross section and analyzing
power $A_y$ that they should be taken into account in comparisons of accurate
experiments in different charge channels.
","[{""version"":""v1"",""created"":""Mon, 16 Dec 1996 16:11:29 GMT""}]","2009-10-30"
"nucl-th/9612042","Reiner Behnsch","D. Vretenar (1), G. A. Lalazissis (2), R. Behnsch, W. P\""oschl and P.
  Ring (3) ((1) University of Zagreb, (2) University of Thessaloniki, (3)
  Technische Universit\""at M\""unchen)","Monopole giant resonances and nuclear compressibility in relativistic
  mean field theory","30 pages of LaTeX, 18 PS-figures",,"10.1016/S0375-9474(97)00192-9",,"nucl-th",,"  Isoscalar and isovector monopole oscillations that correspond to giant
resonances in spherical nuclei are described in the framework of time-dependent
relativistic mean-field (RMF) theory. Excitation energies and the structure of
eigenmodes are determined from a Fourier analysis of dynamical monopole moments
and densities. The generator coordinate method, with generating functions that
are solutions of constrained RMF calculations, is also used to calculate
excitation energies and transition densities of giant monopole states.
Calculations are performed with effective interactions which differ in their
prediction of the nuclear matter compression modulus K_nm. Both time-dependent
and constrained RMF results indicate that empirical GMR energies are best
reproduced by an effective force with K_nm \approx 270 MeV.
","[{""version"":""v1"",""created"":""Mon, 16 Dec 1996 16:51:28 GMT""}]","2009-10-30"
"nucl-th/9612043",,"G.W. Carter, P.J. Ellis and S. Rudaz (University of Minnesota)","An Effective Lagrangian with Broken Scale and Chiral Symmetry III:
  Mesons at Finite Temperature","20 pages latex plus 8 postscript figures","Nucl.Phys. A618 (1997) 317-329","10.1016/S0375-9474(97)00048-1","UMN-TH-1523/96; NUC-MINN-96/20-T","nucl-th hep-ph",,"  We investigate the finite temperature behavior of the meson sector of an
effective Lagrangian which describes nuclear matter. A method is developed for
evaluating the logarithmic terms in the effective potential which involves
expansion and resummation; the result is written in terms of the exponential
integral. In the absence of explicit chiral symmetry breaking, a phase
transition restores the symmetry at a temperature of 190 MeV; when the pion has
a mass the transition is smooth. At a much higher temperature a first order
phase transition restores scale symmetry.
","[{""version"":""v1"",""created"":""Mon, 16 Dec 1996 21:31:23 GMT""}]","2009-10-30"
"nucl-th/9612044",,"V. Spevak, N. Auerbach, V.V. Flambaum","Enhanced T-odd P-odd Electromagnetic Moments in Reflection Asymmetric
  Nuclei","28 pages, Revtex","Phys.Rev.C56:1357-1369,1997","10.1103/PhysRevC.56.1357",,"nucl-th physics.atom-ph",,"  Collective P- and T- odd moments produced by parity and time invariance
violating forces in reflection asymmetric nuclei are considered. The enhanced
collective Schiff, electric dipole and octupole moments appear due to the
mixing of rotational levels of opposite parity. These moments can exceed
single-particle moments by more than two orders of magnitude. The enhancement
is due to the collective nature of the intrinsic moments and the small energy
separation between members of parity doublets. In turn these nuclear moments
induce enhanced T- and P- odd effects in atoms and molecules. First a simple
estimate is given and then a detailed theoretical treatment of the collective
T-, P- odd electric moments in reflection asymmetric, odd-mass nuclei is
presented and various corrections evaluated. Calculations are performed for
octupole deformed long-lived odd-mass isotopes of Rn, Fr, Ra, Ac and Pa and the
corresponding atoms. Experiments with such atoms may improve substantially the
limits on time reversal violation.
","[{""version"":""v1"",""created"":""Tue, 17 Dec 1996 10:08:44 GMT""}]","2008-11-26"
"nucl-th/9612045","Peter Ring","J. Meng, P. Ring","A Giant Halo at the Neutron Drip Line","4 pages of revtex, 4 ps-figures, uses revtex.sty","PHYS REV LETT 80 (1998) 460","10.1103/PhysRevLett.80.460",,"nucl-th",,"  Relativistic Hartree-Bogoliubov (RHB) theory in coordinate space is used to
describe the chain of even-even Zirconium isotopes reaching from Zr116 to the
drip line nucleus Zr140. Pairing correlations are taken into account by a
density dependent force of zero range. For neutron numbers larger than the
magic number N=82 a giant neutron halo outside the core of Zr122 is observed.
It is formed by up to six neutrons.
","[{""version"":""v1"",""created"":""Tue, 17 Dec 1996 12:51:33 GMT""}]","2009-10-30"
"nucl-th/9612046","B. Koerfgen","B. Koerfgen, P. Oltmanns, F. Osterfeld and T. Udagawa","Damping mechanisms of the Delta resonance in nuclei","9 pages, 5 Postscript figures, uses RevTex, psfig.sty. Accepted by
  Physical Review C","Phys.Rev.C55:1819-1825,1997","10.1103/PhysRevC.55.1819","IKP(Th)-96-23","nucl-th",,"  The damping mechanisms of the Delta(1232) resonance in nuclei are studied by
analyzing the quasi-free decay reactions 12C(pi+,pi+ p)11B and 12C(3He,t pi+
p)11B and the 2p emission reactions 12C(pi+,pp)10B and 12C(3He,t pp)10B. The
coincidence cross sections are calculated within the framework of the
isobar-hole model. It is found that the 2p emission process induced by the
decay of the Delta resonance in the nucleus can be consistently described by a
pi+rho+g' model for the Delta+N -> N+N decay interaction.
","[{""version"":""v1"",""created"":""Tue, 17 Dec 1996 14:00:07 GMT""}]","2008-11-26"
"nucl-th/9612047","Sergey Bondarenko","S. G. Bondarenko, V. V. Burov (Bogoliubov Laboratory of Theoretical
  Physics, JINR Dubna, Russia), M. Beyer (Max Planck AG ``Theoretical Many
  Particle Physics'', Rostock University, Rostock, Germany), S. M. Dorkin (Far
  Eastern State University Vladivostok, Russia)","Deuteron electrodisintegration near threshold in the Bethe-Salpeter
  approach","19 pages, RevTeX, epsf.sty, bezier.sty, 1 Postscript figure (eps
  format)",,,"MPG-VT-UR 87/96","nucl-th",,"  In the framework of the covariant Bethe-Salpeter formalism we calculate the
amplitude of electrodisintegration of the deuteron near the threshold energy.
Due to the small relative momentum of the final np-pair, the deuteron break-up
process may be sufficiently described by a transition to the dominant 1S0
channel into the final state. Therefore only one unknown structure function
(form factor) exists. The explicit formula for this form factor is given in
terms of partial Bethe-Salpeter amplitudes. We compare our result to the usual
non-relativistic calculations. The essential role of P-states as well as their
possible link to mesonic exchange currents is discussed.
","[{""version"":""v1"",""created"":""Tue, 17 Dec 1996 13:41:57 GMT""},{""version"":""v2"",""created"":""Fri, 24 Oct 1997 08:47:14 GMT""}]","2008-02-03"
"nucl-th/9612048","Dobaczewski","N. El Aouad, J.Dobaczewski, J. Dudek, X. Li, W.D. Luo, H. Molique, A.
  Bouguettoucha, Th. Byrski, F. Beck, C. Finck, and B. Kharraja","Microscopic Study of Superdeformed Rotational Bands in 151Tb","32 RevTeX pages, 15 figures included, submitted to Physical Review C","Nucl.Phys. A676 (2000) 155-195","10.1016/S0375-9474(00)00194-9","CRN 96-38","nucl-th",,"  Structure of eight superdeformed bands in the nucleus 151Tb is analyzed using
the results of the Hartree-Fock and Woods-Saxon cranking approaches. It is
demonstrated that far going similarities between the two approaches exist and
predictions related to the structure of rotational bands calculated within the
two models are nearly parallel. An interpretation scenario for the structure of
the superdeformed bands is presented and predictions related to the exit spins
are made. Small but systematic discrepancies between experiment and theory,
analyzed in terms of the dynamical moments, J(2), are shown to exist. The
pairing correlations taken into account by using the particle-number-projection
technique are shown to increase the disagreement. Sources of these systematic
discrepancies are discussed -- they are most likely related to the yet not
optimal parametrization of the nuclear interactions used.
","[{""version"":""v1"",""created"":""Tue, 17 Dec 1996 14:40:34 GMT""}]","2009-10-30"
"physics/9612010",,"Ben Kristoffen","A New View of the Universe","95 pages PostScript, with 27 figures included. The fonts with
  Ghostscript 4.01 or higher will be more readable than earlier versions. The
  images for pages 10 and 12, the complete paper, and a PDF version are
  available at http://www.psych.ucsb.edu/~krogh/site.htm",,,,"physics.gen-ph",,"  A new, very different physical model of the universe is proposed. Its virtues
include unifying relativity and quantum mechanics, and particles with de
Broglie waves. It also appears to provide a truly unified physical basis for
electromagnetic, gravitational and nuclear forces. The basic system is a
four-dimensional Euclidean space, containing an array of nonlinear ""flow""
waves. These repeat in one dimension, called [phi]. As in Newtonian mechanics,
time is treated as an additional, unidirectional parameter describing the
evolution of the system. Nevertheless, this wave system is shown be inherently
relativistic. Further self-organizing patterns arise within the overall wave
structure. Called ""wavicles,"" these have intrinsic quantized fields, ""spin,""
and rest energy, and represent elementary particles. Relativistic expressions
are derived for particle behavior in scalar, vector and gravitational
potentials. Proper representations of these potentials, based on the wave
fields and associated [phi] flows of wavicles, are also obtained. As in the
causal quantum mechanics of de Broglie and Bohm, wavicles exist continuously
and follow definite, stochastic trajectories. Although experimentally
equivalent to Einstein's special relativity, this theory differs fundamentally
from his general relativity and the associated Big Bang model. According to
Linde, the latter predict a large-scale space-time curvature roughly 60 orders
of magnitude greater than observed values. Here a flat large-scale geometry is
predicted, in agreement with the observed distribution of galaxies. This theory
is also consistent with recent observations pertaining to the age of the
universe.
","[{""version"":""v1"",""created"":""Tue, 17 Dec 1996 09:22:47 GMT""}]","2008-02-03"
"q-alg/9612020","Ruibin Zhang","R. B. Zhang","Symmetrizable Quantum Affine Superalgebras And Their Representations","Latex, 14 pages",,"10.1063/1.531833",,"q-alg math.QA",,"  Aspects of the algebraic structure and representation theory of the quantum
affine superalgebras with symmetrizable Cartan matrices are studied. The
irreducible integrable highest weight representations are classified, and shown
to be deformations of their classical counterparts. It is also shown that Jimbo
type quantum affine superalgebras can be obtained by deforming universal
enveloping algebras of ordinary (i.e., non-graded) affine algebras supplemented
by certain parity operators.
","[{""version"":""v1"",""created"":""Tue, 17 Dec 1996 05:13:54 GMT""}]","2009-10-30"
"q-alg/9612021","Juan Carlos Perez Bueno","J. A. de Azcarraga, F. J. Herranz, J. C. Perez Bueno and M. Santander","Central Extensions of the Quasi-orthogonal Lie algebras","Latex file. 32 pages. Minor changes. To appear in J. Phys. A","J.Phys.A31:1373-1394,1998","10.1088/0305-4470/31/5/008","DAMTP-96-86","q-alg hep-th math-ph math.MP math.QA",,"  We determine the central extensions of a whole family of Lie algebras,
obtained by the method of graded contractions from so(N+1), N arbitrary. All
the inhomogeneous orthogonal and pseudo-orthogonal algebras are members of this
family, as well as a large number of other non-semisimple algebras, all of
which have at least a semidirect structure (in some cases two or more). The
dimensions of their second cohomology groups H^2(G,R) and the explicit
expression of their central extensions are given.
","[{""version"":""v1"",""created"":""Tue, 17 Dec 1996 09:54:56 GMT""},{""version"":""v2"",""created"":""Thu, 27 Nov 1997 16:12:19 GMT""}]","2008-11-26"
