"astro-ph/9602077",,"John Ellis","Astroparticle physics - A Personal Outlook","22 pages, Latex, 1 table and 20 figures as ps files. Invited talk
  presented at the IVth Workshop on Theoretical and Phenomenological Aspects of
  Underground Physics (TAUP 95), Toledo, Spain, September 1995 - to appear in
  the Proceedings","Nucl.Phys.Proc.Suppl.48:522-544,1996","10.1016/0920-5632(96)00306-4","CERN-TH. 96-10","astro-ph",,"  At the request of the organizers, this talk surveys some of the hot topics
discussed at this meeting, giving my {\it subjective views} on them. Subjects
covered include the present age and Hubble expansion rate of the Universe -
{\it inflation theorists need not yet abandon $\Omega = 1$}, theories of
structure formation in the light of COBE and other data - {\it my favourite is
a flat spectrum of initial perturbations subsequently amplified by mixed hot
and cold dark matter}, neutrino masses and oscillations - {\it the only
experimental indication I take seriously at the moment is the persistent solar
neutrino deficit}, the lightest supersymmetric particle - {\it which may behave
differently if conventional assumptions are relaxed}, and the axion - {\it much
of the window between limits from SN 1987a and cosmology will be explored in an
ongoing experiment}. Finally, I present a chronology of some possible
interesting future experiments.
","[{""version"":""v1"",""created"":""Thu, 15 Feb 1996 17:41:36 GMT""}]","2009-09-11"
"astro-ph/9602078","Karl Fisher","Karl B. Fisher, John N. Bahcall, Sofia Kirhakos and Donald P.
  Schneider","Galaxy Clustering Around Nearby Luminous Quasars","16 pages, 3 figures (included), 2 tables, Apj in press",,"10.1086/177708","IASSNS-AST-96/12","astro-ph",,"  We examine the clustering of galaxies around a sample of 20 luminous low
redshift (z<0.30) quasars observed with the Wide Field Camera-2 on the Hubble
Space Telescope. The HST resolution makes possible galaxy identification
brighter than V=23.5 and as close as 2'' to the quasar. We find a significant
enhancement of galaxies within a projected separation of < 100 kpc/h of the
quasars. If we model the qso/galaxy correlation function as a power law with a
slope given by the galaxy/galaxy correlation function, we find that the ratio
of the qso/galaxy to galaxy/galaxy correlation functions is $3.8\pm 0.8$. The
galaxy counts within r<15 kpc/h of the quasars are too high for the density
profile to have an appreciable core radius ( > 100 kpc). Our results reinforce
the idea that low redshift quasars are located preferentially in groups of
10-20 galaxies rather than in rich clusters. We see no significant difference
in the clustering amplitudes derived from radio-loud and radio-quiet
subsamples.
","[{""version"":""v1"",""created"":""Thu, 15 Feb 1996 19:13:56 GMT""}]","2016-08-30"
"astro-ph/9602079","David Merritt","David Merritt and Monica Valluri (Rutgers)","Chaos and Mixing in Triaxial Stellar Systems","42 TEX pages, 12 PostScript figures, uses AASTEX, epsf.sty. To appear
  in The Astrophysical Journal, November 1996, Volume 471",,"10.1086/177955","Rutgers Astrophysics Preprint Series No. 189","astro-ph",,"  We investigate the timescales for stochasticity and chaotic mixing in a
family of triaxial potentials that mimic the distribution of light in
elliptical galaxies. Some of the models include central point masses designed
to represent nuclear black holes. Most of the boxlike orbits are found to be
stochastic, with mean Liapunov times that are 3-6 times the period of the
long-axis orbit. In models with large cores or small black holes, the
stochastic orbits mimic regular box orbits for hundreds of oscillations at
least. However a small core radius or significant black hole mass causes most
of the stochastic orbits to diffuse through phase space on the same timescale,
visiting a significant fraction of the volume beneath the equipotential
surface. We estimate timescales for chaotic mixing in the more strongly
stochastic models by evolving ensembles of 10^4 points until their distribution
reaches a nearly steady state. Mixing initially takes place rapidly, with
characteristic times of 10-30 dynamical times, as the phase points fill a
region similar in shape to that of a box orbit. Subsequent mixing is slower,
with characteristic times of hundreds of orbital times. Mixing rates were found
to be enhanced by the addition of modest force perturbations. The consequences
for the structure and evolution of elliptical galaxies are discussed.
","[{""version"":""v1"",""created"":""Thu, 15 Feb 1996 21:45:52 GMT""},{""version"":""v2"",""created"":""Tue, 4 Jun 1996 16:15:17 GMT""}]","2009-10-28"
"astro-ph/9602080","Harald Ebeling","H. Ebeling, W. Voges, H. Boehringer, A.C. Edge, J.P. Huchra, U.G.
  Briel","Properties of the X-ray brightest Abell-type clusters of galaxies
  (XBACs) from ROSAT All-Sky Survey data --- I. The sample","LaTeX file, 21 pages, 28 PostScript figures, MN style and EPSF macros
  included, accepted for publication in MNRAS","Mon.Not.Roy.Astron.Soc.281:799-829,1996","10.1093/mnras/281.3.799",,"astro-ph",,"  We present an essentially complete, all-sky, X-ray flux limited sample of 242
Abell clusters of galaxies (six of which are double) compiled from ROSAT
All-Sky Survey data. Our sample is uncontaminated in the sense that systems
featuring prominent X-ray point sources such as AGN or foreground stars have
been removed. The sample is limited to high Galactic latitudes ($|b| \geq
20^{\circ}$), the nominal redshift range of the ACO catalogue of $z \leq 0.2$,
and X-ray fluxes above $5.0 \times 10^{-12}$ erg cm$^{-2}$ s$^{-1}$ in the 0.1
-- 2.4 keV band. Due to the X-ray flux limit, our sample consists, at
intermediate and high redshifts, exclusively of very X-ray luminous clusters.
Since the latter tend to be also optically rich, the sample is not affected by
the optical selection effects and in particular not by the volume
incompleteness known to be present in the Abell and ACO catalogues for richness
class 0 and 1 clusters.
  Our sample is the largest X-ray flux limited sample of galaxy clusters
compiled to date and will allow investigations of unprecedented statistical
quality into the properties and distribution of rich clusters in the local
Universe.
","[{""version"":""v1"",""created"":""Fri, 16 Feb 1996 01:41:00 GMT""}]","2015-06-24"
"astro-ph/9602081",,"Justino Martinez","Transport processes in anisotropic gravitational collapse","RevTex file, 42 pages. 13 postscript figures. Changes in some
  equations. General results and figures remain unchanged. (Guide to the
  changes is present in the header of the paper)","Phys.Rev.D53:6921-6940,1996","10.1103/PhysRevD.53.6921",,"astro-ph",,"  In this paper we introduce a new method to study the influence of thermal
conduction and viscous processes in anisotropic gravitational collapse. To this
end we employ the HJR method to solve the Einstein equations. The
Maxwell-Cattaneo type transport equations are used to find the temperature and
bulk and shear viscous pressures. Under some conditions Maxwell-Cattaneo
transport equations comply with relativistic causality. Thus, it is advisable
to use them instead of Eckart transport equations. In the inner layers of the
star the temperature ceases to be sensitive to the boundary condition. This
behavior, which can be explained in terms of the Eddington approximation,
allows us to find the thickness of the neutrinosphere. The dynamics of
collapsing dense stars is deeply influenced by the neutrino emission/absorption
processes. These cool the star and drive it to a new equilibrium state.
Therefore, the calculation of transport coefficients is based on these
processes.
","[{""version"":""v1"",""created"":""Fri, 16 Feb 1996 14:48:14 GMT""},{""version"":""v2"",""created"":""Thu, 29 Feb 1996 21:17:01 GMT""}]","2008-11-26"
"comp-gas/9602001","Bruce Boghosian","Bruce M. Boghosian, Jeffrey Yepez, Francis J. Alexander, Norman H.
  Margolus","Integer Lattice Gases","23 pages, LaTeX with six PostScript figures included using epsf",,"10.1103/PhysRevE.55.4137","BU-CCS-960101","comp-gas nlin.CG",,"  We generalize the hydrodynamic lattice gas model to include arbitrary numbers
of particles moving in each lattice direction. For this generalization we
derive the equilibrium distribution function and the hydrodynamic equations,
including the equation of state and the prefactor of the inertial term that
arises from the breaking of galilean invariance in these models. We show that
this prefactor can be set to unity in the generalized model, therby effectively
restoring galilean invariance. Moreover, we derive an expression for the
kinematic viscosity, and show that it tends to decrease with the maximum number
of particles allowed in each direction, so that higher Reynolds numbers may be
achieved. Finally, we derive expressions for the statistical noise and the
Boltzmann entropy of these models.
","[{""version"":""v1"",""created"":""Thu, 15 Feb 1996 19:42:58 GMT""}]","2009-10-28"
"cond-mat/9602089","Peter Nightingale","M. P. Nightingale ( Department of Physics, University of Rhode Island,
  Kingston RI, USA) H.W.J. Bloete ( Department of Applied Physics, Delft
  University of Technology, Delft, The Netherlands)","Transfer-Matrix Monte Carlo Estimates of Critical Points in the Simple
  Cubic Ising, Planar and Heisenberg Models",,,"10.1103/PhysRevB.54.1001",,"cond-mat",,"  The principle and the efficiency of the Monte Carlo transfer-matrix algorithm
are discussed. Enhancements of this algorithm are illustrated by applications
to several phase transitions in lattice spin models. We demonstrate how the
statistical noise can be reduced considerably by a similarity transformation of
the transfer matrix using a variational estimate of its leading eigenvector, in
analogy with a common practice in various quantum Monte Carlo techniques. Here
we take the two-dimensional coupled $XY$-Ising model as an example.
Furthermore, we calculate interface free energies of finite three-dimensional
O($n$) models, for the three cases $n=1$, 2 and 3. Application of finite-size
scaling to the numerical results yields estimates of the critical points of
these three models. The statistical precision of the estimates is satisfactory
for the modest amount of computer time spent.
","[{""version"":""v1"",""created"":""Thu, 15 Feb 1996 16:50:15 GMT""}]","2009-10-28"
"cond-mat/9602090","Omri Gat","Omri Gat and Zeev Olami (Chemical Physics Dept., Weizmann Institute,
  Israel)","High dimensional properties of quenched noise growth models","5 pages, REVTeX",,,,"cond-mat adap-org nlin.AO",,"  We discuss the behavior of bounded slope quenched noise invasion models in
high dimensions. We first observe that the roughness of such a steady state
interface is generated by the combination of the roughness of the invasion
process $\chi_c$ and the roughness of the underlying interface dynamics. In
high enough dimension we argue that $\chi_c$ decreases to zero. This defines a
critical dimension for the problem, over which it reduces to the correlated
annealed dynamics, which we show to have the same roughness as the annealed
equation at five dimensions. We argue that on the Cayley tree with one
additional height coordinate the associated processes are fractal. The critical
behavior is anomalous due to strong effects of rare events. Numerical
simulations of the model on a Cayley tree and high dimensional lattices support
those theoretical predictions.
","[{""version"":""v1"",""created"":""Thu, 15 Feb 1996 17:21:33 GMT""}]","2008-02-03"
"cond-mat/9602091","Nick Witte","Lloyd C.L. Hollenberg (1) and N.S. Witte (1) ( (1) Research Centre for
  High Energy Physics, School of Physics, University of Melbourne )","Analytic Solution for the Ground State Energy of the Extensive Many-Body
  Problem","10 pages REVTex3.0, 3 PS figures",,"10.1103/PhysRevB.54.16309","UMP-95-65","cond-mat",,"  A closed form expression for the ground state energy density of the general
extensive many-body problem is given in terms of the Lanczos tri-diagonal form
of the Hamiltonian. Given the general expressions of the diagonal and
off-diagonal elements of the Hamiltonian Lanczos matrix, $\alpha_n(N)$ and
$\beta_n(N)$, asymptotic forms $\alpha(z)$ and $\beta(z)$ can be defined in
terms of a new parameter $z\equiv n/N$ ($n$ is the Lanczos iteration and $N$ is
the size of the system). By application of theorems on the zeros of orthogonal
polynomials we find the ground-state energy density in the bulk limit to be
given in general by ${\cal E}_0 = {\rm inf}\,\left[\alpha(z) -
2\,\beta(z)\right]$.
","[{""version"":""v1"",""created"":""Fri, 16 Feb 1996 03:02:12 GMT""}]","2009-10-28"
"cond-mat/9602092","Bosiljka Tadic","Bosiljka Tadic and Ramakrishna Ramaswamy","Role of Defects in Self-Organized Criticality: A Directed Coupled Map
  Lattice Model","6 pages, Revtex 3.0, 7 figures available by request on
  bosiljka.tadic@ijs.si, uuencoded compressed","Phys. Rev. E 54, 3157 (1996)","10.1103/PhysRevE.54.3157","IJS-TP/96-03","cond-mat",,"  We study a directed coupled map lattice model in two dimensions, with two
degrees of freedom associated with each lattice site. The two freedoms are
coupled at a fraction $c$ of lattice bonds acting as quenched random defects.
In the case of conservative dynamics, at any concentration of defects the
system reaches a self-organized critical state with universal critical
exponents close to the mean-field values. The probability distributions follow
the general scaling form $P(X,L)= L^{-\alpha}{\cal{P}}(XL^{-D_X})$, where
$\alpha \approx 1$ is the scaling exponent for the distribution of avalanche
lengths, $X$ stands for duration, size or released energy, and $D_X$ is the
fractal dimension with respect to $X$. The distribution of current is
nonuniversal, and does not show any apparent scaling form. In the case of
nonconservative dynamics---obtained by incomplete energy transfer at the defect
bonds--- the system is driven out of the critical state. In the scaling region
close to $c=0$ the probability distributions exhibit the general scaling form
$P(X,c,L)=X^{-\tau _X }{\cal{P}}(X/\xi _X (c), XL^{-D_X})$, where $\tau _X
=\alpha /D_X$ and the coherence length $\xi_X (c)$ depends on the concentration
of defect bonds $c$ as $\xi _X (c)\sim c^{-D_X}$.
","[{""version"":""v1"",""created"":""Fri, 16 Feb 1996 10:40:16 GMT""}]","2009-10-28"
"cond-mat/9602093",,"James T. Liu (Rockefeller) and D. F. Wang (ETH-L)","Integrable SU(m|n) supersymmetric electronic models of strong
  correlations","24 pages, Latex",,"10.1142/S0217979296002002","RU96-2-B; ETH-Lausanne; submitted to Int. J. Mod. Phys. B","cond-mat",,"  We generalize the SU(2|2) supersymmetric extended Hubbard model of 1/r2
interaction to the SU(m|n) supersymmetric case. Integrable models may be
defined on both uniform lattice and non-uniform one dimensional lattices. We
study both cases in detail and present the ground state wavefunctions and
energy spectra of these models.
","[{""version"":""v1"",""created"":""Fri, 16 Feb 1996 12:33:22 GMT""}]","2015-06-25"
"cond-mat/9602096","Ariel Dobry","A. Greco and A.Dobry","Stability of correlated electronic systems under the influence of the
  electron-phonon interaction","10 pages, 2 Postscript figures",,"10.1016/0038-1098(96)00307-9",,"cond-mat",,"  We have used an exact diagonalization technique to study the stability of the
$t-J$-Holstein and Hubbard-Holstein models under the influence of the
electron-phonon interaction. Previous results have been obtained using
frozen-phonon technique or introducing only a few dynamical phonon modes due to
the large Hilbert space. To check these results we have done exact
diagonalization in a small cluster (four sites) including all the phonon modes
allowed by symmetry. We compare our results with those obtained by using the
adiabatic approximation.
","[{""version"":""v1"",""created"":""Fri, 16 Feb 1996 12:50:00 GMT""}]","2009-10-28"
"cond-mat/9602111","H. N. Ghosh","S. N. Behera, Umesh. A. Salian, Haranath Ghosh","Raman scattering in high temperature superconductors : An integrated
  view","To appear in Physica B (1996). Invited talk presented by S. N.
  Behera, Latex file in revtex style, six figures available on request to first
  author (e-mail : snb@iopb.ernet.in)",,"10.1016/0921-4526(96)00158-5","IP-BBSR/'95-102","cond-mat",,"  The common features in the Raman data of high temperature superconductors:
(the cuprates, bismathates, alkali doped fullerides and some organic
superconductors), are analyzed. It was shown that qualitative understanding of
the data can be achieved in terms of non-Fermi liquid models for their normal
state, with appropiate bag mechanisms for the superconducting state.
","[{""version"":""v1"",""created"":""Fri, 16 Feb 1996 08:42:49 GMT""}]","2009-10-28"
"hep-ex/9602006","Carmit Sahar","Halina Abramowicz (1 and 2), David Horn (1), Ury Naftaly (1), Carmit
  Sahar-Pikielny (1) ((1) School of Physics and Astronomy, Tel Aviv University,
  (2) Deutches Elektronen-Synchrotron DESY, Hamburg)","An Orientation Selective Neural Network and its Application to Cosmic
  Muon Identification","19 pages, 10 Postrcipt figures","Nucl.Instrum.Meth. A378 (1996) 305-311","10.1016/0168-9002(96)00417-2","DESY-96-009","hep-ex",,"  We propose a novel method for identification of a linear pattern of pixels on
a two-dimensional grid. Following principles employed by the visual cortex, we
employ orientation selective neurons in a neural network which performs this
task. The method is then applied to a sample of data collected with the ZEUS
detector at HERA in order to identify cosmic muons which leave a linear pattern
of signals in the segmented uranium-scintillator calorimeter. A two dimensional
representation of the relevant part of the detector is used. The results
compared with a visual scan point to a very satisfactory cosmic muon
identification. The algorithm performs well in the presence of noise and pixels
with limited efficiency. Given its architecture, this system becomes a good
candidate for fast pattern recognition in parallel processing devices.
","[{""version"":""v1"",""created"":""Thu, 15 Feb 1996 16:29:55 GMT""}]","2009-10-28"
"hep-lat/9602018",,"Artan Borici (Swiss Center for Scintific Computing (SCSC), ETH-Zurich)","Theoretical analysis of multi-boson algorithm with local and global
  update of bosonic fields","9 pages LaTex, 3 figures",,,,"hep-lat cond-mat",,"  We estimate theoretically the cost of the multi-boson method in the
non-hermitian approximation. It is shown that it is proportional to $V(\log
V)^2/m^4$. For a global update of the scalar fields the cost decreases by a
factor $m$ with a $\log V$ overhead.
","[{""version"":""v1"",""created"":""Thu, 15 Feb 1996 21:44:10 GMT""}]","2007-05-23"
"hep-lat/9602019","Thomas Lippert","S. Fischer, A. Frommer, U. Glaessner, Th. Lippert, G. Ritzenhoefer,
  and K. Schilling","A Parallel SSOR Preconditioner for Lattice QCD","21 pages, Tex-file + Postscript figures","Comput.Phys.Commun. 98 (1996) 20-34","10.1016/0010-4655(96)00089-6","WUB 96-1, HLRZ 4/96","hep-lat",,"  We present a parallelizable SSOR preconditioning scheme for Krylov subspace
iterative solvers which proves to be efficient in lattice QCD applications
involving Wilson fermions. Our preconditioner is based on a locally
lexicographic ordering of the lattice points. In actual hybrid Monte Carlo
applications with the bi-conjugate gradient stabilized method BiCGstab, we
achieve a gain factor of about 2 in the number of iterations compared to
conventional odd-even preconditioning. Whether this translates into similar
reductions in run time will depend on the parallel computer in use. We discuss
implementation issues using the `Eisenstat-trick' and machine specific
advantages of the method for the APE100/Quadrics parallel computer. In a full
QCD simulation with Wilson fermions on a 512-processor Quadrics QH4 we find a
gain in cpu-time of a factor of 1.7 over odd-even preconditioning for a 24^3 x
40 lattice.
","[{""version"":""v1"",""created"":""Thu, 15 Feb 1996 22:41:22 GMT""}]","2009-10-28"
"hep-lat/9602020","Christine Davies","C.T.H.Davies, K.Hornbostel, G.P.Lepage, A.J.Lidsey, J.Shigemitsu,
  J.Sloan","$B_c$ Spectroscopy from Lattice QCD","12 pages uuencoded latex file + 1 postscript figure","Phys.Lett. B382 (1996) 131-137","10.1016/0370-2693(96)00650-8",,"hep-lat hep-ph",,"  We present first results for $B_c$ spectroscopy using Lattice
Non-Relativistic QCD (NRQCD). For the NRQCD action the leading order
spin-dependent and next to leading order spin-independent interactions have
been included with tadpole-improved coefficients. We use multi-exponential fits
to multiple correlation functions to extract ground and excited $S$ states and
give accurate values for the $S$ state hyperfine splitting and the P state
($B^{**}_c$) fine structure, including the effects of $^1P_1/^3P_1$ mixing.
","[{""version"":""v1"",""created"":""Fri, 16 Feb 1996 13:55:02 GMT""}]","2019-08-17"
"hep-ph/9602322","Svjetlana Fajfer, Ijs","S. Fajfer","Long distance contribution to $K^+ \to \pi^+ \nu {\bar \nu}$ decay and
  $O(p^4)$ terms in CHPT","12 pages, 1 figure (available upon request)","Nuovo Cim. A110 (1997) 397-404","10.1007/BF03035889","HU-SEFT R 1996-05, IJS-TP-96/3","hep-ph",,"  The long distance contribution to $K^+ \to \pi^+ \nu {\bar \nu} $ is
calculated using chiral perturbation theory. The leading contribution comes
from $O(p^4)$ tree terms. The branching ratio of the $O(p^4)$ long distance
contribution is found to be of order $10_{-3}$ smaller than the short distance
contributions.
","[{""version"":""v1"",""created"":""Thu, 15 Feb 1996 18:01:49 GMT""}]","2009-10-28"
"hep-ph/9602323","Patricia Ball","P. Ball, V.M. Braun","The $\rho$ Meson Light-Cone Distribution Amplitudes of Leading Twist
  Revisited","21 pages, latex2e, requires a4wide.sty and epsf.sty, 6 PS figures
  included","Phys. Rev. D 54, 2182 (1996)","10.1103/PhysRevD.54.2182","CERN-TH/96-12","hep-ph",,"  We give a complete re-analysis of the leading twist quark-antiquark
light-cone distribution amplitudes of longitudinal and transverse $\rho$
mesons. We derive Wandzura-Wilczek type relations between different
distributions and update the coefficients in their conformal expansion using
QCD sum rules including next-to-leading order radiative corrections. We find
that the distribution amplitudes of quarks inside longitudinally and
transversely polarized $\rho$ mesons have a similar shape, which is in
contradiction to previous analyses.
","[{""version"":""v1"",""created"":""Thu, 15 Feb 1996 23:31:37 GMT""}]","2016-08-24"
"hep-ph/9602324","Nikolai Uraltsev","N.G. Uraltsev","On the Problem of Boosting Nonleptonic b Baryon Decays","8 pages, one figure. LaTeX. Revised: More general inequality is
  stated which applies to <p^4> in baryons as well. Explicit expression for the
  hybrid renormalization used is quoted","Phys.Lett. B376 (1996) 303-308","10.1016/0370-2693(96)00305-X","CERN-TH/96-40","hep-ph",,"  The constituent picture of hadrons implies certain quantum mechanical
inequalities which must hold in the potential models. Basing on this
qualitative consideration I argue that it is not easy to increase significantly
the scale of the flavor-dependent 1/m_b^3 effects within the heavy quark
expansion preserving the conventional constituent picture of heavy flavor
hadrons. I briefly address the physical consequences one might expect if the
effects of weak scattering and interference are attempted to be pushed above
the 10% level within 1/m_b expansion not invoking qualitatively different
mechanisms including violations of duality.
","[{""version"":""v1"",""created"":""Fri, 16 Feb 1996 00:18:41 GMT""},{""version"":""v2"",""created"":""Sun, 18 Feb 1996 17:43:01 GMT""},{""version"":""v3"",""created"":""Mon, 19 Feb 1996 13:50:46 GMT""}]","2009-10-28"
"hep-ph/9602325",,"Zurab Berezhiani","Fermion Masses and Mixing in SUSY GUT","36 pages, Latex",,,"INFN-FE 21/95","hep-ph",,"  The problem of fermion masses and mixings is discussed in the context of
supersymmetric grand unification theories. Some predictive frameworks based on
the $SU(5)$, $SO(10)$ and $SU(6)$ models are reviewed. [Based on lectures
delivered at the ICTP Summer School on `High Energy Physics and Cosmology',
Trieste, Italy, 3-28 July 1995 (to appear on Proceedings), and XIX Int.
Conference on {\em Particle Physics and Astrophysics in the Standard Model and
Beyond}, Bystra, Poland, 19-26 September 1995]
","[{""version"":""v1"",""created"":""Fri, 16 Feb 1996 00:57:08 GMT""}]","2007-05-23"
