"hep-ph/9602326",,"Z.G. Berezhiani","Astrophysical Implications of the Mirror World with Broken Mirror Parity","12 pages, Latex","Acta Phys.Polon. B27 (1996) 1503-1516",,"INFN-FE 01/96","hep-ph astro-ph",,"  We discuss the physics of the mirror (shadow) world which is completely
analogous to the visible one except that its `weak' scale is larger by one or
two orders of magnitude than the weak scale in the standard model. The mirror
neutrinos can mix the ordinary ones through the Planck scale induced higher
order operators, which can help to reconcile the present neutrino puzzles that
are the solar and atmospheric neutrino deficits, the recent LSND anomaly and
the need in the $\sim$ eV mass neutrino as the hot dark matter. In particular,
oscillation of $\nu_e$ into its mirror partner $\nu'_e$ emerges with parameters
naturally in the MSW range. The nucleosynthesis constraint on the extra light
particle species can be fulfilled by assuming the asymmetric postinflationary
reheating between the usual and mirror worlds. One implication of our proposal
is that bulk of the dark matter in the universe may be a warm dark matter
consisting of the keV range mirror neutrinos rather than the conventional cold
dark matter, while the mirror baryons can also contribute as dissipative dark
matter. Implications of the mirror Machos for microlensing experiments are also
discussed. [Talk given at the XIX int. conference on `Particle Physics and
Astrophysics in the Standard Model and Beyond', Bystra, Poland, 19-26 September
1995 (to appear on Proceedings). Based on refs. \cite{BM,BDM} done in
collaboration with A.D. Dolgov and R.N. Mohapatra]
","[{""version"":""v1"",""created"":""Fri, 16 Feb 1996 00:57:39 GMT""}]","2007-05-23"
"hep-ph/9602327","Renard Fernand Michel","J. Layssac, G. Montagna, O. Nicrosini, F. Piccinini, F.M. Renard and
  C. Verzegnassi","Z' Reservation at LC2000","9 pages with 3 figures included. (e-mail
  renard@lpmsun2.lpm.univ-montp2.fr)",,,"PM/96-09","hep-ph",,"  We consider the possibility that one extra $Z\equiv Z'$ exists with a mass of
more then two TeV and fermion couplings that do not violate (charged) lepton
universality. We show that, in such a situation, a functional relationship is
generated between the \underline{deviations} from the SM values of three
leptonic observables of two-fermion production at LC 2000 that is completely
independent of the values of the $Z'$ mass and couplings. This selects a
certain region in the 3-d space of the deviations ($Z'$ ""reservation"") that is
\underline{characteristic} of the model and that would have no observable
intersection with analogous regions corresponding to other interesting models
of new physics.
","[{""version"":""v1"",""created"":""Fri, 16 Feb 1996 08:15:23 GMT""}]","2007-05-23"
"hep-ph/9602328","Renard Fernand Michel","P. Chiappetta, F.M. Renard and C. Verzegnassi","Anomalous $Z'$ effects in the WW channel at $LC 2000$","9 pages. (e-mail renard@lpmsun2.lpm.univ-montp2.fr)",,,"PM/96-10, CPT-95/P.3317","hep-ph",,"  We consider the virtual signals of a $Z'$ of very general type in the process
$e^+e^-\to W^+W^-$ at a future linear $e^+e^-$ collider of 2000 GeV c.m. energy
($LC2000$). We show that possible deviations from the SM predictions in this
channel are related to similar deviations in the purely leptonic one in a way
that is only characteristic of this $Z'$ model, and not in general of possible
competitor models with anomalous gauge couplings.
","[{""version"":""v1"",""created"":""Fri, 16 Feb 1996 09:58:39 GMT""}]","2007-05-23"
"hep-ph/9602329","Sridhar K.","K. Sridhar (TIFR, Bombay, India)","Charmonium Production at the LHC","9 pages including 2 postscript figures","Mod.Phys.Lett. A11 (1996) 1555-1562","10.1142/S0217732396001545","TIFR/TH/96-07","hep-ph",,"  The analyses of large transverse momentum charmonium production at the
Tevatron have shown that fragmentation of gluons is an important production
mechanism. We study large-$p_T$ charmonium production in $pp$ collisions at the
LHC, and find that due to the copious gluon production at this energy, the
gluon fragmentation contribution completely overwhelms the fusion contribution
and the charm quark fragmentation contribution. Our analysis shows that for
$J/\psi$ production at the LHC, there is a significant event rate even for $p_T
\sim$~100~GeV. The measurement of the cross-section at such large values of
$p_T$ will provide a very important test of the fragmentation mechanism.
","[{""version"":""v1"",""created"":""Fri, 16 Feb 1996 15:35:39 GMT""}]","2015-06-25"
"hep-th/9602079","Ivanov Evgenyi","Evgeny A. Ivanov","Harmonic Superspace: Some New Trends","11 pages, LaTeX, Talk given at the 1st Joint JINR-ROC (Taiwan)
  Workshop ``Intermediate and High Energy Physics'', June 26-28, 1995, Dubna,
  Russia (to be published in Chinese Journal of Physics)","Chin.J.Phys.34:862-873,1996",,,"hep-th",,"  We give a brief account of two recent applications of the harmonic superspace
method: (i) an off-shell description of torsionful $(4,4)$ supersymmetric $2D$
sigma models in the framework of $SU(2)\times SU(2)$ harmonic superspace and
(ii) the harmonic superspace formulation of ``small'' $N=4$ $SU(2)$
superconformal algebra and the related super KdV hierarchy.
","[{""version"":""v1"",""created"":""Thu, 15 Feb 1996 16:32:45 GMT""}]","2011-04-15"
"hep-th/9602081","Kostas Orginos","Haralambos Marmanis(Brown Un.)","On the analogy between electromagnetism and turbulent hydrodynamics","14 pages",,,,"hep-th",,"  In this note, we propose an exegesis of the Maxwell equations for
electromagnetism. We begin with an analogy between the homogeneous Maxwell
equations and the equations needed to describe the vorticity field of an
incompressible inviscid fluid. We suggest that the inhomogeneous equations are
analogous to two equations valid in turbulent hydrodynamics. Once the analogy
is completed we give the mechanical analogue of the Poynting vector and we
explain the influence of a long solenoid on the motion of a charged particle.
","[{""version"":""v1"",""created"":""Thu, 15 Feb 1996 16:01:21 GMT""}]","2007-05-23"
"hep-th/9602082","Adel Bilal","Frank Ferrari and Adel Bilal (ENS Paris)","The Strong-Coupling Spectrum of the Seiberg-Witten Theory","19 pages, uses PHYZZX, references changed and minor corrections,
  version published in Nuclear Physics B","Nucl.Phys. B469 (1996) 387-402","10.1016/0550-3213(96)00150-2","LPTENS-96/16","hep-th",,"  We carefully study the global structure of the solution of the $N=2$
supersymmetric pure Yang-Mills theory with gauge group $SU(2)$ obtained by
Seiberg and Witten. We exploit its ${\bf Z}_2$-symmetry and describe the curve
in moduli space where BPS states can become unstable, separating the
strong-coupling from the weak-coupling region. This allows us to obtain the
spectrum of stable BPS states in the strong-coupling region: we prove that only
the two particles responsible for the singularities of the solution (the
magnetic monopole and the dyon of unit electric charge) are present in this
region. Our method also permits us to very easily obtain the well-known
weak-coupling spectrum, without using semi-classical methods. We discuss how
the BPS states disintegrate when crossing the border from the weak to the
strong-coupling region.
","[{""version"":""v1"",""created"":""Thu, 15 Feb 1996 16:25:27 GMT""},{""version"":""v2"",""created"":""Wed, 21 Feb 1996 14:56:09 GMT""},{""version"":""v3"",""created"":""Thu, 13 Jun 1996 12:40:22 GMT""}]","2009-10-30"
"hep-th/9602083",,"Emili Bagan, Martin Lavelle and David McMullan","An Infra-Red Finite Electron Propagator","22 pages, plain TeX, 2 figures, needs epsf.tex. Version to appear in
  Physical Review D: title changed, introduction and conclusions modified,
  extra references and some typos corrected","Phys.Rev. D56 (1997) 3732-3743","10.1103/PhysRevD.56.3732","UAB-FT-384, PLY-MS-96-01","hep-th hep-ph",,"  We investigate the properties of a dressed electron which reduces, in a
particular class of gauges, to the usual fermion. A one loop calculation of the
propagator is presented. We show explicitly that an infra-red finite,
multiplicative, mass shell renormalisation is possible for this dressed
electron, or, equivalently, for the usual fermion in the abovementioned gauges.
The results are in complete accord with previous conjectures.
","[{""version"":""v1"",""created"":""Thu, 15 Feb 1996 17:00:10 GMT""},{""version"":""v2"",""created"":""Fri, 27 Jun 1997 17:05:56 GMT""}]","2009-10-30"
"hep-th/9602084","Alexandros Kehagias","Alexandros A. Kehagias and Andre Lukas","$O(d,d)$ Symmetry in Quantum Cosmology","16 pages, latex, no figures. No changes at all. Replaced due to a .ps
  file problem","Nucl.Phys. B477 (1996) 549-566","10.1016/0550-3213(96)00393-8","TUM-HEP 237/96, SFB-375/29","hep-th gr-qc",,"  We analyze the quantum cosmology of one--loop string effective models which
exhibit an $O(d,d)$ symmetry. It is shown that due to the large symmetry of
these models the Wheeler--de Witt equation can completely be solved. As a
result, we find a basis of solutions with well defined transformation
properties under $O(d,d)$ and under scale factor duality in particular. The
general results are explicitly applied to 2--dimensional target spaces while
some aspects of higher dimensional cases are also discussed. Moreover, a
semiclassical wave function for the 2-dimensional black hole is constructed as
a superposition of our basis.
","[{""version"":""v1"",""created"":""Thu, 15 Feb 1996 17:31:50 GMT""},{""version"":""v2"",""created"":""Fri, 16 Feb 1996 17:21:04 GMT""}]","2009-10-30"
"hep-th/9602085","Achim Kempf","Achim Kempf (DAMTP, Cambridge, U.K.)","On Quantum Field Theory with Nonzero Minimal Uncertainties in Positions
  and Momenta","LaTex, 32 pages","J.Math.Phys. 38 (1997) 1347-1372","10.1063/1.531814","DAMTP/96-22","hep-th math.QA q-alg",,"  We continue studies on quantum field theories on noncommutative geometric
spaces, focusing on classes of noncommutative geometries which imply
ultraviolet and infrared modifications in the form of nonzero minimal
uncertainties in positions and momenta. The case of the ultraviolet modified
uncertainty relation which has appeared from string theory and quantum gravity
is covered. The example of euclidean $\phi^4$-theory is studied in detail and
in this example we can now show ultraviolet and infrared regularisation of all
graphs.
","[{""version"":""v1"",""created"":""Thu, 15 Feb 1996 18:07:49 GMT""}]","2009-10-30"
"hep-th/9602086",,"Hisamitsu Mukaida, Yujiro Shimada","Convex effective potential of $O(N)$-symmetric $phi^4$ theory for large
  $N$","New results on finite-size system are added. LaTeX, 21 pages, 6
  figures","Nucl.Phys. B479 (1996) 663-682","10.1016/0550-3213(96)00403-8","INS-Rep.-1133, UT-Komaba~96-1","hep-th",,"  We obtain effective potential of $O(N)$-symmetric $\phi^4$ theory for large
$N$ starting with a finite lattice system and taking the thermodynamic limit
with great care. In the thermodynamic limit, it is globally real-valued and
convex in both the symmetric and the broken phases. In particular, it has a
flat bottom in the broken phase. Taking the continuum limit, we discuss
renormalization effects to the flat bottom and exhibit the effective potential
of the continuum theory in three and four dimensions.On the other hand the
effective potential is nonconvex in a finite lattice system. Our numerical
study shows that the barrier height of the effective potential flattens as a
linear size of the system becomes large. It decreases obeying power law and the
exponent is about $-2$. The result is clearly understood from dominance of
configurations with slowly-rotating field in one direction.
","[{""version"":""v1"",""created"":""Fri, 16 Feb 1996 04:30:36 GMT""},{""version"":""v2"",""created"":""Thu, 14 Mar 1996 06:00:53 GMT""},{""version"":""v3"",""created"":""Wed, 24 Jul 1996 13:02:08 GMT""}]","2009-10-30"
"hep-th/9602087",":","M. Gasperini, J. Maharana and G. Veneziano","Graceful exit in quantum string cosmology","16 pages, LATEX. A complete collection of papers and references on
  the pre-big-bang scenario in string cosmology is available at
  http://www.to.infn.it/teorici/gasperini/","Nucl.Phys. B472 (1996) 349-360","10.1016/0550-3213(96)00201-5","CERN-TH/96-32","hep-th astro-ph gr-qc",,"  We write an O(d,d)-covariant Wheeler-De Witt equation in the
($d^2+1$)-dimensional minisuperspace of low-energy cosmological string
backgrounds. We discuss explicit examples of transitions between two
duality-related cosmological phases, and we find a finite quantum transition
probability even when the two phases are classically separated by a curvature
singularity. This quantum approach is completely free from operator ordering
ambiguities as a consequence of the duality symmetries of the string effective
action.
","[{""version"":""v1"",""created"":""Fri, 16 Feb 1996 12:06:35 GMT""}]","2009-10-30"
"hep-th/9602088","Cihan Saclioglu","Serdar Nergiz and Cihan Saclioglu","Liouville Vortex And $\varphi^{4}$ Kink Solutions Of The Seiberg--Witten
  Equations","14 pages, Latex","J.Math.Phys. 37 (1996) 3753-3759","10.1063/1.531628","MRC.PH.TH.-1-96","hep-th",,"  The Seiberg--Witten equations, when dimensionally reduced to $\bf R^{2}\mit$,
naturally yield the Liouville equation, whose solutions are parametrized by an
arbitrary analytic function $g(z)$. The magnetic flux $\Phi$ is the integral of
a singular Kaehler form involving $g(z)$; for an appropriate choice of $g(z)$ ,
$N$ coaxial or separated vortex configurations with $\Phi=\frac{2\pi N}{e}$ are
obtained when the integral is regularized. The regularized connection in the
$\bf R^{1}\mit$ case coincides with the kink solution of $\varphi^{4}$ theory.
","[{""version"":""v1"",""created"":""Fri, 16 Feb 1996 12:07:50 GMT""}]","2009-10-30"
"hep-th/9602089",,"M.Bordag, K.Kirsten and J.S.Dowker","Heat-kernels and functional determinants on the generalized cone","26p,LaTeX.(Cosmetic changes and eqns (9.8),(11.2) corrected.)","Commun.Math.Phys. 182 (1996) 371-394","10.1007/BF02517895","MUTP/96/10","hep-th",,"  We consider zeta functions and heat-kernel expansions on the bounded,
generalized cone in arbitrary dimensions using an improved calculational
technique. The specific case of a global monopole is analysed in detail and
some restrictions thereby placed on the $A_{5/2}$ coefficient. The computation
of functional determinants is also addressed. General formulas are given and
known results are incidentally, and rapidly, reproduced.
","[{""version"":""v1"",""created"":""Fri, 16 Feb 1996 14:51:40 GMT""},{""version"":""v2"",""created"":""Fri, 1 Mar 1996 13:54:08 GMT""}]","2009-10-30"
"mtrl-th/9602002","Roman Martonak","R. Martonak, E. Tosatti","Third order dielectric susceptibility in a model quantum paraelectric","22 pages",,"10.1103/PhysRevB.54.15714","ICTP Trieste Condensed Matter preprint, 1996","mtrl-th cond-mat.mtrl-sci",,"  In the context of perovskite quantum paraelectrics, we study the effects of a
quadrupolar interaction $J_q$, in addition to the standard dipolar one $J_d$.
We concentrate here on the nonlinear dielectric response $\chi_{P}^{(3)}$, as
the main response function sensitive to quadrupolar (in our case
antiquadrupolar) interactions. We employ a 3D quantum four-state lattice model
and mean-field theory. The results show that inclusion of quadrupolar coupling
of moderate strength ($J_q \sim {{1}\over{4}} J_d$) is clearly accompanied by a
double change of sign of $\chi_{P}^{(3)}$ from negative to positive, near the
quantum temperature $T_Q$ where the quantum paraelectric behaviour sets in. We
fit our $\chi_{P}^{(3)}$ to recent experimental data for SrTiO$_3$, where the
sign change is identified close to $T_Q \sim 37 K$.
","[{""version"":""v1"",""created"":""Thu, 15 Feb 1996 16:57:05 GMT""}]","2009-10-30"
"nucl-th/9602027","Dmitri Kharzeev","D. Kharzeev","Can Gluons Trace Baryon Number?","12 pages, LaTeX, figures available upon request","Phys.Lett. B378 (1996) 238-246","10.1016/0370-2693(96)00435-2","CERN-TH/95-343, BI-TP 95/42","nucl-th hep-ph",,"  QCD as a gauge non-Abelian theory imposes severe constraints on the structure
of the baryon wave function. We point out that, contrary to a widely accepted
belief, the traces of baryon number in a high-energy process can reside in a
non-perturbative configuration of gluon fields, rather than in the valence
quarks. We argue that this conjecture can be tested experimentally, since it
can lead to substantial baryon asymmetry in the central rapidity region of
ultra-relativistic nucleus-nucleus collisions.
","[{""version"":""v1"",""created"":""Thu, 15 Feb 1996 18:09:41 GMT""}]","2009-10-30"
"q-alg/9602025","Jean-Yves Thibon","Bernard Leclerc and Jean-Yves Thibon","Canonical bases of q-deformed Fock spaces","7 pages, LaTex",,,,"q-alg math.QA",,"  We define a canonical basis of the $q$-deformed Fock space representation of
the affine Lie algebra $\glchap_n$. We conjecture that the entries of the
transition matrix between this basis and the natural basis of the Fock space
are $q$-analogues of decomposition numbers of the $v$-Schur algebras for $v$
specialized to a $n$th root of unity.
","[{""version"":""v1"",""created"":""Fri, 16 Feb 1996 09:16:31 GMT""}]","2008-02-03"
