"hep-th/9604125","Mike Strickland","Sen-Ben Liao, Michael Strickland","Dimensional Crossover and Effective Exponents","24 pages, TeX, 8 figures in separate file, Updated version to appear
  in Nucl. Phys. B","Nucl.Phys.B497:611-638,1997","10.1016/S0550-3213(97)00212-5","DUKE-TH-95-101","hep-th cond-mat",,"  We investigate the critical behavior of the lambda phi^4 theory defined on
S^1 x R^d having two finite length scales beta, the circumference of S^1, and
k^{-1}, the blocking scale introduced by the renormalization group
transformation. By numerically solving the coupled differential RG equations
for the finite-temperature blocked potential U_{beta,k}(Phi) and the
wavefunction renormalization constant Z_{beta,k}(Phi), we demonstrate how the
finite-size scaling variable betabar = beta k determines whether the phase
transition is (d+1)- or d-dimensional in the limits betabar >> 1 and betabar <<
1, respectively. For the intermediate values of betabar, finite-size effects
play an important role. We also discuss the failure of the polynomial expansion
of the effective potential near criticality.
","[{""version"":""v1"",""created"":""Mon, 22 Apr 1996 02:00:08 GMT""},{""version"":""v2"",""created"":""Mon, 7 Apr 1997 18:53:49 GMT""}]","2008-11-26"
"hep-th/9604126","Theodora Ioannidou","Theodora Ioannidou","Soliton Solutions and Nontrivial Scattering in an Integrable Chiral
  Model in (2+1) Dimensions","21 pages + 9 figures, LaTex (fingures are not included), to appear in
  Journal of Mathematical Physics","J.Math.Phys. 37 (1996) 3422-3441","10.1063/1.531573","DTP 96/09","hep-th",,"  The behaviour of solitons in integrable theories is strongly constrained by
the integrability of the theory; i.e. by the existence of an infinite number of
conserved quantities which these theories are known to possess. One usually
expects the scattering of solitons in such theories to be rather simple, i.e.
trivial. By contrast, in this paper we generate new soliton solutions for the
planar integrable chiral model whose scattering properties are highly
nontrivial; more precisely, in head-on collisions of $N$ indistinguishable
solitons the scattering angle (of the emerging structures relative to the
incoming ones) is $\pi/N$. We also generate soliton-antisoliton solutions with
elastic scattering; in particular, a head-on collision of a soliton and an
antisoliton resulting in $90^0$ scattering.
","[{""version"":""v1"",""created"":""Sun, 21 Apr 1996 17:24:31 GMT""}]","2009-10-30"
"hep-th/9604127",,"H. Lu, S. Mukherji, C.N. Pope amd J. Rahmfeld","Loop-corrected Entropy of Near-extremal Dilatonic $p$-branes","Latex, 12 pages, no figures, minor changes","Phys.Lett.B389:248-254,1996","10.1016/S0370-2693(96)01280-4","CTP TAMU-16/96","hep-th",,"  It has recently been shown that for certain classical non-dilatonic
$p$-branes, the entropy and temperature satisfy the ideal-gas relation $S\sim
T^{p}$ in the near-extremal regime. We extend these results to cases where the
dilaton is non-vanishing, but nevertheless remains finite on the horizon in the
extremal limit, showing that the ideal-gas relation is again satisfied. At the
classical level, however, this relation does break down if the dilaton diverges
on the horizon. We argue that such a divergence indicates the breakdown of the
validity of the classical approximation, and that by taking string and
worldsheet loop corrections into account, the validity of the
entropy/temperature relation may be extended to include these cases. This opens
up the possibility of giving a microscopic interpretation of the entropy for
all near-extremal $p$-branes.
","[{""version"":""v1"",""created"":""Sun, 21 Apr 1996 20:23:21 GMT""},{""version"":""v2"",""created"":""Thu, 9 May 1996 23:02:37 GMT""},{""version"":""v3"",""created"":""Wed, 18 Sep 1996 17:57:56 GMT""}]","2009-10-07"
"hep-th/9604128","David Broadhurst","D.J.Broadhurst","On the enumeration of irreducible k-fold Euler sums and their roles in
  knot theory and field theory","34 pages, LaTeX",,,"OUT-4102-62","hep-th hep-ph math.QA q-alg",,"  A generating function is given for the number, $E(l,k)$, of irreducible
$k$-fold Euler sums, with all possible alternations of sign, and exponents
summing to $l$. Its form is remarkably simple: $\sum_n E(k+2n,k) x^n =
\sum_{d|k}\mu(d) (1-x^d)^{-k/d}/k$, where $\mu$ is the M\""obius function.
Equivalently, the size of the search space in which $k$-fold Euler sums of
level $l$ are reducible to rational linear combinations of irreducible basis
terms is $S(l,k) = \sum_{n<k}{\lfloor(l+n-1)/2\rfloor\choose n}$. Analytical
methods, using Tony Hearn's REDUCE, achieve this reduction for the 3698
convergent double Euler sums with $l\leq44$; numerical methods, using David
Bailey's MPPSLQ, achieve it for the 1457 convergent $k$-fold sums with
$l\leq7$; combined methods yield bases for all remaining search spaces with
$S(l,k)\leq34$. These findings confirm expectations based on Dirk Kreimer's
connection of knot theory with quantum field theory. The occurrence in
perturbative quantum electrodynamics of all 12 irreducible Euler sums with
$l\leq 7$ is demonstrated. It is suggested that no further transcendental
occurs in the four-loop contributions to the electron's magnetic moment.
Irreducible Euler sums are found to occur in explicit analytical results, for
counterterms with up to 13 loops, yielding transcendental knot-numbers, up to
23 crossings.
","[{""version"":""v1"",""created"":""Mon, 22 Apr 1996 03:09:35 GMT""}]","2008-02-03"
"hep-th/9604129","Clifford Johnson","Eric G. Gimon, Clifford V. Johnson","K3 Orientifolds","34 pages in harvmac `b' option. Requires epsf.tex for 8 figures.
  Revised version (to appear in Nucl. Phys. B.) corrects typographical errors","Nucl.Phys.B477:715-745,1996","10.1016/0550-3213(96)00356-2","NSF-ITP-96-16","hep-th",,"  We study string theory propagating on R^6 times K3 by constructing
orientifolds of Type IIB string theory compactified on the T^4/Z_N orbifold
limits of the K3 surface. This generalises the Z_2 case studied previously. The
orientifold models studied may be divided into two broad categories, sometimes
related by T-duality. Models in category A require either both D5- and
D9-branes, or only D9-branes, for consistency. Models in category B require
either only D5-branes, or no D-branes at all. This latter case is an example of
a consistent purely closed unoriented string theory. The spectra of the
resulting six dimensional N=1 supergravity theories are presented. Precise
statements are made about the relation of the Z_N ALE spaces and D5-branes to
instantons in the dual heterotic string theory.
","[{""version"":""v1"",""created"":""Mon, 22 Apr 1996 06:04:57 GMT""},{""version"":""v2"",""created"":""Mon, 6 May 1996 18:53:46 GMT""},{""version"":""v3"",""created"":""Wed, 10 Jul 1996 00:21:07 GMT""},{""version"":""v4"",""created"":""Thu, 11 Jul 1996 01:15:13 GMT""}]","2014-11-18"
"hep-th/9604130","Lee Min-ho","Min-Ho Lee and Jae Kwan Kim","The Entropy of the Complex Scalar Field in a Charged Kerr Black Hole","Latex,10 pages",,,"KAIST-CHEP-95/20","hep-th",,"  By using the brick wall method we calculate the thermodynamic potential of
the complex scalar field in a charged Kerr black hole. Using it we show that in
the Hartle-Hawking state the leading term of the entropy is proportional to
$\frac{ A _H}{\epsilon^2}$, which becomes divergent as the system approaches
the black hole horizon. The origin of the divergence is that the density of
states diverges at the horizon.
","[{""version"":""v1"",""created"":""Mon, 22 Apr 1996 12:00:17 GMT""}]","2007-05-23"
"math/9604238",,"Michael Jakobson and Sheldon Newhouse","Asymptotic measures for hyperbolic piecewise smooth mappings of a
  rectangle",,,,"Dynamical Systems 4/22/96","math.DS",,"  We prove the existence of Sinai-Ruelle-Bowen measures for a class of $C^2$
self-mappings of a rectangle with unbounded derivatives. The results can be
regarded as a generalization of a well-known one dimensional Folklore Theorem
on the existence of absolutely continuous invariant measures. In an earlier
paper analogous results were stated and the proofs were sketched for the case
of invertible systems. Here we give complete proofs in the more general case of
noninvertible systems, and, in particular, develop the theory of stable and
unstable manifolds for maps with unbounded derivatives.
","[{""version"":""v1"",""created"":""Mon, 22 Apr 1996 00:00:00 GMT""}]","2016-09-06"
"nucl-th/9604031",,"C. Beck, D. Mahboub, R. Nouicer, T. Matsuse, B. Djerroud, R.M.
  Freeman, F. Haas, A. Hachem, A. Morsad, M. Youlal, S.J. Sanders, R. Dayras,
  E. Berthoumieux, R. Legrain, E. Pollacco, Sl Cavallaro, E. De Filippo, G.
  Lanzano, A. Pagano and M.L. Sperduto","$^{35}$Cl+$^{12}$C Asymmetrical fission excitation functions","20 pages, revtex, figures available upon request, to appear in Phys.
  Rev. C","Phys.Rev.C54:227-236,1996","10.1103/PhysRevC.54.227","CRN-96-11","nucl-th",,"  The fully energy-damped yields from the $^{35}$Cl+$^{12}$C reaction have been
systematically investigated using particle-particle coincidence techniques at a
$^{35}$Cl bombarding energy of $\sim$ 8 MeV/nucleon. The fragment-fragment
correlation data show that the majority of events arises from a binary-decay
process with rather large numbers of secondary light-charged particles emitted
from the two excited exit fragments. No evidence is observed for ternary
break-up events. The binary-process results of the present measurement, along
with those of earlier, inclusive experimental data obtained at several lower
bombarding energies are compared with predictions of two different kinds of
statistical model calculations. These calculations are performed using the
transition-state formalism and the Extended Hauser-Feshbach method and are
based on the available phase space at the saddle point and scission point of
the compound nucleus, respectively. The methods give comparable predictions and
are both in good agreement with the experimental results thus confirming the
fusion-fission origin of the fully-damped yields. The similarity of the
predictions for the two models supports the claim that the scission point
configuration is very close to that of the saddle point for the light $^{47}$V
mass-asymmetry-dependent fission barriers needed in the transition-state
calculation.
","[{""version"":""v1"",""created"":""Mon, 22 Apr 1996 10:02:46 GMT""}]","2008-11-26"
"quant-ph/9604019","Mike Ashworth","M. C. Ashworth (UC, Davis)","Constrainted Coherent States","18 pages. Further explaintion added and some errors corrected",,,,"quant-ph gr-qc",,"  Coherent states possess a regularized path integral and gives a natural
relation between classical variables and quantum operators. Recent work by
Klauder and Whiting has included extended variables, that can be thought of as
gauge fields, into this formalism. In this paper, I consider the next step, and
look at the roll of first class constraints.
","[{""version"":""v1"",""created"":""Sun, 21 Apr 1996 20:52:12 GMT""},{""version"":""v2"",""created"":""Thu, 27 Jun 1996 19:35:39 GMT""}]","2008-02-03"
"quant-ph/9604020","T. Opatrny","T. Opatrny, D.-G. Welsch, W. Vogel","Multi-mode density matrices of light via amplitude and phase control","6 pages, latex",,"10.1016/S0030-4018(96)00548-2",,"quant-ph",,"  A new method is described for determining the quantum state of correlated
multimode radiation by interfering the modes and measuring the statistics of
the superimposed fields in four-port balanced homodyne detection. The full
information on the $N$-mode quantum state is obtained by controlling both the
relative amplitudes and the phases of the modes, which simplifies the
reconstruction of density matrices to only $N+1$ Fourier transforms. In
particular, this method yields time-correlated multimode density matrices of
optical pulses by superimposing the signal by a sequence of short
local-oscillator pulses.
","[{""version"":""v1"",""created"":""Mon, 22 Apr 1996 10:31:01 GMT""}]","2009-10-30"
"quant-ph/9604021","Tal Mor","E. Biham, B Huttner, and T Mor","Quantum Cryptographic Network based on Quantum Memories","16 pages, RevTeX. Submitted to PRA. Figure available upon request
  (talmo@tx.technion.ac.il)",,"10.1103/PhysRevA.54.2651",,"quant-ph",,"  Quantum correlations between two particles show non-classical properties
which can be used for providing secure transmission of information. We present
a quantum cryptographic system, in which users store particles in quantum
memories kept in a transmission center. Correlations between the particles
stored by two users are created upon request by projecting their product state
onto a fully entangled state. Our system allows for secure communication
between any pair of users who have particles in the same center. Unlike other
quantum cryptographic systems, it can work without quantum channels and is
suitable for building a quantum cryptographic network. We also present a
modified system with many centers.
","[{""version"":""v1"",""created"":""Mon, 22 Apr 1996 10:52:14 GMT""}]","2009-10-30"
"solv-int/9604004","Wen-Xiu Ma","W. X. Ma and B. Fuchssteiner","Integrable Theory of the Perturbation Equations","27 pages, latex, to appear in Chaos, Soliton & Fractals",,"10.1016/0960-0779(95)00104-2",,"solv-int hep-th nlin.SI",,"  An integrable theory is developed for the perturbation equations engendered
from small disturbances of solutions. It includes various integrable properties
of the perturbation equations: hereditary recursion operators, master
symmetries, linear representations (Lax and zero curvature representations) and
Hamiltonian structures etc. and provides us a method to generate hereditary
operators, Hamiltonian operators and symplectic operators starting from the
known ones. The resulting perturbation equations give rise to a sort of
integrable coupling of soliton equations. Two examples (MKdV hierarchy and KP
equation) are carefully carried out.
","[{""version"":""v1"",""created"":""Mon, 22 Apr 1996 13:18:24 GMT""}]","2015-06-26"
