"alg-geom/9603008","Dan Edidin","Dan Edidin, William Graham","Equivariant intersection theory","LaTex. 49pages. This paper subsumes our previous preprint
  ""Equivariant Chow groups and the Bott residue formula"", alg-geom/9508001.
  Email for William Graham is wag@math.uchicago.edu. This revision corrects
  some minor errors and adds some references",,,,"alg-geom math.AG",,"  In this paper we develop an equivariant intersection theory for actions of
algebraic groups on algebraic schemes. The theory is based on our construction
of equivariant Chow groups. They are algebraic analogues of equivariant
cohomology groups which satsify the formal properties of ordinary Chow groups.
In addition, they enjoy many of the properties of equivariant cohomology. The
principal results are: (1) We prove the existence of canonical intersection
products on the Chow groups of geometric quotients of smooth varieties- even
when the stabilizers of geometric points are non-reduced. (2) We construct a
Todd class map from equivariant $K$-theory of coherent sheaves to a completion
of equivariant Chow groups, and prove that a completion of equivariant
$K$-theory is isomorphic to the completion of equivariant Chow groups. (3) We
prove a localization theorem for torus actions and use it to give a
characteristic free proof of the Bott residue formula for actions of tori on
complete smooth varieties.
","[{""version"":""v1"",""created"":""Thu, 7 Mar 1996 17:38:59 GMT""},{""version"":""v2"",""created"":""Thu, 7 Mar 1996 18:31:12 GMT""},{""version"":""v3"",""created"":""Mon, 11 Mar 1996 02:51:51 GMT""}]","2008-02-03"
"astro-ph/9603030","Georg Lamer","G. Lamer, H. Brunner, and R. Staubert (Institut fuer Astronomie und
  Astrophysik, Astronomie, Universitaet Tuebingen, Germany)","ROSAT Observations of BL Lacertae Objects","9 pages, 8 postscript figures included, accepted for publication in
  Astronomy and Astrophysics",,,,"astro-ph",,"  We present soft X-ray spectra of 74 BL Lacertae objects observed with the
PSPC detector on board of the ROSAT satellite. The sample contains all BL Lac
objects detected during the pointed observation phase as a target or
serendipitously.
  We have investigated the soft X-ray and broad band spectral properties and
discuss the consequences for the X-ray emission processes. For the first time a
clear dependence of the X-ray spectral steepness on the radio to X-ray spectral
energy distribution is found: {alpha}_{rx} and {alpha}_{x} are correlated in
the X-ray selected (XBL) subsample and anticorrelated in the radio selected
(RBL) subsample. The objects with intermediate {alpha}_{rx} values thus do have
the steepest soft X-ray spectra. Simulated PSPC spectra based on a set of
simple two component multifrequency spectra are in good agreement with the
measurements and suggest a broad range of synchrotron cutoff energies.
  We have calculated synchrotron self-Compton beaming factors for a subsample
of radio bright objects and find a correlation of the beaming factors
{delta}_{IC} with {alpha}_{rx} and {alpha}_{x}.
  The most extreme RBL objects are very similar to flat spectrum radio quasars
in all their broad band and X-ray properties.
","[{""version"":""v1"",""created"":""Thu, 7 Mar 1996 19:21:28 GMT""}]","2007-05-23"
"astro-ph/9603031",,"J.A. Peacock and S.J. Dodds (Royal Observatory, Edinburgh)","Nonlinear evolution of cosmological power spectra","MNRAS in press. 8 pages TeX including Postscript figures. Uses mn.tex
  and epsf.tex","Mon.Not.Roy.Astron.Soc. 280 (1996) L19","10.1093/mnras/280.3.L19",,"astro-ph",,"  Hamilton et al. have suggested an invaluable scaling formula which describes
how the power spectra of density fluctuations evolve into the nonlinear regime
of hierarchical clustering. This paper presents an extension of their method to
low-density universes and universes with nonzero cosmological constant. We pay
particular attention to models with large negative spectral indices, and give a
spectrum-dependent fitting formula which is of significantly improved accuracy
by comparison with an earlier version of this work. The tendency of nonlinear
effects to increase power on small scales is stronger for spectra with more
negative spectral indices, and for lower densities. However, for low-density
models with a cosmological constant, the nonlinear effects are less strong than
for an open universe of the same $\Omega$.
","[{""version"":""v1"",""created"":""Fri, 8 Mar 1996 10:48:49 GMT""}]","2016-06-08"
"cmp-lg/9603001","Fernando Pereira","Fernando C. N. Pereira and Michael D. Riley (AT&T Research)","Speech Recognition by Composition of Weighted Finite Automata","24 pages, uses psfig.sty",,,,"cmp-lg cs.CL",,"  We present a general framework based on weighted finite automata and weighted
finite-state transducers for describing and implementing speech recognizers.
The framework allows us to represent uniformly the information sources and data
structures used in recognition, including context-dependent units,
pronunciation dictionaries, language models and lattices. Furthermore, general
but efficient algorithms can used for combining information sources in actual
recognizers and for optimizing their application. In particular, a single
composition algorithm is used both to combine in advance information sources
such as language models and dictionaries, and to combine acoustic observations
and information sources dynamically during recognition.
","[{""version"":""v1"",""created"":""Thu, 7 Mar 1996 22:09:00 GMT""}]","2008-02-03"
"cond-mat/9603046","Alexander Nazarenko","Alexander Nazarenko, Stephan Haas, Jose Riera, Adriana Moreo, and
  Elbio Dagotto (NHMFL/FSU)","Influence of Hole Doping on Antiferromagnetic Real-Space Approaches for
  the High-Tc Cuprates","RevTeX (version 3.0), 5 twocolumn pages with 3 embedded figures,
  added references",,,,"cond-mat",,"  Recently proposed scenarios for the cuprates make extensive use of a ``flat''
quasiparticle (q.p.) dispersion and short-range hole-hole interactions in
real-space, both caused by antiferromagnetic (AF) correlations. The density of
states (DOS) at half-filling has a robust peak which boosts the superconducting
critical temperature $T_c$ to large values as holes are introduced into the
(rigid) q.p. band. Here, the stability of such scenarios is studied after a
$finite$ but small hole density is introduced. The overall conclusion is that
the main features of real-space AF-based approaches remain qualitatively
similar, namely a large $T_c$ is found and superconductivity (SC) appears in
the ${\rm d_{x^2 - y^2}}$ channel. As the hole density grows the chemical
potential $\mu$ crosses a broad peak in the DOS. We also observe that extended
s-wave SC competes with d-wave in the overdoped regime.
","[{""version"":""v1"",""created"":""Thu, 7 Mar 1996 21:41:04 GMT""},{""version"":""v2"",""created"":""Sat, 16 Mar 1996 06:31:32 GMT""}]","2008-02-03"
"cond-mat/9603051","Marcelo Rozenberg","M. J. Rozenberg, I. H. Inoue, H. Makino, F. Iga and Y. Nishihara","Low frequency spectroscopy of the correlated metallic system
  $Ca_xSr_{1-x}VO_3$","4 pages + 2 figures, revtex",,"10.1103/PhysRevLett.76.4781",,"cond-mat",,"  We study the photoemission and optical conductivity response of the strongly
correlated metallic system $Ca_xSr_{1-x}VO_3$. We find that the basic features
of the transfer of spectral weight in photoemission experiments and the unusual
lineshape of the optical response can be understood by modeling the system with
a one band Hubbard model close to the Mott-Hubbard transition. We present a
detailed comparison between the low frequency experimental data and the
corresponding theoretical predictions obtained within the LISA method that is
exact in the limit of large lattice connectivity.
","[{""version"":""v1"",""created"":""Thu, 7 Mar 1996 16:39:24 GMT""}]","2009-10-28"
"cond-mat/9603052","Stefano Zapperi","Alessandro Vespignani, Stefano Zapperi and Vittorio Loreto","Dynamically Driven Renormalization Group","Revised version, 50 LaTex pages, 6 postscript figures",,"10.1007/BF02508464",,"cond-mat",,"  We present a detailed discussion of a novel dynamical renormalization group
scheme: the Dynamically Driven Renormalization Group (DDRG). This is a general
renormalization method developed for dynamical systems with non-equilibrium
critical steady-state. The method is based on a real space renormalization
scheme driven by a dynamical steady-state condition which acts as a feedback on
the transformation equations. This approach has been applied to open non-linear
systems such as self-organized critical phenomena, and it allows the analytical
evaluation of scaling dimensions and critical exponents. Equilibrium models at
the critical point can also be considered. The explicit application to some
models and the corresponding results are discussed.
","[{""version"":""v1"",""created"":""Thu, 7 Mar 1996 17:42:57 GMT""},{""version"":""v2"",""created"":""Wed, 23 Oct 1996 19:26:38 GMT""}]","2009-10-28"
"cond-mat/9603053","Georgios Kavoulakis","G.M. Kavoulakis (Physics Department, University of Illinois, Urbana)
  and Gordon Baym","Auger decay of degenerate and Bose-condensed excitons in Cu$_2$O","15 pages, revtex, figures available from G. Kavoulakis","Phys. Rev. B, 54 (1996) 16625","10.1103/PhysRevB.54.16625",,"cond-mat",,"  We study the non-radiative Auger decay of excitons in Cu$_2$O, in which two
excitons scatter to an excited electron and hole. The exciton decay rate for
the direct and the phonon-assisted processes is calculated from first
principles; incorporating the band structure of the material leads to a
relatively shorter lifetime of the triplet state ortho excitons. We compare our
results with the Auger decay rate extracted from data on highly degenerate
triplet excitons and Bose-condensed singlet excitons in Cu$_2$O.
","[{""version"":""v1"",""created"":""Thu, 7 Mar 1996 21:37:15 GMT""}]","2009-10-28"
"cond-mat/9603054","Bruce Normand","B. Normand and T. M. Rice","Electronic and Magnetic Structure of LaCuO$_{2.5}$","8 pages + 5 figures","Phys. Rev. B 54, 7180 (1997).","10.1103/PhysRevB.54.7180",,"cond-mat",,"  The recently-discovered ``ladder'' compound LaCuO$_{2.5}$ has been found to
admit hole doping without altering its structure of coupled copper oxide
ladders. While susceptibility measurements on the parent compound suggest a
spin gap and a spin-liquid state, NMR results indicate magnetic order at low
temperatures. These seemingly contradictory results may be reconciled if in
fact the magnetic state is near the crossover from spin liquid to
antiferromagnet, and we investigate this possibility. From a tight-binding fit
to the valence LDA bandstructure, we deduce that the strength of the
interladder hopping term is approximately half that of intraladder hopping,
showing that the material is three-dimensional in character. A mean-field
treatment of the insulating magnetic state gives a spin-liquid phase whose spin
gap decreases with increasing interladder coupling, vanishing (signalling a
transition to the ordered phase) at a value somewhat below that obtained for
LaCuO$_{2.5}$. The introduction of an on-site repulsion term, $U$, to the band
scheme causes a transition to an antiferromagnetic insulator for rather small
but finite values of $U$, reflecting the predominance of (one-dimensional)
ladder behavior, and an absence of any special nesting features.
","[{""version"":""v1"",""created"":""Thu, 7 Mar 1996 22:34:16 GMT""},{""version"":""v2"",""created"":""Wed, 12 Jun 1996 17:11:14 GMT""}]","2009-10-28"
"cond-mat/9603055","Burkhard Schmidt","Burkhard Schmidt, Peter Thalmeier, and Peter Fulde
  (Max-Planck-Institute for Physics of Complex Systems)","Excitations in Spin Chains and Specific-Heat Anomalies in Yb(4)As(3)","5 pages, 5 PostScript-figures, needs LaTeX2e and the graphics-package",,"10.1209/epl/i1996-00540-7","mpi-pks/9602003","cond-mat",,"  An explanation is given for the observed magnetic-field dependence of the
low-temperature specific heat coefficient of Yb(4)As(3). It is based on a
recently developed model for that material which can explain the observed
heavy-fermion behaviour. According to it the Yb(3+)-ions are positioned in a
net of parallel chains with an effective spin coupling of the order of J = 25
K. The magnetic-field dependence can be understood by including a weak magnetic
coupling J' between adjacent chains. The data require a ratio J'/J of about
10^{-4}. In that case the experimental results can be reproduced very well by
the theory.
","[{""version"":""v1"",""created"":""Fri, 8 Mar 1996 08:31:50 GMT""}]","2009-10-28"
"cond-mat/9603058","Eugene Kogan","R. J. F. Hughes, A. K. Savchenko, J. E. F. Frost, E. H. Linfield, J.
  T. Nicholls, M. Pepper, E. Kogan, and M. Kaveh","Distribution Function Analysis of Mesoscopic Hopping Conductance
  Fluctuations","Revtex, 24 pages, 9 figures, figures are added",,"10.1103/PhysRevB.54.2091",,"cond-mat",,"  Variable-range hopping (VRH) conductance fluctuations in the gate-voltage
characteristics of mesoscopic GaAs and Si transistors are analyzed by means of
their full distribution functions (DFs). The forms of the DF predicted by the
theory of Raikh and Ruzin have been verified under controlled conditions for
both the long, narrow wire and the short, wide channel geometries. The
variation of the mean square fluctuation size with temperature in wires
fabricated from both materials is found to be described quantitatively by Lee's
model of VRH along a 1D chain. Armed with this quantitative validation of the
VRH model, the DF method is applied to the problem of magnetoconductance in the
insulating regime. Here a non-monotonic variation of the magnetoconductance is
observed in Si MOSFETS whose sign at low magnetic fields is dependent on the
channel geometry. The origin of this defect is discussed within the framework
of the interference model of VRH magnetoconductance in terms of narrowing of
the DF in a magnetic field.
","[{""version"":""v1"",""created"":""Fri, 8 Mar 1996 12:03:48 GMT""},{""version"":""v2"",""created"":""Thu, 25 Apr 1996 10:50:02 GMT""}]","2009-10-28"
"cond-mat/9603059","Joerg Schmalian","S. Grabowski, J. Schmalian, M. Langer and K. H. Bennemann","Electronic Theory for Bilayer-Effects in High-T_c Superconductors","5 pages, Revtex, 4 postscript figures",,"10.1016/S0921-4526(96)00702-8",,"cond-mat",,"  The normal and the superconducting state of two coupled CuO_2 layers in the
High-T_c superconductors are investigated by using the bilayer Hubbard model,
the FLEX approximation on the real frequency axis and the Eliashberg theory. We
find that the planes are antiferromagnetically correlated which leads to a
strongly enhanced shadow band formation. Furthermore, the inter-layer hopping
is renormalized which causes a blocking of the quasi particle inter-plane
transfer for low doping concentrations. Finally, the superconducting order
parameter is found to have a d_{x^2-y^2} symmetry with significant additional
inter-layer contributions.
","[{""version"":""v1"",""created"":""Fri, 8 Mar 1996 12:16:58 GMT""}]","2009-10-28"
"cond-mat/9603060","Steffen Schaefer","J. Dukelsky, V.A. Khodel, P. Schuck, V.R. Shaginyan","Fermion Condensation and Non Fermi Liquid Behavior in a Model with Long
  Range Forces","22 LaTeX pages, 6 figures can be obtained from emduke@roca.csic.es",,"10.1007/s002570050286",,"cond-mat",,"  The phenomenon of the so called Fermion condensation, a phase transition
analogous to Bose condensation but for Fermions, postulated in the past to
occur in systems with strong momentum dependent forces, is reanalysed in a
model with infinite range interactions. The strongly non Fermi Liquid behavior
of this system is demonstrated analytically at $T=0$ and at $T\neq 0$ in the
superconducting and normal phases. The validity of the quasiparticle picture is
investigated and seems to hold true for temperatures less than the
characteristic temperature $T_f$ of the Fermion condensation.
","[{""version"":""v1"",""created"":""Fri, 8 Mar 1996 13:25:01 GMT""}]","2009-10-28"
"cond-mat/9603061",,"Kenneth Holmlund (Umea University, Sweden)","Flux Line Channels and Reduced Hall Effect in Impure 2D Superconductors","4 pages, revtex, 4 inlined PS figures, submitted to prl, source and
  PS also available at http://www.tp.umu.se/~holmlund/",,,,"cond-mat",,"  We have studied the dynamics of flux-lines in an impure two-dimensional
superconductor using numerical Brownian dynamics. In the dirty pinning limit
and for small center-of-mass velocities the flux lines prefer traveling in
narrow channels uniquely determined by the pinning configuration. At a certain
critical drag force there is a dynamic transition from this glassy state into a
more ordered crystalline state, in which the channel structure vanishes. The
channels are studied by monitoring the particle trajectories and the spatial
distribution of vortices. By explicitly including a Magnus force in the
Langevin equations of motion we induce a Hall field and we find that the
effective Hall angle is strongly reduced by the formation of channels, i.e. the
channels introduce a transverse energy barrier that guides the motion,
predominantly in a direction parallel to the external force. The transverse
depinning force is larger than the depinning force in the direction of the drag
and thus the Hall field actually vanishes at finite velocities. We propose that
the Hall angle can serve as an order parameter for experimental detection of
the glass to crystal transition. Our results are in excellent agreement with
recent predictions made by Giamarchi and Le Doussal (cond-mat/9512006).
","[{""version"":""v1"",""created"":""Fri, 8 Mar 1996 14:22:12 GMT""}]","2007-05-23"
"cond-mat/9603062","Robert Holyst","Robert Holyst (Institute of Physical Chemistry, Poland)","Solubility and Mixing in Fluids","38 pages (TeX) for Encyclopedia of Applied Physics",,,,"cond-mat",,"  Traditionally, solubility and mixing belong to the realm of chemistry and
material sciences and many standard textbooks on physical chemistry treat this
problem, usually within the scope of thermodynamics. Here apart from
thermodynamics we shall discuss other issues such as: the statistical mechanics
theories of mixtures, relation between intermolecular interactions and
demixing, coupling between ordering and demixing, and kinetics of demixing
which includes spinodal decomposition in binary liquid mixtures. The following
special examples will be discussed: polymer blends,diblock copolymers, liquid
crystals, and ternary mixtures including surfactants (amphiphiles). Within the
scope of physics of solubility and mixing one can study such diverse phenomena
as: mixing of two simple liquids, collapse of the polymer chain in the solvent,
flocculation of colloidal particle upon the addition of the polymer chains,
mixing of two polymer components in a liquid state, ordering of copolymers and
ternary mixtures of oil, water and surfactant or formation of micelles in
aqueous solutions. In reality, very rarely we have completely pure substances,
thus the properties of mixtures and the phenomenon of mixing and demixing are
of prime importance for science and technology.
","[{""version"":""v1"",""created"":""Fri, 8 Mar 1996 14:31:14 GMT""}]","2007-05-23"
"cond-mat/9603063","Robert Holyst","Robert Holyst and T.A.Vilgis (Institute of Physical Chemistry, Poland
  and MPI-P, Germany)","The structure and phase transitions in polymer blends, diblock
  copolymers and liquid crystalline polymers: the Landau-Ginzburg approach","91 pages (plain TeX) review for Macromolecular Theory and Simulations",,,,"cond-mat",,"  The polymer systems are discussed in the framework of the Landau-Ginzburg
model. The model is derived from the mesoscopic Edwards hamiltonian via the
conditional partition function. We discuss flexible, semiflexible and rigid
polymers. The following systems are studied: polymer blends, flexible diblock
and multi-block copolymer melts, random copolymer melts, ring polymers,
rigid-flexible diblock copolymer melts, mixtures of copolymers and homopolymers
and mixtures of liquid crystalline polymers. Three methods are used to study
the systems: mean-field model, self consistent one-loop approximation and self
consistent field theory. The following problems are studied and discussed: the
phase diagrams, scattering intensities and correlation functions, single chain
statistics and behavior of single chain close to critical points, fluctuations
induced shift of phase boundaries. We concentrate on static, equilibrium
properties of the polymer systems.
","[{""version"":""v1"",""created"":""Fri, 8 Mar 1996 15:35:11 GMT""}]","2007-05-23"
"dg-ga/9603003","Ulrich Bunke","Ulrich Bunke, Martin Olbrich","Group cohomology and the singularities of the Selberg zeta function
  associated to a Kleinian group","63 pages, published version","Ann. of Math. (2) 149 (1999), no. 2, 627-689",,"SFB 288 No. 189; Annals migration 4-2001","dg-ga math.DG",,"  We prove Patterson's conjecture about the singularities of the Selberg zeta
function associated to a convex-cocompact, torsion free group acting on a
hyperbolic space.
","[{""version"":""v1"",""created"":""Thu, 7 Mar 1996 18:12:11 GMT""},{""version"":""v2"",""created"":""Mon, 1 Mar 1999 00:00:00 GMT""}]","2008-02-03"
"dg-ga/9603004","Sergey Finashin","S. Finashin","Decomposability of quotients by complex conjugation for rational and
  Enriques surfaces","7 pages, AMS-TeX, 2 hand-written figures available by request",,,,"dg-ga math.DG",,"  The quotients $Y=X/conj$ by the complex conjugation $conj\: X\to X$ for
complex rational and Enriques surfaces $X$ defined over $\R$ are shown to be
diffeomorphic to connected sums of $\barCP2$, whenever $Y$ are simply
connected.
","[{""version"":""v1"",""created"":""Fri, 8 Mar 1996 09:05:39 GMT""}]","2008-02-03"
"gr-qc/9603008","Dharam Ahluwalia","D. V. Ahluwalia, C. Burgard","Gravitationally Induced Neutrino-Oscillation Phases","First Prize Gravity Research Foundation Essay (1996). Added two
  appendices. Appendix A: Erratum. Appendix B: Neutrino oscillations as a new
  energy transport mechanism for supernova explosions (taken from a 1996 JRO
  Fellowship proposal)","Gen.Rel.Grav.28:1161-1170,1996","10.1007/BF03218936",,"gr-qc astro-ph hep-ph quant-ph",,"  In this essay, we introduce a new effect of gravitationally induced quantum
mechanical phases in neutrino oscillations. These phases arise from an hitherto
unexplored interplay of gravitation and the principle of the linear
superposition of quantum mechanics. In the neighborhood of a 1.4 solar-mass
neutron star, gravitationally induced quantum mechanical phases are roughly 20%
of their kinematical counterparts. When this information is coupled with the
mass square differences implied by the existing neutrino-oscillation data we
find that the new effect may have profound consequences for type-II supernova
evolution.
","[{""version"":""v1"",""created"":""Fri, 8 Mar 1996 01:38:43 GMT""},{""version"":""v2"",""created"":""Thu, 16 May 1996 18:23:00 GMT""},{""version"":""v3"",""created"":""Sun, 19 May 1996 17:12:38 GMT""},{""version"":""v4"",""created"":""Fri, 14 Jun 1996 02:00:10 GMT""},{""version"":""v5"",""created"":""Tue, 22 Oct 1996 00:19:37 GMT""},{""version"":""v6"",""created"":""Thu, 22 Jan 2004 23:54:14 GMT""}]","2023-04-19"
"gr-qc/9603009","Marian Chamula","Vladimir Skalsky and Miroslav Sukenik","Gravitation Interaction and Electromagnetic Interaction in the
  Relativistic Universe with Total Zero and Local Non-Zero Energy","LaTeX, 10 pages, 1 figure","Astrophys.Space Sci.166:159-164,1990","10.1007/BF00655615",,"gr-qc",,"  In the model of flat expansive homogeneous and isotropic relativistic
universe with total zero and local non-zero energy the gravitation energy of
bodies and the elecromagnetic energy of charged bodies can be localised.
","[{""version"":""v1"",""created"":""Fri, 8 Mar 1996 10:10:49 GMT""}]","2009-01-14"
"hep-ex/9603002","Brent Ware","J. Belz, et al. (BNL E888 Collaboration)","Search for the Weak Decay of an H Dibaryon","11 pages, 6 postscript figures, epsfig, aps, preprint, revtex","Phys.Rev.Lett.76:3277-3280,1996","10.1103/PhysRevLett.76.3277","UTEXAS-HEP-95-19, PRINCETON/HEP/95-12, KL-489-H","hep-ex hep-ph nucl-ex",,"  We have searched for a neutral $H$ dibaryon decaying via $H\to\Lambda n$ and
$H\to\Sigma^0 n$. Our search has yielded two candidate events from which we set
an upper limit on the $H$ production cross section. Normalizing to the
inclusive $\Lambda$ production cross section, we find $(d\sigma_H/d\Omega) /
(d\sigma_\Lambda/d\Omega) < 6.3\times 10^{-6}$ at 90% C.L., for an $H$ of mass
$\approx$ 2.15 GeV/$c^2$.
","[{""version"":""v1"",""created"":""Thu, 7 Mar 1996 18:27:35 GMT""}]","2008-11-26"
"hep-lat/9603005","Michael Chavel","Michael Chavel","The Role of Vortex Strings in the Non-Compact Lattice Abelian Higgs
  Model","11 pages LaTeX2e, 4 Postscript figures, uses epsf.sty, references
  added","Phys.Lett. B378 (1996) 227-232","10.1016/0370-2693(96)00396-6",,"hep-lat",,"  The non-compact lattice version of the Abelian Higgs model is studied in
terms of its topological excitations. The Villain form of the partition
function is represented as a sum over world-sheets of gauge-invariant
``vortex'' strings. The phase transition of the system is then related to the
density of these excitations. Through Monte Carlo simulations the density of
the vortex sheets is shown to be a good order parameter for the system. The
vortex density essentially vanishes in the Higgs phase, and the Coulomb phase
consists of a single vortex condensate.
","[{""version"":""v1"",""created"":""Fri, 8 Mar 1996 08:02:40 GMT""},{""version"":""v2"",""created"":""Tue, 12 Mar 1996 21:00:51 GMT""}]","2009-10-28"
