"hep-ph/9603246","V. Kim","Andrei L. Kataev (INR, Moscow) and Victor T. Kim (PNPI, St.Petersburg)","QCD Corrections to Decays of Intermediate Mass Higgs Boson","4 pages in LATEX + 4 figures as PS-file, to appear in PNPI Research
  Report 1994-1995, St.Petersburg",,,"INR-0918/96","hep-ph",,"  The brief discussion of the studies of the radiative QCD corrections to the
decay widths and branching ratios of the Standard Model Higgs boson with the
mass 2 m_b < M_H < 2 M_W is given. The numerical results are obtained with the
help of our FORTRAN code SEEHIGGS.
","[{""version"":""v1"",""created"":""Thu, 7 Mar 1996 16:53:47 GMT""}]","2007-05-23"
"hep-ph/9603247","Tao Han","T. Han, K. Whisnant, B.-L. Young and X. Zhang","Top-Quark Decay Via the Anomalous Coupling $\bar t c \gamma$ at Hadron
  Colliders","19 pages, 8 figures, RevTeX, postscript files available via anonymous
  ftp: ftp://ucdhep.ucdavis.edu/han/top/ (get paper_top.ps and fig*.ps)","Phys. Rev. D 55, 7241 (1997)","10.1103/PhysRevD.55.7241","UCD--96--07; AMES-HET-96-01","hep-ph",,"  We determine the constraints on the anomalous top-quark coupling associated
with the flavor-changing neutral current vertex $\bar t c \gamma $ from the
limits on the $b$-quark rare decay $b\rightarrow s \gamma$ and non-standard
top-quark decays. Based on these constraints, we discuss the experimental
observability of the rare decay mode $t \rightarrow c \gamma$, both at the
Fermilab Tevatron with a luminosity-upgrade and at the LHC.
","[{""version"":""v1"",""created"":""Thu, 7 Mar 1996 18:42:47 GMT""}]","2016-08-24"
"hep-ph/9603248","Scott Yost","S. Jadach, M. Melles, B.F.L. Ward, S.A. Yost","Exact O(alpha) Corrections to the Single Hard Bremsstrahlung Process in
  Low Angle Bhabha Scattering in the SLC/LEP Energy Regime","17 pages Latex2e, 2 figures, epsfig package. To appear in Physics
  Letters B","Phys.Lett. B377 (1996) 168-176","10.1016/0370-2693(96)00354-1","UT 95-0101","hep-ph",,"  We present the exact O(alpha) correction to the process e+ e- -> e+ e- +
gamma in the low angle luminosity regime at SLC/LEP energies. We give explicit
formulas for the completely differential cross section. As an important
application, we illustrate the size of the respective corrections of O(alpha^2)
to the SLC/LEP luminosity cross section. We show explicitly that our results
have the correct infrared limit, as a cross-check. Some comments are made about
the implementation of our results in the framework of a Monte Carlo event
generator. This latter implementation will appear elsewhere.
","[{""version"":""v1"",""created"":""Thu, 7 Mar 1996 22:09:24 GMT""}]","2009-10-28"
"hep-ph/9603249","Xiangdong Ji","Xiangdong Ji (MIT and INT)","Gauge-Invariant Decomposition of Nucleon Spin and Its Spin-Off",,"Phys.Rev.Lett. 78 (1997) 610-613","10.1103/PhysRevLett.78.610",,"hep-ph",,"  I introduce a gauge invariant decomposition of the nucleon spin into quark
helicity, quark orbital, and gluon contributions. The total quark (and hence
the quark orbital) contribution is shown to be measurable through virtual
Compton scattering in a special kinematic region where single quark scattering
dominates. This deeply-virtual Compton scattering (DVCS) has much potential to
unravel the quark and gluon structure of the nucleon.
","[{""version"":""v1"",""created"":""Fri, 8 Mar 1996 00:19:40 GMT""}]","2009-10-28"
"hep-th/9603040","Niclas Wyllard","Niclas Wyllard","Generalized Toda Theories from WZNW Reduction","18 pages, Plain LaTeX","Mod.Phys.Lett. A12 (1997) 95-110","10.1142/S0217732397000091","ITP 96-2","hep-th",,"  We reconsider the, by Brink and Vasiliev, recently proposed generalized Toda
field theories using the framework of WZNW$\rightarrow$Toda reduction. The
reduced theory has a gauge symmetry which can be fixed in various ways. We
discuss some different gauge choices. In particular we study the ${\cal W}$
algebra associated with the generalized model in some different realizations,
corresponding to different gauge choices. We also investigate the mapping
between the Toda field and a free field and show the relation between the
${\cal W}$ algebra generators expressed in terms of the two different fields.
All results apply also to the case of ordinary Toda theories.
","[{""version"":""v1"",""created"":""Thu, 7 Mar 1996 16:47:55 GMT""}]","2015-06-26"
"hep-th/9603041","Juan P. Garrahan","Juan P. Garrahan, Martin Kruczenski, and Daniel R. Bes","Lagrangian Becchi-Rouet-Stora-Tyutin treatment of collective coordinates","LaTeX file, 26 pages, PostScript figures at end of file","Phys.Rev. D53 (1996) 7176-7186","10.1103/PhysRevD.53.7176","Tandar preprint TAN-FNT-95/013","hep-th",,"  The Becchi-Rouet-Stora-Tyutin (BRST) treatment for the quantization of
collective coordinates is considered in the Lagrangian formalism. The motion of
a particle in a Riemannian manifold is studied in the case when the classical
solutions break a non-abelian global invariance of the action. Collective
coordinates are introduced, and the resulting gauge theory is quantized in the
BRST antifield formalism. The partition function is computed perturbatively to
two-loops, and it is shown that the results are independent of gauge-fixing
parameters.
","[{""version"":""v1"",""created"":""Thu, 7 Mar 1996 17:48:29 GMT""}]","2009-10-30"
"hep-th/9603042","Ronen Plesser","P.C. Argyres, M.R. Plesser, and N. Seiberg","The Moduli Space of N=2 SUSY QCD and Duality in N=1 SUSY QCD","46 pages harvmac, 3 figures included using epsf.tex","Nucl.Phys.B471:159-194,1996","10.1016/0550-3213(96)00210-6","RU-96-07, WIS-96-1","hep-th hep-ph",,"  We analyze in detail the moduli space of vacua of N=2 SUSY QCD with n_c
colors and n_f flavors. The Coulomb branch has submanifolds with non-Abelian
gauge symmetry. The massless quarks and gluons at these vacua are smoothly
connected to the underlying elementary quarks and gluons. Upon breaking N=2 by
an N=1 preserving mass term for the adjoint field the theory flows to N=1 SUSY
QCD. Some of the massless quarks and gluons on the moduli space of the N=2
theory become the magnetic quarks and gluons of the N=1 theory. In this way we
derive the duality in N=1 SUSY QCD by identifying its crucial building
blocks---the magnetic degrees of freedom---using only semiclassical physics and
the non-renormalization theorem.
","[{""version"":""v1"",""created"":""Thu, 7 Mar 1996 20:01:29 GMT""}]","2009-09-15"
"hep-th/9603043","Won T. Kim","Sung-Won Kim, Won T. Kim, Young-Jai Park, and Hyeonjoon Shin","Entropy of the BTZ Black Hole in 2+1 Dimensions","13 pages, latex, no figures, superradiant part and many divergences
  are seriously reconsidered","Phys.Lett. B392 (1997) 311-318","10.1016/S0370-2693(96)01572-9","SOGANG-HEP-206/96","hep-th",,"  We semi-classically calculate the entropy of a scalar field in the background
of the BTZ black hole, and derive the perimeter law of the entropy. The proper
length from the horizon to the ultraviolet cutoff is independent of both the
mass and the angular momentum of the black hole. It is shown that the
superradiant scattering modes give the sub-leading order contribution to the
entropy while the non-superradiant modes give the leading order one, and thus
superradiant effect is minor.
","[{""version"":""v1"",""created"":""Fri, 8 Mar 1996 05:06:04 GMT""},{""version"":""v2"",""created"":""Wed, 28 Aug 1996 06:23:45 GMT""}]","2009-10-30"
"hep-th/9603044","Yoon Soo Myung","H.W. Lee, Y.S. Myung(Inje U.), Jin Young Kim(Dongseo U.), D. K.
  Park(Kyungnam U.)","New divergences of tachyon in the two-dimensional charged black holes","10 pages no figure, RevTeX","Class.Quant.Grav.14:L53-L58,1997","10.1088/0264-9381/14/3/003","INJE-TP-96-2","hep-th",,"  We quantize the tachyon field in the two-dimensional (2D), $\epsilon<2$
charged black holes where $\epsilon$ is the dilaton coupling parameter for the
Maxwell term. Especially the expectation value of the stress-energy tensor
$\langle T_{ab}\rangle$, observed by a freely falling observer, is computed.
This shows that new divergences such as $\ln f$ and ${1 \over f}$ arises near
the horizon ($f \to 0$), compared with conformal matter case.
","[{""version"":""v1"",""created"":""Fri, 8 Mar 1996 05:24:59 GMT""}]","2010-04-06"
"hep-th/9603045","Okumura Yoshitaka","Yoshitaka Okumura","BRST invariant Lagrangian of spontaneously broken gauge theories in
  noncommutative geometry","RevTeX, page 9","Phys.Rev.D54:4114-4120,1996","10.1103/PhysRevD.54.4114","Chubu 9603","hep-th",,"  The quantization of spontaneously broken gauge theories in noncommutative
geometry(NCG) has been sought for some time, because quantization is crucial
for making the NCG approach a reliable and physically acceptable theory. Lee,
Hwang and Ne'eman recently succeeded in realizing the BRST quantization of
gauge theories in NCG in the matrix derivative approach proposed by Coquereaux
et al. The present author has proposed a characteristic formulation to
reconstruct a gauge theory in NCG on the discrete space $M_4\times Z_{_N}$.
Since this formulation is a generalization of the differential geometry on the
ordinary manifold to that on the discrete manifold, it is more familiar than
other approaches. In this paper, we show that within our formulation we can
obtain the BRST invariant Lagrangian in the same way as Lee, Hwang and Ne'eman
and apply it to the SU(2)$\times$U(1) gauge theory.
","[{""version"":""v1"",""created"":""Fri, 8 Mar 1996 09:07:13 GMT""},{""version"":""v2"",""created"":""Mon, 20 May 1996 09:53:17 GMT""}]","2014-11-18"
"hep-th/9603046","Julio Abad","Julio Abad and Miguel Rios","A method for solve integrable $A_2$ spin chains combining different
  representations","PlainTeX, harvmac, 13 pages, 3 figures, to appear in Phys. Rev. B",,"10.1103/PhysRevB.53.14000","DFTUZ 95-23","hep-th math.QA q-alg",,"  A non homogeneous spin chain in the representations $ \{3 \}$ and $ \{3^*\}$
of $A_2$ is analyzed. We find that the naive nested Bethe ansatz is not
applicable to this case. A method inspired in the nested Bethe ansatz, that can
be applied to more general cases, is developed for that chain. The solution for
the eigenvalues of the trace of the monodromy matrix is given as two coupled
Bethe equations different from that for a homogeneous chain. A conjecture about
the form of the solutions for more general chains is presented.
  PACS: 75.10.Jm, 05.50+q 02.20 Sv
","[{""version"":""v1"",""created"":""Fri, 8 Mar 1996 10:05:18 GMT""}]","2009-10-30"
"hep-th/9603047",,"K. Arthur, G.M. O'Brien and D.H. Tchrakian","Towards a Coulomb gas of instantons in the SO(4)xU(1) Higgs model on R_4","29 pages LaTeX, 4 Figures available from authors on request","J.Math.Phys. 38 (1997) 4403-4421","10.1063/1.532133",,"hep-th",,"  The $SO(4)\times U(1)$ Higgs model on $\R_4$ is extended by a $F^3$ term so
that the action receives a nonvanishing contribution from the interactions of
2-instantons and 3-instantons, and can be expressed as the inverse of the
Laplacian on $\R_4$ in terms of the mutual distances of the instantons. The
one-instanton solutions of both the basic and the extended models have been
studied in detail numerically.
","[{""version"":""v1"",""created"":""Fri, 8 Mar 1996 11:08:32 GMT""}]","2009-10-30"
"hep-th/9603052","essor Uel","D.M. Gitman, A.E. Goncalves","Pseudoclassical description of the massive Dirac particles in odd
  dimensions","12 pages, LaTeX (RevTeX)","Int.J.Theor.Phys.35:2427-2438,1996","10.1007/BF02085750","IFUSP/P-96-1204","hep-th",,"  A pseudoclassical model is proposed to describe massive Dirac (spin one-half)
particles in arbitrary odd dimensions. The quantization of the model reproduces
the minimal quantum theory of spinning particles in such dimensions. A
dimensional duality between the model proposed and the pseudoclassical
description of Weyl particles in even dimensions is discussed.
","[{""version"":""v1"",""created"":""Fri, 8 Mar 1996 14:20:03 GMT""}]","2014-11-18"
"math/9603211",,"J\'anos Pach","A Tverberg-type result on multicolored simplices",,,,"MSRI 1996-016","math.CO",,"  Let $P_1, P_2,\ldots, P_{d+1}$ be pairwise disjoint $n$-element point sets in
general position in $d$-space. It is shown that there exist a point $O$ and
suitable subsets $Q_i\subseteq P_i \; (i=1, 2, \ldots, d+1)$ such that
$|Q_i|\geq c_d|P_i|$, and every $d$-dimensional simplex with exactly one vertex
in each $Q_i$ contains $O$ in its interior. Here $c_d$ is a positive constant
depending only on $d$.
","[{""version"":""v1"",""created"":""Fri, 8 Mar 1996 00:00:00 GMT""}]","2016-09-06"
"mtrl-th/9603004",,"H.C.Verma, George C. John and Vijay A. Singh (Physics Department,
  Indian Institute of Technology, Kanpur)","Vibrational Spectra of Defects in Silicon: An Orbital Radii Approach","Only text included, figures available on request from
  george@iitk.ernet.in; Phys. Rev. B (to appear)",,"10.1103/PhysRevB.53.9831","IIT-K/PHY/HCV-1/96","mtrl-th atom-ph chem-ph cond-mat.mtrl-sci",,"  A phenomenological approach to the stretching mode vibrational frequencies of
defects in semiconductors is proposed. A novel quantum scale is defined in
terms of the first principles pseudopotential based orbital radius and the
principal quantum number of the element concerned. A universal linear
relationship between the Sanderson electronegativity and this quantum scale is
established. Next, we show that the stretching mode vibrational frequencies of
hydrogen and chlorine in the silicon network scale linearly with this quantum
scale. Predictions and identifications of defect environments around the Si-H
and Si-Cl are possible. The assignments of vibrational modes in porous silicon
are critically examined. We discuss our proposed scale in the context of
Mendeleveyan scales in general, and suggest justifications for it. We believe
that our approach can be gainfully extended to the vibrational spectra of other
semiconductors.
","[{""version"":""v1"",""created"":""Fri, 8 Mar 1996 04:40:48 GMT""}]","2009-10-30"
"nucl-th/9603007","Scott Chapman","Scott Chapman and J. Rayford Nix","Realistic Expanding Source Model for Invariant One-Particle Multiplicity
  Distributions and Two-Particle Correlations in Relativistic Heavy-Ion
  Collisions","37 pages and 12 figures. RevTeX 3.0. Submitted to Physical Review C.
  Complete preprint, including device-independent (dvi), PostScript, and LaTeX
  versions of the text, plus PostScript files of all figures, are available at
  http://t2.lanl.gov/publications/publications.html or at
  ftp://t2.lanl.gov/publications/resm","Phys.Rev.C54:866-881,1996","10.1103/PhysRevC.54.866","LA-UR-96-0782","nucl-th hep-ph",,"  We present a realistic expanding source model with nine parameters that are
necessary and sufficient to describe the main physics occuring during
hydrodynamical freezeout of the excited hadronic matter produced in
relativistic heavy-ion collisions. As a first test of the model, we compare it
to data from central Si + Au collisions at p_lab/A = 14.6 GeV/c measured in
experiment E-802 at the AGS. An overall chi-square per degree of freedom of
1.055 is achieved for a fit to 1416 data points involving invariant pi^+, pi^-,
K^+, and K^- one-particle multiplicity distributions and pi^+ and K^+
two-particle correlations. The 99-percent-confidence region of parameter space
is identified, leading to one-dimensional error estimates on the nine fitted
parameters and other calculated physical quantities. Three of the most
important results are the freezeout temperature, longitudinal proper time, and
baryon density along the symmetry axis. For these we find values of 92.9 +/-
4.4 MeV, 8.2 +/- 2.2 fm/c, and 0.0222 + 0.0096 / - 0.0069 fm^-3, respectively.
","[{""version"":""v1"",""created"":""Thu, 7 Mar 1996 22:59:32 GMT""},{""version"":""v2"",""created"":""Thu, 9 May 1996 19:34:41 GMT""}]","2008-11-26"
"nucl-th/9603008","Daniel Phillips","D.R. Phillips and S.J. Wallace (University of Maryland)","Relativistic bound-state equations in three dimensions","28 pages, RevTeX, 6 figures attached as postscript files. Accepted
  for publication in Phys. Rev. C. Minor changes from original version do not
  affect argument or conclusions","Phys.Rev.C54:507-522,1996","10.1103/PhysRevC.54.507","DOE/ER/40762-082, U.Md.PP#96-089","nucl-th hep-ph",,"  Firstly, a systematic procedure is derived for obtaining three-dimensional
bound-state equations from four-dimensional ones. Unlike ``quasi-potential
approaches'' this procedure does not involve the use of delta-function
constraints on the relative four-momentum. In the absence of negative-energy
states, the kernels of the three-dimensional equations derived by this
technique may be represented as sums of time-ordered perturbation theory
diagrams. Consequently, such equations have two major advantages over
quasi-potential equations: they may easily be written down in any Lorentz
frame, and they include the meson-retardation effects present in the original
four-dimensional equation. Secondly, a simple four-dimensional equation with
the correct one-body limit is obtained by a reorganization of the generalized
ladder Bethe-Salpeter kernel. Thirdly, our approach to deriving
three-dimensional equations is applied to this four-dimensional equation, thus
yielding a retarded interaction for use in the three-dimensional bound-state
equation of Wallace and Mandelzweig. The resulting three-dimensional equation
has the correct one-body limit and may be systematically improved upon. The
quality of the three-dimensional equation, and our general technique for
deriving such equations, is then tested by calculating bound-state properties
in a scalar field theory using six different bound-state equations. It is found
that equations obtained using the method espoused here approximate the wave
functions obtained from their parent four-dimensional equations significantly
better than the corresponding quasi-potential equations do.
","[{""version"":""v1"",""created"":""Thu, 7 Mar 1996 23:25:19 GMT""},{""version"":""v2"",""created"":""Thu, 16 May 1996 21:33:12 GMT""}]","2008-11-26"
"q-alg/9603005","Tim Baker","T. H. Baker and P. J. Forrester (University of Melbourne)","Generalized weight functions and the Macdonald polynomials","23 pages, latex",,,,"q-alg math.QA",,"  A weight function which $q$-generalizes the ground state wave function of the
multi-component Calogero-Sutherland quantum many body system is introduced.
Conjectures, and some proofs in special cases, are given for a constant term
identity involving this function. A Gram-Schmidt procedure with respect to the
inner product associated with the weight function is used to define orthogonal
polynomials in one of the components, which are conjectured to be the Macdonald
polynomials $P_\kappa(w_1,\dots,w_{N_0};qt^p,t)$, and a proof is given in a
special case. Conjectures are also given for an adjoint property of the
Macdonald operator with respect to the inner product associated with the weight
function, and the normalization of the Macdonald polynomial with respect to the
same inner product.
","[{""version"":""v1"",""created"":""Fri, 8 Mar 1996 03:53:41 GMT""}]","2008-02-03"
"quant-ph/9603009",,"Richard Cleve (U. Calgary) and David P. DiVincenzo (IBM)","Schumacher's quantum data compression as a quantum computation","37 pages, no figures",,"10.1103/PhysRevA.54.2636",,"quant-ph",,"  An explicit algorithm for performing Schumacher's noiseless compression of
quantum bits is given. This algorithm is based on a combinatorial expression
for a particular bijection among binary strings. The algorithm, which adheres
to the rules of reversible programming, is expressed in a high-level pseudocode
language. It is implemented using $O(n^3)$ two- and three-bit primitive
reversible operations, where $n$ is the length of the qubit strings to be
compressed. Also, the algorithm makes use of $O(n)$ auxiliary qubits; however,
space-saving techniques based on those proposed by Bennett are developed which
reduce this workspace to $O(\sqrt{n})$ while increasing the running time by
less than a factor of two.
","[{""version"":""v1"",""created"":""Thu, 7 Mar 1996 21:06:15 GMT""}]","2009-10-30"
"quant-ph/9603010","Farhad Ghaboussi","F. Ghaboussi","The Edge Currents in IQHE","6 Pages, Latex",,,,"quant-ph",,"  It is shown that an observed length in the potential drops across IQHE
samples is a universal length for a given magnetic field strength which has the
magnitude equal to the reciprocal magnitude of magnetic length and which
results from the quantum mechanical uncertainty relation in presence of
magnetic field. The analytic solution of Ohm's equation for the potential in
Corbino sample in IQHE is also given.
","[{""version"":""v1"",""created"":""Fri, 8 Mar 1996 11:26:38 GMT""}]","2007-05-23"
"quant-ph/9603011","Farhad Ghaboussi","F. Ghaboussi","On The Quantum Theory of Hall Effect","Latex","Int.J.Theor.Phys. 36 (1997) 923-934",,,"quant-ph",,"  We discuss a model of both classical and integer quantum Hall-effect which is
based on a semi-classical Schroedinger-Chern-Simons-action, where the
Ohm-equations result as equations of motion. The quantization of the classical
Chern-Simons-part of action under typical quantum Hall conditions results in
the quantized Hall conductivity. We show further that the classical Hall-effect
is described by a theory which arises as the classical limit of a theory of
quantum Hall-effect. The model explains also the preference and the domain of
the edge currents on the boundary of samples.
","[{""version"":""v1"",""created"":""Fri, 8 Mar 1996 11:34:12 GMT""}]","2007-05-23"
"quant-ph/9603012","Farhad Ghaboussi","F. Ghaboussi","A Model Of The Integer Quantum Hall Effect","Latex",,,,"quant-ph",,"  We discuss a model for the integer quantum Hall effect which is based on a
Schroedinger-Chern-Simons-action functional for a non-interacting system of
electrons in an electromagnetic field on a mutiply connected manifold. In this
model the integer values of the Hall conductivity arises in view of the
quantization of the Chern-Simons-action functional for electromagnetic
potential.
","[{""version"":""v1"",""created"":""Fri, 8 Mar 1996 11:40:16 GMT""}]","2007-05-23"
"quant-ph/9603013","Farhad Ghaboussi","F. Ghaboussi","On The relation between Superconductivity and Quantum Hall Effect","Latex",,,,"quant-ph",,"  We introduce a model of superconductivity and discuss its relation to the
quantum Hall-effect. This kind of relation is supported by the well known SQUID
results. The concept of pure gauge potential as it is involved in various
theoretical models concerning solid state effects in magnetic fields is also
discussed.
","[{""version"":""v1"",""created"":""Fri, 8 Mar 1996 12:18:32 GMT""}]","2007-05-23"
