"astro-ph/9603158","Dave Bennett","David P. Bennett and Sun Hong Rhie","Detecting Earth-Mass Planets with Gravitational Microlensing","9 pages, AAS latex, epsf, 5 figures (postscript), 2 additional color
  postscript figures available at ftp://igpp.llnl.gov/pub/bennett/em_planet","Astrophys.J.472:660,1996","10.1086/178096",,"astro-ph",,"  We show that Earth mass planets orbiting stars in the Galactic disk and bulge
can be detected by monitoring microlensed stars in the Galactic bulge. The star
and its planet act as a binary lens which generates a lightcurve which can
differ substantially from the lightcurve due only to the star itself. We show
that the planetary signal remains detectable for planetary masses as small as
an Earth mass when realistic source star sizes are included in the lightcurve
calculation. These planets are detectable if they reside in the ``lensing zone""
which is centered between 1 and 4 AU from the lensing star and spans about a
factor of 2 in distance. If we require a minimum deviation of 4\% from the
standard point-lens microlensing lightcurve, then we find that more than 2\% of
all $\mearth$ planets and 10\% of all $10\mearth$ in the lensing zone can be
detected. If a third of all lenses have no planets, a third have $1\mearth$
planets and the remaining third have $10\mearth$ planets then we estimate that
an aggressive ground based microlensing planet search program could find one
earth mass planet and half a dozen $10\mearth$ planets per year.
","[{""version"":""v1"",""created"":""Sat, 30 Mar 1996 01:49:19 GMT""}]","2011-04-21"
"astro-ph/9603159","Ethan Vishniac","Ethan T. Vishniac, J. Craig Wheeler","The Speed of Cooling Fronts and the Functional Form of the Dimensionless
  Viscosity in Accretion Disks","22 pages, 1 figure",,"10.1086/178019",,"astro-ph",,"  We examine the speed of inward traveling cooling fronts in accretion disks.
We show that their speed is determined by the rarefaction wave that precedes
them and is approximately $\alpha_F c_{F} (H/r)^q$, where $\alpha_F$ is the
dimensionless viscosity, $c_{F}$ is the sound speed, $r$ is the radial
coordinate, $H$ is the disk thickness, and all quantities are evaluated at the
cooling front. The scaling exponent $q$ lies in the interval $[0,1]$, depending
on the slope of the $(T,\Sigma)$ relation in the hot state. For a Kramer's law
opacity and $\alpha\propto (H/r)^n$, where $n$ is of order unity, we find that
$q\sim 1/2$. This supports the numerical work of Cannizzo, Chen and Livio
(1995) and their conclusion that $n\approx3/2$ is necessary to reproduce the
exponential decay of luminosity in black hole X-ray binary systems. Our results
are insensitive to the structure of the disk outside of the radius where rapid
cooling sets in. In particular, the width of the rapid cooling zone is a
consequence of the cooling front speed rather than its cause. We conclude that
the exponential luminosity decay of cooling disks is probably compatible with
the wave-driven dynamo model. It is not compatible with models with separate,
constant values of $\alpha$ for the hot and cold states.
","[{""version"":""v1"",""created"":""Fri, 29 Mar 1996 19:29:23 GMT""}]","2009-10-28"
"astro-ph/9603160","David Merritt","David Merritt (Rutgers)","The Dynamical Inverse Problem for Axisymmetric Stellar Systems","23 LATEX pages, 5 Postscript figures, uses AASTEX, epsf.sty. To
  appear in The Astronomical Journal, Vol. 112, September 1996",,"10.1086/118080",,"astro-ph",,"  The standard method of modelling axisymmetric stellar systems begins from the
assumption that mass follows light. The gravitational potential is then derived
from the luminosity distribution, and a unique two-integral distribution
function f(E,Lz) that generates the stellar density in this potential is found.
We show that the gravitational potential can instead be generated directly from
the velocity data in a two-integral galaxy, thus allowing one to drop the
assumption that mass follows light. The rotational velocity field can also be
recovered in a model-independent way. We present regularized algorithms for
carrying out the inversions and test them by application to pseudo-data from a
family of oblate models.
","[{""version"":""v1"",""created"":""Fri, 29 Mar 1996 21:27:28 GMT""},{""version"":""v2"",""created"":""Mon, 1 Apr 1996 20:54:05 GMT""},{""version"":""v3"",""created"":""Wed, 5 Jun 1996 20:07:08 GMT""}]","2009-10-28"
"atom-ph/9603009","Anupam Garg","Anupam Garg (Department of Physics and Astronomy, Northwestern
  University)","Decoherence in Ion Trap Quantum Computers","11 pages, no figures, uses revtex","Phys Rev Lett 77 (1996) 764","10.1007/BF02571179",,"atom-ph cond-mat physics.atom-ph",,"  The {\it intrinsic} decoherence from vibrational coupling of the ions in the
Cirac-Zoller quantum computer [Phys. Rev. Lett. {\bf 74}, 4091 (1995)] is
considered. Starting from a state in which the vibrational modes are at a
temperature $T$, and each ion is in a superposition of an excited and a ground
state, an adiabatic approximation is used to find the inclusive probability
$P(t)$ for the ions to evolve as they would without the vibrations, and for the
vibrational modes to evolve into any final state. An analytic form is found for
$P(t)$ at $T=0$, and the decoherence time is found for all $T$. The decoherence
is found to be quite small, even for 1000 ions.
","[{""version"":""v1"",""created"":""Fri, 29 Mar 1996 16:57:12 GMT""}]","2009-10-28"
"chao-dyn/9603014","Baowen Li","Marko Robnik and Luca Salasnich (CAMTP, University of Maribor,
  Slovenia)","WKB expansion for the angular momentum and the Kepler problem: from the
  torus quantization to the exact one","16 pages plain Latex file, no figures. submitted to J. Phys. A","J.Phys.A30:1719-1729,1997","10.1088/0305-4470/30/5/032","CAMTP/96-4","chao-dyn hep-th nlin.CD nucl-th",,"  We calculate the WKB series for the angular momentum and the
non--relativistic 3-dim Kepler problem. This is the first semiclassical
treatment of the angular momentum for terms beyond the leading WKB
approximation. We explain why the torus quantization (the leading WKB term) of
the full problem is exact, even if the individual torus quantization of the
angular momentum and of the radial Kepler problem separately is not exact.
  PACS numbers: 03.65.-w, 03.65.Ge, 03.65.Sq
","[{""version"":""v1"",""created"":""Fri, 29 Mar 1996 18:39:06 GMT""}]","2016-08-31"
"chem-ph/9603006","Abraham Klein","Wm. R. Greenberg, Abraham Klein, Ivalyo Zlatev, and C. T. Li","From Heisenberg matrix mechanics to EBK quantization: theory and first
  applications","37 pages including 3 poscript figures, submitted to Phys. Rev. A",,"10.1103/PhysRevA.54.1820",,"chem-ph chao-dyn nlin.CD nucl-th physics.chem-ph quant-ph",,"  Despite the seminal connection between classical multiply-periodic motion and
Heisenberg matrix mechanics and the massive amount of work done on the
associated problem of semiclassical (EBK) quantization of bound states, we show
that there are, nevertheless, a number of previously unexploited aspects of
this relationship that bear on the quantum-classical correspondence. In
particular, we emphasize a quantum variational principle that implies the
classical variational principle for invariant tori. We also expose the more
indirect connection between commutation relations and quantization of action
variables. With the help of several standard models with one or two degrees of
freedom, we then illustrate how the methods of Heisenberg matrix mechanics
described in this paper may be used to obtain quantum solutions with a modest
increase in effort compared to semiclassical calculations. We also describe and
apply a method for obtaining leading quantum corrections to EBK results.
Finally, we suggest several new or modified applications of EBK quantization.
","[{""version"":""v1"",""created"":""Fri, 29 Mar 1996 21:02:13 GMT""}]","2009-10-28"
"cond-mat/9603192","Daijiro Yoshioka","D. Yoshioka and A.H. MacDonald","Edge State Transport in Separately Contacted Double-Layer Quantum Hall
  Systems","4 pages, Revtex, two postscript figures attached","Phys. Rev. B53 (1996) R16168","10.1103/PhysRevB.53.R16168","IUCM96-008","cond-mat",,"  We develop a theory of edge state transport in separately contacted
double-layer quantum Hall systems which are tuned close to the resonance
condition for tunneling between the layers. When applied to the case where
contact is made to only one layer, the theory gives a quantized Hall resistance
and zero longitudinal resistance in both weak and strong inter-layer coupling
limits. For weak coupling, the leading correction to the Hall resistance occurs
at second order, while the longitudinal resistance appears at first order.
Recent experiments which show almost quantized Hall resistance and a
substantial longitudinal resistance are explained and predictions are made for
other contact configurations.
","[{""version"":""v1"",""created"":""Fri, 29 Mar 1996 20:13:09 GMT""}]","2009-10-28"
"cond-mat/9603193","Gerard Barkema","G.T. Barkema (IAS, Princeton), S. Flesia (Univ. of Oxford)","Two-dimensional oriented self-avoiding walks with parallel contacts","12 pages, revtex, 10 separate PostScript figures",,"10.1007/BF02174210","IASSNS-HEP-96/30","cond-mat",,"  Oriented self-avoiding walks (OSAWs) on a square lattice are studied, with
binding energies between steps that are oriented parallel across a face of the
lattice. By means of exact enumeration and Monte Carlo simulation, we
reconstruct the shape of the partition function and show that this system
features a first-order phase transition from a free phase to a tight-spiral
phase at $\beta_c=\log(\mu)$, where $\mu =2.638$ is the growth constant for
SAWs. With Monte Carlo simulations we show that parallel contacts happen
predominantly between a step close to the end of the OSAW and another step
nearby; this appears to cause the expected number of parallel contacts to
saturate at large lengths of the OSAW.
","[{""version"":""v1"",""created"":""Fri, 29 Mar 1996 20:29:50 GMT""}]","2009-10-28"
"cond-mat/9603194","Juan Jose Palacios","J. J. Palacios, D. Yoshioka, and A. H. MacDonald","Long-lived charged multiple-exciton complexes in strong magnetic fields","12 pages + 2 PostScript figures, Revtex, Submitted to Phys. Rev. Lett",,"10.1103/PhysRevB.54.R2296","IUCM96-007","cond-mat",,"  We consider the charged exciton complexes of an ideal two-dimensional
electron-hole system in the limit of strong magnetic fields. A series of
charged multiple-exciton states is identified and variational and finite-size
exact diagonalization calculations are used to estimate their binding energies.
We find that, because of a hidden symmetry, bound states of excitons and an
additional electron cannot be created by direct optical absorption and, once
created, have an infinite optical recombination lifetime. We also estimate the
optical recombination rates when electron and hole layers are displaced and the
hidden symmetry is violated.
","[{""version"":""v1"",""created"":""Fri, 29 Mar 1996 23:28:34 GMT""}]","2009-10-28"
"cond-mat/9603195","Rajiv Singh","Rajiv R. P. Singh and Joan Adler","High Temperature Expansion Study of the Nishimori multicritical Point in
  Two and Four Dimensions","5 pages, RevTex, 3 postscript files; To appear in Physical Review B",,"10.1103/PhysRevB.54.364",,"cond-mat",,"  We study the two and four dimensional Nishimori multicritical point via high
temperature expansions for the $\pm J$ distribution, random-bond, Ising model.
In $2d$ we estimate the the critical exponents along the Nishimori line to be
$\gamma=2.37\pm 0.05$, $\nu=1.32\pm 0.08$. These, and earlier $3d$ estimates
$\gamma =1.80\pm 0.15$, $\nu=0.85\pm 0.08$ are remarkably close to the critical
exponents for percolation, which are known to be $\gamma=43/18$, $\nu=4/3$ in
$d=2$ and $\gamma=1.805\pm0.02$ and $\nu=0.875\pm 0.008$ in $d=3$. However, the
estimated $4d$ Nishimori exponents $\gamma=1.80\pm 0.15$, $\nu=1.0\pm 0.1$, are
quite distinct from the $4d$ percolation results $\gamma=1.435\pm 0.015$,
$\nu=0.678\pm 0.05$.
","[{""version"":""v1"",""created"":""Sat, 30 Mar 1996 00:43:14 GMT""}]","2009-10-28"
"cond-mat/9603196","Ping Ao","D.J. Thouless, P. Ao and Q. Niu","Transverse force on a quantized vortex in a superfluid",,"Phys.Rev.Lett.76:3758-3761,1996","10.1103/PhysRevLett.76.3758",,"cond-mat hep-th",,"  We have derived an exact expression for the total nondissipative transverse
force acting on a quantized vortex moving in a uniform background. The
derivation is valid for neutral boson or fermion superfluids, provided the
order parameter is a complex scalar quantity. This force is determined by the
one-particle density matrix far away from the vortex core, and is found to be
the Magnus force proportional to the superfluid density. We conclude that
contributions of the localized core states do not change this force.
","[{""version"":""v1"",""created"":""Sat, 30 Mar 1996 06:25:23 GMT""}]","2009-01-23"
"cond-mat/9603197","Grigori Volovik","G.E. Volovik","Spectral Flow and Vortex Dynamics in Superfluids, Superconductors and
  Ferromagnets","Contributed paper to XXI International Conference on Low Temperature
  Physics, August 8-14, 1996. LaTeX file, 5 pages, no figures","Czechoslovak Journal of Physics 46 (1996) 913","10.1007/BF02583764",,"cond-mat",,"  We discuss the nondissipative Magnus-type force acting on linear defects in
Fermi systems, such as Abrikosov vortices in superconductors, singular and
continuous vortices in superfluid phases of $^3$He, magnetic vortices and
skyrmions in ferromagnets. Spectral flow of fermion zero modes in the vortex
core gives an essential contribution to the nondissipative force, which is
confirmed in Manchester experiments on rotating $^3$He-B. The spectral flow
effect is closely related to the angular momentum paradox.
","[{""version"":""v1"",""created"":""Sat, 30 Mar 1996 09:01:30 GMT""}]","2009-10-28"
"cond-mat/9603198",,"I.J.R. Aitchison, N.E. Mavromatos","Evidence for Deviations from Fermi-Liquid Behaviour in (2+1)-Dimensional
  Quantum Electrodynamics and the Normal Phase of High-$T_c$ Superconductors","20 pages, 1 macro",,,"Invited contribution by N. Mavromatos to 4-th Chia meeting on
  `common trends in particle and condensed matter physics', Chia-Laguna,
  Sardegna, Italy, September 1995","cond-mat",,"  We provide evidence that the gauge-fermion interaction in multiflavour
quantum electrodynamics in $(2 + 1)$-dimensions is responsible for non-fermi
liquid behaviour in the infrared, in the sense of leading to the existence of a
non-trivial (quasi) fixed point (cross-over) that lies between the trivial
fixed point (at infinite momenta) and the region where dynamical symmetry
breaking and mass generation occurs. This quasi-fixed point structure implies
slowly varying, rather than fixed, couplings in the intermediate regime of
momenta, a situation which resembles that of (four-dimensional) `walking
technicolour' models of particle physics. Connection with the anomalous
normal-state properties of certain condensed matter systems relevant for
high-temperature superconductivity is briefly discussed. The relevance of the
large (flavour) N expansion to the fermi-liquid problem is emphasized.
","[{""version"":""v1"",""created"":""Sat, 30 Mar 1996 15:52:38 GMT""}]","2007-05-23"
"dg-ga/9603017","Anton Malkin","Anton Yu. Alekseev (Uppsala) and Anton Z. Malkin (St.Petersburg)","The hyperbolic moduli space of flat connections and the isomorphism of
  symplectic multiplicity spaces","19 pages, AMS LaTeX",,,,"dg-ga math.DG math.QA q-alg",,"  Let $G$ be a simple complex Lie group, $\alg{g}$ be its Lie algebra, $K$ be a
maximal compact form of $G$ and $\alg{k}$ be a Lie algebra of $K$. We denote by
$X\rightarrow \overline{X}$ the anti-involution of $\alg{g}$ which singles out
the compact form $\alg{k}$. Consider the space of flat $\alg{g}$-valued
connections on a Riemann sphere with three holes which satisfy the additional
condition $\overline{A(z)}=-A(\overline{z})$. We call the quotient of this
space over the action of the gauge group $\overline{g(z)}=g^{-1}(\overline{z})$
a \emph{hyperbolic} moduli space of flat connections. We prove that the
following three symplectic spaces are isomorphic: 1. The hyperbolic moduli
space of flat connections. 2. The symplectic multiplicity space obtained as
symplectic quotient of the triple product of co-adjoint orbits of $K$. 3. The
Poisson-Lie multiplicity space equal to the Poisson quotient of the triple
product of dressing orbits of $K$.
","[{""version"":""v1"",""created"":""Fri, 29 Mar 1996 21:15:14 GMT""}]","2008-02-03"
"gr-qc/9603060","Philip Papadopoulos","Roberto Go'mez (1), Pablo Laguna (2), Philippos Papadopoulos (2) and
  Jeff Winicour (1) ((1) University of Pittsburgh, (2) Penn State University)","Cauchy-characteristic Evolution of Einstein-Klein-Gordon Systems","Submitted to Phys. Rev. D, 16 pages, revtex, 7 figures available at
  http://nr.astro.psu.edu:8080/preprints.html","Phys.Rev.D54:4719-4727,1996","10.1103/PhysRevD.54.4719","CGPG-96/4-1","gr-qc",,"  A Cauchy-characteristic initial value problem for the Einstein-Klein-Gordon
system with spherical symmetry is presented. Initial data are specified on the
union of a space-like and null hypersurface. The development of the data is
obtained with the combination of a constrained Cauchy evolution in the interior
domain and a characteristic evolution in the exterior, asymptotically flat
region. The matching interface between the space-like and characteristic
foliations is constructed by imposing continuity conditions on metric,
extrinsic curvature and scalar field variables, ensuring smoothness across the
matching surface. The accuracy of the method is established for all ranges of
$M/R$, most notably, with a detailed comparison of invariant observables
against reference solutions obtained with a calibrated, global, null algorithm.
","[{""version"":""v1"",""created"":""Fri, 29 Mar 1996 21:15:36 GMT""}]","2009-12-30"
"gr-qc/9603061","Simonetta Frittelli","S. Frittelli (1), C. N. Kozameh (2), E. T. Newman (1), C. Rovelli (1),
  R. S. Tate (1) ((1) University of Pittsburgh, PA, USA, (2) FAMAF, Argentina)","Fuzzy spacetime from a null-surface version of GR","17 pages, LateX, iopl styles (ioplppt.sty, iopl12.sty), amssym.def,
  amssym.tex. Invited contribution to the Class. Quantum Grav. special issue
  dedicated to Andrzej Trautman","Class.Quant.Grav.14:A143-A154,1997","10.1088/0264-9381/14/1A/012",,"gr-qc",,"  The null-surface formulation of general relativity -- recently introduced --
provides novel tools for describing the gravitational field, as well as a fresh
physical way of viewing it. The new formulation provides ``local'' observables
corresponding to the coordinates of points --- which constitute the spacetime
manifold --- in a {\em geometrically defined chart\/}, as well as non-local
observables corresponding to lightcone cuts and lightcones. In the quantum
theory, the spacetime point observables become operators and the spacetime
manifold itself becomes ``quantized'', or ``fuzzy''. This novel view may shed
light on some of the interpretational problems of a quantum theory of gravity.
Indeed, as we discuss briefly, the null-surface formulation of general
relativity provides (local) geometrical quantities --- the spacetime point
observables --- which are candidates for the long-sought physical operators of
the quantum theory.
","[{""version"":""v1"",""created"":""Fri, 29 Mar 1996 21:20:10 GMT""}]","2010-04-06"
"gr-qc/9603062",,"M. A. Clayton","Linearisation Instabilities of the Massive Nonsymmetric Gravitational
  Theory","14 pages, IOP style for submission to CQG. Minor changes and
  additional background material added","Class.Quant.Grav. 13 (1996) 2851-2864","10.1088/0264-9381/13/10/020","UTPT-96-04","gr-qc",,"  The massive nonsymmetric gravitational theory is shown to posses a
linearisation instability at purely GR field configurations, disallowing the
use of the linear approximation in these situations. It is also shown that
arbitrarily small antisymmetric sector Cauchy data leads to singular evolution
unless an ad hoc condition is imposed on the initial data hypersurface.
","[{""version"":""v1"",""created"":""Fri, 29 Mar 1996 22:17:36 GMT""},{""version"":""v2"",""created"":""Mon, 8 Jul 1996 16:58:50 GMT""}]","2009-10-28"
"hep-lat/9603026","Zheng Weihong","D.Sch\""utte (1), Zheng Weihong (2) and C.J. Hamer (2) ((1) Institut
  f\""ur Theoretische Kernphysik der Universit\""at Bonn (2) Univ. of NSW)","The Coupled Cluster Method in Hamiltonian Lattice Field Theory","LaTeX, no figure","Phys.Rev. D55 (1997) 2974-2986","10.1103/PhysRevD.55.2974",,"hep-lat",,"  The coupled cluster or exp S form of the eigenvalue problem for lattice
Hamiltonian QCD (without quarks) is investigated. A new construction
prescription is given for the calculation of the relevant coupled cluster
matrix elements with respect to an orthogonal and independent loop space basis.
The method avoids the explicit introduction of gauge group coupling
coefficients by mapping the eigenvalue problem onto a suitable set of character
functions, which allows a simplified procedure. Using appropriate group
theoretical methods, we show that it is possible to set up the eigenvalue
problem for eigenstates having arbitrary lattice momentum and lattice angular
momentum.
","[{""version"":""v1"",""created"":""Sat, 30 Mar 1996 00:36:05 GMT""}]","2016-08-15"
"hep-ph/9603439","Andrea Petrelli","Andrea Petrelli","Colour-octet NLO QCD corrections to hadronic $\chi_J$ decays","12 pages, latex, 3 figures","Phys.Lett.B380:159-164,1996","10.1016/0370-2693(96)00459-5","CERN-TH/96-84","hep-ph",,"  In this paper we present a complete next-to-leading order QCD calculation of
the $\chi_J$ ($^3P_J\; ;J=0,1,2$) hadronic decay width. We include the NLO
colour-octet contribution, as defined in the Bodwin, Braaten and Lepage
formalism. We extract an estimate of the colour-octet parameter \height\ from
the charmonium decay data.
","[{""version"":""v1"",""created"":""Fri, 29 Mar 1996 16:26:43 GMT""}]","2010-11-19"
"hep-ph/9603440","GOMEZ DUMM Daniel","D. Gomez Dumm","Main phenomenological features of the spontaneous CP violation in SU(3)
  x U(1) models","21 pages RevTex, epsf, epsfig, 4 figures","Int.J.Mod.Phys. A11 (1996) 887-901","10.1142/S0217751X96000407","LA PLATA - TH 95/15","hep-ph",,"  We analyze the phenomenological consequences of assuming spontaneous CP
violation in an SU(3) x U(1) model with three Higgs triplets and one sextuplet.
After the identification of the relevant physical scalars, we estimate the
contributions to the parameters $\Delta m_K$, $\epsilon$ and $\epsilon'$ coming
from the Higgs-fermion couplings.
","[{""version"":""v1"",""created"":""Fri, 29 Mar 1996 19:35:08 GMT""}]","2015-06-25"
"hep-ph/9603441","Jaume Guasch","Jaume Guasch, Joan Sola","Supersymmetric three-body decays of the Top Quark in the MSSM","35 pages, LaTeX, 18 figs, as two separate ps files using uufiles.
  Comments added, figs 16b and 16c corrected, some notation changed. Full
  postscript version soon avaliable at
  ftp://ftp.ifae.es/preprint/ft/uabft389.ps","Z.Phys. C74 (1997) 337-354",,"UAB-FT-389","hep-ph",,"  We survey all possible supersymmetric three-body decays of the top quark in
the framework of the MSSM and present detailed numerical analyses of the most
relevant cases. Although the two-body channels are generally dominant, it is
not inconceivable that some or all of our most favourite two-body SUSY
candidates could be suppressed. In this event there is still the possibility
that some of the available three-body SUSY modes might exhibit a substantial
branching fraction and/or carry exotic signatures that would facilitate their
identification. Furthermore, in view of the projected inclusive measurement of
the top-quark width $\Gamma_t$ in future colliders, one should have at one's
disposal the full second order correction (electroweak and strong) to the value
of that parameter in the MSSM. Our analysis confirms that some supersymmetric
three-body decays could be relevant and thus contribute to $\Gamma_t$ at a
level comparable to the largest one loop supersymmetric effects on two-body
modes recently computed in the literature.
","[{""version"":""v1"",""created"":""Fri, 29 Mar 1996 20:55:31 GMT""},{""version"":""v2"",""created"":""Wed, 17 Apr 1996 19:46:12 GMT""}]","2008-02-03"
"hep-ph/9603442",,"Jin Min Yang and Chong Sheng Li","Top-squark mixing effects in the supersymmetric electroweak corrections
  to top quark production at the Tevatron","11 pages, 3 figures, available at request","Phys. Rev. D 54, 4380 (1996)","10.1103/PhysRevD.54.4380","HNU-ITP-96-1","hep-ph",,"  Taking into account the mixing effects between left- and right-handed
top-squarks, we calculate the genuine supersymmetric eletroweak correction to
top quark production at the Tevatron in the minimal supersymmetric model. The
analytic expressions of the corrections to both the parton level cross section
and the total hadronic cross section are presented. Some numerical examples are
also given to show the size of the corrections.
","[{""version"":""v1"",""created"":""Sat, 30 Mar 1996 05:32:47 GMT""}]","2016-08-24"
