"hep-ph/9603443","Antonio Lanza","E.Kh. Akhmedov, A. Lanza, S.T. Petcov and D.W. Sciama","Resonant neutrino spin-flavor precession and supernova shock revival","16 pages, latex, 2 figures. added few references","Phys.Rev.D55:515-522,1997","10.1103/PhysRevD.55.515","SISSA 40/96/A-EP, TUM-HEP-239/96, SFB-375/83","hep-ph astro-ph",,"  A new mechanism of supernova shock revival is proposed, which involves
resonant spin--flavor precession of neutrinos with a transition magnetic moment
in the magnetic field of the supernova. The mechanism can be operative in
supernovae for transition magnetic moments as small as $10^{-14}\mu_B$ provided
the neutrino mass squared difference is in the range $\Delta m^2 \sim (3 \;{\rm
eV})^2-(600 \;{\rm eV})^2$. It is shown that this mechanism can increase the
neutrino--induced shock reheating energy by about 60\%.
","[{""version"":""v1"",""created"":""Sat, 30 Mar 1996 11:11:52 GMT""},{""version"":""v2"",""created"":""Tue, 16 Apr 1996 13:26:06 GMT""}]","2008-11-26"
"hep-th/9603196","Qw","J.E.Paschalis and P.I.Porfyriadis","BFV analysis of the $U_{EM}(1)$ gauged SU(3) WZW model and the
  Faddeev-Jackiw approach","10 pages, LaTex, no figures",,,"THES-TP 96/05","hep-th",,"  The four dimensional SU(3) WZW model coupled to electromagnetism is treated
as a constrained system in the context of Batalin-Fradkin- Vilkovisky
formalism. It is shown that this treatment is equivalent to the Faddeev-Jackiw
(FJ) approach. It is also shown that the field redefinitions that transform the
fields of the model into BRST and $\sigma$ closed are actually the Darboux's
transformations used in the FJ formalism.
","[{""version"":""v1"",""created"":""Sat, 30 Mar 1996 13:16:23 GMT""}]","2007-05-23"
"hep-th/9603198",,"Chien-Hao Liu (University of Miami)","Lorentz Surfaces and Lorentzian CFT --- with an appendix on quantization
  of string phase space","60 pages, 22 Postscript figures",,,"UMTG-190","hep-th",,"  The interest in string Hamiltonian system has recently been rekindled due to
its application to target-space duality. In this article, we explore another
direction it motivates. In Sec.\ 1, conformal symmetry and some algebraic
structures of the system that are related to interacting strings are discussed.
These lead one naturally to the study of Lorentz surfaces in Sec.\ 2. In
contrast to the case of Riemann surfaces, we show in Sec.\ 3 that there are
Lorentz surfaces that cannot be conformally deformed into Mandelstam diagrams.
Lastly in Sec.\ 4, we discuss speculatively the prospect of Lorentzian
conformal field theory.
  Additionally, to have a view of what quantum picture a string Hamiltonian
system may lead to, we discuss independently in the Appendix a formal geometric
quantization of the string phase space.
","[{""version"":""v1"",""created"":""Fri, 29 Mar 1996 23:00:58 GMT""}]","2007-05-23"
"hep-th/9603200","Steven Thomas","Omduth Coceal, Wafic A. Sabra and Steven Thomas","Duality Invariant Magnetohydrodynamics And Dyons","11 pages, latex",,"10.1209/epl/i1996-00566-9",,"hep-th plasm-ph",,"  The theory of magnetohydrodynamics is extended to the cases of a plasma of
separate magnetic and electric charges, as well as to a plasma of dyons
respectively. In both these cases the system possesses electric-magnetic
duality symmetry. In the former case we find that because of the existence of
two independent generalized Ohm's law equations, the limit of infinite electric
and magnetic conductivity results in the vanishing of both electric and
magnetic fields, as well as the corresponding currents. In the dyonic case, we
find that the resulting duality-invariant system of equations are equivalent to
those of ordinary MHD, after suitable field redefinitions.
","[{""version"":""v1"",""created"":""Fri, 29 Mar 1996 23:50:11 GMT""}]","2009-10-30"
"hep-th/9603201",,"G.Bimonte and G.Lozano","Symmetry Non Restoration and Inverse Symmetry Breaking on the lattice","13 pages, latex, no figures","Phys.Lett. B388 (1996) 692-701","10.1016/S0370-2693(96)01230-0","DFTUZ/96/11 , Imperial/TP/95-96/34","hep-th",,"  We study the finite temperature symmetry behaviour of O(N_1) \times O(N_2)
scalar models on the lattice and we prove that at sufficiently high
temperatures and in arbitrary dimensions their full symmetry is always restored
or, equivalently, that the phenomenon of Symmetry Non Restoration which,
according to lowest order perturbation theory, takes place in the continuum
version of these models, does not occur on the lattice.
","[{""version"":""v1"",""created"":""Fri, 29 Mar 1996 17:07:12 GMT""}]","2009-10-30"
"hep-th/9603202",,"L. H. Kauffman (Univ. Illinois) and H. P. Noyes (SLAC)","Discrete Physics and the Dirac Equation","LaTex 16 pages, 10 figures. To obtain a copy, send e-mail to
  techpub@slac.stanford.edu","Phys.Lett. A218 (1996) 139-146","10.1016/0375-9601(96)00436-7","SLAC-PUB-7115","hep-th quant-ph",,"  We rewrite the 1+1 Dirac equation in light cone coordinates in two
significant forms, and solve them exactly using the classical calculus of
finite differences. The complex form yields ``Feynman's Checkerboard''---a
weighted sum over lattice paths. The rational, real form can also be
interpreted in terms of bit-strings.
","[{""version"":""v1"",""created"":""Fri, 29 Mar 1996 20:36:16 GMT""}]","2009-10-30"
"hep-th/9603203","Zwanzige","Daniel Zwanziger (New York University)","Lattice Coulomb Hamiltonian and Static Color-Coulomb Field","110 pages + 1 fig., uuencoded compressed tar-file (190 kb) revised
  and shortened for readability. Technical derivations relegated to appendices.
  Concepts clarified in Introduction and Conclusion. One figure added","Nucl.Phys. B485 (1997) 185-240","10.1016/S0550-3213(96)00566-4","NYU-ThPhZ11-95","hep-th hep-lat",,"  The lattice Coulomb-gauge hamiltonian is derived from the transfer matrix of
Wilson's Euclidean lattice gauge theory, wherein the lattice form of Gauss's
law is satisfied identically. The restriction to a fundamental modular region
(no Gribov copies) is implemented in an effective hamiltonian by the addition
of a ""horizon function"" $G$ to the lattice Coulomb-gauge hamiltonian. Its
coefficient $\gamma_0$ is a thermodynamic parameter that ultimately sets the
scale for hadronic mass, and which is related to the bare coupling constant
$g_0$ by a ""horizon condition"". This condition determines the low-momentum
behavior of the (ghost) propagator that transmits the instantaneous
longitudinal color-electric field, and thereby provides for a confinement-like
feature in leading order in a new weak-coupling expansion.
","[{""version"":""v1"",""created"":""Fri, 29 Mar 1996 22:29:09 GMT""},{""version"":""v2"",""created"":""Mon, 24 Jun 1996 22:04:49 GMT""}]","2009-10-30"
"hep-th/9603204","Rajamani Narayanan","Rajamani Narayanan, Herbert Neuberger","Anomaly free U(1) chiral gauge theories on a two dimensional torus","30 pages","Nucl.Phys. B477 (1996) 521-548","10.1016/0550-3213(96)00405-1","UW/PT-96-04; DOE/ER/40561-254-INT96-00-123; RU-96-18","hep-th hep-lat hep-ph",,"  We consider anomaly free combinations of chiral fermions coupled to $U(1)$
gauge fields on a 2D torus first in the continuum and then on the lattice in
the overlap formulation. Both in the continuum and on the lattice, when the
background consists of sufficiently large constant gauge potentials the action
induced by the fermions varies significantly under certain singular gauge
transformations. ``Ruling away'' such discontinuities cannot be justified in
the continuum framework and does not naturally fit on the lattice. Complete
gauge invariance in the continuum can be restored in some models by choosing
special boundary conditions for the fermions. Evidence is presented that gauge
averaging the overlap phases in these models produces correct continuum
results.
","[{""version"":""v1"",""created"":""Fri, 29 Mar 1996 22:54:45 GMT""}]","2009-10-30"
"hep-th/9603205","Dave Robertson","David G. Robertson (Ohio State)","The Vacuum in Light-Cone Field Theory","20 pages, RevTeX, 4 Postscript figures. Minor typos corrected",,,"OHSTPY-HEP-T-96-011","hep-th hep-ph nucl-th",,"  This is an overview of the problem of the vacuum in light-cone field theory,
stressing its close connection to other puzzles regarding light-cone
quantization. I explain the sense in which the light-cone vacuum is
``trivial,'' and describe a way of setting up a quantum field theory on null
planes so that it is equivalent to the usual equal-time formulation. This
construction is quite helpful in resolving the puzzling aspects of the
light-cone formalism. It furthermore allows the extraction of effective
Hamiltonians that incorporate vacuum physics, but that act in a Hilbert space
in which the vacuum state is simple. The discussion is fairly informal, and
focuses mainly on the conceptual issues. [Talk presented at {\sc Orbis
Scientiae 1996}, Miami Beach, FL, January 25--28, 1996. To appear in the
proceedings.]
","[{""version"":""v1"",""created"":""Fri, 29 Mar 1996 23:03:23 GMT""},{""version"":""v2"",""created"":""Tue, 23 Apr 1996 14:14:10 GMT""}]","2008-02-03"
"hep-th/9603206","Mimura","Eric D'Hoker, Yukihiro Mimura, and Norisuke Sakai","Gauge Symmetry Breaking through Soft Masses in Supersymmetric Gauge
  Theories","LaTeX file, 37 page, some minor changes are included. Especially, the
  descriptions of sect. 2.5 are a little changed. Basic results are unchanged","Phys.Rev. D54 (1996) 7724-7740","10.1103/PhysRevD.54.7724","TIT/HEP-317, UCLA/96/TEP/11","hep-th hep-ph",,"  We analyze the effects of soft supersymmetry breaking terms on N=1
supersymmetric QCD with $N_f$ flavors and color gauge group $SU(N_c)$. The mass
squared of some squarks may be negative, as long as vacuum stability is ensured
by a simple mass inequality. For $N_f<N_c$, we include the dynamics of the
non-perturbative superpotential and use the original (s)quark and gauge fields,
while for $N_f>N_c+1$, we formulate the dynamics in terms of dual (s)quarks and
a dual gauge group $SU(N_f-N_c)$. The presence of negative squark mass squared
terms leads to spontaneous breakdown of flavor and color symmetry. We determine
this breaking pattern, derive the spectrum, and argue that the masses vary
smoothly as one crosses from the Higgs phase into the confining phase.
","[{""version"":""v1"",""created"":""Sat, 30 Mar 1996 03:26:21 GMT""},{""version"":""v2"",""created"":""Thu, 18 Apr 1996 07:49:36 GMT""},{""version"":""v3"",""created"":""Thu, 5 Sep 1996 12:42:32 GMT""}]","2009-10-30"
"math/9603203","Salah Baouendi","M. S. Baouendi, Xiaojun Huang, and Linda Preiss Rothschild","Nonvanishing of the differential of holomorphic mappings at boundary
  points",,,,,"math.CV",,"  In this paper we prove a general result of the ``Hopf lemma'' type for CR
mappings, with nonidentically vanishing Jacobians, between real hypersurfaces
in C^n with smooth or real analytic boundaries. Applications of this result to
finiteness and holomorphic extendibility of such mappings are also given. The
novelty here is that we make no assumption on the nonflatness of the mapping or
its Jacobian, nor do we assume that the hypersurfaces are pseudoconvex or
minimally convex.
","[{""version"":""v1"",""created"":""Fri, 29 Mar 1996 22:35:50 GMT""}]","2008-02-03"
"nucl-th/9603045","Karim Amir Azimi-Nili","T.T.S. Kuo (1), H. M\""uther (2), K. Amir-Azimi-Nili (2) ( (1)
  Department of Physics, SUNY-Stony Brook, Stony Brook, USA, (2) Institut f\""ur
  Theoretische Physik, Universit\""at T\""ubingen, T\""ubingen, Germany)","Realistic effective interactions for halo nuclei",,"Nucl.Phys. A606 (1996) 15-26; Erratum-ibid. A611 (1996) 587","10.1016/0375-9474(96)00205-9",,"nucl-th",,"  We study halo nuclei using a two-frequency shell-model approach employing
wave functions of two different oscillator constants $\hbar\omega_{in}$ and
$\hbar\omega_{out}$, the former for the inner orbits and the latter for the
halo (outer) orbits. An initial application has been made for the halo nuclei
$^6$He and $^6$Li, with $0s_{1/2}$ taken as the inner and ( $0p_{3/2}$,
$0p_{1/2}$) as the halo orbits. Starting from the Paris NN interaction, we have
derived a G-matrix folded-diagram effective interaction for this two-frequency
model space, using an essentially exact treatment for the Pauli exclusion
operator for the G-matrix. While keeping $\hbar\omega_{in}$ fixed, we have
performed calculations with different choices for $\hbar\omega_{out}$, treating
it as a variation parameter. For $\hbar\omega_{in}=19.7 MeV$ and
$\hbar\omega_{out}=8.2 MeV$, our calculated valence energies for $^6$He and
$^6$Li are -2.77 and -3.55 Mev, respectively, both in good agreement with
experiments. The importance of certain three-body-force diagrams is discussed.
","[{""version"":""v1"",""created"":""Fri, 29 Mar 1996 19:33:41 GMT""}]","2015-06-26"
"q-alg/9603027","Friedrich Knop","Friedrich Knop (Rutgers University)","Integrality of two variable Kostka functions","14 pages","J. Reine Angew. Math. 482 (1997), 177-189",,,"q-alg math.QA",,"  The two variable Kostka functions are the scalar products of the Macdonald
polynomials with the Schur polynomials with respect to the scalar product which
makes the Hall-Littlewood polynomials pairwise orthogonal. A conjecture of
Macdonald states that they are polynomials in q and t with non-negative
integral coefficients. We prove that the Kostka functions are at least
polynomials with integral coefficients. The main idea is to prove an analogous
statement for the non-symmetric Macdonald polynomials by establishing recursion
relations via the affine Hecke algebra.
","[{""version"":""v1"",""created"":""Fri, 29 Mar 1996 18:42:39 GMT""}]","2008-02-03"
"q-alg/9603028","Friedrich Knop","Friedrich Knop (Rutgers University)","Symmetric and non-symmetric quantum Capelli polynomials","15 pages","Comment. Math. Helv. 72 (1997), 84-100",,,"q-alg math.QA",,"  We define a family of symmetric and a family of non-symmetric polynomials in
terms of vanishing conditions. These families depend on two paramters, q and t.
Their main feature is that they consist of non-homogeneous polynomials. The
symmetric polynomials form the quantized version of polynomials occuring in the
context of generalized Capelli identities. We show that these quantum Capelli
polynomials are also characterized by q-difference equations. More precisely,
they are eigenfunctions of Cherednik type operators and transform under an
affine Hecke algebra. Thus, we are able to identify their top homogeneous
component as a Macdonald polynomial (symmetric or non-symmetric, respectively).
","[{""version"":""v1"",""created"":""Fri, 29 Mar 1996 18:40:09 GMT""}]","2008-02-03"
"q-alg/9603029","Chongying Dong","Chongying Dong, Haisheng Li and Geoffrey Mason","Hom functor and the associativity of tensor products of modules for
  vertex operator algebras","Latex, 26 pages",,,,"q-alg math.QA",,"  We give a new, construction-free proof of the associativity of tensor product
for modules for rational vertex operator algebras under certain convergence
conditions.
","[{""version"":""v1"",""created"":""Fri, 29 Mar 1996 18:38:27 GMT""}]","2008-02-03"
"q-alg/9603030","Katrina Barron","Katrina D. Barron","A supergeometric interpretation of vertex operator superalgebras","Latex file, 17 pages. To appear in International Mathematics Research
  Notices in 1996",,,,"q-alg hep-th math.QA",,"  Huang's geometric interpretation of vertex operator algebras is extended to a
supergeometric interpretation of vertex operator superalgebras. In particular,
the geometry of spheres with punctures and local analytic coordinates in terms
of exponentials of derivations is extended to the geometry of superspheres with
punctures, a given spin structure, and local superconformal coordinates in
terms of exponentials of superderivations. The notion of supergeometric vertex
operator superalgebra is introduced, and in addition, the notion of
(superalgebraic) vertex operator superalgebra over a Grassmann algebra and with
odd formal variables is introduced. The main result is that the category of
supergeometric vertex operator superalgebras over a Grassmann algebra with a
given spin structure and the category of vertex operator superalgebras over a
Grassmann algebra are isomorphic. In addition, the supergeometric symmetry
between the two different possible spin structures naturally gives rise to a
symmetry in the superalgebraic structure.
","[{""version"":""v1"",""created"":""Fri, 29 Mar 1996 20:45:42 GMT""}]","2008-02-03"
