"hep-ph/9611246","Gordon Ramsey","Gordon P. Ramsey (Loyola U Chicago and ANL)","Polarized Parton Distributions: Theory and Experiments","15 pages, 3 figures, LaTeX. To appear in the proceedings of the
  Circum-Pan-Pacific Workshop on High Energy Spin Physics 96, Kobe, Japan, 2-4
  October, 1996",,,,"hep-ph",,"  I review the constituent contributions to the spin of the proton extracted
from recent data at CERN, SLAC and DESY. The valence, sea quark and antiquark
spin-weighted distributions are determined separately. The data appear to imply
a small to moderate polarized gluon distribution, so that the anomaly term is
not significant in determining these contributions. We have analyzed the
consistency of the results obtained from various sets of data and the Bjorken
Sum Rule. All data are consistent with the sum rule, but they differ in the
contribution of the strange sea to proton spin. This and the remaining
uncertainty in the polarized gluon distribution pose unanswered questions about
hadronic spin. Further experiments are suggested which can extract information
about the polarized gluon and sea to address these questions.
","[{""version"":""v1"",""created"":""Tue, 5 Nov 1996 22:36:46 GMT""}]","2007-05-23"
"hep-ph/9611247","Alakabha Datta","A. Datta and X. Zhang","Non-Universal Correction to $Z \to b {\overline b}$ and Single Top Quark
  Production at Tevatron","8 pages, Latex, 1 figure, BIHEP-TH-96-29","Phys.Rev.D55:2530-2532,1997","10.1103/PhysRevD.55.2530",,"hep-ph",,"  New physics associated with the heavy top quark can affect top quark
production and the partial decay width of $Z \rightarrow b \bar b$. In this
paper, we examine the correlated effects of possible new physics on ${R_b}$
measured at LEP I and the single top quark production rate at Tevatron by using
an effective lagrangian technique. We point out that certain operators in the
effective lagrangian, constrained by the measured value of $R_b$, can lead to
significant and potentially observable effects in single top production.
","[{""version"":""v1"",""created"":""Wed, 6 Nov 1996 02:49:08 GMT""}]","2009-12-30"
"hep-ph/9611248","Passarino Giampiero","Giampiero Passarino (Torino University and INFN Torino)","Standard Higgs Boson Searches at LEP 2","47 pages, 21 Postscript figures","Nucl.Phys. B488 (1997) 3-38","10.1016/S0550-3213(97)00031-X",,"hep-ph",,"  For the first time at LEP most of the events will have four fermions in the
finals state and we have the unique opportunity of testing a complete
calculation with the experimental data, well beyond the usual approximation of
computing production cross section times branching ratios of Higgs into decay
products. Calculation of the total cross sections and of different kinds of
differential distributions at the partonic level are made available to access
the widest information for choosing cuts, for discussing the physics of a
standard Higgs boson with a mass around 90 GeV where the Higgs and the Z signal
become degenerate and for a comprehensive analysis of the various background
components.
","[{""version"":""v1"",""created"":""Wed, 6 Nov 1996 07:04:10 GMT""}]","2009-10-30"
"hep-ph/9611249","Gerhard Schuler","Gerhard A. Schuler (CERN)","GALUGA, a Monte Carlo program for two-photon processes in e+e-
  collisions","Latex, 29 pages, 7 figures, uses 12pt.sty, epsfig.sty, amsbsy.sty",,,"CERN-TH/96-313","hep-ph",,"  A Monte Carlo program is presented for the computation of the most general
cross section for two-photon production in e+e- collisions at fixed two-photon
invariant mass W. Functions implemented for the five gamma* gamma* structure
functions include three models of the total hadronic cross section and the
lepton-pair production cross section. Prospects of a structure-function
determination through a study of the azimuthal dependence between the two
scattering planes are outlined. All dependences on the electron mass and the
photon virtualities Q_i^2 are fully kept. Special emphasis is put on a
numerically stable evaluation of all variables over the full Q_i^2 range from
Q_{i\min}^2 \sim m_e^2 (W/\sqrt{s})^4 \ll m_e^2 up to Q_{i\max}^2 \sim s. A
comparison is made with an existing Monte Carlo program for lepton-pair
production and an equivalent-photon approximation for hadronic cross sections.
","[{""version"":""v1"",""created"":""Wed, 6 Nov 1996 13:18:39 GMT""}]","2016-09-06"
"hep-ph/9611250","Werner Wetzel","Jueping Liu and Werner Wetzel","Gluon-mass effects in quarkonia decays, $e^+e^-$ annihilation and the
  scalar glueball current","14 pages, latex, 5 figures",,,"HD-THEP 96-047","hep-ph",,"  In this paper we continue previous efforts in the literature to determine
phenomenological values for the gluon mass by confronting theoretical results
obtained in a theory of massive gluons with experimental values or results
directly referring to the nontrivial structure of the Yang-Mills vacuum, e.g.
to the presence of the gluon condensate. The decays of heavy quarkonia into 3
gluons and 2 gluons + photon are considered in detail as well as the
correlators of the electromagnetic current and the scalar glueball current.
Based on the analysis for the latter quantities a value for the gluon mass in
the range of 500-600 MeV is estimated from the standard SVZ-value of the gluon
condensate.
","[{""version"":""v1"",""created"":""Wed, 6 Nov 1996 09:42:13 GMT""}]","2007-05-23"
"hep-ph/9611251","Ellwanger","U. Ellwanger, M. Rausch de Traubenberg, C.A. Savoy","Phenomenology of supersymmetric models with a singlet","32 pages, 1 table, 6 figures, LaTeX2e","Nucl.Phys.B492:21-50,1997","10.1016/S0550-3213(97)00128-4","Orsay LPTHE-96-85, Saclay SPhT-T96/050, Strasbourg LPT-96-21","hep-ph",,"  The supersymmetric extension of the standard model with an additional gauge
singlet is analysed in detail in the light of the recent experimental bounds on
supersymmetric particles. The useful part of the parameter space and the
particle spectrum are displayed. We find that once the recent bounds on the
chargino mass are imposed, all other new particles practically satisfy the
present experimental limits. Special attention is given to particles to be
searched for in the future experiments. The singlet fields tend to decouple and
give rise to an effective MSSM, enlarging the validity of many phenomenological
analyses based in the minimal field content. However, in some ranges of the
parameters the singlino is the lightest neutralino, which modifies the
signature for susy particles. Simple analytical approximations are developed
that qualitatively explain the numerical results.
","[{""version"":""v1"",""created"":""Wed, 6 Nov 1996 11:05:22 GMT""}]","2010-05-27"
"hep-ph/9611252","Oleg Selugin","S.V. Goloskokov, S.P. Kuleshov, O.V. Selyugin","Spin asymmetries of the proton-proton elastic scattering at HERA-N","5 pages, 3 figures (files.eps) Talk on Workshop HERA-Dubna ""Spin
  Physics on HERA-N""",,,,"hep-ph",,"  The spin correlation parameters, polarization - $A_{N}$ and double spin
correlation parameters - $A_{NN}$, are calculated in the framework of dynamical
model (GKS) of the hadron-hadron interection in the whole region of small
angles and for energy HERA-N $\sqrt{s}=40 GeV$. It is shown that the
measurements of such spin effects at small trunsfer momenta, in the region of
the dip structure and at $t=-4 GeV^{2}$ have to give significant values of such
spin correlation parameters.
","[{""version"":""v1"",""created"":""Wed, 6 Nov 1996 10:54:52 GMT""}]","2007-05-23"
"hep-ph/9611253","U. Meissner","V. Bernard, N. Kaiser and Ulf-G. Mei{\ss}ner","Aspects of chiral pion-nucleon physics","19 pp, LaTeX, enlarged and revised version, title changed, minor
  corrections in section 4, more detailed discussion in section 5, additional
  results in sec. 6 and the appendix, accepted for publication in Nucl. Phys. A","Nucl.Phys. A615 (1997) 483-500","10.1016/S0375-9474(97)00021-3","KFA-IKP(Th)-1996-14 and LPT-96-22","hep-ph",,"  The next-to-leading order chiral pion-nucleon Lagrangian contains seven
finite low-energy constants. Two can be fixed from the nucleon anomalous
magnetic moments and another one from the quark mass contribution to the
neutron-proton mass splitting. We find a set of nine observables, which to one
loop order do only depend on the remaining four dimension two couplings. These
are then determined from a best fit. We also show that their values can be
understood in terms of resonance exchange related to $\Delta$ excitation as
well as vector and scalar meson exchange. In particular, we discuss the role of
the fictitious scalar-isoscalar meson. We also investigate the chiral expansion
of the two P-wave scattering volumes $P_1^-$ and $P_2^+$ as well as the
isovector S-wave effective range parameter $b^-$. The one-loop calculation is
in good agreement with the data. The difference $P_1^- - P_2^+$ signals chiral
loop effects in the $\pi N$ P-waves. The calculated D- and F-wave threshold
parameters compare well with the empirical values.
","[{""version"":""v1"",""created"":""Wed, 6 Nov 1996 13:27:36 GMT""},{""version"":""v2"",""created"":""Tue, 28 Jan 1997 08:58:45 GMT""}]","2016-09-06"
"hep-ph/9611254","Jonathan R. Ellis","John Ellis","Current Issues in the Phenomenology of Particle Physics","32 pages, LaTeX, 10 figures (included), Invited plenary talk
  presented at the Inaugural Conference of the APCTP, Seoul, June 1996","Int.J.Mod.Phys.A12:5531-5554,1997","10.1142/S0217751X97002905","CERN-TH/96-210","hep-ph",,"  The present status of the Standard Model and its experimental tests are
reviewed, including indications on the likely mass of the Higgs boson. Also
discussed are the motivations for supersymmetry and grand unification, searches
for sparticles at LEP, neutrino oscillations, and the prospects for physics at
the LHC.
","[{""version"":""v1"",""created"":""Wed, 6 Nov 1996 15:23:17 GMT""}]","2009-09-11"
"hep-th/9611027","Marcelo Gomes","M. Gomes, J. M. C. Malbouisson, and A. J. da Silva","Relativistic Corrections to the Aharonov-Bohm Scattering","14 pages, 5 figures, revtex","Phys.Lett. A236 (1997) 373-382","10.1016/S0375-9601(97)00831-1","IFUSP/P-1245","hep-th",,"  We determine the |p|/m expansion of the two body scattering amplitude of the
quantum theory of a Chern-Simons field minimally coupled to a scalar field with
quartic self-interaction. It is shown that the existence of a critical value of
the self-interaction parameter for which the 2-particle amplitude reduces to
the Aharonov-Bohm one is restricted to the leading, nonrelativistic, order. The
subdominant terms correspond to relativistic corrections to the Aharonov-Bohm
scattering.
","[{""version"":""v1"",""created"":""Tue, 5 Nov 1996 18:21:37 GMT""}]","2009-10-30"
"hep-th/9611028","Giovanni Amelino-Camelia","G. Amelino-Camelia, D. Bak, and D. Seminara","String-Inspired Gravity Coupled to Yang-Mills Fields","15 pages, LaTex.","Phys.Rev.D54:6193-6201,1996","10.1103/PhysRevD.54.6193","MIT-CTP-2539 OUTP-96-18-P SNUTP-96-044","hep-th gr-qc",,"  String-inspired 1+1-dimensional gravity is coupled to Yang-Mills fields in
the Cangemi-Jackiw gauge-theoretical formulation, based on the extended
Poincar\'e group. A family of couplings, which involves metrics obtainable from
the physical metric with a conformal rescaling, is considered, and the
resulting family of models is investigated both at the classical and the
quantum level. In particular, also using a series of Kirillov-Kostant phases,
the wave functionals that solve the constraints are identified.
","[{""version"":""v1"",""created"":""Tue, 5 Nov 1996 18:34:47 GMT""}]","2011-09-09"
"hep-th/9611029","George Papadopoulos","G. Papadopoulos","The Universality of M-branes","Many changes have been made in the text and some references have been
  added. 8 pages, Latex, Talk at the Imperial College Workshop 5-10 July",,"10.1142/9781848160927_0025","DAMTP-R/52","hep-th",,"  We review the evidence for the various dualities amongst the five D=10
superstring theories and for the existence of M-theory using the associated
effective supergravity theories. We also summarise the combinatorial technics
developed for constructing BPS solutions in D=11 supergravity theory and
conjecture that all the BPS solutions of D<11 supergravity theories can be
derived from the BPS solutions of D=11 supergravity that preserve 1/2 the
supersymmetry. To demonstrate this, we derive the dyonic p-brane solutions from
eleven dimensions.
","[{""version"":""v1"",""created"":""Tue, 5 Nov 1996 20:02:20 GMT""},{""version"":""v2"",""created"":""Thu, 23 Jan 1997 18:53:12 GMT""}]","2016-12-21"
"hep-th/9611030","Nami Fux Svaiter","A.P.C. Malbouisson, B.F. Svaiter and N.F. Svaiter","Analytic regularization of the Yukawa Model at Finite Temperature","19 pages, Latex","J.Math.Phys. 38 (1997) 2210-2218","10.1063/1.531969",,"hep-th",,"  We analyse the one-loop fermionic contribution for the scalar effective
potential in the temperature dependent Yukawa model. In order to regularize the
model a mix between dimensional and analytic regularization procedures is used.
We find a general expression for the fermionic contribution in arbitrary
spacetime dimension. It is found that in D=3 this contribution is finite.
","[{""version"":""v1"",""created"":""Tue, 5 Nov 1996 22:22:59 GMT""}]","2009-10-30"
"hep-th/9611031","Domingo J. Louis Martinez","Domingo Louis-Martinez (University of British Columbia)","Dirac Quantization of Two-Dimensional Dilaton Gravity Minimally Coupled
  to N Massless Scalar Fields",,"Phys.Rev.D55:7982-7984,1997","10.1103/PhysRevD.55.7982",,"hep-th",,"  It is shown that the Callan-Giddings-Harvey-Strominger theory on the cylinder
can be consistently quantized (using Dirac's approach) without imposing any
constraints on the sign of the gravitational coupling constant or the sign (or
value) of the cosmological constant. The quantum constraints in terms of the
original geometrical variables are also derived.
","[{""version"":""v1"",""created"":""Tue, 5 Nov 1996 22:52:44 GMT""}]","2011-09-09"
"hep-th/9611032","Lawrence M. Krauss","Lawrence M. Krauss and Hong Liu (Case Western Reserve University)","Quantum Hair, Instantons, and Black Hole Thermodynamics: Some New
  Results","35 pages, Latex, submitted to Nuclear Physics B: minor typos
  corrected","Nucl.Phys. B491 (1997) 365-386","10.1016/S0550-3213(97)00053-9","CWRU-P17-96","hep-th gr-qc",,"  We present results obtained by a consideration of the non-classical energy
momentum tensor associated with Euclidean Instantons outside the event horizon
of black holes. We demonstrate here how this allows an analytic estimate to be
made of the effect of discrete quantum hair on the temperature of the black
hole, in which the role of violations of the weak energy condition associated
with instantons is made explicit, and in which the previous results of Coleman,
Preskill, and Wilczek are extended. Last, we demonstrate how the existence of a
non-classical electric field outside the event horizon of black holes,
uncovered by these authors, can be identified with a well-known effect in the
Abelian-Higgs model in two dimensions. In this case, there is a one-to-one
connection between the discrete charge of a black hole and a topological phase
in two dimensions.
","[{""version"":""v1"",""created"":""Tue, 5 Nov 1996 22:51:01 GMT""},{""version"":""v2"",""created"":""Fri, 8 Nov 1996 20:29:37 GMT""}]","2016-09-06"
"hep-th/9611033","Francois Delduc","F. Delduc, L. Gallot, E. Ivanov","New super KdV system with the N=4 SCA as the hamiltonian structure","13 pages, LaTeX file, minor mistakes and misprints corrected","Phys.Lett. B396 (1997) 122-132","10.1016/S0370-2693(97)00133-0","ENSLAPP-L-623, JINR E2-96-394","hep-th",,"  We present a new integrable extension of the a=-2, N=2 SKdV hierarchy, with
the ""small"" N=4 superconformal algebra (SCA) as the second hamiltonian
structure. As distinct from the previously known N=4 supersymmetric KdV
hierarchy associated with the same N=4 SCA, the new system respects only N=2
rigid supersymmetry. We give for it both matrix and scalar Lax formulations and
consider its various integrable reductions which complete the list of known
SKdV systems with the N=2 SCA as the second hamiltonian structure. We construct
a generalized Miura transformation which relates our system to the $\alpha =
-2$, N=2 super Boussinesq hierarchy and, respectively, the ``small'' N=4 SCA to
the N=2 W_3 superalgebra.
","[{""version"":""v1"",""created"":""Wed, 6 Nov 1996 11:29:46 GMT""},{""version"":""v2"",""created"":""Fri, 22 Nov 1996 19:00:48 GMT""}]","2009-10-30"
"hep-th/9611034","Lises Ifa","Sergiu I. Vacaru","Superstrings in Higher Order Extensions of Finsler Superspaces","79 pages, latex209, latex figures, subm. Nucl. Phys. B","Nucl.Phys. B494 (1997) 590-656","10.1016/S0550-3213(97)00089-8",,"hep-th dg-ga gr-qc math.DG",,"  The work proposes a geometric background of the theory of field interactions
and strings in spaces with higher order anisotropy. Our approach proceeds by
developing the concept of higher order anisotropic superspace which unifies the
logical and mathematical aspects of modern Kaluza-Klein theories and
generalized Lagrange and Finsler geometry and leads to modelling of physical
processes on higher order fiber bundles provided with nonlinear and
distingushed connections and metric structures. The view adopted is that a
general field theory should incorporate all possible anisotropic and stochastic
manifestations of classical and quantum interactions and, in consequence, a
corresponding modification of basic principles and mathematical methods in
formulation of physical theories. The presentation is divided into two parts.
The first five sections cover the higher order anisotropic superspaces. We
focus on the geometry of distinguished by nonlinear connection vector
superbundles, consider different supersymmetric extensions of Finsler and
Lagrange spaces and analyze the structure of basic geometric objects on such
superspaces. The remaining five sections are devoted to the theory of higher
order anisotropic superstrings. In the framework of supersymmetric nonlinear
sigma models in Finser extended backgrounds we prove that the low-energy
dynamics of such strings contains motion equations for locally anisotropic
field interactions.
","[{""version"":""v1"",""created"":""Wed, 6 Nov 1996 13:30:43 GMT""},{""version"":""v2"",""created"":""Sat, 9 Nov 1996 17:02:38 GMT""}]","2009-10-30"
"nucl-ex/9611001",,"E. A. Pasyuk, V. Yu. Alexakhin, S. I. Gogolev, K. O. Oganesyan (JINR)
  C. L. Morris, J. M. O'Donnell, M. W. Rawool-Sullivan (LANL) M. K. Jones
  (Rutgers Univesity) F. F. Guber, A. I. Reshetin (INR, Moscow) I. I.
  Strakovsky (PNPI, St. Petersburg)","pi+ + d --> p + p reaction between 18 and 44 MeV","20 pages, 7 Postscript figures","Phys.Rev.C55:1026-1032,1997","10.1103/PhysRevC.55.1026","LA-UR-95-3656","nucl-ex",,"  A study of the reaction pi+ + d --> p + p has been performed in the energy
range of 18 - 44 MeV. Total cross sections and differential cross sections at
six angles have been measured at 15 energies with an energy increment of 1 - 2
MeV. This is the most systematic data set in this energy range. No structure in
the energy dependence of the cross section has been observed within the
accuracy of this experiment.
","[{""version"":""v1"",""created"":""Tue, 5 Nov 1996 23:14:53 GMT""}]","2008-11-26"
"nucl-th/9611008","Jorge G. Hirsch","Jorge G. Hirsch, Peter O. Hess and Osvaldo Civitarese","Double beta decay and the proton-neutron residual interaction","LaTeX, 10 pages plus 3 fugures as LaTeX files. Accepted for
  publication in Physics Letters B","Phys.Lett. B390 (1997) 36-40","10.1016/S0370-2693(96)01511-0",,"nucl-th",,"  The validity of the pn-QRPA and -RQRPA descriptions of double beta decay
transition amplitudes is analyzed by using an exactly solvable model. It is
shown that the collapse of the QRPA is physically meaningful and that it is
associated with the appearance of a state with zero energy in the spectrum. It
is shown that in the RQRPA this particular feature is not present and that this
approach leads to finite but otherwise spurious results for the double beta
decay transition amplitudes near the point of collapse.
","[{""version"":""v1"",""created"":""Tue, 5 Nov 1996 16:47:52 GMT""}]","2009-10-30"
"nucl-th/9611009","Pavlos Protopapas","Pavlos Protopapas, Abraham Klein","Possible solution of the Coriolis attenuation problem","revtex, including 7 figures(postscript), submitted to Phys.Rev.C","Phys.Rev.C55:1810-1818,1997","10.1103/PhysRevC.55.1810",,"nucl-th",,"  The most consistently useful simple model for the study of odd deformed
nuclei, the particle-rotor model (strong coupling limit of the core-particle
coupling model) has nevertheless been beset by a long-standing problem: It is
necessary in many cases to introduce an ad hoc parameter that reduces the size
of the Coriolis interaction coupling the collective and single-particle
motions. Of the numerous suggestions put forward for the origin of this
supplementary interaction, none of those actually tested by calculations has
been accepted as the solution of the problem. In this paper we seek a solution
of the difficulty within the framework of a general formalism that starts from
the spherical shell model and is capable of treating an arbitrary linear
combination of multipole and pairing forces. With the restriction of the
interaction to the familiar sum of a quadrupole multipole force and a monopole
pairing force, we have previously studied a semi-microscopic version of the
formalism whose framework is nevertheless more comprehensive than any
previously applied to the problem. We obtained solutions for low-lying bands of
several strongly deformed odd rare earth nuclei and found good agreement with
experiment, except for an exaggerated staggering of levels for K=1/2 bands,
which can be understood as a manifestation of the Coriolis attenuation problem.
We argue that within the formalism utilized, the only way to improve the
physics is to add interactions to the model Hamiltonian. We verify that by
adding a magnetic dipole interaction of essentially fixed strength, we can fit
the K=1/2 bands without destroying the agreement with other bands. In addition
we show that our solution also fits 163Er, a classic test case of Coriolis
attenuation that we had not previously studied.
","[{""version"":""v1"",""created"":""Tue, 5 Nov 1996 19:47:50 GMT""}]","2016-09-08"
"nucl-th/9611010","Yong Zhong Qian","Y.-Z. Qian (1), W. C. Haxton (2), K. Langanke (1), and P. Vogel (1)
  ((1) Caltech, (2) University of Washington)","Neutrino-induced neutron spallation and supernova r-process
  nucleosynthesis","34 pages, 4 PostScript figures, RevTex","Phys.Rev.C55:1532-1544,1997","10.1103/PhysRevC.55.1532",,"nucl-th astro-ph",,"  In order to explore the consequences of the neutrino irradiation for the
supernova r-process nucleosynthesis, we calculate the rates of charged-current
and neutral-current neutrino reactions on neutron-rich heavy nuclei, and
estimate the average number of neutrons emitted in the resulting spallation.
Our results suggest that charged-current $\nu_e$ captures can be important in
breaking through the waiting-point nuclei at N=50 and 82, while still allowing
the formation of abundance peaks. Furthermore, after the r-process freezes out,
there appear to be distinctive neutral-current and charged-current
postprocessing effects. A subtraction of the neutrino postprocessing effects
from the observed solar r-process abundance distribution shows that two mass
regions, A=124-126 and 183-187, are inordinately sensitive to neutrino
postprocessing effects. This imposes very stringent bounds on the freeze-out
radii and dynamic timescales governing the r-process. Moreover, we find that
the abundance patterns within these mass windows are entirely consistent with
synthesis by neutrino interactions. This provides a strong argument that the
r-process must occur in the intense neutrino flux provided by a core-collapse
supernova.
","[{""version"":""v1"",""created"":""Tue, 5 Nov 1996 20:46:27 GMT""}]","2016-09-08"
"nucl-th/9611011",,"Frank X. Lee, Derek B. Leinweber, Xuemin Jin","New QCD Sum Rules for Nucleon Axial Vector Coupling Constants","30 pages in RevTeX with 11 PS figures embedded. A brief conference
  contribution appeared earlier in nucl-th/9606026","Phys.Rev. D55 (1997) 4066-4082","10.1103/PhysRevD.55.4066","TRI-PP-96-44, UW-DOE/ER/40427-34-N96","nucl-th hep-ph",,"  Two new sets of QCD sum rules for the nucleon axial coupling constants are
derived using the external-field technique and generalized interpolating
fields. An in-depth study of the predicative ability of these sum rules is
carried out using a Monte-Carlo based uncertainty analysis. The results show
that the standard implementation of the QCD sum rule method has only marginal
predicative power for the nucleon axial coupling constants, as the relative
errors are large. The errors range from approximately 50 to 100% compared to
the nucleon mass obtained from the same method, which has only 10% to 25%
error. The origin of the large errors is examined. Previous analyses of these
coupling constants are based on sum rules that have poor OPE convergence and
large continuum contributions. Preferred sum rules are identified and their
predictions are obtained. We also investigate the new sum rules with an
alternative treatment of the problematic transitions which are not
exponentially suppressed in the standard treatment. The new treatment provides
exponential suppression of their contributions relative to the ground state.
Implications for other nucleon current matrix elements are also discussed.
","[{""version"":""v1"",""created"":""Tue, 5 Nov 1996 21:28:25 GMT""}]","2009-10-30"
