"cond-mat/9611035","Harsh Mathur","H. Mathur","Chiral Metal as a Heisenberg Ferromagnet","Latex, 5 pages, 1 figure",,"10.1103/PhysRevLett.78.2429",,"cond-mat.mes-hall",,"  The two dimensional surface of an integer quantum hall multilayer is mapped
onto a Heisenberg spin-chain with ferromagnetic coupling. Using this mapping it
is shown non-perturbatively that the surface states constitute a very
anisotropic metal in the infinite size limit. For multilayers of finite size,
two diffusive mesoscopic regimes are identified and the conductance
fluctuations are calculated perturbatively for both. The Heisenberg spin-chain
representation is used to study the directed wave problem and the exact result
is obtained that the mean-square deflection of a directed wave grows as the
square root of the propagation of the distance.
","[{""version"":""v1"",""created"":""Tue, 5 Nov 1996 18:46:03 GMT""}]","2009-10-28"
"cond-mat/9611036","Nadav Shnerb","N. Shnerb (Physics Department, Harvard University)","The effect of field tilting on the dynamics of vortices pinned by
  correlated disorder","9 pages, Latex, 1 ps figure",,"10.1103/PhysRevB.55.R3382",,"cond-mat.supr-con",,"  Low-temperature dynamics of flux lines in high temperature, type II,
superconductors in the presence of correlated disorder in the form of columnar
defects is discussed. The effect of tilting the applied magnetic field with
respect to the column's directions is considered, using the non-Hermitian
quantum mechanics technique evaluated by Hatano and Nelson. It is shown that
the critical current, as well as the vortex transport properties below this
current, may be determined by ``surface excitations'', i.e., by the roughness
of the flux line near the edges of the sample, which dominated the bulk jumps.
Phase space considerations determine the critical thickness of the sample,
below which the tilt induced surface transport exceeds the bulk mechanism. This
critical length, which depend on the tilt angle as well as the directions of
the perpendicular field and the suppercurrent, diverge at the delocalization
transition.
","[{""version"":""v1"",""created"":""Tue, 5 Nov 1996 22:08:56 GMT""}]","2009-10-28"
"cond-mat/9611037","Takahiro Fukui","T. Fukui, M. Sigrist and N. Kawakami","Low-Energy Properties of Regularly Depleted Spin Ladders","13 pages, revtex, 7 figures, to appear in PRB. A new section is
  added, in which we derived the spin-wave dispersion relation and analyzed the
  quantum fluctuation around it by means of the O(3) nonlinear sigma model",,"10.1103/PhysRevB.56.2530",,"cond-mat.stat-mech",,"  We investigate a model for the regularly depleted two-leg spin ladder
systems. By using Lieb-Schultz-Mattis theorem, it is rigorously shown that this
model realizes massless excitations or, alternatively, a degenerate ground
state, although the original spin ladder system has a spin gap and a unique
ground state. The ground state of the depleted model is either a spin singlet
or partially ferromagnetic reflecting topological properties of the depleted
sites. In order to show that the low-energy excitations are indeed massless, we
proceed our analysis in two different ways by resorting to effective field
theories. We first investigate an effective weak-coupling model in terms of
renormalization group methods. Although the tendency to massless spin
excitations is seen in the strong coupling regime, it turns out that the model
is still massive for any finite coupling, implying that a conventional
weak-coupling approach is not efficient to describe massless modes in our
model. To overcome this difficulty, we further study low-energy properties of
the depleted spin model by mapping on the non-linear sigma model, and confirm
that the massless spin excitation indeed occur.
","[{""version"":""v1"",""created"":""Tue, 5 Nov 1996 22:34:59 GMT""},{""version"":""v2"",""created"":""Tue, 15 Jul 1997 22:45:54 GMT""}]","2009-10-28"
"cond-mat/9611038","Kyungsun Moon","Kyungsun Moon","Topological Excitations in Double-Layer Quantum Hall systems","4 pages (Revtex) + 3 ps-figures; Vertex corrections are added in the
  new version; accepted to Phys. Rev. Lett",,"10.1103/PhysRevLett.78.3741",,"cond-mat.mes-hall",,"  Double-layer quantum Hall systems with spontaneous broken symmetry can
exhibit a novel manybody quantum Hall effect due to the strong interlayer
coherence. When the layer separation becomes close to the critical value,
quantum fluctuations can destroy the interlayer coherence and the quantum Hall
effect will disappear. We calculate the renormalized isospin stiffness $\rho_s$
due to quantum fluctuations within the Hartree-Fock-RPA formalism. The
activation energy of the topological excitations thus obtained demonstrates a
nice qualitative agreement with recent experiment.
","[{""version"":""v1"",""created"":""Tue, 5 Nov 1996 23:18:41 GMT""},{""version"":""v2"",""created"":""Thu, 3 Apr 1997 19:22:30 GMT""}]","2009-10-28"
"cond-mat/9611039","Josh Deutsch","J.M. Deutsch and Hyoungsoo Yoon","Macromolecular separation through a porous surface","18 pages latex, 6 postscript figures, using psfig",,"10.1063/1.474007","JMDHY96-1","cond-mat.soft",,"  A new technique for the separation of macromolecules is proposed and
investigated. A thin mesh with pores comparable to the radius of gyration of a
free chain is used to filter chains according to their length. Without a field
it has previously been shown that the permeability decays as a power law with
chain length. However by applying particular configurations of pulsed fields,
it is possible to have a permeability that decays as an exponential. This
faster decay gives much higher resolution of separation. We also propose a
modified screen containing an array of holes with barb-like protrusions running
parallel to the surface. When static friction is present between the
macromolecule and the protrusion, some of the chains get trapped for long
durations of time. By using this and a periodic modulation of an applied
electric field, high resolution can be attained.
","[{""version"":""v1"",""created"":""Wed, 6 Nov 1996 02:38:10 GMT""}]","2009-10-28"
"cond-mat/9611040","Michael Aizenman","Michael Aizenman","Scaling Limit for the Incipient Spanning Clusters","To appear in the IMA Volumes in Mathematics and its Applications,
  LaTeX, 24 pages, 7 (embedded) .eps figures. Minor revisions","in: Mathematics of Multiscale Materials; the IMA Volumes in
  Mathematics and its Applications (K. Golden, G. Grimmett, R. James, G.
  Milton, and P. Sen, eds.), Springer, 1998.",,,"cond-mat.stat-mech",,"  Scaling limits of critical percolation models show major differences between
low and high dimensional models. The article discusses the formulation of the
continuum limit for the former case. A mathematical framework is proposed for
the direct description of the limiting continuum theory. The resulting
structure is expected to exhibit strict conformal invariance, and facilitate
the mathematical discussion of questions related to universality of critical
behavior, conformal invariance, and some relations with a number of field
theories.
","[{""version"":""v1"",""created"":""Tue, 5 Nov 1996 20:11:39 GMT""},{""version"":""v2"",""created"":""Wed, 11 Dec 1996 23:15:02 GMT""},{""version"":""v3"",""created"":""Wed, 27 Aug 1997 21:36:34 GMT""},{""version"":""v4"",""created"":""Thu, 18 Sep 1997 18:50:20 GMT""}]","2009-09-25"
"cond-mat/9611041","Thomas Vilgis","M.P. Solf and T.A. Vilgis","Langevin Dynamics of a Polymer with Internal Distance Constraints","To appear in PRE, Figures on request",,"10.1103/PhysRevE.55.3037",,"cond-mat.soft",,"  We present a novel and rigorous approach to the Langevin dynamics of ideal
polymer chains subject to internal distance constraints. The permanent
constraints are modelled by harmonic potentials in the limit when the strength
of the potential approaches infinity (hard crosslinks). The crosslinks are
assumed to exist between arbitrary pairs of monomers. Formally exact
expressions for the resolvent and spectral density matrix of the system are
derived. To illustrate the method we study the diffusional behavior of monomers
in the vicinity of a single crosslink within the framework of the Rouse model.
The same problem has been studied previously by Warner (J. Phys. C: Solid State
Phys. {\bf 14}, 4985, (1981)) on the basis of Lagrangian multipliers. Here we
derive the full, hence exact, solution to the problem.
","[{""version"":""v1"",""created"":""Wed, 6 Nov 1996 10:01:01 GMT""}]","2009-10-28"
"cond-mat/9611042",,"M.R. Kibler, J. Meyer and M. Daoud","On $qp$-Deformations in Statistical Mechanics of Bosons in D Dimensions","15 pages, Latex File, to be published in Symmetry and Structural
  Properties of Condensed Matter, Eds. T. Lulek, B. Lulek and W. Florek (World
  Scientific, Singapore, 1997)",,,,"cond-mat.stat-mech math.QA physics.atom-ph physics.chem-ph q-alg quant-ph",,"  The Bose distribution for a gas of nonrelativistic free bosons is derived in
the framework of $qp$-deformed second quantization. Some thermodynamical
functions for such a system in D dimensions are derived. Bose-Einstein
condensation is discussed in terms of the parameters q and p as well as a
parameter $\nu_0'$ which characterizes the representation space of the
oscillator algebra.
","[{""version"":""v1"",""created"":""Wed, 6 Nov 1996 11:41:47 GMT""}]","2016-08-31"
"cond-mat/9611043","Norbert Schultka","Norbert Schultka","Finite-size scaling of the helicity modulus of the two-dimensional O(3)
  model","4 pages, 3 Postscript figures, to appear in Phys. Rev. B Jan. 1997 as
  a Brief Report",,"10.1103/PhysRevB.55.41",,"cond-mat.stat-mech hep-lat hep-th",,"  Using Monte Carlo methods, we compute the finite-size scaling function of the
helicity modulus $\Upsilon$ of the two-dimensional O(3) model and compare it to
the low temperature expansion prediction. From this, we estimate the range of
validity for the leading terms of the low temperature expansion of the
finite-size scaling function and for the low temperature expansion of the
correlation length. Our results strongly suggest that a Kosterlitz-Thouless
transition at a temperature $T > 0$ is extremely unlikely in this model.
","[{""version"":""v1"",""created"":""Wed, 6 Nov 1996 12:20:38 GMT""}]","2016-08-31"
"cond-mat/9611045","Marcelo Rozenberg","Marcelo J. Rozenberg","Integer filling metal insulator transitions in the degenerate Hubbard
  model","4 pages + 4 figures (in 5 ps-files), revtex",,"10.1103/PhysRevB.55.R4855",,"cond-mat.str-el",,"  We obtain exact numerical solutions of the degenerate Hubbard model in the
limit of large dimensions (or large lattice connectivity). Successive
Mott-Hubbard metal insulator transitions at integer fillings occur at
intermediate values of the interaction and low enough temperature in the
paramagnetic phase. The results are relevant for transition metal oxides with
partially filled narrow degenerate bands.
","[{""version"":""v1"",""created"":""Wed, 6 Nov 1996 15:52:50 GMT""}]","2009-10-28"
"gr-qc/9611011","Martin Rainer","A. Zhuk","On Relation between String Theory and Multidimensional Cosmology","latex, to appear in Gravitation and Cosmology","Grav.Cosmol. 2 (1996) 319-320",,"OU-DTP/96-01","gr-qc",,"  It is shown that a transition from a multidimensional cosmological model with
one internal space of the dimension d_1 to the effective tree-level bosonic
string corresponds to an infinite number of the internal dimensions: d_1 ->
infinity.
","[{""version"":""v1"",""created"":""Tue, 5 Nov 1996 16:17:37 GMT""}]","2007-05-23"
"gr-qc/9611012","Nicholas G. Phillips","Nicholas G. Phillips, B. L. Hu","Fluctuations of the vacuum energy density of quantum fields in curved
  spacetime via generalized zeta functions","Uses revtex","Phys.Rev. D55 (1997) 6123-6134","10.1103/PhysRevD.55.6123","UMDPP#97-58","gr-qc",,"  For quantum fields on a curved spacetime with an Euclidean section, we derive
a general expression for the stress energy tensor two-point function in terms
of the effective action. The renormalized two-point function is given in terms
of the second variation of the Mellin transform of the trace of the heat kernel
for the quantum fields. For systems for which a spectral decomposition of the
wave opearator is possible, we give an exact expression for this two-point
function. Explicit examples of the variance to the mean ratio $\Delta' =
(<\rho^2>-<\rho>^2)/(<\rho>^2)$ of the vacuum energy density $\rho$ of a
massless scalar field are computed for the spatial topologies of $R^d\times
S^1$ and $S^3$, with results of $\Delta'(R^d\times S^1) =(d+1)(d+2)/2$, and
$\Delta'(S^3) = 111$ respectively. The large variance signifies the importance
of quantum fluctuations and has important implications for the validity of
semiclassical gravity theories at sub-Planckian scales. The method presented
here can facilitate the calculation of stress-energy fluctuations for quantum
fields useful for the analysis of fluctuation effects and critical phenomena in
problems ranging from atom optics and mesoscopic physics to early universe and
black hole physics.
","[{""version"":""v1"",""created"":""Tue, 5 Nov 1996 19:47:39 GMT""}]","2016-08-31"
"gr-qc/9611013","Nami Fux Svaiter","R. De Paola and N.F. Svaiter","Radiative processes for Rindler and accelerating observers and the
  stress-tensor detector","36 pages, Latex",,,,"gr-qc",,"  We consider a monopole detector interacting with a massive scalar field. The
radiative processes are discussed from the accelerated frame point of view.
After this, we obtain the Minkowski vacuum stress tensor measured by the
accelerated observer using a non-gravitational stress tensor detector as
discussed by Ford and Roman (PRD 48, 776 (1993)). Finally, we analyse radiative
processes of the monopole detector travelling in a world line that is inertial
in the infinite past and has a constant proper acceleration in the infinite
future.
","[{""version"":""v1"",""created"":""Tue, 5 Nov 1996 22:20:05 GMT""}]","2007-05-23"
"gr-qc/9611014","Shuhei Mano","Shuhei Mano and Eiichi Takasugi","Analytic Solutions of the Teukolsky Equation and their Properties","28 pages","Prog.Theor.Phys. 97 (1997) 213-232","10.1143/PTP.97.213",,"gr-qc",,"  The analytical solutions reported in our previous paper are given as series
of hypergeometric or Coulomb wave functions. By using them, we can get the
Teukolsky functions analytically in a desired accuracy. For the computation,
the deep understanding of their properties is necessary. We summarize the main
result: The relative normalization between the solutions with a spin weight s
and -s is given analytically by using the Teukolsky-Starobinsky (T-S)
identities. By examining the asymptotic behaviors of our solution and combined
with the T-S identities and the Wronskian, we found nontrivial identities
between the sums of coefficients of the series. These identities will serve to
make various expression in simpler forms and also become a powerful tool to
test the accuracy of the computation. As an application, we investigated the
absorption rate and the evaporation rate of black hole and obtain interesting
analytic results.
","[{""version"":""v1"",""created"":""Wed, 6 Nov 1996 10:05:33 GMT""}]","2009-10-28"
"gr-qc/9611015","Mahmut Hortacsu","M. Hortacsu and N. Ozdemir","An Extension of Multiple Cosmic String Solution: A Proposal","8 pages, latex",,,"MRC-PH.TH-13/96","gr-qc",,"  We extend the work done for cosmic strings and show that for a more general
class of locally flat metrics the one loop calculation do not introduce any new
divergences to the VEV of the energy of a scalar particle. We explicitly
perform the calculation for the configuration where we have one cosmic string
in the presence of a dipole made out of cosmic strings.
","[{""version"":""v1"",""created"":""Wed, 6 Nov 1996 13:49:31 GMT""}]","2007-05-23"
"hep-ex/9611003",,"Reinhard A. Schumacher (Carnegie Mellon University)","Photoproduction evidence for and against hidden-strangeness states near
  2 GeV","9 pages, RevTex, five postscript figures, submitted to PRD","Phys.Rev.C56:2774-2778,1997","10.1103/PhysRevC.56.2774","CMUMEG-96007","hep-ex nucl-ex",,"  Experimental evidence from coherent diffractive proton scattering has been
reported for two narrow baryonic resonances which decay predominantly to
strange particles. These states, with masses close to 2.0 GeV would, if
confirmed, be candidates for hidden strangeness states with unusual internal
structure. In this paper we examine the literature on strangeness
photoproduction, to seek additional evidence for or against these states. We
find that one state is not confirmed, while for the other state there is some
mild supporting evidence favoring its existence. New experiments are called
for, and the expected photoproduction lineshapes are calculated.
","[{""version"":""v1"",""created"":""Tue, 5 Nov 1996 17:23:06 GMT""}]","2008-11-26"
"hep-ex/9611004","Ralph Eichler","S. Aid, et al. (H1 Collaboration)","Scale Influence on the Energy Dependence of Photon-Proton Cross Sections","13 pages, latex, 3 Figures","Phys.Lett.B392:234-242,1997","10.1016/S0370-2693(96)01594-8","DESY 96-224","hep-ex",,"  The scale dependence of the evolution of photoproduction cross sections with
the photon-proton centre of mass energy W is studied using low Q^2 < 0.01 GeV^2
e^+p interactions collected by the H1 experiment at HERA. The value of the
largest transverse momentum of a charged particle in the photon fragmentation
region is used to define the hard scale. The slope of the $W$ dependence of the
cross section is observed to increase steeply with increasing transverse
momentum. The result is compared to measurements of the Q^2 evolution of the W
dependence of the virtual photon-proton cross section. Interpretations in terms
of QCD and in terms of Regge phenomenology are discussed.
","[{""version"":""v1"",""created"":""Wed, 6 Nov 1996 15:05:09 GMT""}]","2008-11-26"
"hep-lat/9611005","Klaus Scharnhorst","K. Scharnhorst (University of Wales Swansea and Humboldt University
  Berlin)","The exact equivalence of the one-flavour lattice Thirring model with
  Wilson fermions to a two-colour loop model","29 pages LaTeX","Nucl.Phys.B503:479-504,1997","10.1016/S0550-3213(97)00423-9","SWAT/96/131, HUB-EP-96/56","hep-lat cond-mat hep-th",,"  Within Euclidean lattice field theory an exact equivalence between the
one-flavour 2D Thirring model with Wilson fermions and Wilson parameter $r = 1$
to a two-colour loop model on the square lattice is established. For
non-interacting fermions this model reduces to an exactly solved loop model
which is known to be a free fermion model. The two-colour loop model equivalent
to the Thirring model can also be understood as a 4-state 49-vertex model.
","[{""version"":""v1"",""created"":""Wed, 6 Nov 1996 13:19:37 GMT""}]","2008-11-26"
"hep-ph/9611232","Michael Spira","W.Beenakker, R.Hoepker, M.Spira","PROSPINO: A Program for the Production of Supersymmetric Particles in
  Next-to-leading Order QCD","12 pages, latex, no figures, Complete postscript file and FORTRAN
  source codes available from http://wwwcn.cern.ch/~mspira/prospino/",,,,"hep-ph",,"  A Fortran-program for the production cross-sections of squarks and gluinos at
hadron colliders is described. It includes full next-to-leading order SUSY-QCD
corrections to all possible final states ($\squark\squarkbar, \gluino\gluino,
\squark\gluino, \squark\squark$). The program allows to calculate total
cross-sections as well as differential distributions in the transverse momentum
p_t and the rapidity y of one of the outgoing particles. In addition cuts in
p_t and y can easily be implemented.
","[{""version"":""v1"",""created"":""Tue, 5 Nov 1996 17:15:17 GMT""}]","2016-09-06"
"hep-ph/9611237","Francesco Vissani","Marco Fabbrichesi and Francesco Vissani","The supersymmetric prediction for the muon transverse polarization in
  the $K^+ \leftarrow \pi^0 \mu^+ \nu_\mu$ decay","latex, 18 pages, 1 latex figure","Phys.Rev.D55:5334-5340,1997","10.1103/PhysRevD.55.5334","IC/96/220, SISSA 140/96/EP","hep-ph",,"  The muon transverse polarization in the $K^+ \leftarrow \pi^0 \mu^+ \nu_\mu$
decay will be measured at the $10^{-4}$ level in forthcoming experiments. We
compare the phenomenological perspectives with the theoretical predictions in
supersymmetric extensions of the standard model. In the minimal extension,
CP-violating phases lead to a non-zero transverse polarization, that however is
too small to account for a positive experimental signal. The problems that one
encounters when departing from minimal assumptions are discussed. An observable
effect is possible if the hypothesis of R-parity conservation is relaxed, but
only at the price of assuming a very special pattern for the R-parity breaking
couplings.
","[{""version"":""v1"",""created"":""Tue, 5 Nov 1996 19:01:56 GMT""}]","2014-11-17"
"hep-ph/9611240","Scott Willenbrock","S. Willenbrock (U. of Illinois)","Top Quark Theory","9 pages, LateX, uses stwol.sty, 3 ps figures included. Plenary talk
  presented at the 28th International Conference on High Energy Physics, July
  25-31, 1996, Warsaw, Poland",,,,"hep-ph",,"  I review recent theoretical work on top-quark physics within the standard
model, beyond the standard model, and at the Planck scale.
","[{""version"":""v1"",""created"":""Tue, 5 Nov 1996 17:00:50 GMT""}]","2007-05-23"
"hep-ph/9611241","Bernd Krause","Andrzej Czarnecki and Bernd Krause","Computing Techniques for Two-Loop Corrections to Anomalous Magnetic
  Moments of Leptons","Updated Higher Order Hadronic Corrections. Talk given at the 5th
  International Workshop ``New Computing Techniques in Physics Research'',
  Lausanne, September 1996. 7 pages, latex","Nucl.Instrum.Meth.A389:314-317,1997","10.1016/S0168-9002(97)00113-7","TTP96-51","hep-ph",,"  Two-loop electroweak corrections to the electron, muon, and tau lepton
anomalous magnetic moments have been computed recently. Effects of hadronic
contributions to the photon propagator in two-loop QED corrections have also
been reanalysed. The common technique used in both calculations was asymptotic
expansion of Feynman diagrams in the ratio of lepton mass to some heavy mass
scale. In this talk we present some details of this method paying particular
attention to the expansion of multi-scale diagrams.
","[{""version"":""v1"",""created"":""Tue, 5 Nov 1996 17:25:30 GMT""},{""version"":""v2"",""created"":""Tue, 12 Nov 1996 15:05:20 GMT""}]","2011-04-15"
"hep-ph/9611242","Elena Boglione","M.R. Pennington","Calculating hadronic properties in strong QCD","6 Latex pages, 5 figures",,,,"hep-ph",,"  This talk, given at the Second Workshop on ELFE Physics, St Malo, France,
September 1996, presents a brief review of the progress that has been made in
calculating the properties of hadrons in strong QCD.
","[{""version"":""v1"",""created"":""Tue, 5 Nov 1996 18:40:38 GMT""}]","2007-05-23"
"hep-ph/9611243","Andrea Romanino","Gautam Bhattacharyya and Andrea Romanino","Naturalness constraints on gauge-mediated supersymmetry breaking models","Latex, 8 pages, 1 eps figure enclosed. Minor changes, version to be
  published","Phys.Rev. D55 (1997) 7015-7019","10.1103/PhysRevD.55.7015","IFUP-TH 67/96","hep-ph",,"  The question of naturalness is addressed in the context of gauge-mediated
supersymmetry breaking models. Requiring that $M_Z$ arises naturally imposes
upper limits on the right-handed selectron mass in these models that are
stronger than in the Minimal Supersymmetric Standard Model and are interesting
from the point of view of searches at the current and future colliders.
","[{""version"":""v1"",""created"":""Tue, 5 Nov 1996 21:24:59 GMT""},{""version"":""v2"",""created"":""Thu, 27 Feb 1997 13:09:41 GMT""}]","2009-10-30"
"hep-ph/9611244","Tim Tait","Tim Tait and C.--P. Yuan","Anomalous t-c-g coupling: The connection between single top production
  and top decay","5 pages. Requires epsf.sty to process .eps formatted figures","Phys.Rev.D55:7300-7301,1997","10.1103/PhysRevD.55.7300","MSUHEP-61105","hep-ph",,"  Continuing earlier work, we examine the constraint on an anomalous t-c-g
coupling from top quark decay. We find that from current CDF measurements of
the branching ratio $t \rightarrow W b$, the minimum scale at which new physics
can strongly modify the t-c-g coupling is \Ltcg $\geq$ about 950 GeV. At the
upgraded Tevatron, single top production can constrain \Ltcg $\geq$ 4.5 TeV.
The connection between t-c production and the decay $t \rightarrow c g$ is
examined, showing how constraints on one lead to a constraint on the other.
","[{""version"":""v1"",""created"":""Tue, 5 Nov 1996 22:11:09 GMT""}]","2008-11-26"
"hep-ph/9611245","Charles A. Nelson","Charles A. Nelson","Tau Decays Beyond the Standard Model","9 pages, latex, no figures Talk at TAU96 workshop",,"10.1016/S0920-5632(97)00224-7","SUNY BING 10/30/96","hep-ph",,"  In a recent paper, 8 semileptonic parameters were defined to specify the most
general Lorentz-invariant spin correlation functions for 2-body tau decays.
These parameters can be used to search for anomalous longitudinal-versus
transverse polarized-partial widths, for non-CKM-type leptonic CP violation,
and for leptonic T violation. They can also be used to bound the effective-mass
scales ``Lambda"" for new physics arising from additional Lorentz structures,
e.g. from lepton compositeness, tau weak magnetism, weak electricity, or
second-class currents. It is emphasized that (i) for these tests ``different
modes have different merits"" and that (ii) the parameters can be measured
either by using spin-correlation techniques without polarized beams, or with
longitudinally polarized beams.
","[{""version"":""v1"",""created"":""Tue, 5 Nov 1996 17:13:35 GMT""}]","2009-10-30"
