"physics/9611004","Ruth Haeckl","R. Haeckl, V. Hund, H. Pilkuhn","Eight-component differential equation for leptonium","10 pages; no figures. The complete paper, including figures, is also
  available via anonymous ftp at ftp://ttpux2.physik.uni-karlsruhe.de/ , or via
  www at http://www-ttp.physik.uni-karlsruhe.de/cgi-bin/preprints/",,,"TTP96-50","physics.atom-ph",,"  It is shown that the potential for lepton-antilepton bound states (leptonium)
is the Fourier transform of the first Born approximation to the QED scattering
amplitude in an 8-component equation, while 16-component equations are
excluded. The Fourier transform is exact at all cms energies $-\infty < E <
\infty$; the resulting atomic spectrum is explicitly CPT-invariant.
","[{""version"":""v1"",""created"":""Tue, 5 Nov 1996 18:54:47 GMT""}]","2016-09-08"
"physics/9611005","Peter O. Fedichev","P. O. Fedichev","Formation of antihydrogen atoms in an ultra-cold positron-antiproton
  plasma","A talk given on ITAMP Workshop on Exotic Atoms, July 11-13, 1996;
  submitted to Physics Letters A; 3 pages, RevTeX",,"10.1016/S0375-9601(96)00944-9",,"physics.atom-ph",,"  We discuss the formation of antihydrogen atoms ($\bar{\rm H}$) in an
ultra-cold positron-antiproton plasma. For positron densities $n_p\agt 10^8$
cm$^{-3}$ the characteristic formation time of stable $\bar{H}$ is determined
by collisional relaxation of highly excited atoms produced in the process of
3-body Thompson recombination. Relying on the mechanisms of ``replacement
collisions'' and ``transverse collisional drift'' we find a bottleneck in the
relaxation kinetics and analyze the physical consequences of this phenomenon.
","[{""version"":""v1"",""created"":""Wed, 6 Nov 1996 13:18:32 GMT""}]","2016-09-08"
"quant-ph/9611007","Imafuku Kentaro","Kentaro Imafuku (Department of Physics, Waseda University), Ichiro
  Ohba (Department of Physics, Waseda University) and Yoshiya Yamanaka (Waseda
  University Senior High School)","Effects of Inelastic Scattering on Tunneling Time in Generalized
  Nelson's Quantum Mechanics","25 pages, 10 Postscript figures",,,"WU-HEP-96-8","quant-ph",,"  We analyze the effects of inelastic scattering on the tunneling time
theoretically, using generalized Nelson's quantum mechanics. This
generalization enables us to describe quantum system with optical potential and
channel couplings in a real time stochastic approach, which seems to give us a
new insight into quantum mechanics beyond Copenhagen interpretation.
","[{""version"":""v1"",""created"":""Wed, 6 Nov 1996 04:06:07 GMT""}]","2007-05-23"
"solv-int/9611004",,"D. F. Wang","Spinless Calogero-Sutherland model with twisted boundary condition","preprint of ETH-L, appearing in recent PRE",,"10.1103/PhysRevE.54.4586",,"solv-int nlin.SI",,"  In this work, the spinless Calogero-Sutherland model with twisted boundary
condition is studied. The ground state wavefunctions, the ground state
energies, the full energy spectrum are provided in details.
","[{""version"":""v1"",""created"":""Wed, 6 Nov 1996 10:05:06 GMT""}]","2009-10-30"
