"physics/9611010","Ronald Kleiss","Fred James, Jiri Hoogland and Ronald Kleiss","Quasi-Monte Carlo, Discrepancies and Error Estimates","9 pages, standard LaTeX, no special macros. (presented at the 2nd
  International Conference on Monte Carlo and Quasi-Monte Carlo Methods in
  Scientific Computing, Salzburg, Austria, july 9-12,1996)",,,,"physics.comp-ph hep-ph",,"  We discuss the problem of defining an estimate for the error in quasi-Monte
Carlo integration. The key issue is the definition of an ensemble of
quasi-random point sets that, on the one hand, includes a sufficiency of
equivalent point sets, and on the other hand uses information on the degree of
uniformity of the point set actually used, in the form of a discrepancy or
diaphony. A few examples of such discrepancies are given. We derive the
distribution of our error estimate in the limit of large number of points. In
many cases, Gaussian central limits are obtained. We also present numerical
results for the quadratic star-discrepancy for a number of quasi-random
sequences.
","[{""version"":""v1"",""created"":""Tue, 12 Nov 1996 13:36:04 GMT""}]","2008-02-03"
"q-alg/9611011","Andrei Okounkov","Andrei Okounkov","BC-type interpolation Macdonald polynomials and binomial formula for
  Koornwinder polynomials","28 pages, AMS TeX; replaced with revised journal version, to appear
  in Transf. Groups",,,,"q-alg math.QA",,"  We consider 3-parametric polynomials which replace the A-series interpolation
Macdonald polynomials in the BC case. For these polynomials, we prove: an
integral representation, a combinatorial formula, Pieri-type rules, Cauchy
identity, and we also show that they do not satisfy any rational q-difference
equation. We also prove a binomial formula for the 6-parametric Koornwinder
polynomials.
","[{""version"":""v1"",""created"":""Mon, 11 Nov 1996 17:49:46 GMT""},{""version"":""v2"",""created"":""Wed, 17 Dec 1997 23:19:27 GMT""}]","2008-02-03"
"quant-ph/9611016","Daniel I. Fivel","Daniel I. Fivel","A Dynamical Reduction Theory of Einstein-Podolsky-Rosen Correlations and
  a Possible Origin of CP Violations","30 pages, 0 figures, LaTeX",,"10.1103/PhysRevA.56.146",,"quant-ph",,"  We show that there is essentially only one way to construct a stochastic
Schrodinger equation that gives a dynamical account of the transformation of
entangled into factorized states and is consistent both with quantum mechanics
and required symmetries. The noisy, non-linear term is a unimodular scalar
multiple of the time reversal operator that must be present whenever a
Hamiltonian term in the Schrodinger equation can distinguish the factorized
constituents of an entangled state. The dynamical mechanism involved in the
transformation of entangled into factorized states provides an explanation for
the fact that Einstein-Podolsky-Rosen correlations appear in a time determined
by the response of the measuring device and independent of the distance between
the particles. The dependence on the response time of the measuring device may
be testable through a delay in observing the collapse of mesoscopic
``Schrodinger cat"" states in ion traps. It is further shown that there are
situations where a two-particle interaction can induce a non-linear term by
virtue of coupling to decay modes that distinguish factorized constituents of
an entangled state. We show that this should happen in the neutral K-meson
system where the entangled $K_L$ state is pushed slightly in the direction of a
factorized constituent ($K_o$ or $\overline{K_o}$) as a consequence of the fact
that these can be distinguished via the sign of the charged lepton in a
semi-leptonic decay mode. The result is a CP violation that is within 20% of
the experimental value.
","[{""version"":""v1"",""created"":""Tue, 12 Nov 1996 02:57:41 GMT""}]","2009-10-30"
