"hep-ph/9609261","Paul Blanchard Mackenzie","Paul B. Mackenzie (Fermilab)","Recent Lattice Results on the Light Quark Masses","7 pages, 4 embedded figures. Plenary talk given at LATTICE96","Nucl.Phys.Proc.Suppl.53:23-29,1997","10.1016/S0920-5632(96)00596-8","Conf-96/282-T","hep-ph",,"  I discuss old and new determinations of the light quark masses using lattice
QCD. Most lattice results using various approximations can be fit together in a
simple picture which is consistent with lower values than conventionally
supposed: in the quenched approximation for the strange quark mass in the MS
bar scheme, m_s(2 GeV) = 95 (16) MeV, and for the average of the u and d quark
masses, m_l(2 GeV) = 3.6 (6) MeV. An estimate of the effects of light quark
loops yields answers lower still: m_s(2 GeV) in the range 54 - 92 MeV, and
m_l(2 GeV) in the range 2.1 - 3.5 MeV.
","[{""version"":""v1"",""created"":""Thu, 5 Sep 1996 13:09:50 GMT""}]","2011-02-01"
"hep-ph/9609262",,"A. E. Bergan and J. O. Eeg","The self-penguin contribution to $K \to 2 \pi$","Latex, 12 pages, 2 figures","Phys.Lett.B390:420-426,1997","10.1016/S0370-2693(96)01402-5",,"hep-ph",,"  We consider the contribution to $K \rightarrow 2 \pi$ decays from the
non-diagonal $s \ra d$ quark transition amplitude. First, we calculate the most
important part of the $s \rightarrow d$ transition, the so-called self-penguin
amplitude $\sim G_F \alpha_s$, including the heavy top-quark case. Second, we
calculate the matrix element of the $s \rightarrow d$ transition for the
physical $K \rightarrow 2 \pi$ process. This part of the analysis is performed
within the Chiral Quark Model where quarks are coupled to the pseudoscalar
mesons. The CP-conserving self-penguin contribution to $K \rightarrow 2\pi$ is
found to be negligible. The obtained contribution to $\epsilon'/\epsilon$ is
sensitive to the values of the quark condensate $<\bar{q} q>$ and the
constituent quark mass $M$. For reasonable values of these quantities we find
that the self-penguin contribution to $\epsilon'/\epsilon$ is 10-15% of the
gluonic penguin contribution and has the same sign. Given the large
cancellation between gluonic and electroweak penguin contributions, this means
that our contribution is of the same order of magnitude as $\epsilon'/\epsilon$
itself.
","[{""version"":""v1"",""created"":""Thu, 5 Sep 1996 12:11:19 GMT""}]","2014-11-17"
"hep-ph/9609263",,"Stefano Catani (INFN Firenze)","Physical Anomalous Dimensions at Small $x$","26 pages, LateX","Z.Phys.C75:665-678,1997","10.1007/s002880050512","DFF 248/4/96","hep-ph",,"  I present a theoretical discussion of the uncertainties related to the QCD
analysis of the proton structure function $F_2(x,Q^2)$ at small $x$. The role
played by the `unphysical' gluon density is pointed out. It is shown how the
study of more observables can reduce the theoretical uncertainty and, in
particular, an alternative method of analysis, based on the introduction of
physical anomalous dimensions, is suggested.
","[{""version"":""v1"",""created"":""Thu, 5 Sep 1996 13:23:19 GMT""}]","2008-11-26"
"hep-ph/9609264","Antonio Vairo I. N. F. N. Bologna","A. Vairo","Gauge invariance on bound state energy levels","9 pages, Latex, 8 figures. Talk given at the NATO-ASI, Electron
  Theory and Quantum Electrodynamics, Edirne 8-16 September 1994","Electron Theory and Quantum Electrodynamics, Vol. B 358, 37, ed.
  J. Dowling, (Plenum, New York, 1997)",,"DFUB-95-18","hep-ph",,"  In this paper the problem of the gauge in a bound state calculation is
discussed. In particular, in order to verify the gauge invariance in the energy
levels expansion, some set of gauge invariant contributions are given.
","[{""version"":""v1"",""created"":""Thu, 5 Sep 1996 13:50:37 GMT""}]","2007-05-23"
"hep-ph/9609265","Jean-Loic Kneur","J.-L. Kneur (CERN & Montpellier U.)","Variational Quark Mass Expansion and the Order Parameters of Chiral
  Symmetry Breaking","40 pages, LaTex, 2 PS figures. Additions in section 2.2 to better
  explain the relation between the current mass and the dynamical mass ansatz.
  Minor misprints corrected. Version to appear in Phys. Rev. D","Phys.Rev. D57 (1998) 2785-2805","10.1103/PhysRevD.57.2785","CERN-TH/96-243","hep-ph",,"  We investigate in some detail a ""variational mass"" expansion approach,
generalized from a similar construction developed in the Gross-Neveu model, to
evaluate the basic order parameters of the dynamical breaking of the $SU(2)_L
\times SU(2)_R$ and $SU(3)_L \times SU(3)_R$ chiral symmetries in QCD. The
method starts with a reorganization of the ordinary perturbation theory with
the addition of an arbitrary quark mass $m$. The new perturbative series can be
summed to all orders thanks to renormalization group properties, with specific
boundary conditions, and advocated analytic continuation in $m$ properties. In
the approximation where the explicit breakdown of the chiral symmetries due to
small current quark masses is neglected, we derive ansatzes for the dynamical
contribution to the ""constituent"" masses $M_q$ of the $u,d,s$ quarks; the pion
decay constant $F_\pi$; and the quark condensate $< \bar q q > $ in terms of
the basic QCD scale $\Lambda_{\bar{MS}} $. Those ansatzes are then optimized,
in a sense to be specified, and also explicit symmetry breaking mass terms can
be consistently introduced in the framework. The obtained values of $F_\pi$ and
$M_q$ are roughly in agreement with what is expected from other
non-perturbative methods. In contrast we obtain quite a small value of $|< \bar
q q >|$ within our approach. The possible interpretation of the latter results
is briefly discussed.
","[{""version"":""v1"",""created"":""Thu, 5 Sep 1996 14:23:15 GMT""},{""version"":""v2"",""created"":""Thu, 26 Sep 1996 09:20:14 GMT""},{""version"":""v3"",""created"":""Wed, 12 Nov 1997 14:29:12 GMT""}]","2009-10-28"
"hep-th/9609041","D'Hoker Eric","Eric D'Hoker, I. M. Krichever and D. H. Phong","The Effective Prepotential of N=2 Supersymmetric SU(N_c) Gauge Theories","34 pages, Plain TeX, no macros needed, no figures","Nucl.Phys. B489 (1997) 179-210","10.1016/S0550-3213(97)00035-7","UCLA/96/TEP/28","hep-th",,"  We determine the effective prepotential for N=2 supersymmetric SU(N_c) gauge
theories with an arbitrary number of flavors N_f < 2N_c, from the exact
solution constructed out of spectral curves. The prepotential is the same for
the several models of spectral curves proposed in the literature. It has to all
orders the logarithmic singularities of the one-loop perturbative corrections,
thus confirming the non-renormalization theorems from supersymmetry. In
particular, the renormalized order parameters and their duals have all the
correct monodromy transformations prescribed at weak coupling. We evaluate
explicitly the contributions of one- and two-instanton processes.
","[{""version"":""v1"",""created"":""Wed, 4 Sep 1996 23:24:11 GMT""}]","2009-10-30"
"hep-th/9609042","Maraner","P. Maraner (Univ. of Parma, Italy)","Quantum Charged Spinning Particles in a Strong Magnetic Field (a Quantal
  Guiding Center Theory)","LaTeX (epsfig macros), 27 pages, 2 figures included","J.Phys.A30:2163-2180,1997","10.1088/0305-4470/30/6/036","UPRF-96-482","hep-th",,"  A quantal guiding center theory allowing to systematically study the
separation of the different time scale behaviours of a quantum charged spinning
particle moving in an external inhomogeneous magnetic filed is presented. A
suitable set of operators adapting to the canonical structure of the problem
and generalizing the kinematical momenta and guiding center operators of a
particle coupled to a homogenous magnetic filed is constructed. The Pauli
Hamiltonian rewrites in this way as a power series in the magnetic length $l_B=
\sqrt{\hbar c/eB}$ making the problem amenable to a perturbative analysis. The
first two terms of the series are explicitly constructed. The effective
adiabatic dynamics turns to be in coupling with a gauge filed and a scalar
potential. The mechanism producing such magnetic-induced geometric-magnetism is
investigated in some detail.
","[{""version"":""v1"",""created"":""Thu, 5 Sep 1996 09:03:13 GMT""}]","2008-11-26"
"hep-th/9609043","Jorge Russo","J.G. Russo","Stability of the quantum supermembrane in a manifold with boundary","10 pages, harvmac (references added, minor changes)","Phys.Lett. B392 (1997) 49-54","10.1016/S0370-2693(96)01523-7","CERN-TH/96-251","hep-th",,"  We point out an effect which may stabilize a supersymmetric membrane moving
on a manifold with boundary, and lead to a light-cone Hamiltonian with a
discrete spectrum of eigenvalues. The analysis is carried out explicitly for a
closed supermembrane in the regularized $SU(N)$ matrix model version.
","[{""version"":""v1"",""created"":""Thu, 5 Sep 1996 10:50:38 GMT""},{""version"":""v2"",""created"":""Sun, 8 Sep 1996 17:15:48 GMT""}]","2009-10-30"
"hep-th/9609044","Vladimir Plechko","V.N. Plechko (Bogoliubov Lab Dubna)","Fermionic Path Integrals and Analytic Solutions for Two-Dimensional
  Ising Models","LaTeX, 1 + 5 pages, no figures. A talk given at the 5th International
  Conference on Path Integrals from meV to MeV, PI-96, Dubna, May 27--31, 1996","Proceedings PI-96 (JINR, Dubna, 1996) 295--299",,,"hep-th cond-mat hep-lat",,"  The notion of the integral over the anticommuting Grassmann variables
(nonquantum fermionic fields) seems to be the most powerful tool in order to
extract the exact analytic solutions for the 2D Ising models on simple and more
complicated lattices, which is the subject of a discussion in this report.
","[{""version"":""v1"",""created"":""Thu, 5 Sep 1996 05:03:15 GMT""},{""version"":""v2"",""created"":""Mon, 25 Aug 1997 17:54:33 GMT""}]","2008-02-03"
"hep-th/9609045","Teiji Kunihiro","Teiji Kunihiro","The Renormalization-Group Method Applied to Asymptotic Analysis of
  Vector Fields","The revised version of RYUTHP 96/1. Submitted to Prog. Theor. Phys.
  (Kyoto) in Feb., 1996. 28 pages. LATEX. No figures","Prog.Theor.Phys. 97 (1997) 179-200","10.1143/PTP.97.179","RYUTHP 96/1","hep-th chao-dyn cond-mat nlin.CD nlin.PS patt-sol",,"  The renormalization group method of Goldenfeld, Oono and their collaborators
is applied to asymptotic analysis of vector fields. The method is formulated on
the basis of the theory of envelopes, as was done for scalar fields. This
formulation actually completes the discussion of the previous work for scalar
equations. It is shown in a generic way that the method applied to equations
with a bifurcation leads to the Landau-Stuart and the (time-dependent)
Ginzburg-Landau equations. It is confirmed that this method is actually a
powerful theory for the reduction of the dynamics as the reductive perturbation
method is. Some examples for ordinary diferential equations, such as the forced
Duffing, the Lotka-Volterra and the Lorenz equations, are worked out in this
method: The time evolution of the solution of the Lotka-Volterra equation is
explicitly given, while the center manifolds of the Lorenz equation are
constructed in a simple way in the RG method.
","[{""version"":""v1"",""created"":""Thu, 5 Sep 1996 05:53:24 GMT""},{""version"":""v2"",""created"":""Fri, 6 Sep 1996 00:39:51 GMT""}]","2009-10-30"
"math/9609206",,"Carsten Sch\""utt","Floating body, illumination body, and polytopal approximation",,,"10.1016/S0764-4442(99)80345-0","Banach Archive 9/5/96","math.MG math.FA",,"  Let $K$ be a convex body in $\Bbb R^{d}$ and $K_{t}$ its floating bodies.
There is a polytope with at most $n$ vertices that satisfies $$ K_{t} \subset
P_{n} \subset K $$ where $$ n \leq e^{16d} \frac{vol_{d}(K \setminus K_{t})}{t\
vol_{d}(B_{2}^{d})} $$ Let $K^{t}$ be the illumination bodies of $K$ and
$Q_{n}$ a polytope that contains $K$ and has at most $n$ $d-1$-dimensional
faces. Then $$ vol_{d}(K^{t} \setminus K) \leq cd^{4} vol_{d}(Q_{n} \setminus
K) $$ where $$ n \leq \frac{c}{dt} \ vol_{d}(K^{t} \setminus K) $$
","[{""version"":""v1"",""created"":""Thu, 5 Sep 1996 00:00:00 GMT""}]","2015-06-26"
"nucl-th/9609013","O. Krehl","O. Krehl (1), R. Rapp (2), J. Speth (3,1) ((1) IKP, KFA-Juelich, (2)
  Dept. of Physics, Stony Brook, (3) CEBAF, Newport News)","Meson-meson scattering: $K\overline{K}$-thresholds and $f_{0}(980) -
  a_{0}(980)$ mixing","12 pages, RevTeX, 3 Postscript figures, revised version, accepted for
  publication in Phys. Lett. B","Phys.Lett.B390:23-28,1997","10.1016/S0370-2693(96)01425-6","KFA-IKP(Th)-1996-09","nucl-th",,"  We study the influence of mass splitting between the charged and neutral
pions and kaons in the Juelich meson exchange model for $\pi\pi$ and $\pi\eta$
scattering. The calculations are performed in the particle basis, which permits
the use of physical masses for the pseudoscalar mesons and a study of the
distinct thresholds associated with the neutral and the charged kaons. Within
this model we also investigate the isospin violation which arises from the mass
splitting and an apparent violation of G-parity in $\pi\pi$ scattering which
stems from the coupling to the $K\overline{K}$ channel. Nonvanishing cross
sections for $\pi\pi \rightarrow \pi^{0}\eta$ indicate a mixing of the
$f_{0}(980)$ and $a_{0}(980)$ states.
","[{""version"":""v1"",""created"":""Thu, 5 Sep 1996 11:40:01 GMT""},{""version"":""v2"",""created"":""Wed, 23 Oct 1996 11:32:48 GMT""}]","2014-11-18"
"plasm-ph/9609001","Stephanie Conover","V.B. Lebedev (1) and P.H. Diamond (1,2) ((1) Physics Department,
  University of California, San Diego (2) General Atomics, La Jolla, CA)","Theory of the Spatio-Temporal Dynamics of Transport Bifurcations","21 page Tex file, 10 postscript files",,"10.1063/1.872196",,"plasm-ph physics.plasm-ph",,"  The development and time evolution of a transport barrier in a magnetically
confined plasma with non-monotonic, nonlinear dependence of the anomalous flux
on mean gradients is analyzed. Upon consideration of both the spatial
inhomogeneity and the gradient nonlinearity of the transport coefficient, we
find that the transition develops as a bifurcation front with radially
propagating discontinuity in local gradient. The spatial location of the
transport barrier as a function of input flux is calculated. The analysis
indicates that for powers slightly above threshold, the barrier location
$x_b(t) \sim ( D_n t (P-P_c)/P_c)^{1/2},$ where $P_c$ is the local transition
power threshold and $D_n$ is the neoclassical diffusivity . This result
suggests a simple explanation of the high disruptivity observed in reversed
shear plasmas. The basic conclusions of this theory are insensitive to the
details of the local transport model.
","[{""version"":""v1"",""created"":""Wed, 4 Sep 1996 22:18:53 GMT""}]","2009-10-30"
"q-alg/9609006",,"J. Bertrand and M. Irac-Astaud (L.P.T.M. Univ.Denis Diderot, Paris)","Invariance quantum groups of the deformed oscillator algebra","13 pages, Latex",,"10.1088/0305-4470/30/6/024",,"q-alg math.QA",,"  A differential calculus is set up on a deformation of the oscillator algebra.
It is uniquely determined by the requirement of invariance under a
seven-dimensional quantum group. The quantum space and its associated
differential calculus are also shown to be invariant under a nine generator
quantum group containing the previous one.
","[{""version"":""v1"",""created"":""Thu, 5 Sep 1996 13:57:26 GMT""}]","2009-10-30"
"quant-ph/9609003","Olavo Leopoldino Da Silva Filho","L.S.F. Olavo","Quantum Mechanics as a Classical Theory XIII: The Tunnel Effect","10 pages, plain latex",,,"UnB-013","quant-ph",,"  In this continuation paper we will address the problem of tunneling. We will
show how to settle this phenomenon within our classical interpretation. It will
be shown that, rigorously speaking, there is no tunnel effect at all.
","[{""version"":""v1"",""created"":""Wed, 4 Sep 1996 19:25:30 GMT""}]","2007-05-23"
"quant-ph/9609004","Maraner","J.R. Klauder (Univ. of Florida, USA), P. Maraner (Univ. of Parma,
  Italy)","Dynamics as Shadow of Phase Space Geometry","LaTeX (epsfig macros), 30 pages, 1 figure","Annals Phys. 253 (1997) 356-375","10.1006/aphy.1996.5631","UPRF-96-462","quant-ph",,"  Starting with the generally well accepted opinion that quantizing an
arbitrary Hamiltonian system involves picking out some additional structure on
the classical phase space (the {\sl shadow} of quantum mechanics in the
classical theory), we describe classical as well as quantum dynamics as a
purely geometrical effect by introducing a {\sl phase space metric structure}.
This produces an ${\cal O}(\hbar)$ modification of the classical equations of
motion reducing at the same time the quantization of an arbitrary Hamiltonian
system to standard procedures. Our analysis is carried out in analogy with the
adiabatic motion of a charged particle in a curved background (the additional
metric structure) under the influence of a universal magnetic field (the
classical symplectic structure). This allows one to picture dynamics in an
unusual way, and reveals a dynamical mechanism that produces the selection of
the right set of physical quantum states.
","[{""version"":""v1"",""created"":""Thu, 5 Sep 1996 09:36:02 GMT""}]","2009-10-30"
