"cond-mat/9609057","Jinwu Ye","Jinwu Ye (Harvard and Johns Hopkins)","On two channel flavor anisotropic and one channel compactified Kondo
  models","20 pages, REVTEX, no figure","Nucl. Phys. B 512, 543 (1998)","10.1016/S0550-3213(97)80485-3",,"cond-mat.str-el",,"  We reinvestigate the two channel flavor anisotropic model (2CFAK) and one
channel compacitified Kondo model (1CCK). For these two models, all the
possible fixed points and their symmetries are identified; the finite size
spectra, the electron conductivity and pairing susceptibility are calculated.
It is shown that the only non-fermi liquid (NFL) fixed point of the 2CFAK is
the NFL of the two channel Kondo model (2CK) with the symmetry $O(3) \times
O(5)$. Any flavor anisotropies between the two channels drive the system to the
fermi-liquid (FL) fixed point with the symmetry $O(4) \times O(4)$ where one of
the two channels suffers the phase shift \pi/2 and the other remains free. The
NFL fixed point of the 1CCK has the symmetry $O(3) \times O(1)$ and has the
same thermodynamics as the NFL fixed point of the 2CK. However, in contrast to
the 2CK, its conductivity shows $T^{2}$ behavior and there is no pairing
susceptibility divergence. Any anisotropies between the spin and isospin
sectors drive the system to the FL fixed point with the symmetry O(4) where the
electrons suffer the phase shift \pi/2. The connection and differences between
the two models are explicitly demonstrated. The recent conjectures and claims
on the NFL behaviors of the two models are commented.
","[{""version"":""v1"",""created"":""Thu, 5 Sep 1996 15:40:47 GMT""},{""version"":""v2"",""created"":""Sun, 8 Sep 1996 20:29:47 GMT""},{""version"":""v3"",""created"":""Wed, 8 Jan 1997 03:55:43 GMT""},{""version"":""v4"",""created"":""Mon, 27 Oct 1997 21:18:30 GMT""},{""version"":""v5"",""created"":""Thu, 22 Jan 1998 16:47:11 GMT""}]","2016-08-31"
"cond-mat/9609058","Jinwu Ye","Jinwu Ye","Solution of two channel spin-flavor Kondo model","11 pages, REVTEX, no figures. To appear in Phys. Rev. B (Rapid Comm.)
  July 1, 1997",,"10.1103/PhysRevB.56.R489",,"cond-mat.str-el",,"  We investigate a model where an impurity couples to both the spin and the
flavor currents of the two channel conduction electrons. This model can be used
as a prototype model of a magnetic impurity tunneling between two sites in a
metal and of some heavy fermion systems where the ground state of the impurity
has a fourfold degeneracy. The system is shown to flow to a doubly degenerate
non fermi-liquid(NFL) fixed point; the thermodynamic quantities show NFL
behaviors, but the transport quantities show fermi liquid (FL) behaviors . A
spin-flavor coupling double tensor term is shown to drive the system to one of
the two singlet FL fixed points. The relation with SU(4) Coqblin-Schrieffer
model is studied. The implications on the possible experiments are given.
","[{""version"":""v1"",""created"":""Thu, 5 Sep 1996 15:56:50 GMT""},{""version"":""v2"",""created"":""Sun, 8 Sep 1996 18:08:31 GMT""},{""version"":""v3"",""created"":""Wed, 8 Jan 1997 04:06:20 GMT""},{""version"":""v4"",""created"":""Wed, 18 Jun 1997 16:09:04 GMT""}]","2009-10-28"
"gr-qc/9609012","Carlos Lousto","Carlos O. Lousto (U. Utah) and Richard H. Price (U. Utah)","Head-on collisions of black holes: the particle limit","15 pages, REVTeX, 25 figures","Phys.Rev. D55 (1997) 2124-2138","10.1103/PhysRevD.55.2124",,"gr-qc astro-ph hep-th",,"  We compute gravitational radiation waveforms, spectra and energies for a
point particle of mass $m_0$ falling from rest at radius $r_0$ into a
Schwarzschild hole of mass $M$. This radiation is found to lowest order in
$(m_0/M)$ with the use of a Laplace transform. In contrast with numerical
relativity results for head-on collisions of equal-mass holes, the radiated
energy is found not to be a monotonically increasing function of initial
separation; there is a local radiated-energy maximum at $r_0\approx4.5M$. The
present results, along with results for infall from infinity, provide a
complete catalog of waveforms and spectra for particle infall. We give a
representative sample from that catalog and an interesting observation: Unlike
the simple spectra for other head-on collisions (either of particle and hole,
or of equal mass holes) the spectra for $\infty>r_0>\sim5M$ show a series of
evenly spaced bumps. A simple explanation is given for this. Lastly, our energy
vs. $r_0$ results are compared with approximation methods used elsewhere, for
small and for large initial separation.
","[{""version"":""v1"",""created"":""Thu, 5 Sep 1996 00:57:20 GMT""}]","2009-10-28"
"gr-qc/9609013","Ramy Brustein","Bruce Allen, Ram Brustein","Detecting relic gravitational radiation from string cosmology with LIGO","6 pages, 5 eps figures, Revtex","Phys.Rev.D55:3260-3264,1997","10.1103/PhysRevD.55.3260","WISC-MILW-96-TH-34,BGU-PH-96/09","gr-qc astro-ph hep-th",,"  A characteristic spectrum of relic gravitational radiation is produced by a
period of ``stringy inflation"" in the early universe. This spectrum is unusual,
because the energy-density rises rapidly with frequency. We show that
correlation experiments with the two gravitational wave detectors being built
for the Laser Interferometric Gravitational Observatory (LIGO) could detect
this relic radiation, for certain ranges of the parameters that characterize
the underlying string cosmology model.
","[{""version"":""v1"",""created"":""Thu, 5 Sep 1996 06:03:38 GMT""}]","2009-12-30"
"gr-qc/9609014","Alan Gray Wiseman","Dong Lai and Alan G. Wiseman (Caltech)","Innermost Stable Circular Orbit of Inspiraling Neutron-Star Binaries:
  Tidal Effects, Post-Newtonian Effects and the Neutron-Star Equation of State","RevTeX, to appear in PRD, 8 pages, 4 figures included","Phys.Rev. D54 (1996) 3958-3964","10.1103/PhysRevD.54.3958","GRP-444","gr-qc astro-ph",,"  We study how the neutron-star equation of state affects the onset of the
dynamical instability in the equations of motion for inspiraling neutron-star
binaries near coalescence. A combination of relativistic effects and Newtonian
tidal effects cause the stars to begin their final, rapid, and
dynamically-unstable plunge to merger when the stars are still well separated
and the orbital frequency is $\approx$ 500 cycles/sec (i.e. the gravitational
wave frequency is approximately 1000 Hz). The orbital frequency at which the
dynamical instability occurs (i.e. the orbital frequency at the innermost
stable circular orbit) shows modest sensitivity to the neutron-star equation of
state (particularly the mass-radius ratio, $M/R_o$, of the stars). This
suggests that information about the equation of state of nuclear matter is
encoded in the gravitational waves emitted just prior to the merger.
","[{""version"":""v1"",""created"":""Thu, 5 Sep 1996 07:10:10 GMT""}]","2016-08-31"
"hep-lat/9609014","Tetsuya Onogi","T. Onogi, A.X. El-Khadra, B.J. Gough, G.M. Hockney, A.S. Kronfeld,
  P.B. Mackenzie, B.P. Mertens, J.N. Simone","Light Quark Masses with an O(a)-Improved Action","3 pgs. 3 figures. espcrc2.sty included. Talk presented at
  LATTICE96(phenomenology)","Nucl.Phys.Proc.Suppl.53:289-291,1997","10.1016/S0920-5632(96)00639-1","HUPD-96-9616, FERMILAB-CONF-96/281-T","hep-lat hep-ph",,"  We present the recent Fermilab calculations of the masses of the light
quarks, using tadpole-improved Sheikholeslami-Wohlert (SW) quarks. Various
sources of systematic errors are studied. Our final result for the average
light quark mass in the quenched approximation evaluated in the $\bar{MS}$
scheme is $\bar{m}_q(\mu=2 GeV;n_f=0)= (m_u+m_d)/2=3.6 \pm 0.6 MeV$.
","[{""version"":""v1"",""created"":""Thu, 5 Sep 1996 03:38:17 GMT""},{""version"":""v2"",""created"":""Fri, 22 Nov 1996 05:07:09 GMT""}]","2010-11-19"
"hep-lat/9609015","Harry B. Thacker","A. Duncan, E. Eichten, and H. Thacker","Electromagnetic Splittings and Light Quark Masses","Talk presented at LATTICE96(spectrum)","Nucl.Phys.Proc.Suppl. 53 (1997) 295-298","10.1016/S0920-5632(96)00641-X",,"hep-lat",,"  A method for computing electromagnetic properties of hadrons in lattice QCD
is described. The electromagnetic field is introduced dynamically, using a
noncompact formulation. Employing enhanced electric charges, the dependence of
the pseudoscalar meson mass on the (anti)quark charges and masses can be
accurately calculated. At $\beta=5.7$ with Wilson action, the $\pi^+-\pi^0$
splitting is found to be $4.9(3)$ MeV. Using the measured $K^0-K^+$ splitting,
we also find $m_u/m_d = .512(6)$. Systematic errors are discussed. Preliminary
results for vector meson splittings are also presented.}
","[{""version"":""v1"",""created"":""Thu, 5 Sep 1996 14:32:54 GMT""}]","2009-10-28"
"hep-ph/9609245","W. James Stirling","Z. Kunszt (ETH, Zurich), W. J. Stirling (Durham)","Hard diffractive scattering: partons and QCD","6 pages (LaTeX), including 1 embedded figure, uses epsfig.sty. Based
  on talks presented at the Workshop on HERA Physics (Durham, September 1995)
  and the DIS96 Workshop (Rome, April 1996)",,,"ETH-TH/96-27, DTP/96/74","hep-ph",,"  The HERA diffractive structure function data are interpreted in terms of
`diffractive parton distributions' which satisfy DGLAP evolution. These
distributions are modeled assuming that the scattering takes place off a colour
singlet `pomeron' target. A quantitative test of the universality of
diffractive parton distributions is proposed.
","[{""version"":""v1"",""created"":""Wed, 4 Sep 1996 20:11:40 GMT""}]","2007-05-23"
"hep-ph/9609246","Lynne Orr","L.H. Orr (Rochester), T. Stelzer (Illinois), W.J. Stirling (Durham)","Gluon Radiation in $t\bar t$ Production and Decay at the LHC","16 pages including 7 figures, plain LaTeX; minor corrections to text;
  results unchanged","Phys. Rev. D 56, 446 (1997)","10.1103/PhysRevD.56.446","UR-1473, DTP/96/76, ILL-(TH)-96-8","hep-ph",,"  Understanding the pattern of gluon radiation in $t \bar t$ production and
decay processes is important for making an accurate determination of the top
mass from the momenta of its decay products. The larger energy of the LHC $pp$
collider boosts the top cross section by a factor of 100 compared to that at
the Tevatron, but it also increases the amount of additional gluon radiation.
We calculate the cross section for gluon radiation in top production and decay
at the LHC. The distributions of this radiation are presented and the exact
matrix-element results are compared with results from the HERWIG parton-shower
Monte Carlo.
","[{""version"":""v1"",""created"":""Wed, 4 Sep 1996 16:18:55 GMT""},{""version"":""v2"",""created"":""Thu, 12 Sep 1996 22:15:32 GMT""}]","2016-08-24"
"hep-ph/9609247","Jean-Loic Kneur","C. Arvanitis (1), F. Geniet (2), J.-L. Kneur (3) and A. Neveu (2) ((1)
  Imperial College, (2) Montpellier U., (3) CERN)","Chiral Symmetry Breaking in QCD: A Variational Approach","10 pages, no figures, LaTex","Phys.Lett.B390:385-391,1997","10.1016/S0370-2693(96)01384-6","CERN-TH/96-193","hep-ph",,"  We develop a ""variational mass"" expansion approach, recently introduced in
the Gross--Neveu model, to evaluate some of the order parameters of chiral
symmetry breakdown in QCD. The method relies on a reorganization of the usual
perturbation theory with the addition of an ""arbitrary quark mass $m$, whose
non-perturbative behaviour is inferred partly from renormalization group
properties, and from analytic continuation in $m$ properties. The resulting
ansatz can be optimized, and in the chiral limit $m \to 0$ we estimate the
dynamical contribution to the ""constituent"" masses of the light quarks
$M_{u,d,s}$; the pion decay constant $F_\pi$ and the quark condensate $< \bar q
q >$.
","[{""version"":""v1"",""created"":""Wed, 4 Sep 1996 16:05:11 GMT""}]","2014-11-17"
"hep-ph/9609248","Thomas G. Rizzo","Thomas G. Rizzo","Searches for New Gauge Bosons at Future Colliders","11 pages, 6 figures","ECONF C960625:NEW142,1996",,"SLAC-PUB-7279","hep-ph",,"  The search reaches for new gauge bosons at future hadron and lepton colliders
are summarized for a variety of extended gauge models. Experiments at these
energies will vastly improve over present limits and will easily discover a
$Z'$ and/or $W'$ in the multi-TeV range. [To appear in the Proceedings of the
1996 DPF/DPB Summer Study on New Directions for High Energy Physics-Snowmass96,
Snowmass, CO, 25 June-12 July, 1996.]
","[{""version"":""v1"",""created"":""Wed, 4 Sep 1996 19:24:16 GMT""}]","2009-09-15"
"hep-ph/9609249","Edward Shuryak","E. Shuryak (Physics Department, State University of New York Stony
  Brook)","The Phases of QCD","Summary talk at RHIC Summer Studies, Brookhaven, July 1996",,,,"hep-ph",,"  In the recent years we have learned that light quarks play a crucial role in
QCD-like theories, transforming it to many different phases. We review what is
known about them, both from lattice and non-lattice approaches. A particularly
simple mechanism of the QCD chiral restoration phase transition is discussed
first: it suggests that it is a transition from randomly placed tunneling
events (instantons) at low T to strongly localized tunneling-anti-tunneling
pairs at high T. Many features of the transition found on the lattice can be
explained in this simple picture. Very relevant for RHIC, this approach
predicts a strong non-perturbative interaction between quarks $above$ the phase
transition. It also predicts that QGP-like phase sets in at $zero$ temperature,
provided few more light quark flavors are added to QCD. Finally, we also
discuss possible experimental signatures of the QCD phase transition. One issue
is CERN dilepton data, possibly related with ``dropping'' masses of $\rho, A_1$
mesons. Another is direct manifestation of a $softeness$ of EOS (smallness of
pressure/energy density) in the phase transition region in flow and even the
global lifetime of the system.
","[{""version"":""v1"",""created"":""Wed, 4 Sep 1996 19:28:22 GMT""}]","2007-05-23"
"hep-ph/9609250",,"M. Burkardt and H. El-Khozondar (NMSU)","A 3+1 Dimensional Light-Front Model with Spontaneous Breaking of Chiral
  Symmetry","6 pages, REVTEX","Phys.Rev. D55 (1997) 6514-6521","10.1103/PhysRevD.55.6514",,"hep-ph",,"  We investigate a 3+1 dimensional toy model that exhibits spontaneous
breakdown of chiral symmetry, both in a light-front (LF) Hamiltonian and in a
Euclidean Schwinger-Dyson (SD) formulation. We show that both formulations are
completely equivalent --- provided the renormalization is properly done. For
the model considered, this means that if one uses the same transverse momentum
cutoff on the SD and LF formulations then the vertex mass in the LF calculation
must be taken to be the same as the current quark mass in the SD calculation.
The kinetic mass term in the LF calculation is renormalized non-trivially,
which is eventually responsible for the mass generation of the physical fermion
of the model.
","[{""version"":""v1"",""created"":""Wed, 4 Sep 1996 19:57:37 GMT""}]","2009-10-28"
"hep-ph/9609251","Laurel Sinclair","A. Lebedev, L. Sinclair, E. Strickland, J. Vazdik","Colour Coherence in Photon Induced Reactions","6 pages, LaTeX, 6 eps figures included, to appear in the proceedings
  of the workshop ""Future Physics at HERA""",,,"GLAS-PPE/96-05","hep-ph",,"  Colour coherence in hard photoproduction is considered using the Monte Carlo
event generators PYTHIA and HERWIG. Significant effects in the parton shower
are found using multijet observables for direct and resolved photon induced
reactions. The particle flow in the interjet region of direct processes shows a
strong influence of string fragmentation effects.
","[{""version"":""v1"",""created"":""Wed, 4 Sep 1996 20:53:42 GMT""}]","2007-05-23"
"hep-ph/9609252","Mauro","M. Napsuciale and J.L. Lucio M. (Instituto de F\'isica, Universidad de
  Guanajuato, M\'exico)","Heavy Baryon Spin 3/2 Theory and Radiative Decays of the Decuplet","27 pages","Nucl.Phys.B494:260-280,1997","10.1016/S0550-3213(97)00097-7",,"hep-ph",,"  We study the radiative decays of the decuplet $(3/2 \to 1/2 \gamma)$ using
Heavy Baryon Chiral Perturbation Theory (HBChPT). We emphasize the problems
faced by the interacting spin 3/2 field theory. We argue that, to lowest order
in the $1/m$ expansion, HBChPT provides a framework where R-invariance and the
appropiated constraints for the interacting spin 3/2 fields are consistently
incorporated. We perform a gauge invariant calculation of the decay amplitudes,
to lowest order in $1/m$ and to order $w^2/\Lambda^2_\chi$ in the chiral
expansion and report analytical results for the one-loop contributions to the
two form factors involved in the $3/2 \to 1/2 \gamma$ transitions. Parameters
independent predictions for the SU(3) forbidden decays are presented.
","[{""version"":""v1"",""created"":""Wed, 4 Sep 1996 21:39:17 GMT""}]","2009-09-24"
"hep-ph/9609253","V. A. Kuzmin","Vadim A. Kuzmin","Might Fast B-Violating Transitions Be Found Soon?","LaTeX file",,,"Preprint INR-0931/Aug 1996","hep-ph",,"  We claim that there might exist a new interaction leading to very fast
baryon-number violating processes quite observable in the laboratory
conditions, provided all three generations are simultaneously involved.
","[{""version"":""v1"",""created"":""Thu, 5 Sep 1996 07:26:00 GMT""}]","2007-05-23"
"hep-ph/9609254",,"G. K\""albermann (Faculty of Agriculture and Racah Institute of
  Physics, Hebrew University, Jerusalem, Israel)","A Skyrmion Fluid","Latex source, 21 pages, 6 postscript figures. Accepted for
  publication in Nuclear Physics A","Nucl.Phys. A612 (1997) 359-374","10.1016/S0375-9474(96)00333-8",,"hep-ph nucl-th",,"  A fluid of Skyrmions coupled to the dilaton field and the $\o$ meson field is
considered. A mean field theory is developed in which the dilaton and the $\o$
field acquire a mean value determined by the Skyrmions. The influence of the
background fields on the Skyrmion profile is determined and consequently the
scaling properties of the Skyrmion follow. The model obeys chiral invariance
and scale invariance broken only by the dilaton trace anomaly potential. The
dilaton plays the role of the scalar field as in the $\s + \o$ model. The
dilaton potential is augmented by terms that do not spoil the trace anomaly
while allowing a fit to nuclear matter properties. The phase diagram of the
model shows unique features, like a lack of solutions for certain densities and
temperatures, signalling the appearance of a new phase that can not be
described in terms of Skyrme baryons.
","[{""version"":""v1"",""created"":""Thu, 5 Sep 1996 08:32:00 GMT""},{""version"":""v2"",""created"":""Fri, 6 Sep 1996 04:58:00 GMT""}]","2016-09-06"
"hep-ph/9609255","Erwin Mirkes","Erwin Mirkes and Dieter Zeppenfeld","Fixed-Order QCD Backgrounds to BFKL Dynamics in Forward Jet Production","Latex, 6 pages, 2 figures. To appear in the proceedings of the 1996
  HERA Physics Workshop. The complete paper, including figures, is also
  available via anonymous ftp at ftp://ttpux2.physik.uni-karlsruhe.de/ , or via
  www at http://www-ttp.physik.uni-karlsruhe.de/cgi-bin/preprints/",,,"MADPH-96-960, TTP96-40","hep-ph",,"  The production of forward jets of transverse momentum $p_T(j)\approx Q$ and
large momentum fraction $x_{jet}\gg x$ probes the onset of BFKL dynamics at
HERA. A full ${\cal O}(\alpha_s^2)$ calculation of the inclusive forward jet
cross section is presented and compared to the expected BFKL cross section.
","[{""version"":""v1"",""created"":""Thu, 5 Sep 1996 07:44:07 GMT""}]","2007-05-23"
"hep-ph/9609256","Francois Gelis","P. Aurenche, F. Gelis (ENSLAPP, Annecy) R. Kobes, E. Petitgirard
  (Winnipeg Univ.)","Breakdown of the Hard Thermal Loop expansion near the light-cone","40 pages, 8 postscript figures included by \epsfbox, LaTeX file using
  article style, also available at this http URL
  http://theory.uwinnipeg.ca/users/randy/webfiles/brem.uu","Z.Phys. C75 (1997) 315-332",,"ENSLAPP-A-614/96, WIN-96-13","hep-ph",,"  We discuss the bremsstrahlung production of soft real and virtual photons in
a quark-gluon plasma at thermal equilibrium beyond the Hard Thermal Loop (HTL)
resummation. The physics is controlled by the ratio $Q^2/q_0^2$ of the
virtuality to the energy. When $Q^2/q_0^2$ is much smaller than $g^2$, where
$g$ is the strong coupling constant, the emission rate is enhanced by a factor
$1/g^2$ over the HTL results due to light-cone singularities and the
bremsstrahlung is induced by scattering of the quark via both transverse and
longitudinal soft gluon exchanges. When $Q^2/q_0^2$ increases, the enhancement
factor is given by $q_0^2/Q^2$. When this ratio is near unity, the
bremsstrahlung contribution is of the same order as the rate predicted by the
HTL resummation. In that case, the bremsstrahlung is induced by both soft and
hard gluon exchanges.
","[{""version"":""v1"",""created"":""Thu, 5 Sep 1996 08:05:41 GMT""}]","2007-05-23"
"hep-ph/9609257","S. Troitsky","A.A. Penin, V.A. Rubakov, P.G. Tinyakov and S.V. Troitsky","What Becomes of Vortices in Theories with Flat Directions","8 pages, latex, 3 figures, uses axodraw.sty","Phys.Lett.B389:13-17,1996","10.1016/S0370-2693(96)01234-8","INR-ST-7-96","hep-ph hep-th",,"  In many theories with flat directions of scalar potential, static vortex
solutions do not exist for a generic choice of vacuum. In two Euclidean
dimensions, we find their substitutes --- constrained instantons consisting of
compact core formed by Abrikosov--Nielsen--Olesen vortex and long-ranged cloud
of modulus field. In (3+1) dimensions, an initial compact configuration of
string topology evolves in such a way that at every point in space the modulus
relaxes, in a universal manner, to one and the same value characteristic to the
theory.
","[{""version"":""v1"",""created"":""Thu, 5 Sep 1996 09:13:52 GMT""}]","2008-11-26"
"hep-ph/9609258","Narison Stephan","Stephan Narison (LPM-Montpellier)","Heavy quarkonia mass-splittings in QCD: test of the $1/m$-expansion and
  estimates of $<\alpha_s G^2>$ and $\alpha_s$","Talk given at QCD 96-Montpellier, 4-12th July 1996 and at the 28th
  ICHEP96-Varsaw, 25-31th July 1996, and based on the paper hep-ph/9512348 (to
  appear in Phys. Lett.B386, October 1996). 9 pages in Latex files.","Nucl.Phys.Proc.Suppl. 54A (1997) 238-243","10.1016/S0920-5632(97)00047-9","Montpellier preprint PM 96/26","hep-ph hep-lat",,"  I present a more refined analysis of the mass-splittings between the
different heavy quarkonia states, using {\it new double ratios} of exponential
moments of different two-point functions. Then, I test the validity of the
$1/m$-expansion, extract $\alpha_s(M_Z)=0.127\pm 0.011$ from $M_{\chi_c(P^1_1)}
- M_{\chi_c(P^3_1)}$, and provide a new estimate of the gluon condensate from
$M_\psi -M_{\eta_c}$ and $M_{\chi_b}-M_\Upsilon$, which combined with the
recent estimate from the $\tau$-like decay sum rules in $e^+e^-\rar I=1$
hadrons data, leads to the {\it update average value} $\la\alpha_s G^2\ra =
(7.1\pm 0.9)\times 10^{-2}$ GeV$^4$ from the light and heavy quark systems. I
also find $M_{\Upsilon}-M_{\eta_b}\approx 63^{-29}_{+51}$ MeV implying the
possible observation of the $\eta_b$ in the $\Upsilon$-radiative decay.
","[{""version"":""v1"",""created"":""Thu, 5 Sep 1996 09:34:58 GMT""}]","2016-09-06"
"hep-ph/9609259","Jose I. Illana","F. Cornet (1), R. Graciani (2) and J.I. Illana (1) ((1) Universidad de
  Granada, Spain, (2) U.A.M., Madrid, Spain)","Bounds on the Z\gamma\gamma couplings from HERA","LaTeX, 11 pages, 4 figures, uses feynman.tex and epsf.sty.
  Contribution to the proc. of the Workshop `Future Physics at HERA',
  DESY,Hamgurg, 1995-96",,,"UG-FT-65/96","hep-ph",,"  The possibility of testing trilinear neutral gauge boson couplings in
radiative neutral current scattering at HERA is analyzed using a Monte Carlo
program that includes the Standard Model at tree level and the anomalous
vertices. Acceptance and isolation cuts are applied as well as optimized cuts
to enhance the signal from new physics. The bounds on Z\gamma\gamma couplings
that can be achieved are not so stringent as present bounds, even for high
luminosities, but probe a different kinematical region almost unsensitive to
form factors.
","[{""version"":""v1"",""created"":""Thu, 5 Sep 1996 10:05:12 GMT""}]","2007-05-23"
"hep-ph/9609260","Dmitri Kharzeev","D. Kharzeev","Quarkonium Production and Color Deconfinement in Nuclear Collisions","16 pages, LaTeX, 6 figures, uses epsf.tex, espcrc1.sty (included);
  Invited talk given at the ""Quark Matter 96"" Conference, Heidelberg May 1996;
  to appear in the Proceedings","Nucl.Phys.A610:418c-433c,1996","10.1016/S0375-9474(96)00374-0","BI-TP/96-42","hep-ph nucl-th",,"  The suppression of quarkonium production in nucleus-nucleus collisions was
originally proposed as a signal of colour deconfinement. Strong ``anomalous""
J/\psi suppression in Pb-Pb collisions has been reported at this Conference by
the NA50 Collaboration. Is this suppression really anomalous? Can we conclude
that the quark-gluon plasma is already discovered? What has to be done next? I
address these questions basing on the current theoretical understanding of
quarkonium production and new precise experimental information.
","[{""version"":""v1"",""created"":""Thu, 5 Sep 1996 10:57:16 GMT""}]","2009-07-09"
