"acc-phys/9609001","Herr Rossmanith","U. Bandow, D. Einfeld, T. Hezel, H.O. Moser, R. Rossmanith, J. Schaper","Calculation of the dynamic aperture in the ANKA storage ring with a
  high-field wavelength shifter",,,,,"acc-phys physics.acc-ph",,"  Third order tracking calculations show that a wavelength shifter on the basis
of a commercially available 12 T split-pair solenoid is compatible with the
ANKA storage ring
","[{""version"":""v1"",""created"":""Thu, 5 Sep 1996 13:34:09 GMT""}]","2008-02-03"
"alg-geom/9609001","Sorin Popescu","Mark Gross, Sorin Popescu","Equations of (1,d)-polarized Abelian Surfaces","50 pages with 1 figure, author-supplied PostScript file available at
  http://www.math.columbia.edu/~psorin/eprints/abel-eq.ps (Final version) Plain
  TeX with epsf.tex and amssym.tex",,,,"alg-geom math.AG",,"  We study the equations of abelian surfaces embedded in P^{n-1} with a line
bundle of polarization of type (1,n). For n>9, we show that the ideal of a
general abelian surface with this polarization is generated by quadrics, and if
the embedding is Heisenberg invariant, we give a very specific description of
these quadrics. These quadrics are produced using a generalization of the Moore
matrices which yields a uniform description of these ideals. We prove that
these equations generate the ideals using a degeneration argument, degenerating
abelian surfaces to schemes obtained from Stanley-Reisner ideals of certain
triangulations of the torus. Furthermore, we obtain information on how to
compute the moduli spaces of abelian surfaces of type (1,n) with canonical
level structure. In a sequel to this paper, we will study the structure of the
equations for n<=9, and also give detailed geometric descriptions for the
moduli spaces of abelian surfaces of low degree.
","[{""version"":""v1"",""created"":""Wed, 4 Sep 1996 22:54:26 GMT""},{""version"":""v2"",""created"":""Wed, 5 Mar 1997 23:10:15 GMT""}]","2008-02-03"
"alg-geom/9609002","Parusinski Adam","Adam Parusinski and Zbigniew Szafraniec","Algebraically Constructible Functions and Signs of Polynomials","AMS-LaTeX, 15 pages",,,"Universite d'Angers prepublication no. 18","alg-geom math.AG",,"  We show that on real algebraic sets algebraically constructible functions
coincide with the finite sums of signs of polynomials. Then we give some
applications.
","[{""version"":""v1"",""created"":""Thu, 5 Sep 1996 11:11:58 GMT""}]","2008-02-03"
"astro-ph/9609029","Cristiano Porciani","Cristiano Porciani (SISSA-ISAS, Trieste)","Evolution of the two-point correlation function in the Zel'dovich
  approximation","revised version accepted for publication in MNRAS. The comparison
  with the scaling ansatz of Baugh & Gaztanaga (1996), one figure and some
  comments have been added. LaTex, 14 pages, 8 figures",,"10.1093/mnras/290.4.639","SISSA 77/97/A","astro-ph",,"  We study the evolution of the mass autocorrelation function by describing the
growth of density fluctuations through the Zel'dovich approximation. The
results are directly compared with the predictions of the scaling hypothesis
for clustering evolution extracted from numerical simulations (Hamilton et al.
1991), as implemented by Jain, Mo & White (1995). We find very good agreement
between the correlations on mildly non-linear scales and on completely linear
scales. In between these regimes, we note that the density fields evolved
through the Zel'dovich approximation show more non-linear features than
predicted by the scaling ansatz which is, however, forced to match the linear
evolution on scales larger than the simulation box. In any case, the scaling
ansatz by Baugh & Gaztanaga (1996), calibrated against large box simulations
agrees better with ZA predictions on large scales, keeping good accuracy also
on intermediate scales. We show that mode-coupling is able to move the first
zero crossing of xi(r) as time goes on. A detailed fit of the time dependence
of this shifting is given for a CDM model. The evolution of the cross
correlation of the density fluctuation field evaluated at two different times
is also studied. The possible implications of the results for the analysis of
the observed correlation function of high redshift galaxies are discussed.
","[{""version"":""v1"",""created"":""Wed, 4 Sep 1996 17:00:15 GMT""},{""version"":""v2"",""created"":""Thu, 12 Jun 1997 14:19:50 GMT""}]","2015-06-24"
"astro-ph/9609030","Ebakker","Eric J. Bakker, David L. Lambert, Ewine F. van Dishoeck","Lines of Circumstellar C2, CN, and CH+ in the Optical Spectra of
  Post-Agb Stars","7 pages, 3 figures, to appear in IAU 177 ""The carbon star phenomenon""",,,,"astro-ph",,"  Recent optical spectra of post-AGB stars show the presence of C2, CN, and CH+
originating in the circumstellar shell. We present here new, higher resolution
spectra which provide constraints on the physical parameters and information on
the line profiles. An empirical curve of growth for the C2 Phillips and CN Red
system lines in the spectrum of HD 56126 yields b = 0.50 (+0.59, -0.23) km/s.
CH+ (0,0) emission lines in the spectrum of the Red Rectangle have been
resolved with a FWHM approx 8.5 pm 0.8 km/s. The circumstellar CN lines of IRAS
08005--2356 are resolved into two separate components with a velocity
separation of Delta v = 5.7 pm 2.0 km/s. The line profiles of CN of HD 235858
have not been resolved.
","[{""version"":""v1"",""created"":""Wed, 4 Sep 1996 16:13:52 GMT""}]","2007-05-23"
"astro-ph/9609031","Russell M. Kulsrud","Armando M. Howard and Russell M. Kulsrud","The Evolution of a Primordial Galactic Magnetic Field","Figure 4 has been removed. Please address correspondence to
  rkulsrud@astro.princeton.edu","Astrophys.J. 483 (1997) 648-665","10.1086/304262",,"astro-ph",,"  We consider the hypothesis that galactic magnetic fields are primordial. We
also discuss the various objections to this hypothesis. We assume that there
was a magnetic field present in the galactic plasma before the galaxy formed.
After the galactic disk formed, the lines of force thread through it and remain
connected to the external cosmic medium. They enter through one side of the
disk, proceed horizontally a distance $ l $ in the disk, and then leave through
the other side. We find that the lines of force are stretched rotation of the
galactic disk, which amplifies the toroidal component of the field and
increases$l $. When the magnetic field is strong enough, it produces ambipolar
velocities that try to lift the line out of the galactic disk but in opposite
directions ondifferent parts of the line. The result is, instead of the line
being expelled from the disk, its horizontal length $l $ is shortened, both in
the radial, and in the toroidal direction. This leads to a reduction of the
rate of horizontal stretching, and, finally, a reduction in the magnetic field
strength. After a sufficient time, the magnetic field at all points goes
through this stretching and reduction, and the field strength approaches a
universal function of time. This function is slowly decreasing, and only
depends on the ambipolar propertiesof the interstellar medium. At any given
time the magnetic field is toroidal, and has the same strength almost
everywhere. On the other hand, it turns out that its direction varies rapidly
with radius, changing sign every one hundred parsecs field dominate over that
of the other. The resulting field has a net Faraday rotation. If such a field
were observed with low resolution in an external galaxy then the field would
appear toroidal in between the spiral arms. The spiral density wave would turn
it so that the lines appear to trace out the spiral arm,
","[{""version"":""v1"",""created"":""Wed, 4 Sep 1996 16:11:10 GMT""}]","2016-08-30"
"astro-ph/9609032","P. Marziani","P. Marziani, M. Calvani, and J. W. Sulentic","On the Difference Between Radio Quiet and Radio Loud AGN","2 pages, to appear in Accretion Phenomena and Related Outflows,
  Proceedings of the IAU Symp. # 163",,,,"astro-ph",,"  A systematic difference in alignment between the central black hole spin and
the angular momentum of the accreting gas may help explain several differences
found in the optical and UV HST spectra of radio loud and radio quiet AGN.
","[{""version"":""v1"",""created"":""Wed, 4 Sep 1996 17:27:45 GMT""}]","2007-05-23"
"astro-ph/9609033","Suzanne Linder","Suzanne M. Linder (Penn State)","Comparing Low Surface Brightness Galaxies and Ly$\alpha$ Absorbers","4 pages, Latex, to appear in the proceedings of the Young Galaxies
  and QSO Absorption-line Systems conference held in Santos, Brazil in April,
  1996",,,,"astro-ph",,"  I explore the hypothesis that Ly$\alpha$ absorption at low redshift is caused
by the outer regions of extended galaxy disks, including those of dwarf and low
surface brightness galaxies. McGaugh (1996) has shown that the distribution of
central galaxy surface brightnesses may be flat to 25 B mag arcsec$^{-2}$ or
fainter. A population of galaxies is simulated based upon observed
distributions. The low-redshift neutral column density distribution is
predicted, and an estimate is made for the number density of disk galaxies
required to explain all absorbers. Results relating to galaxy luminosities and
impact parameters are discussed.
","[{""version"":""v1"",""created"":""Wed, 4 Sep 1996 20:04:08 GMT""}]","2007-05-23"
"astro-ph/9609034","Charley Lineweaver","Charles H. Lineweaver (Observatoire Astronomique de Strasbourg)","The CMB Dipole: The Most Recent Measurement And Some History","To be published in Moriond CMB Proceedings 7 pages postscript",,,,"astro-ph",,"  The largest anisotropy in the cosmic microwave background (CMB) is the
$\approx 3$ mK dipole assumed to be due to our velocity with respect to the
CMB. Over the past ten years the precision of our knowledge of the dipole has
increased by a factor of ten. We discuss the most recent measurement of this
dipole obtained from the four year COBE Differential Microwave Radiometers
(DMR) as reported by Lineweaver \etal (1996). The inferred velocity of the
Local Group is $v_{LG}= 627 \pm 22$ km/s in the direction $\ell = 276\deg \pm
3$, $b= 30\deg \pm 2$. We compare this most recent measurement to a compilation
of more than 30 years of dipole observations.
","[{""version"":""v1"",""created"":""Wed, 4 Sep 1996 22:47:39 GMT""}]","2007-05-23"
"astro-ph/9609035","Tomonori Totani","Tomonori Totani and Katsuhiko Sato (Tokyo Univ.)","Resonant Spin-Flavor Conversion of Supernova Neutrinos and Deformation
  of the Electron Antineutrino Spectrum","19 pages, LaTeX, using revtex. To appear in Phys. Rev. D. 16 figures
  attatched","Phys.Rev.D54:5975-5992,1996","10.1103/PhysRevD.54.5975","UTAP-233/96, RESCEU-15/96","astro-ph hep-ph",,"  The neutrino spin-flavor conversion of \bar\nu_e and \nu_\mu which is induced
by the interaction of the Majorana neutrino magnetic moment and magnetic fields
in the collapse-driven supernova is investigated in detail. We calculate the
conversion probability by using the latest precollapse models of Woosley and
Weaver (1995), and also those of Nomono and Hashimoto (1988), changing the
stellar mass and metallicity in order to estimate the effect of the
astrophysical uncertainties. Contour maps of the conversion probability are
given for all the models as a function of neutrino mass squared difference and
the neutrino magnetic moment times magnetic fields. It is shown that in the
solar metallicity models some observational effects are expected with \Delta
m^2 = 10^{-5}--10^{-1} [eV^2] and \mu_\nu >~ 10^{-12} (10^9 G / B_0) [\mu_B],
where B_0 is the strength of the magnetic fields at the surface of the iron
core. We also find that although the dependence on the stellar models or
stellar mass is not so large, the metallicity of precollapse stars has
considerable effects on this conversion. Such effects may be seen in a
supernova in the Large or Small Magellanic Clouds, and should be taken into
account when one considers an upper bound on \mu_\nu from the SN1987A data.
","[{""version"":""v1"",""created"":""Thu, 5 Sep 1996 04:31:23 GMT""}]","2014-10-13"
"astro-ph/9609036","Thomas Buchert","Juergen Ehlers and Thomas Buchert","Newtonian Cosmology in Lagrangian Formulation: Foundations and
  Perturbation Theory","submitted to G.R.G., TeX 30 pages; AEI preprint 016","Gen.Rel.Grav. 29 (1997) 733-764","10.1023/A:1018885922682",,"astro-ph gr-qc",,"  The ``Newtonian'' theory of spatially unbounded, self--gravitating,
pressureless continua in Lagrangian form is reconsidered. Following a review of
the pertinent kinematics, we present alternative formulations of the Lagrangian
evolution equations and establish conditions for the equivalence of the
Lagrangian and Eulerian representations. We then distinguish open models based
on Euclidean space $\R^3$ from closed models based (without loss of generality)
on a flat torus $\T^3$. Using a simple averaging method we show that the
spatially averaged variables of an inhomogeneous toroidal model form a
spatially homogeneous ``background'' model and that the averages of open
models, if they exist at all, in general do not obey the dynamical laws of
homogeneous models. We then specialize to those inhomogeneous toroidal models
whose (unique) backgrounds have a Hubble flow, and derive Lagrangian evolution
equations which govern the (conformally rescaled) displacement of the
inhomogeneous flow with respect to its homogeneous background. Finally, we set
up an iteration scheme and prove that the resulting equations have unique
solutions at any order for given initial data, while for open models there
exist infinitely many different solutions for given data.
","[{""version"":""v1"",""created"":""Thu, 5 Sep 1996 13:50:19 GMT""}]","2015-06-24"
"chao-dyn/9609002","Stephane Nonnenmacher","S. Nonnenmacher, A. Voros (CEA-Saclay, Service de Physique Theorique)","Eigenstate structures around a hyperbolic point","27 pages, 6 Encapsulated Postscript figures","J. Phys. A: Math. Gen 30, 295-315 (1997)","10.1088/0305-4470/30/1/021","T96/093","chao-dyn nlin.CD quant-ph",,"  Using coherent-state representations of quantum mechanics (Bargmann, Husimi,
and stellar representations), we describe analytically the phase-space
structure of the general eigenstates corresponding to a 1-dimensional bilinear
hyperbolic Hamiltonian, H=pq or equivalently H=1/2(P^2-Q^2). Their
semi-classical behaviour is discussed for eigenvalues either near or away from
the separatrix energy {H=0}, especially in the phase-space vicinity of the
saddle-point (q,p)=(0,0).
","[{""version"":""v1"",""created"":""Thu, 5 Sep 1996 13:49:38 GMT""}]","2009-10-28"
"cond-mat/9609046","Nicolas Dupuis","N. Dupuis","Dimensional crossover and metal-insulator transition in
  quasi-two-dimensional disordered conductors","16 pages (RevTex), 4 poscript figures",,"10.1103/PhysRevB.56.9377",,"cond-mat",,"  We study the metal-insulator transition (MIT) in weakly coupled disordered
planes on the basis of a Non-Linear Sigma Model (NL$\sigma $M). Using two
different methods, a renormalization group (RG) approach and an auxiliary field
method, we calculate the crossover length between a 2D regime at small length
scales and a 3D regime at larger length scales. The 3D regime is described by
an anisotropic 3D NL$\sigma $M with renormalized coupling constants. We obtain
the critical value of the single particle interplane hopping which separates
the metallic and insulating phases. We also show that a strong parallel
magnetic field favors the localized phase and derive the phase diagram.
","[{""version"":""v1"",""created"":""Wed, 4 Sep 1996 18:56:17 GMT""}]","2009-10-28"
"cond-mat/9609047","Benjamin E. C. Koltenbah","Robert Joynt (Department of Physics, University of Wisconsin-Madison)","Theory of Neutron Diffraction from the Vortex Lattice in UPt3","11 pages; uses REVTEX, APS and PRABIB styles; 2 Postscript figure
  files included",,"10.1103/PhysRevLett.78.3189",,"cond-mat",,"  Neutron scattering experiments have recently been performed in the
superconducting state of UPt3 to determine the structure of the vortex lattice.
The data show anomalous field dependence of the aspect ratio of the unit cell
in the B phase. There is apparently also a change in the effective coherence
length on the transition from the B to the C phases. Such observations are not
consistent with conventional superconductvity. A theory of these results is
constructed based on a picture of two-component superconductivity for UPt3. In
this way, these unusual observations can be understood. There is a possible
discrepancy between theory and experiment in the detailed field dependence of
the aspect ratio.
","[{""version"":""v1"",""created"":""Wed, 4 Sep 1996 20:45:47 GMT""}]","2009-10-28"
"cond-mat/9609048","Sora Cho","Sora Cho and Matthew P.A. Fisher","Conductance fluctuations at the integer quantum Hall plateau transition","minor changes, 5 pages LaTex, 7 postscript figures included using
  epsf; to be published Phys. Rev. B 55 (1997)",,"10.1103/PhysRevB.55.1637",,"cond-mat.mes-hall",,"  We study numerically conductance fluctuations near the integer quantum Hall
effect plateau transition. The system is presumed to be in a mesoscopic regime,
with phase coherence length comparable to the system size. We focus on a
two-terminal conductance G for square samples, considering both periodic and
open boundary conditions transverse to the current. At the plateau transition,
G is broadly distributed, with a distribution function close to uniform on the
interval between zero and one in units of e^2/h. Our results are consistent
with a recent experiment by Cobden and Kogan on a mesoscopic quantum Hall
effect sample.
","[{""version"":""v1"",""created"":""Wed, 4 Sep 1996 21:25:37 GMT""},{""version"":""v2"",""created"":""Wed, 13 Nov 1996 23:42:33 GMT""}]","2016-08-31"
"cond-mat/9609049","Marti Pi","M. Guilleumas, M. Barranco, D.M. Jezek, R.J. Lombard and M. Pi","Quantum cavitation in liquid helium","Typeset using Revtex, 10 pages and 2 figures, Phys. Rev B (1996)","Phys. Rev. 54 (1996) 16135","10.1103/PhysRevB.54.16135",,"cond-mat",,"  Using a functional-integral approach, we have determined the temperature
below which cavitation in liquid helium is driven by thermally assisted quantum
tunneling. For both helium isotopes, we have obtained the crossover temperature
in the whole range of allowed negative p essures. Our results are compatible
with recent experimental results on 4He.
","[{""version"":""v1"",""created"":""Thu, 5 Sep 1996 10:29:39 GMT""}]","2009-10-28"
"cond-mat/9609050","Bosiljka Tadic","Bosiljka Tadic (Jo\v{z}ef Stefan Institute, Ljubljana, Slovenia)","Nonuniversal scaling behavior of Barkhausen noise","5 pages, Latex, 4 PostScript figures included","Phys. Rev. Lett. 77, 3843 (1996)","10.1103/PhysRevLett.77.3843",,"cond-mat",,"  We simulate Barkhausen avalanches on fractal clusters in a two-dimensional
diluted Ising ferromagnet with an effective Gaussian random field. We vary the
concentration of defect sites $c$ and find a scaling region for moderate
disorder, where the distribution of avalanche sizes has the form $D(s,c,L) =
s^{-(1+\tau (c))}{\cal{D}}(sL^{-D_s(c)})$. The exponents $\tau (c)$ for size
and $\alpha (c)$ for length distribution, and the fractal dimension of
avalanches $D_s(c)$ satisfy the scaling relation $D_s(c)\tau (c) =\alpha (c)$.
For fixed disorder the exponents vary with driving rate in agreement with
experiments on amorphous Si-Fe alloys.
","[{""version"":""v1"",""created"":""Thu, 5 Sep 1996 10:04:01 GMT""}]","2009-10-28"
"cond-mat/9609051",,"Jordi Faraudo and Javier Bafaluy (Departament de Fisica, Universitat
  Autonoma de Barcelona, Bellaterra, Spain)","Irreversible Adsorption of particles after diffusing in a gravitational
  field","15 pages, REVTeX, 8 figures upon request, to appear in PRE Oct 96",,"10.1103/PhysRevE.54.3725",,"cond-mat",,"  In this paper we analyze the influence of transport mechanisms (diffusion and
sedimentation) on the structure of monolayers of particles irreversibly
adsorbed on a line. We focus our attention on the dependence of the radial
distribution function $g(r)$ and the saturation coverage $\theta_\infty$ on the
gravitational P\'eclet number $N_g$. First, we study the probability density of
adsorption onto an available interval using approximate solutions of the
transport equation and computer simulations. Combining our results with an
approximate general formalism, we can obtain values of $\theta_\infty$ and the
gap density, which agree with our simulations. We also show that, for large
gravity, the coverage $\theta_{\infty}$ approaches the ballistic limit
following a power law in $N_g$ that is independent of the number of dimensions,
as has been observed in simulations.
","[{""version"":""v1"",""created"":""Thu, 5 Sep 1996 12:38:31 GMT""}]","2009-10-28"
"cond-mat/9609052","Hans Dekker","J.P. Dekker (1), A.Lodder (1), R. Zeller (2), A.F. Tatarchenko (3)
  ((1) Vrije Universiteit, Amsterdam, The Netherlands, (2) Forschungszentrum
  J\""ulich GmbH, Germany, (3) Institute of High Pressure Physics, Troitsk,
  Russia)","Accurate evaluation of the interstitial KKR-Green function","23 pages, RevTeX","Phys. Rev. B 54 (1996) 4531","10.1103/PhysRevB.54.4531",,"cond-mat",,"  It is shown that the Brillouin zone integral for the interstitial KKR-Green
function can be evaluated accurately by taking proper care of the free-electron
singularities in the integrand. The proposed method combines two recently
developed methods, a supermatrix method and a subtraction method. This
combination appears to provide a major improvement compared with an earlier
proposal based on the subtraction method only. By this the barrier preventing
the study of important interstitial-like defects, such as an electromigrating
atom halfway along its jump path, can be considered as being razed.
","[{""version"":""v1"",""created"":""Thu, 5 Sep 1996 13:38:23 GMT""}]","2009-10-28"
"cond-mat/9609053","Marti Pi","D. Jezek, M. Guilleumas, M. Pi, and M. Barranco","Thermally assisted quantum cavitation in solutions of 3He in 4He","Typeset using Revtex, 9 pages and 4 figures","Europhys. Lett. 38 (1997) 601","10.1209/epl/i1997-00290-6",,"cond-mat",,"  We have investigated the quantum-to-thermal crossover temperature T* for
cavitation in liquid helium mixtures up to 0.05 3He concentrations. With
respect to the pure 4He case, T* is sizeably reduced, to a value below 50 mK
for 3He concentrations above 0.02. As in pure 4He, the homogeneous cavitation
pressure is systematically found close to the spinodal pressure.
","[{""version"":""v1"",""created"":""Thu, 5 Sep 1996 15:04:33 GMT""}]","2009-10-28"
"cond-mat/9609054","Peter Neu","D.R. Reichman, F.L.H. Brown, and P. Neu","Cumulant Expansions and the Spin-Boson Problem","26 pages, LaTex",,"10.1103/PhysRevE.55.2328",,"cond-mat",,"  The dynamics of the dissipative two-level system at zero temperature is
studied using three different cumulant expansion techniques. The relative
merits and drawbacks of each technique are discussed. It is found that a new
technique, the non-crossing cumulant expansion, appears to embody the virtues
of the more standard cumulant methods.
","[{""version"":""v1"",""created"":""Thu, 5 Sep 1996 13:40:20 GMT""}]","2009-10-28"
"cond-mat/9609055","Andrey Zheludev","Y. Sasago, K. Uchinokura, A. Zheludev and G. Shirane","Temperature-dependent spin gap and singlet ground state in BaCuSi2O6","10 pages, 4 figures, REVTeX and PS for text, PS for figures direct
  download: http://papillon.phy.bnl.gov/preprints/bacusio.html",,"10.1103/PhysRevB.55.8357",,"cond-mat",,"  Bulk magnetic measurements and inelastic neutron scattering were used to
investigate the spin-singlet ground state and magnetic gap excitations in
BaCuSi2O6, a quasi-2-dimensional antiferromagnet with a bilayer structure. The
results are well described by a model based on weakly interacting
antiferromagnetic dimers. A strongly temperature-dependent dispersion in the
gap modes was found. We suggest that the observed excitations are analogous to
magneto-excitons in light rare-earth compounds, but are an intrinsic property
of a simple Heisenberg Hamiltonian for the S=1/2 magnetic bilayer.
","[{""version"":""v1"",""created"":""Thu, 5 Sep 1996 14:51:53 GMT""}]","2009-10-28"
"cond-mat/9609056","Miroslav Kolesik","M. Kolesik, H. L. Richards, M. A. Novotny, Per Arne Rikvold and
  Per-Anker Lindgard","Magnetization switching in nanoscale ferromagnetic grains: simulations
  with heterogeneous nucleation","3 pages, 4 Postscript figures","J. Appl. Phys. 81 (8), 5600 (1997).","10.1063/1.364612",,"cond-mat",,"  We present results obtained with various types of heterogeneous nucleation in
a kinetic Ising model of magnetization switching in single-domain ferromagnetic
nanoparticles. We investigate the effect of the presence of the system boundary
and make comparison with simulations on periodic lattices. We also study
systems with bulk disorder and compare how two different types of disorder
influence the switching behavior.
","[{""version"":""v1"",""created"":""Thu, 5 Sep 1996 15:02:22 GMT""}]","2009-10-28"
