"hep-th/9609218","Saulo Carneiro de Souza Silva S.","P.C.R. Cardoso de Mello, S. Carneiro and M.C. Nemes","Action Principle for the Classical Dual Electrodynamics","latex, 8 pages, no figures","Phys.Lett.B384:197-200,1996","10.1016/0370-2693(96)00813-1",,"hep-th",,"  The purpose of this paper is to formulate an action principle which allows
for the construction of a classical lagrangean including both electric and
magnetic currents. The lagrangean is non-local and shown to yield all the
expected (local) equations for dual electrodynamics.
","[{""version"":""v1"",""created"":""Fri, 27 Sep 1996 17:57:50 GMT""}]","2010-03-19"
"hep-th/9609220","Alexander Belopolsky","Alexander Belopolsky","De Rham Cohomology of the Supermanifolds and Superstring BRST Cohomology","6 pages","Phys.Lett. B403 (1997) 47-50","10.1016/S0370-2693(97)00445-0","IFP/101/UNC","hep-th",,"  We show that the BRST operator of Neveu-Schwarz-Ramond superstring is closely
related to de Rham differential on the moduli space of decorated super-Riemann
surfaces P. We develop formalism where superstring amplitudes are computed via
integration of some differential forms over a section of P over the super
moduli space M. We show that the result of integration does not depend on the
choice of section when all the states are BRST physical. Our approach is based
on the geometrical theory of integration on supermanifolds of which we give a
short review.
","[{""version"":""v1"",""created"":""Sat, 28 Sep 1996 00:50:20 GMT""}]","2009-10-30"
"hep-th/9609221",,"Kenichiro Aoki, Eric D'Hoker","High energy scattering of non-critical strings","10pp, LaTeX, Contribution to Proceedings of the Telluride 1996,
  workshop on Low-Dimensional Quantum Fields Theory","Int.J.Mod.Phys.A12:1253-1263,1997","10.1142/S0217751X97000980","UCLA/96/TEP/29","hep-th",,"  We summarize recent work, in which we consider scattering amplitudes of
non-critical strings in the limit where the energy of all external states is
large compared to the string tension. We show that the high energy limit is
dominated by a saddle point that can be mapped onto an electrostatic
equilibrium configuration of an assembly of charges associated with the
external states, together with a density of charges arising from the Liouville
field. The Liouville charges accumulate on line segments, which produce
quadratic branch cuts on the worldsheet. The electrostatics problem is solved
for string tree level in terms of hyperelliptic integrals and is given
explicitly for the 3- and 4-point functions. For generic values of the central
charge, the high energy limit behaves in a string-like fashion, with
exponential energy dependence.
","[{""version"":""v1"",""created"":""Sat, 28 Sep 1996 01:47:16 GMT""}]","2014-11-18"
"hep-th/9609223","Motohiko Yoshimura","I. Joichi, Sh. Matsumoto, and M. Yoshimura","Quantum Dissipation and Decay in Medium","19 pages, LATEX file. Substantially expanded and revised for
  publication, including more complete description of application to unstable
  particle decay in thermal medium. Some minor mistake of numerical factors
  corrected","Phys.Rev. A57 (1998) 798","10.1103/PhysRevA.57.798","TU/96/510","hep-th cond-mat gr-qc hep-ph quant-ph",,"  Quantum dissipation in thermal environment is investigated, using the path
integral approach. The reduced density matrix of the harmonic oscillator system
coupled to thermal bath of oscillators is derived for arbitrary spectrum of
bath oscillators. Time evolution and the end point of two-body decay of
unstable particles is then elucidated: After early transient times unstable
particles undergo the exponential decay, followed by the power law decay and
finally ending in a mixed state of residual particles containing contributions
from both on and off the mass shell, whose abundance does not suffer from the
Boltzmann suppression.
","[{""version"":""v1"",""created"":""Sat, 28 Sep 1996 07:47:27 GMT""},{""version"":""v2"",""created"":""Tue, 2 Sep 1997 01:07:14 GMT""}]","2009-10-30"
"hep-th/9609224","Takehisa Fujita","Takehisa Fujita, Makoto Hiramoto and Hidenori Takahashi","Bound states of 1+1 dimensional field theories","10 pages, Latex, no figure, Talk given at the 13th International
  Seminar On High Energy Physics Problems, Dubna, 2-7 September, 1996",,,,"hep-th",,"  We discuss the bound states of the massive Thirring model. Here, the periodic
boundary condition equations for the Bethe ansatz solutions are numerically
solved. It is found that the massive Thirring model has only one bound state
and the bound state spectrum as the function of the coupling constant agrees
with that of infinite momentum frame prescription by Fujita and Ogura. Boson
boson states (2p$-$2h states) appear only as the continuum spectrum without
making any bound states.
  Further, the finite size correction to the vacuum energy is estimated. The
evaluated central charge is found to be close to unity.
","[{""version"":""v1"",""created"":""Sat, 28 Sep 1996 11:01:17 GMT""}]","2007-05-23"
"nucl-th/9609062",,"C. Ciofi degli Atti, L.P. Kaptari (Perugia), S. Scopetta (Perugia and
  Mainz)","Tagging nucleon structure functions by heavy particle detection in deep
  inelastic electron-ion scattering","14 pages, Latex file, 4 postscript figures generated by epsf.sty
  included in submission",,,,"nucl-th",,"  It is shown that in deep inelastic electron - ion collisions the detection,
in coincidence with the scattered electron, of a nucleus A-1 in the ground
state, as well as a nucleon and a nucleus A-2 also in the ground state, may
provide unique information on several long standing problems, such as the
origin of the EMC effect, the possible medium modifications of the nucleon
structure functions, and the nature of Nucleon-Nucleon correlations.
","[{""version"":""v1"",""created"":""Fri, 27 Sep 1996 20:18:17 GMT""}]","2007-05-23"
"nucl-th/9609063","Mannque Rho","Mannque Rho (SPhT/CEA Saclay)","QCD Vacuum Changes in Nuclei","12 pages, revtex, no figures. Invited talk given at the International
  Workshop on Hadrons in Dense Matter, July 3-5, 1996, GSI, Darmstadt, Germany
  and at the International Symposium on Non-Nucleonic Degrees of Freedom
  Detected in Nucleus, September 2-5, 1996, Osaka, Japan",,,,"nucl-th hep-ph",,"  In this talk, I discuss how the changes in the QCD vacuum induced by
increasing nuclear matter density affect nuclear properties under normal as
well as extreme conditions. The quark condensate which is the order parameter
for the mode in which chiral symmetry is manifested is expected to change as
matter density or temperature is changed. The topics discussed are ``BR
scaling,"" its connection to the structure of nuclei in Landau's Fermi liquid
theory and a variety of consequences on such nuclear properties as effective
nucleon mass, nuclear gyromagnetic ratios, $g_A^\star$, axial-charge
transitions in nuclei and on the fluctuations of nuclear matter into the
strange-flavor direction as observed in heavy-ion collisions. I will also
present a simple explanation of the recent dilepton data in the CERN-CERES
heavy-ion experiments involving densities greater than that of nuclear matter
and of the Indiana results on the longitudinally polarized proton scattering
from heavy nuclei, evidencing dropping vector-meson masses in medium which can
be interpreted as signaling an aspect of chiral symmetry restoration in dense
medium. The test of BR scaling provides a bridge between the physics of extreme
conditions (e.g. relativistic heavy-ion collisions) and the physics of normal
conditions which has conventional descriptions, thereby setting the stage for
formulating many-body theory for nuclear matter starting from an effective
chiral Lagrangian.
","[{""version"":""v1"",""created"":""Sat, 28 Sep 1996 09:48:44 GMT""}]","2007-05-23"
"q-alg/9609031","Vyjayanthi Chari","Vyjayanthi Chari and Andrew Pressley","Quantum Affine Algebras at Roots of Unity","54 pages, Amstex. The paper has been substantially revised,
  reorganized and the results are now proved for arbitrary untwisted affine Lie
  algebras. The proof uses several new identities in the the quantized
  enveloping algbera",,,,"q-alg math.QA",,"  We study the restricted form of the qaunatized enveloping algebra of an
untwisted affine Lie algebra and prove a triangular decomposition for it. In
proving the decomposition we prove several new identities in the quantized
algebra, one of these show a connection between the quantized algebra and Young
diagrams. These identities are all invisible in the non-quantum case of the
problem which was considered by Garland in 1978. We then study the
finite-dimensional irreducible representations and prove a factorization
theorem for such representations.
","[{""version"":""v1"",""created"":""Fri, 27 Sep 1996 22:02:28 GMT""},{""version"":""v2"",""created"":""Tue, 22 Apr 1997 02:40:38 GMT""}]","2016-09-08"
"quant-ph/9609023","Olavo Leopoldino Da Silva Filho","L.S.F. Olavo","Quantum Mechanics as a Classical Theory XIV: Connection with Stochastic
  Processes","plain latex, no figures, 15 pages",,,"unb-014","quant-ph",,"  In this paper we are interested in unraveling the mathematical connections
between the stochastic derivation of Schr\""odinger equation and ours. It will
be shown that these connections are given by means of the time-energy
dispersion relation and will allow us to interpret this relation on more
sounded grounds. We also discuss the underlying epistemology.
","[{""version"":""v1"",""created"":""Fri, 27 Sep 1996 18:23:19 GMT""}]","2007-05-23"
"quant-ph/9609024","Chris Adami","C. Adami and N.J. Cerf (California Institute of Technology)","On the von Neumann capacity of noisy quantum channels","15 pages RevTeX with psfig, 13 figures. Revised interpretation of
  capacity, added section, changed title","Phys.Rev.A56:3470,1997","10.1103/PhysRevA.56.3470","KRL MAP-206","quant-ph",,"  We discuss the capacity of quantum channels for information transmission and
storage. Quantum channels have dual uses: they can be used to transmit known
quantum states which code for classical information, and they can be used in a
purely quantum manner, for transmitting or storing quantum entanglement. We
propose here a definition of the von Neumann capacity of quantum channels,
which is a quantum mechanical extension of the Shannon capacity and reverts to
it in the classical limit. As such, the von Neumann capacity assumes the role
of a classical or quantum capacity depending on the usage of the channel. In
analogy to the classical construction, this capacity is defined as the maximum
von Neumann mutual entropy processed by the channel, a measure which reduces to
the capacity for classical information transmission through quantum channels
(the ""Kholevo capacity"") when known quantum states are sent. The quantum mutual
entropy fulfills all basic requirements for a measure of information, and
observes quantum data-processing inequalities. We also derive a quantum Fano
inequality relating the quantum loss of the channel to the fidelity of the
quantum code. The quantities introduced are calculated explicitly for the
quantum ""depolarizing"" channel. The von Neumann capacity is interpreted within
the context of superdense coding, and an ""extended"" Hamming bound is derived
that is consistent with that capacity.
","[{""version"":""v1"",""created"":""Fri, 27 Sep 1996 23:17:08 GMT""},{""version"":""v2"",""created"":""Wed, 23 Oct 1996 02:27:50 GMT""},{""version"":""v3"",""created"":""Tue, 3 Jun 1997 02:35:23 GMT""}]","2008-12-18"
"quant-ph/9609025","Mark J. Gotay","Mark J. Gotay, Hendrik B. Grundling","On Quantizing $T^*S^1$","LaTeX, 19 pps","Rept.Math.Phys. 40 (1997) 107-123","10.1016/S0034-4877(97)85622-4",,"quant-ph dg-ga hep-th math.DG",,"  In this paper we continue our study of Groenewold-Van Hove obstructions to
quantization. We show that there exists such an obstruction to quantizing the
cylinder $T^*S^1.$ More precisely, we prove that there is no quantization of
the Poisson algebra of $T^*S^1$ which is irreducible on a naturally defined
$e(2) \times R$ subalgebra. Furthermore, we determine the maximal
``polynomial'' subalgebras that can be consistently quantized, and completely
characterize the quantizations thereof. This example provides support for one
of the conjectures in Gotay et al 1996, but disproves part of another. Passing
to coverings, we also derive a no-go result for $R^2$ which is comparatively
stronger than those originally found by Groenewold and Van Hove.
","[{""version"":""v1"",""created"":""Sat, 28 Sep 1996 00:15:28 GMT""}]","2009-10-30"
"quant-ph/9609026",,"Stefano Mancini, Vladimir I. Man'ko, and Paolo Tombesi","Classical-Like Description of Quantum Dynamics by Means of Symplectic
  Tomography","29 pages,LATEX,accepted by Foundations of Physics","Found.Phys. 27 (1997) 801","10.1007/BF02550342",,"quant-ph",,"  The dynamical equation of quantum mechanics are rewritten in form of
dynamical equations for the measurable, positive marginal distribution of the
shifted, rotated and squeezed quadrature introduced in the so called
""symplectic tomography"". Then the possibility of a purely classical description
of a quantum system as well as a reinterpretation of the quantum measurement
theory is discussed and a comparision with the well known quasi-probabilities
approach is given. Furthermore, an analysis of the properties of this marginal
distribution, which contains all the quantum information, is performed in the
framework of classical probability theory. Finally examples of harmonic
oscillator's states dynamics are treated.
","[{""version"":""v1"",""created"":""Sat, 28 Sep 1996 11:17:00 GMT""}]","2009-10-30"
