"astro-ph/9605106","Omar Almaini","Omar Almaini, Tom Shanks, Brian J. Boyle, Richard E. Griffiths, Nathan
  Roche, Gordon C. Stewart, Ioannis Georgantopoulos","A deep ROSAT Survey - XII. The X-ray spectra of faint ROSAT sources","MNRAS Accepted. (References revised and updated). The preprint is
  also available at http://www.ast.cam.ac.uk/preprint/PrePrint.html or
  http://www.ast.cam.ac.uk/~omar/astro.html",,"10.1093/mnras/282.1.295","CAP-9605004","astro-ph",,"  Optical spectroscopy has enabled us to identify the optical counterparts to
over 200 faint X-ray sources to a flux limit of S_(0.5-2keV)=4x10^-15 erg s^-1
cm^-2 on 5 deep ROSAT fields. Here we present a spectral analysis of all the
X-ray sources to investigate claims that the average source spectra harden at
faint X-ray flux. From a hardness ratio analysis we confirm that the average
spectra from 0.5-2 keV harden from an equivalent photon index of $\Gamma=2.2$
at S_(0.5-2keV)=1x10^-13 erg s^-1 cm^-2 to $\Gamma=1.7$ below 1x10^-14 erg s^-1
cm^-2. These spectral changes are due to the emergence of an unidentified
source population rather than the class of X-ray QSOs already identified. The
128 QSOs detected so far show no evidence for spectral hardening over this
energy range and retain a mean photon index of $\Gamma=2.2$. Recent work
suggests that many of the remaining unidentified sources are X-ray luminous
galaxies. Taking a subset identified as the most likely galaxy candidates we
find that these show significantly harder spectra than QSOs. The emission line
galaxies in particular show spectra more consistent with the residual X-ray
background, with $\Gamma=1.51 \pm 0.1$ from 0.1-2 keV. Individually the
galaxies appear to be a mixture of absorbed and unabsorbed X-ray sources.
Combined with recent cross-correlation results and work on the source number
count distribution, these results suggest that we may be uncovering the missing
hard component of the cosmic X-ray background.
","[{""version"":""v1"",""created"":""Fri, 17 May 1996 16:14:02 GMT""},{""version"":""v2"",""created"":""Thu, 23 May 1996 13:54:23 GMT""}]","2015-06-24"
"astro-ph/9605112","Reynier Peletier","A. Vazdekis (IAC), E. Casuso (IAC), R.F. Peletier (Groningen, IAC) and
  J.E. Beckman (IAC)","A new chemo-evolutionary population synthesis model for early-type
  galaxies. I: Theoretical basis","37 pages; includes 8 tables and 23 figures, accepted by the
  Astrophysical Journal Supplement. Fig. 11, can be obtained from
  http://www.astro.rug.nl/~peletier/paper1.html","Astrophys.J.Suppl.106:307,1996","10.1086/192340",,"astro-ph",,"  We have developed a new stellar population synthesis model designed to study
early-type galaxies. It provides optical and near-infrared colors, and line
indices for 25 absorption lines. It can synthesize single age, single
metallicity stellar populations or follow the galaxy through its evolution from
an initial gas cloud to the present time. The model incorporates the new
isochrones of the Padova group and the latest stellar spectral libraries. The
model has been extensively compared with previous ones in the literature to
establish its accuracy as well as the accuracy of this kind of models in
general.
  Using the evolutionary version of the model we find that we cannot fit the
most metal-rich elliptical galaxies if we keep the IMF constant and do not
allow infall of gas. We do however reproduce the results of Arimoto \& Yoshii
(1986) for the evolution of the gas, and produce colors, and, for the first
time with this type of models, absorption line-strengths. It is in fact
possible to fit the data for the elliptical galaxies by varying the IMF with
time. Our numerical model is in good broad agreement with the analytical
'simple model'. In the present paper we describe the model, and compare a few
key observables with new data for three early-type {\em standard} galaxies.
However the data, as well as our fits, will be discussed in much more detail in
a second paper (Vazdekis {\it et al.} 1996), where some conclusions will be
drawn about elliptical galaxies on the basis of this model.
","[{""version"":""v1"",""created"":""Fri, 17 May 1996 17:00:11 GMT""}]","2008-11-26"
"astro-ph/9605113","Jean M. Quashnock","Daniel E. Vanden Berk, Jean M. Quashnock, Donald G. York, (Dept. of
  Astronomy and Astrophysics, U. Chicago), and Brian Yanny (Fermilab)","An Excess of C IV Absorbers in Luminous QSOs: Evidence for Gravitational
  Lensing?","21 LaTeX pages with 5 encapsulated Postscript figures included, uses
  AASTeX (v. 4.0) available at ftp://ftp.aas.org/pubs/ , to appear in The
  Astrophysical Journal, Sept. 20, 1996","Astrophys.J. 469 (1996) 78","10.1086/177760",,"astro-ph",,"  We have compiled a new and extensive catalog of heavy-element QSO absorption
line systems and analyzed the distribution of absorbers in bright and faint
QSOs, to search for gravitational lensing of background QSOs by the matter
associated with the absorbers. There is a highly significant excess of C {\sc
iv} absorbers in bright QSOs in the redshift range $z=1.2-3.2$, and this excess
increases strongly as a function of QSO absolute magnitude. No significant
excess is found for Mg {\sc ii} absorbers in the redshift range $z=0.30-1.55$.
We rule out several possible reasons for this effect and argue that the C {\sc
iv} excess could be due to gravitational lensing. If so, then the lensing
masses must be at $z \gtrsim 1.5$ and within several hundred comoving Mpc of
the QSOs, where the C {\sc iv} absorbers are mainly found. The absence of an
excess in the available Mg {\sc ii} sample would then arise because the Mg {\sc
ii} data does not sample this region of space.
","[{""version"":""v1"",""created"":""Fri, 17 May 1996 21:59:18 GMT""}]","2009-10-28"
"astro-ph/9605114","Michael Liu","Michael C. Liu, James R. Graham (UC Berkeley), and Gillian S. Wright
  (JAC/UKIRT)","IRAS FSC 15307+3252 -- Gravitationally Lensed Seyfert or Cannibal
  Elliptical at $z$ = 0.93?","AASTeX, 24 pages (19 text and 5 Postscript figures). To appear in the
  October 20, 1996 issue of the Astrophysical Journal. Corrected orientation of
  figures and also object positions in Table 1",,"10.1086/177907",,"astro-ph",,"  We present the highest spatial and spectral resolution near-infrared data to
date of the $\sim~10^{13}~h^{-2}~L_{\sun}$ {\sl IRAS} source FSC 15307+3252 at
$z = 0.93$, apparently the most luminous galaxy in the known Universe. Deep
$K$-band (2.2 \micron) images taken in 0\farcs4 seeing at the W.\ M.\ Keck
Telescope reveal three components within 2\arcsec. The dominant component has a
surface brightness profile well-characterized by an $r^{1/4}$ law and a nucleus
which is stellar in appearance with extended structure, possibly a second
nucleus $\sim$~0\farcs5 away. Our 1.1--1.4~\micron\ spectrum shows strong
emission lines of \oi\ \lam\lam6300, 6364; blended \ha~+~\nii\ \lam\lam6548,
6583; and \sii\ \lam\lam6716, 6731 with characteristics of Seyfert 2 galaxies.
The \ha\ line also has a broad (1900 km~s$^{-1}$) component. In light of the
recent discovery that FSC 10214+4724, previously the most luminous known
galaxy, is a gravitationally-lensed system, we explore the possibility that
F15307 is also lensed. Quantitative arguments are inconclusive, but aspects of
F15307's morphology do suggest lensing; the system bears a strong resemblance
to quadruple-image gravitational lenses. On the other hand, given the $r^{1/4}$
profile, the close companions, and the active nucleus, F15307 may in fact be a
giant elliptical galaxy caught in the act of galactic cannibalism, a scenario
which could also account for its unparalleled luminosity.
","[{""version"":""v1"",""created"":""Sat, 18 May 1996 08:20:04 GMT""},{""version"":""v2"",""created"":""Thu, 8 Aug 1996 00:10:49 GMT""}]","2009-10-28"
"cond-mat/9605109","Jim Freericks","J. K. Freericks (Georgetown), Mark Jarrell (Cincinnati), and G. D.
  Mahan (Tennessee and ORNL)","The anharmonic electron-phonon problem","5 pages typeset in ReVTeX. Four encapsulated postscript files
  included",,"10.1103/PhysRevLett.77.4588",,"cond-mat",,"  The anharmonic electron-phonon problem is solved in the infinite-dimensional
limit using quantum Monte Carlo simulation. Charge-density-wave order is seen
to remain at half filling even though the anharmonicity removes the
particle-hole symmetry (and hence the nesting instability) of the model.
Superconductivity is strongly favored away from half filling (relative to the
charge-density-wave order) but the anharmonicity does not enhance transition
temperatures over the maximal values found in the harmonic limit.
","[{""version"":""v1"",""created"":""Fri, 17 May 1996 19:15:01 GMT""}]","2009-10-28"
"cond-mat/9605110",,"D. Stauffer, P.M.C. de Oliveira, S.M. Moss de Oliveira and R.M.
  Zorzenon dos Santos","Monte Carlo Simulations of Sexual Reproduction","8 pages, plain tex, 7 EPS figures, to appear in PHYSICA A",,"10.1016/0378-4371(96)00214-2",,"cond-mat q-bio",,"  Modifying the Redfield model of sexual reproduction and the Penna model of
biological aging, we compare reproduction with and without recombination in
age-structured populations. In contrast to Redfield and in agreement with
Bernardes we find sexual reproduction to be preferred to asexual one. In
particular, the presence of old but still reproducing males helps the survival
of younger females beyond their reproductive age.
","[{""version"":""v1"",""created"":""Fri, 17 May 1996 21:04:12 GMT""}]","2015-06-25"
"cond-mat/9605111","Muyu Guo","Muyu Guo (Argonne National Lab and Princeton Univ.), R. N. Bhatt
  (Princeton Univ.), David A. Huse (AT&T Bell Labs)","Quantum Griffiths Singularities in the Transverse-Field Ising Spin Glass","20 pages, REVTEX, 6 eps figures included using the epsf macros; to
  appear in Phys. Rev. B","Phys. Rev. B 54, 3336-3342 (1996)","10.1103/PhysRevB.54.3336",,"cond-mat",,"  We report a Monte Carlo study of the effects of {\it fluctuations} in the
bond distribution of Ising spin glasses in a transverse magnetic field, in the
{\it paramagnetic phase} in the $T\to 0$ limit. Rare, strong fluctuations give
rise to Griffiths singularities, which can dominate the zero-temperature
behavior of these quantum systems, as originally demonstrated by McCoy for
one-dimensional ($d=1$) systems. Our simulations are done on a square lattice
in $d=2$ and a cubic lattice in $d=3$, for a gaussian distribution of nearest
neighbor (only) bonds. In $d=2$, where the {\it linear} susceptibility was
found to diverge at the critical transverse field strength $\Gamma_c$ for the
order-disorder phase transition at T=0, the average {\it nonlinear}
susceptibility $\chi_{nl}$ diverges in the paramagnetic phase for $\Gamma$ well
above $\Gamma_c$, as is also demonstrated in the accompanying paper by Rieger
and Young. In $d=3$, the linear susceptibility remains finite at $\Gamma_c$,
and while Griffiths singularity effects are certainly observable in the
paramagnetic phase, the nonlinear susceptibility appears to diverge only rather
close to $\Gamma_c$. These results show that Griffiths singularities remain
persistent in dimensions above one (where they are known to be strong), though
their magnitude decreases monotonically with increasing dimensionality (there
being no Griffiths singularities in the limit of infinite dimensionality).
","[{""version"":""v1"",""created"":""Fri, 17 May 1996 22:47:52 GMT""}]","2012-08-17"
"cond-mat/9605112","Shao-Ming Fei","Sergio Albeverio, Shao-Ming Fei","Integration Approach to Ising Models","25 pages, Latex",,,,"cond-mat hep-th nlin.SI solv-int",,"  An integral representation of the partition function for general
$n$-dimensional Ising models with nearest or non-nearest neighbours
interactions is given. The representation is used to derive some properties of
the partition function. An exact solution is given in a particular case.
","[{""version"":""v1"",""created"":""Sat, 18 May 1996 10:50:07 GMT""}]","2008-02-03"
"gr-qc/9605039","Robert Mann","C. Alvarez and R.B. Mann","Testing the Equivalence Principle in the Quantum Regime","6 pages, harvmac, Honorable mention in the Gravity Research
  Foundation Essay Contest","Gen.Rel.Grav. 29 (1997) 245-250","10.1023/A:1010296229642","WATPHYS-TH96/07","gr-qc",,"  We consider possible tests of the Einstein Equivalence Principle for physical
systems in which quantum-mechanical vacuum energies cannot be neglected.
Specific tests include a search for the manifestation of non-metric effects in
Lamb-shift transitions of Hydrogenic atoms and in anomalous magnetic moments of
massive leptons. We discuss how current experiments already set bounds on the
violation of the equivalence principle in this sector and how new
(high-precision) measurements of these quantities could provide further
information to this end.
","[{""version"":""v1"",""created"":""Fri, 17 May 1996 21:31:38 GMT""}]","2015-06-25"
"gr-qc/9605040","Patricio Salgado Areas","Mauricio Cataldo (Universidad del Bio-Bio, Chile), Patricio Salgado
  (Universidad de Concepcion, Chile)","Superposition of a static perfect fluid and a radial elecric field","12 pages, RevTeX, no figures","J.Math.Phys. 36 (1995) 6872-6878","10.1063/1.531195",,"gr-qc",,"  We obtain a two-parameter set of solutions, which represents a spherically
symmetric space-time with a superposition of a neutral fluid and an electric
field. The electromagnetic four-potential of this Einstein-Maxwell space-time
is taken in the form A=(q/n)(r^n)dt, when n=/0 and A=q*ln(r)dt, when n=0 (where
q and n are arbitrary constants)
","[{""version"":""v1"",""created"":""Fri, 17 May 1996 19:11:31 GMT""}]","2009-10-28"
"gr-qc/9605041","Akihiro Ishibashi","Akihiro Ishibashi, Tatsuhiko Koike, Masaru Siino and Sadayoshi Kojima","Compact hyperbolic universe and singularities","8 pages with 7 figures","Phys.Rev. D54 (1996) 7303-7310","10.1103/PhysRevD.54.7303","TIT/HEP-330/COSMO-72","gr-qc",,"  Recently many people have discussed the possibility that the universe is
hyperbolic and was in an inflationary phase in the early stage. Under these
assumptions, it is shown that the universe cannot have compact hyperbolic
time-slices. Though the universal covering space of the universe has a past
Cauchy horizon and can be extended analytically beyond it, the extended region
has densely many points which correspond to singularities of the compact
universe. The result is essentially attributed to the ergodicity of the
geodesic flow on a compact negatively curved manifold. Validity of the result
is also discussed in the case of inhomogeneous universe. Relationship with the
strong cosmic censorship conjecture is also discussed.
","[{""version"":""v1"",""created"":""Sat, 18 May 1996 12:14:15 GMT""}]","2009-10-28"
"hep-lat/9605022","Xiang-Qian Luo","Vicente Azcoiti, Victor Laliena, Xiang-Qian Luo","Investigation of spontaneous symmetry breaking from a non standard
  approach",,"Nucl.Phys.Proc.Suppl. 47 (1996) 565-568","10.1016/0920-5632(96)00123-5",,"hep-lat",,"  We propose a new method for the study of the chiral properties of the ground
state in Quantum Field Theories (QFT's) which is based on the computation of
the probability distribution function (p.d.f.) of the chiral condensate in the
chiral limit. We show how despite of the fact that Grassmann variables cannot
be simulated on a computer, an analysis of spontaneous symmetry breaking
without a symmetry breaking external field, which is standard in the case of
spin systems, can also be done in QFT's with fermion degrees of freedom.
","[{""version"":""v1"",""created"":""Sat, 18 May 1996 08:29:52 GMT""}]","2009-10-28"
"hep-ph/9605338","Probir Roy","Probir Roy","Seeking Supersymmetry at LEP","Latex, 12 pages, contains four figures, written version of invited
  talk given at the Workshop WHEPP 4 (S.N. Bose National Centre for Basic
  Sciences, Calcutta, India, Jan 2-16, 1996), to appear in proceedings to be
  printed by Allied Publishers. This version replaces the previous one where
  some figures were misplaced",,,"TIFR/TH/96-23","hep-ph",,"  1. Scope and motivation
  2. Lightning review of CMSSM
  3. LEP 1 bounds and LEP 1.5 results
  4. LEP 2 futurology
  5. Bottomline
","[{""version"":""v1"",""created"":""Fri, 17 May 1996 16:36:15 GMT""},{""version"":""v2"",""created"":""Wed, 22 May 1996 11:52:20 GMT""}]","2008-02-03"
"hep-ph/9605342",,"R.Casalbuoni, A. Deandrea, N.Di Bartolomeo, F.Feruglio, R.Gatto and G.
  Nardulli","Phenomenology of Heavy Meson Chiral Lagrangians","92 pages, LaTeX, 17 figures, to appear in Physics Reports, page size
  shortened to fit american format","Phys.Rept.281:145-238,1997","10.1016/S0370-1573(96)00027-0","UGVA-DPT 1996/05-928, BARI-TH/96-237","hep-ph nucl-th",,"  The approximate symmetries of Quantum ChromoDynamics in the infinite heavy
quark ($Q=c,b$) mass limit ($m_Q \to \infty$) and in the chiral limit for the
light quarks ($m_q \to 0,\;q=\,u,\,d,\,s$) can be used together to build up an
effective chiral lagrangian for heavy and light mesons describing strong
interactions among effective meson fields as well as their couplings to
electromagnetic and weak currents, including the relevant symmetry breaking
terms. The effective theory includes heavy ($Q \bar q$) mesons of both negative
and positive parity, light pseudoscalars, as well as light vector mesons. We
summarize the estimates for the parameters entering the effective lagrangian
and discuss in particular some phenomenologically important couplings, such as
$g_{B^* B \pi}$. The hyperfine splitting of heavy mesons is discussed in
detail. The effective lagrangian allows for the possibility to describe
consistently weak couplings of heavy ($B,\, D$) to light ($\pi,\, \rho, \,
K^*,\,$ etc.) mesons. The method has however its own limitations, due to the
requirement that the light meson momenta should be small, and we discuss how
such limitations can be circumvented through reasonable ansatz on the form
factors. Flavour conserving (e. g. $B^* \to B\, \gamma$) and flavour changing
(e. g. $B \to K^* \, \gamma$) radiative decays provide another field of
applications of effective lagrangians; they are discussed together with their
phenomenological implications. Finally we analyze effective lagrangians
describing heavy charmonium- like ($\bar Q Q$) mesons and their strong and
electromagnetic interactions. The role of approximate heavy quark symmetries
for this case and the phenomenological tests of these models are also
discussed.
","[{""version"":""v1"",""created"":""Fri, 17 May 1996 17:32:36 GMT""},{""version"":""v2"",""created"":""Tue, 21 May 1996 07:16:39 GMT""}]","2011-05-05"
"hep-ph/9605343","Omar Miranda Romagnoli","R. Huerta, M. Maya and O. G. Miranda","The Number of Neutrinos and the Left-Right Symmetric Model","11 pages, 3 figures","Z.Phys. C73 (1997) 701-704",,"CINVESTAV-FIS-06/96","hep-ph",,"  The meaning of $N_\nu$ in the Left-Right Symmetric Model (LRSM) is discussed.
In its original definition $N_\nu$ is the number of neutrinos or generations of
leptons, so, in the Standard Model its value is three. However the
determination of $N_\nu$ in experiments and in astrophysical observations is
subject to different theoretical interpretations. We present arguments that
gives $N_\nu$ as a parameter of the LRSM. Using an experimental value for the
rate $Gamma_{inv}/Gamma_{l\bar{l}}$ we calculate the bound $2.90\leq
N_{\nu_LR}\leq 3.04$ (90 % C. L.), where $N_{\nu_LR}$ is a function of the
left-right mixing angle $\phi$. This range is less restrictive than the one of
the standard model.
","[{""version"":""v1"",""created"":""Fri, 17 May 1996 16:56:04 GMT""}]","2007-05-23"
"hep-ph/9605344","Gabriel Lopez Castro","J. L. Diaz-Cruz, G. Lopez Castro and J. H. Munoz","Isospin corrections to charmless semileptonic $B \to V$ transitions","Latex, 8 pages, no figures","Phys.Rev.D54:2388-2390,1996","10.1103/PhysRevD.54.2388","CINVESTAV-FIS-01/96","hep-ph",,"  We compute isospin corrections to the charmless semileptonic $B \rightarrow
V$ transitions arising from $\rho-\omega$ mixing and discuss its relevance in
the determination of $V_{ub}$.
","[{""version"":""v1"",""created"":""Fri, 17 May 1996 18:14:31 GMT""}]","2010-11-23"
"hep-ph/9605345","David Atwood","David Atwood (CEBAF), Shaouly Bar-Shalom (Technion), Gad Eilam
  (Technion) and Amarjit Soni (BNL)","CP Nonconservation in $p\bar p\to t\bar b X$ at the Tevatron","14 pages, 3 figures. Note: replaced due to minor problems that
  appeared on some postscript previewers. No change in content","Phys.Rev.D54:5412-5416,1996","10.1103/PhysRevD.54.5412","CEBAF-TH-96-04; TECHNION-PH-96-11","hep-ph",,"  The reaction $p\bar p\to t\bar bX$ is found to be rather rich in exhibiting
several different types of CP asymmetries. The spin of the top quark plays an
important role. Asymmetries are related to form factors arising from radiative
corrections of the $tbW$ production vertex due to non-standard physics. As
illustrations, effects are studied in two Higgs Doublet Models and in
Supersymmetric Models; asymmetries up to a few percent may be possible.
","[{""version"":""v1"",""created"":""Fri, 17 May 1996 19:38:14 GMT""},{""version"":""v2"",""created"":""Tue, 21 May 1996 22:05:11 GMT""}]","2009-12-30"
"hep-ph/9605346","Joao Filipe","Joao A. N. Filipe (1,2) and Alan J. Bray (1) ((1) University of
  Manchester, (2) University of Edinburgh)","Phase ordering dynamics of cosmological models","26 pages(LaTeX), 7 figures(1 PS file)","Phys.Rev. E50 (1994) 2523-2537","10.1103/PhysRevE.50.2523",,"hep-ph astro-ph cond-mat",,"  The ordering dynamics of the Higgs field is studied, using techniques
inspired by the study of phase ordering in condensed matter physics, as a first
step to understanding the evolution of cosmic structure through the formation
of topological defects in the early universe. The common feature of these
different physical processes is scaling. A fully analytical approximate scheme
-- the linear-gaussian approach -- is proposed to evaluate 1-point, 2-point,
etc.\ scaling functions for the ordering dynamics of the $O(n)$-symmetric
Higgs-field models.
","[{""version"":""v1"",""created"":""Fri, 17 May 1996 18:56:12 GMT""}]","2009-10-28"
"hep-ph/9605347","Felice Pisano","F. Pisano (IFT - S.Paulo - Brazil), J.A. Silva-Sobrinho (IFT -S.Paulo
  - Brazil) and M.D. Tonasse (UERJ - Rio de Janeiro - Brazil)","Neutrinos and Electromagnetic Gauge Invariance","10 pages, Revtex 3.0, no figures","Phys.Lett. B388 (1996) 338-345","10.1016/S0370-2693(96)01250-6","IFT-P.005/96","hep-ph",,"  It is discussed a recently proposed connection among U(1)$_{\rm em}$
electromagnetic gauge invariance and the nature of the neutrino mass terms in
the framework of $\mbox {SU(3)}_C\otimes G_W \otimes {\mbox U(1)}_N$, $G_W$ =
SU(3)$_L$, extensions of the Standard Model. The impossibility of that
connection, also in the extended case $G_W $ = SU(4)$_L$, is demonstrated.
","[{""version"":""v1"",""created"":""Fri, 17 May 1996 20:12:58 GMT""}]","2009-10-28"
"hep-ph/9605348","Per Osland","A. I. Davydychev, P. Osland (Bergen), O. V. Tarasov (Bielefeld,
  NORDITA)","Three-gluon vertex in arbitrary gauge and dimension","41 pages, LaTex, plus 3 figures in separate file. Misprints (signs)
  in eqs.(4.26), (C.2), (C.4), (C.5) are corrected. To appear in Phys. Rev. D","Phys.Rev.D54:4087-4113,1996; Erratum-ibid.D59:109901,1999","10.1103/PhysRevD.54.4087 10.1103/PhysRevD.59.109901","Bergen Scientific/Technical Report No. 1995-16","hep-ph hep-lat hep-th",,"  One-loop off-shell contributions to the three-gluon vertex are calculated, in
arbitrary covariant gauge and in arbitrary space-time dimension, including
quark-loop contributions (with massless quarks). It is shown how one can get
the results for all on-shell limits of interest directly from the general
off-shell expression. The corresponding general expressions for the one-loop
ghost-gluon vertex are also obtained. They allow for a check of consistency
with the Ward--Slavnov--Taylor identity.
","[{""version"":""v1"",""created"":""Sat, 18 May 1996 09:51:47 GMT""},{""version"":""v2"",""created"":""Tue, 21 May 1996 17:07:04 GMT""},{""version"":""v3"",""created"":""Thu, 8 Aug 1996 12:10:19 GMT""}]","2014-11-17"
"hep-th/9605120",,"Zhang Xiaofei(ihep, Beijing) Li Jiarong","Non-Abelian Kubo Formula and the Multiple Time-Scale Method","18 pages, latex , to be pblished in Ann. Phys.(N,Y)(1996)","Annals Phys. 250 (1996) 433-447","10.1006/aphy.1996.0100",,"hep-th",,"  The non-Abelian Kubo formula is derived from the kinetic theory. That
expression is compared with the one obtained using the eikonal for a
Chern-Simons theory. The multiple time-scale method is used to solve the
non-Abelian Kubo formula, and the damping rate for longitudinal color waves is
computed.
","[{""version"":""v1"",""created"":""Fri, 17 May 1996 22:43:50 GMT""}]","2015-06-26"
