"hep-th/9605126","Jens Ole Madsen","J. M. Evans (DAMTP, University of Cambridge), J. O. Madsen (ENSLAPP,
  Annecy)","Real Forms of Non-abelian Toda Theories and their W-algebras","11 pages, LaTex; minor errors corrected, extra references added","Phys.Lett. B384 (1996) 131-139","10.1016/0370-2693(96)00788-5","DAMTP/96-49, ENSLAPP-A-592/96","hep-th",,"  We consider real forms of Lie algebras and embeddings of sl(2) which are
consistent with the construction of integrable models via Hamiltonian
reduction. In other words: we examine possible non-standard reality conditions
for non-abelian Toda theories. We point out in particular that the usual
restriction to the maximally non-compact form of the algebra is unnecessary,
and we show how relaxing this condition can lead to new real forms of the
resulting W-algebras. Previous results for abelian Toda theories are recovered
as special cases. The construction can be extended straightforwardly to deal
with osp(1|2) embeddings in Lie superalgebras. Two examples are worked out in
detail, one based on a bosonic Lie algebra, the other based on a Lie
superalgebra leading to an action which realizes the N=4 superconformal
algebra.
","[{""version"":""v1"",""created"":""Fri, 17 May 1996 17:35:25 GMT""},{""version"":""v2"",""created"":""Mon, 22 Jul 1996 16:17:41 GMT""}]","2009-10-30"
"hep-th/9605127","Andrea Cappelli","Andrea Cappelli and Guillermo R. Zemba","Modular Invariant Partition Functions in the Quantum Hall Effect","Latex, 38 pages, 1 table (one minor error has been corrected)","Nucl.Phys. B490 (1997) 595-632","10.1016/S0550-3213(97)00110-7","preprint DFF 249/5/96","hep-th cond-mat",,"  We study the partition function for the low-energy edge excitations of the
incompressible electron fluid. On an annular geometry, these excitations have
opposite chiralities on the two edges; thus, the partition function takes the
standard form of rational conformal field theories. In particular, it is
invariant under modular transformations of the toroidal geometry made by the
angular variable and the compact Euclidean time. The Jain series of plateaus
have been described by two types of edge theories: the minimal models of the
W-infinity algebra of quantum area-preserving diffeomorphisms, and their
non-minimal version, the theories with U(1)xSU(m) affine algebra. We find
modular invariant partition functions for the latter models. Moreover, we
relate the Wen topological order to the modular transformations and the
Verlinde fusion algebra. We find new, non-diagonal modular invariants which
describe edge theories with extended symmetry algebra; their Hall
conductivities match the experimental values beyond the Jain series.
","[{""version"":""v1"",""created"":""Fri, 17 May 1996 17:33:24 GMT""},{""version"":""v2"",""created"":""Thu, 30 May 1996 09:24:08 GMT""}]","2009-10-30"
"hep-th/9605128","Thomas Thiemann","Abhay Ashtekar, Jurek Lewandowski, Donald Marolf, Jos\'e Mour\~ao,
  Thomas Thiemann","Closed formula for Wilson loops for $SU(N)$ Quantum Yang-Mills Theory in
  two dimensions","31 pages, Latex, no figures","J.Math.Phys. 38 (1997) 5453-5482","10.1063/1.532146","HUTMP-96/B-351, CGPG-94/4-2","hep-th",,"  A closed expression of the Euclidean Wilson-loop functionals is derived for
pure Yang-Mills continuum theories with gauge groups $SU(N)$ and $U(1)$ and
space-time topologies $\Rl^1\times\Rl^1$ and $\Rl^1\times S^1$. (For the $U(1)$
theory, we also consider the $S^1\times S^1$ topology.) The treatment is
rigorous, manifestly gauge invariant, manifestly invariant under area
preserving diffeomorphisms and handles all (piecewise analytic) loops in one
stroke. Equivalence between the resulting Euclidean theory and and the
Hamiltonian framework is then established. Finally, an extension of the
Osterwalder-Schrader axioms for gauge theories is proposed. These axioms are
satisfied for the present model.
","[{""version"":""v1"",""created"":""Sat, 18 May 1996 00:18:03 GMT""}]","2009-10-30"
"hep-th/9605129","Thomas Ackermann","Thomas Ackermann","Dirac Operators and Clifford Geometry - New Unifying Principles in
  Particle Physics ?","8 pages, plain tex, Lecture at the IV th Conference on Clifford
  Algebras and their Applications in Mathematical Physics, Aachen, Germany, May
  28 - 31, 1996, some misprints in corollary 4 and (16) corrected",,,,"hep-th",,"  In this lecture I will report on some recent progress in understanding the
relation of Dirac operators on Clifford modules over an even-dimensional closed
Riemannian manifold $M$\ and (euclidean) Einstein-Yang-Mills-Higgs models.
","[{""version"":""v1"",""created"":""Sat, 18 May 1996 06:21:25 GMT""},{""version"":""v2"",""created"":""Mon, 20 May 1996 15:26:20 GMT""},{""version"":""v3"",""created"":""Thu, 23 May 1996 17:04:37 GMT""}]","2008-02-03"
"hep-th/9605130","Shao-Ming Fei","Sergio Albeverio, Shao-Ming Fei","Symmetry, Integrable Chain Models and Stochastic Processes","34 pages, Latex","Rev.Math.Phys. 10 (1998) 723-750",,,"hep-th cond-mat math.QA nlin.SI q-alg solv-int",,"  A general way to construct chain models with certain Lie algebraic or quantum
Lie algebraic symmetries is presented. These symmetric models give rise to
series of integrable systems. As an example the chain models with $A_n$
symmetry and the related Temperley-Lieb algebraic structures and
representations are discussed. It is shown that corresponding to these $A_n$
symmetric integrable chain models there are exactly solvable stationary
discrete-time (resp. continuous-time) Markov chains whose spectra of the
transition matrices (resp. intensity matrices) are the same as the ones of the
corresponding integrable models.
","[{""version"":""v1"",""created"":""Sat, 18 May 1996 10:49:40 GMT""}]","2008-02-03"
"math/9605206",,"Vladimir Shpilrain","Fixed points of endomorphisms of a free metabelian group","LaTex file, 11 pages",,,"MAGNUS preprint #96-05-17A","math.GR",,"  We consider IA-endomorphisms (i.e., Identical in Abelianization) of a free
metabelian group of finite rank, and give a matrix characterization of their
fixed points which is similar to (yet different from) the well-known
characterization of eigenvectors of a linear operator in a vector space. We
then use our matrix characterization to elaborate several properties of the
fixed point groups of metabelian endomorphisms. In particular, we show that the
rank of the fixed point group of an IA-endomorphism of the free metabelian
group of rank $n \ge 2$ can be either equal to 0, 1, or greater than $(n-1)$
(in particular, it can be infinite). We also point out a connection between
these properties of metabelian IA-endomorphisms and some properties of the
Gassner representation of pure braid groups.
","[{""version"":""v1"",""created"":""Fri, 17 May 1996 16:11:36 GMT""}]","2008-02-03"
"math/9605207",,"Vladimir Shpilrain","Generalized primitive elements of a free group","LaTex file, 9 pages",,,"MAGNUS preprint #96-05-17B","math.GR",,"  We study endomorphisms of a free group of finite rank by means of their
action on specific sets of elements. In particular, we prove that every
endomorphism of the free group of rank 2 which preserves an automorphic orbit
(i.e., acts ``like an automorphism"" on one particular orbit), is itself an
automorphism. Then, we consider elements of a different nature, defined by
means of homological properties of the corresponding one-relator group. These
elements (``generalized primitive elements""), interesting in their own right,
can also be used for distinguishing automorphisms among arbitrary
endomorphisms.
","[{""version"":""v1"",""created"":""Fri, 17 May 1996 21:52:05 GMT""}]","2008-02-03"
"nucl-th/9605025",,"E.L. Bratkovskaya, W. Cassing and U. Mosel (Giessen Univ.)","Probing Hadronic Polarizations with Dilepton Anisotropies","16 pages, LaTeX, plus 7 postscript figures tarred, compressed and
  uuencoded in separate file","Z.Phys. C75 (1997) 119-126",,"UGI-96-11, submitted to Z. Phys. C","nucl-th",,"  We investigate the production of $e^+e^-$ pairs from $p + Be$ and
nucleus-nucleus collisions from 2 GeV/A to 200 GeV/A within a covariant
transport approach and focus on the dilepton angular anisotropies as a function
of the dilepton invariant mass. Whereas the low mass regime yields information
about the Dalitz decays of the $\Delta, \eta$ and $\omega$, above M $\approx
$0.5 GeV the angular anisotropies provide additional information about the
$\pi^+\pi^- \to \rho^0 \to e^+e^-$ channel in the medium. The anisotropy
coefficient is found to change its sign for M $>$ 0.5 GeV in case of
nucleus-nucleus reactions when increasing the bombarding energy from 2 GeV/A to
200 GeV/A which sheds some light on the $\pi \pi \to \rho$ dynamics.
","[{""version"":""v1"",""created"":""Fri, 17 May 1996 17:44:07 GMT""}]","2007-05-23"
"nucl-th/9605026",,"Bao-An Li, Wolfgang Bauer and Che Ming Ko","Pion Transparency in 500 MeV C(pi,pi') Reactions?","Latex file, 11 pages, 3 figures availabe upon request. Phys. Lett. B
  in press","Phys.Lett. B382 (1996) 337-342","10.1016/0370-2693(96)00644-2",,"nucl-th nucl-ex",,"  The question whether there is a pion transparency in 500 MeV $C(\pi,
\pi^{'})$ scatterings is studied using a semiclassical, hadronic transport
model. The double differential cross sections of this reaction measured at
LAMPF can be largely accounted for, if one uses energy-dependent, anisotropic
angular distributions which are fitted to pion-nucleon scattering data for the
decay of $\Delta(1232)$ and $N^*(1440)$ resonances. The remaining discrepancy
between the data and the calculation sets a limit on effects of more exotic
processes.
","[{""version"":""v1"",""created"":""Fri, 17 May 1996 19:24:39 GMT""}]","2015-06-26"
"nucl-th/9605027",,"C.J. Burden, Lu Qian, C.D. Roberts, P.C. Tandy, M.J. Thomson","Ground-state Spectrum of Light-quark Mesons","30 pages, LaTeX/REVTEX 3.0, no figures","Phys.Rev.C55:2649-2664,1997","10.1103/PhysRevC.55.2649","ANL-PHY-8421-TH-96 and KSUCNR-03-96","nucl-th hep-ph",,"  A confining, Goldstone theorem preserving, separable Ansatz for the ladder
kernel of the two-body Bethe-Salpeter equation is constructed from
phenomenologically efficacious $u$, $d$ and $s$ dressed-quark propagators. The
simplicity of the approach is its merit. It provides a good description of the
ground-state isovector-pseudoscalar, vector and axial-vector meson spectrum;
facilitates an exploration of the relative importance of various components of
the two-body Bethe-Salpeter amplitudes, showing that sub-leading Dirac
components are quantitatively important in the isovector-pseudoscalar meson
channels; and allows a scrutiny of the domain of applicability of ladder
truncation studies. A colour-antitriplet diquark spectrum is obtained.
Shortcomings of separable Ans\""atze and the ladder kernel are highlighted.
","[{""version"":""v1"",""created"":""Fri, 17 May 1996 21:37:24 GMT""}]","2008-11-26"
"q-alg/9605028","Arkady Vaintrob","Arkady Vaintrob (University of Utah)","Melvin-Morton conjecture and primitive Feynman diagrams","17 pages, LaTeX 2.09 with bezier.sty",,,,"q-alg math.QA",,"  We give a very short proof of the Melvin-Morton conjecture relating the
colored Jones polynomial and the Alexander polynomial of knots. The proof is
based on the explicit evaluation of the corresponding weight systems on
primitive elements of the Hopf algebra of chord diagrams which, in turn,
follows from simple identities between four-valent tensors on the Lie algebra
$sl_2$ and the Lie superalgebra $gl(1|1)$. This shows that the miraculous
connection between the Jones and Alexander invariants follows from the
similarity (supersymmetry) between $sl_2$ and $gl(1|1)$.
","[{""version"":""v1"",""created"":""Fri, 17 May 1996 19:06:57 GMT""}]","2008-02-03"
