"nucl-th/9606011","Kai Hencken","Adrian Alscher, Kai Hencken, Dirk Trautmann, and Gerhard Baur","Multiple electromagnetic electron positron pair production in
  relativistic heavy ion collisions","13 pages REVTeX, 4 Postscript figures, This and related papers may
  also be obtained from http://www.phys.washington.edu/~hencken/","Phys.Rev. A55 (1997) 396-401","10.1103/PhysRevA.55.396","DOE/ER/40561-264-INT96-00-126","nucl-th",,"  We calculate the cross sections for the production of one and more
electron-positron pairs due to the strong electromagnetic fields in
relativistic heavy ion collisions. Using the generating functional of fermions
in an external field we derive the N-pair amplitude. Neglecting the
antisymmetrisation in the final state we find that the total probability to
produce N pairs is a Poisson distribution. We calculate total cross sections
for the production of one pair in lowest order and also include higher-order
corrections from the Poisson distribution up to third order. Furthermore we
calculate cross sections for the production of up to five pairs including
corrections from the Poisson distribution.
","[{""version"":""v1"",""created"":""Thu, 6 Jun 1996 21:14:04 GMT""}]","2009-10-30"
"nucl-th/9606012","Alexander Motovilov","V.B.Belyaev and A.K.Motovilov (JINR, Dubna)","Perturbation of Embedded Eigenvalue by a Near-Lying Resonance","24 pages, 80 kB, REVTEX; Submitted to Teoreticheskaya i
  Matematicheskaya Fizika; Acknowledgments were corrected","Theor. Math. Phys. 111 (1997) 454-466; Teor. Mat. Fiz. 111:1
  (1997) 77-93","10.1007/BF02634200","JINR E4-96-201","nucl-th chem-ph quant-ph",,"  The case of quantum-mechanical system (including electronic molecules) is
considered where Hamiltonian allows a separation, in particular by the Faddeev
method, of a weakly coupled channel. Width (i.e. the imaginary part) of the
resonance generated by a discrete spectrum eigenvalue of the separated channel
is studied in the case where main part of the Hamiltonian gives itself another
resonance. It is shown that if real parts of these resonances coincide and, at
the same time, a coupling between the separated and main channels is
sufficiently small then the width of the resonance generated by the separated
(molecular) channel is inversely proportional to the width of the main
(nuclear) channel resonance. This phenomenon being a kind of universal law, may
play an important role increasing the ``cold fusion'' probability in electronic
molecules whose nuclear constituents have narrow pre-threshold resonances.
","[{""version"":""v1"",""created"":""Fri, 7 Jun 1996 07:59:52 GMT""},{""version"":""v2"",""created"":""Tue, 11 Jun 1996 09:47:58 GMT""}]","2008-02-03"
"nucl-th/9606013","Christian Fuchs","J. Zipprich, C. Fuchs, E. Lehmann, L. Sehn, S.W. Huang and Amand
  Faessler","Influence of the pion-nucleon interaction on the collective pion flow in
  heavy ion reactions","12 pages Latex, 4 PS-figures","J.Phys. G23 (1997) L1","10.1088/0954-3899/23/1/001",,"nucl-th",,"  We investigate the influence of the real part of the in-medium pion optical
potential on the pion dynamics in intermediate energy heavy ion reactions at 1
GeV/A. For different models, i.e. a phenomenological model and the
$\Delta$--hole model, a pionic potential is extracted from the dispersion
relation and used in Quantum Molecular Dynamics calculations. In addition with
the inelastic scattering processes we thus take care of both, real and
imaginary part of the pion optical potential. A strong influence of the real
pionic potential on the pion in-plane flow is observed. In general such a
potential has the tendency to reduce the anticorrelation of pion and nucleon
flow in non-central collisions.
","[{""version"":""v1"",""created"":""Fri, 7 Jun 1996 09:14:22 GMT""}]","2009-10-30"
"nucl-th/9606014","Manuel Malheiro","M. Malheiro (Department of Physics, University of Maryland at College
  Park, USA), A. Delfino (UFF-Universidade Federal Fluminense, Brasil), and C.
  T. Coelho (UFF-Universidade Federal Fluminense, Brasil)","Phase Transition in Warm Nuclear Matter with Alternative Derivative
  Coupling Models","10 pages latex file, 2 tables and 7 Postscript figures","Phys.Rev.C58:426-433,1998","10.1103/PhysRevC.58.426",,"nucl-th",,"  An analysis is performed of the liquid-gas phase transition of nuclear matter
obtained from different versions of scalar derivate coupling suggested by
Zimanyi and Moszkowski (ZM) and the results are compared with those obtained
from the Walecka model. We present the phase diagram for the models and one of
them, the ZM3 model, has the lowest critical temperature $T_c=13.6$ MeV with
the lowest critical density $\rho_c=0.037$ f$m^{-3}$ and pressure $p_c=0.157$
MeV f$m^{-3}$.
  These results are in accord with recent observations from energetic heavy-ion
collisions, which suggest a small liquid-gas phase region.
","[{""version"":""v1"",""created"":""Fri, 7 Jun 1996 12:26:17 GMT""}]","2016-09-08"
"patt-sol/9606001","Yuki Sugiyama","Y. Sugiyama (City College of Mie, Japan), H. Yamada (Nagoya
  University,Japan)","The Exactly Solvable Simplest Model for Queue Dynamics","10 pages (LaTeX), 5 figures (eps-files)",,,"DPNU-96-31","patt-sol nlin.PS",,"  We present an exactly solvable model for queue dynamics. Our model is very
simple but provides the essential property for such dynamics. As an example,
the model has the traveling cluster solution as well as the homogeneous flow
solution. The model is the limiting case of Optimal Velocity (OV) model, which
is proposed for the car following model to induce traffic jam spontaneously.
","[{""version"":""v1"",""created"":""Fri, 7 Jun 1996 07:57:45 GMT""}]","2008-02-03"
"q-alg/9606008",,"Alexander Molev","Factorial supersymmetric Schur functions and super Capelli identities","AMS-Tex, 40 pages",,,"Australian National University preprint CMA 001-96","q-alg math.QA",,"  A factorial analogue of the supersymmetric Schur functions is introduced. It
is shown that factorial versions of the Jacobi--Trudi and Sergeev--Pragacz
formulae hold. The results are applied to construct a linear basis in the
center of the universal enveloping algebra for the Lie superalgebra gl(m|n) and
to obtain super-analogues of the higher Capelli identities.
","[{""version"":""v1"",""created"":""Fri, 7 Jun 1996 02:56:26 GMT""}]","2008-02-03"
"quant-ph/9606007","dr. W. M. de Muynck","Willem M. de Muynck (Eindhoven University of Technology)","Wigner Distributions and the Joint Measurement of Incompatible
  Observables","8 pages, latex, 3 figures",,,,"quant-ph",,"  A theory of joint nonideal measurement of incompatible observables is used in
order to assess the relative merits of quantum tomography and certain
measurements of generalized observables, with respect to completeness of the
obtained information. A method is studied for calculating a Wigner distribution
from the joint probability distribution obtained in a joint measurement.
","[{""version"":""v1"",""created"":""Fri, 7 Jun 1996 14:01:07 GMT""}]","2007-05-23"
