"cond-mat/9606048","Lian Zheng","Lian Zheng and S. Das Sarma (Univ. of Maryland)","Comment on ``Energy Dependence of Electron Lifetime in Graphite Observed
  with Femtosecond Photoemission Spectroscopy'' (PRL 76, 483(1996).)","4 pages, RevTex, no figures. Also available at
  http://www-cmg.physics.umd.edu/~lzheng/ . Phys. Rev. Lett. (to appear)",,"10.1103/PhysRevLett.77.1410",,"cond-mat",,"  We comment on the theoretical interpretations applied to a recent experiment
on electron lifetime in graphite. We point out that the acoustic-plasmon
excitations in a layered two-dimensional electron system do not produce a
linear energy dependence for the Coulomb scattering rate.
","[{""version"":""v1"",""created"":""Fri, 7 Jun 1996 15:26:40 GMT""}]","2009-10-28"
"gr-qc/9606012","Osamu Iguchi","O.Iguchi, H.Ishihara, J.Soda","Inhomogeneity of Spatial Curvature for Inflation","17 pages, revtex, 6 figures included using epsf","Phys.Rev.D55:3337-3345,1997","10.1103/PhysRevD.55.3337","TIT/HEP-324/COSMO-69, KUCP/U-0098","gr-qc",,"  We study how the initial inhomogeneities of the spatial curvature affect the
onset of inflation in the closed universe. We consider a cosmological model
which contains a radiation and a cosmological constant. In order to treat the
inhomogeneities in the closed universe, we improve the long wavelength
approximation such that the non-small spatial curvature is tractable in the
lowest order. Using the improved scheme, we show how large inhomogeneities of
the spatial curvature prevent the occurrence of inflation.
","[{""version"":""v1"",""created"":""Fri, 7 Jun 1996 14:25:11 GMT""}]","2011-07-19"
"gr-qc/9606014","Galtsov Dmitzi","D.V. Gal'tsov and O.V. Kechkin","Hidden Symmerties in Dilaton--Axion Gravity","Talk at the Dubna Workshop ``Geometry and Integrable models'', JINR,
  Dubna, (Russia), October 1994 , published in the Proceedings, ``Geometry and
  Integrable models'', P.N. Pyatov and S.N. Solodukhin (Eds.), World
  Scientific, 1996",,,"DTP MSU 95/26","gr-qc hep-th",,"  Four--dimensional Einstein--Maxwell--dilaton--axion system restricted to
space--times with one non--null Killing symmetry is formulated as the
three--dimensional gravity coupled sigma--model. Several alternative
representations are discussed and the associated hidden symmetries are
revealed. The action of target space isometries on the initial set of
(non--dualized ) variables is found. New mulicenter solutions are obtained via
generating technique based on the formulation in terms of the non--dualized
variables.
","[{""version"":""v1"",""created"":""Fri, 7 Jun 1996 06:49:14 GMT""}]","2007-05-23"
"hep-ph/9606256","Mauricio Bernardino Magro","A. Bartl, W. Porod, M. A. Garcia-Jareno, M. B. Magro, J. W. F. Valle
  and W. Majerotto","New Signatures for a Light Stop at LEP2 in SUSY Models with
  Spontaneously Broken R-Parity","uudecoded latex file, 12 pages with 3 figures included. The complete
  uudecoded ps paper is also available via anonymous ftp at
  ftp://neutrinos.uv.es/pub/papers/ps/stop1.uu","Phys.Lett.B384:151-156,1996","10.1016/0370-2693(96)00816-7","FTUV/96-29, IFIC/96-33, HEPHY-PUB 647/96, UWThPh-1996-36","hep-ph",,"  In a class of supersymmetric models with R-parity breaking the lightest stop
can have new decay modes into third generation fermions, $\tilde{t}_1
\rightarrow b + \tau$. We show that this decay may be dominant or at least
comparable to the ordinary R-parity conserving mode $\tilde{t}_1 \rightarrow c
+ \tilde{\chi}_1^0$, where $\tilde{\chi}_1^0$ denotes the lightest neutralino.
The new R-parity violating decay mode could provide new signatures for stop
production at LEP.
","[{""version"":""v1"",""created"":""Thu, 6 Jun 1996 17:41:07 GMT""},{""version"":""v2"",""created"":""Fri, 7 Jun 1996 10:00:32 GMT""}]","2009-09-17"
"hep-ph/9606257","Sinisa Veseli","S. Veseli and M. G. Olsson","Sum rules, Regge trajectories, and relativistic quark models","Latex (uses epsf macro), 17 pages of text, 2 postscript figures
  included. To appear in Phys. Lett. B","Phys.Lett. B383 (1996) 109-115","10.1016/0370-2693(96)00721-6","MADPH-96-938","hep-ph",,"  We present an analysis which uses Regge structure and the Bjorken and
Voloshin HQET sum rules to restrict the choice of parameters of a relativistic
quark model.
","[{""version"":""v1"",""created"":""Thu, 6 Jun 1996 17:50:43 GMT""}]","2009-10-28"
"hep-ph/9606258","Valentin Kuznetsov","Vladimir M. Dubovik and Valentin E. Kuznetsov (JINR, Dubna, Russia)","The Toroid Moment of Majorana Neutrino","22 pages, 1 table and 3 EPS-figures included, uses prd.sty,
  preprint.sty, aps.sty and epsfig.sty (RevTeX is used), major conceptual
  changes of E2-96-53 are included","Int.J.Mod.Phys.A13:5257-5278,1998","10.1142/S0217751X98002419","E2-96-53","hep-ph",,"  If neutrino is the Majorana particle it can possess only one electromagnetic
characteristic, the toroid dipole moment (anapole) in the static limit and
nothing else. We have calculated the diagonal toroid moment (form factor) of
the Majorana neutrino by the dispersion method in the one-loop approximation of
the Standard Model and found it to be different from zero in the case of
massive as well as massless neutrinos. All external particles are on the mass
shells and there are no problems with the physical interpretation of the final
result. Some manifestations of the toroid interactions of Majorana neutrinos,
induced by their toroid moments, are also remarked.
","[{""version"":""v1"",""created"":""Thu, 6 Jun 1996 19:32:34 GMT""}]","2014-11-17"
"hep-ph/9606259","He Xiao-Gang","N.G. Deshpande, Xiao-Gang He, and Sandip Pakvasa","Single Isospin Decay Amplitude and CP Violation","16 pages include four figures. Revtex",,,"OITS-604, UH-511-851-96","hep-ph",,"  We study partial rate asymmetry in decays with single isospin final state.
For K meson or hyperon decays, the partial rate asymmetries are always zero if
the final states are single isospin states. In B decays the situation is
dramatically different and partial rate asymmetries can be non-zero even if the
final states are single isospin states. We calculated partial rate asymmetries
for several B decays with single isospin amplitude in the final states using
factorization approximation. We find that in some cases the asymmetries can be
large.
","[{""version"":""v1"",""created"":""Thu, 6 Jun 1996 23:04:19 GMT""}]","2007-05-23"
"hep-ph/9606260","Andrei Linde","Edward W. Kolb, Andrei Linde, and Antonio Riotto","GUT Baryogenesis after Preheating","4 pages, version to be published in Phys. Rev. Lett","Phys.Rev.Lett.77:4290-4293,1996","10.1103/PhysRevLett.77.4290","SU-ITP-96-24","hep-ph astro-ph",,"  At the end of inflation the universe is frozen in a near zero-entropy state
with energy density in a coherent scalar field and must be ``defrosted'' to
produce the observed entropy and baryon number. We propose that the baryon
asymmetry is generated by the decay of supermassive Grand Unified Theory (GUT)
bosons produced non-thermally in a preheating phase after inflation. We show
that baryogenesis is possible for an inflaton masses of order 10^{13} GeV and a
GUT Higgs boson mass of order 10^{14} GeV, thus solving many drawbacks facing
GUT baryogenesis in the old reheating scenario.
","[{""version"":""v1"",""created"":""Fri, 7 Jun 1996 05:01:49 GMT""},{""version"":""v2"",""created"":""Thu, 24 Oct 1996 23:09:28 GMT""}]","2009-09-29"
"hep-ph/9606261","Bednyakov Vadim","V.A.Bednyakov, S.G.Kovalenko (Joint Institute for Nuclear Research)
  and H.V.Klapdor-Kleingrothaus, Y.Ramachers (Max-Planck-Institut fuer
  Kernphysik, Heidelberg)","Is SUSY accessible by direct dark matter detection?","21 pages, 4 Postscript figures","Z.Phys. A357 (1997) 339-347","10.1007/s002180050251","JINR preprint E2-96-198","hep-ph",,"  We performed a combined analysis of the parameter space of the Minimal
Supersymmetric Standard Model (MSSM) taking into account cosmological and
accelerator constraints including those from the radiative $b\rightarrow
s\gamma$ decay measured by the CLEO collaboration. Special attention is paid to
the event rate, $R$, of direct dark matter neutralino detection. We have found
domains of the parameter space with $R\simeq 5-10$~events/kg/day. This would be
within the reach of current dark matter experiments. The $b\rightarrow s\gamma$
data do not essentially reduce these large event rate domains of the MSSM
parameter space.
","[{""version"":""v1"",""created"":""Fri, 7 Jun 1996 07:17:18 GMT""}]","2009-10-28"
"hep-ph/9606262","Arnd Leike","A. Leike","Four fermion final states in $e^+e^-$ annihilation","10 pages latex, uses nuclphys.sty (included), 1 figure included by
  epsf.sty, invited talk held at ``QED and QCD at higher orders'', Rheinsberg,
  April 1996","Nucl.Phys.Proc.Suppl. 51C (1996) 71-80","10.1016/S0920-5632(96)90009-2","LMU 06/96","hep-ph",,"  The present status of calculations of four fermion final states is reviewed.
Higher order problems arising there are pointed out. Special attention is paid
to results obtained in the semi-analytical approach and their limitations and
perspectives.
","[{""version"":""v1"",""created"":""Fri, 7 Jun 1996 12:03:25 GMT""}]","2015-06-25"
"hep-ph/9606263","Krzywicki","J.-P. Blaizot and A. Krzywicki","DCC: Attractive Idea Seeks Serious Confirmation","18 pages LaTex, based on invited lecture given by A.Krzywicki at the
  workshop ""Quark, plasma and beyond"", Zif, Bielefeld, May 1996 ; a reference
  is corrected","Acta Phys.Polon. B27 (1996) 1687-1702",,"LPTHE Orsay 96/37","hep-ph",,"  The theoretical ideas relevant for the physics of the disoriented chiral
condensate (DCC) are reviewed.
","[{""version"":""v1"",""created"":""Fri, 7 Jun 1996 15:09:19 GMT""},{""version"":""v2"",""created"":""Fri, 5 Jul 1996 17:14:54 GMT""}]","2008-02-03"
"hep-ph/9606265","Daniel De Florian","D.de Florian, C.Garcia Canal, S.Joffily, R.Sassot","Kinematical Dependence of NLO Corrections to Semi-Inclusive Spin
  Dependent Observables","Latex, 5 pages, 5 figures in 5 ps files",,,,"hep-ph",,"  We analyse the phenomenological consequences of target and current
fragmentation contributions at next to leading order in semi-inclusive spin
dependent deep inelastic scattering asymmetries.
","[{""version"":""v1"",""created"":""Fri, 7 Jun 1996 14:56:45 GMT""}]","2007-05-23"
"hep-ph/9606267","Martin Maul","R. Kirschner, L. Mankiewicz, A. Sch\""afer, and L. Szymanowski","Small $x$ behaviour of the chirally-odd parton distribution $h_1(x,Q^2)$","16 pages latex","Z.Phys. C74 (1997) 501-508",,"UFTP 416 preprint/1996, NTZ 26/96, TUM/T39-96-16","hep-ph",,"  The small $x$ behaviour of the structure function $h_1(x,Q^2)$ is studied
within the leading logarithmic approximation of perturbative QCD. There are two
contributions relevant at small $x$. The leading one behaves like
$(\frac{1}{x})^0$ i.e. it is just a constant in this limit. The second
contribution, suppressed by one power of $x$, includes the terms summed by the
GLAP equation. Thus for $h_1(x,Q^2)$ the GLAP asymptotics and Regge asymptotics
are completely different, making $h_1(x,Q^2)$ quite an interesting quantity for
the study of small $x$ physics.
","[{""version"":""v1"",""created"":""Fri, 7 Jun 1996 15:19:30 GMT""}]","2007-05-23"
"hep-th/9606029","Mark DE WILD Propitius","Mark de Wild Propitius","Spontaneously broken abelian Chern-Simons theories","72+2 pages, LaTeX, 10 eps figures uuencoded. Postscript version also
  available at http://parthe.lpthe.jussieu.fr/~mdwp/","Nucl.Phys. B489 (1997) 297-359","10.1016/S0550-3213(97)00005-9","PAR-LPTHE 96-17 and ITFA 96-16","hep-th",,"  A detailed analysis of Chern-Simons (CS) theories in which a compact abelian
direct product gauge group U(1)^k is spontaneously broken down to a direct
product H of (finite) cyclic groups is presented. The spectrum features global
H charges, vortices carrying flux labeled by the elements of H and dyonic
combinations. Due to the Aharonov-Bohm effect these particles exhibit
toplogical interactions. The remnant of the U(1)^k CS term in the discrete H
gauge theory describing the effective long distance physics of such a model is
shown to be a 3-cocycle for H summarizing the nontrivial topological
interactions cast upon the magnetic vortices by the U(1)^k CS term. It is noted
that there are in general three types of 3-cocycles for a finite abelian gauge
group H: one type describes topological interactions among vortices carrying
flux w.r.t. the same cyclic group in the direct product H, another type gives
rise to topological interactions between vortices carrying flux w.r.t. two
different cyclic factors of H and a third type leading to topological
interactions between vortices carrying flux w.r.t. three different cyclic
factors. Among other things, it is demonstrated that only the first two types
can be obtained from a spontaneously broken U(1)^k CS theory. The 3-cocycles
that can not be reached in this way turn out to be the most interesting. They
render the theory nonabelian and in general lead to dualities with planar
theories with a nonabelian finite gauge group. In particular, the CS theory
with finite gauge group H = Z_2 x Z_2 x Z_2 defined by such a 3-cocycle is
shown to be dual to the planar discrete D_4 gauge theory with D_4 the dihedral
group of order 8.
","[{""version"":""v1"",""created"":""Thu, 6 Jun 1996 17:33:09 GMT""}]","2009-10-30"
"hep-th/9606032",,"C.R. Fernandez-Pousa, M.V. Gallas, T.J. Hollowood and J.L. Miramontes","The Symmetric Space and Homogeneous sine-Gordon Theories","22 pages, plain TeX","Nucl.Phys. B484 (1997) 609-630","10.1016/S0550-3213(96)00603-7","US-FT/24-96, SWAT/117","hep-th",,"  Two series of integrable theories are constructed which have soliton
solutions and can be thought of as generalizations of the sine-Gordon theory.
They exhibit internal symmetries and can be described as gauged WZW theories
with a potential term. The spectrum of massive states is determined.
","[{""version"":""v1"",""created"":""Thu, 6 Jun 1996 16:58:18 GMT""}]","2009-10-30"
"hep-th/9606033",,"M. Cvetic and A.A. Tseytlin","Non-extreme black holes from non-extreme intersecting M-branes","19 pages, latex (misprints corrected; remarks added in section 6)","Nucl.Phys.B478:181-198,1996","10.1016/0550-3213(96)00411-7","DAMTP/R/96/27, Imperial/TP/95-96/52","hep-th",,"  We present non-extreme generalisations of intersecting p-brane solutions of
eleven-dimensional supergravity which upon toroidal compactification reduce to
non-extreme static black holes in dimensions D=4, D=5 and 5<D<10, parameterized
by four, three and two charges, respectively. The D=4 black holes are obtained
either from non-extreme configuration of three intersecting five-branes with a
boost along the common string or from non-extreme intersecting system of two
two-branes and two five-branes. The D=5 black holes arise from three
intersecting two-branes or from a system of intersecting two-brane and
five-brane with a boost along the common string. Five-brane and two-brane with
a boost along one direction reduce to black holes in D=6 and D=9, respectively,
while D=7 black hole can be interpreted in terms of non-extreme configuration
of two intersecting two-branes. We discuss the expressions for the
corresponding masses and entropies.
","[{""version"":""v1"",""created"":""Thu, 6 Jun 1996 22:31:01 GMT""},{""version"":""v2"",""created"":""Sat, 13 Jul 1996 16:20:07 GMT""}]","2009-09-17"
"hep-th/9606034",,"M. Awada and F. Mansouri","Dimensionless Coupling of Superstrings to Supersymmetric Gauge Theories
  and Scale Invariant Superstring Actions","9 pages, LaTex","Phys.Lett. B387 (1996) 75-79","10.1016/0370-2693(96)00991-4","UCTP101-Feb/96","hep-th",,"  We construct new superstring actions which are distinguished from standard
superstrings by being space-time scale invariant. Like standard superstrings,
they are also reparametrization invariant, space-time supersymmetric, and
invariant under local scale transformations of the world sheet. We discuss
scenarios in which these actions could play a significant role, in particular
one which involves their coupling to supersymmetric gauge theories.
","[{""version"":""v1"",""created"":""Fri, 7 Jun 1996 05:03:31 GMT""}]","2009-10-30"
"hep-th/9606035","Ichiro Oda","Ichiro Oda","Black hole entropy from a single long string","9 pages, phyzzx",,,"EDO-EP-6","hep-th",,"  In this article we derive the Bekenstein-Hawking formula of black hole
entropy from a single string. We consider a open string in the Rindler metric
which can be obtained in the large mass limit from the Schwarzschild black hole
metric. By solving the field equations we find a nontrivial solution with the
exact value of the Hawking temperature. We see that this solution gives us the
Bekenstein-Hawking formula of black hole entropy to leading order of
approximation. This string has effectively a rescaled string tension having a
relation with a redshift factor. It is also pointed out that this formalism is
extensible to other black holes in an arbitrary spacetime dimension. The
present work might lead us to a surprising idea that the recent picture which
the black hole entropy arises from D-brane excitations has the root of the
picture that the black hole entropy is stocked in a single long string with a
rescaled string tension.
","[{""version"":""v1"",""created"":""Fri, 7 Jun 1996 06:21:33 GMT""}]","2007-05-23"
"hep-th/9606037",,"M. P. Fry","QED in inhomogeneous magnetic fields","20 pages, latex2e + amstex","Phys.Rev. D54 (1996) 6444-6452","10.1103/PhysRevD.54.6444",,"hep-th",,"  A lower bound is placed on the fermionic determinant of Euclidean quantum
electrodynamics in three dimensions in the presence of a smooth, finite--flux,
static, unidirectional magnetic field
$\mathbf{B}(\mathbf{r})=(0,0,B(\mathbf{r}))$, where $B(\mathbf{r})\geq 0$ or
$B(\mathbf{r})\leq 0$ and $\mathbf r$ is a point in the $xy\mbox{-plane}$.
Bounds are also obtained for the induced spin for $2+1$ dimensional QED in the
presence of $\mathbf{B}(\mathbf{r})$. An upper bound is placed on the fermionic
determinant of Euclidean QED in four dimensions in the presence of a strong,
static, directionally-varying, square-integrable magnetic field
$\mathbf{B}(\mathbf{r})$ on $\R^3 $.
","[{""version"":""v1"",""created"":""Fri, 7 Jun 1996 10:35:19 GMT""}]","2009-10-30"
"hep-th/9606039","Oren Bergman","Oren Bergman","Evidence for String Substructure","Latex file, 21 pages, 11 postscript figures",,,"UFIFT-HEP-96-13","hep-th",,"  We argue that the behavior of string theory at high temperature and high
longitudinal boosts, combined with the emergence of p-branes as necessary
ingredients in various string dualities, point to a possible reformulation of
strings, as well as p-branes, as composites of bits. We review the string-bit
models, and suggest generalizations to incorporate p-branes.
","[{""version"":""v1"",""created"":""Fri, 7 Jun 1996 15:41:11 GMT""}]","2007-05-23"
"hep-th/9606041","Galtsov Dmitzi","D.V. Gal'tsov","Geroch--Kinnersley--Chitre group for Dilaton--Axion Gravity","Published in ``Quantum Field Theory under the Influence of External
  Conditions'', M. Bordag (Ed.) (Proc. of the International Workshop, Leipzig,
  Germany, 18--22 September 1995), B.G. Teubner Verlagsgessellschaft,
  Stuttgart--Leipzig, 1996, pp. 228-237",,"10.1007/978-3-663-01204-7_42","DTP-MSU 95/39","hep-th gr-qc",,"  Kinnersley--type representation is constructed for the four--dimensional
Einstein--Maxwell--dilaton--axion system restricted to space--times possessing
two non--null commuting Killing symmetries. New representation essentially uses
the matrix--valued $SL(2,R)$ formulation and effectively reduces the
construction of the Geroch group to the corresponding problem for the vacuum
Einstein equations. An infinite hierarchy of potentials is introduced in terms
of $2\times 2$ real symmetric matrices generalizing the scalar hierarchy of
Kinnersley--Chitre known for the vacuum Einstein equations.
","[{""version"":""v1"",""created"":""Fri, 7 Jun 1996 06:50:05 GMT""}]","2022-04-13"
"hep-th/9606042","Galtsov Dmitzi","D.V. Gal'tsov","Symmetries of Heterotic String Effective Theory in Three and Two
  Dimensions","Extended talk at the International Workshop ``Heat Kernel Techniques
  and Quantum Gravity'', Winnipeg, Canada, 2---6 August, 1994), published in
  ``Heat Kernel Techniques and Quantum Gravity'', ed. by S. A. Fulling,
  Discourses in Mathematics and Its Applications, No. 4, Texas A\&M Univ.,
  College Station, Texas, 1995, pp. 423--449",,,"DTP-MSU 94-38","hep-th gr-qc",,"  The four-dimensional bosonic effective action of the toroidally compactified
heterotic string incorporating a dilaton, an axion and one $U(1)$ vector field
is studied on curved space-time manifolds with one and two commuting Killing
vectors. In the first case the theory is reduced to a three-dimensional sigma
model possessing a symmetric pseudoriemannian target space isomorphic to the
coset $SO(2,3)/(SO(3)\times SO(2))$. The ten-parameter group $SO(2,3)$ of
target space isometries contains embedded both $S$ and $T$ classical duality
symmetries of the heterotic string. With one more ignorable coordinate, the
theory reduces to a two-dimensional chiral model built on the above coset, and
therefore belongs to the class of completely integrable systems. This entails
infinite-dimensional symmetries of the Geroch--Kinnersley--Chitre type. Purely
dilatonic theory is shown to be two-dimensionally integrable only for two
particular values of the dilaton coupling constant. In the static case
(diagonal metrics) both theories essentially coincide; in this case the
integrability property holds for all values of the dilaton coupling.
","[{""version"":""v1"",""created"":""Fri, 7 Jun 1996 06:47:56 GMT""}]","2007-05-23"
"math/9606212",,"Zinaida A. Lykova","Excision in Banach simplicial and cyclic cohomology",,,,"MSRI 1996-046","math.OA",,"  We prove that, for every extension of Banach algebras $ 0 \rightarrow B
\rightarrow A \rightarrow D \rightarrow 0 $ such that $B$ has a left or right
bounded approximate identity, the existence of an associated long exact
sequence of Banach simplicial or cyclic cohomology groups is equivalent to the
existence of one for homology groups. It follows from the continuous version of
a result of Wodzicki that associated long exact sequences exist. In particular,
they exist for every extension of $C^*$-algebras.
","[{""version"":""v1"",""created"":""Fri, 7 Jun 1996 00:00:00 GMT""}]","2016-09-06"
"math/9606232","Maggie McLoughlin","Donald E. Knuth","Irredundant intervals",,"ACM J. Exp. Algorithmics 1 (1996), 19pp",,"Knuth migration 11/2004","math.CO",,"  This expository note presents simplifications of a theorem due to Gy\H{o}ri
and an algorithm due to Franzblau and Kleitman: Given a family $F$ of $m$
intervals on a linearly ordered set of $n$ elements, we can construct in
$O(m+n)^2$ steps an irredundant subfamily having maximum cardinality, as well
as a generating family having minimum cardinality. The algorithm is of special
interest because it solves a problem analogous to finding a maximum independent
set, but on a class of objects that is more general than a matroid. This note
is also a complete, runnable computer program, which can be used for
experiments in conjunction with the public-domain software of {\sl The Stanford
GraphBase}.
","[{""version"":""v1"",""created"":""Fri, 7 Jun 1996 00:00:00 GMT""}]","2008-02-03"
"nucl-th/9606010","Boris Kopeliovich","Joerg Huefner (U. Heidelberg), Boris Kopeliovich (MPI-K Heidelberg)","Interplay of Interference Effects in Production of $J/\Psi$ and $\Psi'$
  off Nuclei","Latex 7 pages, 4 postscript files with figures. Invited talks
  presented by B. Kopeliovich at the XXXI st Rencontres de Moriond, ''QCD and
  High-Energy Hadronic Interactions'' March 23-30, 1996, Les Arcs, France and
  at PANIC'96, May 22-28, 1996, Williamsburg, USA Misprints in eqs. (13) and
  (14) are corrected",,,,"nucl-th hep-ph",,"  Our main observations are: (i) The effective path length of the $c\bar c$
wave packet, which is produced in the nucleus, grows with the energy of the
produced charmonium. The variation is controlled by the coherence length
$l_c=2E_{\Psi}/M^2_{\Psi}$. (ii) A colorless $c\bar c$ wave packet produced in
$pp$-interaction is a specific linear combination of the $J/\Psi$ and $\Psi'$
states, and interacts substantially weaker that any of its components. The time
evolution of this wave packet is controlled by the formation length,
$l_f=2E_{\Psi}/(M^2_{\Psi'} - M^2_{\Psi})$. Exact formulas incorporating with
these effects are derived. The interplay of the two phenomena results in a
nontrivial energy- and $x_F$-dependence of the nuclear suppression of the
charmonium production in proton-nucleus and nucleus-nucleus collisions and
explains some of the experimentally observed effects.
","[{""version"":""v1"",""created"":""Thu, 6 Jun 1996 18:14:26 GMT""},{""version"":""v2"",""created"":""Wed, 17 Jul 1996 16:38:39 GMT""}]","2008-02-03"
