"alg-geom/9606005","Janos Kollar","J\'anos Koll\'ar","Nonrational Covers of $CP^m\times CP^n$","AMSTeX 2.1",,,,"alg-geom math.AG",,"  The aim of the paper is to construct examples of cyclic covers of $CP^m\times
CP^n$ which are rationally connected but are not rational. The crucial point
turns out to be the study of Del Pezzo surfaces over function fields in
positive characteristic.
","[{""version"":""v1"",""created"":""Thu, 6 Jun 1996 16:55:42 GMT""}]","2008-02-03"
"alg-geom/9606006","Dmitri O. Orlov","Dmitri Orlov","Equivalences of derived categories and K3 surfaces","28 pages, LaTeX file","J. Math. Sci. (New York) 84 (1997), no. 5, 1361--1381",,,"alg-geom math.AG","http://arxiv.org/licenses/nonexclusive-distrib/1.0/","  We consider derived categories of coherent sheaves on smooth projective
varieties. We prove that any equivalence between them can be represented by an
object on the product. Using this, we give a necessary and sufficient condition
for equivalence of derived categories of two K3 surfaces.
","[{""version"":""v1"",""created"":""Fri, 7 Jun 1996 12:29:42 GMT""},{""version"":""v2"",""created"":""Tue, 11 Jun 1996 10:37:02 GMT""},{""version"":""v3"",""created"":""Fri, 1 Nov 1996 12:54:27 GMT""},{""version"":""v4"",""created"":""Wed, 17 Dec 1997 13:00:12 GMT""},{""version"":""v5"",""created"":""Sat, 28 Nov 2009 02:16:12 GMT""}]","2009-11-28"
"alg-geom/9606007","Joost van Hamel","Fr\'ed\'eric Mangolte and Joost van Hamel","Algebraic cycles and topology of real Enriques surfaces","18 pages AMS-LaTeX v 1.2",,,,"alg-geom math.AG",,"  For a real Enriques surface Y we prove that every homology class in H_1(Y(R),
Z/2) can be represented by a real algebraic curve if and only if all connected
components of Y(R) are orientable. Furthermore, we give a characterization of
real Enriques surfaces which are Galois-Maximal and/or Z-Galois-Maximal and we
determine the Brauer group of any real Enriques surface.
","[{""version"":""v1"",""created"":""Fri, 7 Jun 1996 11:20:04 GMT""}]","2008-02-03"
"astro-ph/9606041","Michael Rauch","M. Rauch, W.L.W. Sargent, D.S. Womble, T.A. Barlow (Caltech)","Temperature and Kinematics of CIV Absorption Systems","submitted to the ApJ Letters, March 16, 1996 (in press); (13 Latex
  pages, 4 Postscript figures, and psfig.sty included)",,"10.1086/310187",,"astro-ph",,"  We use Keck HIRES spectra of three intermediate redshift QSOs to study the
physical state and kinematics of the individual components of CIV selected
heavy element absorption systems. Fewer than 8 % of all CIV lines with column
densities greater than 10^{12.5} cm^{-2} have Doppler parameters b < 6 km/s. A
formal decomposition into thermal and non-thermal motion using the simultaneous
presence of SiIV gives a mean thermal Doppler parameter b_{therm}(CIV) = 7.2
km/s, corresponding to a temperature of 38,000 K although temperatures possibly
in excess of 300,000 K occur occasionally. We also find tentative evidence for
a mild increase of temperature with HI column density. Non-thermal motions
within components are typically small (< 10 km/s) for most systems, indicative
of a quiescent environment. The two-point correlation function (TPCF) of CIV
systems on scales up to 500 km/s suggests that there is more than one source of
velocity dispersion. The shape of the TPCF can be understood if the CIV systems
are caused by ensembles of objects with the kinematics of dwarf galaxies on a
small scale, while following the Hubble flow on a larger scale. Individual high
redshift CIV components may be the building blocks of future normal galaxies in
a hierarchical structure formation scenario.
","[{""version"":""v1"",""created"":""Thu, 6 Jun 1996 16:42:22 GMT""}]","2009-10-28"
"astro-ph/9606042","Daniel Schaerer","Daniel Schaerer (STScI; Geneva Observatory; OMP Toulouse)","About the initial mass function and HeII emission in young starbursts","ApJ Letters, accepted. 8 pages LaTeX including 3 PostScript figures,
  uses AASTeX and psfig macros. PostScript file also available at
  ftp://ftp.stsci.edu/outside-access/out.going/schaerer/imf.ps",,"10.1086/310193",,"astro-ph",,"  We demonstrate that it is crucial to account for the evolution of the
starburst population in order to derive reliable numbers of O stars from
integrated spectra for burst ages t > 2 - 3 Myr. In these cases the method of
Vacca & Conti (1992) and Vacca (1994) systematically underestimates the number
of O stars. Therefore the current WR/O number ratios in Wolf-Rayet (WR)
galaxies are overestimated. This questions recent claims about flat IMF slopes
(alpha ~ 1-2) in these objects. If the evolution of the burst is properly
treated we find that the observations are indeed compatible with a Salpeter
IMF, in agreement with earlier studies.
  Including recent predictions from non-LTE, line blanketed model atmospheres
which account for stellar winds, we synthesize the nebular and WR HeII 4686
emission in young starbursts. For metallicities 1/5 <= Z/Z_sun <= 1 we predict
a strong nebular HeII emission due to a significant fraction of WC stars in
early WR phases of the burst. For other metallicities broad WR emission will
always dominate the HeII emission. Our predictions of the nebular HeII
intensity agree well with the observations in WR galaxies and an important
fraction of the giant HII regions where nebular HeII is detected. We propose
further observational tests of our result.
","[{""version"":""v1"",""created"":""Thu, 6 Jun 1996 16:14:29 GMT""}]","2009-10-28"
"astro-ph/9606043","Peter Meszaros","P. Meszaros and M.J. Rees","Optical and Long Wavelength Afterglow from Gamma-Ray Bursts","Submitted to Ap.J. (Letters) on 5/31/96; uuencoded latex file, 10
  pages, uses AAS macro aaspp4.sty","Astrophys.J. 476 (1997) 232-237","10.1086/303625",,"astro-ph",,"  We discuss the evolution of cosmological gamma-ray burst remnants, consisting
of the cooling and expanding fireball ejecta together with any swept-up
external matter, after the gamma-ray event. We show that significant optical
emission is predicted which should be measurable for timescales of hours after
the event, and in some cases radio emission may be expected days to weeks after
the event. The flux at optical, X-ray and other long wavelengths decays as a
power of time, and the initial value of the flux or magnitude, as well as the
value of the time-decay exponent, should help to distinguish between possible
types of dissipative fireball models.
","[{""version"":""v1"",""created"":""Thu, 6 Jun 1996 20:50:00 GMT""}]","2009-10-28"
"astro-ph/9606044","Limin Lu","Limin Lu, Wallace L.W. Sargent, and Thomas A. Barlow","Abundances at High Redshifts: the Chemical Enrichment History of Damped
  Lyman-alpha Galaxies","AASTEX file containing 18 of the 20 tables. The remaining two tables
  (tables 16 and 17) are provided as separate PS files. 30 figures files also
  included (1 bitmapped at 100dpi). ApJS, accepted","Astrophys.J.Suppl. 107 (1996) 475","10.1086/192373",,"astro-ph",,"  Damped Lyman-alpha absorption systems found in the spectra of high redshift
quasars are believed to trace the interstellar gas in high redshift galaxies.
In this paper, we study the elemental abundances of C, N, O, Al, Si, S, Cr, Mn,
Fe, Ni, and Zn in a sample of 14 damped Lyman-alpha systems using high quality
echelle spectra of quasars obtained with the 10m Keck telescope. These
abundances are combined with similar measurements in the literature in order to
investigate the chemical evolution of damped Lyman-alpha galaxies in the
redshift range 0.7<z<4.4. Among the things investigated are: the metallicity
distribution of damped Lyman-alpha galaxy, its evolution with redshift (ie,
age-metallicity relation), the relative abundance patterns of the heavy metals
and implications for their nucleosynthetic origin, the effects of dust, the
nature of the star formation process in damped Lyman-alpha galaxies, and the
nature of damped Lyman-alpha galaxies themselves.
","[{""version"":""v1"",""created"":""Fri, 7 Jun 1996 00:32:11 GMT""}]","2009-10-28"
"astro-ph/9606045","M. H. van Kerkwijk","M. H. van Kerkwijk (Palomar Observatory, Caltech), P. Bergeron
  (Universite de Montreal), S. R. Kulkarni (Palomar Observatory, Caltech)","The masses of the millisecond pulsar J1012+5307 and its white-dwarf
  companion","6 pages of text and figures. Refereed version, resubmitted to ApJL.
  Needs aas2pp4.sty, epsf.sty","Astrophys. J. 467, L89 (1996)","10.1086/310209",,"astro-ph",,"  We report on spectroscopy of the white-dwarf companion of the millisecond
radio pulsar PSR J1012+5307. We find strong Balmer absorption lines, as would
be expected for a cool DA white dwarf. The profiles are much narrower than
usual, however, and lines are seen up to H12, indicating that the companion has
a low gravity and hence a low mass. This is consistent with the
expectation---based on evolutionary considerations and on the mass
function---that it is a low-mass white dwarf with a helium core. By comparing
the spectra to model atmospheres, we derive an effective temperature
$T_{\rm{}eff}=8550\pm25\,$K and a surface gravity $\log{}g=6.75\pm0.07$ (cgs
units). Using the Hamada-Salpeter mass-radius relation for helium white dwarfs,
with an approximate correction for finite-temperature effects, we infer a mass
$\mwd=0.16\pm0.02\,\msun$. This is the lowest mass among all spectroscopically
identified white dwarfs. We determine radial velocities from our spectra, and
find a radial-velocity amplitude of $280\pm15\,\kms$. With the pulsar's
radial-velocity amplitude, the mass ratio $\mpsr/\mwd=13.3\pm0.7$. From all
constraints, we find that with 95\% confidence $1.5<\mpsr/\msun<3.2$.
","[{""version"":""v1"",""created"":""Fri, 7 Jun 1996 05:00:53 GMT""}]","2009-10-28"
"astro-ph/9606046","Ferrara Andrea","Andrea Ferrara, Simone Bianchi, Ralf-Juergen Dettmar and Carlo
  Giovanardi","The Effect of Light Scattering by Dust in Galactic Halos on Emission
  Line Ratios","12 pages, LaTeX (aasms4.sty), 2 figures; ApJ Letters, accepted, June
  5th",,"10.1086/310212","OAA-12","astro-ph",,"  We present results from Monte Carlo simulations describing the radiation
transfer of $H\alpha$ line emission, produced both by HII regions in the disk
and in the diffuse ionized gas (DIG), through the dust layer of the galaxy
NGC891. This allows us to calculate the amount of light originating in the HII
regions of the disk and scattered by dust at high $z$, and compare it with the
emission produced by recombinations in the DIG. The cuts of photometric and
polarimetric maps along the $z$-axis show that scattered light from HII regions
is still 10\% of that of the DIG at $z\sim 600$~pc, whereas the the degree of
linear polarization is small ($<1$\%). The importance of these results for the
determination of intrinsic emission line ratios is emphasized, and the
significance and possible implications of dust at high $z$ are discussed.
","[{""version"":""v1"",""created"":""Fri, 7 Jun 1996 09:17:22 GMT""}]","2009-10-28"
"astro-ph/9606047","David Wands","Juan Garcia-Bellido and David Wands","The spectrum of curvature perturbations from hybrid inflation","LaTeX (with RevTex) 5 pages, 3 uuencoded figures appended, also
  available on WWW via http://star-www.maps.susx.ac.uk/index.html","Phys.Rev.D54:7181-7185,1996","10.1103/PhysRevD.54.7181","SUSSEX-AST 96/6-1, RCG 96/08, IEM-FT-132/96","astro-ph gr-qc",,"  We study the amplitude and spectral tilt of density perturbations in the
simplest hybrid inflation models. We give an exact expression for the amplitude
of quantum fluctuations on all scales in the limit where we can neglect the
backreaction on the metric. This is a very good approximation for values of the
inflaton field well below the Planck scale and our results remain valid far
from the usual massless limit. We confirm that the primordial density spectrum
in this model has a constant spectral index n>1 over all observable scales. For
the small values of the tilt (n<1.4) required by observations, the results
remain close to those obtained using the quasi-massless approximation.
","[{""version"":""v1"",""created"":""Fri, 7 Jun 1996 11:52:26 GMT""}]","2009-06-19"
"chao-dyn/9606001","Andrzej Z. Gorski","A.Z. Gorski (1), R. Botet (2), S. Drozdz (1) and M. Ploszajczak (1,3)
  ( (1) Inst.of Nucl. Physics, Cracow, (2) Laboratorie de Physique des Solides,
  Orsay, (3) GANIL Caen )","Decay of Nuclear Giant Resonances: Quantum Self-similar Fragmentation","4 pages, LaTeX format, pc96.sty + 2 eps figures, accepted as: talk at
  the 8th Joint EPS-APS International Conference on Physics Computing (PC'96,
  17-21. Sept. 1996), to appear in the Proceedings",,,,"chao-dyn hep-ph nlin.CD nucl-th",,"  Scaling analysis of nuclear giant resonance transition probabilities with
increasing level of complexity in the background states is performed. It is
found that the background characteristics, typical for chaotic systems lead to
nontrivial multifractal scaling properties.
","[{""version"":""v1"",""created"":""Fri, 7 Jun 1996 15:25:00 GMT""}]","2008-02-03"
"cmp-lg/9606006","Anoop Sarkar","Anoop Sarkar and Aravind Joshi (Dept of Computer and Information
  Science, University of Pennsylvania)","Coordination in Tree Adjoining Grammars: Formalization and
  Implementation","6 pages, 16 Postscript figures, uses colap.sty. To appear in the
  proceedings of COLING 1996",,,,"cmp-lg cs.CL",,"  In this paper we show that an account for coordination can be constructed
using the derivation structures in a lexicalized Tree Adjoining Grammar (LTAG).
We present a notion of derivation in LTAGs that preserves the notion of fixed
constituency in the LTAG lexicon while providing the flexibility needed for
coordination phenomena. We also discuss the construction of a practical parser
for LTAGs that can handle coordination including cases of non-constituent
coordination.
","[{""version"":""v1"",""created"":""Fri, 7 Jun 1996 02:02:07 GMT""}]","2008-02-03"
"cmp-lg/9606007","Eneko Agirre","Eneko Agirre (Euskal Herriko Unibertsitatea), German Rigau
  (Universitat Politecnica de Catalunya)","Word Sense Disambiguation using Conceptual Density","Postscript version. 8 pages. To appear in the proceedings of COLING
  1996",,,,"cmp-lg cs.CL",,"  This paper presents a method for the resolution of lexical ambiguity of nouns
and its automatic evaluation over the Brown Corpus. The method relies on the
use of the wide-coverage noun taxonomy of WordNet and the notion of conceptual
distance among concepts, captured by a Conceptual Density formula developed for
this purpose. This fully automatic method requires no hand coding of lexical
entries, hand tagging of text nor any kind of training process. The results of
the experiments have been automatically evaluated against SemCor, the
sense-tagged version of the Brown Corpus.
","[{""version"":""v1"",""created"":""Fri, 7 Jun 1996 12:34:11 GMT""}]","2008-02-03"
"cond-mat/9606037","Eugene Shakhnovich","M.Karplus and E.Shakhnovich (Department of Chemistry, Harvard
  University)","Comment on ""A Criterion that determines foldability of proteins"" by D.
  Klimov and D. Thirumalai (PRL,v.76, p.4070 (1996))","3 pages (doublespace)",,,,"cond-mat q-bio",,"  We argue that that the folding criterion suggested by Klimov and Thirumalai
is similar to the one published earlier and that their conclusion of invalidity
of the ``gap criterion'' is due to misunderstanding of previous work
","[{""version"":""v1"",""created"":""Thu, 6 Jun 1996 23:56:33 GMT""}]","2007-05-23"
"cond-mat/9606038","Carey Huscroft","C. Huscroft and R.T. Scalettar (U.C. Davis)","Effect of Disorder on Charge Density Wave and Superconducting Order in
  the Half-Filled Attractive Hubbard Model",,,"10.1103/PhysRevB.55.1185",,"cond-mat",,"  The half-filled attractive Hubbard model exhibits simultaneous charge density
wave and superconducting order in its ground state. In this paper we explore
the effect of disorder in the site energies on this degeneracy. We find that
superconducting order survives randomness out to a critical amount of disorder,
but charge ordering is immediately reduced. We explore the validity of a strong
coupling picture which maps the system onto a Heisenberg model in a random
magnetic field.
","[{""version"":""v1"",""created"":""Fri, 7 Jun 1996 06:34:30 GMT""}]","2009-10-28"
"cond-mat/9606039","Ruihong Yue","Ruihong Yue and Tetsuo Deguchi","Analytic Bethe Ansatz for 1-D Hubbard model and twisted coupled XY model","22 pages, latex, no figures",,"10.1088/0305-4470/30/3/011","OCHA-PP-81","cond-mat",,"  We found the eigenvalues of the transfer matrices for the 1-D Hubbard model
and for the coupled XY model with twisted boundary condition by using the
analytic Bethe Ansatz method. Under a particular condition the two models have
the same Bethe Ansatz equations. We have also proved that the periodic 1-D
Hubbard model is exactly equal to the coupled XY model with nontrivial twisted
boundary condition at the level of hamiltonians and transfer matrices.
","[{""version"":""v1"",""created"":""Fri, 7 Jun 1996 06:54:55 GMT""}]","2009-10-28"
"cond-mat/9606040","Michael Bulenda","M.Bulenda, F.Schwabl, U.C.T\""auber","Defect-induced condensation and central peak at elastic phase
  transitions","11 pages, 11 ps-figures, to appear in PRB","Phys. Rev. B 54 (1996) 6210","10.1103/PhysRevB.54.6210",,"cond-mat",,"  Static and dynamical properties of elastic phase transitions under the
influence of short--range defects, which locally increase the transition
temperature, are investigated. Our approach is based on a Ginzburg--Landau
theory for three--dimensional crystals with one--, two-- or three--dimensional
soft sectors, respectively. Systems with a finite concentration $n_{\rm D}$ of
quenched, randomly placed defects display a phase transition at a temperature
$T_c(n_{\rm D})$, which can be considerably above the transition temperature
$T_c^0$ of the pure system. The phonon correlation function is calculated in
single--site approximation. For $T>T_c(n_{\rm D})$ a dynamical central peak
appears; upon approaching $T_c(n_{\rm D})$, its height diverges and its width
vanishes. Using an appropriate self--consistent method, we calculate the
spatially inhomogeneous order parameter, the free energy and the specific heat,
as well as the dynamical correlation function in the ordered phase. The
dynamical central peak disappears again as the temperatur is lowered below
$T_c(n_{\rm D})$. The inhomogeneous order parameter causes a static central
peak in the scattering cross section, with a finite $k$ width depending on the
orientation of the external wave vector ${\bf k}$ relative to the soft sector.
The jump in the specific heat at the transition temperatur of the pure system
is smeared out by the influence of the defects, leading to a distinct maximum
instead. In addition, there emerges a tiny discontinuity of the specific heat
at $T_c(n_{\rm D})$. We also discuss the range of validity of the mean--field
approach, and provide a more realistic estimate for the transition temperature.
","[{""version"":""v1"",""created"":""Fri, 7 Jun 1996 09:10:24 GMT""}]","2016-08-31"
"cond-mat/9606041","Jan Ambjorn","J. Ambjorn, Y. Makeenko and K. Zarembo","Supersymmetric matrix models and branched polymers","xx pages, Latex, no macros needed","Nucl.Phys. B482 (1996) 660-674","10.1016/S0550-3213(96)00526-3","NBI-HE-96-20, ITEP-TH-15/96, SMI-96-3","cond-mat hep-lat hep-th",,"  We solve a supersymmetric matrix model with a general potential. While matrix
models usually describe surfaces, supersymmetry enforces a cancellation of
bosonic and fermionic loops and only diagrams corresponding to so-called
branched polymers survive. The eigenvalue distribution of the random matrices
near the critical point is of a new kind.
","[{""version"":""v1"",""created"":""Fri, 7 Jun 1996 09:17:36 GMT""}]","2009-10-28"
"cond-mat/9606042","Reuven Zeitak","Bernard Derrida(1,2) and Reuven Zeitak(1) ((1)LPS ENS Paris (2)SPT
  Saclay)","Distribution of domain sizes in the zero temperature Glauber dynamics of
  the 1 D Potts model","LaTeX 24 pages. 2 postscript figures. Submitted to PRE 15-april-96",,"10.1103/PhysRevE.54.2513",,"cond-mat",,"  For the zero temperature Glauber dynamics of the $q$-state Potts model, we
calculate the exact distribution of domain sizes by mapping the problem on an
exactly soluble one-species coagulation model ($A+A\rightarrow A$). In the long
time limit, this distribution is universal and from its (complicated) exact
expression, we extract its behavior in various regimes. Our results are tested
in a simulation and compared to the predictions of a simple approximation
proposed recently. Considering the dynamics of domain walls as a reaction
diffusion model $ A+A \to \ A $ with probability $ (q-2)/(q-1)$ and $A+A \to
\emptyset $ with probability $1/(q-1)$, we calculate the pair correlation
function in the long time regime.
","[{""version"":""v1"",""created"":""Fri, 7 Jun 1996 10:22:53 GMT""}]","2009-10-28"
"cond-mat/9606043","Joerg Schulenburg","R. Hayn, A.F. Barabanov and J. Schulenburg","Non-rigid hole band in the extended t-J model","14 pages, LaTeX, 6 figures on request, submitted to Zeitschrift fuer
  Physik",,"10.1007/s002570050299",,"cond-mat",,"  The dispersion of one hole in an extended $t$-$J$ model with additional
hopping terms to second and third nearest neighbours and a frustration term in
the exchange part has been investigated. Two methods, a Green's function
projection technique describing a magnetic polaron of minimal size and the
exact diagonalization of a $4*4$ lattice, have been applied, showing reasonable
agreement among each other. Using additional hopping integrals which are
characteristic for the CuO$_2$ plane in cuprates we find in the nonfrustrated
case an isotropic minimum of the dispersion at the point $(\pi/2,\pi/2)$ in
$k$-space in good coincidence with recent angle-resolved photoemission results
for the insulating compound Sr$_2$CuO$_2$Cl$_2$. Including frustration or
finite temperature which shall simulate the effect of doping, the dispersion is
drastically changed such that a flat region and an extended saddle point may be
observed between $(\pi/2,0)$ and $(\pi,0)$ in agreement with experimental
results for the optimally doped cuprates.
","[{""version"":""v1"",""created"":""Fri, 7 Jun 1996 12:45:19 GMT""}]","2009-10-28"
"cond-mat/9606044","IV Lerner","J. T. Chalker, Igor V. Lerner, and Robert A. Smith","Fictitious Level Dynamics: A Novel Approach to Spectral Statistics in
  Disordered Conductors","35 pages in REVTeX format including 10 postscript figures; to be
  published in a special issue (on Topics in Mesoscopic Physics) of the Journal
  of Mathematical Physics, October 1996","J. Math. Phys. 37 (1996) 5061","10.1063/1.531676",,"cond-mat",,"  We establish a new approach to calculating spectral statistics in disordered
conductors, by considering how energy levels move in response to changes in the
impurity potential. We use this fictitious dynamics to calculate the spectral
form factor in two ways. First, describing the dynamics using a Fokker-Planck
equation, we make a physically motivated decoupling, obtaining the spectral
correlations in terms of the quantum return probability. Second, from an
identity which we derive between two- and three-particle correlation functions,
we make a mathematically controlled decoupling to obtain the same result. We
also calculate weak localization corrections to this result, and show for two
dimensional systems (which are of most interest) that corrections vanish to
three-loop order.
","[{""version"":""v1"",""created"":""Fri, 7 Jun 1996 11:11:36 GMT""}]","2009-10-28"
"cond-mat/9606045","Marco Grilli","M.Capone, M.Grilli, and W.Stephan (Dipartimento di Fisica, Universita`
  la Sapienza, Roma, Italy)","Small polaron formation in the Holstein and Su-Schrieffer-Heeger models:
  The criteria from analytic and numerical analyses","8 pages+4 postscript figures",,,,"cond-mat",,"  We investigate the conditions leading to polaron formation for a single
electron interacting with dispersionless optical phonons within the Holstein
and the Su-Schrieffer-Heeger models. Both from analytic perturbation theory and
exact numerical diagonalization of small clusters, we find different criteria
for the model parameters ruling the setting in of the polaronic regime. We also
illustrate the common physical origin of polarons in the two models as arising
from the simultaneous fulfilling of two conditions: A sizable ionic
displacement and a lattice deformation energy gain larger that the loss in the
bare electron kinetic energy.
","[{""version"":""v1"",""created"":""Fri, 7 Jun 1996 10:42:50 GMT""}]","2007-05-23"
"cond-mat/9606046",,"Gunter M. Sch\""utz","An exactly solvable lattice model for inhomogeneous interface growth","10 pages, latex",,"10.1051/jp1:1996153",,"cond-mat",,"  We study the dynamics of an exactly solvable lattice model for inhomogeneous
interface growth. The interface grows deterministically with constant velocity
except along a defect line where the growth process is random. We obtain exact
expressions for the average height and height fluctuations as functions of
space and time for an initially flat interface. For a given defect strength
there is a critical angle between the defect line and the growth direction
above which a cusp in the interface develops. In the mapping to polymers in
random media this is an example for the transverse Meissner effect.
Fluctuations around the mean shape of the interface are Gaussian.
","[{""version"":""v1"",""created"":""Fri, 7 Jun 1996 15:08:23 GMT""}]","2009-10-28"
