"hep-th/9606074","Shabanov","F.G. Scholtz and S.V. Shabanov","Supersymmetric quantization of Yang-Mills theory and possible
  applications","to appear in the Proceedings of the 2nd Sakharov Conference on
  Physics, Moscow, May, 1996",,,"FTUV/96-34, IFIC/96-42","hep-th",,"  We develop a new operator quantization scheme for gauge theories where no
gauge fixing for gauge fields is needed. The scheme allows one to avoid the
Gribov problem and construct a manifestly Lorentz invariant path integral that
can be used in the non-perturbative domain. We discuss briefly an application
of the method to Abelian projections of QCD.
","[{""version"":""v1"",""created"":""Thu, 13 Jun 1996 13:26:34 GMT""}]","2007-05-23"
"hep-th/9606075",,"Anna Okopi\'nska","The Effective Action for Local Composite Operators $\Phi^2(x)$ and
  $\Phi^4(x)$","15 pages, plain Latex, 1 compressed and uuencoded Postscript figure","Int.J.Mod.Phys. A12 (1997) 585-606","10.1142/S0217751X97000554",,"hep-th",,"  The generating functionals for the local composite operators, $\Phi^2(x)$ and
$\Phi^4(x)$, are used to study excitations in the scalar quantum field theory
with $\lambda \Phi^4$ interaction. The effective action for the composite
operators is obtained as a series in the Planck constant $\hbar$, and the two-
and four-particle propagators are derived. The numerical results are studied in
the space-time of one dimension, when the theory is equivalent to the quantum
mechanics of an anharmonic oscillator. The effective potential and the poles of
the composite propagators are obtained as series in $\hbar$, with effective
mass and coupling determined by non-perturbative gap equations. This provides a
systematic approximation method for the ground state energy, and for the second
and fourth excitations. The results show quick convergence to the exact values,
better than that obtained without including the operator $\Phi^4$.
","[{""version"":""v1"",""created"":""Thu, 13 Jun 1996 15:09:36 GMT""}]","2015-06-26"
"hep-th/9606076",,"Maximilian F. Hasler (C.P.T. Marseille)","The three-form multiplet in N=2 superspace","12 pages, LaTeX (2.09). (Final version to appear in Z.Phys.C)","Eur.Phys.J.C1:729-734,1998","10.1007/s100520050118","CPT-96/P.3349","hep-th",,"  We present an N=2 multiplet including a three-index antisymmetric tensor
gauge potential, and describe it as a solution to the Bianchi identities for
the associated fieldstrength superform, subject to some covariant constraints,
in extended central charge superspace. We find that this solution is given in
terms of an 8+8 tensor multiplet subject to an additional constraint. We give
the transformation laws for the multiplet as well as invariant superfield and
component field lagrangians, and mention possible couplings to other
multiplets. We also allude to the relevance of the 3--form geometry for generic
invariant supergravity actions.
","[{""version"":""v1"",""created"":""Thu, 13 Jun 1996 15:06:56 GMT""},{""version"":""v2"",""created"":""Mon, 17 Jun 1996 07:38:08 GMT""},{""version"":""v3"",""created"":""Sat, 19 Jul 1997 10:07:18 GMT""}]","2011-09-13"
"math/9606217",,"Sergei Lysenko","On the functional equation f(p(z))=g(q(z)), where p,q are ""generalized""
  polynomials and f,g are meromorphic functions",,,"10.1070/IM1996v060n05ABEH000088","Dynamical Systems 6/13/96","math.DS",,"  The functional equation f(p(z))=g(q(z)) is studied, where p,q are polynomials
and f,g are trancendental meromorphic functions in C. We find all the pairs p,q
for which there exist nonconstant f,g satisfying our equation and there exist
no rational f,g with this property. In fact, a more general problem is solved.
In addition to algebraic methods, some results from local analytic dynamics are
used.
","[{""version"":""v1"",""created"":""Thu, 13 Jun 1996 00:00:00 GMT""}]","2015-06-26"
"nucl-th/9606023","Hitoshi Nakada","H. Nakada, T. Sebe and K. Muto","Realistic shell model calculation of $2\nu\beta\beta$ nuclear matrix
  elements and role of shell structure in intermediate states","LaTeX 28 pages & 5 Postscript figures, to appear in Nucl. Phys. A","Nucl.Phys. A607 (1996) 235-249","10.1016/0375-9474(96)00227-8",,"nucl-th",,"  We discuss two conditions needed for correct computation of $2\nu \beta\beta$
nuclear matrix-elements within the realistic shell-model framework. An
algorithm in which intermediate states are treated based on Whitehead's moment
method is inspected, by taking examples of the double GT$^+$ transitions
$\mbox{$^{36}$Ar}\rightarrow\mbox{$^{36}$S}$,
$\mbox{$^{54}$Fe}\rightarrow\mbox{$^{54}$Cr}$ and $\mbox{$^{58}$Ni}
\rightarrow\mbox{$^{58}$Fe}$. This algorithm yields rapid convergence on the
$2\nu\beta\beta$ matrix-elements, even when neither relevant GT$^+$ nor GT$^-$
strength distribution is convergent. A significant role of the shell structure
is pointed out, which makes the $2\nu\beta \beta$ matrix-elements highly
dominated by the low-lying intermediate states. Experimental information of the
low-lying GT$^\pm$ strengths is strongly desired. Half-lives of
$T^{2\nu}_{1/2}({\rm EC}/{\rm EC};
\mbox{$^{36}$Ar}\rightarrow\mbox{$^{36}$S})=1.7\times 10^{29}\mbox{yr}$,
$T^{2\nu}_{1/2}({\rm EC}/{\rm EC};\mbox{$^{54}$Fe}\rightarrow
\mbox{$^{54}$Cr})=1.5\times 10^{27}\mbox{yr}$,$T^{2\nu}_{1/2}({\rm EC} /{\rm
EC};\mbox{$^{58}$Ni}\rightarrow\mbox{$^{58}$Fe})=6.1\times 10^{24}\mbox{yr}$and
$T^{2\nu}_{1/2}(\beta^+/{\rm EC};\mbox{$^{58}$Ni}
\rightarrow\mbox{$^{58}$Fe})=8.6\times 10^{25}\mbox{yr}$ are obtained from the
present realistic shell-model calculation of the nuclear matrix-elements.
","[{""version"":""v1"",""created"":""Thu, 13 Jun 1996 10:16:19 GMT""}]","2009-10-30"
"nucl-th/9606024","Terry Mart","T. Mart, C. Bennhold, and L. Alfieri","Electromagnetic Production of Kaons on the Nucleon","3 pages, Latex, 1 Postscript figure, Talk given at the Workshop on
  Production, Properties and Interaction of Mesons (MESON '96), Cracow, Poland,
  May 1996. To be published in Acta Physica Polonica","Acta Phys.Polon. B27 (1996) 3167-3170",,"MKPH-T-96-12","nucl-th hep-ph",,"  Kaon photo- and electroproduction in all six isospin channels are
investigated by means of an isobaric model. It is found that existing models
can only partially describe the current experimental data. Moreover, the
extracted coupling constants are mostly inconsistent with the prediction of
SU(3) symmetry or the information from hadronic reactions. In order to further
analyze this problem, we introduce a form factor at the hadronic vertices $KNY$
(with $Y=\Lambda~ \textrm{or}~ \Sigma$) and study its behavior qualitatively.
Our result suggests the need of more accurate experiments, especially in the
charged $\Sigma$ and the neutral $K^0$ channels.
","[{""version"":""v1"",""created"":""Thu, 13 Jun 1996 13:17:28 GMT""}]","2007-05-23"
"q-alg/9606011","Aristophanes Dimakis","A. Dimakis and C. Tzanakis","Noncommutative geometry and its relation to stochastic calculus and
  symplectic mechanics","Talk presented by C.T. at the 4th International Conference in
  Geometry, Thessaloniki, May 1996, 10 pages, Latex",,,,"q-alg math.QA",,"  In the context of a noncommutative differential calculus on the algebra of
real valued functions of an $n$-dimensional manifold $M$, a commutative and
associative product of 1-forms is naturally defined. Ordinary differential
calculus corresponds to this product being trivially zero. We consider the
minimal generalization in which the algebra of 1-forms with this product is
nilpotent of degree 3. Basic tensor analysis and differential geometry are
developped in this context and applied to the formulation of symplectic
geometry and Hamiltonian dynamics. It is shown that the corresponding Liouville
equation can take the form of a generalized Fokker-Planck equation, well known
in statistical mechanics of open systems, as well as in stochastic calculus.
Specifically it may be the same with that obtained via Ito stochastic calculus,
when solving a linear stochastic differential equation with a Wiener process as
the stochastic term. The close connection between noncommutative differential
structures of this kind, with semimartingale stochastic processes on manifolds
thus suggested, is further explored.
","[{""version"":""v1"",""created"":""Thu, 13 Jun 1996 10:43:18 GMT""}]","2008-02-03"
"quant-ph/9606011","Ary Espinoza Muller","Ary W. Espinosa M\""uller and Adelio R. Matamala V\'asquez","Algebraic Formulation of the Operatorial Perturbation Theory. Part I","plain LATEX, submitted to Phys. Rev. A",,,"DFUDEC-9603","quant-ph",,"  A new totally algebraic formalism based on general, abstract ladder operators
has been proposed. This approach heavily grounds in the superoperator formalism
of Primas. However it is necessary to introduce many improvements in his
formalism. In this regard, it has been introduced a new set of superoperators
featured by their algebraic structure. Also, two lemmas and one theorem have
been developed in order to algebraically reformulate the theory on more
rigorous grounds. Finally, we have been able to build a coherent and
self-contained formalism independent on any matricial representation , removing
in this way the degeneracy problem .
","[{""version"":""v1"",""created"":""Wed, 12 Jun 1996 21:01:04 GMT""}]","2016-08-15"
