"cond-mat/9606155","Kun Yang","F. D. M. Haldane and Kun Yang","Landau Level Mixing and Levitation of Extended States in Two Dimensions","4 pages, 2 eps figures, uuencoded in 1 compressed tar file","Phys. Rev. Lett. 78, 298 (1997).","10.1103/PhysRevLett.78.298",,"cond-mat",,"  We study the effects of mixing of different Landau levels on the energies of
one-body states, in the presence of a strong uniform magnetic field and a
random potential in two dimensions. We use a perturbative approach and develop
a systematic expansion in both the strength and smoothness of the random
potential. We find the energies of the extended states shift {\em upward}, and
the amount of levitation is proportional to $(n+1/2)/B^3$ for strong magnetic
field, where $B$ is the magnetic field strength and $n$ is the Landau level
index.
","[{""version"":""v1"",""created"":""Fri, 21 Jun 1996 14:14:27 GMT""}]","2009-10-28"
"funct-an/9606005","Victor Nistor","Richard B. Melrose and Victor Nistor","Homology of pseudodifferential operators I. Manifolds with boundary","AMS-Latex, xy-pic version 3.2, 47 pages. We changed the introduction",,,,"funct-an dg-ga hep-th math.DG math.OA",,"  The Hochschild and cyclic homology groups are computed for the algebra of
`cusp' pseudodifferential operators on any compact manifold with boundary. The
index functional for this algebra is interpreted as a Hochschild 1-cocycle and
evaluated in terms of extensions of the trace functionals on the two natural
ideals, corresponding to the two filtrations by interior order and vanishing
degree at the boundary, together with the exterior derivations of the algebra.
This leads to an index formula which is a pseudodifferential extension of that
of Atiyah, Patodi and Singer for Dirac operators; together with a symbolic term
it involves the `eta' invariant on the suspended algebra over the boundary
previously introduced by the first author.
","[{""version"":""v1"",""created"":""Fri, 21 Jun 1996 00:50:29 GMT""},{""version"":""v2"",""created"":""Mon, 28 Oct 1996 14:13:28 GMT""}]","2008-02-03"
"gr-qc/9606063","Slava Turyshev","Slava G. Turyshev","Relativistic Navigation: A Theoretical Foundation","160 pages, LaTeX, no figures",,,"NASA/JPL No 96-013 July 1, 1996","gr-qc astro-ph",,"  We present a theoretical foundation for relativistic astronomical
measurements in curved space-time. In particular, we discuss a new iterative
approach for describing the dynamics of an astronomical N-body system. To do
this, we generalize the Fock-Chandrasekhar method of the weak-field and
slow-motion approximation (WFSMA) and develop a theory of relativistic
reference frames (RF) for a gravitationally bounded many-extended-body problem.
In any proper RF constructed in the immediate vicinity of an arbitrary body,
the N-body solutions of the gravitational field equations are presented as a
sum of the Riemann-flat inertial space-time, the gravitational field generated
by the body itself, the unperturbed solutions for each body in the system
transformed to the coordinates of this proper RF, and the gravitational
interaction term. We develop the basic concept of a general theory of the
celestial RFs applicable to a wide class of metric theories of gravity with an
arbitrary model of matter distribution. We apply the proposed method to general
relativity. Bodies are described using a perfect fluid model; as such, they
possess any number of internal mass and current multipole moments which
explicitly characterize their internal structure. The obtained relativistic
equations of motion contain an explicit information about the coupling of the
bodies proper multiple moments to the surrounding gravitational field. We
further generalize the proposed method and include two Eddington parameters
$(\gamma,\beta)$. This generalized approach was used to derive the relativistic
equations of satellite motion in the vicinity of the extended bodies. We
discuss the possible future implementation of the proposed formalism in
software codes developed for solar-system orbit determination.
","[{""version"":""v1"",""created"":""Thu, 20 Jun 1996 19:35:50 GMT""}]","2007-05-23"
"gr-qc/9606064","Jose Ademir Sales de Lima","L. R. W. Abramo (Brown University, Providence, RI, USA) and J. A. S.
  Lima (Brown University, Providence, RI, USA and Universidade Federal do Rio
  grande do Norte, Natal, RN, Brazil)","Inflationary Models Driven by Adiabatic Matter Creation","25 pages, 2 figures(available from the authors), uses LATEX","Class.Quant.Grav. 13 (1996) 2953-2964","10.1088/0264-9381/13/11/011","Brown-HET-1009","gr-qc",,"  The flat inflationary dust universe with matter creation proposed by
Prigogine and coworkers is generalized and its dynamical properties are
reexamined. It is shown that the starting point of these models depends
critically on a dimensionless parameter $\Sigma$, closely related to the matter
creation rate $\psi$. For $\Sigma$ bigger or smaller than unity flat universes
can emerge, respectively, either like a Big-Bang FRW singularity or as a
Minkowski space-time at $t=-\infty$. The case $\Sigma=1$ corresponds to a de
Sitter-type solution, a fixed point in the phase diagram of the system,
supported by the matter creation process. The curvature effects have also been
investigated. The inflating de Sitter is a universal attractor for all
expanding solutions regardless of the initial conditions as well as of the
curvature parameter.
","[{""version"":""v1"",""created"":""Fri, 21 Jun 1996 04:18:17 GMT""}]","2009-10-28"
"hep-lat/9606009",,"J.J.M. Verbaarschot","On the spectrum of the QCD Dirac operator","Invited talk at 'Continuous Advances in QCD II', Minneapolis 1996, to
  be published by World Scientific, ed. M. Polikarpov",,,,"hep-lat cond-mat",,"  In this lecture we argue that the fluctuations of Dirac eigenvalues on the
finest scale, i.e. on the scale of the average level spacing do not depend on
the underlying dynamics and can be obtained from a chiral random matrix theory
with the same low energy effective theory. We present three pieces of evidence
supporting that such microscopic correlations of lattice QCD Dirac spectra are
given by chiral random matrix theory. First, we find that the spectral
correlations of eigenvalues in the bulk of the spectrum obey the
Dyson-Mehta-Wigner statistics. Second, we show that the valence quark mass
dependence for sufficiently small quark masses, as calculated by the Columbia
group, can be obtained from the microscopic spectral density of chiral random
matrix theory. Third, in the framework of chiral random matrix models, we
present results showing that the microscopic spectral density is strongly
universal, i.e. is insensitive to the details of the probability distribution.
","[{""version"":""v1"",""created"":""Thu, 20 Jun 1996 17:15:51 GMT""}]","2007-05-23"
"hep-lat/9606010","Christian B. Lang","J. Jersak, C. B. Lang and T. Neuhaus","Non-Gaussian fixed point in four-dimensional pure compact U(1) gauge
  theory on the lattice","11 pages, LaTeX, 2 figures","Phys.Rev.Lett. 77 (1996) 1933-1936","10.1103/PhysRevLett.77.1933","UNIGRAZ-UTP-29-05-96","hep-lat",,"  The line of phase transitions, separating the confinement and the Coulomb
phases in the four-dimensional pure compact U(1) gauge theory with extended
Wilson action, is reconsidered. We present new numerical evidence that a part
of this line, including the original Wilson action, is of second order. By
means of a high precision simulation on homogeneous lattices on a sphere we
find that along this line the scaling behavior is determined by one fixed point
with distinctly non-Gaussian critical exponent nu = 0.365(8). This makes the
existence of a nontrivial and nonasymptotically free four-dimensional pure U(1)
gauge theory in the continuum very probable. The universality and duality
arguments suggest that this conclusion holds also for the monopole loop gas,
for the noncompact abelian Higgs model at large negative squared bare mass, and
for the corresponding effective string theory.
","[{""version"":""v1"",""created"":""Fri, 21 Jun 1996 11:29:37 GMT""}]","2009-10-28"
"hep-lat/9606011","Stefan Thurner","S. Thurner, M. Feurstein, H. Markum (Institut f\""ur Kernphysik, TU
  Wien)","Relations Between Monopoles, Instantons and Chiral Condensate","Talk presented at the Workshop on QCD: Confinement, Collisions, and
  Chaos, at The American University of Paris, 3-8 June, 1996; 5 pages, 9 eps
  figures",,,,"hep-lat",,"  We analyze the interplay of topological objects in four dimensional QCD. The
distributions of color magnetic monopoles obtained in the maximum abelian gauge
are computed around instantons in both pure and full QCD. We find an enhanced
probability of encountering monopoles inside the core of an instanton on gauge
field average. For specific gauge field configurations we visualize the
situation graphically. Moreover we investigate how monopole loops and
instantons are locally correlated with the chiral condensate.
","[{""version"":""v1"",""created"":""Fri, 21 Jun 1996 15:34:07 GMT""}]","2007-05-23"
"hep-ph/9606388","Nir Polonsky","Hans-Peter Nilles and Nir Polonsky","Supersymmetric Neutrino Masses, R Symmetries, and The Generalized mu
  Problem","30 pages (including 3 postscript figures) + 1 bitmapped postscript
  figure submitted separately. LaTex + RevTex 3","Nucl.Phys. B484 (1997) 33-62","10.1016/S0550-3213(96)00511-1","TUM-HEP-245/96, SFB-375/97, LMU-TPW-96-09","hep-ph",,"  In supersymmetric models a tree-level neutrino mass could originate from the
(weak-scale) superpotential. We propose and examine a realization of that idea,
which arises naturally in the framework of a spontaneously broken U(1)
R-symmetry. The solution to the neutrino mass problem could shed light in this
framework on the possible resolution of the $\mu$ problem. Furthermore, the
suppression of the neutrino mass in comparison to the weak scale arises
dynamically and need not be encoded in the superpotential. The latter mechanism
operates, for example, in universal models for the soft supersymmetry breaking
terms. Phenomenological and cosmological implications of the model are also
discussed, some of which are shown to hold more generally. We also note that
future signatures could include observable enhancement of dijet and multijet
production rates and a correlation between the supersymmetric and neutrino
spectra.
","[{""version"":""v1"",""created"":""Thu, 20 Jun 1996 18:18:26 GMT""}]","2009-10-28"
"hep-ph/9606392","Darrell Tonge","C.J.Maxwell and D.G.Tonge (Centre for Particle Theory, Durham)","RS-invariant all-orders renormalon resummations for some QCD observables","25 pages, uses LaTeX, 12 Postscript figures, epsfig.sty 'elsart.sty'
  and 'elsart12.sty' are available via anonymous-ftp at
  ftp://ftp.tex.ac.uk/tex-archive/macros/latex/contrib/supported/elsevier","Nucl.Phys. B481 (1996) 681-703","10.1016/S0550-3213(96)00532-9","DTP/96/52","hep-ph",,"  We propose a renormalon-inspired resummation of QCD perturbation theory based
on approximating the renormalization scheme (RS) invariant effective charge
beta-function coefficients by the portion containing the highest power of
$b$=$\frac{1}{6}(11N$--$2N_{f})$, for SU($N$) QCD with $N_{f}$ quark flavours.
This can be accomplished using exact large-$N_{f}$ all-orders results. The
resulting resummation is RS-invariant and the exact next-to-leading order (NLO)
and next-to-NLO (NNLO) coefficients in any RS are included. This improves on a
previously employed naive resummation of the leading-$b$ piece of the
perturbative coefficients which is RS-dependent, making its comparison with
fixed-order perturbative results ambiguous. The RS-invariant resummation is
used to assess the reliability of fixed-order perturbation theory for the
$e^{+}e^{-}$ $R$-ratio, the analogous $\tau$-lepton decay ratio $R_{\tau}$, and
Deep Inelastic Scattering (DIS) sum rules, by comparing it with the exact NNLO
results in the effective charge RS. For the $R$-ratio and $R_{\tau}$, where
large-order perturbative behaviour is dominated by a leading ultra-violet
renormalon singularity, the comparison indicates fixed-order perturbation
theory to be very reliable. For DIS sum rules, which have a leading infra-red
renormalon singularity, the performance is rather poor. In this way we estimate
that at LEP/SLD energies ideal data on the $R$-ratio could determine
$\alpha_{s}(M_{Z})$ to three-significant figures, and for the $R_{\tau}$ we
estimate a theoretical uncertainty $\delta\alpha_{s}(m_{\tau})\simeq0.008$
corresponding to $\delta\alpha_{s}(M_{Z})\simeq0.001$. This encouragingly small
uncertainty is much less than has recently been deduced from comparison with
the ambiguous naive resummation.
","[{""version"":""v1"",""created"":""Thu, 20 Jun 1996 20:40:01 GMT""}]","2009-10-28"
"hep-ph/9606395","Jerzy Szwed","Wojciech Slominski (Jagellonian University) and Jerzy Szwed (BNL and
  Jagellonian University)","On the Electron Structure Function","27 pages, 9 figures; Acta Physica Polonica B, dedicated to Andrzej
  Bialas in honour of his 60th birthday","Acta Phys.Polon. 27 (1996) 1887-1914",,"TPJU-13/96","hep-ph",,"  The collinear QCD structure of the electron is studied within the Standard
Model. The electron structure function is defined and calculated in leading
logarithmic approximation. It shows important contribution from the
interference of the intermediate electroweak bosons. The problem of momentum
scales is extensively discussed. The master equations for the QCD parton
densities inside the electron are constructed and solved numerically in the
asymptotic region. Significant corrections to the naive evolution procedure are
found. Phenomenological applications at present and future momentum scales are
discussed.
","[{""version"":""v1"",""created"":""Thu, 20 Jun 1996 17:06:05 GMT""}]","2007-05-23"
"hep-ph/9606396","Christopher Kolda","Chris Kolda (Institute for Advanced Study, Princeton)","Leptophobic U(1)'s and R_b, R_c at LEP","LaTeX, 4 pages, 1 embedded EPSF figure. Talk given at Fourth
  International Conference on Supersymmetry (SUSY-96), College Park, Maryland,
  May 29 - June 1, 1996","Nucl.Phys.Proc.Suppl.52A:120-126,1997","10.1016/S0920-5632(96)00547-6","IASSNS-HEP-96/65","hep-ph",,"  In the context of explaining the experimental deviations in R_b and R_c from
their Standard Model predictions, a new type of U(1) interaction is proposed
which couples only to quarks. Special attention will be paid to the
supersymmetric \eta-model coming from E_6 which, due to kinetic mixing effects,
may play the role of the leptophobic U(1). This talk summarizes work done with
K.S. Babu and J. March-Russell in hep-ph/9603212.
","[{""version"":""v1"",""created"":""Thu, 20 Jun 1996 16:18:39 GMT""}]","2011-01-25"
"hep-ph/9606397","Francisco Larios","F. Larios and C.-P. Yuan (MSU)","Top Quark Interactions and the Search for New Physics","48 pages, LaTeX, 12 eps figures, uses psfig.tex. To appear on Phys.
  Rev. D. Corrections in several sections, and in some equations, including
  amplitudes. Spelling, typos and some references have been corrected","Phys.Rev.D55:7218-7240,1997","10.1103/PhysRevD.55.7218","MSUHEP-60620","hep-ph",,"  We give a complete set of 19 independent effective dimension 5 interactions
involving the top and bottom quarks with the electroweak gauge bosons within
the context of the chiral Lagrangian. The anomalous operators contribute to the
leading energy power E^3 of the V_L V_L -> t\bar t or t\bar b amplitudes. We
also show the top quark production rates at the LHC and the LC via V_L V_L
fusion processes. If no anomalous production rate is found, then these
coefficients can be bound (based on the naive dimensional analysis) to be of
order 10^{-2} or 10^{-1}. This is about an order of magnitude more stringent
than the bounds for the next-to-leading order bosonic operators commonly
studied in V_L V_L -> V_L V_L scatterings. The effect on a CP-odd observable is
also briefly discussed.
","[{""version"":""v1"",""created"":""Thu, 20 Jun 1996 23:34:37 GMT""},{""version"":""v2"",""created"":""Sun, 2 Feb 1997 18:52:02 GMT""}]","2014-11-17"
"hep-ph/9606398","Doreen Wackeroth","Doreen Wackeroth, Wolfgang Hollik","Electroweak Radiative Corrections to Resonant Charged Gauge Boson
  Production","49 pages, LaTeX source and 17 postscript figures, revised version
  with few minor changes, accepted for publication in Phys.Rev.D","Phys.Rev.D55:6788-6818,1997","10.1103/PhysRevD.55.6788","Fermilab-Pub-96/094-T and KA-TP-12-1996","hep-ph",,"  The electroweak O(alpha) contribution to the resonant single W production in
a general 4-fermion process is discussed with particular emphasis on a gauge
invariant decomposition into a QED-like and weak part. The cross section in the
vicinity of the resonance can be represented in terms of a convolution of a
`hard' Breit-Wigner-cross section, comprising the (m_t,M_H)-dependent weak
1-loop corrections, with an universal radiator function. The numerical impact
of the various contributions on the W line shape are discussed, together with
the concepts of s-dependent and constant width approach. Analytic formulae for
the W decay width are also provided including the 1-loop electroweak and QCD
corrections.
","[{""version"":""v1"",""created"":""Thu, 20 Jun 1996 22:36:32 GMT""},{""version"":""v2"",""created"":""Tue, 18 Feb 1997 19:37:46 GMT""}]","2008-11-26"
"hep-ph/9606399","Wu-Ki Tung","H.L. Lai, J. Huston, S. Kuhlmann, F. Olness, J. Owens, D. Soper, W.K.
  Tung, H. Weerts","Improved Parton Distributions from Global Analysis of Recent Deep
  Inelastic Scattering and Inclusive Jet Data","39 pages, 21 figures; Web page address corrected; Mislabelled table
  rows corrected; Table for CTEQ4LQ added; reformatted for pub. in Phys.Rev","Phys.Rev.D55:1280-1296,1997","10.1103/PhysRevD.55.1280","MSUHEP-60426 \\ CTEQ-604","hep-ph",,"  The impact of recent precision measurements of DIS structure functions and
inclusive jet production at the Tevatron on the global QCD analysis of parton
distribution functions is studied in detail. Particular emphasis is placed on
exploring the range of variation of the gluon distribution $G(x,Q)$ allowed by
these new data. The strong coupling of $G(x,Q)$ with $\alpha_s$ is fully taken
into account. A new generation of CTEQ parton distributions, CTEQ4, is
presented. It consists of the three standard sets (\mbox{\small {$\overline
{\rm MS}$}}, {\protect \small DIS} and leading order), a series that gives a
range of parton distributions with corresponding $\alpha_s$'s, and a set with a
low starting value of $Q$. Previously obtained gluon distributions that are
consistent with the high $E_t$ jet cross-section are also discussed in the
context of this new global analysis.
","[{""version"":""v1"",""created"":""Fri, 21 Jun 1996 07:36:19 GMT""},{""version"":""v2"",""created"":""Sat, 10 Aug 1996 04:31:04 GMT""}]","2008-11-26"
"hep-ph/9606400","Tadeusz Wibig","Tadeusz Wibig (University of Lodz)","Estimation of distribution parameters from statistically limited
  information; muons in KASCADE experiment","18p; 6 figs",,,"ZPK-UL-960620","hep-ph",,"  The problem of the estimation of distribution parameters in the case of
experimentally limited information is discussed. As an example the
determination of the total number of muons in Extensive Air Showers registered
in the KASCADE experiment is studied in details. Some methods based on other
than standard maximum-likelihood approach are examined. The advantages of the
new methods are shown. The comparison with the Artificial Neural Network
approach is also given.
","[{""version"":""v1"",""created"":""Fri, 21 Jun 1996 08:04:26 GMT""}]","2007-05-23"
"hep-ph/9606401","Grzegorz Wilk","G.Wilk and Z.Wlodarczyk","Propagation of Strange Quark Matter in the Atmosphere","uuencoded gz-compressed .tar file containing LaTeX file and 3
  postscript files with figures, 8 pages altogether (uses art10.sty and
  hhep.sty which are attached). Talk presented at Strangeness'96 Workshop,
  Budapest, May 15-17, 1996 to be published in Heavy Ion Phys. (1996)",,"10.1007/BF03155636",,"hep-ph nucl-th",,"  We propose model of propagation of lumps of Strange Quark Matter
(strangelets) through the atmosphere, which accounts for their apparent strong
penetrability and normal nuclear-type sizes at the same time. The mass spectrum
of strangelets reaching the Earth predicted by this model agrees very well with
the existing data on the abundance of different elemets in the Universe.
","[{""version"":""v1"",""created"":""Fri, 21 Jun 1996 10:01:26 GMT""}]","2022-02-23"
"hep-ph/9606402","Bing An Li","Bing An Li (Dept. of Physics and Astronomy, Univ. of Kentucky)","Theory of tau mesonic decays","55 pages, 9 figures. This is the replacement of the previous paper.
  Most changes are made in the decay tau-->K^{*}\pi","Phys.Rev.D55:1436-1452,1997","10.1103/PhysRevD.55.1436","UK/96-04","hep-ph",,"  A theory of tau mesonic decays is proposed. The general formula of the
axial-vector currents of mesons is presented. The meson vertices are obtained
from an effective chiral theory of mesons. The vertices depend on momentum.
Many decay modes are studied. Theoretical results agree reasonably well with
the data. There are predictions.
","[{""version"":""v1"",""created"":""Fri, 21 Jun 1996 13:24:09 GMT""},{""version"":""v2"",""created"":""Tue, 23 Jul 1996 12:09:07 GMT""},{""version"":""v3"",""created"":""Mon, 4 Nov 1996 16:44:31 GMT""}]","2008-11-26"
"hep-ph/9606403","Taco Nieuwenhuis","Taco Nieuwenhuis and J.A. Tjon (Institute for Theoretical Physics,
  University of Utrecht, the Netherlands)","Nonperturbative study of generalized ladder graphs in a \phi^2\chi
  theory","5 pages revtex, 3 Postscripts figures, uses epsf.sty, accepted for
  publication in Physical Review Letters","Phys.Rev.Lett. 77 (1996) 814-817","10.1103/PhysRevLett.77.814","THU-96/23","hep-ph nucl-th",,"  The Feynman-Schwinger representation is used to construct scalar-scalar bound
states for the set of all ladder and crossed-ladder graphs in a \phi^2\chi
theory in (3+1) dimensions. The results are compared to those of the usual
Bethe-Salpeter equation in the ladder approximation and of several
quasi-potential equations. Particularly for large couplings, the ladder
predictions are seen to underestimate the binding energy significantly as
compared to the generalized ladder case, whereas the solutions of the
quasi-potential equations provide a better correspondence. Results for the
calculated bound state wave functions are also presented.
","[{""version"":""v1"",""created"":""Fri, 21 Jun 1996 15:33:00 GMT""}]","2009-10-28"
"hep-ph/9606405",,"I.I. Bigi (Univ. of Notre Dame)","Treating the Lifetimes of Charm and Beauty Hadrons with QCD Plus a Bit
  More!","LATEX file, 14 pages, SPROCL.STY style file appended at the end; talk
  given at the Second Workshop on ""Continuous Advances in QCD"", March 1996",,,"UND-HEP-96-BIG01","hep-ph",,"  The heavy quark expansion implemented through an operator product expansion
provides us with a treatment of inclusive decays of beauty and charm hadrons
that is genuinely derived from QCD,though it requires one additional
assumption, namely that of 'local' quark-hadron duality. Subtleties in the
application of factorization to hadronic expectation values are pointed out.
The observed pattern in the charm lifetime ratios is reproduced in a
semi-quantitative manner. The ratio $\tau (\Lambda _b)/\tau (B_d)$ cannot be
pushed significantly below 0.9 -- unless one invokes a new hitherto unknown
paradigm for evaluating baryonic matrix elements. One confidently predicts
$\tau (B^-)$ to exceed $\tau (B_d)$ by several percent only. Failure of those
predictions would force us to pay a hefty theoretical price, namely ultimately
to abandon local duality as a practical concept.
","[{""version"":""v1"",""created"":""Fri, 21 Jun 1996 15:40:04 GMT""}]","2007-05-23"
"hep-ph/9606413","Tadeusz Wibig","Tadeusz Wibig (University of Lodz)","Experimental Information on the Mass Composition of Primary Cosmic Rays
  Using the KASCADE array","18p; 17 figs",,,"ZPK-UL-960621","hep-ph",,"  A procedure is proposed to extract experimental information about the primary
cosmic Ray composition from the data taken with the KASCADE setup.
","[{""version"":""v1"",""created"":""Fri, 21 Jun 1996 10:20:00 GMT""}]","2007-05-23"
"hep-th/9606129","Yutaka Hosotani","Y. Hosotani, R. Rodriguez, J.E. Hetrick, and S. Iso","Confinement and Chiral Dynamics in the Multi-flavor Schwinger Model","9 pages. 3 ps files and sprocl.sty attached. To appear in the
  Proceedings of the QCD 96 workshop (March, Minnesota)",,,"UMN-TH-1430/96, AZPH-TH/96-15","hep-th hep-lat hep-ph",,"  Two-dimensional QED with $N$ flavor fermions is solved at zero and finite
temperature with arbitrary fermion masses to explore QCD physics such as chiral
condensate and string tension. The problem is reduced to solving a
Schr\""odinger equation for $N$ degrees of freedom with a specific potential
determined by the ground state of the Schr\""odinger problem itself.
","[{""version"":""v1"",""created"":""Thu, 20 Jun 1996 16:46:07 GMT""}]","2007-05-23"
