"hep-th/9606130","Michael Flohr","Michael Flohr","2-Dimensional Turbulence: yet another Conformal Field Theory Solution","11 pages, LaTeX (or better LaTeX2e), no figures, also available at
  http://www.sns.ias.edu/~flohr/, only the report number and three typos are
  corrected","Nucl.Phys. B482 (1996) 567-578","10.1016/S0550-3213(96)00563-9","IASSNS-HEP-96/69","hep-th chao-dyn nlin.CD",,"  A new conformal field theory description of two-dimensional turbulence is
proposed. The recently established class of rational logarithmic conformal
field theories provides a unique candidate solution which resolves many of the
drawbacks of former approaches via minimal models. This new model automatically
includes magneto-hydrodynamic turbulence and the Alf'ven effect.
","[{""version"":""v1"",""created"":""Thu, 20 Jun 1996 17:02:35 GMT""},{""version"":""v2"",""created"":""Fri, 21 Jun 1996 16:12:05 GMT""}]","2009-10-30"
"hep-th/9606131","Yuri N. Obukhov","Yuri N. Obukhov and Franz E. Schunck","Vortices, flux tubes and other structures in the Ginzburg-Landau model:
  a possible fine structure of the mixed state?","13 p., Revtex, 5 postscript figures included",,,,"hep-th cond-mat gr-qc supr-con",,"  We present new regular static isolated cylindrically symmetric solutions for
the Ginzburg-Landau model which have finite Gibbs free energy. These
configurations (which we call the {\it flux tube} and {\it type B} solutions)
are energetically favorable in the interval of the external magnetic fields
between the thermodynamic critical value $H_{c}$ and the upper critical field
$H_{c_2}$ which indicates that they are important new elements of the mixed
state describing a transition from vortices to the normal state.
","[{""version"":""v1"",""created"":""Thu, 20 Jun 1996 17:09:59 GMT""}]","2007-05-23"
"hep-th/9606132",,"Giampiero Esposito, Alexander Yu. Kamenshchik and Klaus Kirsten","One-Loop Effective Action for Euclidean Maxwell Theory on Manifolds with
  Boundary","25 pages, Revtex","Phys.Rev. D54 (1996) 7328-7337","10.1103/PhysRevD.54.7328","DSF preprint 96/27","hep-th",,"  This paper studies the one-loop effective action for Euclidean Maxwell theory
about flat four-space bounded by one three-sphere, or two concentric
three-spheres. The analysis relies on Faddeev-Popov formalism and
$\zeta$-function regularization, and the Lorentz gauge-averaging term is used
with magnetic boundary conditions. The contributions of transverse,
longitudinal and normal modes of the electromagnetic potential, jointly with
ghost modes, are derived in detail. The most difficult part of the analysis
consists in the eigenvalue condition given by the determinant of a $2 \times 2$
or $4 \times 4$ matrix for longitudinal and normal modes. It is shown that the
former splits into a sum of Dirichlet and Robin contributions, plus a simpler
term. This is the quantum cosmological case. In the latter case, however, when
magnetic boundary conditions are imposed on two bounding three-spheres, the
determinant is more involved. Nevertheless, it is evaluated explicitly as well.
The whole analysis provides the building block for studying the one-loop
effective action in covariant gauges, on manifolds with boundary. The final
result differs from the value obtained when only transverse modes are
quantized, or when noncovariant gauges are used.
","[{""version"":""v1"",""created"":""Thu, 20 Jun 1996 17:17:58 GMT""}]","2009-10-30"
"hep-th/9606133","Govindan Rajesh","Philip Candelas, Eugene Perevalov and Govindan Rajesh","F-Theory Duals of Nonperturbative Heterotic E8xE8 Vacua in Six
  Dimensions","24 pages, LaTex, no figures. Significant errors corrected, leading to
  a modification of some of our conclusions. References added","Nucl.Phys. B502 (1997) 613-628","10.1016/S0550-3213(97)00375-1","UTTG-08-96","hep-th",,"  We present a systematic way of generating F-theory models dual to
nonperturbative vacua (i.e., vacua with extra tensor multiplets) of heterotic
E8xE8 strings compactified on K3, using hypersurfaces in toric varieties. In
all cases, the Calabi-Yau is an elliptic fibration over a blow up of the
Hirzebruch surface F_n. We find that in most cases the fan of the base of the
elliptic fibration is visible in the dual polyhedron of the Calabi-Yau, and
that the extra tensor multiplets are represented as points corresponding to the
blow-ups of the F_n.
","[{""version"":""v1"",""created"":""Thu, 20 Jun 1996 21:11:10 GMT""},{""version"":""v2"",""created"":""Thu, 20 Mar 1997 20:57:24 GMT""}]","2009-10-30"
"hep-th/9606134","G. Kunstatter","A. Barvinsky (Lebedev Physics Institute) and G. Kunstatter (University
  of Winnipeg)","Exact Physical Black Hole States in Generic 2-D Dilaton Gravity","11 pages, Revtex","Phys.Lett. B389 (1996) 231-237","10.1016/S0370-2693(96)01261-0","MIT-CTP-2528","hep-th gr-qc",,"  The quantum mechanics of black holes in generic 2-D dilaton gravity is
considered. The Hamiltonian surface terms are derived for boundary conditions
corresponding to an eternal black hole with slices on the interior ending on
the horizon bifurcation point. The quantum Dirac constraints are solved exactly
for these boundary conditions to yield physical eigenstates of the energy
operator. The solutions are obtained in terms of geometrical phase space
variables that were originally used by Cangemi, Jackiw and Zwiebach in the
context of string inspired dilaton gravity. The spectrum is continuous in the
Lorentzian sector, but in the Euclidean sector the thermodynamic entropy must
be $2\pi n/G$ where $n$ is an integer. The general class of models considered
contains as special cases string inspired dilaton gravity, Jackiw-Teitelboim
gravity and spherically symmetry gravity.
","[{""version"":""v1"",""created"":""Thu, 20 Jun 1996 21:02:20 GMT""}]","2009-10-30"
"hep-th/9606135",,"Mary K. Gaillard, Vidyut Jain and Kamran Saririan","Supergravity Coupled to Chiral and Yang-Mills Matter at One Loop","14 pages","Phys.Lett. B387 (1996) 520-528","10.1016/0370-2693(96)01084-2","LBL-37697, UCB-PTH-95/31, ITP-SB-95-38","hep-th hep-ph",,"  We present the full result for the divergent one-loop contribution to the
effective boson Lagrangian for supergravity coupled to chiral and Yang-Mills
supermultiplets. We also consider the specific case of dilaton couplings in
effective supergravity Lagrangians from superstrings, for which the one-loop
result is considerably simplified.
","[{""version"":""v1"",""created"":""Thu, 20 Jun 1996 22:55:26 GMT""}]","2009-10-30"
"hep-th/9606136","Amihay Hanany","Amihay Hanany and Igor R. Klebanov","On Tensionless Strings in $3+1$ Dimensions","latex, 16 pages; version to appear in Nucl. Phys. B","Nucl.Phys. B482 (1996) 105-118","10.1016/S0550-3213(96)00540-8","IASSNS-HEP-96/68, PUPT-1630","hep-th",,"  We argue for the existence of phase transitions in $3+1$ dimensions
associated with the appearance of tensionless strings. The massless spectrum of
this theory does not contain a graviton: it consists of one $N=2$ vector
multiplet and one linear multiplet, in agreement with the light-cone analysis
of the Green-Schwarz string in $3+1$ dimensions. In M-theory the string
decoupled from gravity arises when two 5-branes intersect over a
three-dimensional hyperplane. The two 5-branes may be connected by a 2-brane,
whose boundary becomes a tensionless string with $N=2$ supersymmetry in $3+1$
dimensions. Non-critical strings on the intersection may also come from
dynamical 5-branes intersecting the two 5-branes over a string and wrapped over
a four-torus. The near-extremal entropy of the intersecting 5-branes is
explained by the non-critical strings originating from the wrapped 5-branes.
","[{""version"":""v1"",""created"":""Fri, 21 Jun 1996 02:56:42 GMT""},{""version"":""v2"",""created"":""Mon, 1 Jul 1996 21:52:56 GMT""},{""version"":""v3"",""created"":""Wed, 2 Oct 1996 14:33:21 GMT""}]","2009-10-30"
"hep-th/9606137","Charles Nash","Charles Nash and Denjoe O' Connor","Modular invariance, lattice field theories and finite size corrections","25 pages Plain TeX","Annals Phys. 273 (1999) 72-98","10.1006/aphy.1998.5868",,"hep-th cond-mat hep-lat",,"  We give a lattice theory treatment of certain one and two dimensional quantum
field theories. In one dimension we construct a combinatorial version of a
non-trivial field theory on the circle which is of some independent interest in
itself while in two dimensions we consider a field theory on a toroidal
triangular lattice. We take a continuous spin Gaussian model on a toroidal
triangular lattice with periods $L_0$ and $L_1$ where the spins carry a
representation of the fundamental group of the torus labeled by phases $u_0$
and $u_1$. We compute the {\it exact finite size and lattice corrections}, to
the partition function $Z$, for arbitrary mass $m$ and phases $u_i$. Summing
$Z^{-1/2}$ over a specified set of phases gives the corresponding result for
the Ising model on a torus. An interesting property of the model is that the
limits $m\rightarrow0$ and $u_i\rightarrow0$ do not commute. Also when $m=0$
the model exhibits a {\it vortex critical phase} when at least one of the $u_i$
is non-zero. In the continuum or scaling limit, for arbitrary $m$, the finite
size corrections to $-\ln Z$ are {\it modular invariant} and for the critical
phase are given by elliptic theta functions. In the cylinder limit
$L_1\rightarrow\infty$ the ``cylinder charge'' $c(u_0,m^2L_0^2)$ is a
non-monotonic function of $m$ that ranges from $2(1+6u_0(u_0-1))$ for $m=0$ to
zero for $m\rightarrow\infty$ but from which one can determine the central
charge $c$. The study of the continuum limit of these field theories provides a
kind of quantum theoretic analog of the link between certain combinatorial and
analytic topological quantities.
","[{""version"":""v1"",""created"":""Fri, 21 Jun 1996 11:09:00 GMT""}]","2009-10-30"
"hep-th/9606138","Alexander Lewis","J.-S. Caux, I. Kogan, A. Lewis and A. M. Tsvelik (Oxford University)","Logarithmic Operators and Dynamical Extention of The Symmetry Group in
  the Bosonic SU(2)_0 and SUSY SU(2)_2 WZNW Models","16 pages, Latex","Nucl.Phys. B489 (1997) 469-484","10.1016/S0550-3213(97)00011-4","OUTP-96-33P","hep-th",,"  We study the operator product expansion in the bosonic $SU(2)_0$ and SUSY
$SU(2)_2$ WZNW models. We find that these OPEs contain both logarithmic
operators and new conserved currents, leading to an extension of the symmetry
group.
","[{""version"":""v1"",""created"":""Fri, 21 Jun 1996 11:25:36 GMT""}]","2009-10-30"
"mtrl-th/9606002","Emil Briggs","E.L. Briggs, D.J. Sullivan, and J. Bernholc (NCSU, Raleigh, NC)","Multigrid Methods in Electronic Structure Calculations","RevTeX preprint format, 41 pages, 4 postscript figures",,,,"mtrl-th cond-mat.mtrl-sci",,"  We describe a set of techniques for performing large scale ab initio
calculations using multigrid accelerations and a real-space grid as a basis.
The multigrid methods provide effective convergence acceleration and
preconditioning on all length scales, thereby permitting efficient calculations
for ill-conditioned systems with long length scales or high energy cut-offs. We
discuss specific implementations of multigrid and real-space algorithms for
electronic structure calculations, including an efficient multigrid-accelerated
solver for Kohn-Sham equations, compact yet accurate discretization schemes for
the Kohn-Sham and Poisson equations, optimized pseudo\-potentials for
real-space calculations, efficacious computation of ionic forces, and a
complex-wavefunction implementation for arbitrary sampling of the Brillioun
zone. A particular strength of a real-space multigrid approach is its ready
adaptability to massively parallel computer architectures, and we present an
implementation for the Cray-T3D with essentially linear scaling of the
execution time with the number of processors. The method has been applied to a
variety of periodic and non-periodic systems, including disordered Si, a N
impurity in diamond, AlN in the wurtzite structure, and bulk Al. The high
accuracy of the atomic forces allows for large step molecular dynamics; e.g.,
in a 1 ps simulation of Si at 1100 K with an ionic step of 80 a.u., the total
energy was conserved within 27 microeV per atom.
","[{""version"":""v1"",""created"":""Fri, 21 Jun 1996 12:23:11 GMT""}]","2008-02-03"
"nucl-th/9606043","Petr Navratil","P Navratil (University of Arizona), H B Geyer (University of
  Stellenbosch), J Dobaczewski (Warsaw University)","Boson-fermion mapping and dynamical supersymmetry in fermion models","20 pages. Revtex. One PostScript figure available on request from PN","Nucl.Phys. A607 (1996) 23-42","10.1016/0375-9474(96)00228-X",,"nucl-th",,"  We show that a dynamical supersymmetry can appear in a purely fermionic
system. This ``supersymmetry without bosons"" is constructed by application of a
recently introduced boson-fermion Dyson mapping from a fermion space to a space
comprised of collective bosons and ideal fermions. In some algebraic fermion
models of nuclear structure, particular Hamiltonians may lead to collective
spectra of even and odd nuclei that can be unified using the dynamical
supersymmetry concept with Pauli correlations exactly taken into account.
","[{""version"":""v1"",""created"":""Thu, 20 Jun 1996 21:36:49 GMT""}]","2009-10-30"
"nucl-th/9606044",,"Thomas D. Cohen","Regularization, Renormalization and Range: The Nucleon-Nucleon
  Interaction from Effective Field Theory","7 pages","Phys.Rev.C55:67-72,1997","10.1103/PhysRevC.55.67","DOE/ER/40762-087; U. of MD PP# 96-112","nucl-th hep-ph",,"  Regularization and renormalization is discussed in the context of low-energy
effective field theory treatments of two or more heavy particles (such as
nucleons). It is desirable to regulate the contact interactions from the outset
by treating them as having a finite range. The low energy physical observables
should be insensitive to this range provided that the range is of a similar or
greater scale than that of the interaction. Alternative schemes, such as
dimensional regularization, lead to paradoxical conclusions such as the
impossibility of repulsive interactions for truly low energy effective theories
where all of the exchange particles are integrated out. This difficulty arises
because a nonrelativistic field theory with repulsive contact interactions is
trivial in the sense that the $S$ matrix is unity and the renormalized coupling
constant zero. Possible consequences of low energy attraction are also
discussed. It is argued that in the case of large or small scattering lengths,
the region of validity of effective field theory expansion is much larger if
the contact interactions are given a finite range from the beginning.
","[{""version"":""v1"",""created"":""Fri, 21 Jun 1996 15:45:39 GMT""}]","2008-11-26"
"supr-con/9606002","Nobuhiko Hayashi","N. Hayashi, M. Ichioka, K. Machida (Okayama Univ.)","Star-shaped Local Density of States around Vortices in a Type II
  Superconductor","4 pages, REVTeX, 3 figures available upon request","Phys. Rev. Lett. 77, 4074 (1996).","10.1103/PhysRevLett.77.4074",,"supr-con cond-mat.supr-con",,"  The electronic structure of vortices in a type II superconductor is analyzed
within the quasi-classical Eilenberger framework. The possible origin of a
sixfold ``star'' shape of the local density of states, observed by scanning
tunneling microscope experiments on NbSe$_2$, is examined in the light of the
three effects; the anisotropic pairing, the vortex lattice, and the anisotropic
density of states at the Fermi surface. Outstanding features of split parallel
rays of this star are well explained in terms of an anisotropic $s$-wave
pairing. This reveals a rich internal electronic structure associated with a
vortex core.
","[{""version"":""v1"",""created"":""Fri, 21 Jun 1996 09:34:10 GMT""}]","2009-10-30"
