"astro-ph/9601032","Brian Fields","Brian D. Fields, Michel Casse, Elisabeth Vangioni-Flam, and Ken'ichi
  Nomoto","Nuclear and Gamma-ray Production by Supernova Ejecta","18 pages, written in aastex using aaspptwo.sty; 6 figures. Also
  available at http://www.nd.edu/~bfields/fcvn.html .","Astrophys.J. 462 (1996) 276-286","10.1086/177148","UND-A/95-10","astro-ph",,"  The fastest ejecta of supernova explosions propagate as a precursor to the
main supernova shock wave, and can be quite energetic. The spectrum of such
fast ejecta is estimated based on recent analytic and numerical supernova
models, and found to be a power law having a cutoff at an energy of order 10
MeV/nucl, the precise value of which depends on the supernova mass and
energetics. With cutoffs in this range there can be significant flux with
energies above the thresholds for $\gamma$-ray and Li, Be, and B production.
These nuclear interactions should inevitably accompany the passage of prompt
supernova ejecta through the surrounding medium. The fast particle composition
is that of the outermost layers of the progenitor; if the progenitor
experienced significant loss of its envelope to a companion or by mass loss,
then the composition is nonsolar, and in particular, metal-rich. Such a
composition and spectrum of fast particles is required to explain the recent
COMPTEL observations of $\gamma$-ray emission in Orion. Supernova ejecta from
one progenitor having lost a large amount of mass are shown to quantitatively
account for the Orion $\gamma$ rays, and to imply the presence of other, weaker
lines and of a supernova explosion in Orion in the last $\la 10^4$ years.
Implications for this mechanism as a mode of nucleosynthesis, and as a
potential supernova diagnostic, are discussed. Model dependences and
uncertainties are noted, and the need is shown for accurate measurements of
$\gamma$-ray and spallation production cross sections at energies near
threshold.
","[{""version"":""v1"",""created"":""Tue, 9 Jan 1996 16:38:59 GMT""}]","2009-10-28"
"astro-ph/9601033","Bennett Link","Bennett Link (Montana State) and Richard Epstein (Los Alamos)","Statistics of Gamma Ray Burst Temporal Asymmetry","13 pages, 3 postscript figures, uses aasms4.sty. Submitted to ApJ
  Letters",,"10.1086/177550",,"astro-ph",,"  We study the temporal asymmetry of over 600 bursts from the BATSE 3B catalog,
encompassing a 200-fold range in peak flux. By comparing the rates of rise and
fall of the flux near the highest burst peak, we find that about two-thirds of
the bursts exhibit a preferred asymmetry in the sense that the flux rises more
rapidly than it falls, confirming the conclusions of previous studies employing
smaller databases. The statistical significance of the average time asymmetry
of the sample is $>99.999$%; therefore, models that predict time symmetry of
the burst profile are ruled out. We find no statistically significant
correlation between burst temporal asymmetry and peak. This result is
consistent with both cosmological and local interpretations of the gamma ray
burst phenomenon.
","[{""version"":""v1"",""created"":""Tue, 9 Jan 1996 19:31:02 GMT""}]","2009-10-28"
"astro-ph/9601034","Neil Cornish","Neil J. Cornish, David N. Spergel, Glenn D. Starkman","Does Chaotic Mixing Facilitate Omega<1 Inflation?","Version to appear in Phys. Rev. Lett. July 1st, 1996. 4 Pages,
  RevTeX, no figures","Phys.Rev.Lett. 77 (1996) 215-218","10.1103/PhysRevLett.77.215","CWRU-P16-95","astro-ph gr-qc hep-th",,"  Yes, if the universe has compact topology. Inflation is currently the most
elegant explanation of why the universe is old, large, nearly flat, homogeneous
on large scales and structured on small scales. One of the weaknesses of the
inflationary paradigm is the problem of initial conditions for inflation: the
pre-inflationary universe must be somewhat old, somewhat large and somewhat
homogeneous. These initial condition requirements are even more severe in Omega
< 1 inflationary models: if the universe does not inflate enough to appear
flat, then it does not inflate enough to appear homogeneous. One solution is to
have two inflationary epochs. Here, we propose another solution to the problem
of pre-inflationary homogeneity: if the universe is compact, then during the
pre-inflationary period, there is sufficient time to homogenize the universe as
chaotic mixing smoothes out primordial fluctuations. Gradients in the
energy-density are reduced as e^(-kappa d), where kappa is the
Kolomogorov-Sinai entropy of the flow, and d is the distance the flow travels.
We explore this homogenization process, outline why compact negatively-curved
universes are the most natural, and conclude with a discussion of the
implications of living in such a universe.
","[{""version"":""v1"",""created"":""Tue, 9 Jan 1996 20:25:31 GMT""},{""version"":""v2"",""created"":""Mon, 3 Jun 1996 07:49:46 GMT""}]","2009-10-28"
"astro-ph/9601035","Byung-Il Jun","Byung-Il Jun (University of Minnesota) and Michael L. Norman
  (University of Illinois)","On the Origin of Strong Magnetic Fields in Young Supernova Remnants","Accepted for the publication in ApJ, 31 pages, 16 Postscript figures",,"10.1086/177464",,"astro-ph",,"  Young supernova remnants such as Tycho generally exhibit a bright circular
clumpy shell in both radio and X-ray emission. For several young remnants,
various arguments suggest that the magnetic field is larger than can be
explained by compression of a few $\mu G$ ambient magnetic field by the shock
wave. Radio polarization studies reveal a net radial orientation of magnetic
fields in the shell which cannot be explained by the simple compression either.
We model Rayleigh-Taylor instability at the interface of the ejecta and the
shocked ambient medium to explain these observations. We have performed
multidimensional MHD simulations of the instability in the shell of a Type-I
supernova remnant for the first time utilizing a moving grid technique which
allows us to follow the growth of the instability and its effect on the local
magnetic field in detail. We find that the evolution of the instability is very
sensitive to the deceleration of the ejecta and the evolutionary stage of the
remnant. As the reverse shock enters the inner uniform density region,
Chevalier's self-similar stage ends and the thickness of radio shell increases
and the instability weakens. Our simulation shows that Rayleigh-Taylor and
Kelvin-Helmholtz instabilities amplify ambient magnetic fields locally by as
much as a factor of 60 around dense fingers due to stretching, winding, and
compression. Globally, the amount of magnetic-field amplification is low and
the magnetic energy density reaches only about 0.3% of the turbulent energy
density at the end of simulation. Strong magnetic field lines draped around the
fingers produce the radial B-vector polarization, whereas thermal
bremsstrahlung from the dense fingers themselves produce the clumpy X-ray
emission. As a result, the X-ray emission peaks inside of the radio emission.
","[{""version"":""v1"",""created"":""Tue, 9 Jan 1996 21:22:45 GMT""}]","2009-10-28"
"astro-ph/9601036","David Band","David L. Band (CASS/UCSD)","Sky Coverage and Burst Repetition","12 pages AASTeX 4.0, 3 figures on request from dband@ucsd.edu",,"10.1086/177350",,"astro-ph",,"  To investigate the repeater content of gamma ray burst samples I develop two
models where sources burst at a constant average rate. I find that the sky
coverage affects the number of repeaters in a sample predominantly through the
detector livetime, and that the number of bursts in the sample is the primary
parameter. Thus the repeater content of burst samples should be compared within
the context of a repetition model; a direct comparison between two samples is
possible only if the samples have similar sizes. The observed repeater fraction
may not be the actual fraction if the sources burst on average less than once
during the detector livetime. Sources which burst repeatedly during active
phases separated by more than the observation period must be treated
separately.
","[{""version"":""v1"",""created"":""Tue, 9 Jan 1996 22:32:12 GMT""}]","2009-10-28"
"astro-ph/9601037","Mike Isenberg","Michael Isenberg, D. Q. Lamb (U. Chicago), John C.L. Wang (U.
  Maryland)","Cyclotron Line Formation in a Relativistic Outflow","5 LaTeX pages with 1 Postscript figure included using psfig.sty, uses
  revtex.sty, aps.sty and aipbook.sty available at ftp://aps.org/ or
  http://aps.org/, to appear in Proc. 3rd Huntsville Gamma--Ray Burst
  Symposium, eds. C. Kouveliotou, M.S. Briggs and G.J. Fishman, (New York:AIP)",,"10.1063/1.51661",,"astro-ph",,"  There is mounting evidence that, if gamma-ray bursters are Galactic in
origin, they are located in a Galactic corona at distances greater than 100
kpc. This has created a need to explore new models of cyclotron line formation.
In most previous calculations the line-forming region was modeled as a static
slab of plasma, optically thin to continuum scattering, and threaded by a
magnetic field of the order $10^{12}$ gauss oriented normal to the slab. Such a
model is appropriate, for example, for the magnetic polar cap of a neutron star
with a dipole field. However, if bursters lie at distances farther than several
hundred parsecs, the burst luminosity exceeds the magnetic Eddington
luminosity, and the plasma in a line-forming region at the magnetic polar cap
would be ejected relativistically along the field lines. Mitrofanov and Tsygan
have modeled the dynamics of such an outflow, and Miller {\it et al.} have
calculated the properties of the cyclotron second and third harmonics,
approximating them as due to cyclotron absorption. Here we describe Monte Carlo
calculations of cyclotron resonant scattering at the first three harmonics in a
relativistic outflow from the magnetic polar cap, and show that such scattering
can produce narrow lines like those observed by Ginga.
","[{""version"":""v1"",""created"":""Tue, 9 Jan 1996 23:48:22 GMT""}]","2009-10-28"
"astro-ph/9601038","David Merritt","Benoit Tremblay and David Merritt (Rutgers)","Evidence from Intrinsic Shapes for Two Families of Elliptical Galaxies","9 TEX pages, 4 PostScript figures, uses AASTEX, epsf.sty. Submitted
  to The Astronomical Journal, January 1996; revised February 1996",,"10.1086/117959","Rutgers Astrophysics Preprint Series No. 183","astro-ph",,"  Bright elliptical galaxies have a markedly different distribution of Hubble
types than faint ellipticals; the division occurs near M_B=-20 and bright
ellipticals are rounder on average. The Hubble types of galaxies in both groups
are narrowly clustered, around E1.5 in the case of the bright galaxies and
around E3 for the fainter ones. The Hubble-type distribution of the faint
ellipticals is consistent with oblate symmetry, but the oblate hypothesis fails
for the bright ellipticals. However a distribution of triaxial intrinsic shapes
can successfully reproduce the apparent shape data for either group. The
distribution of intrinsic, short-to-long axis ratios is peaked around 0.75 for
bright galaxies and 0.65 for faint galaxies. Our results provide further
evidence that elliptical galaxies should be divided into two, morphologically
distinct families.
","[{""version"":""v1"",""created"":""Wed, 10 Jan 1996 01:21:21 GMT""},{""version"":""v2"",""created"":""Tue, 20 Feb 1996 02:28:04 GMT""}]","2009-10-28"
"astro-ph/9601039","Peter Schneider","Peter Schneider (Max-Planck-Institut f. Astrophysik)","Detection of (dark) matter concentrations via weak gravitational lensing","24 pages, Plain-Tex, no macros needed, including 10 figures,
  submitted to Monthly Notices of the Royal Astronomical Society; the result
  (15) and (16) of the paper was derived previously by Kaiser et al. (1994);
  proper reference is now given","Mon.Not.Roy.Astron.Soc.283:837-853,1996","10.1093/mnras/283.3.837","MPA 917","astro-ph",,"  The distortion of images of faint background galaxies by (weak) gravitational
lensing can be used to measure the mass distribution of the deflector. The
image distortions can be used to define a weighted mean of the mass inside a
circular aperture, as was first suggested by Kaiser. The aperture mass can be
used to {\it detect} dark matter concentrations. Keeping in mind that
wide-field cameras will become increasingly available, this method can be used
to search for mass concentrations on wide-field images. To do this, the
aperture mass measure is generalized to account for different weighting
functions. For each such weighting function, a signal-to-noise ratio can be
calculated. For an assumed mass profile of the density concentrations, the
weighting function can be chosen such as to maximize the resulting
signal-to-noise ratio. Numerical simulations which adopt parameters
characteristic of 4-m class telescopes are then used to show that dark halos
with a velocity dispersion in excess of $\sim 600$\ts km/s can be reliably
detected as significant peaks in the signal-to-noise map. The effects of seeing
and an anisotropic PSF are then investigated and shown to be less important
than might be feared. It is thus suggested that the method of aperture mass
measures developed here can be used to obtain a mass-selected sample of dark
halos, in contrast to flux-selected samples. Shear fields around high-redshift
bright QSOs as detected by Fort et al. provide a first successful application
of this strategy. The simplicity of the method allows its routine application
to wide-field images of sufficient depth and image quality.
","[{""version"":""v1"",""created"":""Wed, 10 Jan 1996 09:03:20 GMT""},{""version"":""v2"",""created"":""Tue, 16 Jan 1996 08:20:41 GMT""}]","2015-06-24"
"astro-ph/9601040","Walter Dehnen","Walter Dehnen and James Binney (Oxford)","Dynamical Models for the Milky Way","10 pages, LaTeX, style file and 4 figures included. Invited talk
  presented at the meeting ``Formation of the Galactic Halo ... Inside and
  Out'', Tucson, October 9-11. Full .ps file available at
  ftp://ftp.physics.ox.ac.uk/pub/local/users/dehnen/MilkyWayModels.ps.gz",,,"OUTP-95-11A","astro-ph",,"  The only way to map the Galaxy's gravitational potential $\Phi({\bf x})$ and
the distribution of matter that produces it is by modelling the dynamics of
stars and gas. Observations of the kinematics of gas provide key information
about gradients of $\Phi$ within the plane, but little information about the
structure of $\Phi$ out of the plane. Traditional Galaxy models {\em assume},
for each of the Galaxy's components, arbitrary flattenings, which together with
the components' relative masses yield the model's equipotentials. However, the
Galaxy's isopotential surfaces should be {\em determined\/} directly from the
motions of stars that move far from the plane. Moreover, from the kinematics of
samples of such stars that have well defined selection criteria, one should be
able not only to map $\Phi$ at all positions, but to determine the distribution
function $f_i({\bf x},{\bf v})$ of each stellar population $i$ studied. These
distribution functions will contain a wealth of information relevant to the
formation and evolution of the Galaxy. An approach to fitting a wide class of
dynamical models to the very heterogeneous body of available data is described
and illustrated.
","[{""version"":""v1"",""created"":""Wed, 10 Jan 1996 09:21:39 GMT""}]","2007-05-23"
"astro-ph/9601041",,"Jacco Th. van Loon, Albert A. Zijlstra, Valentin Bujarrabal, Lars-Ake
  Nyman","Discovery of the first extra-galactic SiO maser","4 pages, accepted by Astron. Astrophys. Letters, for correspondence
  contact jvloon@eso.org","Astron.Astrophys.306:L29-L32,1996",,,"astro-ph",,"  We report on the detection of SiO J=2--1 v=1 (86 GHz) maser emission from the
red supergiant IRAS04553--6825 in the LMC. It has thereby become the first
known source of SiO maser emission outside the Milky Way. We used the
Swedish-ESO Submm Telescope at the European Southern Observatory at La Silla.
With the help of good atmospheric conditions, the excellent performance of the
brand new 3~mm SIS receiver, and 26 hours total observing time we reduced the
noise level to only 63~mJy rms. This allowed us to detect the 0.28~Jy maser
peak. Integrating the flux of the maser profile resulted in a 6.9~${\sigma}$
detection. The SiO maser peak was situated 16~km~s$^{-1}$ redward of the center
of the already known, double peaked OH maser emission. We argue that the SiO
maser peak velocity coincides with the stellar velocity, which is supported by
a spectrum of H$\alpha$ that we took four months later. This would mean that
the outflow velocity of the circumstellar matter around IRAS04553--6825 is
v$_{\rm exp} \sim 26$~km~s$^{-1}$, which is typical for galactic red
supergiants, instead of the abnormally low 11~km~s$^{-1}$ inferred from the OH
data alone. The peak intensity of the SiO maser emission is not incompatible
with ranges found in galactic RSGs, but the total integrated photon flux is
lower than expected for this extremely red and luminous supergiant.
","[{""version"":""v1"",""created"":""Wed, 10 Jan 1996 10:49:35 GMT""}]","2009-10-26"
"astro-ph/9601042","Shoichi Yamada","Shoichi Yamada","An Implicit Lagrangean Code for Spherically Symmetric General
  Relativistic Hydrodynamics with an Approximate Riemann Solver","AASTeX v4.0, 24 pages, 13 figures on request from
  shoichi@MPA-Garching.MPG.DE, submitted to ApJ",,"10.1086/303548","MPA 918","astro-ph",,"  An implicit Lagrangian hydrodynamics code for general relativistic spherical
collapse is presented. This scheme is based on an approximate linearized
Riemann solver (Roe type scheme). This code is aimed especially at the
calculation of the late phase of collapse-driven supernovae and the nascent
neutron star, where there is a remarkable contrast between the dynamical time
scale of the proto-neutron star and the diffusion time scale of neutrinos,
without such severe limitation of the Courant condition at the center of the
neutron star. Several standard test calculations have been done. Two other
adiabatic simulations have also been done in order to test the performance of
the code in the context of the collapse-driven supernovae. It is found that the
time step can be extended far beyond the Courant limitation at the center of
the neutron star. The details of the scheme and the results of these test
calculations are discussed.
","[{""version"":""v1"",""created"":""Wed, 10 Jan 1996 15:09:36 GMT""}]","2009-10-28"
"astro-ph/9601043","David A. Buote","David A. Buote and Claude R. Canizares (MIT)","The Twisting X-ray Isophotes of the Elliptical Galaxy NGC 720","17 pages (3 figures), AASTeX manuscript with PostScript figures, to
  appear in ApJ September 10, 1996. Only a few minor cosmetic changes in this
  version","Astrophys.J. 468 (1996) 184","10.1086/177680","CSR-96-01","astro-ph",,"  We present spatial analysis of the deep (57ks) ROSAT HRI X-ray image of the
E4 galaxy NGC 720. The orientation of the HRI surface brightness is consistent
with the optical position angle $(PA)$ interior to semi-major axis $a\sim
60\arcsec$ (optical $R_e\sim 50\arcsec$). For larger $a$ the isophotes twist
and eventually $(a\gtrsim 100\arcsec)$ orient along a direction consistent with
the $PA$ measured with the PSPC data (Buote & Canizares 1994) -- the $\sim
30\arcdeg$ twist is significant at an estimated 99% confidence level. We argue
that this twist is not the result of projected foreground and background
sources, ram pressure effects, or tidal distortions. If spheroidal symmetry and
a nearly isothermal hot gas are assumed, then the azimuthally averaged radial
profile displays features which, when combined with the observed $PA$ twist,
are inconsistent with the simple assumptions that the X-ray emission is due
either entirely to hot gas or to the combined emission from hot gas and
discrete sources. We discuss possible origins of the $PA$ twist and radial
profile features (e.g., triaxiality).
","[{""version"":""v1"",""created"":""Wed, 10 Jan 1996 15:56:30 GMT""},{""version"":""v2"",""created"":""Thu, 11 Apr 1996 15:47:29 GMT""}]","2009-10-28"
"chao-dyn/9601004","Anatoly Malevanets","Anatoly Malevanets, Agusti Careta, Raymond Kapral","Biscale Chaos in Propagating Fronts","Typeset using RevTeX, fig.1 and fig.4 are not available, mpeg
  simulations are at
  http://www.chem.utoronto.ca/staff/REK/Videos/front/front.html","Phys. Rev. E 52(5), 4724, 1995","10.1103/PhysRevE.52.4724",,"chao-dyn nlin.CD",,"  The propagating chemical fronts found in cubic autocatalytic
reaction-diffusion processes are studied. Simulations of the reaction-diffusion
equation near to and far from the onset of the front instability are performed
and the structure and dynamics of chemical fronts are studied. Qualitatively
different front dynamics are observed in these two regimes. Close to onset the
front dynamics can be characterized by a single length scale and described by
the Kuramoto-Sivashinsky equation. Far from onset the front dynamics exhibits
two characteristic lengths and cannot be modeled by this amplitude equation. An
amplitude equation is proposed for this biscale chaos. The reduction of the
cubic autocatalysis reaction-diffusion equation to the Kuramoto-Sivashinsky
equation is explicitly carried out. The critical diffusion ratio delta, where
the planar front loses its stability to transverse perturbations, is determined
and found to be delta=2.300.
","[{""version"":""v1"",""created"":""Wed, 10 Jan 1996 03:27:39 GMT""}]","2009-10-28"
"chao-dyn/9601005","Satoshi Yukawa","S. Yukawa and M. Kikuchi","Density Fluctuations in Traffic Flow","5 pages, Figures are available at
  http://bopper.phys.sci.osaka-u.ac.jp/yuk/density_fluct/dfluct.html or they
  will be sent upon request by e-mail",,"10.1143/JPSJ.65.916","OUCMT-95-6","chao-dyn adap-org cond-mat nlin.AO nlin.CD",,"  Density fluctuations in traffic current are studied by computer simulations
using the deterministic coupled map lattice model on a closed single-lane
circuit. By calculating a power spectral density of temporal density
fluctuations at a local section, we find a power-law behavior, $\sim
1/f^{1.8}$, on the frequency $f$, in non-congested flow phase. The distribution
of the headway distance $h$ also shows the power law like $\sim 1/h^{3.0} $ at
the same time. The power law fluctuations are destroyed by the occurence of the
traffic jam.
","[{""version"":""v1"",""created"":""Wed, 10 Jan 1996 12:53:17 GMT""}]","2009-10-28"
"cond-mat/9601028","Igor Vilfan","Igor Vilfan (J. Stefan Institute, Ljubljana)","Step Patterns on Vicinal Reconstructed Surfaces","11 pages with 5 eps figures in text. Uses psfig and elsart.sty
  (ELSEVIER Science). To be published in Surf. Sci",,"10.1016/0039-6028(95)01074-2",,"cond-mat",,"  Step patterns on vicinal $(2\times1)$ reconstructed surfaces of noble metals
Au(110) and Pt(110), miscut towards the (100) orientation, are investigated.
The free energy of the reconstructed surface with a network of crossing
opposite steps is calculated in the strong chirality regime when the steps
cannot make overhangs. It is explained why the steps are not perpendicular to
the direction of the miscut but form in equilibrium a network of crossing steps
which make the surface to look like a fish skin. The network formation is the
consequence of competition between the -- predominantly elastic -- energy loss
and entropy gain. It is in agreement with recent scanning-tunnelling-microscopy
observations on vicinal Au(110) and Pt(110) surfaces.
","[{""version"":""v1"",""created"":""Tue, 9 Jan 1996 16:00:59 GMT""}]","2009-10-28"
"cond-mat/9601029","Barbara Drossel","Barbara Drossel and Mehran Kardar (MIT)","Winding Angle Distributions for Random Walks and Flux Lines","12 pages Revtex and 9 postscript figures","Phys. Rev. E 53, 5861 (1996)","10.1103/PhysRevE.53.5861",,"cond-mat",,"  We study analytically and numerically the winding of a flux line around a
columnar defect. Reflecting and absorbing boundary conditions apply to marginal
or repulsive defects, respectively. In both cases, the winding angle
distribution decays exponentially for large angles, with a decay constant
depending only on the boundary condition, but not on microscopic features. New
{\it non-universal} distributions are encountered for {\it chiral} defects
which preferentially twist the flux line in one direction. The resulting
asymmetric distributions have decay constants that depend on the degree of
chirality. In particular, strong chirality encourages entanglements and leads
to broad distributions. We also examine the windings of flux lines in the
presence of point impurities (random bonds). Our results suggest that pinning
to impurities reduces entanglements, leading to a narrow (Gaussian)
distribution.
","[{""version"":""v1"",""created"":""Tue, 9 Jan 1996 22:48:04 GMT""}]","2009-10-28"
