"hep-th/9601038","Joe Polchinski","Eric G. Gimon, Joseph Polchinski","Consistency Conditions for Orientifolds and D-Manifolds","Reference added. 27 pages LaTeX, 2 epsf figures. To appear in
  Phys.Rev.D (15Jly96)","Phys.Rev.D54:1667-1676,1996","10.1103/PhysRevD.54.1667","NSF-ITP-96-01","hep-th",,"  We study superstrings with orientifold projections and with generalized open
string boundary conditions (D-branes). We find two types of consistency
condition, one related to the algebra of Chan-Paton factors and the other to
cancellation of divergences. One consequence is that the Dirichlet 5-branes of
the Type I theory carry a symplectic gauge group, as required by string
duality. As another application we study the Type I theory on a $K3$ $Z_2$
orbifold, finding a family of consistent theories with various unitary and
symplectic subgroups of $U(16) \times U(16)$. We argue that the $K3$ orbifold
with spin connection embedded in gauge connection corresponds to an interacting
conformal field theory in the Type I theory.
","[{""version"":""v1"",""created"":""Tue, 9 Jan 1996 19:49:57 GMT""},{""version"":""v2"",""created"":""Thu, 16 Mar 1995 23:22:55 GMT""},{""version"":""v3"",""created"":""Thu, 27 Jun 1996 00:12:13 GMT""}]","2009-10-09"
"hep-th/9601039","Schaden","Laurent Baulieu (LPTHE), Martin Schaden (New York University)","Gauge Group TQFT and Improved Perturbative Yang-Mills Theory","28 pages, uuencoded and compressed tar-file, LATEX+4 PS-figures, uses
  psfig.sty. New appendix and some clarifying modifications, references added","Int.J.Mod.Phys.A13:985-1012,1998","10.1142/S0217751X98000445","NYU-TH-96/01/05","hep-th hep-ph",,"  We reinterpret the Faddeev-Popov gauge-fixing procedure of Yang-Mills
theories as the definition of a topological quantum field theory for gauge
group elements depending on a background connection. This has the advantage of
relating topological gauge-fixing ambiguities to the global breaking of a
supersymmetry. The global zero modes of the Faddeev-Popov ghosts are handled in
the context of an equivariant cohomology without breaking translational
invariance. The gauge-fixing involves constant fields which play the role of
moduli and modify the behavior of Green functions at subasymptotic scales. At
the one loop level physical implications from these power corrections are gauge
invariant.
","[{""version"":""v1"",""created"":""Wed, 10 Jan 1996 02:46:44 GMT""},{""version"":""v2"",""created"":""Sun, 14 Jul 1996 22:08:18 GMT""}]","2008-11-26"
"hep-th/9601040","Gabor Takacs","Z. Horvath and G. Takacs","Form-factors of the sausage model obtained with bootstrap fusion from
  sine-Gordon theory","16 pages, revtex; references added, some typos corrected. Accepted
  for publication in Physical Review D","Phys.Rev. D53 (1996) 3272-3284","10.1103/PhysRevD.53.3272",,"hep-th",,"  We continue the investigation of massive integrable models by means of the
bootstrap fusion procedure, started in our previous work on O(3) nonlinear
sigma model. Using the analogy with SU(2) Thirring model and the O(3) nonlinear
sigma model we prove a similar relation between sine-Gordon theory and a
one-parameter deformation of the O(3) sigma model, the sausage model. This
allows us to write down a free field representation for the
Zamolodchikov-Faddeev algebra of the sausage model and to construct an integral
representation for the generating functions of form-factors in this theory. We
also clear up the origin of the singularities in the bootstrap construction and
the reason for the problem with the kinematical poles.
","[{""version"":""v1"",""created"":""Wed, 10 Jan 1996 10:15:14 GMT""},{""version"":""v2"",""created"":""Thu, 11 Jan 1996 18:33:52 GMT""}]","2009-10-30"
"hep-th/9601041","Jan Plefka","Jan C. Plefka","Supersymmetric Generalizations of Matrix Models","PhD Thesis at the University of Hannover, 53 pages in landscape,
  LaTeX 2e version, uses NFSS2; no changes in contents",,,"DESY 95-234, ITP-UH 27/95","hep-th",,"  In this thesis generalizations of matrix and eigenvalue models involving
supersymmetry are discussed. Following a brief review of the Hermitian one
matrix model, the c=-2 matrix model is considered. Built from a matrix valued
superfield this model displays supersymmetry on the matrix level. We stress the
emergence of a Nicolai-map of this model to a free Hermitian matrix model and
study its diagrammatic expansion in detail. Correlation functions for quartic
potentials on arbitrary genus are computed, reproducing the string
susceptibility of c=-2 Liouville theory in the scaling limit. The results may
be used to perform a counting of supersymmetric graphs.
  We then turn to the supereigenvalue model, today's only successful discrete
approach to 2d quantum supergravity. The model is constructed in a
superconformal field theory formulation by imposing the super-Virasoro
constraints. The complete solution of the model is given in the moment
description, allowing the calculation of the free energy and the multi-loop
correlators on arbitrary genus and for general potentials. The solution is
presented in the discrete case and in the double scaling limit. Explicit
results up to genus two are stated.
  Finally the supersymmetric generalization of the external field problem is
addressed. We state the discrete super-Miwa transformations of the
supereigenvalue model on the eigenvalue and matrix level. Properties of
external supereigenvalue models are discussed, although the model corresponding
to the ordinary supereigenvalue model could not be identified so far.
","[{""version"":""v1"",""created"":""Wed, 10 Jan 1996 14:39:30 GMT""},{""version"":""v2"",""created"":""Thu, 11 Jan 1996 13:17:02 GMT""},{""version"":""v3"",""created"":""Mon, 12 Feb 1996 22:54:39 GMT""},{""version"":""v4"",""created"":""Fri, 16 Feb 1996 22:13:14 GMT""}]","2016-09-06"
"hep-th/9601042","Horatiu-Stefan Nastase","Horatiu-Stefan Nastase","A possible solution of the black hole information paradox through
  quantum gravity unified with other interactions","24 pages, 8 figures, in a single compressed/encoded file",,,"NBI-HE-96-02","hep-th",,"  I try to argue that the only way out of the black hole information paradox is
through a unified quantum field theory of gravity and other interactions.
Superstring theory is especially interesting, since in a special limit, the
classical picture of 't Hooft emerges.
","[{""version"":""v1"",""created"":""Wed, 10 Jan 1996 14:43:02 GMT""}]","2007-05-23"
"hep-th/9601044","Bernard de Wit","B. de Wit","Applications of special geometry","LateX file, 12 pp. To appear in the proc. of the Workshop on Strings,
  Gravity & Related Phenomena, Trieste, 1995",,,"THU-95/31","hep-th",,"  We review characteristic features of N=2 supersymmetric vector multiplets and
discuss symplectic reparametrizations and their relevance for monopoles and
dyons. We close with an analysis of perturbative corrections to the low-energy
effective action of N=2 heterotic superstring vacua.
","[{""version"":""v1"",""created"":""Wed, 10 Jan 1996 15:03:30 GMT""}]","2007-05-23"
"nucl-th/9601009","Jim Friar","U. van Kolck, J.L. Friar, and T. Goldman","Phenomenological Aspects of Isospin Violation in the Nuclear Force","10 pages, latex, 1 figure -- To appear in Physics Letters B --
  epsfig.sty required","Phys.Lett.B371:169-174,1996","10.1016/0370-2693(96)00009-3","DOE/ER/40427-22-N95 and LA-UR-95-4023","nucl-th hep-ph",,"  Phenomenological Lagrangians and dimensional power counting are used to
assess isospin violation in the nucleon-nucleon force. The $\pi NN$ coupling
constants (including the Goldberger-Treiman discrepancy), charge-symmetry
breaking, and meson-mixing models are examined. A one-loop analysis of the
isospin-violating $\pi NN$ coupling constants is performed using chiral
perturbation theory. Meson-mixing models and the $^3$He - $^3$H mass difference
are also discussed in the context of naturalness.
","[{""version"":""v1"",""created"":""Tue, 9 Jan 1996 19:36:11 GMT""}]","2008-11-26"
"nucl-th/9601010","Tomoyuki Maruyama","Tomoyuki Maruyama, Koji Niita, Toshiki Maruyama, Satoshi Chiba,
  Yasuaki Nakahara, Akira Iwamoto","Relativistic Effects in the Transverse Flow in the Molecular Dynamics
  Framework","6pages, Latex is used, 1 Postscript figures are available by request
  from tomo@hadron05.tokai.jaeri.go.jp","Prog.Theor.Phys. 96 (1996) 263-268","10.1143/PTP.96.263",,"nucl-th",,"  In order to investigate relativistic effects we compare the transverse flow
calculated by using the four versions of the QMD approaches with that of the
full covariant RQMD approach. From the comparison we conclude that the
simplified RQMD (RQMD/S), which uses the common time coordinate to all
particles, can be used instead of RQMD up to 6 GeV/u.
","[{""version"":""v1"",""created"":""Wed, 10 Jan 1996 02:32:43 GMT""}]","2009-10-30"
"q-alg/9601006","Leonardo Castellani","Paolo Aschieri and Leonardo Castellani","Bicovariant Calculus on Twisted ISO(N), Quantum Poincare' Group and
  Quantum Minkowski Space","35 pages, latex, no figures","Int. J. Mod. Phys. A11 (1996) 4513","10.1142/S0217751X96002091","DFTT-53/95 and IFUP-TH 64/95","q-alg hep-th math.QA",,"  A bicovariant calculus on the twisted inhomogeneous multiparametric
$q$-groups of the $B_n,C_n,D_n$ type, and on the corresponding quantum planes,
is found by means of a projection from the bicovariant calculus on $B_{n+1}$,
$C_{n+1}$, $D_{n+1}$. In particular we obtain the bicovariant calculus on a
dilatation-free $q$-Poincar\'e group $ISO_q (3,1)$, and on the corresponding
quantum Minkowski space. The classical limit of the $B_n,C_n,D_n$ bicovariant
calculus is discussed in detail.
","[{""version"":""v1"",""created"":""Tue, 9 Jan 1996 17:01:58 GMT""}]","2009-10-30"
