"cond-mat/9601030","Vijay Balasubramanian","Vijay Balasubramanian (Princeton University)","Statistical Inference, Occam's Razor and Statistical Mechanics on The
  Space of Probability Distributions","17 pages, LaTeX",,,"PUPT-1587","cond-mat adap-org bayes-an nlin.AO",,"  The task of parametric model selection is cast in terms of a statistical
mechanics on the space of probability distributions. Using the techniques of
low-temperature expansions, we arrive at a systematic series for the Bayesian
posterior probability of a model family that significantly extends known
results in the literature. In particular, we arrive at a precise understanding
of how Occam's Razor, the principle that simpler models should be preferred
until the data justifies more complex models, is automatically embodied by
probability theory. These results require a measure on the space of model
parameters and we derive and discuss an interpretation of Jeffreys' prior
distribution as a uniform prior over the distributions indexed by a family.
Finally, we derive a theoretical index of the complexity of a parametric family
relative to some true distribution that we call the {\it razor} of the model.
The form of the razor immediately suggests several interesting questions in the
theory of learning that can be studied using the techniques of statistical
mechanics.
","[{""version"":""v1"",""created"":""Wed, 10 Jan 1996 01:31:34 GMT""}]","2008-02-03"
"cond-mat/9601031","Sasha Dotsenko","A.V. Dotsenko and O.P. Sushkov","Temperature dependence of the electron chemical potential in YBa2Cu3O","8 pages, REVTeX 3.0, PostScript figures. (Minor revisions made.)",,"10.1016/0921-4534(96)00245-6",,"cond-mat",,"  We study the behaviour of the electronic chemical potential in YBa2Cu3O near
the superconducting transition using the spin-wave exchange theory of pairing.
We find that the experimental value of the jump in the temperature derivative
of the chemical potential is inconsistent with the theoretical value calculated
under the assumption of constant hole concentration. It is suggested that
charge transfer between chains and planes takes place and corresponding
calculations are done.
","[{""version"":""v1"",""created"":""Wed, 10 Jan 1996 04:51:07 GMT""},{""version"":""v2"",""created"":""Wed, 28 Feb 1996 08:08:45 GMT""},{""version"":""v3"",""created"":""Thu, 29 Feb 1996 07:21:08 GMT""}]","2009-10-28"
"cond-mat/9601032",,"Ping Ao, Staffan Grundberg and J{\o}rgen Rammer (Umea University)","Influence of typical environments on quantum processes","46 pages, 11 post script figures. Accepted for publication in
  Physical Review B",,"10.1103/PhysRevB.53.10042",,"cond-mat",,"  We present the results of studying the influence of different environmental
states on the coherence of quantum processes. We choose to discuss a simple
model which describe two electronic reservoirs connected through tunneling via
a resonant state. The model could, e.g., serve as an idealization of inelastic
resonant tunneling through a double barrier structure. We develop Schwinger's
closed time path formulation of non-equilibrium quantum statistical mechanics,
and show that the influence of the environment on a coherent quantum process
can be described by the value of a generating functional at a specific force
value, thereby allowing for a unified discussion of destruction of phase
coherence by various environmental states: thermal state, classical noise, time
dependent classical field, and a coherent state. The model allows an extensive
discussion of the influence of dissipation on the coherent quantum process, and
expressions for the transmission coefficient are obtained in the possible
limits.
","[{""version"":""v1"",""created"":""Wed, 10 Jan 1996 14:52:22 GMT""}]","2009-10-28"
"cond-mat/9601033","Tadashi Kadowaki","Tadashi Kadowaki, Yoshihiko Nonomura and Hidetoshi Nishimori","Exact Ground-State Energy of the Ising Spin Glass on Strips","10 pages, 12 Postscript figures, LaTeX, uses subeqn.sty, minor
  changes in tex-file","J. Phys. Soc. Jpn. 66 (1996) 1609","10.1143/JPSJ.65.1609","TITCMT-95-30","cond-mat",,"  We propose a new method for exact analytical calculation of the ground-state
energy of the Ising spin glass on strips. An outstanding advantage of this
method over the numerical transfer matrix technique is that the energy is
obtained for complex values of the probability describing quenched randomness.
We study the $\pm J$ and the site-random models using this method for strips of
various sizes up to $5\times\infty$. The ground-state energy of these models is
found to have singular points in the complex-probability plane, reminiscent of
Lee-Yang zeros in the complex-field plane for the Ising ferromagnet. The $\pm
J$ Ising model has a series of singularities which may approach a limiting
point around $p \sim 0.9$ on the real axis in the limit of infinite width.
","[{""version"":""v1"",""created"":""Wed, 10 Jan 1996 13:05:26 GMT""},{""version"":""v2"",""created"":""Tue, 16 Jan 1996 13:11:39 GMT""}]","2009-10-28"
"cond-mat/9601035","Kikuchi Macoto","Macoto Kikuchi, Nobuyasu Ito, and Yutaka Okabe","Statistical Dependence Analysis","8 pages, Figures are available at
  http://glimmung.phys.sci.osaka-u.ac.jp/kikuchi/physics.html or they will be
  sent upon request by e-mail",,"10.1142/S0129183196000326","OUCMT-95-8","cond-mat",,"  We review our recent studies on the dynamical correlations in MC simulations
from the view point of the statistical dependence. Attentions are paid to the
reduction of the statistical degrees of freedom for correlated data. Possible
biases on several cumulants, such as the susceptibility and the Binder number
due to finite MC length are discussed. A new method for calculating the
equilibrium relaxation time from the analysis of the statistical dependence is
presented. We apply it to the critical dynamics of the Ising model to estimate
the dynamical critical exponent accurately.
","[{""version"":""v1"",""created"":""Wed, 10 Jan 1996 13:20:11 GMT""}]","2015-06-25"
"gr-qc/9601009","Jorge Pullin","Richard H. Price, Jorge Pullin","Analytic approximations to the spacetime of a critical gravitational
  collapse","12 pages, Revtex, 9 figures included with epsf","Phys.Rev.D54:3792-3799,1996","10.1103/PhysRevD.54.3792","CGPG-96/1-1","gr-qc",,"  We present analytic expressions that approximate the behavior of the
spacetime of a collapsing spherically symmetric scalar field in the critical
regime first discovered by Choptuik. We find that the critical region of
spacetime can usefully be divided into a ``quiescent'' region and an
``oscillatory'' region, and a moving ``transition edge'' that separates the two
regions. We find that in each region the critical solution can be well
approximated by a flat spacetime scalar field solution. A qualitative nonlinear
matching of the solutions across the edge yields the right order of magnitude
for the oscillations of the discretely self-similar critical solution found by
Choptuik.
","[{""version"":""v1"",""created"":""Tue, 9 Jan 1996 17:02:08 GMT""}]","2011-09-09"
"gr-qc/9601010","Steve Brandt","Steven R. Brandt, Edward Seidel (National Center for Supercomputing
  Applications, Department of Physics, Univ. of Illinois at Urbana-Champaign)","The Evolution of Distorted Rotating Black Holes III: Initial Data","16 pages","Phys.Rev. D54 (1996) 1403-1416","10.1103/PhysRevD.54.1403",,"gr-qc",,"  In this paper we study a new family of black hole initial data sets
corresponding to distorted ``Kerr'' black holes with moderate rotation
parameters, and distorted Schwarzschild black holes with even- and odd-parity
radiation. These data sets build on the earlier rotating black holes of Bowen
and York and the distorted Brill wave plus black hole data sets. We describe
the construction of this large family of rotating black holes. We present a
systematic study of important properties of these data sets, such as the size
and shape of their apparent horizons, and the maximum amount of radiation that
can leave the system during evolution. These data sets should be a very useful
starting point for studying the evolution of highly dynamical black holes and
can easily be extended to 3D.
","[{""version"":""v1"",""created"":""Tue, 9 Jan 1996 17:03:33 GMT""}]","2009-10-28"
"gr-qc/9601011","Jose Antonio Zapata","Henri Waelbroeck (Instituto de Ciencias Nucleares, UNAM, Mexico) and
  Jose A. Zapata (Center for Gravitational Physics and Geometry, PennState,
  USA)","$2+1$ Covariant Lattice Theory and t'Hooft's Formulation","10 pages of text. One figure available from J.A. Zapata upon request","Class.Quant.Grav. 13 (1996) 1761-1768","10.1088/0264-9381/13/7/009","CGPG-96/1-2","gr-qc",,"  We show that 't Hooft's representation of (2+1)-dimensional gravity in terms
of flat polygonal tiles is closely related to a gauge-fixed version of the
covariant Hamiltonian lattice theory. 't Hooft's gauge is remarkable in that it
leads to a Hamiltonian which is a linear sum of vertex Hamiltonians, each of
which is defined modulo $2 \pi$. A cyclic Hamiltonian implies that ``time'' is
quantized. However, it turns out that this Hamiltonian is {\it constrained}. If
one chooses an internal time and solves this constraint for the ``physical
Hamiltonian'', the result is not a cyclic function. Even if one quantizes {\it
a la Dirac}, the ``internal time'' observable does not acquire a discrete
spectrum. We also show that in Euclidean 3-d lattice gravity, ``space'' can be
either discrete or continuous depending on the choice of quantization. Finally,
we propose a generalization of 't Hooft's gauge for Hamiltonian lattice
formulations of topological gravity dimension 4.
","[{""version"":""v1"",""created"":""Tue, 9 Jan 1996 19:17:19 GMT""}]","2009-10-28"
"gr-qc/9601012","Merced Montesinos","M. Montesinos-Velasquez","Isometries and embedding of the thermodynamic phase space of an ideal
  gas","8 pages, Latex, 0 figures",,,"CINVESTAV-FIS-22/95","gr-qc",,"  In this work we find the Killing vector fields of the riemannian submanifolds
of the thermodynamic phase space of an ideal gas and show that the isometry
group corresponding to them is homomorphic to the euclidean group $E(2)$. We
also give the embedding of these submanifolds in the euclidean space $(R^{3},\
delta)$.
","[{""version"":""v1"",""created"":""Tue, 9 Jan 1996 23:44:18 GMT""}]","2016-08-31"
"gr-qc/9601013","Merced Montesinos","M. Montesinos-Velasquez and T. Matos","From vacuum field equations on principal bundles to Einstein equations
  with fluids","7 pages, Latex, 0 figures","Rev. Mex. Fis. 41 (1995) 791",,,"gr-qc",,"  In the present work we show that the Einstein equations on $M$ without
cosmological constant and with perfect fluid as source, can be obtained from
the field equations for vacuum with cosmological constant on the principal
fibre bundle $P(\frac{1}{I} M,U(1))$, $M$ being the space-time and $I$ the
radius of the internal space $U(1)$.
","[{""version"":""v1"",""created"":""Wed, 10 Jan 1996 00:12:48 GMT""}]","2007-05-23"
"gr-qc/9601014","Gerard 't Hooft","G. 't Hooft","Quantization of Point Particles in 2+1 Dimensional Gravity and
  Space-Time Discreteness","23 pages Plain TeX, 3 Figures","Class.Quant.Grav.13:1023-1040,1996","10.1088/0264-9381/13/5/018","THU-96/02","gr-qc",,"  By investigating the canonical commutation rules for gravitating quantized
particles in a 2+1 dimensional world it is found that these particles live on a
space-time lattice. The space-time lattice points can be characterized by three
integers. Various representations are possible, the details depending on the
topology chosen for energy-momentum space. We find that an $S_2\times S_1$
topology yields a physically most interesting lattice within which first
quantization of Dirac particles is possible. An $S_3$ topology also gives a
lattice, but does not allow first quantized particles.
","[{""version"":""v1"",""created"":""Wed, 10 Jan 1996 10:44:08 GMT""}]","2010-04-06"
"gr-qc/9601015","K. Kokkotas","Nils Andersson (Cardiff), Kostas D. Kokkotas (Thessaloniki) and
  Bernard F. Schutz (Cardiff)","Spacetime modes of relativistic stars","4 pages, MN.STY, 2 postscript figures","Mon.Not.Roy.Astron.Soc. 280 (1996) 1230","10.1093/mnras/280.4.1230",,"gr-qc",,"  The problem of relativistic stellar pulsations is studied in a somewhat ad
hoc approximation that ignores all fluid motions. This {\em Inverse Cowling
Approximation} (ICA) is motivated by two observations: 1) For highly damped
($w$-mode) oscillations the fluid plays very little role. 2) If the fluid
motion is neglected the problem for polar oscillation modes becomes similar to
that for axial modes. Using the ICA we find a polar mode spectrum that has all
features of the $w$-mode spectrum of the full problem. Moreover, in the limit
of superdense stars, we find the ICA spectrum to be qualitatively similar to
that of the axial modes. These results clearly show the importance of general
relativity for the pulsation modes of compact stars, and that there are modes
whose existence do not depend on motions of the fluid at all; pure
``spacetime'' modes.
","[{""version"":""v1"",""created"":""Wed, 10 Jan 1996 12:24:45 GMT""}]","2015-06-25"
"hep-ph/9601232",,"S. Rigolin (Univerit\'a di Padova)","Heavy fermions virtual effects at e^+ e^- colliders","21 pages, 8 eps file - needs epsfig.sty","Acta Phys.Polon. B27 (1996) 1627-1648",,,"hep-ph",,"  We derive the low-energy electroweak effective lagrangian for the case of
additional heavy, unmixed, sequential fermions. Present LEP1 data still allow
for the presence of a new quark and/or lepton doublet with masses greater than
$M_Z/2$, provided that these multiplets are sufficiently degenerate. Keeping in
mind this constraint, we analyse the virtual effects of heavy chiral fermions
in $e^+ e^- \raw W^+ W^-$ process at energies $\sqrt{p^2} = 200,~500,~1000$
GeV, provided by LEP2 and Next Linear Collider. The effects will be
unobservable at LEP2, being smaller than $3.0\cdot 10^{-3}$, while more
interesting is the case of NLC, where an enhancement factor, due to a delay of
unitarity, gives deviations from SM of the order 10-50 per cent, for a wide
range of new fermions masses.
","[{""version"":""v1"",""created"":""Tue, 9 Jan 1996 16:39:54 GMT""}]","2007-05-23"
"hep-ph/9601233","Jean-Loic Kneur","G. Gounaris, J.-L. Kneur, D. Zeppenfeld, Z. Ajaltouni, A. Arhrib, G.
  Bella, F. Berends, M. Bilenky, A. Blondel, J. Busenitz, Charlton, D
  Choudhury, P. Clarke, J. E. Conboy, M. Diehl, D. Fassouliotis, J.-M. Fr\`ere,
  C. Georgiopoulos, M. Gibbs, M. Gr\""unewald, J. B. Hansen, C. Hartmann, B. N.
  Jin, J. Jousset, J. Kalinowski, M. Kocian, A. Lahanas, J. Layssac, E. Lieb,
  C. Markou, C. Matteuzzi, P. M\""attig, J. M. Moreno, G. Moultaka, A. Nippe, J.
  Orloff, C. G. Papadopoulos, J. Paschalis, C. Petridou, H. Phillips, F.
  Podlyski, M. Pohl, F. M. Renard, J.-M. Rossignol, R. Rylko, R. L. Sekulin, A.
  van Sighem, E. Simopoulou, A. Skillman, V. Spanos, A. Tonazzo, M. Tytgat, S.
  Tzamarias, C. Verzegnassi, N.D. Vlachos and E. Zevgolatakos","Triple Gauge Boson Couplings","52 pages, LaTeX, 17 PostScript figures. To appear in ""Physics at
  LEP2"", G. Altarelli and F. Zwirner eds., CERN Report 1996. Conveners: G.
  Gounaris, J.-L. Kneur, D. Zeppenfeld",,,,"hep-ph",,"  We present the results obtained by the ""Triple Gauge Couplings"" working group
during the LEP2 Workshop (1994-1995). The report concentrates on the
measurement of $WW\gamma$ and $WWZ$ couplings in $e^-e^+\to W^-W^+$ or, more
generally, four-fermion production at LEP2. In addition the detection of new
interactions in the bosonic sector via other production channels is discussed.
","[{""version"":""v1"",""created"":""Tue, 9 Jan 1996 16:44:01 GMT""}]","2007-05-23"
"hep-ph/9601234","Leutwyler Heinrich","H. Leutwyler (University of Bern and CERN)","Bounds on the light quark masses","11 pages, Latex","Phys.Lett. B374 (1996) 163-168","10.1016/0370-2693(96)85876-X",,"hep-ph",,"  The corrections to the current algebra mass formulae for the pseudoscalar
mesons are analyzed by means of a simultaneous exansion in powers of the light
quark masses and powers of 1/N. A set of mass formulae is derived, including an
inequality, which leads to bounds for ratios of quark masses.
","[{""version"":""v1"",""created"":""Tue, 9 Jan 1996 21:44:09 GMT""}]","2009-10-28"
"hep-ph/9601235",,"R.G. Roberts and G.G. Ross","Quark Model Description of Polarised Deep Inelastic Scattering and the
  prediction of $g_2$","Latex 17 pages plus 4 figures (uuencoded)","Phys.Lett. B373 (1996) 235-245","10.1016/0370-2693(96)00116-5","RAL-95-TR-057","hep-ph",,"  We show how the operator product expansion evaluated in the approximation of
ignoring gluons leads to the covariant formulation of the quark parton model.
We discuss the connection with other formulations and show how the free quark
model prediction, $g_2=0$, changes smoothly into the Wandzura-Wilczek (WW)
relation for quark masses small relative to the nucleon mass. Previous
contradictory parton model predictions are shown to follow from an inconsistent
treatment of the mass shell conditions. The description is extended to include
quark mass corrections.
","[{""version"":""v1"",""created"":""Wed, 10 Jan 1996 11:49:04 GMT""}]","2009-10-28"
"hep-ph/9601236","Leutwyler Heinrich","H. Leutwyler (University of Bern and CERN)","Implications of eta-etaprime mixing for the decay eta->3 pi","8 pages, Latex","Phys.Lett. B374 (1996) 181-185","10.1016/0370-2693(96)00167-0","BUTP-96/5","hep-ph",,"  Taken by itself, the interference with the etaprime appears to strongly
affect the amplitude of the transition eta->3 pi. I point out that this effect
is fictitious and also occurs in the mass spectrum of the pseudoscalars. Chiral
symmetry implies that the same combination of effective coupling constants
which determines the small deviations from the Gell-Mann-Okubo formula also
specifies the symmetry breaking effects in the decay amplitude and thus ensures
that these are small.
","[{""version"":""v1"",""created"":""Wed, 10 Jan 1996 12:24:36 GMT""}]","2009-10-28"
"hep-ph/9601237","Leutwyler Heinrich","A. V. Anisovich (Gatchina, St. Petersburg) and H. Leutwyler
  (University of Bern and CERN)","Dispersive analysis of the decay eta -> 3 pi","14 pages, 1 figure","Phys.Lett.B375:335-342,1996","10.1016/0370-2693(96)00192-X","BUTP-95/2","hep-ph",,"  We demonstrate that the decay eta -> 3 pi represents a sensitive probe for
the breaking of chiral symmetry by the quark masses. The transition amplitude
is proportional to the mass ratio (m_d^2-m_u^2)/(m_s^2-m^2). The factor of
proportionality is calculated by means of dispersion relations, using chiral
perturbation theory to determine the subtraction constants. The theoretical
uncertainties in the result are shown to be remarkably small, so that eta-decay
may be used to accurately measure this ratio of quark masses.
","[{""version"":""v1"",""created"":""Wed, 10 Jan 1996 13:59:26 GMT""}]","2008-11-26"
"hep-th/9601029","Andy Strominger","A. Strominger and C. Vafa","Microscopic Origin of the Bekenstein-Hawking Entropy","12 pages. Relatively minor corrections and additions to discussion","Phys.Lett.B379:99-104,1996","10.1016/0370-2693(96)00345-0","HUTP-96/A002, RU-96-01","hep-th gr-qc",,"  The Bekenstein-Hawking area-entropy relation $S_{BH}=A/4$ is derived for a
class of five-dimensional extremal black holes in string theory by counting the
degeneracy of BPS soliton bound states.
","[{""version"":""v1"",""created"":""Tue, 9 Jan 1996 22:20:39 GMT""},{""version"":""v2"",""created"":""Thu, 15 Feb 1996 01:40:05 GMT""}]","2009-07-09"
"hep-th/9601034","Jean-Loup Gervais","Jean-Loup Gervais","On the Liouville coupling constants","Final version to be published in Phys. Lett. B","Phys.Lett. B376 (1996) 65-72","10.1016/0370-2693(96)00296-1","LPTENS-96/01","hep-th",,"  For the general operator product algebra coefficients derived by Cremmer
Roussel Schnittger and the present author with (positive integer) screening
numbers, the coupling constants determine the factors additional to the quantum
group 6j symbols.
  They are given by path independent products over a two dimensional lattice in
the zero mode space. It is shown that the ansatz for the three point function
of Dorn-Otto and Zamolodchikov-Zamolodchikov precisely defines the
corresponding flat lattice connection, so that it does give a natural
generalization of these coupling constants to continuous screening numbers. The
consistency of the restriction to integer screening charges is reviewed, and
shown to be linked with the orthogonality of the (generalized) 6j symbols. Thus
extending this last relation is the key to general screening numbers.
","[{""version"":""v1"",""created"":""Tue, 9 Jan 1996 16:11:58 GMT""},{""version"":""v2"",""created"":""Tue, 27 Feb 1996 10:03:38 GMT""}]","2016-09-06"
"hep-th/9601035","Eduardo Ramos","E. Ramos and J. Roca","On the W-geometrical origins of massless field equations and gauge
  invariance","16 pages, plain TeX (macros included)","Nucl.Phys. B477 (1996) 606-622","10.1016/0550-3213(96)00373-2","PM/95-52, QMW-PH-95-49","hep-th",,"  We show how to obtain all covariant field equations for massless particles of
arbitrary integer, or half-integer, helicity in four dimensions from the
quantization of the rigid particle, whose action is given by the integrated
extrinsic curvature of its worldline, {\ie} $S=\alpha\int ds \kappa$. This
geometrical particle system possesses one extra gauge invariance besides
reparametrizations, and the full gauge algebra has been previously identified
as classical $\W_3$. The key observation is that the covariantly reduced phase
space of this model can be naturally identified with the spinor and twistor
descriptions of the covariant phase spaces associated with massless particles
of helicity $s=\alpha$. Then, standard quantization techniques require $\alpha$
to be quantized and show how the associated Hilbert spaces are solution spaces
of the standard relativistic massless wave equations with $s=\alpha$.
Therefore, providing us with a simple particle model for Weyl fermions
($\alpha=1/2$), Maxwell fields ($\alpha=1$), and higher spin fields. Moreover,
one can go a little further and in the Maxwell case show that, after a suitable
redefinition of constraints, the standard Dirac quantization procedure for
first-class constraints leads to a wave-function which can be identified with
the gauge potential $A_\mu$. Gauge symmetry appears in the formalism as a
consequence of the invariance under $\W_3$-morphisms, that is, exclusively in
terms of the extrinsic geometry of paths in Minkowski space. When all gauge
freedom is fixed one naturally obtains the standard Lorenz gauge condition on
$A_{\mu}$, and Maxwell equations in that gauge. This construction has a direct
generalization to arbitrary integer values of $\alpha$, and we comment on the
physically interesting case of linearized Einstein gravity ($\alpha =2$).
","[{""version"":""v1"",""created"":""Tue, 9 Jan 1996 16:21:02 GMT""}]","2009-10-30"
"hep-th/9601036",,"M. J. Duff, R. Minasian and Edward Witten","Evidence for Heterotic/Heterotic Duality","36 pages, LaTeX","Nucl.Phys.B465:413-438,1996","10.1016/0550-3213(96)00059-4","CTP-TAMU-54/95","hep-th",,"  We re-examine the question of heterotic - heterotic string duality in six
dimensions and argue that the $E_8\times E_8$ heterotic string, compactified on
$K3$ with equal instanton numbers in the two $E_8$'s, has a self-duality that
inverts the coupling, dualizes the antisymmetric tensor, acts non-trivially on
the hypermultiplets, and exchanges gauge fields that can be seen in
perturbation theory with gauge fields of a non-perturbative origin. The special
role of the symmetric embedding of the anomaly in the two $E_8$'s can be seen
from field theory considerations or from an eleven-dimensional point of view.
The duality can be deduced by looking in two different ways at
eleven-dimensional $M$-theory compactified on $K3\times {\bf S}^1/\Z_2$.
","[{""version"":""v1"",""created"":""Tue, 9 Jan 1996 23:29:37 GMT""}]","2010-04-07"
"hep-th/9601037","John Rizos","P.M. Petropoulos(CERN) and J. Rizos(SISSA)","Universal moduli-dependent thresholds in Z(2)xZ(2) orbifolds","12 pages, Latex, contains two figures, final version, typos corrected","Phys.Lett.B374:49-56,1996","10.1016/0370-2693(96)00230-4","CERN-TH/95-284, SISSA/170/95/EP","hep-th",,"  In the context of a recently proposed method for computing exactly string
loop corrections regularized in the infra-red, we determine and calculate the
universal moduli-dependent part of the threshold corrections to the gauge
couplings for the symmetric $Z_2\times Z_2$ orbifold model. We show that these
corrections decrease the unification scale of the underlying effective field
theory. We also comment on the relation between this infra-red regularization
scheme and other proposed methods.
","[{""version"":""v1"",""created"":""Tue, 9 Jan 1996 19:01:09 GMT""},{""version"":""v2"",""created"":""Tue, 16 Jan 1996 16:47:22 GMT""},{""version"":""v3"",""created"":""Wed, 14 Aug 1996 12:08:42 GMT""}]","2008-11-26"
