"hep-ph/9601276","Michael Kraemer","Matteo Cacciari and Michael Kr\""amer (DESY)","Color-Octet Contributions to $J/\psi$ Photoproduction","10 pages, LaTeX, epsfig, 4 figures","Phys.Rev.Lett.76:4128-4131,1996","10.1103/PhysRevLett.76.4128","DESY 96-005","hep-ph",,"  We have calculated the leading color-octet contributions to the production of
$J/\psi$ particles in photon-proton collisions. Using the values for the
color-octet matrix elements extracted from fits to prompt $J/\psi$ data at the
Tevatron, we demonstrate that distinctive color-octet signatures should be
visible in $J/\psi$ photoproduction. However, these predictions appear at
variance with recent experimental data obtained at HERA, indicating that the
phenomenological importance of the color-octet contributions is smaller than
expected from theoretical considerations and suggested by the Tevatron fits.
","[{""version"":""v1"",""created"":""Tue, 16 Jan 1996 14:33:02 GMT""}]","2009-04-13"
"hep-th/9601075","Gary Gibbons","G W Gibbons","Tunelling with a Negative Cosmological Constant","36 pages, plain TEX","Nucl.Phys.B472:683-710,1996","10.1016/0550-3213(96)00207-6","DAMTP-R/96/01","hep-th gr-qc",,"  The point of this paper is see what light new results in hyperbolic geometry
may throw on gravitational entropy and whether gravitational entropy is
relevant for the quantum origin of the univeres. We introduce some new
gravitational instantons which mediate the birth from nothing of closed
universes containing wormholes and suggest that they may contribute to the
density matrix of the universe. We also discuss the connection between their
gravitational action and the topological and volumetric entropies introduced in
hyperbolic geometry. These coincide for hyperbolic 4-manifolds, and increase
with increasing topological complexity of the four manifold. We raise the
questions of whether the action also increases with the topological complexity
of the initial 3-geometry, measured either by its three volume or its Matveev
complexity. We point out, in distinction to the non-supergravity case, that
universes with domains of negative cosmological constant separated by
supergravity domain walls cannot be born from nothing. Finally we point out
that our wormholes provide examples of the type of Perpetual Motion machines
envisaged by Frolov and Novikov.
","[{""version"":""v1"",""created"":""Mon, 15 Jan 1996 16:04:11 GMT""}]","2016-09-06"
"hep-th/9601076","Silvio Rabello","J. Barcelos-Neto and S. Rabello","Mass generation for gauge fields in the Salam-Weinberg theory without
  Higgs","7 pages, Latex","Z.Phys. C74 (1997) 715-719",,,"hep-th hep-ph",,"  We consider the Salam-Weinberg theory by introducing tensor gauge fields.
When these fields are coupled in a topological way with the vector ones, the
resulting system constitutes an alternative mechanism of mass generation for
vector fields without the presence of Higgs bosons. We show that these masses
are in agreement with the ones obtained by means of the spontaneous symmetry
breaking.
","[{""version"":""v1"",""created"":""Mon, 15 Jan 1996 16:44:41 GMT""}]","2007-05-23"
"hep-th/9601077","John Schwarz","John H. Schwarz (Caltech)","M Theory Extensions of T Duality","13 pages, latex2e, 3 figures included; for Kikkawa's 60th Birthday",,,"CALT-68-2034","hep-th",,"  T duality expresses the equivalence of a superstring theory compactified on a
manifold K to another (possibly the same) superstring theory compactified on a
dual manifold K'. The volumes of K and K' are inversely proportional. In this
talk we consider two M theory generalizations of T duality: (i) M theory
compactified on a torus is equivalent to type IIB superstring theory
compactified on a circle and (ii) M theory compactified on a cylinder is
equivalent to SO(32) superstring theory compactified on a circle. In both cases
the size of the circle is proportional to the -3/4 power of the area of the
dual manifold.
","[{""version"":""v1"",""created"":""Mon, 15 Jan 1996 22:40:34 GMT""}]","2007-05-23"
"hep-th/9601078","Bert Schellekens","J""urgen Fuchs, Bert Schellekens, Christoph Schweigert","A matrix S for all simple current extensions","Phyzzx, 53 pages 1 uuencoded figure Arrow in figure corrected;
  Forgotten acknowledment to funding organization added; DESY preprint-number
  added","Nucl.Phys. B473 (1996) 323-366","10.1016/0550-3213(96)00247-7","DESY 96--008 - IHES/P/98/8 - NIKHEF 96-001","hep-th",,"  A formula is presented for the modular transformation matrix S for any simple
current extension of the chiral algebra of a conformal field theory. This
provides in particular an algorithm for resolving arbitrary simple current
fixed points, in such a way that the matrix S we obtain is unitary and
symmetric and furnishes a modular group representation. The formalism works in
principle for any conformal field theory. A crucial ingredient is a set of
matrices S^J_{ab}, where J is a simple current and a and b are fixed points of
J. We expect that these input matrices realize the modular group for the torus
one-point functions of the simple currents. In the case of WZW-models these
matrices can be identified with the S-matrices of the orbit Lie algebras that
we introduced in a previous paper. As a special case of our conjecture we
obtain the modular matrix S for WZW-theories based on group manifolds that are
not simply connected, as well as for most coset models.
","[{""version"":""v1"",""created"":""Tue, 16 Jan 1996 10:08:08 GMT""},{""version"":""v2"",""created"":""Thu, 15 Feb 1996 13:42:37 GMT""}]","2009-10-30"
"hep-th/9601079","Tanimura Shogo","Shogo Tanimura (Kyoto University)","Algebra and Twisted Algebra in Toroidal Target Space","10 pages, no figures, LaTeX; a small revision is made","Mod.Phys.Lett. A11 (1996) 1161-1168","10.1142/S0217732396001193","KU-AMP 95015, hep-th/9601079","hep-th",,"  Target space duality is reconsidered from the viewpoint of quantization in a
space with nontrivial topology. An algebra of operators for the toroidal
bosonic string is defined and its representations are constructed. It is shown
that there exist an infinite number of inequivalent quantizations, which are
parametrized by two parameters $ 0 \le s, t < 1 $. The spectrum exhibits the
duality only when $ s = t $ or $ -t $ (mod 1). A deformation of the algebra by
a central extension is also introduced. It leads to a kind of twisted relation
between the zero mode quantum number and the topological winding number.
","[{""version"":""v1"",""created"":""Tue, 16 Jan 1996 13:25:14 GMT""},{""version"":""v2"",""created"":""Fri, 1 Mar 1996 04:48:29 GMT""}]","2009-10-30"
"hep-th/9601080","Moshe Moshe","G. Eyal, M. Moshe, S. Nishigaki, J. Zinn-Justin","The O(N) vector model in the large N limit revisited: multicritical
  points and double scaling limit","31 pages, 2 PostScript figures, TeX + epsf.tex","Nucl.Phys. B470 (1996) 369-395","10.1016/0550-3213(96)00168-X","TECHNION-PH-95-21, SPhT/95-132","hep-th",,"  The multicritical points of the $O(N)$ invariant $N$ vector model in the
large $N$ limit are reexamined. Of particular interest are the subtleties
involved in the stability of the phase structure at critical dimensions. In the
limit $N \to \infty$ while the coupling $g \to g_c$ in a correlated manner (the
double scaling limit) a massless bound state $O(N)$ singlet is formed and
powers of $1/N$ are compensated by IR singularities. The persistence of the $N
\to \infty$ results beyond the leading order is then studied with particular
interest in the possible existence of a phase with propagating small mass
vector fields and a massless singlet bound state. We point out that under
certain conditions the double scaled theory of the singlet field is
non-interacting in critical dimensions.
","[{""version"":""v1"",""created"":""Tue, 16 Jan 1996 14:14:28 GMT""}]","2009-10-30"
"hep-th/9601084",,"M. Alishahiha, A. H. Fatollahi, K. Kaviani","Non-Commutative Geometry and Chiral Perturbation Lagrangian","Latex, 9 pages","Phys.Lett. B382 (1996) 369-373","10.1016/0370-2693(96)00527-8","IPM-96-122","hep-th",,"  Chiral perturbation lagrangian in the framework of non-commutative geometry
is considered in full detail. It is found that the explicit symmetry breaking
terms appear and some relations between the coupling constants of the theory
come out naturally. The WZW term also turns up on the same footing as the other
terms of the chiral lagrangian.
","[{""version"":""v1"",""created"":""Tue, 16 Jan 1996 07:40:26 GMT""}]","2009-10-30"
"math/9601203","Arnold Miller","Arnold W. Miller","Introduction to mathematical logic - A problem solving course",,,,"Logic E-prints January 16, 1996","math.LO",,"  This is a set of 288 questions written for a Moore-style course in
Mathematical Logic. I have used these (or some variation) four times in a
beginning graduate course. Topics covered are:
  propositional logic
  axioms of ZFC
  wellorderings and equivalents of AC
  ordinal and cardinal arithmetic
  first order logic, and the compactness theorem
  Lowenheim-Skolem theorems
  Turing machines, Church's Thesis
  completeness theorem and first incompleteness theorem
  undecidable theories
  second incompleteness theorem
","[{""version"":""v1"",""created"":""Tue, 16 Jan 1996 00:00:00 GMT""}]","2008-02-03"
"mtrl-th/9601002","David Vanderbilt","J. Bennetto and David Vanderbilt (Department of Physics and Astronomy,
  Rutgers University)","Semiconductor effective charges from tight-binding theory","4 pages, two-column style with 2 postscript figures embedded. Uses
  REVTEX and epsf macros. Also available at
  http://www.physics.rutgers.edu/~dhv/preprints/index.html#jb_tb",,"10.1103/PhysRevB.53.15417",,"mtrl-th cond-mat.mtrl-sci",,"  We calculate the transverse effective charges of zincblende compound
semiconductors using Harrison's tight-binding model to describe the electronic
structure. Our results, which are essentially exact within the model, are found
to be in much better agreement with experiment than previous
perturbation-theory estimates. Efforts to improve the results by using more
sophisticated variants of the tight-binding model were actually less
successful. The results underline the importance of including quantities that
are sensitive to the electronic wavefunctions, such as the effective charges,
in the fitting of tight-binding models.
","[{""version"":""v1"",""created"":""Mon, 15 Jan 1996 21:31:35 GMT""}]","2009-10-30"
"nucl-th/9601021","Alexander Motovilov","V.B.Belyaev, A.K.Motovilov, W.Sandhas","On the possibility of fusion reactions in water molecules","4 pages, 11 kB, REVTEX; Journal-ref was corrected","JINR Rapid Communications, 1995, Nr. 6 [74]-95, p. 5--8",,,"nucl-th",,"  The probability of nuclear transitions $p+p+{}^{16}{O} \, \rightarrow \,
{}^{18}{Ne}\, (4.522,1^-)$ in molecular water is estimated. Due to the
practically exact agreement of the energy of the $Ne$ resonance and of the
$p+p+{}^{16}{O}$ threshold, the transition probability is found to be
considerably enhanced. This indicates the possibility of nuclear fusion in
rotationally excited $H_2O$ molecules in the state $1^-$.
","[{""version"":""v1"",""created"":""Mon, 15 Jan 1996 23:34:09 GMT""},{""version"":""v2"",""created"":""Wed, 12 Jun 1996 11:57:00 GMT""}]","2008-02-03"
"q-alg/9601013","Maxim Sokolov","Maxim Sokolov (Chelyabinsk State University)","On the absolute value of the SO(3)-invariant and other summands of the
  Turaev-Viro invariant","Plain TeX, 12 pages, no figures. In this version we added a
  definition of the invariant TV_1 on a triangulation, Lemma 3 and Remark 5 in
  section 6, some remarks about the tables. We also corrected the definition of
  an odd edge in section 6","Knot Theory, Banach Center Publ., Vol. 42, 1998, pp 395--408",,,"q-alg math.QA",,"  The Turaev-Viro invariant is defined as a certain state sum calculated on an
arbitrary simple spine of a 3-manifold. We specify each term of the sum as
0-term, 1-term or 2-term such that each sum of the terms having the same type
is an invariant too. The sum of the 0-terms is equal to the square of the
modulus of the so-called SO(3)-invariant. In the paper we express the sum of
the 0-terms and 2-terms and the sum of the 1-terms via the Turaev-Viro
invariants. Tables of values of the invariants are enclosed. The values are
presented as polynomials on primitive roots of unity with integer coefficients.
","[{""version"":""v1"",""created"":""Mon, 15 Jan 1996 22:38:42 GMT""},{""version"":""v2"",""created"":""Sat, 20 Apr 1996 20:39:29 GMT""}]","2008-02-03"
"quant-ph/9601013","Shelly Goldstein","Martin Daumer, Detlef D\""urr, Sheldon Goldstein, and Nino Zangh\`{\i}","Naive Realism about Operators","18 pages, LaTex2e with AMS-LaTeX, to appear in Erkenntnis, 1996 (the
  proceedings of the international conference ``Probability, Dynamics and
  Causality,'' Luino, Italy, 15-17 June 1995, a special issue edited by D.
  Costantini and M.C. Gallavotti and dedicated to Prof. R. Jeffrey)",,,,"quant-ph",,"  A source of much difficulty and confusion in the interpretation of quantum
mechanics is a ``naive realism about operators.'' By this we refer to various
ways of taking too seriously the notion of operator-as-observable, and in
particular to the all too casual talk about ``measuring operators'' that occurs
when the subject is quantum mechanics. Without a specification of what should
be meant by ``measuring'' a quantum observable, such an expression can have no
clear meaning. A definite specification is provided by Bohmian mechanics, a
theory that emerges from Sch\""rodinger's equation for a system of particles
when we merely insist that ``particles'' means particles. Bohmian mechanics
clarifies the status and the role of operators as observables in quantum
mechanics by providing the operational details absent from standard quantum
mechanics. It thereby allows us to readily dismiss all the radical claims
traditionally enveloping the transition from the classical to the quantum
realm---for example, that we must abandon classical logic or classical
probability. The moral is rather simple: Beware naive realism, especially about
operators!
","[{""version"":""v1"",""created"":""Mon, 15 Jan 1996 23:09:13 GMT""}]","2007-05-23"
"quant-ph/9601014","M. Czachor","Marek Czachor","Manifestly Covariant Approach to Bargmann-Wigner Fields (I): Generalized
  scalar products and Wigner states","bibliography is extended",,,,"quant-ph gr-qc hep-th",,"  Manifestly covariant formalism for Bargmann-Wigner fields is developed.
  It is shown that there exists some freedom in the choice of the form of the
Bargmann-Wigner scalar product: The general product depends implicitly on a
family of world-vectors. The standard choice of the product corresponds to
timelike and equal vectors which define a ``time"" direction. The generalized
form shows that formulas are simpler if one chooses {\it null\/} directions.
This freedom is used to derive simple covariant formulas for momentum-space
wave functions (generalized Wigner states) corresponding to arbitrary mass and
spin and using eigenstates of the Pauli-Lubanski vector. The eigenstates which
make formulas the simplest correspond to projections of the Pauli-Lubanski
vector on {\it null\/} directions. The new formulation is an alternative to the
standard helicity formalism.
","[{""version"":""v1"",""created"":""Tue, 16 Jan 1996 09:23:27 GMT""},{""version"":""v2"",""created"":""Mon, 12 Feb 1996 15:32:04 GMT""}]","2016-09-08"
"quant-ph/9601015","M. Czachor","Marek Czachor","Nambu-Type Generalization of the Dirac Equation","revtex, 19 pages","Phys.Lett.A225:1-12,1997","10.1016/S0375-9601(96)00869-9",,"quant-ph hep-th",,"  Nonlinear generalization of the Dirac equation extending the standard
paradigm of nonlinear Hamiltonians is discussed. ``Faster-than-light
telegraphs"" are absent for all theories formulated within the new framework. A
new metric for infinite dimensional Lie algebras associated with Lie-Poisson
dynamics is introduced.
","[{""version"":""v1"",""created"":""Tue, 16 Jan 1996 09:26:55 GMT""}]","2014-11-18"
"quant-ph/9601016","Piotr Garbaczewski","Piotr Garbaczewski and Robert Olkiewicz","Comment on ""Why quantum mechanics cannot be formulated as a Markov
  process""","Latex file, resubm. to Phys. Rev. A","Phys.Rev. A54 (1996) 1733-1736","10.1103/PhysRevA.54.1733",,"quant-ph",,"  In the paper with the above title, D. T. Gillespie [Phys. Rev. A 49, 1607,
(1994)] claims that the theory of Markov stochastic processes cannot provide an
adequate mathematical framework for quantum mechanics. In conjunction with the
specific quantum dynamics considered there, we give a general analysis of the
associated dichotomic jump processes. If we assume that Gillespie's
""measurement probabilities"" \it are \rm the transition probabilities of a
stochastic process, then the process must have an invariant (time independent)
probability measure. Alternatively, if we demand the probability measure of the
process to follow the quantally implemented (via the Born statistical
postulate) evolution, then we arrive at the jump process which \it can \rm be
interpreted as a Markov process if restricted to a suitable duration time.
However, there is no corresponding Markov process consistent with the $Z_2$
event space assumption, if we require its existence for all times $t\in R_+$.
","[{""version"":""v1"",""created"":""Tue, 16 Jan 1996 12:23:45 GMT""}]","2009-10-30"
