"hep-th/9601104","Stephen G. Naculich","M. Crescimanno, S. G. Naculich, and H. J. Schnitzer","Evaluation of the Free Energy of Two-Dimensional Yang-Mills Theory","10 pages; no figures; LaTeX","Phys.Rev. D54 (1996) 1809-1813","10.1103/PhysRevD.54.1809","BRX-TH-365, BOW-PH-106, BERC-PH-105","hep-th",,"  The free energy in the weak-coupling phase of two-dimensional Yang-Mills
theory on a sphere for SO(N) and Sp(N) is evaluated in the 1/N expansion using
the techniques of Gross and Matytsin. Many features of Yang-Mills theory are
universal among different gauge groups in the large N limit, but significant
differences arise in subleading order in 1/N.
","[{""version"":""v1"",""created"":""Fri, 19 Jan 1996 21:16:02 GMT""}]","2009-10-30"
"hep-th/9601105","Thomas Thiemann","Thomas Thiemann (Harvard University)","The inverse loop transform","15 pages, Latex","J.Math.Phys. 39 (1998) 1236-1248","10.1063/1.532344","CGPG-95/7-2, HUTMP-95/B-346","hep-th gr-qc",,"  The loop transform in quantum gauge field theory can be recognized as the
Fourier transform (or characteristic functional) of a measure on the space of
generalized connections modulo gauge transformations. Since this space is a
compact Hausdorff space, conversely, we know from the Riesz-Markov theorem that
every positive linear functional on the space of continuous functions thereon
qualifies as the loop transform of a regular Borel measure on the moduli space.
In the present article we show how one can compute the finite joint
distributions of a given characteristic functional, that is, we derive the
inverse loop transform.
","[{""version"":""v1"",""created"":""Fri, 19 Jan 1996 23:20:52 GMT""}]","2016-09-06"
"hep-th/9601106",,"Anatolij I.Bugrij, Vitalij N.Shadura (Bogolyubov Institute for
  Theoretical Physics, Kiev)","On Duality of Two-dimensional Ising Model on Finite Lattice","18 pages, LaTeX",,"10.1103/PhysRevB.55.11045","ITP-96-01E","hep-th cond-mat hep-lat",,"  It is shown that the partition function of the 2d Ising model on the dual
finite lattice with periodical boundary conditions is expressed through some
specific combination of the partition functions of the model on the torus with
corresponding boundary conditions. The generalization of the duality relations
for the nonhomogeneous case is given. These relations are proved for the
weakly-nonhomogeneous distribution of the coupling constants for the finite
lattice of arbitrary sizes. Using the duality relations for the nonhomogeneous
Ising model, we obtain the duality relations for the two-point correlation
function on the torus, the 2d Ising model with magnetic fields applied to the
boundaries and the 2d Ising model with free, fixed and mixed boundary
conditions.
","[{""version"":""v1"",""created"":""Sat, 20 Jan 1996 09:09:01 GMT""}]","2009-10-30"
"patt-sol/9601002","David Raitt","David Raitt (Florida State University), Hermann Riecke (Northwestern
  University)","Parametric Forcing of Waves with Non-Monotonic Dispersion Relation:
  Domain Structures in Ferrofluids?","23 pages, 6 postscript figures, composed using RevTeX. Submitted to
  PRE",,"10.1103/PhysRevE.55.5448",,"patt-sol nlin.PS",,"  Surface waves on ferrofluids exposed to a dc-magnetic field exhibit a
non-monotonic dispersion relation. The effect of a parametric driving on such
waves is studied within suitable coupled Ginzburg-Landau equations. Due to the
non-monotonicity the neutral curve for the excitation of standing waves can
have up to three minima. The stability of the waves with respect to long-wave
perturbations is determined $via$ a phase-diffusion equation. It shows that the
band of stable wave numbers can split up into two or three sub-bands. The
resulting competition between the wave numbers corresponding to the respective
sub-bands leads quite naturally to patterns consisting of multiple domains of
standing waves which differ in their wave number. The coarsening dynamics of
such domain structures is addressed.
","[{""version"":""v1"",""created"":""Fri, 19 Jan 1996 21:17:41 GMT""}]","2009-10-30"
