"astro-ph/9610042","Jai-chan Hwang","J. Hwang","Roles of a coherent scalar field on the evolution of cosmic structures","4 pages, revtex, no figures, discussion revised","Phys.Lett. B401 (1997) 241-246","10.1016/S0370-2693(97)00400-0",,"astro-ph gr-qc",,"  A coherently oscillating scalar field, an axion as an example, is known to
behave as a cold dark matter. The arguments were usually made in the Newtonian
context. Ratra proved the case in relativistic context using the synchronous
gauge. In this paper we present another proof based on a more suitable gauge
choice, the uniform-curvature gauge, which fits the problem. By a proper time
averaging the perturbed oscillating scalar field behaves as a cold dark matter
on the relevant scales including the superhorizon scale.
","[{""version"":""v1"",""created"":""Mon, 7 Oct 1996 05:09:40 GMT""},{""version"":""v2"",""created"":""Wed, 9 Oct 1996 01:47:33 GMT""}]","2009-10-28"
"astro-ph/9610043","Jerry Kriss","Gerard A. Kriss (Johns Hopkins University)","Resolving the C IV and Mg II Absorption in NGC 4151","4 pages, 2 PostScript files, uses paspconf.sty. To appear in the
  proceedings of the GHRS Science Symposium, September 1996, J.C. Brandt, C.C.
  Petersen, and T.B. Ake, eds",,,,"astro-ph",,"  Observations of the C IV and Mg II absorption lines in the Seyfert 1 galaxy
NGC 4151 obtained with the GHRS in October 1994 are presented. The data from
the STScI archive show multiple broad and narrow components in both species. In
addition to Galactic absorption, four narrow and four broad systems associated
with NGC 4151 are identified. Two broad systems dominate the total equivalent
width, and their mean blueshift and width are comparable to the broad Lyman
line and continuum absorption seen in far-UV spectra from the Hopkins
Ultraviolet Telescope. Narrow-line C IV emission is present on the red side of
the broadest absorption trough, and narrow absorption at the systemic velocity
of NGC 4151, presumably in its own ISM, absorbs the core of the narrow emission
line. Strong Mg II absorption is present in all but two velocity systems.
Ratios relative to the corresponding C IV components suggest a low ionization
parameter for the absorbing gas: U ~ 1-3 x 10^{-3}. This makes none of the
identified UV absorption systems a good candidate for association with the warm
X-ray absorbing gas.
","[{""version"":""v1"",""created"":""Mon, 7 Oct 1996 13:27:58 GMT""}]","2007-05-23"
"astro-ph/9610044","Steven Weinberg","Steven Weinberg","Theories of the Cosmological Constant","10 pages, no figures. This is a plain LaTeX file. No special macros
  are needed",,,"UTTG-10-96","astro-ph gr-qc hep-ph",,"  This is a talk given at the conference ``Critical Dialogues in Cosmology'' at
Princeton University, June 24-- 27, 1996. It gives a brief summary of our
present theoretical understanding regarding the value of the cosmological
constant, and describes how to calculate the probability distribution of the
observed cosmological constant in cosmological theories with a large number of
subuniverses (i. e., different expanding regions, or different terms in the
wave function of the universe) in which this constant takes different values.
","[{""version"":""v1"",""created"":""Mon, 7 Oct 1996 13:57:22 GMT""}]","2016-08-30"
"chao-dyn/9610011","Hans Henrik Rugh","Hans Henrik Rugh","Intermittency and Regularized Fredholm Determinants","22 pages, LaTeX",,,"Warwick Preprints: 41/1996","chao-dyn nlin.CD",,"  We consider real-analytic maps of the interval $I=[0,1]$ which are expanding
everywhere except for a neutral fixed point at 0. We show that on a certain
function space the spectrum of the associated Perron-Frobenius operator ${\cal
M}$ has a decomposition $Sp ({\cal M}) = \sigma_c \cup \sigma_p$ where
$\sigma_c=[0,1]$ is the continuous spectrum of ${\cal M}$ and $\sigma_p$ is the
pure point spectrum with no points of accumulation outside 0 and 1. We
construct a regularized Fredholm determinant $d(\lambda)$ which has a
holomorphic extension to $\lambda \in C-\sigma_c$ and can be analytically
continued from each side of $\sigma_c$ to an open neighborhood of
$\sigma_c-{0,1}$ (on different Riemann sheets). In $C-\sigma_c$ the zero-set of
$d(\lambda)$ is in one-to-one correspondence with the point spectrum of ${\cal
M}$. Through the conformal transformation $\lambda(z) = 1/(4z) (1+z)^2$ the
function $d \circ \lambda(z)$ extends to a holomorphic function in a domain
which contains the unit disc.
","[{""version"":""v1"",""created"":""Mon, 7 Oct 1996 15:13:52 GMT""}]","2008-02-03"
"cond-mat/9610036","James P. Sethna","Olga Perkovic and James P. Sethna","Improved Magnetic Information Storage using Return-Point Memory","9 pages, 15 figures",,"10.1063/1.364088",,"cond-mat.mtrl-sci",,"  The traditional magnetic storage mechanisms (both analog and digital) apply
an external field signal H(t) to a hysteretic magnetic material, and read the
remanent magnetization M(t), which is (roughly) proportional to H(t). We
propose a new analog method of recovering the signal from the magnetic
material, making use of the shape of the hysteresis loop M(H). The field H,
``stored'' in a region with N domains or particles, can be recovered with
fluctuations of order 1/N using the new method - much superior to the 1/sqrt{N}
fluctuations in traditional analog storage.
","[{""version"":""v1"",""created"":""Sun, 6 Oct 1996 16:30:34 GMT""}]","2009-10-28"
"cond-mat/9610037","Leonid GLazman","Matthew P.A. Fisher, Leonid I. Glazman","Transport in a one-dimensional Luttinger liquid","20 pages, including 7 Postscript figures. Paper to be published in
  ""Mesoscopic Electron Transport"", edited by L. Kowenhoven, G. Schoen and L.
  Sohn, NATO ASI Series E, Kluwer Ac. Publ., Dordrecht",,,,"cond-mat.mes-hall",,"  In this paper we review recent theoretical results for transport in a
one-dimensional (1d) Luttinger liquid. For simplicity, we ignore electron spin,
and focus exclusively on the case of a single-mode. Moreover, we consider only
the effects of a single (or perhaps several) spatially localized impurities.
Even with these restrictions, the predicted behavior is very rich, and
strikingly different than for a 1d non-interacting electron gas. The method of
bosonization is reviewed, with an emphasis on physical motivation, rather than
mathematical rigor. Transport through a single impurity is reviewed from
several different perspectives, as a pinned strongly interacting ``Wigner""
crystal and in the limit of weak interactions. The existence of fractionally
charged quasiparticles is also revealed. Inter-edge tunnelling in the quantum
Hall effect, and charge fluctuations in a quantum dot under the conditions of
Coulomb blockade are considered as examples of the developed techniques.
","[{""version"":""v1"",""created"":""Sun, 6 Oct 1996 18:15:25 GMT""}]","2008-02-03"
"cond-mat/9610038","Kazuhiko Kuroki","Kazuhiko Kuroki, Takashi Kimura, Hideo Aoki","Quantum Monte Carlo study of the pairing correlation in the Hubbard
  ladder","10 pages, RevTeX, 5 figures in PostScript files",,"10.1103/PhysRevB.54.R15641",,"cond-mat.str-el",,"  An extensive Quantum Monte Carlo calculation is performed for the two-leg
Hubbard ladder model to clarify whether the singlet pairing correlation decays
slowly, which is predicted from the weak-coupling theory but controversial from
numerical studies. Our result suggests that the discreteness of energy levels
in finite systems affects the correlation enormously, where the enhanced
pairing correlation is indeed detected if we make the energy levels of the
bonding and anti-bonding bands lie close to each other at the Fermi level to
mimic the thermodynamic limit.
","[{""version"":""v1"",""created"":""Mon, 7 Oct 1996 01:58:03 GMT""}]","2009-10-28"
"cond-mat/9610039","Hemant Bokil","Hemant Bokil and Onuttom Narayan (University of California, Santa
  Cruz)","Flux penetration in slab shaped Type-I superconductors","4 pages, 2 figures, Fig 2.(b) available upon request from the
  authors, email - bokil@chopin.ucsc.edu",,"10.1103/PhysRevB.56.11195",,"cond-mat.supr-con",,"  We study the problem of flux penetration into type--I superconductors with
high demagnetization factor (slab geometry).Assuming that the interface between
the normal and superconducting regions is sharp, that flux diffuses rapidly in
the normal regions, and that thermal effects are negligible, we analyze the
process by which flux invades the sample as the applied field is increased
slowly from zero.We find that flux does not penetrate gradually.Rather there is
an instability in the process and the flux penetrates from the boundary in a
series of bursts, accompanied by the formation of isolated droplets of the
normal phase, leading to a multiply connected flux domain structure similar to
that seen in experiments.
","[{""version"":""v1"",""created"":""Mon, 7 Oct 1996 04:52:45 GMT""}]","2009-10-28"
"cond-mat/9610040","Walter Apel","W. Apel (1) and Yu. A. Bychkov (2,1) ((1) Physikalisch-Technische
  Bundesanstalt, Germany and (2) L.D. Landau Institute for Theoretical Physics,
  Russia)","Hopf term and the effective Lagrangian for the Skyrmions in a
  two-dimensional electron gas at small g-factor","4 pages, Latex","Phys. Rev. Lett. 78, 2188 (1997)","10.1103/PhysRevLett.78.2188",,"cond-mat.mes-hall",,"  We study interacting electrons in two dimensions moving in the lowest Landau
level under the condition that the Zeeman energy is much smaller than the
Coulomb energy and the filling factor is one. In this case, Skyrmion
quasiparticles play an important role. Here, we present a simple and
transparent derivation of the corresponding effective Lagrangian. In its
kinetic part, we find a non-zero Hopf term the prefactor of which we determine
rigorously. In the Hamiltonian part, we calculate, by means of a gradient
expansion, the Skyrmion-Skyrmion interaction completely up to fourth order in
spatial derivatives.
","[{""version"":""v1"",""created"":""Mon, 7 Oct 1996 06:38:39 GMT""}]","2009-10-28"
"cond-mat/9610042","Dr. Sriram Ramaswamy","Alex Levine, Sriram Ramaswamy, and Robijn Bruinsma","Nonequilibrium Fluctuations in Sedimenting Suspensions: A Dynamical
  Renormalization Group Theory","Four pages, revtex, two .eps files, uses epsf.sty",,,,"cond-mat.soft",,"  A nonlinear two-fluid stochastic hydrodynamical description of velocity and
concentration fluctuations in sedimenting suspensions is constructed, and
analyzed using self-consistent (SC) and renormalization group (RG) methods. The
advection of particles by velocity fluctuations is shown to be ``relevant'' in
all dimensions $d < 6$ . Both RG and SC analyses predict a strong reduction in
the dependence of velocity fluctuations on system-size $L$ relative to the
$L^{1/2}$ obtained in the linearized theory of Caflisch and Luke [Phys. Fluids
{\bf 28}, 785 (1985)]. This is an important step towards resolving a ten-year
old puzzle in the field.
","[{""version"":""v1"",""created"":""Mon, 7 Oct 1996 08:47:48 GMT""}]","2008-02-03"
"cond-mat/9610043","Walter Apel","Lothar Spies (1), Walter Apel (2), and Bernhard Kramer (1) ((1) U
  Hamburg, (2) PTB Braunschweig, Germany )","Exact density of states of a two-dimensional electron gas in a strong
  magnetic field and a long-range correlated random potential","4 pages, latex; 3 pictures in postscript format","Phys. Rev. B 55, 4057 (1997)","10.1103/PhysRevB.55.4057",,"cond-mat.mes-hall",,"  We derive an exact result for the averaged Feynman propagator and the
corresponding density of states of an electron in two dimensions in a
perpendicular homogeneous magnetic field and a Gaussian random potential with
long-range spatial correlations described by a quadratic correlation function.
","[{""version"":""v1"",""created"":""Mon, 7 Oct 1996 09:21:55 GMT""}]","2009-10-28"
"cond-mat/9610044","Vincenzo Fiorentini","Fabio Bernardini, Vincenzo Fiorentini, and R. M. Nieminen","Zn-related deep centers in wurtzite GaN","4 pages, to appear in ""The Physics of Semiconductors""",,,"CA96-BFN1","cond-mat.mtrl-sci",,"  Zn in GaN forms an efficient radiative center and acts as a deep acceptor
which can make the crystal insulating. Four different Zn-related centers have
been by now identified, leading to light emission in the range between 1.8 eV
and 2.9 eV. We present a first-principles investigation total energy and
electronic structure calculations for Ga-substitutional and hetero-antisite
N-substitutional Zn in wurtzite GaN, using ultrasoft pseudopotentials and a
conjugate-gradient total energy minimization method. Our results permit the
identification of the blue-light emission center as the substitutional
acceptor, while contrary to a common belief the Zn_N heteroantisite has a very
high formation energy and donor behavior, which seems to exclude it as the
origin of the other centers.
","[{""version"":""v1"",""created"":""Mon, 7 Oct 1996 11:28:19 GMT""}]","2016-08-31"
"cond-mat/9610045","Vincenzo Fiorentini","V. Fiorentini, F. Bernardini, A. Bosin, D. Vanderbilt","Ab initio shallow acceptor levels in gallium nitride","4 pages, to appear in ""The Physics of Semiconductors""",,,,"cond-mat.mtrl-sci",,"  Impurity levels and formation energies of acceptors in wurtzite GaN are
predicted ab initio. Be_Ga is found to be the shallow (thermal ionization
energy $\sim$ 0.06 eV); $Mg_{Ga}$ and $Zn_{Ga}$ are mid-deep acceptors (0.23 eV
and 0.33 eV respectively); $Ca_{Ga}$ and $Cd_{Ga}$ are deep acceptors
($\sim$0.65 eV); $Si_N$ is a midgap trap with high formation energy; finally,
contrary to recent claims, $C_N$ is a deep acceptor (0.65 eV). Interstitials
and heteroantisites are energetically not competitive with substitutional
incorporation.
","[{""version"":""v1"",""created"":""Mon, 7 Oct 1996 11:33:32 GMT""}]","2008-02-03"
"cond-mat/9610046","Vincenzo Fiorentini","V. Fiorentini, M. Methfessel","Extracting convergent surface energies from slab calculations","3 revtex pages, 1 figure, in print on J. Phys. Cond. Matt","J.Phys.Cond.Matt. 8, 6525 (1996)","10.1088/0953-8984/8/36/005",,"cond-mat.mtrl-sci",,"  The formation energy of a solid surface can be extracted from slab
calculations if the bulk energy per atom is known. It has been pointed out
previously that the resulting surface energy will diverge with slab thickness
if the bulk energy is in error, in the context of calculations which used
different methods to study the bulk and slab systems. We show here that this
result is equally relevant for state-of-the-art computational methods which
carefully treat bulk and slab systems in the same way. Here we compare
different approaches, and present a solution to the problem that eliminates the
divergence and leads to rapidly convergent and accurate surface energies.
","[{""version"":""v1"",""created"":""Mon, 7 Oct 1996 11:42:54 GMT""}]","2009-10-28"
"cond-mat/9610047","Poul Olesen","Mogens H. Jensen, Poul Olesen","Turbulent Binary Fluids: A Shell Model Study","25 pages including 9 figures in epsf. Some figures have been revised,
  and a few comments have been inserted in the text. To be published in Physica","Physica D111 (1998) 243","10.1016/S0167-2789(97)80014-0",,"cond-mat.soft astro-ph chao-dyn nlin.CD",,"  We introduce a shell (``GOY'') model for turbulent binary fluids. The
variation in the concentration between the two fluids acts as an active scalar
leading to a redefined conservation law for the energy, which is incorporated
into the model together with a conservation law for the scalar. The model is
studied numerically at very high values of the Prandtl and Reynolds numbers and
we investigate the properties close to the critical point of the miscibility
gap where the diffusivity vanishes. A peak develops in the spectrum of the
scalar, showing that a strongly turbulent flow leads to an increase in the
mixing time. The peak is, however, not very pronounced. The mixing time
diverges with the Prandtl number as a power law with an exponent of
approximately 0.9. The continuum limit of the shell equations leads to a set of
equations which can be solved by a scaling ansatz, consistent with an exact
scaling of the Navier-Stokes equations in the inertial range. In this case a
weak peak also persists for a certain time in the spectrum of the scalar. Exact
analytic solutions of the continuous shell equations are derived in the
inertial range. Starting with fluids at rest, from an initial variation of the
concentration difference, one can provoke a ``spontaneous'' generation of a
velocity field, analogous to MHD in the early universe.
","[{""version"":""v1"",""created"":""Mon, 7 Oct 1996 12:27:20 GMT""},{""version"":""v2"",""created"":""Thu, 24 Apr 1997 15:43:20 GMT""},{""version"":""v3"",""created"":""Mon, 9 Jun 1997 11:27:05 GMT""}]","2009-10-28"
"cond-mat/9610048","Peter Olmsted","Peter D. Olmsted (Leeds Physics) and F. C. MacKintosh (University of
  Michigan Physics)","Instability and front propagation in laser-tweezed lipid bilayer tubules","12 page latex + figures using epsf.sty to be published in Journal de
  Physique II, January 1997","Journal de Physique II 7 (1997) 139-156","10.1051/jp2:1997118",,"cond-mat.soft",,"  We study the mechanism of the `pearling' instability seen recently in
experiments on lipid tubules under a local applied laser intensity. We argue
that the correct boundary conditions are fixed chemical potentials, or surface
tensions \Sigma, at the laser spot and the reservoir in contact with the
tubule. We support this with a microscopic picture which includes the intensity
profile of the laser beam, and show how this leads to a steady-state flow of
lipid along the surface and gradients in the local lipid concentration and
surface tension (or chemical potential). This leads to a natural explanation
for front propagation and makes several predictions based on the tubule length.
While most of the qualitative conclusions of previous studies remain the same,
the `ramped' control parameter (surface tension) implies several new
qualitative results. We also explore some of the consequences of front
propagation into a noisy (due to pre-existing thermal fluctuations) unstable
medium.
","[{""version"":""v1"",""created"":""Mon, 7 Oct 1996 13:37:03 GMT""}]","2009-10-28"
"hep-ph/9610263","Edward Sarkisyan","E.K.G. Sarkisyan (Tel Aviv University), L.K. Gelovani, G.L.
  Gogiberidze (JINR)","On Dynamics of Fractality in Central C-Cu Collisions at 4.5A Gev/c","1+8 pages, 6 figures, LaTeX. Talk given by E. Sarkisyan at the 7th
  International Workshop on Multiparticle Dynamics, ``Correlations and
  Fluctuations'' Nijmegen, The Netherlands, June 30 - July 6, 1996. To appear
  in the Proceedings (World Scientific, Singapore, 1997)",,,"TAUP 2370-96","hep-ph hep-ex",,"  Fractal structure of charged particle distributions in the pseudorapidity and
transverse momentum in central C-Cu collisions at 4.5A GeV/c is studied by
means of intermittency approach and multifractal analysis. The modifications to
take into account statistical bias are applied. Intermittency study in the
pseudorapidity phase space indicates a non-thermal phase transition and
different regimes of multiparticle production. Multifractality is observed
within the both methods applied. The interrelation of the methods using the
effective average multiplicity approach is studied. The findings support the
idea of statistical significance of influence of finite multiplicities. In the
transverse momentum spectrum no dynamical fluctuations are found.
","[{""version"":""v1"",""created"":""Sun, 6 Oct 1996 19:03:21 GMT""}]","2007-05-23"
"hep-ph/9610264","Pyungwon Ko","Jihn E. Kim (Seoul National University, Korea)","Can Strong QCD in the Early Universe Raise the Axion Decay Constant?","Invited talk given in ICHEP'96, Poland. To appear in the proceeding.
  The tex file, one figure and the stwol.sty files are all included.",,,"SNUTP 96-107","hep-ph",,"  We report that the hypothesis that the upper bound on the axion decay
constant can be moved up beyond $10^{12}$ GeV in models with a stronger QCD in
the early universe is not realized. This proof is possible by studying the
superpotential in the dual model and obtaining the form of the axion potential
respecting the original global symmetries.
","[{""version"":""v1"",""created"":""Mon, 7 Oct 1996 06:48:28 GMT""}]","2016-09-06"
"hep-ph/9610265","Jan Bolz","J. Bolz, P. Kroll (University of Wuppertal, Germany) and G.A. Schuler
  (CERN)","Colour-octet contributions to exclusive charmonium decays","12 pages Latex, 3 PS-files of figures, uses macros 'amstex' and
  'psfig'; also available by anonymous ftp from
  ftp://wpts0.physik.uni-wuppertal.de/pub/bolz/pwav/","Phys.Lett. B392 (1997) 198-206","10.1016/S0370-2693(96)01515-8","CERN-TH/96-266 and WU B 96-28","hep-ph",,"  We investigate the theoretical uncertainties of $P$-wave charmonium decays
into two pions, $\chi_{\c J}\rightarrow \pi^+\pi^-$, $\pi^0\pi^0$. Constraining
the pion distribution-amplitude from the recent precise data on
$F_{\pi\gamma}(Q^2)$, we find an order-of-magnitude discrepancy between data
and prediction. The disagreement persists even after inclusion of transverse
degrees of freedom and Sudakov suppressions. We propose the colour-octet
mechanism as the solution to the puzzle. The colour-octet decay contribution
arising from the higher Fock component $|\c \cbar \g >$ of the $\chi_{\c J}$
wave function is actually not power suppressed with respect to the usual
colour-singlet decay arising from the dominant $|\c \cbar >$ Fock state. An
explicit calculation yields an agreement with the data for a very reasonable
value for the single extra non-perturbative parameter.
","[{""version"":""v1"",""created"":""Mon, 7 Oct 1996 10:32:44 GMT""}]","2009-10-28"
"hep-ph/9610266","Matthias Neubert","Matthias Neubert (CERN)","Heavy-Quark Effective Theory","45 pages, 11 figures; Lectures presented at the 34th International
  School of Subnuclear Physics: Effectives Theories and Fundamental
  Interactions, Erice, Italy, 3-12 July 1996",,,"CERN-TH/96-281","hep-ph",,"  We give an introduction to the heavy-quark effective theory and the $1/m_Q$
expansion, which provide the modern framework for a systematic,
model-independent description of the properties and decays of hadrons
containing a heavy quark. We discuss the applications of these concepts to
spectroscopy and to the weak decays of $B$ mesons.
","[{""version"":""v1"",""created"":""Mon, 7 Oct 1996 13:23:00 GMT""}]","2007-05-23"
"hep-ph/9610267","Bernd Kniehl","B.A. Kniehl (MPI Munich), G. Kramer (Hamburg University), M. Spira
  (CERN)","Large-p_T Photoproduction of D^*+- Mesons in ep Collisions","31 pages (Latex), 13 figures (Postscript). This version of the
  manuscript is identical with the one being printed in Z. Phys. C","Z.Phys.C76:689-700,1997","10.1007/s002880050591","CERN-TH/96-274, DESY 96-210, MPI/PhT/96-103","hep-ph hep-ex",,"  The cross section for the inclusive photoproduction of large-p_T D^*+- mesons
is calculated at next-to-leading order, adopting different approaches to
describe the fragmentation of charm quarks into D^*+- mesons. We treat the
charm quark according to the massless factorization scheme, where it is assumed
to be one of the active flavours inside the proton and the photon. We present
inclusive single-particle distributions in transverse momentum and rapidity,
including the contributions due to both direct and resolved photons. We compare
and assess the various implementations of fragmentation. We argue that, in the
high-p_T regime, a particularly realistic description can be obtained by
convoluting the Altarelli-Parisi-evolved fragmentation functions of Peterson et
al. with the hard-scattering cross sections of massless partons where the
factorization of the collinear singularities associated with final-state charm
quarks is converted to the massive-charm scheme. The predictions thus obtained
agree well with recent experimental data by the H1 and ZEUS Collaborations at
DESY HERA.
","[{""version"":""v1"",""created"":""Mon, 7 Oct 1996 13:13:00 GMT""},{""version"":""v2"",""created"":""Tue, 17 Jun 1997 12:39:38 GMT""},{""version"":""v3"",""created"":""Mon, 13 Oct 1997 08:23:18 GMT""}]","2014-11-17"
"hep-ph/9610269",,"J. Bijnens and P. Talavera","$\pi \to l\nu \gamma$ Form Factors at Two-loop","Added cut-off dependence discusion, misprints corrected","Nucl.Phys. B489 (1997) 387-404","10.1016/S0550-3213(97)00069-2","NORDITA-96/69 N,P","hep-ph",,"  Within Chiral Perturbation Theory (CHPT) we compute the form factors A, V and
$\gamma = A/V$ in the $\pi \to \nu l \gamma$ decay to $O(p^6)$. A and $\gamma$
obtain corrections of order 25%.
","[{""version"":""v1"",""created"":""Mon, 7 Oct 1996 15:27:46 GMT""},{""version"":""v2"",""created"":""Tue, 28 Jan 1997 08:53:54 GMT""}]","2016-09-06"
"hep-th/9610031","Yoon Soo Myung","H.W. Lee, Y.S. Myung(Inje U.), Jin Young Kim(Dongseo U.), D. K.
  Park(Kyungnam U.)","Higher dimensional extremal black strings","18 pages no figure, RevTeX",,,"INJE-TP-96-5","hep-th",,"  We investigate the five and six-dimensional black strings within
Einstein-Maxwell theory. The extremal black strings are endowed with the null
Killing symmetry. We study the propagation of Einstein-Maxwell modes in the
extremal black string background by using this symmetry. It turns out that one
graviton is a propagating mode, while both the Maxwell $F$ and three-form $H$
fields are non-propagating modes. Further we discuss the stability and
classical hair of the extremal black strings.
","[{""version"":""v1"",""created"":""Mon, 7 Oct 1996 05:24:30 GMT""}]","2016-09-06"
