"hep-th/9610032","Enrique Alvarez","Enrique Alvarez and Yuri Kubyshin (UAM Madrid; and MSU Moscow)","Is the String Coupling Constant invariant under T-duality?","LaTeX, 13 pag. Contributions to Santa Margherita and S. Petersburg
  meetings","Nucl.Phys.Proc.Suppl. 57 (1997) 44-51","10.1016/S0920-5632(97)00352-6","FTUAM-96/24","hep-th",,"  It is well known that under T-duality the sigma model dilaton (which is
normally thought to be related to the string coupling constant through the
simple formula $\kappa = exp <\phi >$), undergoes an additive shift. On the
other hand, Kugo and Zwiebach, using a simplified form of string field theory,
claim that the string coupling constant does not change under the T-duality.
Obviously, what seems to happen is that two different coupling constants,
associated to different dilatons, are used. In this contribution we shall try
to clarify this, and related issues.
","[{""version"":""v1"",""created"":""Mon, 7 Oct 1996 09:49:45 GMT""}]","2009-10-30"
"hep-th/9610033","Steven Brumby","S.P. Brumby and G.C. Joshi (Melbourne Uni.)","Global effects in quaternionic quantum field theory","11 pages, no figures, revtex","Found.Phys. 26 (1996) 1591-1599","10.1007/BF02282122","UM-P-96/88; RCHEP 96/11","hep-th gr-qc hep-ph quant-ph",,"  We present some striking global consequences of a model quaternionic quantum
field theory which is locally complex. We show how making the quaternionic
structure a dynamical quantity naturally leads to the prediction of cosmic
strings and non-baryonic hot dark matter candidates.
","[{""version"":""v1"",""created"":""Mon, 7 Oct 1996 10:48:19 GMT""}]","2009-10-30"
"hep-th/9610034","Tigran S. Hakobyan","D.R.Karakhanyan","The effective action of W_3-gravity","Final version for publication, 17 pages, LaTeX file","Zh. Exp. Teor. Fiz. 111 1537 (1997)","10.1134/1.558239",,"hep-th",,"  A new method for integrating anomalous Ward identities and finding the
effective action is proposed. Two-dimensional supergravity and $W_3$-gravity
are used as examples to demonstrate its potential. An operator is introduced
that associates each physical quantity with a Ward identity, i.e., a quantity
that is transformed without anomalous terms and can be nullified in a
consistent manner. A covariant form of the action for matter field interacting
with a gravitational and $W_3$-gravitational background is proposed.
","[{""version"":""v1"",""created"":""Mon, 7 Oct 1996 11:50:42 GMT""},{""version"":""v2"",""created"":""Wed, 29 Apr 1998 08:02:44 GMT""}]","2009-10-30"
"hep-th/9610035","Gennaro Miele","F. Lizzi, G. Mangano, G. Miele and G. Sparano","Fermion Hilbert Space and Fermion Doubling in the Noncommutative
  Geometry Approach to Gauge Theories","plain LaTeX, pp. 17","Phys.Rev.D55:6357-6366,1997","10.1103/PhysRevD.55.6357","DSF-T-45/96, OUTP-96-61-P","hep-th",,"  In this paper we study the structure of the Hilbert space for the recent
noncommutative geometry models of gauge theories. We point out the presence of
unphysical degrees of freedom similar to the ones appearing in lattice gauge
theories (fermion doubling). We investigate the possibility of projecting out
these states at the various levels in the construction, but we find that the
results of these attempts are either physically unacceptable or geometrically
unappealing.
","[{""version"":""v1"",""created"":""Mon, 7 Oct 1996 12:47:11 GMT""}]","2010-11-19"
"hep-th/9610036","M. Libanov","M.V. Libanov","Multiparticle Threshold Amplitudes Exponentiate in Arbitrary Scalar
  Theories","9 pages, latex, 3 latex figures","Mod.Phys.Lett. A11 (1996) 2539-2546","10.1142/S021773239600254X","INR-ST-8-96","hep-th",,"  Threshold amplitudes are considered for $n$-particle production in arbitrary
scalar theory. It is found that, like in $\phi ^4$, leading-$n$ corrections to
the tree level amplitudes, being summed over all loops, exponentiate. This
result provides more evidence in favor of the conjecture on the exponential
behavior of the multiparticle amplitudes.
","[{""version"":""v1"",""created"":""Mon, 7 Oct 1996 13:18:25 GMT""}]","2015-06-26"
"hep-th/9610037","Francois David","Francois David","A scenario for the c>1 barrier in non-critical bosonic strings","20 pages, REVTeX3.0 + epsf, 10 figures. 1 reference added. To appear
  in Nucl. Phys. B","Nucl.Phys. B487 (1997) 633-649","10.1016/S0550-3213(96)00716-X","Saclay-T96/112","hep-th",,"  The c<1 and c>1 matrix models are analyzed within large N renormalization
group, taking into account touching (or branching) interactions. The c<1
modified matrix model with string exponent gamma>0 is naturally associated with
an unstable fixed point, separating the Liouville phase (gamma<0) from the
branched polymer phase (gamma=1/2). It is argued that at c=1 this multicritical
fixed point and the Liouville fixed point coalesce, and that both fixed points
disappear for c>1. In this picture, the critical behavior of c>1 matrix models
is generically that of branched polymers, but only within a scaling region
which is exponentially small when c -> 1. It also explains the behavior of
multiple Ising spins coupled to gravity. Large crossover effects occur for c-1
small enough, with a c ~ 1 pseudo-scaling which explains numerical results.
","[{""version"":""v1"",""created"":""Mon, 7 Oct 1996 14:01:24 GMT""},{""version"":""v2"",""created"":""Wed, 13 Nov 1996 09:59:44 GMT""},{""version"":""v3"",""created"":""Tue, 17 Dec 1996 09:29:42 GMT""}]","2009-10-30"
"hep-th/9610038",,"Dmitrij Sorokin and Francesco Toppan","An n=(1|1) super--Toda Model Based on OSp(1|4)","LaTex file, 12 pages","Lett.Math.Phys.42:139-152,1997","10.1023/A:1007396708587","DFPD 96/TH/49","hep-th",,"  We show that a Hamiltonian reduction of affine Lie superalgebras having
bosonic simple roots (such as $OSp(1|4)$) ``does'' produce supersymmetric Toda
models, with superconformal symmetry being nonlinearly realised for those
fields of the Toda system which are related to the bosonic simple roots of the
superalgebra. A fermionic $b-c$ system of conformal spin $(3/2,-1/2)$ is a
natural ingredient of such models.
","[{""version"":""v1"",""created"":""Mon, 7 Oct 1996 15:33:19 GMT""}]","2011-07-19"
"math/9610205","Greg Hjorth","Greg Hjorth","Sharper changes in topologies",,,,"Logic E-prints October 07, 1996","math.LO",,"  Becker and Kechris showed that if a Polish group G acts continuously on a
Polish space X, then for any invariant Borel set B we can change the topology
on X so that B becomes open, the Borel structure is preserved, and the action
continues to be continuous.
  In this brief paper a short proof is presented for their theorem. The method
also gives optimal bounds in terms of minimizing the change to the original
topology.
","[{""version"":""v1"",""created"":""Mon, 7 Oct 1996 00:00:00 GMT""}]","2009-09-25"
"math/9610210",,"Peter G. Casazza, Nigel J. Kalton","Uniqueness of unconditional bases in Banach spaces",,,,"Banach Archive 10/7/96","math.FA",,"  We prove a general result on complemented unconditional basic sequences in
Banach lattices and apply it to give some new examples of spaces with unique
unconditional basis. We show that Tsirelson space and certain Nakano spaces
have the unique unconditional bases. We also construct an example of a space
with a unique unconditional basis with a complemented subspace failing to have
a unique unconditional basis.
","[{""version"":""v1"",""created"":""Mon, 7 Oct 1996 00:00:00 GMT""}]","2009-09-25"
"math/9610211",,"Nigel J. Kalton, A. Pelczynski","Kernels of surjections from ${\cal L}_1$-spaces with an application to
  Sidon sets",,,,"Banach Archive 10/7/96","math.FA",,"  If $Q$ is a surjection from $L^1(\mu)$, $\mu$ $\sigma$-finite, onto a Banach
space containing $c_0$ then (*) $\ker Q$ is uncomplemented in its second dual.
If $Q$ is a surjection from an ${\cal L}_1$-space onto a Banach space
containing uniformly $\ell_n^\infty$ ($n=1,2,\dots$) then (**) there exists a
bounded linear operator from $\ker Q$ into a Hilbert space which is not
2-absolutely summing. Let $S$ be an infinite Sidon set in the dual group
$\Gamma$ of a compact abelian group $G$. Then $L^1_{\tilde{S}}(G)=\{f\in
L^1(G): \hat{f}(\gamma)=0$ for $\gamma\in S\}$ satisfies (*) and (**) hence
$L^1_{\tilde{S}}(G)$ is not an ${\cal L}_1$-space and is not isomorphic to a
Banach lattice.
","[{""version"":""v1"",""created"":""Mon, 7 Oct 1996 00:00:00 GMT""}]","2009-09-25"
"math/9610212",,"Denny H. Leung","Compact subsets of $\Ps(\N)$ with applications to the embedding of
  symmetric sequence spaces into $C(\alpha)$",,,,"Banach Archive 10/7/96","math.FA",,"  Let $\Ps(\N)$ be the set of all finite subsets of $\N$, endowed with the
product topology. A description of the compact subsets of $\Ps(\N)$ is given.
Two applications of this result to Banach space theory are shown : (1) a
characterization of the symmetric sequence spaces which embed into
$C(\om^\om)$, and (2) a characterization, in terms of the Orlicz function $M$,
of the Orlicz sequence spaces $h_M$ which embed into $C(K)$ for some countable
compact Hausdorff space $K$.
","[{""version"":""v1"",""created"":""Mon, 7 Oct 1996 00:00:00 GMT""}]","2009-09-25"
"q-alg/9610008","Won-Sang Chung","W-S.Chung","The Polar Decomposition of q-Deformed Boson Algebra","LaTeX v1.2, 6 pages with no figures",,,"Gyeongsang National Univerrsity Preprint","q-alg math.QA",,"  In this paper we used the finite Fourier transformation to obtain the polar
decomposition of the q-deformed boson algebra with $q$ a root of unity.
","[{""version"":""v1"",""created"":""Mon, 7 Oct 1996 04:01:08 GMT""}]","2008-02-03"
"quant-ph/9610006","Henrik Carlsen","Erik Sjoeqvist, Henrik Carlsen and Harvey R. Brown","Galilean non-invariance of geometric phase","LaTeX, 6 pages, no figures",,"10.1016/S0375-9601(97)00214-4",,"quant-ph",,"  It is shown that geometric phase in non-relativistic quantum mechanics is not
Galilean invariant.
","[{""version"":""v1"",""created"":""Sun, 6 Oct 1996 18:59:25 GMT""}]","2009-10-30"
