"cond-mat/9610061","D. P. Chu","D. P. Chu, M. G. Dowsett, and G. A. Cooke (Department of Physics,
  University of Warwick, Coventry, UK)","Characterization of the Noise in Secondary Ion Mass Spectrometry Depth
  Profiles","14 pages, 4 postscript figures, to appear on J. Appl. Phys",,"10.1063/1.363722",,"cond-mat.mtrl-sci",,"  The noise in the depth profiles of secondary ion mass spectrometry (SIMS) is
studied using different samples under various experimental conditions. Despite
the noise contributions from various parts of the dynamic SIMS process, its
overall character agrees very well with the Poissonian rather than the Gaussian
distribution in all circumstances. The Poissonian relation between the measured
mean-square error (MSE) and mean can be used to describe our data in the range
of four orders. The departure from this relation at high counts is analyzed and
found to be due to the saturation of the channeltron used. Once saturated, the
detector was found to exhibit hysteresis between rising and falling input flux
and output counts.
","[{""version"":""v1"",""created"":""Tue, 8 Oct 1996 15:07:36 GMT""}]","2009-10-28"
"hep-ex/9610004","Michael Kuhlen","M. Kuhlen","High-p_T Particles in the Forward Region at HERA","5 pages, latex (2 .tex file), 3 figures (5 .eps files)",,,"MPI-PhE/96-18","hep-ex",,"  In order to probe the dynamics of parton evolution in deep inelastic
scattering at small x, high-p_T particles produced centrally in pseudorapidity
are studied. In the BFKL mechanism gluon radiation is expected to be more
abundant than for DGLAP evolution with strong ordering of the gluon transverse
momenta, leading to harder p_T spectra. The proposed measurements require
charged particle tracking capability as much forward as possible in the HERA
laboratory frame, for example with a Very Forward Silicon Tracker, and high
luminosity for detailed studies.
","[{""version"":""v1"",""created"":""Tue, 8 Oct 1996 08:02:42 GMT""}]","2016-08-31"
"hep-ex/9610005","Sergey Kananov","J. Grunhaus, S. Kananov","Separation of \gamma/\pi^0 showers at high energies","16 pages, 6 figures, LaTeX. Submitted to Nuclear Instruments and
  Methods","Nucl.Instrum.Meth. A391 (1997) 351-359","10.1016/S0168-9002(97)00520-2","TAUP 2369-96","hep-ex",,"  We have designed and carried out simulation studies of a two layer Shower
Maximum Detector diagonally off-set (SMD-dos) optimized for the separation of
\pi^0 showers from \gamma showers in the 30 to 150 GeV energy range. For 90%
\gamma acceptance the SMD-dos yields \pi^0 rejection efficiency of 92+-4%,
87+-4% and 32+-2%, respectively, for 30, 50 and 150 GeV incident energies. We
find that the SMD-dos is superior to a conventional geometry single-layer or
mutiple-layer shower maximum detector (SMD), of equal granularity, by an
average factor of ~1.5 over the 50 to 150 GeV energy range. We also find that
the SMD-dos gives better \pi^0 rejection, for the same number of channels, than
a SMD. At hadron - hadron colliders the signature of choice for the detection
of the Higgs particle, in the mass range of 120 to 160 GeV, is via the decay
H-->\gamma\gamma. The addition of a SMD-dos to the planned detectors at the LHC
would significantly reduce the background to the \gamma-signal coming from
prolific \pi^0 production.
","[{""version"":""v1"",""created"":""Tue, 8 Oct 1996 13:22:55 GMT""},{""version"":""v2"",""created"":""Thu, 10 Oct 1996 13:18:33 GMT""},{""version"":""v3"",""created"":""Mon, 14 Oct 1996 07:08:56 GMT""}]","2009-10-28"
"hep-ph/9610268","Stefano  Forte","Stefano Forte and Richard D. Ball","Double Asymptotic Scaling '96","5 pages, LaTeX with espcrc2.sty (included), 11 figures included by
  epsfig","Nucl.Phys.Proc.Suppl. 54A (1997) 163-167","10.1016/S0920-5632(97)00034-0","DFTT 61/96, Edinburgh 96/25","hep-ph",,"  We review recent HERA data on the structure function F_2 at small x and large
Q^2. We show that the salient features of the data are revealed by comparing
them to the double asymptotic scaling behaviour which F_2 is predicted to
satisfy in perturbative QCD.
","[{""version"":""v1"",""created"":""Mon, 7 Oct 1996 18:36:29 GMT""}]","2009-10-28"
"hep-ph/9610270","Paul Hoyer","Paul Hoyer (Nordita)","A Perturbative Gluon Condensate?","17 pages, no figures",,,"NORDITA-96/63 P","hep-ph",,"  I propose that the properties of QCD perturbation theory should be
investigated when the boundary state (`perturbative vacuum') at $t= \pm\infty$
includes gluons. Any boundary state that has an overlap with the true QCD
ground state generates a perturbative series that (when summed to all orders)
is formally exact. Through an analogy with the boundary condition corresponding
to a fermion condensate, I propose an explicit form for a `perturbative gluon
condensate' that suppresses low momentum gluon production, thus generating an
effective mass gap. Standard perturbative calculations are modified only
through a change in the $i\epsilon$ prescription of low momentum $(|\pv| \lsim
\Lambda_{QCD})$ gluon propagators. Gauge invariance is expected to be preserved
since this modification is equivalent to adding on-shell external particles.
Renormalizability is unaffected since only low-momentum propagators are
modified. Due to the asymptotic low momentum gluons boost invariance is not
explicit. Lorentz invariance should be restored in the sum to all orders in
analogy to standard bound state calculations.
","[{""version"":""v1"",""created"":""Mon, 7 Oct 1996 17:07:49 GMT""}]","2007-05-23"
"hep-ph/9610271","Post Graduate Students Uid","A. Dedes, A. B. Lahanas, J. Rizos and K. Tamvakis","Threshold effects and radiative electroweak symmetry breaking in $SU(5)$
  extensions of the MSSM","18 pages, LaTeX2e,uses epsf,9 figures,full postscript file available
  at http://artemis.cc.uoi.gr/~dedes/new96.ps.gz","Phys.Rev. D55 (1997) 2955-2964","10.1103/PhysRevD.55.2955","IOA-04-96, SISSA/107/96/EP","hep-ph",,"  We make a complete analysis of radiative symmetry breaking in the MSSM and
its $SU(5)$ extensions including low- and high-energy threshold effects in the
framework of the two-loop renormalization group. In particular, we consider
minimal $SU(5)$, the ``missing-doublet'' $SU(5)$, a Peccei-Quinn invariant
version of $SU(5)$ as well as a version with light adjoint remnants. We derive
permitted ranges for the parameters of these models in relation to predicted
$\alpha_{s}$ and $M_G$ values within the present experimental accuracy. The
parameter regions allowed under the constraints of radiative symmetry breaking,
perturbativity and proton stability, include the experimentally designated
domain for $\alpha_s$. In the case of the minimal $SU(5)$, the values of
$\alpha_s$ obtained are somewhat large in comparison with the experimental
average. The ``missing-doublet'' $SU(5)$, generally, predicts smaller values of
$\alpha_s$. In both versions of the ``missing-doublet'', the high energy
threshold effects on $\alpha_s$ operate in the opposite direction than in the
case of the minimal model, leading to small values. In the case of the
Peccei-Quinn version however the presence of an extra intermediate scale allows
to achieve an excellent agreement with the experimental $\alpha_s$ values.
Finally, the last considered version, with light remnants, exhibits unification
of couplings at string scale at the expense however of rather large $\alpha_s$
values.
","[{""version"":""v1"",""created"":""Mon, 7 Oct 1996 21:05:22 GMT""}]","2009-10-28"
"hep-ph/9610272","Kurt Riesselmann","Thomas Hambye and Kurt Riesselmann","Matching conditions and Higgs mass upper bounds revisited","20 pages, 6 figures; uses epsf and rotate macros","Phys.Rev. D55 (1997) 7255-7262","10.1103/PhysRevD.55.7255","TUM-HEP-253/96, DO-TH 96/20","hep-ph",,"  Matching conditions relate couplings to particle masses. We discuss the
importance of one-loop matching conditions in Higgs and top-quark sector as
well as the choice of the matching scale. We argue for matching scales
$\mu_{0,t} \simeq m_t$ and $\mu_{0,H} \simeq max[ m_t, M_H ]$. Using these
results, the two-loop Higgs mass upper bounds are reanalyzed. Previous results
for $\Lambda\approx$ few TeV are found to be too stringent. For
$\Lambda=10^{19}$ GeV we find $M_H < 180 \pm 4\pm 5$ GeV, the first error
indicating the theoretical uncertainty, the second error reflecting the
experimental uncertainty due to $m_t=175\pm6$ GeV.
","[{""version"":""v1"",""created"":""Mon, 7 Oct 1996 18:04:01 GMT""}]","2009-10-28"
"hep-ph/9610273","Kurt Riesselmann","Kurt Riesselmann (Techn. Univ. Munich)","Perturbation Theory and Its Limitations in the Higgs Sector of the SM","10 pages, 4 figures. The complete paper is also available via WWW at
  http://www.physik.tu-muenchen.de/tumphy/d/T30d/PAPERS/TUM-HEP-252-96.ps.gz To
  appear in the Proceedings of the ""XXXVI Cracow School of Theoretical
  Physics"", Zakopane, Poland, June 1--10, 1996","Acta Phys.Polon.B27:3661-3670,1996",,"TUM-HEP-252/96","hep-ph",,"  This lecture reviews various Higgs-sector amplitudes which have been
calculated to two loops in the Higgs quartic coupling. After explaining the
framework of these calculatins, the perturbative behaviour of the amplitudes is
discussed, and perturbative upper bounds on the Higgs boson mass are given.
","[{""version"":""v1"",""created"":""Mon, 7 Oct 1996 18:07:02 GMT""}]","2014-11-17"
"hep-ph/9610274",,"L. Frankfurt, A.V.Radyushkin and M. Strikman","Interaction of small size wave packet with hadron target","Revised version of the report CEBAF-TH-96-09","Phys.Rev.D55:98-104,1997","10.1103/PhysRevD.55.98",,"hep-ph",,"  We calculate in QCD the cross section for the scattering of an energetic
small-size wave packet off a hadron target. We use our results to study the
small-$\sigma$ behaviour of $P_{\pi}(\sigma)$, the distribution over cross
section for the pion, in the leading $\alpha_{s}$-order.
","[{""version"":""v1"",""created"":""Mon, 7 Oct 1996 19:50:19 GMT""}]","2014-11-17"
"hep-ph/9610275","U. Meissner","G. M\""uller, Ulf-G. Mei{\ss}ner","Renormalization of the three flavor Lagrangian in heavy baryon chiral
  perturbation theory","40 pp, LaTeX, 3 figs, uses epsf, slight changes in some equations and
  phrasing, table 1 in more compact form, accepted for publication in Nucl.
  Phys. B","Nucl.Phys. B492 (1997) 379-416","10.1016/S0550-3213(97)80039-9","TK 96 24 and KFA-IKP(TH)-1996-07","hep-ph nucl-th",,"  The complete renormalization of the generating functional for Green functions
of quark currents between one--baryon states in three flavor heavy baryon
chiral perturbation theory is performed to order q^3. As an example, we study
the kaon loop induced divergences in neutral pion photoproduction off protons.
","[{""version"":""v1"",""created"":""Mon, 7 Oct 1996 20:33:04 GMT""},{""version"":""v2"",""created"":""Thu, 16 Jan 1997 07:08:07 GMT""}]","2015-06-25"
"hep-ph/9610276",,"L. N. Lipatov","Small-x physics in perturbative QCD","review to be published in Phys. Rep","Phys.Rept.286:131-198,1997","10.1016/S0370-1573(96)00045-2","DESY 96-132","hep-ph",,"  We review the parton model and the Regge approach to the QCD description of
the deep-inelastic $ep$ scattering at the small Bjorken variable $x$ and
demonstrate their relation with the DGLAP and BFKL evolution equations. It is
shown, that in the leading logarithmic approximation the gluon is reggeized and
the pomeron is a compound state of two reggeized gluons. The conformal
invariance of the BFKL pomeron in the impact parameter space is used to
investigate the scattering amplitudes at high energies and fixed momentum
transfers. The remarkable properties of the Schr\""odinger equation for compound
states of an arbitrary number of reggeized gluons in the multi-colour QCD are
reviewed. The gauge-invariant effective action describing the gluon-Reggeon
interactions is constructed. The known next-to-leading corrections to the QCD
pomeron are discussed.
","[{""version"":""v1"",""created"":""Mon, 7 Oct 1996 20:37:54 GMT""}]","2014-11-17"
"hep-ph/9610277","Nathan Isgur","Nathan Isgur","Exclusive versus Inclusive Semileptonic $\bar B$ Decays in the Quark
  Model","revtex file, 6 pages, no figures","Phys.Rev. D54 (1996) 5896-5898","10.1103/PhysRevD.54.5896",,"hep-ph",,"  Some emerging difficulties in the theoretical description of exclusive
semileptonic $\bar B$ decays are discussed in the context of the quark model.
While there are no unambiguous problems at this time, I discuss physics beyond
the valence quark model which should eventually be probed by precision
measurements of $\bar B$ semileptonic decays.
","[{""version"":""v1"",""created"":""Mon, 7 Oct 1996 20:59:36 GMT""}]","2009-10-28"
"hep-ph/9610278","Richard J. Gonsalves","Richard J. Gonsalves (SUNY at Buffalo) and C.F. Wai (Academica Sinica,
  Taipei)","Chromo-electroweak interference and parity-violating asymmetries in the
  production of an electroweak boson + two jets in hadron collisions","66 pages, 20 Postscript figures in 2 files, uses REVTeX v3.0","Phys.Rev.D49:190,1994; Erratum-ibid.D51:1428,1995;
  Phys.Rev.D51:1428,1995","10.1103/PhysRevD.49.190 10.1103/PhysRevD.51.1428","UB-HET-93-1","hep-ph",,"  In the Standard Model the process $q\bar{q}\rightarrow q\bar{q}V$ (where
$V=W^\pm,Z^0$ or $\gamma$) can occur via gluon exchange and also via $W^\pm$ or
$Z^0$ exchange. The corresponding chromodynamic and electroweak amplitudes can
interfere with one another. These interference cross sections are largest when
the exchanged $W^\pm$ or $Z^0$ is on-shell when they are also odd under parity.
Interference cross sections computed using helicity-amplitude techniques are
presented for all interesting subprocesses as well as for the processes
$q\bar{q}\rightarrow q\bar{q} l\bar{l}$ in which the lepton pair $l\bar{l}$
comes from the decay of $V$ on-shell. Parity-violating asymmetries are defined
and presented at the parton level and for the hadronic processes $pp$ or
$p\bar{p}\rightarrow V$ + 2 jets or $l\bar{l}$ + 2 jets. These asymmetries are
independent of the polarizations of all particles involved, and do not require
that the flavors of the jet partons be measured. They are generally of order
0.01 pb at energies $\sqrt{s} \gtrsim 1$ TeV.
","[{""version"":""v1"",""created"":""Mon, 7 Oct 1996 22:07:00 GMT""}]","2014-11-17"
"hep-ph/9610279","Andreas Schenk","A. Schenk","A Manifestly Gauge-Invariant Approach to Charged Particles","Latex. The complete paper is also available via anonymous ftp at
  ftp://ttpux2.physik.uni-karlsruhe.de/ , or via www at
  http://www-ttp.physik.uni-karlsruhe.de/cgi-bin/preprints/",,,"TTP96-47","hep-ph",,"  In this article we provide a manifestly gauge-invariant approach to charged
particles. It involves (1) Green functions of gauge-invariant operators and (2)
Feynman rules which do not depend on any kind of gauge-fixing condition. First,
we provide a thorough analysis of QED. We propose a specific set of
gauge-invariant Green functions and describe a manifestly gauge-invariant
technique to evaluate them. Furthermore we show how Green's functions and
Feynman rules of the manifestly gauge-invariant approach and of the Faddeev-
Popov ansatz are related to each other. Finally, we extend this manifestly
gauge-invariant approach to the Standard Model of electroweak interactions.
  Motivation for such an approach is abundant. A gauge-dependent framework does
obstruct not only theoretical insight but also phenomenological analyses of
precision experiments at LEP. Unresolved issues include the analysis of finite
width effects of unstable particles and of oblique corrections parametrised by,
e.g., S, T, and U. Quite another example of considerable complications caused
by a gauge-dependent framework is the matching of a full and an effective
theory, relevant for effective field theory analyses of the symmetry-breaking
sector of the Standard Model.
","[{""version"":""v1"",""created"":""Mon, 7 Oct 1996 23:18:53 GMT""}]","2007-05-23"
"hep-ph/9610280","Glennys Farrar","Frank E. Close (Rutherford Appleton Laboratory), Glennys R. Farrar
  (Rutgers University), Zhenping Li (Peking University)","Determining the Gluonic Content of Isoscalar Mesons","48 pages, inc 1 fig","Phys.Rev.D55:5749-5766,1997","10.1103/PhysRevD.55.5749","RAL-96-052, RU-96-35","hep-ph",,"  We develop tools to determine the gluonic content of a resonance of known
mass, width and $J^{PC}$ from its branching fraction in radiative quarkonium
decays and production cross section in $\gamma \gamma$ collisions. We test the
procedures by applying them to known $q\bar{q}$ mesons, then analyze four
leading glueball candidates. We identify inconsistencies in data for $J/\psi
\to \gamma f_0(1500)$ and $J/\psi \to \gamma f_J(1710)$ whose resolution can
quantify their glueball status.When $\Gamma(f_0(1500) \to \gamma \gamma )$ and
$\Gamma(f_J(1710) \to \gamma \gamma)$ are known, the $n\bar{n}, s\bar{s},gg$
mixing angles can be determined. The enigmatic situation in 1400-1500 MeV
region of the isosinglet $0^{-+}$ sector is discussed.
","[{""version"":""v1"",""created"":""Tue, 8 Oct 1996 02:22:58 GMT""}]","2008-11-26"
"hep-ph/9610282","V. V. Gubin","N.N. Achasov (1), V.V. Gubin (1), E.P. Solodov (2) ((1) S.L. Sobolev
  Institute for Mathematics, Novosibirsk,(2) Budker Institute for Nuclear
  Physics, Novosibirsk)","The interference in the reaction $e^+e^-\to\gamma\pi^+\pi^-$ and the
  search for the decay $\phi\to\gamma f_0\to\gamma\pi^+\pi^-$","21 pages, revtex, 8 ps files of figures","Phys.Rev.D55:2672-2682,1997","10.1103/PhysRevD.55.2672","IM RAS SB NNA 6-96","hep-ph",,"  We describe the interference between amplitudes $e^+e^- \to \rho \to
\gamma\pi^+\pi^-$ and $e^+e^- \to \phi \to \gamma f_0 \to \gamma\pi^+\pi^-$,
where $f_0$ meson is considered in the frameworks of the four-quark model and
the model of the scalar $K\bar K$ molecule. The general expressions for the
differential cross section with the radiative corrections and two angle cuts
are given. The interference patterns are obtained in the spectrum of the
differential cross section by the energy of the photon and in the full cross
section by the energy of the beams.
","[{""version"":""v1"",""created"":""Tue, 8 Oct 1996 08:57:10 GMT""}]","2010-11-15"
"hep-ph/9610283","Hai-Yang Cheng","Hai-Yang Cheng","Can $B\to J/\psi K(K^*)$ decays be described by factorization ?","12 pages, typos in Eqs.(5) and (16) are corrected","Phys.Lett. B395 (1997) 345-354","10.1016/S0370-2693(97)00083-X","IP-ASTP-05-96","hep-ph hep-ex",,"  The new measurements of $B\to J/\psi K(K^*)$ decays by CDF and CLEO indicate
that the production ratio $R$ and the fraction of longitudinal polarization
$\Gamma_L/\Gamma$ are smaller than the previous results. In conjunction with
the new result of parity-odd transverse polarization in $B\to J/\psi K^*$, we
found a minimal modification to the factorization hypothesis: While the data of
$B\to J/\psi K^*$ can be accommodated in the factorization approach with
nonfactorizable terms $\chi_{A_1} = \chi_{A_2} = \chi_{V} \equiv \chi$ of order
15%, the result of $R$ measurement requires that the nonfactorizable effect
$\chi_{F_1}$ on $B\to J/\psi K$ be slightly larger than $\chi$. Therefore, the
effective parameter $a_2^{\rm eff}$ is not universal even for $B\to J/\psi
K(K^*)$ decays. We have generalized the considerations to $B\to \psi(2S)K(K^*)$
and $B_s\to J/\psi\phi$ and found that the predictions are in agreement with
currently available data.
","[{""version"":""v1"",""created"":""Tue, 8 Oct 1996 07:25:02 GMT""},{""version"":""v2"",""created"":""Sat, 19 Oct 1996 07:39:07 GMT""}]","2016-09-06"
"hep-ph/9610284","Vassilis Spanos","A.B. Lahanas (Univ. of Athens) and V.C. Spanos (Univ. Of Durham)","Supersymmetric QCD corrections to the W-boson width","7 pages, LaTeX file with 2 figures, uses epsf macros","Phys.Lett.B391:351-354,1997","10.1016/S0370-2693(96)01494-3","DTP/96/88","hep-ph",,"  We calculate the one-loop supersymmetric QCD corrections to the width of the
$W$-boson. We find that these are of order $\sim {{ \alpha_s} \over {\pi}} {1
\over 20} { {M^2_W} \over {M_S^2}} \Gamma_{u {\bar d}}$, where $M_S$ is the
supersymmetry breaking scale and $ \Gamma_{u {\bar d}}$ the tree level hadronic
width for $W^+ \rightarrow u {\bar d} $. Due to the appearance of the
suppression factor $\sim {1 \over 20}$ these are at least two orders of
magnitude smaller than the standard QCD corrections $\sim {{ \alpha_s} \over
{\pi}} \Gamma_{u {\bar d}}$ and hence of the order of the two-loop electroweak
effects. Therefore supersymmetric QCD corrections will only be of relevance
once experiments reach that level of accuracy.
","[{""version"":""v1"",""created"":""Tue, 8 Oct 1996 08:16:10 GMT""}]","2011-02-01"
"hep-ph/9610285","Dirk Kreimer","A. Frink, U. Kilian and D. Kreimer","New representation of the two-loop crossed vertex function","16 pages, latex, uses epsfig, amstex, amssymb. Replacement has typo
  corrected, references updated","Nucl.Phys. B488 (1997) 426-440","10.1016/S0550-3213(97)00026-6","MZ-TH/96-30","hep-ph",,"  We calculate the two-loop vertex function for the crossed topology, and for
arbitrary masses and external momenta. We derive a double integral
representation, suitable for a numerical evaluation by a Gaussian quadrature.
Real and imaginary parts of the diagram can be calculated separately.
","[{""version"":""v1"",""created"":""Tue, 8 Oct 1996 14:36:29 GMT""},{""version"":""v2"",""created"":""Wed, 9 Oct 1996 15:11:00 GMT""}]","2009-10-28"
"hep-ph/9610286",,"M. Arneodo, L. Lamberti, M. Ryskin","DIPSI: a Monte Carlo generator for elastic vector meson production in
  charged lepton-proton scattering","24 pages, 7 figures, Latex, to be published in Computer Physics
  Communications","Comput.Phys.Commun. 100 (1997) 195-214","10.1016/S0010-4655(96)00102-6","DESY-96-149","hep-ph",,"  We present a Monte Carlo generator for exclusive vector meson production in
charged lepton-proton interactions, l+p --> l+p+V, based on a QCD leading
logarithm model calculation according to which the cross section for this
process is proportional to the square of the gluon momentum density in the
proton. The generator can be used for both fixed target and collider
kinematics. Each event is assigned a weight equal to its cross section, so that
the independent variables can be generated according to convenient
distributions, not necessarily identical to the physics ones.
","[{""version"":""v1"",""created"":""Tue, 8 Oct 1996 09:56:38 GMT""}]","2009-10-28"
"hep-ph/9610287","Dirk Graudenz","Dirk Graudenz (CERN)","Prospects for a Measurement of $\alpha_s$ via Scaling Violations of
  Fragmentation Functions in Deeply Inelastic Scattering","6 pages (Latex); figures are included via epsfig. The AMSTEX fonts
  are required. Based on a contribution to the workshop ``Future Physics at
  HERA'' at DESY, Hamburg, 1995/96; compressed postscript version also
  available at http://wwwcn.cern.ch/~graudenz/publications.html",,,"CERN-TH/96-187","hep-ph",,"  The prospects for a determination of the strong coupling constant $\alpha_s$
via scaling violations of fragmentation functions in deeply inelastic
scattering are studied. The statistical error in the case of an integrated
luminosity of $250 pb^{-1}$, and the theoretical errors due to the various
parton density parametrizations and to the factorization scale dependence are
estimated.
","[{""version"":""v1"",""created"":""Tue, 8 Oct 1996 11:43:08 GMT""}]","2016-09-06"
"hep-ph/9610288","Piet Mulders","R. Jakob, A. Kotzinian, P.J. Mulders, J. Rodrigues","Quark transverse momentum in hard scattering processes","3 pages, Latex, 1 Postscript figure, uses epsfig.sty, wrapfig.sty,
  Talk presented by P. Mulders at the 12th Int. Symposium on High-Energy Spin
  Physics, Amsterdam, 10-14 Sept. 1996; to appear in the proceedings",,,"NIKHEF 96-024","hep-ph",,"  The role of transverse momentum of quarks in semi-inclusive leptoproduction
will be discussed. It involves generalized distribution and fragmentation
functions which depend on both the longitudinal lightcone momentum fraction of
the quarks and on the transverse momentum. Constraints on these functions and
relations between them arise as a consequence of the QCD equation of motion for
the quark fields, Lorentz invariance and of C, P, and T invariance of the
strong interactions. Experimentally one has access to the functions for
instance in measurements of azimuthal asymmetries in hard processes.
","[{""version"":""v1"",""created"":""Tue, 8 Oct 1996 14:33:57 GMT""}]","2007-05-23"
"hep-ph/9610289","Daniel Boer","D. Boer, R.D. Tangerman","Quark masses in Qiu's factorization procedure","3 pages, Latex, 2 Postscript figures, uses epsfig.sty, wrapfig.sty,
  Talk presented by D. Boer at the 12th Int. Symposium on High-Energy Spin
  Physics, Amsterdam, 10-14 Sept. 1996, To appear in the proceedings",,,"NIKHEF 96-023","hep-ph",,"  We discuss a higher-twist factorization procedure of the hadron tensor in
deep inelastic scattering, proposed by Qiu, and extend it to include quark mass
terms. Its property that the hard scattering parts are electromagnetic gauge
invariant separately, is manifestly preserved. Using an auxiliary parton, a
so-called spurion, to generate the quark mass terms, a simple parton model
interpretation is also retained.
","[{""version"":""v1"",""created"":""Tue, 8 Oct 1996 15:51:54 GMT""}]","2007-05-23"
