"hep-ph/9610290","Jose Rodriguez Quintero","J. Rodriguez-Quintero","Do the Profile Function singularities explain the high energy reflection
  of fermions in a phase transition?","6 pages, 1 figure","Phys. Lett. B390 (1997) 69.","10.1016/S0370-2693(96)01408-6","FAMNSE-96/10","hep-ph",,"  We investigate the scope of a previous result concerning the behaviour of
fermions hitting a general wall caused by a first-order phase transition. The
wall profile function was considered to be analytic in the real axis. The
previous result is valid for analytic functions in the whole complex plane
except in certain isolated singularities located out of the real axis. A
non-analytic profile function in the real axis is studied in order to show the
validity of the result for any profile which can be put as a certain limit of a
function which verifies the latter. A new understanding of the high energy
behaviour of the quantum reflection caused by a sharp profile, as the step,
arises from that study.
","[{""version"":""v1"",""created"":""Tue, 8 Oct 1996 14:35:02 GMT""}]","2009-10-28"
"hep-th/9610039","Mironov","A. Zabrodin","Discrete Hirota's equation in quantum integrable models","26 pages, LaTeX",,"10.1142/S0217979297001520","ITEP-TH-44/96","hep-th",,"  The recent progress in revealing classical integrable structures in quantum
models solved by Bethe ansatz is reviewed. Fusion relations for eigenvalues of
quantum transfer matrices can be written in the form of classical Hirota's
bilinear difference equation. This equation is also known as the completely
discretized version of the 2D Toda lattice. We explain how one obtains the
specific quantum results by solving the classical equation. The auxiliary
linear problem for the Hirota equation is shown to generalize Baxter's T-Q
relation.
","[{""version"":""v1"",""created"":""Mon, 7 Oct 1996 19:23:34 GMT""}]","2015-06-26"
"hep-th/9610040","Jose Gaite","Jose Gaite","Relative entropy in Field Theory, the H theorem and the renormalization
  group","14 pages, 4 Postscript figures, LaTeX with sprocl.sty, talk given at
  RG96, JINR, Dubna (Russia)",,,,"hep-th cond-mat",,"  We consider relative entropy in Field Theory as a well defined
(non-divergent) quantity of interest. We establish a monotonicity property with
respect to the couplings in the theory. As a consequence, the relative entropy
in a field theory with a hierarchy of renormalization group fixed points ranks
the fixed points in decreasing order of criticality. We argue from a
generalized $H$ theorem that Wilsonian RG flows induce an increase in entropy
and propose the relative entropy as the natural quantity which increases from
one fixed point to another in more than two dimensions.
","[{""version"":""v1"",""created"":""Mon, 7 Oct 1996 19:00:04 GMT""}]","2007-05-23"
"hep-th/9610041","Michael Douglas","Michael R. Douglas","Superstring Dualities, Dirichlet Branes and the Small Scale Structure of
  Space","To appear in the proceedings of the LXIV Les Houches session on
  `Quantum Symmetries', August 1995. latex, 29 pp",,,"RU-96-91","hep-th",,"  We give a broad overview of superstring duality, Dirichlet branes, and some
implications of both for questions about the structure of space-time at short
distances.
","[{""version"":""v1"",""created"":""Mon, 7 Oct 1996 20:33:56 GMT""}]","2007-05-23"
"hep-th/9610042",,"Chien-Hao Liu","Topological Membrane Solitons and Loop Orders of Membrane Scatterings in
  M-theory","38 pages, 14 figures in .eps files",,,"UMTG-191","hep-th",,"  Two topological issues on membranes in M-theory are studied:
  (1) Soliton is an important subject in M-theory. Under the framework of
obstruction theory with the help from framed links in $S^3$, we give a complete
enumeration of topological membrane solitons in a string-admissible
target-space of the form a product of Minkowskian space-times, tori, and
K3-surfaces. Patching of these solitons and their topological charges are also
defined and discussed.
  (2) Loop order of membrane scatterings is the basis for a perturbative
M-theory. We explore this concept with emphases on its distinct features from
pointlike and stringlike particles.
  For completeness, a light exposition on homologies of compact oriented
3-manifolds is given in the Appendix.
","[{""version"":""v1"",""created"":""Mon, 7 Oct 1996 22:35:42 GMT""}]","2007-05-23"
"hep-th/9610043","Stephen Shenker","T. Banks, W. Fischler, S.H. Shenker, L. Susskind","M Theory As A Matrix Model: A Conjecture","Typo and tex error corrected. 41 pages, harvmac","Phys.Rev.D55:5112-5128,1997","10.1103/PhysRevD.55.5112","RU-96-95, SU-ITP-96-12,UTTG-13-96","hep-th",,"  We suggest and motivate a precise equivalence between uncompactified eleven
dimensional M-theory and the N = infinity limit of the supersymmetric matrix
quantum mechanics describing D0-branes. The evidence for the conjecture
consists of several correspondences between the two theories. As a consequence
of supersymmetry the simple matrix model is rich enough to describe the
properties of the entire Fock space of massless well separated particles of the
supergravity theory. In one particular kinematic situation the leading large
distance interaction of these particles is exactly described by supergravity .
The model appears to be a nonperturbative realization of the holographic
principle. The membrane states required by M-theory are contained as
excitations of the matrix model. The membrane world volume is a noncommutative
geometry embedded in a noncommutative spacetime.
","[{""version"":""v1"",""created"":""Mon, 7 Oct 1996 21:32:58 GMT""},{""version"":""v2"",""created"":""Tue, 12 Nov 1996 21:13:23 GMT""},{""version"":""v3"",""created"":""Wed, 15 Jan 1997 19:16:31 GMT""}]","2009-07-09"
"hep-th/9610044","Prem Prakash Srivastava","Prem P. Srivastava (Inst. Fisica, UERJ-Univ. do Estado de Rio de
  Janeiro, Rio de Janeiro, Brasil)","Light-Front Quantization of Field Theory","18 pages, Tex, published in ``Lightfront quantization of field
  theory'' in ``Topics in Theoretical Physics'', ``Festschrift for Paulo Leal
  Ferreira'', eds. V.C. Aguilera-Navarro et. al., pgs. 206-217, IFT-SP, Sao
  Paulo, Brasil, 1995",,,"CBPF-NF-045/96; IF-UERJ 033/96","hep-th hep-ph",,"  Some basic topics in Light-Front (LF) quantized field theory are reviewed.
Poincar\`e algebra and the LF Spin operator are discussed. The local scalar
field theory of the conventional framework is shown to correspond to a
non-local Hamiltonian theory on the LF in view of the constraint equations on
the phase space, which relate the bosonic condensates to the non-zero modes.
This new ingredient is useful to describe the spontaneous symmetry breaking on
the LF. The instability of the symmetric phase in two dimensional scalar theory
when the coupling constant grows is shown in the LF theory renormalized to one
loop order. Chern-Simons gauge theory, regarded to describe excitations with
fractional statistics, is quantized in the light-cone gauge and a simple LF
Hamiltonian obtained which may allow us to construct renormalized theory of
anyons.
","[{""version"":""v1"",""created"":""Mon, 7 Oct 1996 22:37:43 GMT""}]","2007-05-23"
"hep-th/9610045","Esko Keski-Vakkuri","Esko Keski-Vakkuri and Per Kraus (Cal Tech)","Microcanonical D-branes and Back Reaction","16 pages, LaTeX file. Some typos corrected, 1 reference added","Nucl.Phys.B491:249-262,1997","10.1016/S0550-3213(97)00085-0","CALT-68-2079","hep-th",,"  We compare the emission rates from excited D-branes in the microcanonical
ensemble with back reaction corrected emission rates from black holes in field
theory. In both cases, the rates in the high energy tail of the spectrum differ
markedly from what a canonical ensemble or free field theory approach would
yield. Instead of being proportional to a Bose-Einstein distribution function,
the rates in the high energy tail are proportional to $\exp (-\Delta S_{BH})$
where $\Delta S_{BH}$ is the difference in black hole entropies before and
after emission. After including the new effects, we find agreement, at leading
order, between the D-brane and field theory rates over the entire range of the
spectrum.
","[{""version"":""v1"",""created"":""Tue, 8 Oct 1996 05:44:08 GMT""},{""version"":""v2"",""created"":""Thu, 14 Nov 1996 23:53:16 GMT""}]","2010-04-06"
"hep-th/9610046","Tsukasa Tada","Jerome P. Gauntlett, Tsukasa Tada","Entropy of Four-Dimensional Rotating BPS-Dyons","12 pages, uses RevTex, some misprints corrected","Phys.Rev.D55:1707-1710,1997","10.1103/PhysRevD.55.1707","CALT-68-2074, QMW-PH-96-23, UCSBTH-96-21, NSF-ITP-96-77","hep-th",,"  The known BPS dyon black hole solutions of the N=4 heterotic string in four
dimensions with non-zero angular momentum all have naked singularities. We show
that it is possible to modify a certain class of these solutions by the
addition of massive Kaluza-Klein fields in such a way that the solutions
decompactify near the core to five-dimensional black hole solutions with
regular event horizons. We argue that the degeneracy of the four-dimensional
BPS dyon states is given, for large charges, by the five-dimensional geometric
entropy.
","[{""version"":""v1"",""created"":""Tue, 8 Oct 1996 06:04:16 GMT""},{""version"":""v2"",""created"":""Wed, 22 Jan 1997 05:27:35 GMT""}]","2010-01-06"
"hep-th/9610047","Masaomi Kimura","Masaomi Kimura","Geometric Quantization on a Coset Space G/H","12 pages, LateX2e","Prog.Theor.Phys. 99 (1998) 467-476","10.1143/PTP.99.467","ICRR-Report-375-96-26","hep-th",,"  Geometric quantization on a coset space $G/H$ is considered, intending to
recover Mackey's inequivalent quantizations. It is found that the inequivalent
quantizations can be obtained by adopting the symplectic 2-form which leads to
Wong's equation. The irreducible representations of $H$ which label the
inequivalent quantizations arise from Weil's theorem, which ensures a Hermitian
bundle over $G/H$ to exist.
","[{""version"":""v1"",""created"":""Tue, 8 Oct 1996 06:30:29 GMT""}]","2009-10-30"
"hep-th/9610048","J. M. Pawlowski","J.M. Pawlowski","The Definition of Double Commutators and Consistency in Free Field
  Theory","10 pages,latex, no figure, report-no corrected",,,"FSUJ-TPI-15/96","hep-th",,"  Within the framework of generalized functions a general consistent definition
of double commutators is given. This definition respects the Jacobi identity
even if the regularization is removed. The double commutator of fermionic
currents is calculated in this limit. We show that BJL--type prescriptions and
point--splitting prescriptions for calculating double commutators fail to give
correct results in free field theory.
","[{""version"":""v1"",""created"":""Tue, 8 Oct 1996 12:25:56 GMT""},{""version"":""v2"",""created"":""Wed, 9 Oct 1996 09:28:43 GMT""}]","2016-09-06"
"hep-th/9610049","Holger Ewen","Holger Ewen, Kristin Foerger","Simple Calculation of Instanton Corrections in Massive N=2 SU(3) SYM","16 pages, Latex","Int.J.Mod.Phys. A12 (1997) 4725-4742","10.1142/S0217751X97002528","LMU-TPW 96-24","hep-th",,"  We give an explicit derivation of the Picard-Fuchs equations for N=2
supersymmetric SU(3) Yang-Mills theory with $N_f<6$ massive hypermultiplets in
the fundamental representation. We determine the instanton corrections to the
prepotential in the weak coupling region using the relation between
$\tr<\phi^2>$ and the prepotential. This method can be generalized to other
gauge groups.
","[{""version"":""v1"",""created"":""Tue, 8 Oct 1996 15:20:10 GMT""}]","2016-09-06"
"hep-th/9610050","Adam","C. Adam","The three-boson bound state in the massive Schwinger model","12 pages, Latex file, 6 figures, needed macro: psbox.tex","Czech.J.Phys.48:1013-1023,1998","10.1023/A:1022887418022","FSUJ TPI 16/96","hep-th",,"  We derive the (matrix-valued) Feynman rules of mass perturbation theory of
the massive Schwinger model for non-zero vacuum angle theta. Further, we
discuss the properties of the three-boson bound state and compute -- by a
partial resummation of the mass perturbation series -- its mass and its partial
decay widths.
","[{""version"":""v1"",""created"":""Tue, 8 Oct 1996 15:29:08 GMT""}]","2009-07-24"
"hep-th/9610051","Costas Efthimiou","Samwel Apikyan, Costas Efthimiou","Minimal Models of CFT on Z_N-Surfaces","16 pages, latex, no figures; two important early references on the
  coset construction have been included; to appear in Mod. Phys. Lett","Int.J.Mod.Phys.A12:4291-4307,1997","10.1142/S0217751X97002334","TAUP 2358-96","hep-th",,"  The conformal field theory on a Z_N-surface is studied by mapping it on the
branched sphere. Using a coulomb gas formalism we construct the minimal models
of the theory.
","[{""version"":""v1"",""created"":""Tue, 8 Oct 1996 15:45:17 GMT""},{""version"":""v2"",""created"":""Sun, 9 Feb 1997 17:57:21 GMT""}]","2014-11-18"
"nucl-ex/9610005","A. M. Bernstein","A. M. Bernstein, E. Shuster, R. Beck, M. Fuchs, B. Krusche, H. Merkel,
  H. Stroher","Observation of a unitary cusp in the threshold {\gamma}p -> \pi^{0}p
  reaction","22 pages, 10 figures, 2 tables. Uses LaTex 2e (will not work with
  previous versions). This paper is also available via an anonymous ftp site
  ftp://marie.mit.edu/pub/bernstein/ Submitted to Phys. Rev. C","Phys.Rev.C55:1509-1516,1997","10.1103/PhysRevC.55.1509",,"nucl-ex hep-ex hep-ph",,"  A rigorous multipole analysis of the recent {\gamma}p -> \pi^{0}p cross
section measurement is presented. The data were taken using the photon
spectrometer TAPS at the tagged photon beam of the Mainz microtron. The s and p
wave multipoles were extracted using minimal model assumptions. The predicted
unitary cusp for the s wave multipole E_{0+} due to the two step {\gamma}p ->
\pi^{+}n -> \pi^{0}p reaction was observed. The results are consistent with one
loop chiral perturbation theory calculations for which three low energy
constants have been determined by a fit to the data. The uncertainties in the
analysis and the need for polarization observables are discussed.
","[{""version"":""v1"",""created"":""Mon, 7 Oct 1996 17:39:57 GMT""}]","2008-11-26"
"nucl-th/9610010","Lee SukJoon","Jae Hwang Lee, Young Jae Lee, and Suk-Joon Lee","Nuclear Density-Dependent Effective Coupling Constants in the Mean-Field
  Theory","12 pages in RevTeX","J.KoreanPhys.Soc.30:169-174,1997",,,"nucl-th",,"  It is shown that the equation of state of nuclear matter can be determined
within the mean-field theory of $\sigma \omega$ model provided only that the
nucleon effective mass curve is given. We use a family of the possible nucleon
effective mass curves that reproduce the empirical saturation point in the
calculation of the nuclear binding energy curves in order to obtain
density-dependent effective coupling constants. The resulting density-dependent
coupling constants may be used to study a possible equation of state of nuclear
system at high density or neutron matter. Within the constraints used in this
paper to $M^*$ of nuclear matter at saturation point and zero density, neutron
matter of large incompressibility is strongly bound at high density while soft
neutron matter is weakly bound at low density. The study also exhibits the
importance of surface vibration modes in the study of nuclear equation of
state.
","[{""version"":""v1"",""created"":""Tue, 8 Oct 1996 12:05:14 GMT""}]","2008-11-26"
"patt-sol/9610005","Xiao-jun Li","Hao-wen Xi (Bowling Green), Xiao-jun Li (Lehigh) and J. D. Gunton
  (Lehigh)","Direct Transition to Spatiotemporal Chaos in Low Prandtl Number Fluids","5 pages, 5 figures, to appear in Phys. Rev. Lett",,"10.1103/PhysRevLett.78.1046",,"patt-sol chao-dyn cond-mat nlin.CD nlin.PS physics.flu-dyn",,"  We present the first large scale numerical simulation of three-dimensional
Rayleigh-B\'enard convection near onset, under free-free boundary conditions
for a fluid of Prandtl number $\sigma=0.5$. We find that a spatiotemporally
chaotic state emerges immediately above onset, which we investigate as a
function of the reduced control parameter $\epsilon$. We conclude that the
transition from conduction to spatiotemporal chaos is second order and of
``mean field'' character. We also present a simple theory for the time-averaged
convective current. Finally, we show that the time-averaged structure factor
satisfies a scaling behavior with respect to the correlation length near onset.
","[{""version"":""v1"",""created"":""Mon, 7 Oct 1996 21:42:18 GMT""},{""version"":""v2"",""created"":""Thu, 2 Jan 1997 23:12:49 GMT""}]","2009-10-30"
"patt-sol/9610006","Patrick Buechel","H. W. Mueller(1), H. Wittmer(1), C. Wagner(2), J. Albers(2), K.
  Knorr(2) ((1) Institut fuer Theoretische Physik, Universitaet des Saarlandes,
  Saarbruecken, Germany (2) Institut fuer Technische Physik, Universitaet des
  Saarlandes, Saarbruecken, Germany)","An analytical stability theory for Faraday waves and the observation of
  the harmonic surface response","10 pages (LaTeX-file), 3 figures (Postscript) Submitted for
  publication",,"10.1103/PhysRevLett.78.2357",,"patt-sol nlin.PS",,"  We present an analytical stability theory for the onset of the Faraday
instability, applying over a wide frequency range between shallow water gravity
and deep water capillary waves. For sufficiently thin fluid layers the surface
is predicted to occur in harmonic rather than subharmonic resonance with the
forcing. An experimental confirmation of this result is given. PACS: 47.20.Ma,
47.20.Gv, 47.15.Cb
","[{""version"":""v1"",""created"":""Tue, 8 Oct 1996 07:25:04 GMT""}]","2009-10-30"
"patt-sol/9610007","Matsuba Kenichi","Ken-ichi Matsuba, Kenji Imai and Kazuhiro Nozaki (Nagoya University,
  Japan)","Nonlinear Modulation of Travelling Rolls in Magnetoconvection","8 pages,latex",,"10.1016/S0167-2789(97)00034-1","DPNU-96-30","patt-sol nlin.PS",,"  Modulational dynamics of oscillatory travelling rolls in magnetoconvection is
studied near the onset of a Hopf bifurcation. Using weakly nonlinear analysis,
we derive an envelope equation of oscillatory travelling rolls in the plane
perpendicular to an ambient vertical magnetic field.The envelope equation is
the Davey-Stewartson (DS) equation with complex coefficients, from which we
obtain criteria for the modulational (Benjamin-Feir) instability of oscillatory
travelling rolls.
","[{""version"":""v1"",""created"":""Tue, 8 Oct 1996 09:06:53 GMT""}]","2009-10-30"
"physics/9610005","Jason W. Bates","David Montgomery, Jason W. Bates, H. Ralph Lewis","Resistive Magnetohydrodynamic Equilibria in a Torus","17 pages, 4 figures",,"10.1063/1.872195",,"physics.plasm-ph",,"  It was recently demonstrated that static, resistive, magnetohydrodynamic
equilibria, in the presence of spatially-uniform electrical conductivity, do
not exist in a torus under a standard set of assumed symmetries and boundary
conditions. The difficulty, which goes away in the ``periodic straight cylinder
approximation,'' is associated with the necessarily non-vanishing character of
the curl of the Lorentz force, j x B. Here, we ask if there exists a spatial
profile of electrical conductivity that permits the existence of zero-flow,
axisymmetric r esistive equilibria in a torus, and answer the question in the
affirmative. However, the physical properties of the conductivity profile are
unusual (the conductivity cannot be constant on a magnetic surface, for
example) and whether such equilibria are to be considered physically possible
remains an open question.
","[{""version"":""v1"",""created"":""Mon, 7 Oct 1996 16:05:43 GMT""}]","2009-10-30"
"physics/9610006","Jason W. Bates","David Montgomery, Jason W. Bates, and Shuojun Li","Toroidal Vortices in Resistive Magnetohydrodynamic Equilibria","17 pages, 4 figures",,"10.1063/1.869206",,"physics.plasm-ph",,"  Resistive steady states in toroidal magnetohydrodynamics (MHD), where Ohm's
law must be taken into account, differ considerably from ideal ones. Only for
special (and probably unphysical) resistivity profiles can the Lorentz force,
in the static force-balance equation, be expressed as the gradient of a scalar
and thus cancel the gradient of a scalar pressure. In general, the Lorentz
force has a curl directed so as to generate toroidal vorticity. Here, we
calculate, for a collisional, highly viscous magnetofluid, the flows that are
required for an axisymmetric toroidal steady state, assuming uniform scalar
resistivity and viscosity. The flows originate from paired toroidal vortices
(in what might be called a ``double smoke ring'' configuration), and are
thought likely to be ubiquitous in the interior of toroidally driven
magnetofluids of this type. The existence of such vortices is conjectured to
characterize magnetofluids beyond the high-viscosity limit in which they are
readily calculable.
","[{""version"":""v1"",""created"":""Mon, 7 Oct 1996 20:04:05 GMT""}]","2009-10-30"
"q-alg/9610009","Arut","G.E. Arutyunov and S.A. Frolov","Quantum Dynamical R-matrices and Quantum Frobenius Group","latex, 15 pages, the statement about the form of the quantum
  integrals of motion is corrected",,,"SMI-96-72","q-alg hep-th math.QA nlin.SI solv-int",,"  We propose an algebraic scheme for quantizing the rational
Ruijsenaars-Schneider model in the R-matrix formalism. We introduce a special
parameterization of the cotangent bundle over GL(N,C). In new variables the
standard symplectic structure is described by a classical (Frobenius) r-matrix
and by a new dynamical $\bar{r}$-matrix. Quantizing both of them we find the
quantum L-operator algebra and construct its particular representation
corresponding to the rational Ruijsenaars-Schneider system. Using the dual
parameterization of the cotangent bundle we also derive the algebra for the
L-operator of the trigonometric Calogero-Moser system.
","[{""version"":""v1"",""created"":""Tue, 8 Oct 1996 11:03:58 GMT""},{""version"":""v2"",""created"":""Tue, 12 Nov 1996 17:06:49 GMT""}]","2016-09-08"
"quant-ph/9610009","Steven Brumby","S.P. Brumby and G.C. Joshi","Experimental status of quaternionic quantum mechanics","8 pages, no figures, revtex. An update of paper appearing in journal
  reference given below, with minor amendments and latest additional references","Chaos Solitons Fractals 7 (1996) 747-752","10.1016/0960-0779(95)00001-1","UM-P-94/120; RCHEP-94/34","quant-ph hep-ph hep-th",,"  Analysis of the logical foundations of quantum mechanics indicates the
possibility of constructing a theory using quaternionic Hilbert spaces. Whether
this mathematical structure reflects reality is a matter for experiment to
decide. We review the only direct search for quaternionic quantum mechanics yet
carried out and outline a recent proposal by the present authors to look for
quaternionic effects in correlated multi-particle systems. We set out how such
experiments might distinguish between the several quaternionic models proposed
in the literature.
","[{""version"":""v1"",""created"":""Tue, 8 Oct 1996 01:20:43 GMT""}]","2015-06-26"
"solv-int/9610005","Kenichi Maruno","K. Maruno, K. Kajiwara, S. Nakao, M. Oikawa","Bilinearization of Discrete Soliton Equations and Singularity
  Confinement","14 pages, LaTex",,"10.1016/S0375-9601(97)00171-0",,"solv-int nlin.SI",,"  Bilinear forms for some nonlinear partial difference equations(discrete
soliton equations) are derived based on the results of singularity confinement.
Using the bilinear forms, the N-soliton and algebraic solutions of the discrete
potential mKdV equation are constructed.
","[{""version"":""v1"",""created"":""Tue, 8 Oct 1996 14:39:21 GMT""}]","2016-09-08"
