"hep-ph/9610296","Ian Jack","P.M. Ferreira, I. Jack and D.R.T. Jones","The Quasi-Infra-Red Fixed Point at Higher Loops","12 pages, including 3 figures. Version as published in Phys. Lett. B,
  but with minor errors corrected, particularly f(T)-->f(0). Plain TeX. Uses
  Harvmac and epsf","Phys.Lett. B392 (1997) 376-382","10.1016/S0370-2693(96)01549-3","LTH 386","hep-ph",,"  We calculate the four-loop $\beta$-function for the generalised Wess-Zumino
model. We use the result and Pad\'e-Borel summation to discuss the domain of
attraction of the quasi-infra-red fixed point of the top-quark Yukawa coupling
in the supersymmetric standard model, and argue that the domain is in fact
substantial.
","[{""version"":""v1"",""created"":""Wed, 9 Oct 1996 09:30:39 GMT""},{""version"":""v2"",""created"":""Fri, 27 Dec 1996 14:33:20 GMT""},{""version"":""v3"",""created"":""Fri, 3 Jan 1997 17:13:45 GMT""},{""version"":""v4"",""created"":""Tue, 29 Jun 1999 16:00:34 GMT""}]","2009-10-28"
"hep-ph/9610297","Pietro Santorelli","P. Colangelo, F. De Fazio, P. Santorelli, E. Scrimieri","Rare B \to K^{(*)} \nu\bar\nu Decays at B Factories","11 pages LaTeX + 2 eps figures. Version published in Physics Letters
  B","Phys.Lett. B395 (1997) 339-344","10.1016/S0370-2693(97)00130-5","BARI-TH/96-252, Napoli Preprint DSF-T-46/96","hep-ph",,"  We compute the branching fraction of the decays $B \to K \nu \bar\nu$ and $B
\to K^* \nu \bar\nu$ in the Standard Model. We also comment on the experimental
difficulties and procedures to detect such modes at B factories.
","[{""version"":""v1"",""created"":""Wed, 9 Oct 1996 11:53:03 GMT""},{""version"":""v2"",""created"":""Tue, 15 Apr 1997 18:05:45 GMT""}]","2016-09-06"
"hep-ph/9610298","Giovanni Amelino-Camelia","G. Amelino-Camelia","Simple GUTs","15 pages, LaTex. Presented as plenary talk at QUARKS96, Yaroslavl,
  Russia, May 5-11, 1996. To be published in the proceedings",,,"OUTP-96-17P","hep-ph",,"  Together with some positive features, such as the constrained hypercharge
assignments, grandunification models typically have some unwelcome aspects,
mostly associated with the rich and peculiarly selected matter content. I
discuss some ideas which might help to interpret (part of) this apparent
complexity arising in grandunification in terms of simple structures. I also
point out that the conventional criteria used to establish fine tuning in
grandunified models should be modified if these models are viewed as effective
low-energy descriptions of a more fundamental theory.
","[{""version"":""v1"",""created"":""Wed, 9 Oct 1996 13:24:00 GMT""}]","2007-05-23"
"hep-ph/9610299",,"S. Dawson (BNL), A. Likhoded (IITAP), G. Valencia (ISU), and O.
  Yushchenko (IHEP)","Probing Quartic Couplings Through Three Gauge Boson Production at an
  $e^+e^-$ Linear Collider","To appear in the Proceedings of the 1996 DPF/DPB Summer Study on New
  Directions for High Energy Physics, Snowmass, CO, June 25-July 12, 1996; 4
  pg, uses LATEX2e with epsfig and snow2e.cls",,,"BNL-HET-SD-7","hep-ph",,"  We explore the capability of a 500 or 1000 GeV $e^+e^-$ linear collider to
measure anomalous quartic gauge boson couplings. In the framework of a
non-linear effective Lagrangian with a custodial $SU)2)$ symmetry, there are
only two next-to-leading order operators which contribute to quartic, but not
to two- and three- gauge boson interactions. The limits on the coefficients of
these operators from present and future $e^+e^-$ colliders are compared with
those available from other sources.
","[{""version"":""v1"",""created"":""Wed, 9 Oct 1996 15:24:14 GMT""}]","2007-05-23"
"hep-ph/9610300",,"K.C. Chou (CAS) and Yue-Liang Wu (OSU)","A solution to the puzzles of CP violation, neutrino oscillation, fermion
  masses and mixings in an SUSY GUT model with small $tan \beta$","4 pages, latex, no figures, talk presented at SUSY96, May 1996,
  University of Maryland","Nucl.Phys.Proc.Suppl. 52A (1997) 159-162","10.1016/S0920-5632(96)00553-1","DOE-ER-01545-675","hep-ph",,"  CP violation, fermion masses and mixing angles including that of neutrinos
are studied in an SUSY SO(10)$\times \Delta(48) \times$ U(1) model with small
$tan \beta$. It is amazing that the model can provide a successful prediction
on twenty three observables by only using four parameters. The renormalization
group (RG) effects containing those above the GUT scale are considered. Fifteen
relations among the low energy parameters are found with nine of them free from
RG modifications. They could be tested directly by low energy experiments.
","[{""version"":""v1"",""created"":""Wed, 9 Oct 1996 15:06:42 GMT""}]","2009-10-28"
"hep-ph/9610305","Sheldon Stone","Sheldon Stone, (Physics Dept. Syracuse University)","Prospects for B-Physics in the Next Decade","70 pages, also available at
  http://physics.syr.edu/research/elementary_particles/experimental/virgin_2.ps","NATO Adv.Study Inst.Ser.B Phys.365:465-533,1997",,"HEPSY 96-01","hep-ph",,"  In these lectures I review what has been learned from studies of b-quark
decays, including semileptonic decays ($V_{ub}$ and $V_{cb}$),
$B^o-\overline{B}^o$ mixing and rare B decays. Then a discussion on CP
violation follows, which leads to a summary of plans for future experiments and
what is expected to be learned from them. (Presented at NATO Advanced Study
Institute on Techniques and Concepts of High Energy Physics, Virgin Islands,
July 1996.)
","[{""version"":""v1"",""created"":""Tue, 8 Oct 1996 22:44:54 GMT""},{""version"":""v2"",""created"":""Tue, 5 Nov 1996 19:03:09 GMT""}]","2014-11-17"
"hep-th/9610052","Krzywicki","J. Jurkiewicz and A. Krzywicki","Branched Polymers with Loops","11 pages LaTeX","Phys.Lett. B392 (1997) 291-297","10.1016/S0370-2693(96)01559-6","LPTHE Orsay 96/82","hep-th cond-mat",,"  We propose a classification of critical behaviours of branched polymers for
arbitrary topology. We show that in an appropriately defined double scaling
limit the singular part of the partition function is universal. We calculate
this partition function exactly in the generic case and perturbatively
otherwise. In the discussion section we comment on the relation between
branched polymer theory and Euclidean quantum gravity.
","[{""version"":""v1"",""created"":""Tue, 8 Oct 1996 20:13:50 GMT""}]","2009-10-30"
"hep-th/9610053","Stieberger Stephan","A. Brandhuber and S. Stieberger","Self-Dual Strings and Stability of BPS States in N=2 SU(2) Gauge
  Theories","27 LaTex with figs., Some changes in W-boson decay discussion, Refs.
  added","Nucl.Phys. B488 (1997) 199-222","10.1016/S0550-3213(96)00656-6","CERN-TH/96-263 and NEIP-96/007","hep-th",,"  We show how BPS states of supersymmetric SU(2) Yang-Mills with matter -both
massless and massive- are described as self-dual strings on a Riemann surface.
This connection enables us to prove the stability and the strong coupling
behaviour of these states. The Riemann surface naturally arises from type-IIB
Calabi-Yau compactifications whose three-branes wrapped around vanishing
two-cycles correspond to one-cycles on this surface.
","[{""version"":""v1"",""created"":""Tue, 8 Oct 1996 20:11:38 GMT""},{""version"":""v2"",""created"":""Mon, 28 Oct 1996 21:49:17 GMT""}]","2016-09-06"
"hep-th/9610054","Joshua Feinberg","J. Feinberg, A. Zee (ITP, UC Santa-Barbara)","Dynamical Generation of Solitons in a 1+1 Dimensional Chiral Field
  Theory: Non-Perturbative Dirac Operator Resolvent Analysis","10 pages, 2 figures, LaTex. Talk delivered by J.Feinberg at the
  Workshop on Low Dimensional Field Theory at Telluride, CO (August 1996). To
  appear in the conference proceedings. Minor typographical corrections","Int.J.Mod.Phys.A12:1133-1142,1997","10.1142/S0217751X97000864","NSF-ITP-96-69","hep-th",,"  We analyze the 1+1 dimensional Nambu-Jona-Lasinio model non-perturbatively.
We study non-trivial saddle points of the effective action in which the
composite fields $\sigx=<\bar\psi\psi>$ and $\pix=<\bar\psii\gam_5\psi>$ form
static space dependent configurations. These configurations may be viewed as
one dimensional chiral bags that trap the original fermions (``quarks'') into
stable extended entities (``hadrons''). We provide explicit expressions for the
profiles of some of these objects and calculate their masses. Our analysis of
these saddle points, and in particular, the proof that the $\sigx, \pix$
condensations must give rise to a reflectionless Dirac operator, appear to us
simpler and more direct than the calculations previously done by Shei, using
the inverse scattering method following Dashen, Hasslacher, and Neveu.
","[{""version"":""v1"",""created"":""Tue, 8 Oct 1996 23:11:43 GMT""},{""version"":""v2"",""created"":""Thu, 14 Nov 1996 01:10:20 GMT""}]","2011-04-15"
"hep-th/9610055","Manfred Requardt","Manfred Requardt","Emergence of Space-Time on the Planck Scale described as an Unfolding
  Phase Transition within the Scheme of Dynamical Cellular Networks and Random
  Graphs","36 pages, Latex",,,"Re-96-03","hep-th gr-qc",,"  As in an earlier paper we start from the hypothesis that physics on the
Planck scale should be described by means of concepts taken from ``discrete
mathematics''. This goal is realized by developing a scheme being based on the
dynamical evolution of a particular class of ``cellular networks'' being
capable of performing an ``unfolding phase transition'' from a (presumed)
chaotic initial phase towards a new phase which acts as an ``attractor'' in
total phase space and which carries a fine or super structure which is
identified as the discrete substratum underlying ordinary continuous space-time
(or rather, the physical vacuum). Among other things we analyze the internal
structure of certain particular subclusters of nodes/bonds (maximal connected
subsimplices, $mss$) which are the fundamental building blocks of this new
phase and which are conjectured to correspond to the ``physical points'' of
ordinary space-time. Their mutual entanglement generates a certain near- and
far-order, viz. a causal structure within the network which is again set into
relation with the topological/metrical and causal/geometrical structure of
continuous space-time. The mathematical techniques to be employed consist
mainly of a blend of a fair amount of ``stochastic mathematics'' with several
relatively advanced topics of discrete mathematics like the ``theory of random
graphs'' or ``combinatorial graph theory''. Our working philosophy is it to
create a scenario in which it becomes possible to identify both gravity and
quantum theory as the two dominant but derived(!) aspects of an underlying
discrete and more primordial theory (dynamical cellular network) on a much
coarser level of resolution, viz. continuous space-time.
","[{""version"":""v1"",""created"":""Wed, 9 Oct 1996 09:22:15 GMT""}]","2016-09-06"
"hep-th/9610056","Martin Seeger","O. Jahn, T. Kraus and M. Seeger (Institut fuer Theoretische Physik,
  Universitaet Erlangen-Nuernberg)","The Path Integral for 1+1-dimensional QCD","16 pages, LaTeX, 3 PostScript figures, uses epsf.sty","Int.J.Mod.Phys. A12 (1997) 4445-4459","10.1142/S0217751X97002425","FAU-TP3-96/15","hep-th",,"  We derive a path integral expression for the transition amplitude in
1+1-dimensional QCD starting from canonically quantized QCD. Gauge fixing after
quantization leads to a formulation in terms of gauge invariant but curvilinear
variables. Remainders of the curved space are Jacobians, an effective
potential, and sign factors just as for the problem of a particle in a box.
Based on this result we derive a Faddeev-Popov like expression for the
transition amplitude avoiding standard infinities that are caused by
integrations over gauge equivalent configurations.
","[{""version"":""v1"",""created"":""Wed, 9 Oct 1996 11:03:05 GMT""}]","2009-10-30"
"hep-th/9610057","Giovanni Amelino-Camelia","G. Amelino-Camelia, I. I. Kogan, and R. J. Szabo","Gravitational Dressing of Aharonov-Bohm Amplitudes","10 pages, LaTex, uses macro package FEYNMAN.tex Presented by G.
  Amelino-Camelia at the Workshop on Low Dimensional Field Theory, Telluride,
  CO, 5-17 Aug 1996. To be published in the proceedings","Int.J.Mod.Phys. A12 (1997) 1043-1052","10.1142/S0217751X97000773","OUTP-96-60P","hep-th",,"  We investigate Aharonov-Bohm scattering in a theory in which charged bosonic
matter fields are coupled to topologically massive electrodynamics and
topologically massive gravity. We demonstrate that, at one-loop order, the
transmuted spins in this theory are related to the ones of ordinary
Chern-Simons gauge theory in the same way that the
Knizhnik-Polyakov-Zamolodchikov formula relates the Liouville-dressed conformal
weights of primary operators to the bare weights in two-dimensional conformal
field theories. We remark on the implications of this connection between
two-dimensional conformal field theories and three-dimensional gauge and
gravity theories for a topological membrane reformulation of strings. We also
discuss some features of the gravitational analog of the Aharonov-Bohm effect.
","[{""version"":""v1"",""created"":""Wed, 9 Oct 1996 13:27:37 GMT""}]","2015-06-26"
"hep-th/9610058","Valentina Varchenko","A.N. Varchenko, S.M.Gusein-Zade","Verlinde Algebras and the Intersection Form on Vanishing Cycles","latex file",,,,"hep-th",,"  We prove Zuber's conjecture establishing connections of the fusion rules of
the $su(N)_k$ WZW model of conformal field theory and the intersection form on
vanishing cycles of the associated fusion potential.
","[{""version"":""v1"",""created"":""Wed, 9 Oct 1996 14:29:31 GMT""}]","2019-08-17"
"hep-th/9610059","Elcio Abdalla","Elcio Abdalla and Roya Mohayaee","Decay amplitudes in two-dimensional QCD","We discuss in more detail the background material and elaborate on
  the consequences of the new results. New equations and text are added and the
  figures are efficiently regenerated by a fortran program, latex file, 13
  pages, 4 figures in encapsulated postscript files, uses epsf. minor changes,
  version to appear in Physical Review D",,,"IC/96/204, CERN-TH/96-253","hep-th",,"  Decay amplitudes for mesons in two-dimensional QCD are discussed. We show
that in spite of an infinite number of conserved charges, particle production
is not entirely suppressed. This phenomenon is explained in terms of quantum
corrections to the combined algebra of higher-conserved and spectrum-generating
currents. We predict the qualitative form of particle production probabilities
and verify that they are in agreement with numerical data. We also discuss
four-dimensional self-dual Yang-Mills theory in the light of our results.
","[{""version"":""v1"",""created"":""Wed, 9 Oct 1996 14:32:07 GMT""},{""version"":""v2"",""created"":""Tue, 28 Jan 1997 16:29:34 GMT""},{""version"":""v3"",""created"":""Mon, 17 Nov 1997 11:08:36 GMT""}]","2008-02-03"
"hep-th/9610060","Alexandros Kehagias","S. Forste and A. Kehagias","Zero-branes in 2+1 dimensions","Latex, 8 pages. Talk given at the Workshop on Gauge Theories, Applied
  Symmetries and Quantum Gravity, London, Jul 1996",,,"TUM-HEP-256/96, LMU-TPW 96-25","hep-th",,"  We discuss zero-brane solutions in three-dimensional Minkowski space-time
annihilated by half of the supersymmetries. The other half of the
supersymmetries which should generate the supersymmetric multiplet are
ill-defined and lead to a non bose-fermi degenerate solitonic spectrum.
","[{""version"":""v1"",""created"":""Wed, 9 Oct 1996 14:48:01 GMT""}]","2007-05-23"
"hep-th/9610063","Arne Lykke Larsen","A.L. Larsen (University of Alberta, Canada)","Cosmic Strings and Black Holes","28 pages, Latex. 5 figures not included. For the proceedings of
  ""String Gravity"", Paris, France, June 1996 and the e-proceedings of
  ""Non-Equilibrium Phase Transitions"", Santa Fe, New Mexico, July 1996",,,"Alberta Thy 33-96","hep-th gr-qc",,"  In the first part of this talk, I consider some exact string solutions in
curved spacetimes. In curved spacetimes with a Killing vector (timelike or
spacelike), the string equations of motion and constraints are reduced to the
Hamilton equations of a relativistic point-particle in a scalar potential, by
imposing a particular ansatz. As special examples I consider circular strings
in axially symmetric spacetimes, as well as stationary strings in stationary
spacetimes. In the second part of the talk, I then consider in more detail the
stationary strings in the Kerr -Newman geometry. It is shown that the
world-sheet of a stationary string, that passes the static limit of the 4-D
Kerr-Newman black hole, describes a 2-D black hole. Mathematical results for
2-D black holes can therefore be applied to physical objects; (say) cosmic
strings in the vicinity of Kerr black holes. As an immediate general result, it
follows that the string modes are thermally excited.
","[{""version"":""v1"",""created"":""Wed, 9 Oct 1996 15:07:32 GMT""}]","2007-05-23"
"hep-th/9610065","Erick J. Weinberg","Erick J. Weinberg","Massless and Massive Monopoles Carrying Nonabelian Magnetic Charges","17 pages Latex, presented at Quarks-96, Yaroslavl, Russia",,,"CU-TP-785, FERMILAB-CONF-96/349-T","hep-th",,"  The properties of BPS monopoles carrying nonabelian magnetic charges are
investigated by following the behavior of the moduli space of solutions as the
Higgs field is varied from a value giving a purely abelian symmetry breaking to
one that leaves a nonabelian subgroup of the gauge symmetry unbroken. As the
limit of nonabelian unbroken symmetry is reached, some of the fundamental
abelian monopoles remain massive but acquire nonabelian magnetic charges. The
BPS mass formula indicates that others should because massless in this limit.
These do not correspond to distinct solitons, but instead are manifested as a
``nonabelian cloud'' surrounding the massive monopoles, with their position and
phase degrees of freedom being transformed into parameters characterizing the
cloud.
","[{""version"":""v1"",""created"":""Wed, 9 Oct 1996 14:19:22 GMT""}]","2007-05-23"
"nucl-th/9610011","Hungchong Kim","Hungchong Kim, S. Schramm, and Su Houng Lee","Delta Decay in the Nuclear Medium","13 pages (including figures), revtex","Phys.Rev.C56:1582-1587,1997","10.1103/PhysRevC.56.1582","YUM 96-23, SNUTP 96-106","nucl-th",,"  The $\Delta$ decay in the nuclear medium is calculated in the relativistic
meson-nucleon model. The delta spreading width is calculated and compared with
the Pauli-blocked $\pi$N decay width. The influence of relativistic mean fields
is also studied. We stress the importance of understanding the delta spreading
width in interpreting experiments involving delta resonances.
","[{""version"":""v1"",""created"":""Wed, 9 Oct 1996 04:28:08 GMT""}]","2008-11-26"
"physics/9610007","Jonathan Katz","J. I. Katz (Washington University, St. Louis, Mo)","Jets from Collapsing Bubbles","10 pp., tex",,,"WU-JIK-96-4","physics.flu-dyn",,"  When an asymmetric bubble collapses it generally produces a well defined high
velocity jet. This is remarkable because one might expect such a collapse to
produce a complex or chaotic flow rather than an ordered one. I present a
dimensional argument for the ubiquity of jets from collapsing bubbles, and
model the aspherical collapse of a bubble with pieces of Rayleigh's solution
for spherical collapse and its cylindrical analogue. This model explains the
ubiquity of jet formation in aspherical collapse, and predicts the shape and
velocity profile of the resulting jet. These predictions may be tested in the
laboratory or by numerical calculation. An application to solid spall is
suggested.
","[{""version"":""v1"",""created"":""Tue, 8 Oct 1996 16:23:50 GMT""}]","2008-02-03"
"q-alg/9610010","Parma","N.A. Gromov, I.V. Kostyakov and V.V. Kuratov","The Quantum Symplectic Cayley-Klein Groups","6 pages, LaTeX, submitted to Proceedings of ' II International
  Workshop on Classical and Quantum Integrible Systems' (Dubna, 8-12
  July,1996), to be published in Int.J.Mod.Phys",,"10.1142/S0217751X97000244",,"q-alg math.QA",,"  The contraction method applied to the construction of the nonsemisimple
quantum symplectic Cayley-Klein groups $ Fun(Sp_q(n;j)) $. This groups has been
realised as Hopf algebra of the noncommutative functions over the algebra with
nilpotent generators. The dual quantum algebras $ sp_q(n;j) $ are constructed.
","[{""version"":""v1"",""created"":""Tue, 8 Oct 1996 19:31:38 GMT""}]","2009-10-30"
"q-alg/9610011","Parma","N.A. Gromov, I.V. Kostyakov and V.V. Kuratov","Quantum Orthogonal Cayley-Klein Groups in Cartesian Basis","9 pages, LaTeX, submitted to Proceedings of ' II International
  Workshop on Classical and Quantum Integrible Systems' (Dubna, 8-12
  July,1996), to be published in Int.J.Mod.Phys",,"10.1142/S0217751X97000050",,"q-alg math.QA",,"  The similarity transformations of quantum orthogonal groups are developed and
FRT theory is reformulated to the Cartesian basis. The quantum orthogonal
Cayley-Klein groups are introduced as the algebra functions over an associative
algebra with the nilpotent generators. The quantum orthogonal Cayley-Klein
algebras are obtained as the dual objects to the corresponding quantum groups.
","[{""version"":""v1"",""created"":""Tue, 8 Oct 1996 19:32:09 GMT""}]","2009-10-30"
"q-alg/9610012","Pasquale","L. Dabrowski, F. Nesti, and P. Siniscalco","On the Drinfeld Twist for Quantum sl(2)","Latex, 9 pages; Proc. 12th Italian Conf.Gen.Rel.Grav. Phys. Roma
  1996; World Sci. 1997, Singapore",,,"SISSA 130/96/FM","q-alg math.QA",,"  An isomorphism, up to a twist, between the quasitriangular quantum enveloping
algebra U_h(sl(2)) and the (classical) U(sl(2))[[h]]is discussed. The universal
twisting element $\cal F$ is given up to the second order in the deformation
parameter $h$.
","[{""version"":""v1"",""created"":""Wed, 9 Oct 1996 14:43:41 GMT""}]","2012-04-19"
"quant-ph/9610010","Gary Oas","Patrick Suppes, J. Acacio de Barros, Gary Oas","A Collection of Probabilistic Hidden-Variable Theorems and
  Counterexamples","20 pages latex. To appear in Nuovo Cimento. Presented Sept. 17, 1996
  in Florence at a symposium in honor of Giuliano Toraldo di Francia.
  Significant additions and corrections have been made. Additional conditions
  on the existence of joint probability distributions as well as theorems on
  mapping from higher spin systems to two state variables",,,,"quant-ph",,"  The purpose of this article is to formulate a number of probabilistic
hidden-variable theorems, to provide proofs in some cases, and counterexamples
to some conjectured relationships. The first theorem is the fundamental one. It
asserts the general equivalence of the existence of a hidden variable and the
existence of a joint probability distribution of the observed quatities,
whether finite or continuous.
","[{""version"":""v1"",""created"":""Tue, 8 Oct 1996 23:05:12 GMT""},{""version"":""v2"",""created"":""Tue, 18 Feb 1997 19:37:57 GMT""}]","2008-02-03"
"quant-ph/9610011","Emanuel Knill","E. Knill, R. Laflamme, W. Zurek","Threshold Accuracy for Quantum Computation","20 pages. 10/15/96: Added references to threshold results by Aharanov
  and Ben-Or and by Kitaev",,,,"quant-ph",,"  We have previously (quant-ph/9608012) shown that for quantum memories and
quantum communication, a state can be transmitted over arbitrary distances with
error $\epsilon$ provided each gate has error at most $c\epsilon$. We discuss a
similar concatenation technique which can be used with fault tolerant networks
to achieve any desired accuracy when computing with classical initial states,
provided a minimum gate accuracy can be achieved. The technique works under
realistic assumptions on operational errors. These assumptions are more general
than the stochastic error heuristic used in other work. Methods are proposed to
account for leakage errors, a problem not previously recognized.
","[{""version"":""v1"",""created"":""Tue, 8 Oct 1996 19:50:12 GMT""},{""version"":""v2"",""created"":""Wed, 9 Oct 1996 05:07:19 GMT""},{""version"":""v3"",""created"":""Tue, 15 Oct 1996 23:27:18 GMT""}]","2008-02-03"
"solv-int/9610004","Parma","N.A. Gromov, I.V. Kostyakov and V.V. Kuratov","Contractions of Integrable Equations","6 pages, LaTeX, submitted to Proceedings of ' II International
  Workshop on Classical and Quantum Integrible Systems' (Dubna, 8-12
  July,1996), to be published in Int.J.Mod.Phys",,"10.1142/S0217751X97000256",,"solv-int nlin.SI",,"  The contraction is applied to obtaining of integrable systems associated with
nonsemisimple algebras. The effect of contraction is splitting off some
components from initial system without loss of integrability.
","[{""version"":""v1"",""created"":""Tue, 8 Oct 1996 19:33:00 GMT""}]","2009-10-30"
"solv-int/9610006","Mts","Andrey Yu. Boldin and Ruslan A. Sharipov (Baskir State University,
  Math. Department, Russia)","On the solution of normality equations for the dimension $n\geq 3$","AmS-TeX, amsppt style, 18 pages",,,,"solv-int nlin.SI",,"  The normality equations for the Newtonian dynamical systems on an arbitrary
Riemannian manifold of the dimension $n \geq 3$ are considered. Locally the
solution of such equations reduces to three possible cases: in two of them the
solution is written out explicitly, and in the third case the equations of
normality are reduced to an ordinary differential equation of the second order.
Some new examples of explicit solutions of normality equations are constructed.
","[{""version"":""v1"",""created"":""Wed, 9 Oct 1996 08:22:33 GMT""}]","2008-02-03"
