"cond-mat/9610075",,"Derek K.K. Lee, Patrick A. Lee (MIT)","Transport phenomenology for a holon-spinon fluid","4 pages, 1 postscript figure. Uses RevTeX, epsf, multicol",,"10.1088/0953-8984/9/47/010",,"cond-mat.str-el",,"  We propose that the normal-state transport in the cuprate superconductors can
be understood in terms of a two-fluid model of spinons and holons. In our
scenario, the resistivity is determined by the properties of the holons while
magnetotransport involves the recombination of holons and spinons to form
physical electrons. Our model implies that the Hall transport time is a measure
of the electron lifetime, which is shorter than the longitudinal transport
time. This agrees with our analysis of the normal-state data. We predict a
strong increase in linewidth with increasing temperature in photoemission. Our
model also suggests that the AC Hall effect is controlled by the transport
time.
","[{""version"":""v1"",""created"":""Tue, 8 Oct 1996 22:30:01 GMT""}]","2009-10-28"
"cond-mat/9610076","Antoine Georges","Antoine Georges and Laurent Laloux","Normal Helium 3: a Mott-Stoner liquid","4 pages, RevTeX3.0, 1 EPS figure",,"10.1142/S0217984997001122",,"cond-mat.str-el",,"  A physical picture of normal liquid $^3$He, which accounts for both ``almost
localized'' and ``almost ferromagnetic'' aspects, is proposed and confronted to
experiments.
","[{""version"":""v1"",""created"":""Wed, 9 Oct 1996 15:53:24 GMT""}]","2009-10-28"
"cond-mat/9610077","Grigori Volovik","N.B. Kopnin and G.E. Volovik","Singularity of the Vortex Density of States in d-wave Superconductors","LaTeX file, 8 pages, no figures, submitted to JETP Letters","Pisma Zh.Eksp.Teor.Fiz. 64 (1996) 641-645; JETP Lett. 64 (1996)
  690","10.1134/1.567283","LTL-96007","cond-mat.supr-con",,"  In d-wave superconductors, the electronic density of states (DOS) induced by
a vortex exhibits 1/|E| divergency at low energies. It is the result of gap
nodes in the excitations spectrum outside the vortex core. The heat capacity in
two regimes, (T/T_c)^2 >> B/B_{c2} and (T/T_c)^2 << B/B_{c2}, is discussed.
","[{""version"":""v1"",""created"":""Wed, 9 Oct 1996 11:31:44 GMT""}]","2014-10-13"
"cond-mat/9610078",,"Enrique Diez, Angel Sanchez and Francisco Dominguez-Adame","Electron dynamics in intentionally disordered semiconductor
  superlattices","10 pagex, RevTex, 13 Postscript figures. Physical Review B (in press)",,"10.1103/PhysRevB.54.14550",,"cond-mat.mes-hall",,"  We study the dynamical behavior of disordered quantum-well-based
semiconductor superlattices where the disorder is intentional and short-range
correlated. We show that, whereas the transmission time of a particle grows
exponentially with the number of wells in an usual disordered superlattice for
any value of the incident particle energy, for specific values of the incident
energy this time increases linearly when correlated disorder is included. As
expected, those values of the energy coincide with a narrow subband of extended
states predicted by the static calculations of Dom\'{\i}nguez-Adame {\em et
al.} [Phys. Rev. B {\bf 51}, 14 ,359 (1994)]; such states are seen in our
dynamical results to exhibit a ballistic regime, very close to the WKB
approximation of a perfect superlattice. Fourier transform of the output signal
for an incident Gaussian wave packet reveals a dramatic filtering of the
original signal, which makes us confident that devices based on this property
may be designed and used for nanotechnological applications. This is more so in
view of the possibility of controllingthe outp ut band using a dc electric
field, which we also discuss. In the conclusion we summarize our results and
present an outlook for future developments arising from this work.
","[{""version"":""v1"",""created"":""Wed, 9 Oct 1996 15:12:31 GMT""}]","2016-08-31"
"cond-mat/9610079","Malte Henkel","Dragi Karevski and Malte Henkel","Finite-size effects in layered magnetic systems","13 pages, Revtex, with 9 eps figures","Phys. Rev. B55, 6429 (1997)","10.1103/PhysRevB.55.6429",,"cond-mat.stat-mech hep-lat hep-th",,"  Thermal and magnetic effects in a system consisting of thin layers of coupled
Ising spins with $S=1/2$ and $S=1$ are considered. The specific heat and the
correlation length display maxima at two different temperatures. It is
discussed in what sense these maxima can be interpreted as a finite-size
rounding of a thermodynamic singularity associated with a phase transition. The
connection with ordinary, extraordinary and special surface phase transitions
is made. In $2D$, the surface critical exponents are calculated from conformal
invariance. The bulk and surface finite-size scaling of the order parameter
profiles at the transition points is discussed. In $2D$, an exact scaling
function for the profiles is suggested through conformal invariance arguments
for the (extra)ordinary transition.
","[{""version"":""v1"",""created"":""Wed, 9 Oct 1996 13:23:33 GMT""}]","2016-08-31"
"cond-mat/9610080","Swapan K. Pati","Swapan K. Pati, S. Ramasesha and Diptiman Sen (Indian Institute of
  Science, Bangalore)","Low-Lying Excited States and Low-Temperature Properties of an
  Alternating Spin-1 / Spin-1/2 Chain : A DMRG study","22 pages in latex; 16 eps figures available upon request",,"10.1103/PhysRevB.55.8894",,"cond-mat",,"  We report spin wave and DMRG studies of the ground and low-lying excited
states of uniform and dimerized alternating spin chains. The DMRG procedure is
also employed to obtain low-temperature thermodynamic properties of the system.
The ground state of a 2N spin system with spin-1 and spin-1/2 alternating from
site to site and interacting via an antiferromagnetic exchange is found to be
ferrimagnetic with total spin $s_G=N/2$ from both DMRG and spin wave analysis.
Both the studies also show that there is a gapless excitation to a state with
spin $s_G-1$ and a gapped excitation to a state with spin $s_G+1$.
Surprisingly, the correlation length in the ground state is found to be very
small from both the studies for this gapless system. For this very reason, we
show that the ground state can be described by a variational ``ansatz'' of the
product type. DMRG analysis shows that the chain is susceptible to a
conditional spin-Peierls' instability. The DMRG studies of magnetization,
magnetic susceptibility ($\chi$) and specific heat show strong magnetic-field
dependence. The product $\chi T$ shows a minimum as a function of
temperature($T$) at low-magnetic fields and the minimum vanishes at
high-magnetic fields. This low-field behaviour is in agreement with earlier
experimental observations. The specific heat shows a maximum as a function of
temperature and the height of the maximum increases sharply at high magnetic
fields. It is hoped that these studies will motivate experimental studies at
high-magnetic fields.
","[{""version"":""v1"",""created"":""Tue, 8 Oct 1996 23:11:59 GMT""}]","2016-08-31"
"cond-mat/9610081","Kouno","Masanori Kohno","Ground State Properties of the Two-Dimensional t-J Model","15 pages, RevTex, 12 PostScript figures, to appear in Phys.Rev.B",,"10.1103/PhysRevB.55.1435",,"cond-mat.str-el",,"  The two-dimensional $t$-$J$ model in the ground state is investigated by the
power Lanczos method. The pairing-pairing correlation function for
$d_{x^2-y^2}$-wave symmetry is enhanced in the realistic parameter regime for
high-$T_c$ superconductors. The charge susceptibility $\chi_c$ shows divergent
behavior as $\chi_c\propto\delta^{-1}$ near half-filling for the doping
concentration $\delta$, indicating that the value of the dynamical exponent $z$
is four under the assumption of hyperscaling. The peak height of the spin
structure factor $S_{max}(Q)$ also behaves as $S_{max}(Q) \propto\delta^{-1}$
near half-filling, which leads to the divergence of the antiferromagnetic
correlation length $\xi_m$ as $\xi_m \propto\delta^{-1/2}$. The boundary of
phase separation is estimated on the basis of the Maxwell construction.
Numerical results are compared with experimental features observed in
high-$T_c$ cuprates.
","[{""version"":""v1"",""created"":""Wed, 9 Oct 1996 12:54:09 GMT""}]","2009-10-28"
"cond-mat/9610082","Peter Swain","A.O. Parry, C.J. Boulter, P.S. Swain","Coupled Fluctuations near Critical Wetting","4 pages, LaTex, 1 postscript figure","Phys. Rev. E52 (1995), R5768","10.1103/PhysRevE.52.R5768",,"cond-mat.soft",,"  Recent work on the complete wetting transition has emphasized the role played
by the coupling of fluctuations of the order parameter at the wall and at the
depinning fluid interface. Extending this approach to the wetting transition
itself we predict a novel crossover effect associated with the decoupling of
fluctuations as the temperature is lowered towards the transition temperature
T_W. Using this we are able to reanalyse recent Monte-Carlo simulation studies
and extract a value \omega(T_W)=0.8 at T_W=0.9T_C in very good agreement with
long standing theoretical predictions.
","[{""version"":""v1"",""created"":""Wed, 9 Oct 1996 14:22:16 GMT""}]","2009-10-28"
"dg-ga/9610004","Robert B. Kusner","K. Brauckmann and R. Kusner","Moduli Spaces of Embedded Constant Mean Curvature Surfaces with Few Ends
  and Special Symmetry","latex2e, AMS-latex, 24 pages",,,,"dg-ga math.DG",,"  We give necessary conditions on complete embedded \cmc surfaces with three or
four ends subject to reflection symmetries. The respective submoduli spaces are
two-dimensional varieties in the moduli spaces of general \cmc surfaces. We
characterize fundamental domains of our \cmc surfaces by associated great
circle polygons in the three-sphere.
","[{""version"":""v1"",""created"":""Tue, 8 Oct 1996 20:06:32 GMT""}]","2008-02-03"
"dg-ga/9610005",,"Rob Kusner, Nick Schmitt","The Spinor Representation of Surfaces in Space","latex, 37 pages plus appendices",,,,"dg-ga math.DG",,"  The spinor representation is developed for conformal immersions of Riemann
surfaces into space. We adapt the approach of Dennis Sullivan, which treats a
spin structure on a Riemann surface M as a complex line bundle S whose square
is the canonical line bundle K=T(M). Given a conformal immersion of M into
\bbR^3, the unique spin strucure on S^2 pulls back via the Gauss map to a spin
structure S on M, and gives rise to a pair of smooth sections (s_1,s_2) of S.
Conversely, any pair of sections of S generates a (possibly periodic) conformal
immersion of M under a suitable integrability condition, which for a minimal
surface is simply that the spinor sections are meromorphic. A spin structure S
also determines (and is determined by) the regular homotopy class of the
immersion by way of a \bbZ_2-quadratic form q_S. We present an analytic
expression for the Arf invariant of q_S, which decides whether or not the
correponding immersion can be deformed to an embedding. The Arf invariant also
turns out to be an obstruction, for example, to the existence of certain
complete minimal immersions. The later parts of this paper use the spinor
representation to investigate minimal surfaces with embedded planar ends. In
general, we show for a spin structure S on a compact Riemann surface M with
punctures at P that the space of all such (possibly periodic) minimal
immersions of M\setminus P into \bbR^3 (upto homothety) is the the product of
S^1\times H^3 with the Grassmanian of 2-planes in a complex vector space \calK
of meromorphic sections of S. An important tool -- a skew-symmetric form \Omega
defined by residues of a certain meromorphic quadratic differential on M --
lets us compute how \calK varies as M and P are varied. Then we apply this to
determine the moduli spaces of planar-ended minimal spheres and real projective
planes, and also to construct a new family of minimal tori and a minimal Klein
bottle with 4 ends. These surfaces compactify in S^3 to yield surfaces critical
for the \Moebius invariant squared mean curvature functional W. On the other
hand, Robert Bryant has shown all W-critical spheres and real projective planes
arise this way. Thus we find at the same time the moduli spaces of W-critical
spheres and real projective planes via the spinor representation.
","[{""version"":""v1"",""created"":""Tue, 8 Oct 1996 20:48:39 GMT""}]","2016-08-31"
"funct-an/9610001","Hideki Nakamura","Hideki Nakamura (Hokkaido University)","The Rohlin Property for Actions of $Z^{2}$ on UHF Algebras","35 pages, no figure, LaTex. Changes suggested by the referee are
  made. To appear in Journal of the Mathematical Society of Japan",,,,"funct-an math.OA",,"  We define a Rohlin property for actions of $Z^{2}$ on UHF algebras and show a
noncommutative Rohlin type theorem. Among those actions with the Rohlin
property, we classify product type actions up to outer conjugacy. In particular
we present two classes of UHF algebras. For UHF algebras in one class, which
includes the CAR algebra, there is one and only one outer conjugacy class of
product type actions and for UHF algebras in the other class, contrary to the
case of actions of $Z$, there are infinitely many outer conjugacy classesof
product type actions.
","[{""version"":""v1"",""created"":""Wed, 9 Oct 1996 01:50:20 GMT""},{""version"":""v2"",""created"":""Mon, 22 Dec 1997 08:53:27 GMT""}]","2008-02-03"
"gr-qc/9610008","Abhay Ashtekar","Abhay Ashtekar","Large quantum gravity effects: Unexpected limitations of the classical
  theory","8 pages, No figures, ReVTeX","Phys.Rev.Lett. 77 (1996) 4864-4867","10.1103/PhysRevLett.77.4864","CGPG/10-1","gr-qc hep-th",,"  3-dimensional gravity coupled to Maxwell (or Klein-Gordon) fields is exactly
soluble under the assumption of axi-symmetry. The solution is used to probe
several quantum gravity issues. In particular, it is shown that the quantum
fluctuations in the geometry are large unless the number and frequency of
photons satisfy the inequality $\N(\hbar G\omega)^2 << 1$. Thus, even when
there is a single photon of Planckian frequency, the quantum uncertainties in
the metric are significant. Results hold also for a sector of the 4-dimensional
theory (consisting of Einstein Rosen gravitational waves).
","[{""version"":""v1"",""created"":""Tue, 8 Oct 1996 19:54:47 GMT""}]","2009-10-28"
"gr-qc/9610009","Torsten Asselmeyer","T. Asselmeyer","Generation of Source Terms in General Relativity by differential
  structures","14 pages, LaTeX, submitted to Class. Quant. Grav","Class.Quant.Grav. 14 (1997) 749-758","10.1088/0264-9381/14/3/016",,"gr-qc dg-ga hep-th math.DG",,"  In this paper the relation between the choice of a differential structure and
a smooth connection in the tangential bundle is discussed. For the case of an
exotic $S^7$ one obtains corrections to the curvature after the change of the
differential structure, which can not be neglected by a gauge transformation.
In the more interesting case of four dimensions we obtain a correction of the
connection constructed by intersections of embedded surfaces. This correction
produce a source term in the equation of the general relativity theory which
can be interpreted as the energy-momentum tensor of a embedded surface.
","[{""version"":""v1"",""created"":""Wed, 9 Oct 1996 10:45:02 GMT""}]","2009-10-28"
"gr-qc/9610010","Piotr Chrusciel","Piotr T. Chru\'sciel","Uniqueness of stationary, electro-vacuum black holes revisited","24 pages, latex with amsfonts","Helv.Phys.Acta 69 (1996) 529-552",,,"gr-qc",,"  In recent years there has been some progress in the understanding of the
global structure of stationary black hole space-times. In this paper we review
some new results concerning the structure of stationary black hole space-times.
In particular we prove a corrected version of the ``black hole rigidity
theorem'', and we prove a uniqueness theorem for static black holes with
degenerate connected horizons. This paper is an expanded version of a lecture
given at the Journ\'ees relativistes in Ascona, May 1996.
","[{""version"":""v1"",""created"":""Wed, 9 Oct 1996 10:50:23 GMT""}]","2007-05-23"
"gr-qc/9610011","Piotr Chrusciel","Piotr T. Chru\'sciel","On rigidity of analytic black holes","10 pages, latex with amssymb","Commun.Math.Phys. 189 (1997) 1-7","10.1007/s002200050187",,"gr-qc",,"  We establish global extendibility (to the domain of outer communications) of
locally defined isometries of appropriately regular analytic black holes. This
allows us to fill a gap in the Hawking-Ellis proof of black-hole rigidity.
","[{""version"":""v1"",""created"":""Wed, 9 Oct 1996 11:20:52 GMT""}]","2009-10-28"
"hep-lat/9610010","Jonathan Flynn","Jonathan Flynn","Heavy Light Weak Matrix Elements","12 pages, LaTeX2e with 6 postscript figures. Uses espcrc2.sty and
  epsf.sty (included). Talk presented at LATTICE96(heavy quarks)","Nucl.Phys.Proc.Suppl.53:168-180,1997","10.1016/S0920-5632(96)00611-1","SHEP-96-21","hep-lat",,"  I review the status of lattice calculations of heavy-light weak matrix
elements, concentrating on semileptonic B decays to light mesons, B -> K*
gamma, the B meson decay constant, f_B, and the mixing parameter B_B.
","[{""version"":""v1"",""created"":""Wed, 9 Oct 1996 09:11:38 GMT""}]","2009-03-20"
"hep-lat/9610011","Anthony Maurice Green","A.M. Green, C. Michael and P.S. Spencer","The Structure of Flux-tubes in SU(2)","27 pages including 11 ps figures","Phys.Rev.D55:1216-1225,1997","10.1103/PhysRevD.55.1216","HU-TFT-96-39","hep-lat",,"  The spatial distribution of the action and energy in the colour fields of
flux-tubes is studied in lattice SU(2) field theory for static quarks at
separations up to 1 fm. Special attention is paid to the structure of the
colour fields associated with an excited flux-tube with E_u symmetry. We
compare our results with hadronic string and flux-tube models. Sum rules are
used to extract generalised beta-functions, to describe the expected colour
field behaviour and to cross check the methods used.
","[{""version"":""v1"",""created"":""Wed, 9 Oct 1996 09:59:30 GMT""}]","2008-11-26"
"hep-lat/9610012","Pawel Sawicki","P. Sawicki","Hubbard Model and Luscher fermions","3 pages, espcrc2.sty, latex, 2 figures. Talk presented at
  LATTICE96(algorithms). Revised version. Some spelling errors has been
  corrected",,,"TPJU-19-96","hep-lat",,"  We discuss numerical complexity of the L\""uscher algorithm applied to the
Hubbard Model. In particular we present comparison to a certain algorithm based
on direct computation of the fermionic determinant.
","[{""version"":""v1"",""created"":""Wed, 9 Oct 1996 14:56:16 GMT""},{""version"":""v2"",""created"":""Tue, 22 Oct 1996 09:33:42 GMT""}]","2008-02-03"
"hep-ph/9610281",,"R. Engel, J. Ranft, and S. Roesler","Photoproduction off Nuclei and Point-like Photon Interactions Part I:
  Cross Sections and Nuclear Shadowing","15 pages, 12 figures","Phys.Rev. D55 (1997) 6957-6967","10.1103/PhysRevD.55.6957","SI 96-09, US-FT/42-96","hep-ph",,"  High energy photoproduction off nuclear targets is studied within the
Glauber-Gribov approximation. The photon is assumed to interact as a
$q\bar{q}$-system according to the Generalized Vector Dominance Model and as a
``bare photon'' in direct scattering processes with target nucleons. We
calculate total cross sections for interactions of photons with nuclei taking
into account coherence length effects and point-like interactions of the
photon. Results are compared to data on photon-nucleus cross sections, nuclear
shadowing, and quasi- elastic $\rho$-production. Extrapolations of cross
sections and of the shadowing behaviour to high energies are given.
","[{""version"":""v1"",""created"":""Tue, 8 Oct 1996 19:00:36 GMT""}]","2009-10-28"
"hep-ph/9610291","Carlo Giunti","W.M. Alberico, S.M. Bilenky and C. Giunti","Inclusive neutrino and antineutrino processes and the problem of the
  spin of proton","Latex2e file, 4 pages, no figures. Talk presented by S.M. Bilenky at
  the 12th International Symposium on High Energy Spin Physics, SPIN96,
  Amsterdam, September 10-14, 1996",,,"DFTT 62/96","hep-ph",,"  The inclusive NC and CC neutrino(antineutrino)-nucleus scattering for the
case of a nucleus with isotopic spin equal to zero is considered. It is shown
that the measurement of the neutrino-antineutrino asymmetry at relatively small
energies could allow to obtain model-independent information about the
contribution of the axial strange current to the cross sections of the NC
processes.
","[{""version"":""v1"",""created"":""Tue, 8 Oct 1996 17:52:21 GMT""}]","2007-05-23"
"hep-ph/9610292","Warren Perkins","Anne-Christine Davis, Warren B. Perkins","Generic Current-Carrying Strings","8 pages, TeX, 5 postscript figures","Phys.Lett. B390 (1997) 107-114","10.1016/S0370-2693(96)01358-5","DAMTP 96-71, SWAT/126","hep-ph",,"  We investigate the standard model in a cosmic string background and show that
the electroweak symmetry is partially restored. For a range of parameters the
electroweak Higgs field can wind in this region, producing an electroweak
string stabilised by the cosmic string background. In this case there are quark
and lepton zero modes that result in the string becoming superconducting at the
electroweak scale. If the electroweak Higgs field does not wind, there are no
zero modes, but there are fermion bound states. These bound states can also
carry a current.
","[{""version"":""v1"",""created"":""Tue, 8 Oct 1996 16:21:22 GMT""}]","2009-10-28"
"hep-ph/9610293",,"Vincent Lucas, Stuart Raby (The Ohio State University)","Nucleon Decay in a Realistic SO(10) SUSY GUT","42 pages, LaTeX","Phys.Rev.D55:6986-7009,1997","10.1103/PhysRevD.55.6986","OHSTPY-HEP-T-96-030","hep-ph",,"  In this paper, we calculate neutron and proton decay rates and branching
ratios in a predictive SO(10) SUSY GUT which agrees well with low energy data.
We show that the nucleon lifetimes are consistent with the experimental bounds.
The nucleon decay rates are calculated using all one-loop chargino and gluino
dressed diagrams regardless of their chiral structure. We show that the
four-fermion operator $C_{jk} (u_R {d_j}_R)({d_k}_L {\nu_\tau}_L)$, commonly
neglected in previous nucleon decay calculations, not only contributes
significantly to nucleon decay, but, for many values of the initial GUT
parameters and for large $\tan\beta$, actually dominates the decay rate. As a
consequence, we find that $\tau_p/\tau_n$ is often substantially larger than
the prediction obtained in small $\tan\beta$ models. We also find that
gluino-dressed diagrams, often neglected in nucleon decay calculations,
contribute significantly to nucleon decay. In addition we find that the
branching ratios obtained from this realistic SO(10) SUSY GUT differ
significantly from the predictions obtained from ``generic"" SU(5) SUSY GUTS.
Thus nucleon decay branching ratios, when observed, can be used to test
theories of fermion masses.
","[{""version"":""v1"",""created"":""Wed, 9 Oct 1996 02:44:53 GMT""}]","2014-11-17"
"hep-ph/9610294","Lee Jungil","C.S. Kim(KEK), Jungil Lee and H.S. Song(Seoul National Univ)","Color-Octet Contributions in the Associate J/psi+gamma Hadroproduction","25 pages, LaTeX using revtex and epsfig, corrections made for trivial
  misprints in labeling of figs. 6-8(should be read as nb not pb)","Phys.Rev.D55:5429-5436,1997","10.1103/PhysRevD.55.5429","SNUTP-96-019","hep-ph",,"  Color-octet contributions to the associate J/psi+gamma hadroproduction are
studied in detail, and found to be negligible, compared to the ordinary
color-singlet contribution. Within the color-singlet model the J/psi+gamma
production in the leading order is possible only through gluon-gluon fusion
process. Therefore, the associate J/psi+gamma hadroproduction remains to be
useful as a clean channel to probe the gluon distribution inside proton, to
study heavy quarkonia production mechanism, and to find proton's spin
structure.
","[{""version"":""v1"",""created"":""Wed, 9 Oct 1996 05:32:54 GMT""},{""version"":""v2"",""created"":""Wed, 20 Nov 1996 13:02:33 GMT""}]","2010-11-19"
"hep-ph/9610295","Rainer Jakob","R. Jakob and P. J. Mulders","Time reversal odd fragmentation functions","3 pages, Latex, 1 Postscript figure, uses epsfig.sty, wrapfig.sty,
  Talk presented by R. Jakob at the 12th Int. Symposium on High-Energy Spin
  Physics, Amsterdam, 10-14 Sept. 1996; to appear in the proceedings",,,"NIKHEF 96-025","hep-ph",,"  The combination of transverse momentum and polarization effects in hard
scattering processes, e.g polarized deep-inelastic leptoproduction, results in
a rich variety of information on the hadronic structure. This information is
encoded in a correspondingly large number of functions depending on both,
longitudinal fractional momenta $x$ and transverse momenta $p_T$. Integration
over transverse momenta establishes the connection to the usual distribution
and fragmentation functions. Constraints from hermiticity and invariance under
parity operation induce some relations between different functions. One
specific aspect of the information on the hadronic structure is the appearance
of {\em time reversal odd} fragmentation functions due to the non-applicability
of time-reversal invariance for the hadronization of a quark. {\em T-odd}
fragmentation functions are experimentally accessible via the measurement of,
for instance, asymmetries in semi-inclusive leptoproduction.
","[{""version"":""v1"",""created"":""Wed, 9 Oct 1996 15:33:43 GMT""}]","2007-05-23"
