"astro-ph/9610051","Alexander Kashlinsky","A. Kashlinsky, J. C. Mather, S. Odenwald","Clustering of the Diffuse Infrared Light from the COBE DIRBE maps. An
  all-sky survey of $C(0)$","15 pages (LATEX) with 2 figures and 1 plate; Ap. J. Letters, in press","Astrophys.J.473:L9,1996","10.1086/310379",,"astro-ph",,"  We measure the smoothness of the infrared sky using the COBE DIRBE maps, and
obtain interesting limits on the production of the diffuse cosmic infrared
background (CIB) light by matter clustered like galaxies. The predicted
fluctuations of the CIB with the DIRBE beam size of 0.7\deg\ are of the order
of 10\%, and the maps are smooth at the level of $\delta\nu I_\nu \sim $ a few
\nwm2sr rms from 2.2 to 100 \um. The lowest numbers are achieved at mid- to
far-IR where the foreground is bright but smooth; they are
$\sqrt{C(0)}$$\leq$$(1-1.5)$ \nwm2sr at $\lambda=$ 10-100 \um. If the CIB comes
from clustered matter evolving according to typical scenarios, then the
smoothness of the maps implies CIB levels less than $\sim (10-15) $ \nwm2sr
over this wavelength range.
","[{""version"":""v1"",""created"":""Tue, 8 Oct 1996 17:07:48 GMT""}]","2011-02-11"
"astro-ph/9610054","Taoling Xie","Taoling Xie, L. Mundy, S. Vogel and P. Hofner","On Turbulent Pressure Confinement of Ultra-Compact HII Regions","11 pages, 1 figure, ApJ Letters",,,,"astro-ph",,"  It has been proposed recently that the small size and long lifetime of
ultra-compact HII regions (UCHIIs) could be due to pressure confinement if the
thermal pressure of the ambient gas is higher than previous estimates. We point
out that confinement by thermal pressure alone implies emission measures in
excess of observed values. We show that turbulent pressure, inferred from
observed non-thermal velocities, is sufficient to confine UC HIIs and explain
their longevity. We predict an anti-correlation between the size of UCHIIs and
the velocity dispersion of the ambient neutral gas, and show that it is
consistent with existing observations.
","[{""version"":""v1"",""created"":""Wed, 9 Oct 1996 02:05:30 GMT""}]","2007-05-23"
"astro-ph/9610055","Sandy Faber","S. M. Faber, Scott Tremaine, Edward A. Ajhar, Yong-Ik Byun, Alan
  Dressler, Karl Gebhardt, Carl Grillmair, John Kormendy, Tod R. Lauer, Douglas
  Richstone","The Centers of Early-Type Galaxies with HST. IV. Central Parameter
  Relations","40 pages (Tex) with 10 figures and 4 tables (Postscript). To appear
  in the November 1997 Astronomical Journal. The discussion section is
  significantly revised from the original submission to Astro-ph, dated October
  1996. One figure is slightly altered, and the data tables are the same","Astron.J. 114 (1997) 1771","10.1086/118606","UCO/Lick No. 84","astro-ph",,"  We analyze Hubble Space Telescope surface-brightness profiles of 61
elliptical galaxies and spiral bulges (hot galaxies). Luminous hot galaxies
have cuspy cores with steep outer power-law profiles that break at r ~ r_b to
shallow inner profiles with logslope less than 0.3. Faint hot galaxies show
steep, largely featureless power-law profiles at all radii and lack cores. The
centers of power-law galaxies are up to 1000 times denser in mass and
luminosity than the cores of large galaxies at a limiting radius of 10 pc. At
intermediate magnitudes (-22.0 < M_V < -20.5), core and power-law galaxies
coexist, and there is a range in r_b at a given luminosity of at least two
orders of magnitude. Central properties correlate with global rotation and
shape: core galaxies tend to be boxy and slowly rotating, whereas power-law
galaxies tend to be disky and rapidly rotating. The dense power-law centers of
disky, rotating galaxies are consistent with their formation in gas-rich
mergers. The parallel proposition that cores are simply the by-products of
gas-free stellar mergers is less compelling. For example, core galaxies accrete
small, dense, gas-free galaxies at a rate sufficient to fill in low-density
cores if the satellites survived and sank to the center. An alternative model
for core formation involves the orbital decay of massive black holes (BHs): the
BH may heat and eject stars from the center, eroding a power law if any exists
and scouring out a core. An average BH mass per spheroid of 0.002 times the
stellar mass yields reasonably good agreement with the masses and radii of
observed cores and in addition is consistent with the energetics of AGNs and
kinematic detections of BHs in nearby galaxies.
","[{""version"":""v1"",""created"":""Wed, 9 Oct 1996 01:31:34 GMT""},{""version"":""v2"",""created"":""Tue, 14 Oct 1997 22:36:42 GMT""}]","2009-10-28"
"astro-ph/9610056",,"V.G. Gurzadyan and A. Mazure","Revealing Galaxy Associations in Abell 119","Latex file, 7 pages, 2 figures, .ps files can be obtained from the
  authors. To appear in The Observatory, vol.116, No.1134, 1996",,,"EFI 96 (117)","astro-ph",,"  We report the results of an analysis of the hierarchical properties of the
cluster of galaxies Abell 119. Observational data from the ESO Nearby Abell
Cluster Survey (ENACS) are used, complemented by data from previous studies,
while the analysis is performed with the S-tree method. The main physical
system and its three subgroups with truncated Gaussian velocity distributions
are identified; due to their remarkable physical features and possible
cosmogonical mission we call these subgroups ``galaxy associations''. The mass
centre of the core of main system is shown to coincide with the X-ray centre of
the cluster. An alignment of the mass centres of the 3 galaxy associations is
also shown.
","[{""version"":""v1"",""created"":""Wed, 9 Oct 1996 04:27:10 GMT""}]","2016-08-30"
"astro-ph/9610057","Claus Grupen","Claus Grupen (Siegen University)","Neutrino Astronomy: A New Window to the Universe","8 pages, 3 figures, talk held at XV Cracow Summer School on
  Cosmology, July 1996, Lodz, Poland",,,,"astro-ph",,"  Neutrino astronomy offers the prospect to be able to look into the interior
of compact astrophysical objects which may be the sources of cosmic radiation.
This paper describes the results on neutrino observations from the sun and the
supernova SN1987A along with an outlook on neutrino astronomy beyond the TeV
scale.
","[{""version"":""v1"",""created"":""Wed, 9 Oct 1996 09:26:27 GMT""}]","2007-05-23"
"astro-ph/9610058","A. Mastichiadis","A. Mastichiadis and J.G. Kirk (MPI Kernphysik, Heidelberg)","Variability in the synchrotron self-Compton model of blazar emission","Astron. & Astrophys. (in press), Latex (laa.sty), 8 pages, 9 Ps
  figures",,,,"astro-ph",,"  We present a model of the spectra of gamma-ray emitting blazars in which a
single homogeneous emission region both emits synchrotron photons directly and
scatters them to high (gamma-ray) energy before emission (a ``synchrotron
self-Compton'' or SSC model). In contrast to previous work, we follow the full
time dependent evolution of the electron and photon spectra, assuming a
power-law form of the electron injection and examine the predictions of the
model with regard to variability of the source. We apply these computations to
the object Mkn 421, which displayed rapid variability in its X-ray and TeV
emission during a multiwavelength campaign in 1994. This observation strongly
implies that the same population of electrons produces the radiation in both
energy bands. By fitting first the observed quiescent spectrum over all 18
orders of magnitude in frequency, we show that the time dependence of the
keV/TeV flare could have been the result of a sudden increase in the maximum
energy of the injected electrons. We show also that different types of flare
may occur in this object and others, and that the energy band most sensitive to
the properties of the acceleration mechanism is the X-ray band.
","[{""version"":""v1"",""created"":""Wed, 9 Oct 1996 07:50:18 GMT""}]","2016-08-30"
"astro-ph/9610059",,"F. Matteucci, B.K. Gibson","Galaxy evolution: the effect of dark matter on the chemical evolution of
  ellipticals and galaxy clusters","12 pages, 3 Postscript figures, paspconf.sty to appear on the proc.
  of ""Dark and Visible Matter in Galaxies"" Persic and Salucci eds., ASP Conf.
  Series",,,,"astro-ph",,"  In this paper we discuss the chemical evolution of elliptical galaxies and
its consequences on the evolution of the intracluster medium (ICM). We use
chemical evolution models taking into account dark matter halos and compare the
results with previous models where dark matter was not considered. In
particular, we examine the evolution of the abundances of some relevant heavy
elements such as oxygen, magnesium and iron and conclude that models including
dark matter halos and an initial mass function (IMF) containing more massive
stars than the Salpeter (1955) IMF, better reproduce the observed abundances of
Mg and Fe both in the stellar populations and in the ICM (ASCA results). We
also discuss the origin of gas in galaxy clusters and conclude that most of it
should have a primordial origin.
","[{""version"":""v1"",""created"":""Wed, 9 Oct 1996 10:38:47 GMT""}]","2007-05-23"
"astro-ph/9610060","Giulio Mignola","V. Berezinsky, A. Bottino and G. Mignola","On neutralino stars as microlensing objects","7 pages, LaTeX, no figures","Phys.Lett.B391:355-359,1997","10.1016/S0370-2693(96)01495-5","CERN-TH 96-283, DFTT 53/96","astro-ph",,"  The microlensing objects, Machos, recently observed in the halo of our
Galaxy, can be interpreted as dense neutralino objects, neutralino stars,
produced by the gravitational instability of neutralino gas. Taking the mass
and radius of these objects from microlensing observations we calculated the
diffuse gamma-ray flux produced in neutralino--neutralino annihilation inside
the objects. The resulting flux is many orders of magnitude higher than the
observed one.
","[{""version"":""v1"",""created"":""Wed, 9 Oct 1996 15:51:33 GMT""}]","2010-11-30"
"cond-mat/9610055","Bernd Rosenow","R. Oppermann and B. Rosenow (Univ. Wuerzburg)","Fermionic Quantum Spin Glass Transitions","10 pages, 2 Postscript figures, macro lamuphys.sty (included), to
  appear in the proceedings of the conference `Complex Behavior of Glassy
  Systems', Sitges, June 1996",,"10.1007/BFb0104833",,"cond-mat.dis-nn cond-mat.str-el",,"  This article reviews recent progress of the analytical theory of quantum spin
glasses (QSG). Exact results for infinite range and one loop renormalisation
group calculations for finite range models of either insulating or metallic
type are presented. We describe characteristics of fermionic spin glass
transitions and of fermionic correlations which are affected by these
transitions and by spin glass order. Connections between tricritical thermal--
and $T=0$ QSG transitions are described. A general phase diagram with
tricritical QSG transitions caused either by random chemical potential or by
elastic electron scattering, and implying discontinuous $T=0$--transitions in
weak and in strong filling regimes, is also derived.
","[{""version"":""v1"",""created"":""Tue, 8 Oct 1996 19:04:44 GMT""}]","2009-10-28"
"cond-mat/9610062","Alon Drory","Alon Drory","Exact solution of a one-dimensional continuum percolation model","21 pages, Latex",,"10.1103/PhysRevE.55.3878",,"cond-mat.stat-mech",,"  I consider a one dimensional system of particles which interact through a
hard core of diameter $\si$ and can connect to each other if they are closer
than a distance $d$. The mean cluster size increases as a function of the
density $\rho$ until it diverges at some critical density, the percolation
threshold. This system can be mapped onto an off-lattice generalization of the
Potts model which I have called the Potts fluid, and in this way, the mean
cluster size, pair connectedness and percolation probability can be calculated
exactly. The mean cluster size is $S = 2 \exp[ \rho (d -\si)/(1 - \rho \si)] -
1$ and diverges only at the close packing density $\rho_{cp} = 1 / \si $. This
is confirmed by the behavior of the percolation probability. These results
should help in judging the effectiveness of approximations or simulation
methods before they are applied to higher dimensions.
","[{""version"":""v1"",""created"":""Tue, 8 Oct 1996 17:19:48 GMT""}]","2009-10-28"
"cond-mat/9610063","Martin Zapotocky","Martin Zapotocky, Dmitrii L. Maslov, and Paul M. Goldbart (University
  of Illinois at Urbana-Champaign)","Induction of non-d-wave order-parameter components by currents in d-wave
  superconductors","15 pages, includes 2 figures. To appear in Phys. Rev. B","Phys. Rev. B 55, 6599 (1997)","10.1103/PhysRevB.55.6599","P-96-07-054-i","cond-mat.supr-con",,"  It is shown, within the framework of the Ginzburg-Landau theory for a
superconductor with d_{x^2-y^2} symmetry, that the passing of a supercurrent
through the sample results, in general, in the induction of order-parameter
components of distinct symmetry. The induction of s-wave and
d_{xy(x^2-y^2)-wave components are considered in detail. It is shown that in
both cases the order parameter remains gapless; however, the structure of the
lines of nodes and the lobes of the order parameter are modified in distinct
ways, and the magnitudes of these modifications differ in their dependence on
the (a-b plane) current direction. The magnitude of the induced s-wave
component is estimated using the results of the calculations of Ren et al.
[Phys. Rev. Lett. 74, 3680 (1995)], which are based on a microscopic approach.
","[{""version"":""v1"",""created"":""Tue, 8 Oct 1996 16:38:31 GMT""}]","2009-10-28"
"cond-mat/9610064",,"P. G. Silvestrov (Budker Institute of Nuclear Physics, Novosibirsk,
  Russia and The Niels Bohr Institute, Copenhagen, Denmark)","Summing graphs for random band matrices","20 pages, REVTEX, 11 eps figures, improved version accepted for
  publication in Phys. Rev. E","Phys.Rev. E55 (1997) 6419","10.1103/PhysRevE.55.6419","NBI-HE-96-53","cond-mat.stat-mech hep-th",,"  A method of resummation of infinite series of perturbation theory diagrams is
applied for studying the properties of random band matrices. The topological
classification of Feynman diagrams, which was actively used in last years for
matrix model regularization of 2d-gravity, turns out to be very useful for band
matrices. The critical behavior at the edge of spectrum and the asymptotics of
energy level correlation function are considered. This correlation function
together with the hypothesis about universality of spectral correlations allows
to estimate easily the localization length for eigen-vectors. A smoothed
two-point correlation function of local density of states $\overline{
\rho(E_1,i) \rho(E_2,j)_c}$ as well as the energy level correlation for finite
size band matrices are also found. As d-dimensional generalization of band
matrices lattice Hamiltonians with long-range random hopping are considered as
well.
","[{""version"":""v1"",""created"":""Tue, 8 Oct 1996 16:49:00 GMT""},{""version"":""v2"",""created"":""Wed, 20 Nov 1996 12:12:57 GMT""},{""version"":""v3"",""created"":""Mon, 24 Feb 1997 16:41:08 GMT""}]","2016-08-31"
"cond-mat/9610065","A. S. Alexandrou","A.S. Alexandrov","Logarithmic divergence of normal state resistivity of bipolaronic
  high-$T_{c}$ cuprates","8 pages, Latex, 3 figures available upon request",,,,"cond-mat.supr-con",,"  The resonance Wigner scattering of charged bosons (small bipolarons) in a
random potential leads to logarithmically divergent low-temperature resistivity
as observed in several cuprates. Unusual temperature dependence of resistivity
of $La_{2-x}Sr_{x}CuO_{4}$ as well as of the Hall effect is quantitatively
described in a wide temperature range providing an evidence for $2e$ charged
Bose-liquid in high-$T_{c}$ cuprates.
","[{""version"":""v1"",""created"":""Tue, 8 Oct 1996 17:00:05 GMT""}]","2008-02-03"
"cond-mat/9610066","Walter Kob","J. Horbach, W. Kob, K. Binder and C.A. Angell (Institute of Physics,
  Mainz, Germany)","Some Finite Size Effects in Simulations of Glass Dynamics","12 pages of RevTex, 4 postscript figures available from W. Kob","Phys. Rev. E 54, R5897 (1996)","10.1103/PhysRevE.54.R5897","KOMA-96-39","cond-mat.stat-mech",,"  We present the results of a molecular dynamics computer simulation in which
we investigate the dynamics of silica. By considering different system sizes,
we show that in simulations of the dynamics of this strong glass former
surprisingly large finite size effects are present. In particular we
demonstrate that the relaxation times of the incoherent intermediate scattering
function and the time dependence of the mean squared displacement are affected
by such finite size effects. By compressing the system to high densities, we
transform it to a fragile glass former and find that for that system these
types of finite size effects are much weaker.
","[{""version"":""v1"",""created"":""Tue, 8 Oct 1996 17:48:57 GMT""}]","2009-10-28"
"cond-mat/9610067","Douglas Davidson","Douglas Davidson, Marcel den Nijs (University of Washington)","Roughening Induced Deconstruction in (100) Facets of CsCl Type Crystals","31 pages, 9 figures",,"10.1103/PhysRevE.55.1331",,"cond-mat.stat-mech",,"  The staggered 6-vertex model describes the competition between surface
roughening and reconstruction in (100) facets of CsCl type crystals. Its phase
diagram does not have the expected generic structure, due to the presence of a
fully-packed loop-gas line. We prove that the reconstruction and roughening
transitions cannot cross nor merge with this loop-gas line if these degrees of
freedom interact weakly. However, our numerical finite size scaling analysis
shows that the two critical lines merge along the loop-gas line, with strong
coupling scaling properties. The central charge is much larger than 1.5 and
roughening takes place at a surface roughness much larger than the conventional
universal value. It seems that additional fluctuations become critical
simultaneously.
","[{""version"":""v1"",""created"":""Tue, 8 Oct 1996 18:21:16 GMT""}]","2009-10-28"
"cond-mat/9610068","Regis Melin","R. M\'elin and B. Doucot (CRTBT-CNRS, Grenoble)","nu=1/2 quantum Hall effect in the Aharonov-Casher geometry in a
  mesoscopic ring","23 pages,14 included postscript figures, submitted to Phys. Rev. B",,"10.1103/PhysRevB.55.13135",,"cond-mat.mes-hall",,"  We study the effect of an electric charge in the middle of a ring of
electrons in a magnetic field such as $\nu = 1/2$. In the absence of the
central charge, a residual current should appear due to an Aharanov-Bohm
effect. As the charge varies, periodic currents should appear in the ring. We
evaluate the amplitude of these currents, as well as their period as the
central charge varies. The presence of these currents should be a direct
signature of the existence of a statistical gauge field in the $\nu=1/2$
quantum Hall effect. Numerical diagonalizations for a small number of electrons
on the sphere are also carried out. The numerical results up to 9 electrons are
qualitatively consistent with the mean field picture.
","[{""version"":""v1"",""created"":""Tue, 8 Oct 1996 18:33:22 GMT""}]","2009-10-28"
"cond-mat/9610069","Phil Nelson","Udo Seifert, Julian Shillcock, Philip Nelson","The Role of Bilayer Tilt Difference in Equilibrium Membrane Shapes","Latex file; .ps available at
  http://dept.physics.upenn.edu/~nelson/saddle.ps",,"10.1103/PhysRevLett.77.5237",,"cond-mat.soft",,"  Lipid bilayer membranes below their main transition have two tilt order
parameters, corresponding to the two monolayers. These two tilts may be
strongly coupled to membrane shape but only weakly coupled to each other. We
discuss some implications of this observation for rippled and saddle phases,
bilayer tubules, and bicontinuous phases. Tilt difference introduces a length
scale into the elastic theory of tilted fluid membranes. It can drive an
instability of the flat phase; it also provides a simple mechanism for the
spontaneous breaking of inversion symmetry seen in some recent experiments.
","[{""version"":""v1"",""created"":""Tue, 8 Oct 1996 18:33:04 GMT""}]","2009-10-28"
"cond-mat/9610070","Phil Nelson","Roy Bar-Ziv, J. David Moroz, Elisha Moses, Philip Nelson","Spontaneous Expulsion of Giant Lipid Vesicles Induced by Laser Tweezers","Plain TeX file; uses harvmac and epsf; .ps available at
  http://dept.physics.upenn.edu/~nelson/expulsion.ps",,,,"cond-mat.soft q-bio",,"  Irradiation of a giant unilamellar lipid bilayer vesicle with a focused laser
spot leads to a tense pressurized state which persists indefinitely after laser
shutoff. If the vesicle contains another object it can then be gently and
continuously expelled from the tense outer vesicle. Remarkably, the inner
object can be almost as large as the parent vesicle; its volume is replaced
during the exit process. We offer a qualitative theoretical model to explain
these and related phenomena. The main hypothesis is that the laser trap pulls
in lipid and ejects it in the form of submicron objects, whose osmotic activity
then drives the expulsion.
","[{""version"":""v1"",""created"":""Tue, 8 Oct 1996 18:57:42 GMT""}]","2008-02-03"
"cond-mat/9610071","Lev Ioffe","P. Chandra, M.V. Feigelman, M.E. Gershenson, and L.B. Ioffe","An Experimentally Realizable Weiss Model for Disorder-Free Glassiness","6 pages, LaTeX, 2 Postscript figures",,"10.1007/BFb0104840",,"cond-mat.dis-nn",,"  We summarize recent work on a frustrated periodic long-range Josephson array
in a parameter regime where its dynamical behavior is identical to that of the
$p=4$ disordered spherical model. We also discuss the physical requirements
imposed by the theory on the experimental realization of this superconducting
network.
","[{""version"":""v1"",""created"":""Tue, 8 Oct 1996 20:04:19 GMT""}]","2009-10-28"
"cond-mat/9610072","David Moroz","J. David Moroz and Philip Nelson (University of Pennsylvania)","Dynamically-Stabilized Pores in Bilayer Membranes","7 pages RevTeX, 3 included eps figures (published version).
  Postscript also available at http://dept.physics.upenn.edu/~moroz","Biophys. J. 72, 2211-16 (1997)","10.1016/S0006-3495(97)78864-7","UPR-720T","cond-mat.soft q-bio",,"  Zhelev and Needham have recently created large, quasi-stable pores in
artificial lipid bilayer vesicles [Biochim. Biophys. Acta 1147 (1993) 89].
Initially created by electroporation, the pores remain open for up to several
seconds before quickly snapping shut. This result is surprising in light of the
large line tension for holes in bilayer membranes and the rapid time scale for
closure of large pores. We show how pores can be dynamically stabilized via a
new feedback mechanism. We also explain quantitatively the observed sudden pore
closure as a tangent bifurcation. Finally we show how Zhelev and Needham's
experiment can be used to measure accurately the pore line tension, an
important material parameter. For their SOPC/CHOL mixture we obtain a line
tension of 2.6 10^{-6} erg/cm.
","[{""version"":""v1"",""created"":""Tue, 8 Oct 1996 22:31:31 GMT""},{""version"":""v2"",""created"":""Wed, 14 May 1997 23:57:13 GMT""}]","2009-10-28"
"cond-mat/9610073","Gary Oas","Gary Oas","Universal Cubic Eigenvalue Repulsion for Random Normal Matrices","15 pages, 2 eps figures. to appar in Physical Review E",,"10.1103/PhysRevE.55.205",,"cond-mat.stat-mech",,"  Random matrix models consisting of normal matrices, defined by the sole
constraint $[N^{\dag},N]=0$, will be explored. It is shown that cubic
eigenvalue repulsion in the complex plane is universal with respect to the
probability distribution of matrices. The density of eigenvalues, all
correlation functions, and level spacing statistics are calculated. Normal
matrix models offer more probability distributions amenable to analytical
analysis than complex matrix models where only a model wth a Gaussian
distribution are solvable. The statistics of numerically generated eigenvalues
from gaussian distributed normal matrices are compared to the analytical
results obtained and agreement is seen.
","[{""version"":""v1"",""created"":""Tue, 8 Oct 1996 22:03:14 GMT""}]","2009-10-28"
"cond-mat/9610074","Jorge Jose","R. Badrinarayanan and Jorge V. Jos\'e","Classical and Quantum Chaos in a quantum dot in time-periodic magnetic
  fields","26 pages and 17 PstScript figures, two large ones can be obtained
  from the Authors","Physical Review E, Sept 01, Vol 54, No 3, 2419 (1996)","10.1103/PhysRevE.54.2419",,"cond-mat.mes-hall",,"  We investigate the classical and quantum dynamics of an electron confined to
a circular quantum dot in the presence of homogeneous $B_{dc}+B_{ac}$ magnetic
fields. The classical motion shows a transition to chaotic behavior depending
on the ratio $\epsilon=B_{ac}/B_{dc}$ of field magnitudes and the cyclotron
frequency ${\tilde\omega_c}$ in units of the drive frequency. We determine a
phase boundary between regular and chaotic classical behavior in the $\epsilon$
vs ${\tilde\omega_c}$ plane. In the quantum regime we evaluate the quasi-energy
spectrum of the time-evolution operator. We show that the nearest neighbor
quasi-energy eigenvalues show a transition from level clustering to level
repulsion as one moves from the regular to chaotic regime in the
$(\epsilon,{\tilde\omega_c})$ plane. The $\Delta_3$ statistic confirms this
transition. In the chaotic regime, the eigenfunction statistics coincides with
the Porter-Thomas prediction. Finally, we explicitly establish the phase space
correspondence between the classical and quantum solutions via the Husimi phase
space distributions of the model. Possible experimentally feasible conditions
to see these effects are discussed.
","[{""version"":""v1"",""created"":""Tue, 8 Oct 1996 22:20:05 GMT""}]","2016-08-31"
