"hep-th/9610097","Mihai Visinescu","Mihai Visinescu","Generalized Killing equations for spinning spaces and the role of
  Killing-Yano tensors","LaTeX, 6 pages, Talk given at the International Symposium on the
  Theory of Elementary Particles, Buckow 1996","Nucl.Phys.Proc.Suppl. 56B (1997) 142-147","10.1016/S0920-5632(97)00319-8","IFA-FT-421-1996","hep-th gr-qc",,"  The generalized Killing equations for the configuration space of spinning
particles (spinning space) are analysed. Solutions of these equations are
expressed in terms of Killing-Yano tensors. In general the constants of motion
can be seen as extensions of those from the scalar case or new ones depending
on the Grassmann-valued spin variables.
","[{""version"":""v1"",""created"":""Tue, 15 Oct 1996 09:51:29 GMT""}]","2009-10-30"
"hep-th/9610098",,"Igor A. Bandos and Alexei Yu. Nurmagambetov","Generalized action principle and extrinsic geometry for N=1
  superparticle","31 pages. Latex","Class.Quant.Grav.14:1597-1621,1997","10.1088/0264-9381/14/7/004","KhPTI-TH-9610","hep-th",,"  It is proposed the generalized action functional for N=1 superparticle in
D=3,4,6 and 10 space-time dimensions. The superfield geometric approach
equations describing superparticle motion in terms of extrinsic geometry of the
worldline superspace are obtained on the base of the generalized action. The
off-shell superdiffeomorphism invariance (in the rheonomic sense) of the
superparticle generalized action is proved. It was demonstrated that the half
of the fermionic and one bosonic (super)fields disappear from the generalized
action in the analytical basis. Superparticle interaction with Abelian gauge
theory is considered in the framework of this formulation. The geometric
approach equations describing superparticle motion in Abelian background are
obtained.
","[{""version"":""v1"",""created"":""Tue, 15 Oct 1996 12:18:51 GMT""}]","2016-09-06"
"hep-th/9610099","Andreas Opfermann","A. Opfermann and G. Papadopoulos","Solitons in (1,1)-supersymmetric massive sigma model","Phyzzx.tex, 32 pp, 3 figs","Nucl.Phys.B488:177-198,1997","10.1016/S0550-3213(96)00707-9","R/96/45","hep-th",,"  We find the solitons of massive (1,1)-supersymmetric sigma models with target
space the groups $SO(2)$ and $SU(2)$ for a class of scalar potentials and
compute their charge, mass and moduli space metric. We also investigate the
massive sigma models with target space any semisimple Lie group and show that
some of their solitons can be obtained from embedding the $SO(2)$ and $SU(2)$
solitons.
","[{""version"":""v1"",""created"":""Tue, 15 Oct 1996 12:36:37 GMT""}]","2009-10-09"
"hep-th/9610100",,"G. Lambiase and V.V. Nesterenko","Nambu-Goto string with massive ends at finite temperature","LaTex file, 8 pages","Phys.Lett. B398 (1997) 335-341","10.1016/S0370-2693(97)00231-1",,"hep-th",,"  It is shown that the critical (or deconfinement) temperature for the
Nambu-Goto string connecting the point-like masses (quarks) does not depend on
the value of these masses. This temperature turns out to be the same as that in
the case of string with fixed ends (infinitely heavy immobile quarks).
","[{""version"":""v1"",""created"":""Tue, 15 Oct 1996 15:05:43 GMT""}]","2009-10-30"
"hep-th/9610102","Alexander Sevrin","Alexander Sevrin and Jan Troost","Off-Shell Formulation of N=2 Non-Linear Sigma-Models","22 pages, LaTeX","Nucl.Phys. B492 (1997) 623-646","10.1016/S0550-3213(97)00103-X","VUB/TENA/96/06","hep-th",,"  We study d=2, N=(2,2) non-linear sigma-models in (2,2) superspace. By
analyzing the most general constraints on a superfield, we show that through an
appropriate choice of coordinates, there are no other superfields than chiral,
twisted chiral and semi-chiral ones. We study the resulting sigma-models and we
speculate on the possibility that all (2,2) non-linear sigma-models can be
described using these fields. We apply the results to two examples: the SU(2) x
U(1) and the SU(2) x SU(2) WZW model. Pending upon the choice of complex
structures, the former can be described in terms of either one semi-chiral
multiplet or a chiral and a twisted chiral multiplet. The latter is formulated
in terms of one semi-chiral and one twisted chiral multiplet. For both cases we
obtain the potential explicitely.
","[{""version"":""v1"",""created"":""Tue, 15 Oct 1996 09:57:41 GMT""}]","2009-10-30"
"hep-th/9610104","Peter Johnson","E.J.Beggs, P.R.Johnson (Swansea)","Inverse scattering and solitons in $A_{n-1}$ affine Toda field theories","28 pages, Latex, 4 figs included","Nucl.Phys. B484 (1997) 653-681","10.1016/S0550-3213(96)00576-7","SWAT 95-96/115","hep-th",,"  We implement the inverse scattering method in the case of the $A_n$ affine
Toda field theories, by studying the space-time evolution of simple poles in
the underlying loop group. We find the known single soliton solutions, as well
as additional solutions with non-linear modes of oscillation around the
standard solution, by studying the particularly simple case where the residue
at the pole is a rank one projection. We show that these solutions with extra
modes have the same mass and topological charges as the standard solutions, so
we do not shed any light on the missing topological charge problem in these
models. We also show that the integrated energy-momentum density can be
calculated from the central extension of the loop group.
","[{""version"":""v1"",""created"":""Tue, 15 Oct 1996 14:37:04 GMT""},{""version"":""v2"",""created"":""Fri, 8 Nov 1996 17:37:52 GMT""}]","2009-10-30"
"math/9610203","Yum-Tong Siu","Yum-Tong Siu and Sai-Kee Yeung","Defects for Ample Divisors of Abelian Varieties, Schwarz Lemma, and
  Hyperbolic Hypersurfaces of Low Degrees",,,,,"math.CV",,"  The main purpose of this paper is to prove the following theorem on the
defect relations for ample divisors of abelian varieties.
  Main Theorem. Let $A$ be an abelian variety of complex dimension $n$ and $D$
be an ample divisor in $A$. Let $f:{\bf C}\rightarrow A$ be a holomorphic map.
Then the defect for the map $f$ and the divisor $D$ is zero.
  Corollary to Main Theorem. The complement of an ample divisor $D$ in an
abelian variety $A$ is hyperbolic in the sense that there is no nonconstant
holomorphic map from $\bf C$ to $A-D$.
","[{""version"":""v1"",""created"":""Mon, 14 Oct 1996 20:22:20 GMT""}]","2008-02-03"
"math/9610206","Paul Bankston","Paul Bankston","Some applications of the ultrapower theorem to the theory of compacta",,,,"Logic E-prints October 15, 1996","math.LO",,"  The ultrapower theorem of Keisler-Shelah allows such model-theoretic notions
as elementary equivalence, elementary embedding and existential embedding to be
couched in the language of categories (limits, morphism diagrams). This in turn
allows analogs of these (and related) notions to be transported into unusual
settings, chiefly those of Banach spaces and of compacta. Our interest here is
the enrichment of the theory of compacta, especially the theory of continua,
brought about by the immigration of model-theoretic ideas and techniques.
","[{""version"":""v1"",""created"":""Tue, 15 Oct 1996 00:00:00 GMT""}]","2008-02-03"
"math/9610219","Shelah Office","Marek Balcerzak, Andrzej Ros{\l}anowski, Saharon Shelah","Ideals without ccc",,"J. Symbolic Logic 63 (1998), 128--147",,"Shelah [BRSh:512]","math.LO",,"  Let I be an ideal of subsets of a Polish space X, containing all singletons
and possessing a Borel basis. Assuming that I does not satisfy ccc, we consider
the following conditions (B), (M) and (D). Condition (B) states that there is a
disjoint family F subseteq P(X) of size c, consisting of Borel sets which are
not in I. Condition (M) states that there is a function f:X-> X with
f^{-1}[{x}] notin I for each x in X. Provided that X is a group and I is
invariant, condition (D) states that there exist a Borel set B notin I and a
perfect set P subseteq X for which the family {B+x: x in P} is disjoint. The
aim of the paper is to study whether the reverse implications in the chain (D)
=> (M) => (B) => not-ccc can hold. We build a sigma-ideal on the Cantor group
witnessing''(M) and not (D)'' (Section 2). A modified version of that
sigma-ideal contains the whole space (Section 3). Some consistency results
deriving (M) from (B) for''nicely'' defined ideals are established (Section 4).
We show that both ccc and (M) can fail (Theorems 1.3 and 4.2). Finally, some
sharp versions of (M) for invariant ideals on Polish groups are investigated
(Section 5).
","[{""version"":""v1"",""created"":""Tue, 15 Oct 1996 00:00:00 GMT""}]","2016-09-06"
"math/9610222","Marco Martens","Marco Martens and Welington de Melo","Universal models for Lorenz maps",,,,"Stony Brook IMS 1996/12. Dynamical Systems 10/15/96","math.DS",,"  The existence of smooth families of Lorenz maps exhibiting all possible
dynamical behavior is established and the structure of the parameter space of
these families is described.
","[{""version"":""v1"",""created"":""Tue, 15 Oct 1996 00:00:00 GMT""}]","2009-09-25"
"math/9610226","Shelah Office","Saharon Shelah","Further cardinal arithmetic",,"Israel J. Math. 95 (1996), 61--114",,"Shelah [Sh:430]","math.LO",,"  We continue the investigations in the author's book on cardinal arithmetic,
assuming some knowledge of it. We deal with the cofinality of (S_{<=
aleph_0}(kappa), subseteq) for kappa real valued measurable (Section 3),
densities of box products (Section 5,3), prove the equality cov(lambda, lambda,
theta^+,2)=pp(lambda) in more cases even when cf(lambda)= aleph_0 (Section 1),
deal with bounds of pp(lambda) for lambda limit of inaccessible (Section 4) and
give proofs to various claims I was sure I had already written but did not find
(Section 6).
","[{""version"":""v1"",""created"":""Tue, 15 Oct 1996 00:00:00 GMT""}]","2016-09-06"
"math/9610227","Shelah Office","Sabine Koppelberg, Saharon Shelah","Subalgebras of Cohen algebras need not be Cohen",,"Oxford Sci. Publ. (1996), 261--275",,"Shelah [KpSh:504]","math.LO math.GN",,"  We give an example of a regular and complete subalgebra of a Cohen algebra
which is not Cohen.
","[{""version"":""v1"",""created"":""Tue, 15 Oct 1996 00:00:00 GMT""}]","2008-02-03"
"physics/9610011","Samar Abbas","Samar Abbas","The Non-Organic Theory of the Genesis of Petroleum","20 pages in Latex file",,,,"physics.ao-ph physics.geo-ph",,"  Recent advances in interdisciplinary fields as diverse as astrophysics,
cosmogeophysics, nuclear geology, etc. have led to interesting developments in
the non-organic theory of the genesis of petroleum. This theory, which holds
that petroleum is of an abiogenic primordial origin, provides an explanation
for certain features of petroleum geology that are hard to explain within the
standard organic framework. If the non-organic theory is correct, then
hydrocarbon reserves would be enormous and almost inexhaustable.
","[{""version"":""v1"",""created"":""Tue, 15 Oct 1996 10:03:12 GMT""}]","2008-02-03"
"q-alg/9610016","Friedrich Knop","Friedrich Knop, Siddhartha Sahi","A recursion and a combinatorial formula for Jack polynomials","Preprint March 1996, to appear in Invent. Math., 15 pages, Plain TeX","Invent. Math. 128 (1997), 9-22","10.1007/s002220050134",,"q-alg math.QA",,"  Heckman and Opdam introduced a non-symmetric analogue of Jack polynomials
using Cherednik operators. In this paper, we derive a simple recursion formula
for these polynomials and formulas relating the symmetric Jack polynomials with
the non-symmetric ones. These formulas are then implemented by a closed
expression of symmetric and non-symmetric Jack polynomials in terms of certain
tableaux. The main application is a proof of a conjecture of Macdonald stating
certain integrality and positivity properties of Jack polynomials.
","[{""version"":""v1"",""created"":""Tue, 15 Oct 1996 04:31:15 GMT""}]","2008-02-03"
"q-alg/9610017","Friedrich Knop","Friedrich Knop, Siddhartha Sahi","Difference equations and symmetric polynomials defined by their zeros","Preprint March 1996, 14 pages, Plain TeX","Internat. Math. Res. Notices 1996, No. 10, 473-486","10.1155/S107379289600030X",,"q-alg math.QA",,"  In this paper, we introduce a new family of symmetric polynomials which
depends on a parameter r. They are defined by specifying certain of their
zeros. For the parameter values 1/2, 1, and 2 they have an interpretation in
terms of Capelli identities.
  First, we give explicit formulas in some special cases. Then we show that the
polynomials can also be defined in terms of difference equations. As a
corollary we obtain that their top homogeneous part is a Jack polynomial. This
is used to give a new proof of the Pieri formula for Jack polynomials.
","[{""version"":""v1"",""created"":""Tue, 15 Oct 1996 04:53:52 GMT""}]","2008-02-03"
"q-alg/9610018","Katsuhisa Mimachi","Katsuhisa Mimachi","A new derivation of the inner product formula for the Macdonald
  symmetric polynomials","6 pages, AMS-LaTeX, no figures",,,,"q-alg math.QA",,"  We give a short proof of the inner product conjecture for the symmetric
Macdonald polynomials of type $A_{n-1}$. As a special case, the corresponding
constant term conjecture is also proved.
","[{""version"":""v1"",""created"":""Tue, 15 Oct 1996 06:32:29 GMT""}]","2008-02-03"
"q-alg/9610019",,"Karol Przanowski (University of Lodz, Poland)","The infinitesimal form of induced representation of the kappa-Poincare
  group","LaTeX, Pages 6",,,,"q-alg math.QA",,"  The infinitesimal form of the induced representation of the kappa-Poincare
group is constructed. The infinitesimal action of the kappa-Poincare group on
the kappa-Minkowski space is described. The actions of these two infinitesimal
forms on the solution of Klein-Gordon equation are compared.
","[{""version"":""v1"",""created"":""Tue, 15 Oct 1996 14:40:40 GMT""}]","2008-02-03"
"quant-ph/9610020","Marcelo Trindade dos Santos S.","M. Trindade dos Santos and M. C. Nemes","Quantum Corrections to the Classical Dynamics: Application to the SU(2)
  Lipkin Model","25 pages, LaTeX, 11 (new version) figures",,,"IFUSP/P-1235","quant-ph chao-dyn hep-th nlin.CD",,"  We show how nonrelativistic many body techniques can be used to study quantum
corrections to the classical limit, in particular of the $SU(2)$ Lipkin Model.
We show that the quantum corrections are essentially of two types: unitary and
nonunitary. In this work we perform a detailed study of the unitary
corrections. They can be cast in Hamiltonian form and are shown to double the
number of degrees of freedom. As a consequence chaotic behavior emerges. We
show that this semiquantal chaos is the mechanism trough which tunneling is
effected. We also show that these corrections systematically improve the
classical results and propose some quantitative measure of this improvement.
","[{""version"":""v1"",""created"":""Mon, 14 Oct 1996 18:26:39 GMT""},{""version"":""v2"",""created"":""Tue, 15 Oct 1996 17:29:27 GMT""},{""version"":""v3"",""created"":""Wed, 16 Oct 1996 19:38:49 GMT""},{""version"":""v4"",""created"":""Fri, 18 Oct 1996 15:34:31 GMT""}]","2008-02-03"
