"alg-geom/9610015","N. Raghavendra","L. Brambila-Paz and N. Raghavendra","Universal Einstein-Hermitian Metrics","Withdrawn because of error",,,,"alg-geom math.AG",,"  Lemma 3.4 is wrong.
","[{""version"":""v1"",""created"":""Mon, 14 Oct 1996 20:14:59 GMT""},{""version"":""v2"",""created"":""Sat, 20 Sep 1997 05:47:41 GMT""}]","2008-02-03"
"alg-geom/9610016","Mireille Deschamps","Mireille Martin-Deschamps and Ragni Piene","Arithmetically Cohen--Macaulay curves in P^4 of degree 4 and genus 0","17 pages, AMSTeX",,,,"alg-geom math.AG",,"  We show that the arithmetically Cohen--Macaulay (ACM) curves of degree 4 and
genus 0 in ${\bold P}^4$ form an irreducible subset of the Hilbert scheme.
Using this, we show that the singular locus of the corresponding component of
the Hilbert scheme has dimension greater than 6. Moreover, we describe the
structures of all ACM curves of Hilb$^{4m+1}({\bold P}^4)$.
","[{""version"":""v1"",""created"":""Tue, 15 Oct 1996 13:35:11 GMT""}]","2008-02-03"
"astro-ph/9610097","Chris Reynolds","C.S. Reynolds (1,2), T. Di Matteo (1), A.C. Fabian (1), U. Hwang (3),
  C.R. Canizares (3) ((1) Institute of Astronomy, Cambridge, UK (2) JILA,
  University of Colorado, USA (3) Center for Space Research, MIT, USA)","The `quiescent' black hole in M87","6 pages, 2 postscript figues included. Accepted for publication in
  MNRAS (pink pages)",,"10.1093/mnras/283.4.L111",,"astro-ph",,"  It is believed that most giant elliptical galaxies possess nuclear black
holes with masses in excess of $10^8\Msun$. Bondi accretion from the
interstellar medium might then be expected to produce quasar-like luminosities
from the nuclei of even quiescent elliptical galaxies. It is a puzzle that such
luminosities are not observed. Motivated by this problem, Fabian & Rees have
recently suggested that the final stages of accretion in these objects occurs
in an advection-dominated mode with a correspondingly small radiative
efficiency. Despite possessing a long-known active nucleus and dynamical
evidence for a black hole, the low radiative and kinetic luminosities of the
core of M87 provide the best illustration of this problem. We examine an
advection-dominated model for the nucleus of M87 and show that accretion at the
Bondi rate is compatible with the best known estimates for the core flux from
radio through to X-ray wavelengths. The success of this model prompts us to
propose that FR-I radio galaxies and quiescent elliptical galaxies accrete in
an advection dominated mode whereas FR-II type radio-loud nuclei possess
radiatively efficient thin accretion disks.
","[{""version"":""v1"",""created"":""Mon, 14 Oct 1996 20:48:30 GMT""}]","2016-06-08"
"astro-ph/9610098",,"Heino Falcke (Univ. Maryland)","Compact Radio Cores in the Galactic Center and Elsewhere","Review, to appear in: IAU Coll. 163, ""Accretion Phenomena and Related
  Outflows"", Wickramasinghe D., Ferrario L., & Bicknell G. (eds.), PASP Conf.
  Proc., (Latex, 12 pages, paspconf.sty, Sorry - no figures), also available at
  http://www.astro.umd.edu/~hfalcke/publications.html#iauc163",,,"hfa/eprint/No.18","astro-ph",,"  Compact radio cores are not only common in radio galaxies and quasars but
also in many nearby galaxies with low-active, supermassive black holes. One
famous example is the Galactic Center source Sgr A*. Recent studies of proper
motions and radial velocities of stars in the inner parsec of the Galaxy
convincingly demonstrate the presence of a compact dark mass of 2.5 10^6 Mo in
the nucleus of the Milky Way. Millimeter VLBI and submm observations of Sgr A*
thus probe a region of only a few Schwarzschild radii in diameter. In this
paper I will review our current theoretical and observational knowledge of this
source and compare it to some famous LINER galaxies like NGC 4258, NGC 3079,
and NGC 6500. In all cases these radio cores can be well explained by a
standard AGN jet model, and, with the exception of Sgr A*, large scale outflows
are observed that have powers comparable to those inferred from the radio
cores. Recent VLBI observations of radio-weak quasars and HST observations of
Seyfert galaxies indicate that these AGN also produce powerful jets which,
however, have relatively less luminous radio cores than radio-loud quasars and
the LINERs discussed here. Therefore, jets and compact radio cores appear to be
natural constituents of an AGN, but the reason why apparently some jets are
radio-loud and others not remains a mystery.
","[{""version"":""v1"",""created"":""Mon, 14 Oct 1996 18:12:36 GMT""}]","2007-05-23"
"astro-ph/9610099","Dallas Kennedy","Dallas C. Kennedy (1), Sidney A. Bludman (2) ((1) University of
  Florida, (2) University of Pennsylvania)","Variational Principles for Stellar Structure","28 pages, LaTeX, requires AASTeX, 1 PostScript figure, revisions:
  erratum; accepted by Astrophysical Journal","Astrophys.J. 484 (1997) 329-340","10.1086/304333","UF-IFT-HEP-95-4, UPR-718-T, NSF-ITP-95-71","astro-ph cond-mat.stat-mech",,"  The four equations of stellar structure are reformulated as two alternate
pairs of variational principles. Different thermodynamic representations lead
to the same hydromechanical equations, but the thermal equations require, not
the entropy, but the temperature as the thermal field variable. Our treatment
emphasizes the hydrostatic energy and the entropy production rate of luminosity
produced and transported. The conceptual and calculational advantages of
integral over differential formulations of stellar structure are discussed
along with the difficulties in describing stellar chemical evolution by
variational principles.
","[{""version"":""v1"",""created"":""Mon, 14 Oct 1996 19:02:51 GMT""},{""version"":""v2"",""created"":""Tue, 15 Oct 1996 22:07:09 GMT""},{""version"":""v3"",""created"":""Mon, 2 Dec 1996 22:29:18 GMT""},{""version"":""v4"",""created"":""Wed, 4 Dec 1996 23:13:51 GMT""},{""version"":""v5"",""created"":""Tue, 11 Feb 1997 02:11:42 GMT""},{""version"":""v6"",""created"":""Wed, 19 Mar 1997 18:28:26 GMT""},{""version"":""v7"",""created"":""Thu, 28 Aug 1997 23:40:57 GMT""},{""version"":""v8"",""created"":""Fri, 5 Mar 1999 18:55:49 GMT""},{""version"":""v9"",""created"":""Fri, 8 Dec 2000 04:29:02 GMT""}]","2009-10-28"
"astro-ph/9610100","Huan Lin","M. J. Sawicki, H. Lin, and H. K. C. Yee (Univ. of Toronto)","Evolution of the Galaxy Population Based on Photometric Redshifts in the
  Hubble Deep Field","31 pages, including 10 postscript figures, uses AASTEX v4.0 style
  files, to appear in the Astronomical Journal","Astron.J.113:1-12,1997","10.1086/118231",,"astro-ph",,"  This paper presents the results of a photometric redshift study of galaxies
in the Hubble Deep Field (HDF). The method of determining redshifts from
broadband colors is described, and the dangers inherent in using it to estimate
redshifts, particularly at very high z, are discussed. In particular, the need
for accurate high-z spectral energy distributions is illustrated. The validity
of our photometric redshift technique is demonstrated both by direct
verification with available HDF spectroscopic data and by comparisons of
luminosity functions and luminosity densities with those obtained from z < 1
spectroscopic redshift surveys. Evolution of the galaxy population is studied
over 0 \lesssim z < 4. Brightening is seen in both the luminosity function and
the luminosity density out to z \approx 3; this is followed by a decline in
both at z > 3. A population of z < 0.5 star-forming dwarfs is observed to
M_{F450W_{AB}} = -11. Our results are discussed in the context of recent
developments in the understanding of galaxy evolution.
","[{""version"":""v1"",""created"":""Mon, 14 Oct 1996 20:18:04 GMT""}]","2008-11-26"
"astro-ph/9610101","Uehara","Hideya Uehara, Hajime Susa, Ryoichi Nishi, Masako Yamada, and Takashi
  Nakamura","Fragmentation of the Primordial Gas Clouds and the Lower Limit on the
  Mass of the First Stars","Astrophysical Journal Letters, in press (accepted 4 Oct 1996), 10
  pages, Latex, 1 fig",,"10.1086/310409","KUNS-1414, YITP-96-42","astro-ph",,"  We discuss the fragmentation of primordial gas clouds in the universe after
decoupling. Comparing the time scale of collapse with that of fragmentation, we
obtain the typical mass of a fragment both numerically and analytically. It is
shown that the estimated mass gives the minimum mass of a fragment which is
formed from the primordial gas cloud and is essentially determined by the
Chandrasekhar mass.
","[{""version"":""v1"",""created"":""Tue, 15 Oct 1996 00:22:56 GMT""}]","2016-08-30"
"astro-ph/9610102","Tamara Helfer","Tamara T. Helfer (UMD/UCB) and Leo Blitz (UMD/UCB)","Dense Gas in the Milky Way","34 pages LaTeX, AASTEX macros, includes 11 postscript figures. To
  appear in ApJ 478, March 1997",,"10.1086/303774",,"astro-ph",,"  We present a study of dense gas emission in the Milky Way in order to serve
as a basis for comparison with extragalactic results. This study combines new
observations of HCN, CS, and CO in individual GMCs and in the Milky Way plane
with published studies of emission from these molecules in the inner 500 pc of
the Milky Way. We find a strong trend in the fraction of emission from dense
gas tracers as a function of location in the Milky Way: in the bulge,
I_{HCN}/I_{CO} = 0.081 \pm 0.004, in the plane, I_{HCN}/I_{CO} = 0.026 \pm
0.008 on average, and over the full extent of nearby GMCs, I_{HCN}/I_{CO} =
0.014 \pm 0.020. Similar trends are seen in I_{CS}/I_{CO}. The low intensities
of the HCN and CS emission in the plane suggests that these lines are produced
by gas at moderate densities; they are thus not like the emission produced by
the dense, pc-scale star forming cores in nearby GMCs. The contrast between the
bulge and disk ratios in the Milky Way is likely to be caused by a combination
of higher kinetic temperatures as well as a higher dense gas fraction in the
bulge of the Milky Way.
","[{""version"":""v1"",""created"":""Tue, 15 Oct 1996 01:21:21 GMT""}]","2009-10-28"
"astro-ph/9610103","Tamara Helfer","Tamara T. Helfer (UMD/UCB) and Leo Blitz (UMD/UCB)","Synthesis Imaging of Dense Gas in Nearby Galaxies","26 pages LaTeX, AASTEX macros, includes 4 postscript figures. To
  appear in ApJ 478, March 1997",,"10.1086/303760",,"astro-ph",,"  We present BIMA observations of the HCN emission from five nearby spiral
galaxies. The HCN observations comprise the first high-resolution
(5--10\arcsec) survey of dense molecular gas from a sample of normal galaxies,
rather than galaxies with prolific starburst or nuclear activities. The images
show compact structure, demonstrating that the dense gas emission is largely
confined to the central kiloparsec of the sources. In one of the galaxies, NGC
6946, the ratio of HCN to CO integrated intensities ranges from 0.05--0.2
within the extent of the HCN emission (r = 150 pc), with an average value of
0.11 \pm 0.01 over the whole region; the range and average values of the ratios
in NGC 6946 are very similar to what is observed in the central r = 250 pc of
the Milky Way. In NGC 6946, NGC 1068 and the Milky Way, the ratio I{HCN}/I{CO}
is 5 to 10 times higher in the bulge regions than in their disks; this suggests
that the physical conditions in their bulges and disks are very different. In
NGC 4826 and M51, as in the Milky Way and NGC 1068, there is a linear offset of
\sim 100 pc between the dense gas distribution and the peak of the radio
continuum emission.
","[{""version"":""v1"",""created"":""Tue, 15 Oct 1996 01:25:50 GMT""}]","2009-10-28"
"astro-ph/9610104","Vincenzo Ripepi","V. Ripepi and E. Brocato","A photometric study of NGC 458","4 pages, 7 postscript figures; to appear in: Proceedings of the Elba
  Meeting ``Stellar Ecology'', ed. R.T. Rood",,,,"astro-ph",,"  We present a CCD investigation of the poorly known SMC young Globular Cluster
NGC 458. The NTT data, presented here, allowed us to study in detail the more
internal regions of the cluster which are less contaminated by the field. On
the basis of theoretical isochrones, a preliminary evaluation of the age is
also given.
","[{""version"":""v1"",""created"":""Tue, 15 Oct 1996 08:42:25 GMT""}]","2007-05-23"
"astro-ph/9610105","Joao Magueijo","Joao Magueijo (Imperial College-London) and M.P.Hobson
  (MRAO-Cambridge)","Ideal scales for weighing the Universe",,"Phys.Rev. D56 (1997) 1908-1923","10.1103/PhysRevD.56.1908",,"astro-ph",,"  We investigate the performance of a large class of cosmic microwave
background experiments with respect to their ability to measure various
cosmological parameters. We pay special attention to the measurement of the
total cosmological density, $\Omega$. We consider interferometer experiments,
all-sky single-dish experiments, and also single-dish experiments with a
deep-patch technique. Power spectrum estimates for these experiments are
studied, and their induced errors in cosmological parameter estimates
evaluated. Given this motivation we find various promising corners in the
experiment parameter space surveyed. Low noise all-sky satellite experiments
are the expensive option, but they are best suited for dealing with large sets
of cosmological parameters. At intermediate noises we find a useful corner in
high-resolution deep patch single-dish experiments. Interferometers are limited
by sample variance, but provide the best estimates based on the very small
angular scales. For all these experiments we present conservative, but still
promising estimates of the accuracy of the measurement of $\Omega$. In these
estimates we consider a variety of possible signals not necessarily in the
vicinity of standard cold dark matter.
","[{""version"":""v1"",""created"":""Tue, 15 Oct 1996 12:46:52 GMT""}]","2016-08-30"
"astro-ph/9610106",,"F. De Paolis, V.G. Gurzadyan and G. Ingrosso","Pulsars Tracing Black Holes in Globular Clusters","laa-style Latex 4 pages; to appear in Astronomy and Astrophysics","Astron.Astrophys.315:396-399,1996",,,"astro-ph",,"  Results of precise measurements of the periods of pulsars discovered in the
central regions of globular clusters are shown to be approaching the
capabilities of testing the existence of a central black hole. For example, in
the case of M 15 the available data on two pulsars PSR 2129+1210A and PSR
2129+1209D seem to exclude the existence of a black hole, the presence of which
was instead supported by recent Hubble Space Telescope data on surface
brightness profile (Yanny et al. 1994). The fluctuations of the gravitational
field caused by the stars of the system are enough to explain the acceleration
observed for both pulsars. In the case of the Galactic center, additional data
are needed for similar definite conclusions.
","[{""version"":""v1"",""created"":""Tue, 15 Oct 1996 13:33:43 GMT""}]","2011-05-23"
"chao-dyn/9610013","Gregor Tanner","Gregor Tanner","How Chaotic is the Stadium Billiard? A Semiclassical Analysis","27 pages, 6 figures, submitted to J. Phys. A",,"10.1088/0305-4470/30/8/028",,"chao-dyn nlin.CD",,"  The impression gained from the literature published to date is that the
spectrum of the stadium billiard can be adequately described, semiclassically,
by the Gutzwiller periodic orbit trace formula together with a modified
treatment of the marginally stable family of bouncing ball orbits. I show that
this belief is erroneous. The Gutzwiller trace formula is not applicable for
the phase space dynamics near the bouncing ball orbits. Unstable periodic
orbits close to the marginally stable family in phase space cannot be treated
as isolated stationary phase points when approximating the trace of the Green
function. Semiclassical contributions to the trace show an $\hbar$ - dependent
transition from hard chaos to integrable behavior for trajectories approaching
the bouncing ball orbits. A whole region in phase space surrounding the
marginal stable family acts, semiclassically, like a stable island with
boundaries being explicitly $\hbar$-dependent. The localized bouncing ball
states found in the billiard derive from this semiclassically stable island.
The bouncing ball orbits themselves, however, do not contribute to individual
eigenvalues in the spectrum. An EBK-like quantization of the regular bouncing
ball eigenstates in the stadium can be derived. The stadium billiard is thus an
ideal model for studying the influence of almost regular dynamics near
marginally stable boundaries on quantum mechanics.
","[{""version"":""v1"",""created"":""Mon, 14 Oct 1996 23:26:11 GMT""}]","2009-10-28"
"cond-mat/9610112","Victor Kagalovsky","V. Kagalovsky, B. Horovitz and Y.Avishai (BGU, Israel)","Landau level mixing and spin degeneracy in the quantum Hall effect","18 pages, 11 tex-files and 1 ps-file of figures","PRB 55 (1997) 7761","10.1103/PhysRevB.55.7761",,"cond-mat.mes-hall",,"  We study dynamics of electrons in a magnetic field using a network model with
two channels per link with random mixing in a random intrachannel potential;
the channels represent either two Landau levels or two spin states. We consider
channel mixing as function of the energy separation of the two extended states
and show that its effect changes from repulsion to attraction as the energy
separation increases. For two Landau levels this leads to level floating at low
magnetic fields while for Zeeman split spin states we predict level attraction
at high magnetic fields, accounting for ESR data. We also study random mixing
of two degenerate channels, while the intrachannel potential is periodic
(non-random). We find a single extended state with a localization exponent
$\nu\approx 1.1$ for real scattering at nodes; the general case has also a
single extended state, though the localized nature of nearby states sets in at
unusually large scales.
","[{""version"":""v1"",""created"":""Mon, 14 Oct 1996 16:56:48 GMT""}]","2009-10-28"
"cond-mat/9610113","Henri Orland","E. Pitard and H. Orland","Dynamics of the swelling or collapse of a homopolymer",,,,,"cond-mat.soft",,"  We study the dynamics of a polymer when it is quenched from a $\theta$
solvent into a good or bad solvent by means of a Langevin equation. The
variation of the radius of gyration is studied as a function of time. For the
first stage of collapse or swelling, the characteristic time-scale is found to
be independent of the number of monomers. Other scaling laws are derived for
the diffusion regime at larger times. Although the present model is solved only
for homopolymers and doesn't include hydrodynamic interactions, these results
may be a first step towards the understanding of the early stages of protein
folding.
","[{""version"":""v1"",""created"":""Mon, 14 Oct 1996 16:58:57 GMT""}]","2008-02-03"
"cond-mat/9610114","Jaro Fabian","Jaroslav Fabian (SUNY at Stony Brook)","On the Decay of Localized Vibrational States in Glasses: a
  one-dimensional example","10 pages (RevTeX), 4 postscript figures, Fig. 5 in GIF format",,"10.1103/PhysRevB.55.R3328",,"cond-mat.dis-nn",,"  The interaction between three localized vibrational modes is shown to be as
relevant for the lifetimes of localized modes as the interaction involving two
localized and one extended, and one localized and two extended modes. This
contrasts with previous views. I support my arguments by a numerical study of a
strongly disordered linear atomic chain.
","[{""version"":""v1"",""created"":""Mon, 14 Oct 1996 21:43:53 GMT""}]","2009-10-28"
"cond-mat/9610115","Subir Sachdev","Subir Sachdev and Kedar Damle (Yale University)","Low temperature spin diffusion in the one-dimensional quantum $O(3)$
  nonlinear $\sigma$-model","4 pages including 3 eps-figures, Revtex","Physical Review Letters, 78, 943 (1997)","10.1103/PhysRevLett.78.943",,"cond-mat.str-el",,"  An effective, low temperature, classical model for spin transport in the
one-dimensional, gapped, quantum $O(3)$ non-linear $\sigma$-model is developed.
Its correlators are obtained by a mapping to a model solved earlier by Jepsen.
We obtain universal functions for the ballistic-to-diffusive crossover and the
value of the spin diffusion constant, and these are claimed to be exact at low
temperatures. Implications for experiments on one-dimensional insulators with a
spin gap are noted.
","[{""version"":""v1"",""created"":""Tue, 15 Oct 1996 00:07:23 GMT""}]","2009-10-28"
"cond-mat/9610116","Josh Deutsch","J.M. Deutsch","Long Range Moves for High Density Polymer Simulations","15 pages in latex with 6 color postscript figures using psfig",,"10.1063/1.473943","JMD396","cond-mat.soft",,"  Monte Carlo simulations of proteins are hindered by the system's high density
which often makes local moves ineffective. Here we devise and test a set of
long range moves that work well even when all sites of a lattice simulation are
filled. We demonstrate that for a 27-mer cube, the ground state of random
heteropolymers can quickly be reached. We discuss results for 48-mer systems
where the ground state is known exactly. For ten sequences that were examined,
the introduction of long range moves speeds up the search for the ground state
by about one order of magnitude. The method is compared to a fast folding chain
growth algorithm that had previously been used with much success. The new
algorithm here appears to be more efficient. The point is illustrated by the
folding of an 80-mer four-helix bundle considered previously.
","[{""version"":""v1"",""created"":""Tue, 15 Oct 1996 01:47:08 GMT""}]","2009-10-28"
"cond-mat/9610117","Yasushi Honda","Yasushi Honda and Tsuyoshi Horiguchi (Department of Computer and
  Mathematical Sciences, Tohoku University, Sendai, Japan)","Critical phase of a magnetic hard hexagon model on triangular lattice","11 pages, 8 Postscript figures, uses revtex.sty",,"10.1103/PhysRevE.55.194",,"cond-mat.stat-mech",,"  We introduce a magnetic hard hexagon model with two-body restrictions for
configurations of hard hexagons and investigate its critical behavior by using
Monte Carlo simulations and a finite size scaling method for discreate values
of activity. It turns out that the restrictions bring about a critical phase
which the usual hard hexagon model does not have. An upper and a lower critical
value of the discrete activity for the critical phase of the newly proposed
model are estimated as 4 and 6, respectively.
","[{""version"":""v1"",""created"":""Tue, 15 Oct 1996 04:02:22 GMT""}]","2009-10-28"
"cond-mat/9610118","Madjet Mohamed","M.E. Madjet, P.A. Hervieux, D.H.E. Gross, and O. Schapiro (Hahn
  Meitner Institut Berlin, Germany)","Fragmentation Phase Transition in Atomic Clusters II -----Symmetry of
  Fission of Metal Clusters----","18 text pages +7 *.eps figures my e-mail adress: madjet@hmi.de to be
  published in Z.Phys.D",,"10.1007/s004600050141",,"cond-mat.mtrl-sci",,"  We present a statistical fragmentation study of doubly charged alkali (Li,
Na, K) and antimony clusters. The evaporation of one charged trimer is the most
dominant decay channel (asymmetric fission) at low excitation energies. For
small sodium clusters this was quite early found in molecular dynamical
calculations by Landman et al. For doubly charged lithium clusters, we predict
Li$_{9}^{+}$ to be the preferential dissociation channel. As already seen
experimentally a more symmetric fission is found for doubly charged antimony
clusters. This different behavior compared to the alkali metal clusters is in
our model essentially due to a larger fissility of antimony. This is checked by
repeating the calculations for Na$_{52}^{++}$ with a bulk fissility parameter
set artificially equal to the value of Sb.
","[{""version"":""v1"",""created"":""Tue, 15 Oct 1996 11:06:39 GMT""},{""version"":""v2"",""created"":""Fri, 10 Jan 1997 15:23:58 GMT""}]","2009-10-28"
"cond-mat/9610119","Andreas Wacker","Andreas Wacker and Antti-Pekka Jauho (Mikroelektronik Centret,
  Danmarks Tekniske Universitet, Lyngby, Denmark)","Impact of interface roughness on perpendicular transport and domain
  formation in superlattices","4 pages 1 figure","Superlattices and Microstructures, Vol. 23, 297-300 (1998)","10.1006/spmi.1996.0249",,"cond-mat.mes-hall",,"  A microscopic calculation of the perpendicular current in doped multiple
quantum wells is presented. Interface roughness is shown to affect the resonant
transitions as well as to cause a nonresonant background current. The
theoretical characteristics exhibit several branches due to the formation of
electric field domains in quantitative agreement with experimental data.
","[{""version"":""v1"",""created"":""Tue, 15 Oct 1996 13:19:33 GMT""}]","2009-10-28"
"cond-mat/9610120","Andreas Wacker","Andreas Wacker and Antti-Pekka Jauho (Mikroelektronik Centret,
  Danmarks Tekniske Universitet, Lyngby)","Microscopic modelling of perpendicular electronic transport in doped
  multiple quantum wells","10 pages 5 figures","Physica Scripta, Vol. T69, pages 321-324 (1997)","10.1088/0031-8949/1997/T69/070",,"cond-mat.mes-hall",,"  We present a microscopic calculation of transport in strongly doped
superlattices where domain formation is likely to occur. Our theoretical method
is based on a current formula involving the spectral functions of the system,
and thus allows, in principle, a systematic investigation of various
interaction mechanisms. Taking into account impurity scattering and optical
phonons we obtain a good quantitative agreement with existing experimental data
from Helgesen and Finstad (J. Appl. Phys. 69, 2689, (1991)). Furthermore the
calculated spectral functions indicate a significant increase of the average
intersubband spacing compared to the bare level differences which might explain
the experimental trend.
","[{""version"":""v1"",""created"":""Tue, 15 Oct 1996 13:54:14 GMT""}]","2015-06-25"
