"gr-qc/9610023","Pedro. Silva","Ian G. Moss and Pedro J. Silva","BRST Invariant Boundary Conditions for Gauge Theories","15 pages, RevTeX","Phys.Rev. D55 (1997) 1072-1078","10.1103/PhysRevD.55.1072","NCL96-TP2","gr-qc",,"  A systematic way of generating sets of local boundary conditions on the gauge
fields in a path integral is presented. These boundary conditions are suitable
for one--loop effective action calculations on manifolds with boundary and for
quantum cosmology. For linearised gravity, the general proceedure described
here leads to new sets of boundary conditions.
","[{""version"":""v1"",""created"":""Mon, 14 Oct 1996 16:21:42 GMT""}]","2009-10-28"
"gr-qc/9610024","Othmar Brodbeck","Othmar Brodbeck","On Symmetric Gauge Fields for arbitrary Gauge and Symmetry Groups","4 pages, Latex, talk given at Les Journees Relativistes 96, Ascona,
  Switzerland, May 26-30, to appear in Helv. Phys. Acta","Helv.Phys.Acta 69:321-324,1996",,"ZU-TH-29/96","gr-qc",,"  A classification of the possible symmetric principal bundles with a compact
gauge group, a compact symmetry group and a base manifold which is regularly
foliated by the orbits of the symmetry group is derived. A generalization of
Wang's theorem (classifying the invariant connections) is proven and local
expressions for the gauge potential of an invariant connection are given.
","[{""version"":""v1"",""created"":""Tue, 15 Oct 1996 00:19:42 GMT""}]","2011-04-15"
"gr-qc/9610025","Vivek Iyer","Vivek Iyer","Lagrangian perfect fluids and black hole mechanics","26 pages LaTeX-2e","Phys.Rev. D55 (1997) 3411-3426","10.1103/PhysRevD.55.3411",,"gr-qc",,"  The first law of black hole mechanics (in the form derived by Wald), is
expressed in terms of integrals over surfaces, at the horizon and spatial
infinity, of a stationary, axisymmetric black hole, in a diffeomorphism
invariant Lagrangian theory of gravity. The original statement of the first law
given by Bardeen, Carter and Hawking for an Einstein-perfect fluid system
contained, in addition, volume integrals of the fluid fields, over a spacelike
slice stretching between these two surfaces. When applied to the
Einstein-perfect fluid system, however, Wald's methods yield restricted
results. The reason is that the fluid fields in the Lagrangian of a gravitating
perfect fluid are typically nonstationary. We therefore first derive a first
law-like relation for an arbitrary Lagrangian metric theory of gravity coupled
to arbitrary Lagrangian matter fields, requiring only that the metric field be
stationary. This relation includes a volume integral of matter fields over a
spacelike slice between the black hole horizon and spatial infinity, and
reduces to the first law originally derived by Bardeen, Carter and Hawking when
the theory is general relativity coupled to a perfect fluid. We also consider a
specific Lagrangian formulation for an isentropic perfect fluid given by
Carter, and directly apply Wald's analysis. The resulting first law contains
only surface integrals at the black hole horizon and spatial infinity, but this
relation is much more restrictive in its allowed fluid configurations and
perturbations than that given by Bardeen, Carter and Hawking. In the Appendix,
we use the symplectic structure of the Einstein-perfect fluid system to derive
a conserved current for perturbations of this system: this current reduces to
one derived ab initio for this system by Chandrasekhar and Ferrari.
","[{""version"":""v1"",""created"":""Tue, 15 Oct 1996 03:26:47 GMT""}]","2009-10-28"
"gr-qc/9610026","Bahman K. Darian","B.K. Darian and H.P. Kunzle","Cosmological Einstein-Yang-Mills equations","28 pages, uses amsmath,amsthm,amssymb,epsfig,verbatim, minor
  corrections","J.Math.Phys.38:4696-4713,1997","10.1063/1.532116","Alberta THY 34-96","gr-qc hep-th",,"  We use a systematic construction method for invariant connections on
homogeneous spaces to find the Einstein-SU(n)-Yang-Mills equations for
Friedmann-Robertson-Walker and locally rotationally symmetric homogeneous
cosmologies. These connections depend on the choice of a homomorphism from the
isotropy group into the gauge group. We consider here the cases of the gauge
group SU(n) and SO(n) where these homomorphisms correspond to unitary or
orthogonal representations of the isotropy group. For some of the simpler cases
the full system of the evolution equations are derived, for others we only
determine the number of dynamical variables that remain after some mild fixing
of the gauge.
","[{""version"":""v1"",""created"":""Tue, 15 Oct 1996 06:11:29 GMT""},{""version"":""v2"",""created"":""Sun, 19 Oct 1997 04:22:05 GMT""}]","2010-11-19"
"gr-qc/9610027","Jiseong Park","James Isenberg and Jiseong Park","Asymptotically Hyperbolic Non Constant Mean Curvature Solutions of the
  Einstein Constraint Equations","19 pages, TeX, no figures","Class.Quant.Grav.14:A189-A202,1997","10.1088/0264-9381/14/1A/016","AEI-021","gr-qc",,"  We describe how the iterative technique used by Isenberg and Moncrief to
verify the existence of large sets of non constant mean curvature solutions of
the Einstein constraints on closed manifolds can be adapted to verify the
existence of large sets of asymptotically hyperbolic non constant mean
curvature solutions of the Einstein constraints.
","[{""version"":""v1"",""created"":""Tue, 15 Oct 1996 08:30:54 GMT""}]","2010-04-06"
"gr-qc/9610028","Jim McElwaine","Adrian Kent and Jim McElwaine","Quantum Prediction Algorithms","53 pages, RevTeX with LaTeX2e","Phys.Rev.A55:1703-1720,1997","10.1103/PhysRevA.55.1703","DAMTP-96-88","gr-qc hep-th quant-ph",,"  The consistent histories formulation of the quantum theory of a closed system
with pure initial state defines an infinite number of incompatible consistent
sets, each of which gives a possible description of the physics. We investigate
the possibility of using the properties of the Schmidt decomposition to define
an algorithm which selects a single, physically natural, consistent set. We
explain the problems which arise, set out some possible algorithms, and explain
their properties with the aid of simple models. Though the discussion is framed
in the language of the consistent histories approach, it is intended to
highlight the difficulty in making any interpretation of quantum theory based
on decoherence into a mathematically precise theory.
","[{""version"":""v1"",""created"":""Tue, 15 Oct 1996 09:29:45 GMT""}]","2011-08-04"
"gr-qc/9610029","Elisha Atzmon","E. Atzmon","A Comment on The A/4 Black Hole Entropy","8 pages, Latex, 2 ps-files",,,"TAUP-2380, IHES/p/96/69","gr-qc",,"  Using a simple analysis based on the measurement procedure for a quantized
area we explain the 1/4 factor in the Bekenstein-Hawking black hole formula A/4
for the entropy.
","[{""version"":""v1"",""created"":""Tue, 15 Oct 1996 09:47:10 GMT""}]","2007-05-23"
"gr-qc/9610030","Miguel Angel Perez Sebastian","A. Feinstein and M. A. P\'erez Sebasti\'an (Dpto. Fisica Teorica,
  Univ. Pais Vasco, Spain)","The Origin of the Entropy in the Universe","18 pages. LaTeX file. Revised version, some discussions expanded,
  several references added. The main results unchanged","Found.Phys.Lett. 13 (2000) 133-145",,,"gr-qc hep-th",,"  We discuss the entropy generation in quantum tunneling of a relativistic
particle under the influence of a time varying force with the help of squeezing
formalism. It is shown that if one associates classical coarse grained entropy
to the phase space volume, there is an inevitable entropy increase due to the
changes in position and momentum variances. The entropy change can be
quantified by a simple expression $\Delta S=\ln\cosh 2r$, where $r$ is the
squeeze parameter measuring the ""height"" and ""width"" of the potential barrier.
We suggest that the universe could have acquired its initial entropy in a
quantum squeeze from ""nothing"" and briefly discuss the implications of our
proposal.
","[{""version"":""v1"",""created"":""Tue, 15 Oct 1996 13:21:27 GMT""},{""version"":""v2"",""created"":""Wed, 16 Oct 1996 10:22:25 GMT""},{""version"":""v3"",""created"":""Thu, 13 Mar 1997 11:56:49 GMT""}]","2008-02-03"
"gr-qc/9610031","Ghanashyam Date","G. Date","On a Static Solution to Einstein Equations with incoming and outgoing
  radiation","20 pages, latex, needs psfig.tex macro. An appendix is added
  discussing more general situations and matching conditions. Accepted for
  publication in General Relativity and Gravitation","Gen.Rel.Grav.29:953,1997","10.1023/A:1018864423958","IMSc-96/09/28","gr-qc",,"  Einstein equations with $T_{\mu\nu} = k_\mu k_\nu + \ell_\mu \ell_\nu$ where
$k, \ell$ are null are considered with spherical symmetry and staticity. The
solution has naked singularity and is not asymptotically flat. However, it may
be interpreted as an envelope for any static spherical body making it more
massive. Such an interpretation and some of its implications are detailed.
","[{""version"":""v1"",""created"":""Tue, 15 Oct 1996 15:00:36 GMT""},{""version"":""v2"",""created"":""Thu, 27 Feb 1997 06:15:11 GMT""}]","2008-11-26"
"hep-ex/9610007","Peter Bosted","The E142 Collaboration, P.L. Anthony et al","Deep Inelastic Scattering of Polarized Electrons by Polarized $^3$He and
  the Study of the Neutron Spin Structure","97 pages, format is postscript file","Phys.Rev.D54:6620-6650,1996","10.1103/PhysRevD.54.6620","SLAC-PUB-7103","hep-ex",,"  The neutron longitudinal and transverse asymmetries $A^n_1$ and $A^n_2$ have
been extracted from deep inelastic scattering of polarized electrons by a
polarized $^3$He target at incident energies of 19.42, 22.66 and 25.51 GeV. The
measurement allows for the determination of the neutron spin structure
functions $g^n_1 (x,Q^2)$ and $g^n_2(x,Q^2)$ over the range $0.03 < x < 0.6$ at
an average $Q^2$ of 2 (GeV$/c)^2$. The data are used for the evaluation of the
Ellis-Jaffe and Bjorken sum rules. The neutron spin structure function $g^n_1
(x,Q^2)$ is small and negative within the range of our measurement, yielding an
integral ${\int_{0.03}^{0.6} g_1^n(x) dx}= -0.028 \pm 0.006 (stat) \pm 0.006
(syst) $. Assuming Regge behavior at low $x$, we extract $\Gamma_1^n=\int^1_0
g^n_1(x)dx = -0.031 \pm 0.006 (stat)\pm 0.009 (syst) $. Combined with previous
proton integral results from SLAC experiment E143, we find $\Gamma_1^p -
\Gamma_1^n = 0.160 \pm 0.015$ in agreement with the Bjorken sum rule prediction
$\Gamma^p_1 - \Gamma ^n_1 = 0.176 \pm 0.008$ at a $Q^2$ value of 3 (GeV$/c)^2$
evaluated using $\alpha_s = 0.32\pm 0.05$.
","[{""version"":""v1"",""created"":""Mon, 14 Oct 1996 22:31:34 GMT""}]","2008-11-26"
"hep-lat/9610016","Chris Allton","C. R. Allton","Lattice Monte Carlo Data versus Perturbation Theory","Latex, 29 pages with 9 figures",,,"SWAT/129","hep-lat",,"  The differences between lattice Monte Carlo data and perturbation theory are
usually associated with the ``bad'' behaviour of the bare lattice coupling g_0
due to the effects of large (and unknown) higher order coefficients in the g_0
perturbative series. In this philosophy a new, renormalised coupling g' is
defined with the aim of reducing the higher order coefficients of the
perturbative series in g'. An improvement in the agreement between lattice data
and this new perturbation series is generally observed.
  In this paper an alternative scenario is discussed where lattice artifacts
are proposed as the cause of the disagreement between lattice data and the
g_0-perturbative series. We find that this interpretation provides excellent
agreement between lattice data and perturbation theory in g_0 corrected for
lattice artifacts. We show that this viewpoint leads typically to an order of
magnitude improvement in the agreement between lattice data and perturbation
theory, compared to typical g' perturbation expansions. The success of this
procedure leads to a determination of Lambda_MSbar^{N_f=0} of 220 +- 20 MeV.
Lattice data studied includes quenched values of the string tension, the
hadronic scale r_0, the discrete beta function Delta\beta, M_rho, f_pi and the
1P-1S splitting in charmonium. The new 3-loop term of the lattice beta-
function has been incorporated in this study.
  A discussion of the implication of this result for lattice calculations is
presented.
","[{""version"":""v1"",""created"":""Tue, 15 Oct 1996 08:24:06 GMT""}]","2007-05-23"
"hep-lat/9610017","sadataka Furui","H. Nakajima and S. Furui","A new algorithm for numerical simulation of Langevin equations","4 pages,latex,2 figures(GNU plot).Presented at LATTICE96(algorithms),
  the International Symposium on Lattice Field Theory, 4 - 8 June 1996, in St.
  Louis, Missouri, USA","Nucl.Phys.Proc.Suppl. 53 (1997) 983-986","10.1016/S0920-5632(96)00834-1",,"hep-lat",,"  Formulated is a new systematic method for obtaining higher order corrections
in numerical simulation of stochastic differential equations (SDEs), i.e.,
Langevin equations. Random walk step algorithms within a given order of finite
$\Delta t$, are obtained so as to reproduce within that order a corresponding
transition density of the Fokker-Planck equations, in the weak Taylor
approximation scheme. A great advantage of our method is its
straightforwardness such that direct perturbative calculations produce the
algorithm as an end result, so that the procedure is tractable by computer.
Examples in general form for curved space cases as well as flat space cases are
given in some order of approximations. Simulations are performed for specific
examples of U(1) system and SU(2) systems, respectively.
","[{""version"":""v1"",""created"":""Tue, 15 Oct 1996 10:02:15 GMT""}]","2009-10-28"
"hep-lat/9610018","Keh-Fei Liu","C. Thron, K. F. Liu, and S. J. Dong","The PZ method for estimating determinant ratios, with applications","4 pages, Latex, 5 ps figures. Talk presented at Lattice '96","Nucl.Phys.Proc.Suppl. 53 (1997) 977-979","10.1016/S0920-5632(96)00832-8",,"hep-lat",,"  We introduce a new method for estimating determinants or determinant ratios
of large matrices, which combines the techniques of Pad\`{e} approximation with
rational functions and $Z_{2}$ noise estimation of traces of large matrices.
The method requires simultaneously solving several matrix equations, which can
be conveniently accomplished using the MR method. We include some preliinary
results, and indicate potential applications to non-Hermitian matrices, and
Hybrid Monte Carlo without pseudofermions.
","[{""version"":""v1"",""created"":""Tue, 15 Oct 1996 14:49:12 GMT""}]","2009-10-28"
"hep-ph/9610352","Borut Bajc","Borut Bajc and Goran Senjanovic","Symmetry Restoration in Hot SUSY","8 pages, revtex, no figures. Based on the talk given by G. Senjanovic
  at SUSY96, University of Maryland, 1996. To appear in the Proceedings","Nucl.Phys.Proc.Suppl. 52A (1997) 246-250","10.1016/S0920-5632(96)00572-5","IJS-TP-96/18","hep-ph",,"  It is by now well known that symmetries may be broken at high temperature.
However,in renormalizable supersymmetric theories any internal symmetry gets
always restored. In nonrenormalizable theories the situation is far less
simple. We review here some recent work which seems to indicate that
renormalizability is not essential for the restoration of internal symmetries
in supersymmetry.
","[{""version"":""v1"",""created"":""Mon, 14 Oct 1996 17:00:53 GMT""}]","2009-10-28"
"hep-ph/9610354","Juergen Berges","J. Berges, N. Tetradis and C. Wetterich","Coarse graining and first order phase transitions","14 pages, 5 figures","Phys.Lett. B393 (1997) 387-394","10.1016/S0370-2693(96)01654-1","CERN-TH-96-289, HD-THEP-96-042","hep-ph cond-mat",,"  We discuss the dependence of the coarse grained free energy and the classical
interface tension on the coarse graining scale $k$. A stable range appears only
if the renormalized dimensionless couplings at the critical temperature are
small. This gives a quantitative criterion for the validity of computations
within Langer's theory of spontaneous bubble nucleation.
","[{""version"":""v1"",""created"":""Mon, 14 Oct 1996 16:11:06 GMT""}]","2009-10-28"
"hep-ph/9610355","Beatriz de Carlos","B. de Carlos (Sussex) and G.V. Kraniotis (Royal Holloway)","Relic Abundances and Detection Rates of Neutralinos in String-Inpired
  Supergravity Models","Latex, 7 pages including 6 figs, uses sprocl.sty. Based on a talk
  given by G.V. Kraniotis at the international Workshop on the Identification
  of Dark Matter, IDM'96, Sheffield (UK) 8-12 September 1996",,,"SUSX-TH-96-015, IEM-FT-144/96","hep-ph",,"  We calculate ``relic abundances'' and ``detection rates'' of the neutralino
(LSP) in string-inspired supergravity models with ``dilaton-moduli'' induced
supersymmetry breaking. In particular we investigate ``universal'' scenarios
for the soft-supersymmetry breaking terms from Calabi-Yau compactifications, as
well as from the dilaton-dominated limit. ``Non-universal'' scenarios from
orbifold string theory are also incorporated into the analysis. In all cases,
in the cosmologically interesting region, we find $m_{LSP}\geq 50$ GeV and
direct-detection rates in the range O($10^{-3}$ events/(Kg day)) - O($10^{-4}$
events/(Kg day)). ``Indirect-detection'' rates from LSPs captured in the Sun
are also calculated.
","[{""version"":""v1"",""created"":""Mon, 14 Oct 1996 16:57:44 GMT""}]","2007-05-23"
"hep-ph/9610356",,"S. De Curtis","Signatures of Dynamical Symmetry Breaking at Tevatron Upgrade and LHC","9 pages, latex, 3 figures, needs sprocl.sty",,,,"hep-ph",,"  We study the phenomenology of a strongly interacting electroweak symmetry
breaking sector in which the physics is dominated by spin one resonances.
Specifically we will consider an effective description of dynamical symmetry
breaking based on a particular model which passes all the low-energy precision
tests and gives clear signals at LHC but also at Tevatron Upgrade.
","[{""version"":""v1"",""created"":""Mon, 14 Oct 1996 18:42:52 GMT""}]","2007-05-23"
"hep-ph/9610358",,"Howard Baer, Michal Brhlik, Chih-hao Chen and Xerxes Tata","Signals for the Minimal Gauge-mediated Supersymmetry Breaking Model at
  the Fermilab Tevatron Collider","18 page REVTEX file plus 11 PS figures","Phys.Rev. D55 (1997) 4463-4474","10.1103/PhysRevD.55.4463","FSU-HEP-961002, UH-511-855-96","hep-ph",,"  We investigate the experimental implications of the minimal gauge-mediated
low energy supersymmetry breaking (GMLESB) model for Fermilab Tevatron collider
experiments. We map out the regions of parameter space of this model that have
already been excluded by collider searches and by limits on $b\to s\gamma$. We
use ISAJET to compute the cross sections for a variety of topological
signatures which include photons in assocation with multiple leptons, jets and
missing transverse energy. The reach in the parameter $\Lambda$, which fixes
the scale of sparticle masses, is estimated to be $\sim 60$, 100 and 135 TeV
for Tevatron integrated luminosities of 0.1, 2 and 25 fb$^{-1}$, respectively.
The largest signals occur in photon(s) plus lepton(s) plus multi-jet channels;
jet-free channels containing just photons plus leptons occur at much smaller
rates, at least within this minimal framework.
","[{""version"":""v1"",""created"":""Mon, 14 Oct 1996 22:55:34 GMT""}]","2009-10-28"
"hep-ph/9610359",,"Shin Ishida, Taku Ishida, Muneyuki Ishida, Kunio Takamatsu, and
  Tsuneaki Tsuru","Further Analysis on \sigma-particle Properties","Updated with recent progress","Prog. Theor. Phys. 98 (1997) 1005-1010","10.1143/PTP.98.1005",,"hep-ph",,"  In a previous work, we have reanalyzed the I=0 S-wave \pi\pi-scattering
phase-shift through a new method of Interfering Breit-Wigner amplitudes, and
have shown the existence of a light scalar, \sigma particle, accompanied by a
negative ""repulsive core""-type background phase-shift, whose origin may have
some correspondence to a ``compensating'' \pi\pi contact interaction. In this
work we make further analysis on the phase shift under KKbar threshold from the
same standpoint, to determine precise values of \sigma mass and width, so far
as present experimental data are concerned.
","[{""version"":""v1"",""created"":""Tue, 15 Oct 1996 07:07:30 GMT""},{""version"":""v2"",""created"":""Tue, 27 May 1997 14:39:50 GMT""}]","2009-10-28"
"hep-ph/9610360","Johan Bijnens","Johan Bijnens(Nordita) and Joaquim Prades(IFIC and Valencia)","Electromagnetic Corrections for Pions and Kaons : Masses and
  Polarizabilities","LaTeX, 5 figures, uses epsf, 39 pages, partially rewritten, more
  information about $\mu$ dependence included","Nucl.Phys. B490 (1997) 239-271","10.1016/S0550-3213(97)00107-7","FTUV/96-69,IFIC/96-78, NORDITA-96/70 N,P","hep-ph",,"  The unknown constants in Chiral Perturbation Theory needed for an all orders
analysis of the polarizabilities and electromagnetic corrections to the masses
of the pseudo-Goldstone bosons are estimated at leading order in $1/N_c$. We
organize the calculation in an $1/N_c$-expansion and separate long- and
short-distance physics contributions by introducing an Euclidean cut-off. The
long-distance part is evaluated using the ENJL model and the short-distance
part using perturbative QCD and factorization. We obtain very good matching
between both.
  We then include these estimates in a full Chiral Perturbation Theory
calculation to order $e^2$ $p^2$ for the masses and $p^6$ for the
polarizabilities. For the electromagnetic corrections to the masses, we confirm
a large violation of Dashen's theorem getting a more precise value for this
violation. We make comparison with earlier related work. Some phenomenological
consequences are discussed too.
","[{""version"":""v1"",""created"":""Tue, 15 Oct 1996 09:11:40 GMT""},{""version"":""v2"",""created"":""Mon, 27 Jan 1997 09:14:01 GMT""}]","2009-10-28"
"hep-ph/9610361","Nico Schoonderwoerd","N. C. J. Schoonderwoerd and B. L. G. Bakker (Vrije Universiteit
  Amsterdam)","Equivalence of Covariant and Light-Front Perturbation Theory","3 pages latex, uses epsf, epsfig, wrapfig. To appear in the
  Proceedings of the 12th International Symposium on High-Energy Spin Physics
  Amsterdam Sept. 1996",,,,"hep-ph",,"  Light-Front Field Theory (LFFT) is a good candidate to describe bound states.
In LFFT covariance is non-manifest. Burkardt and Langnau claim that, even for
scattering amplitudes, rotational invariance is broken. We will take a
different path of obtaining rules for light-front time-ordered diagrams.
Covariance depends on the choice of a regulator $\alpha$. We need to apply some
regularisation scheme to render physical amplitudes finite. This is done by
applying minus regularisation. In this process all ambiguities related to the
regulator $\alpha$ are removed. Therefore there is equivalence between the
perturbative expansions of covariant and LFFT.
","[{""version"":""v1"",""created"":""Tue, 15 Oct 1996 09:55:37 GMT""}]","2007-05-23"
"hep-ph/9610362","Daniel De Florian","D. de Florian (CERN- TH Division) and R. Sassot (UBA, Argentina)","Next to Leading Order QCD Corrections to Polarized $\Lambda$ Production
  in DIS","final version with few corrections, to be published in Nuc. Phys. B","Nucl.Phys. B488 (1997) 367-388","10.1016/S0550-3213(97)00010-2","CERN-TH/96-261","hep-ph",,"  We calculate next to leading order QCD corrections to semi-inclusive
polarized deep inelastic scattering and $e^+e^-$ annihilation cross sections
for processes where the polarization of the identified final-state hadron can
also be determined. Using dimensional regularization and the HVBM prescription
for the $\gamma_5$ matrix, we compute corrections for different spin-dependent
observables, both in the $\overline{MS}$ and $\overline{MS_p}$ factorization
schemes, and analyse their structure. In addition to the well known corrections
to polarized parton distributions, we also present those for final-state
polarized fracture functions and polarized fragmentation functions, in a
consistent factorization scheme.
","[{""version"":""v1"",""created"":""Tue, 15 Oct 1996 14:24:15 GMT""},{""version"":""v2"",""created"":""Mon, 6 Jan 1997 09:10:23 GMT""}]","2009-10-28"
"hep-ph/9610364","Michelangelo Mangano","M.L. Mangano and A. Petrelli","NLO Quarkonium Production in Hadronic Collisions","11 pages, Latex, epsfig, 4 figures. To appear in the proceedings of
  the Quarkonium Physics Workshop, University of Illinois, Chicago, June1996","Int.J.Mod.Phys.A12:3887-3897,1997","10.1142/S0217751X97002048","CERN-TH/96-293","hep-ph",,"  We present some preliminary results on the next-to-leading order calculation
in QCD of quarkonium production cross sections in hadronic collisions. We will
show that the NLO total cross sections for $P$-wave states produced at high
energy are not reliable, due to the appearance of very large and negative
contributions. We also discuss some issues related to the structure of final
states in colour-octet production and to high-p_T fragmentation.
","[{""version"":""v1"",""created"":""Tue, 15 Oct 1996 15:50:07 GMT""}]","2011-04-15"
"hep-ph/9610365","Kari Eskola","K.J. Eskola","Minijets in ultrarelativistic heavy ion collisions at RHIC and LHC","10 pages, Talk presented at the Theory Workshop on Relativistic Heavy
  Ion Collisions, Brookhaven National Laboratory, July 1996",,,,"hep-ph nucl-th",,"  Recent results on minijet production in nuclear collisions at the RHIC and
LHC energies are reviewed. Initial conditions of the QGP at $\tau=0.1$ fm$/c$,
especially parton chemistry, thermalization and net baryon number-to-entropy
ratio are discussed. Also, contribution of minijets from a hard BFKL-pomeron
ladder will be estimated.
","[{""version"":""v1"",""created"":""Tue, 15 Oct 1996 14:52:07 GMT""}]","2007-05-23"
