"astro-ph/9610237","Marco Tavani","M. Tavani (Columbia University)","X-Ray Emission of Gamma-Ray Bursts","18 pages, 5 figures included as postscript files. Astrophysical
  Journal, in press, vol. 474 (10 April 1997)",,"10.1086/303969","CAL-622","astro-ph",,"  X-ray emission can provide a crucial diagnostic of gamma-ray bursts (GRBs).
We calculate the X-ray and gamma-ray spectra of impulsive acceleration episodes
related to GRB pulses. We use the synchrotron shock model (SSM) as a basis of
our calculations. We show that the current data on soft-to-hard emission ratios
of GRB pulse emission are in agreement with the SSM. In particular, GRB pulse
emission detected by GINGA is in agreement with the SSM low-energy spectra. We
deduce that GINGA detected the majority of bright GRBs detectable by BATSE.
These results indicate that the physical environment surrounding the GRB
emission site is optically thin to X-ray photon energies. We also calculate
emission ratios in the Einstein, ROSAT, SAX and HETE energy bands, and discuss
how future information on simultaneous soft/hard GRB emission can contribute in
distinguishing different emission models. Two different components of X-ray
emission may simultaneously exist in a fraction of GRBs. One component is
clearly associated with the individual GRB pulses, and an additional component
may be related to the pulse X-ray spectral upturns and/or the precursors/tails
occasionally observed. We also show that a meaningful search of GRB-driven
X-ray flashes in Andromeda (M31) can be carried out with existing ROSAT data
and future SAX Wide Field Camera observations.
","[{""version"":""v1"",""created"":""Tue, 29 Oct 1996 16:37:48 GMT""}]","2009-10-28"
"astro-ph/9610238",,"Sten Odenwald, Jeffrey Newmark, George Smoot","A Study of External Galaxies Detected by COBE-DIRBE","Plain LaTex, 11pt, 14 pages, 2 figures, 4 tables",,,,"astro-ph",,"  A comparison of the COBE, Diffuse Infrared Background Experiment (DIRBE)
all-sky survey with the locations of known galaxies in the IRAS Catalog of
Extragalactic Objects and the Center for Astrophysics Catalog of Galaxies led
to the detection of as many as 56 galaxies. In this paper, we present the
photometric analysis of these detections and an analysis of their dust
properties. The sample is dominated by late-type spirals and active galaxies,
and their far-IR continuua between 25-240 microns suggest a single dust
component dominating the far-IR emission. We show that for the spirals,
T(dust)= 27.6 K, and for the active galaxies, T(dust) = 35.5 K. Estimates of
the ratio of the mass of the dust component detected at T(dust) = 20 - 30 K to
a hypothetical component with T(dust) = 15 K provide modest constraints to the
Very Cold Dust (VCD) component present in the galaxies detected at 140 and 240
microns. VCD components with less than times the mass of the 20-30 K dust are
consistent with all of the upper limits.
","[{""version"":""v1"",""created"":""Tue, 29 Oct 1996 18:04:29 GMT""}]","2007-05-23"
"astro-ph/9610239","Sergio Campana","Sergio Campana (Osservatorio astronomico di Brera, Italy)","ROSAT observations of A0538--66 during quiescence","5 pages + 1 figure, LaTex, Springer-Verlag's A&A macro package +
  s_tables macro (included). Accepted for publication in A&A Main Journal",,,,"astro-ph",,"  We discuss serendipitous ROSAT observations of the Be transient A0538-66,
which contains the fastest known accreting X-ray pulsar (69 ms). We show that
this transient is detected several times during quiescence at a level of about
10^34-35 erg/s. Considering this low luminosity it is more likely that X-rays
are produced by matter falling onto the neutron star magnetosphere, rather than
onto the star surface. This could be the first example of an X-ray source in
the ""propeller regime"".
","[{""version"":""v1"",""created"":""Tue, 29 Oct 1996 18:20:23 GMT""}]","2007-05-23"
"astro-ph/9610240","Sangeeta Malhotra","S. Malhotra, G. Helou, D. van Buren, M. Kong, C. A. Beichman (IPAC),
  H. Dinerstein (U. Texas), D. J. Hollenbach (U. Wyoming), D. A. Hunter (Lowell
  Observatory), K. Y. Lo (U. Illinois), S. Lord, N. Lu (IPAC), R. H. Rubin
  (NASA-ARC), G. Stacey (Cornell University), H. Thronson (U. Wyoming, NASA
  HQ), M. W. Werner (JPL)","ISOCAM Observations of NGC 6946: Mid-IR Structure","4 page, 4 figures. To appear in Astronomy and Astrophysics. Also
  available at http://isowww.estec.esa.nl/ISO/AandA/s_malhotra.ps",,,,"astro-ph",,"  The nearby spiral galaxy NGC 6946 was observed with ISO-CAM in the
mid-infrared, achieving 7 arcsec resolution and sub-MJy/steradian sensitivity.
Images taken with CAM filters LW2 (7 microns) and LW3 (15 microns) are analysed
to determine the morphology of this galaxy and understand better the emission
mechanisms. The mid-infrared emission follows an exponential disk with a scale
length 75 arcsec. This is 60% of the scale length in the optical R-band and
radio continuum. The nuclear starburst region is too bright for reliable
measurement in these images. Its surface brightness exceeds the inner disk by
at least a factor of 12. The arms and interarm regions are clearly detected,
with each of these components contributing about equally to the disk emission.
The arm-interarm contrast is 2-4 in the mid-IR, close to that measured in the
visible R band light and lower than the contrast in $H\alpha$, suggesting that
non-ionizing radiation contributes significantly to dust heating.
","[{""version"":""v1"",""created"":""Tue, 29 Oct 1996 18:18:43 GMT""}]","2007-05-23"
"astro-ph/9610241","Sangeeta Malhotra","G. Helou, S. Malhotra, C. A. Beichman (IPAC), H. Dinerstein (U.
  Texas), D.J. Hollenbach (U. Wyoming), D. A. Hunter (Lowell Observatory), K.
  Y. Lo (U. Illinois), S. Lord, N. Lu (IPAC), R. H. Rubin (NASA-ARC), G. Stacey
  (Cornell University), H. Thronson (U. Wyoming, NASA HQ), M. W. Werner (JPL)","The Mid-Infrared Color of NGC 6946","4 pages, 3 figures. To appear in Astronomy and Astrophysics, also
  available at http://isowww.estec.esa.nl/ISO/AandA/I0085.html",,,,"astro-ph",,"  We analyze the new mid-infrared maps of NGC 6946 for variations in the color
ratio of the 7-to-15 micron emission. Our preliminary findings are that this
mid-infrared color is remarkably constant between arms and inter-arm regions,
and as a function of radius in the disk, excluding the nuclear region. As
surface brightness ranges by more than an order of magnitude and the radius
runs from about 0.5 to 3kpc, the color ratio remains constant to about +/-20%.
Our interpretation is that (1) hard UV radiation from OB stars does not
dominate the heating of the grains radiating in the mid-infrared; and (2) that
surface brightness variations are driven primarily by surface-filling fraction
in the disk, and by radiation intensity increases in starburst environments,
such as the nucleus of NGC 6946.
","[{""version"":""v1"",""created"":""Tue, 29 Oct 1996 18:49:54 GMT""}]","2007-05-23"
"astro-ph/9610242","Sangeeta Malhotra","N. Y. Lu, G. Helou, R. Tuffs, C. Xu, S. Malhotra, M. W. Werner (JPL),
  H. Thronson (U. Wyoming, NASA HQ)","An ISOPHOT of the disk of galaxy NGC 6946: 60 micron infrared and radio
  continuum correlation","4 pages, to appear in Astronomy and Astrophysics. Also available at
  http://isowww.estec.esa.nl/ISO/AandA/I0085.html",,,,"astro-ph",,"  We use the ISOPHOT 60 micron image of Tuffs et al. (1996) to study the 60
micron light distribution and its correlation with radio continuum within the
disk of spiral galaxy NGC6946, and to resolve the long-standing IRAS
controversy as to whether the infrared-to-radio continuum ratio, Q, decreases
radially out in galaxy disks. Our main results are: (1) The disk at 60 microns
also appears to follow an exponential fall-off. Its e-folding scale-length lies
between 1'.3 and an upper limit of 1'.9, obtained from the mean radial profile
between 1'.5 and 4' in radius. This scale length is smaller than that derived
from the radio continuum data at either 20cm or 6cm, with or without the
thermal component removed, at a significance level of >~ 2 sigma. From 1'.5 to
4' in radius, the 60 micron -to-radio continuum surface brightness ratio, Q,
decreases by a factor of 1.5 to 1.7 on average. These quantitative results
agree with that of Marsh & Helou (1995) using IRAS HiRes data, but not with
that of Fitt et al. (1992) based on IRAS CPC data. Our results also fit into
the picture of the radio disk as a ``smeared'' version of the infrared disk,
but are not consistent with the picture in which the variation of Q is a result
of the thermal and non-thermal radio components having two distinct, constant
values of the infrared-to-radio ratio.
","[{""version"":""v1"",""created"":""Tue, 29 Oct 1996 19:02:40 GMT""}]","2007-05-23"
"astro-ph/9610243",,"Ricardo P. Schiavon, Beatriz Barbuy, Silvia C.F. Rossi and Andre
  Milone (Instituto Astronomico Geofisico - Universidade de Sao Paulo, Brazil)","The Near Infrared NaI Doublet Feature in M Stars","9 pages, (TeX file) + 7 Figures in Postscript format. Accepted for
  publication in The Astrophysical Journal",,"10.1086/303907",,"astro-ph",,"  The NaI near-infrared doublet has been used to indicate the dwarf/giant
population in composite systems, but its interpretation is still a contentious
issue. In order to understand the behaviour of this controversial feature, we
study the observed and synthetic spectra of cool stars. We conclude that the
NaI infrared feature can be used as a dwarf/giant discriminator. We propose a
modified definition of the NaI index by locating the red continuum at 8234
angstrons and by measuring the equivalent width in the range 8172-8197
angstrons, avoiding the region at lambda > 8197 angstrons, which contains VI,
ZrI, FeI and TiO lines. We also study the dependence of this feature on stellar
atmospheric parameters.
","[{""version"":""v1"",""created"":""Tue, 29 Oct 1996 19:49:00 GMT""}]","2009-10-28"
"astro-ph/9610244","Dima Verner","D. A. Verner, D. G. Yakovlev, I. M. Band, and M. B. Trzhaskovskaya","Comment on a paper by M. A. Bautista ``Atomic data from the Iron
  Project. XVI. Photoionization cross sections and oscillator strengths for Fe
  V''","1 page, latex uses l-aa.sty style file. Submitted to Astron.
  Astrophys. Suppl",,,,"astro-ph",,"  Recently, Bautista (1996, A&AS, 119, 105) reported new calculations of
photoionization cross sections for Fe V, and compared them with the earlier
results of Reilman & Manson (1979, ApJS, 40, 815) and Verner et al. (1993,
Atomic Data Nucl. Data Tables, 55, 233). Bautista claimed that beyond 10 Ry the
new cross sections ``converge well toward the results by Reilman and Manson'',
whereas ``the calculations by Verner et al. still underestimate the cross
section by almost factor of two''. We show that Bautista erroneously compared
the total (summed over shells) cross sections from Reilman & Manson with the
partial 3d-shell cross sections from Verner et al. Actually, the total cross
sections from Verner et al. and Reilman & Manson agree within 3% at all
energies.
","[{""version"":""v1"",""created"":""Tue, 29 Oct 1996 22:42:30 GMT""}]","2007-05-23"
"astro-ph/9610245","Jeff Benensohn","J. S. Benensohn (1), D. Q. Lamb (1), R. E. Taam (2) ((1) University of
  Chicago, (2) Northwestern University)","Hydrodynamical Studies of Wind Accretion Onto Compact Objects:
  Two-Dimensional Calculations","16 pages, PostScript; figures available via anonymous ftp to
  astro.uchicago.edu in /pub/astro/jeffb/wind2d; mpeg movies available at
  http://astro.uchicago.edu/home/web/jeffb/wind.html; to be published in
  Astrophysical Journal (submitted 9/96, accepted 10/96)",,"10.1086/303835",,"astro-ph",,"  We present the results of hydrodynamical simulations of nonaxisymmetric gas
flow past a gravitating compact object in two dimensions. Calculations were
performed with uniform flow as well as with transverse velocity and density
gradients. We find that the flow is highly nonsteady, exhibiting the
``flip-flop'' behavior seen in previous studies in which accretion disks form
with alternating directions of rotation. We investigate the periodicity of the
flip-flop behavior, and study the effects of spatial resolution on the results.
We find that the flip-flop motion creates accretion torques which, in some
cases, may be large enough to explain the erratic spin behavior observed in
some massive X-ray pulsars.
","[{""version"":""v1"",""created"":""Tue, 29 Oct 1996 23:54:10 GMT""}]","2009-10-28"
"astro-ph/9610246","Tal Alexander","Tal Alexander (Tel Aviv University)","Bloated Stars as AGN Broad Line Clouds: The Emission Lines Response to
  Continuum Variations","6 pages with 4 figures, LaTeX using mn.sty and epsf.sty, to appear in
  MNRAS",,"10.1093/mnras/285.4.891","WO-SIA-96/74","astro-ph",,"  The `Bloated Stars Scenario' proposes that AGN broad line emission originates
in the winds or envelopes of bloated stars (BS). Alexander and Netzer (1994,
1996) established that ~ 5e4 BSs with dense, decelerating winds can reproduce
the observed emission line spectrum and line profiles while avoiding rapid
collisional destruction. Here, I investigate a third prediction of the model,
related to the size of the broad line region, by deriving the emission line
response to variations in the ionizing continuum (`line reverberation') and
comparing it to observations. The expected time lags, as well as the order of
response of the various lines, strongly depend on the typical variability time
scale of the ionizing continuum. The BS model studied here corresponds to a
bright Syfert 1 galaxy (Sy1) or a low luminosity QSO. I find that the BS model
is consistent with the observed correlation between the Balmer lines time lags
and the AGN luminosity, which at present is the only line reverberation
information available for this luminosity class. The model displays also some
of the anti-correlation between the time lags of the metal emission lines and
their degree of ionization that has been observed in a few low-luminosity Sy1s.
However, the bright Sy1 model results differs from the low-luminosity Sy1 data
in that the Hb time lag is relatively shorter and the CIV time lag relatively
longer.
","[{""version"":""v1"",""created"":""Wed, 30 Oct 1996 12:58:19 GMT""}]","2015-06-24"
"astro-ph/9610247","Michal Ostrowski","M. Ostrowski (1,2) and G. Siemieniec-Ozi\c{e}b{\l}o(1) (1 -
  Astronomical Observatory of the Jagiellonian University, Cracow; 2 -
  Max-Planck-Institut fuer Radioastronomie, Bonn)","Diffusion in momentum space as a picture of second-order Fermi
  acceleration","LaTex, 9 pages; to be published in Astroparticle Physics","Astropart.Phys.6:271-278,1997","10.1016/S0927-6505(96)00061-8",,"astro-ph",,"  Energetic particles in a turbulent medium can be subject to second-order
Fermi acceleration due to scattering on moving plasma waves. This mechanism
leads to growing particle momentum dispersion and, at the same time, increases
the mean particle energy. In the most frequently met situations both processes
can be represented by a single momentum diffusion term in the particle kinetic
equation. In the present paper we discuss the conditions allowing the
additional term for regular acceleration to arise. For forward-backward
asymmetric scattering centres, besides the diffusive term one should explicitly
consider the regular acceleration term in momentum space, which can consist of
the first-order ($\propto V$), as well as the second-order ($\propto V^2$) part
in the wave velocity V . We derive the condition for the scattering probability
in the wave rest frame required for vanishing the regular acceleration term and
provide a simple mechanical example illustrating the theoretical concepts.
Finally, we address its possible role in cosmic ray acceleration processes.
","[{""version"":""v1"",""created"":""Wed, 30 Oct 1996 15:04:41 GMT""}]","2011-05-23"
"chao-dyn/9610018","Giovanni Gallavotti","Giovannni Gallavotti (Dipartimento di Fisica, Universit\'a di Roma)","New methods in nonequilibrium gases and fluids","Dedicated to the memory of Giovanni Paladin; e-mail
  giovanni@ipparco.roma1.infn.it","Open Systems and Information Dynamics, 6, 101--136, 1999",,"FM 96-13","chao-dyn nlin.CD",,"  Kinematical and dynamical properties of chaotic systems are reviewed and a
few applications are described.
","[{""version"":""v1"",""created"":""Wed, 30 Oct 1996 01:26:38 GMT""}]","2008-10-09"
"chao-dyn/9610019",,"A. Hof","On scaling in relation to singular spectra","16 pages, LaTeX. To appear in Comm. Math. Phys",,"10.1007/s002200050073",,"chao-dyn nlin.CD",,"  This paper relates uniform alpha-Hoelder continuity, or alpha-dimensionality,
of spectral measures in an arbitrary interval to the Fourier transform of the
measure. This is used to show that scaling exponents of exponential sums
obtained from time series give local upper bounds on the degree of Hoelder
continuity of the power spectrum of the series. The results have applications
to generalized random walk, numerical detection of singular continuous spectra
and to the energy growth in driven oscillators.
","[{""version"":""v1"",""created"":""Wed, 30 Oct 1996 06:10:06 GMT""}]","2009-10-28"
"cmp-lg/9610005","Eric Sven Ristad","Eric Sven Ristad and Peter N. Yianilos","Learning string edit distance","http://www.cs.princeton.edu/~ristad/papers/pu-532-96.ps.gz",,,"CS-TR-532-96","cmp-lg cs.CL",,"  In many applications, it is necessary to determine the similarity of two
strings. A widely-used notion of string similarity is the edit distance: the
minimum number of insertions, deletions, and substitutions required to
transform one string into the other. In this report, we provide a stochastic
model for string edit distance. Our stochastic model allows us to learn a
string edit distance function from a corpus of examples. We illustrate the
utility of our approach by applying it to the difficult problem of learning the
pronunciation of words in conversational speech. In this application, we learn
a string edit distance with one fourth the error rate of the untrained
Levenshtein distance. Our approach is applicable to any string classification
problem that may be solved using a similarity function against a database of
labeled prototypes.
  Keywords: string edit distance, Levenshtein distance, stochastic
transduction, syntactic pattern recognition, prototype dictionary, spelling
correction, string correction, string similarity, string classification, speech
recognition, pronunciation modeling, Switchboard corpus.
","[{""version"":""v1"",""created"":""Tue, 29 Oct 1996 17:32:50 GMT""},{""version"":""v2"",""created"":""Mon, 28 Apr 1997 15:24:43 GMT""},{""version"":""v3"",""created"":""Sun, 2 Nov 1997 18:54:05 GMT""}]","2008-02-03"
"cond-mat/9610204",,"Enrique Diez, Francisco Dominguez-Adame, and Angel Sanchez","Suppresion of Bloch oscillations by weak disorder in semiconductor
  superlattices","4 pages, RevTex, 3 PostScript figures",,,,"cond-mat.mes-hall",,"  We investigate the dephasing dynamics of Bloch oscillations in semiconductor
superlattices by means of a very simple model including disorder and applied
electric fields. A thorough numerical study of our model allows us to claim
that small, unintentional well width fluctuations can be responsible for fast
dephasing of Bloch oscillations at low temperatures. We show that the lifetime
of Bloch oscillations is controlled by a characteristic time which depends on
the degree of disorder and is independent of the electric field. This result is
further supported by the excellent agreement between our model calculations and
several recent experiments, and leads to specific new predictions.
","[{""version"":""v1"",""created"":""Tue, 29 Oct 1996 18:01:02 GMT""}]","2008-02-03"
"cond-mat/9610205","Carsten Timm","Carsten Timm (Dept. of Physics, Indiana University)","Flux noise in high-temperature superconductors","9 pages, 4 PostScript figures, to be published in Phys. Rev. B","Phys. Rev. B 55, 3241 (1997)","10.1103/PhysRevB.55.3241",,"cond-mat.supr-con",,"  Spontaneously created vortex-antivortex pairs are the predominant source of
flux noise in high-temperature superconductors. In principle, flux noise
measurements allow to check theoretical predictions for both the distribution
of vortex-pair sizes and for the vortex diffusivity. In this paper the
flux-noise power spectrum is calculated for the highly anisotropic
high-temperature superconductor Bi-2212, both for bulk crystals and for
ultra-thin films. The spectrum is basically given by the Fourier transform of
the temporal magnetic-field correlation function. We start from a
Berezinskii-Kosterlitz-Thouless type theory and incorporate vortex diffusion,
intra-pair vortex interaction, and annihilation of pairs by means of a
Fokker-Planck equation to determine the noise spectrum below and above the
superconducting transition temperature. We find white noise at low frequencies
omega and a spectrum proportional to 1/omega^(3/2) at high frequencies. The
cross-over frequency between these regimes strongly depends on temperature. The
results are compared with earlier results of computer simulations.
","[{""version"":""v1"",""created"":""Tue, 29 Oct 1996 16:22:50 GMT""}]","2009-10-28"
"cond-mat/9610206","Hans-Karl Janssen","H.K. Janssen","On Critical Exponents and the Renormalization of the Coupling Constant
  in Growth Models with Surface Diffusion","4 pages, revtex, 2 postscript figures, to appear in Phys.Rev.Lett",,"10.1103/PhysRevLett.78.1082",,"cond-mat.stat-mech",,"  It is shown by the method of renormalized field theory that in contrast to a
statement based on a mathematically ill-defined invariance transformation and
found in most of the recent publications on growth models with surface
diffusion, the coupling constant of these models renormalizes nontrivially.
This implies that the widely accepted supposedly exact scaling exponents are to
be corrected. A two-loop calculation shows that the corrections are small and
these exponents seem to be very good approximations.
","[{""version"":""v1"",""created"":""Tue, 29 Oct 1996 16:52:22 GMT""},{""version"":""v2"",""created"":""Thu, 19 Dec 1996 14:18:45 GMT""}]","2009-10-28"
"cond-mat/9610207","Steven Spencer","Steven Spencer and Henrik Jeldoft Jensen","Absence of Translational Ordering in Driven Vortex Lattices","single postscript file containing 10 pages with figures included",,"10.1103/PhysRevB.55.8473",,"cond-mat.supr-con",,"  By using finite temperature molecular dynamics simulations, we consider the
question of the existence of dynamical ordering as a two dimensional vortex
lattice is driven through a random background potential. The shape of the
current-voltage(I-V) characteristics are qualitatively the same as those seen
in experiments on the conventional superconductors 2H-NbSe_{2} and
Mo_{77}Ge_{23}. However, in contrast to previous simulations, we find that the
lattice has no topological or translational order for any value of the driving
but that it does exhibit a high driving phase where long range orientational
order exists.
","[{""version"":""v1"",""created"":""Tue, 29 Oct 1996 18:47:03 GMT""}]","2016-08-31"
"cond-mat/9610208","Igor Aronov","Igor E. Aronov, Gennady P. Berman, David K. Campbell, and Sergey V.
  Dudiy","Wigner Function Description of the A.C.-Transport Through a
  Two-Dimensional Quantum Point Contact","23 pages (latex), 3 figures",,"10.1088/0953-8984/9/24/009",,"cond-mat",,"  We have calculated the admittance of a two-dimensional quantum point contact
(QPC) using a novel variant of the Wigner distribution function (WDF)
formalism. In the semiclassical approximation, a Boltzman-like equation is
derived for the partial WDF describing both propagating and nonpropagating
electron modes in an effective potential generated by the adiabatic QPC. We
show that this quantum kinetic approach leads to the well-known stepwise
behavior of the real part of the admittance (the conductance), and of the
imaginary part of the admittance (the emittance), in agreement with the latest
results, which is determined by the number of propagating electron modes. It is
shown, that the emittance is sensitive to the geometry of the QPC, and can be
controlled by the gate voltage. We established that the emittance has
contributions corresponding to both quantum inductance and quantum capacitance.
Stepwise oscillations in the quantum inductance are determined by the harmonic
mean of the velocities for the propagating modes, whereas the quantum
capacitance is a significant mesoscopic manifestation of the non-propagating
(reflecting) modes.
","[{""version"":""v1"",""created"":""Tue, 29 Oct 1996 18:54:09 GMT""}]","2016-08-31"
"cond-mat/9610209","Christopher Jarzynski","C. Jarzynski","A nonequilibrium equality for free energy differences","Latex, 11 pages, no figures","Phys Rev Lett 78, 2690 (1997)","10.1103/PhysRevLett.78.2690",,"cond-mat.stat-mech physics.bio-ph physics.chem-ph physics.comp-ph",,"  An expression is derived for the classical free energy difference between two
configurations of a system, in terms of an ensemble of finite-time measurements
of the work performed in parametrically switching from one configuration to the
other. Two well-known equilibrium identities emerge as limiting cases of this
result.
","[{""version"":""v1"",""created"":""Wed, 30 Oct 1996 00:13:42 GMT""}]","2009-10-28"
