"hep-th/9610238","Daniel J. Waldram","Andre Lukas, Burt A. Ovrut, Daniel Waldram","String and M-Theory Cosmological Solutions with Ramond Forms","34 pages, Latex, 3 figures using epsf","Nucl.Phys. B495 (1997) 365-399","10.1016/S0550-3213(97)00194-6","UPR-723T, IASSNS-HEP-96/107, PUPT-1656","hep-th",,"  A general framework for studying a large class of cosmological solutions of
the low-energy limit of type II string theory and of M-theory, with non-trivial
Ramond form fields excited, is presented. The framework is applicable to
spacetimes decomposable into a set of flat or, more generally, maximally
symmetric spatial subspaces, with multiple non-trivial form fields spanning one
or more of the subspaces. It is shown that the corresponding low-energy
equations of motion are equivalent to those describing a particle moving in a
moduli space consisting of the scale factors of the subspaces together with the
dilaton. The choice of which form fields are excited controls the potential
term in the particle equations. Two classes of exact solutions are given, those
corresponding to exciting only a single form and those with multiple forms
excited which correspond to Toda theories. Although typically these solutions
begin or end in a curvature singularity, there is a subclass with positive
spatial curvature which appears to be singularity free. Elements of this class
are directly related to certain black p-brane solutions.
","[{""version"":""v1"",""created"":""Wed, 30 Oct 1996 02:36:47 GMT""},{""version"":""v2"",""created"":""Thu, 31 Oct 1996 09:03:47 GMT""},{""version"":""v3"",""created"":""Thu, 12 Dec 1996 17:01:24 GMT""}]","2009-10-30"
"hep-th/9610239",,"Choon-Lin Ho (Dept. of Physics, Tamkang University, Taiwan)","Sphere-like Solutions in Surface Functional Theory and Dirac's Membrane
  Model","16 pages. Plain Tex","Phys.Rev.D51:1880-1885,1995","10.1103/PhysRevD.51.1880",,"hep-th dg-ga math.DG",,"  A surface functional theory for p-dimensional extended objects, the p-branes,
was proposed in previous papers. The field equations for toroidal p-branes was
exactly solved in $d=p+2$ dimensions, yielding equally spaced mass-squared
spectrum with massless states. In this paper, we obtain the asymptotic
distribution of mass spectrum in the point-particle limit of the theory with
sphere-like membranes ($p=2$) in $d=4$ dimensions. Similarity between this
spectrum and that obtained in the Dirac's membrane model of electron is
discussed.
","[{""version"":""v1"",""created"":""Wed, 30 Oct 1996 12:45:45 GMT""}]","2010-11-19"
"hep-th/9610240","Rabin Banerjee","R. Banerjee","Gauge Independent Reduction of a Solvable Model with Gribov-Like
  Ambiguity","LaTex, 26 pages",,,,"hep-th",,"  We present a gauge independent Lagrangian method of abstracting the reduced
space of a solvable model with Gribov-like ambiguity, recently proposed by
Friedberg, Lee, Pang and Ren. The reduced space is found to agree with the
explicit solutions obtained by these authors. Complications related to gauge
fixing are analysed. The Gribov ambiguity manifests by a nonuniqueness in the
canonical transformations mapping the hamiltonian in the afflicted gauge with
that obtained gauge independently. The operator ordering problem in this gauge
is investigated and a prescription is suggested so that the results coincide
with the usual hamiltonian formalism using the Schr\""odinger representation.
Finally, a Dirac analysis of the model is elaborated. In this treatment it is
shown how the existence of a nontrivial canonical set in the ambiguity-ridden
gauge yields the connection with the previous hamiltonian formalism.
","[{""version"":""v1"",""created"":""Wed, 30 Oct 1996 14:19:11 GMT""}]","2007-05-23"
"hep-th/9610241","Stephan Duerr","Stephan D\""urr and Andreas Wipf","Finite Temperature Schwinger Model with Chirality Breaking Boundary
  Conditions","One reference added plus one corrected, final version as to be
  published in Annals of Physics","Annals Phys. 255 (1997) 333-361","10.1006/aphy.1996.5664","ZU-TH-18/96 and FSU-TPI-11/96","hep-th hep-ph",,"  The $N_f$-flavour Schwinger Model on a finite space $0\leq x^1\leq L$ and
subject to bag-type boundary-conditions at $x^1=0$ und $x^1=L$ is solved at
finite temperature $T=1/\beta$. The boundary conditions depend on a real
parameter $\theta$ and break the axial flavour symmetry. We argue that this
approach is more appropriate to study the broken phases than introducing small
quark masses, since all calculations can be performed analytically. In the
imaginary time formalism we determine the thermal correlators for the
fermion-fields and the determinant of the Dirac-operator in arbitrary
background gauge-fields. We show that the boundary conditions induce a CP-odd
$\theta$-term in the effective action. The chiral condensate, and in particular
its T- and L- dependence, is calculated for $N_f$ fermions. It is seen to
depend on the order in which the two lengths $\beta=1/T$ and $L$ are sent to
infinity.
","[{""version"":""v1"",""created"":""Wed, 30 Oct 1996 14:59:25 GMT""},{""version"":""v2"",""created"":""Wed, 29 Jan 1997 15:12:05 GMT""}]","2016-09-06"
"hep-th/9610242","Andrei Marshakov","A. Marshakov","Non-perturbative Quantum Theories and Integrable Equations","35 pages, LaTeX, to appear in Int.J.Mod.Phys. A","Int.J.Mod.Phys. A12 (1997) 1607-1650","10.1142/S0217751X97001109","FIAN/TD-16/96, ITEP/TH-47/96","hep-th",,"  I review the appearance of classical integrable systems as an effective tool
for the description of non-perturbative exact results in quantum string and
gauge theories. Various aspects of this relation: spectral curves, action-angle
variables, Whitham deformations and associativity equations are considered
separately demonstrating hidden parallels between topological 2d string
theories and naively non-topological 4d theories. The proofs are supplemented
by explicit illustrative examples.
","[{""version"":""v1"",""created"":""Wed, 30 Oct 1996 15:28:06 GMT""}]","2015-06-26"
"nucl-ex/9610009","Willibrord Reisdorf","W. Reisdorf, et al. (FOPI Collaboration)","Central Collisions of Au on Au at 150, 250 and 400 A MeV","LateX text 62 pages, plus six Postscript files with a total of 34
  figures, accepted by Nucl.Phys.A","Nucl.Phys.A612:493-556,1997","10.1016/S0375-9474(96)00388-0",,"nucl-ex",,"  Collisions of Au on Au at incident energies of 150, 250 and 400 A MeV were
studied with the FOPI-facility at GSI Darmstadt. Nuclear charge (Z < 16) and
velocity of the products were detected with full azimuthal acceptance at
laboratory angles of 1-30 degrees. Isotope separated light charged particles
were measured with movable multiple telescopes in an angular range of 6-90
degrees. Central collisions representing about 1 % of the reaction cross
section were selected by requiring high total transverse energy, but vanishing
sideflow. The velocity space distributions and yields of the emitted fragments
are reported. The data are analysed in terms of a thermal model including
radial flow. A comparison with predictions of the Quantum Molecular Model is
presented.
","[{""version"":""v1"",""created"":""Tue, 29 Oct 1996 17:38:46 GMT""}]","2011-06-10"
"nucl-ex/9610010",,"John N. Bahcall, P. I. Krastev, E. Lisi","Neutrino Oscillations and Moments of Electron Spectra","16 pages, Latex, text+figures. To be published in Physical Review C,
  January 1997","Phys.Rev.C55:494-503,1997","10.1103/PhysRevC.55.494","IASSNS-AST 96/43","nucl-ex astro-ph hep-ph",,"  We show that the effects of neutrino oscillations on 8B solar neutrinos are
described well by the first two moments (the average and the variance) of the
energy distribution of scattered or recoil electrons. For the SuperKamiokande
and the Sudbury Neutrino Observatory experiments, the differences between the
moments calculated with oscillations and the standard, no-oscillation moments
are greater than 3 standard deviations for a significant fraction of the
neutrino mass-mixing (Delta m^2, sin^2 2 theta) parameter space.
","[{""version"":""v1"",""created"":""Tue, 29 Oct 1996 21:32:26 GMT""}]","2008-11-26"
"nucl-ex/9610011","Elizabeth J. Beise","E.J. Beise (Univ. of Maryland) (for the SAMPLE collaboration)","Experimental Status of Parity Violating Electron Scattering","9 pages, Latex, 3 embedded figures, sty files included, prepared for
  the proceedings of SPIN96 symposium, Amsterdam, Sept 1996",,,,"nucl-ex",,"  Recently, there has been considerable theoretical interest in determining
strange quark contributions to hadronic matrix elements. Such matrix elements
can be accessed through the nucleon's neutral weak form factors as determined
in parity violating electron scattering. A program of experiments is presently
underway or planned at the MIT-Bates, Mainz and Jefferson Laboratories. The
SAMPLE experiment at MIT-Bates will measure the strange magnetic form factor
$G_M^s$ at low momentum transfer. Two data taking periods have recently been
completed, representing about 15% of the desired data on hydrogen. A summary of
recent progress on the SAMPLE experiment is presented, along with future plans
at Jefferson Lab.
","[{""version"":""v1"",""created"":""Wed, 30 Oct 1996 14:44:10 GMT""}]","2019-08-14"
"nucl-th/9610045","Jonathan Engel","J. Engel, S. Pittel, P. Vogel, M. Stoitsov, and J. Dukelsky","Neutron-Proton Correlations in an Exactly Solvable Model","13 pages + 11 postscript figures, in RevTeX","Phys.Rev.C55:1781-1788,1997","10.1103/PhysRevC.55.1781",,"nucl-th",,"  We examine isovector and isoscalar neutron-proton correlations in an exactly
solvable model based on the algebra SO(8). We look particularly closely at
Gamow-Teller strength and double beta decay, both to isolate the effects of the
two kinds of pairing and to test two approximation schemes: the renormalized
neutron-proton QRPA (RQRPA) and generalized BCS theory. When isoscalar pairing
correlations become strong enough a phase transition occurs and the dependence
of the Gamow-Teller beta+ strength on isospin changes in a dramatic and
unfamiliar way, actually increasing as neutrons are added to an N=Z core.
Renormalization eliminates the well-known instabilities that plague the QRPA as
the phase transition is approached, but only by unnaturally suppressing the
isoscalar correlations. Generalized BCS theory, on the other hand, reproduces
the Gamow-Teller strength more accurately in the isoscalar phase than in the
usual isovector phase, even though its predictions for energies are equally
good everywhere. It also mixes T=0 and T=1 pairing, but only on the isoscalar
side of the phase transition.
","[{""version"":""v1"",""created"":""Tue, 29 Oct 1996 16:23:43 GMT""}]","2008-11-26"
"physics/9610020","Konrad Banaszek","Konrad Banaszek and Peter L. Knight (Imperial College, London)","Quantum Interference in Three Photon Down Conversion","9 pages REVTeX, 5 figures, uses multicol, epsfig, and pstricks","Phys.Rev. A55 (1997) 2368","10.1103/PhysRevA.55.2368",,"physics.optics quant-ph",,"  We study degenerate three photon down conversion as a potential scheme for
generating nonclassical states of light which exhibit clear signatures of phase
space interference. The Wigner function representing these states contains an
interference pattern manifesting quantum coherence between distinct phase space
components, and has substantial areas of negativity. We develop an analytical
description of the interference pattern, which demonstrates how the
oscillations of the Wigner function are built up by the superposition
principle. We analyze the impact of dissipation and pump fluctuations on the
visibility of the interference pattern; the results suggest that some
signatures of quantum coherence can be observed in the presence of moderate
amount of noise.
","[{""version"":""v1"",""created"":""Tue, 29 Oct 1996 16:01:46 GMT""}]","2009-10-30"
"q-alg/9610034","Anatol N. Kirillov","Anatol N. Kirillov","Quantum Grothendieck polynomials","PlainTeX, 13 pages",,,,"q-alg math.QA",,"  We study the algebraic aspects of (small) quantum equivariant $K$-theory of
flag manifold. Lascoux-Sch\""utzenberger's type formula for quantum double and
quantum double dual Grothendieck polynomials and the quantum Cauchy identity
for quantum Grothendieck polynomials are obtained.
","[{""version"":""v1"",""created"":""Wed, 30 Oct 1996 15:57:00 GMT""}]","2008-02-03"
"quant-ph/9610044","Daniel Rohrlich","Sandu Popescu and Daniel Rohrlich","Thermodynamics and the Measure of Entanglement","8 pages, RevTeX; edited for clarity, additional references, to appear
  as a Rapid Communication in Phys. Rev. A",,"10.1103/PhysRevA.56.R3319","TAUP 2385-96","quant-ph",,"  We point out formal correspondences between thermodynamics and entanglement.
By applying them to previous work, we show that entropy of entanglement is the
unique measure of entanglement for pure states.
","[{""version"":""v1"",""created"":""Tue, 29 Oct 1996 20:06:48 GMT""},{""version"":""v2"",""created"":""Thu, 11 Sep 1997 21:43:13 GMT""}]","2009-10-30"
"quant-ph/9610045","Toshifumi Sakaguchi","Toshifumi Sakaguchi","On the EPR Phenomenon","6 pages, REVTeX, no figures",,,,"quant-ph",,"  The origin of the nonlocal nature of quantum mechanics is investigated in the
context of Everett's formulation of quantum mechanics. EPR phenomenon can fully
be explained without introducing any kind of decoherence.
","[{""version"":""v1"",""created"":""Wed, 30 Oct 1996 05:17:34 GMT""}]","2007-05-23"
