"cond-mat/9610210","Roza Kotlyar","R. Kotlyar and S. Das Sarma","Persistent Current in an Artificial Quantum Dot Molecule","4 pages, 3 figures","Physical Review B 55, R10205 (1997).","10.1103/PhysRevB.55.R10205",,"cond-mat.mes-hall",,"  Using an exact diagonalization technique within a generalized Mott-Hubbard
Hamiltonian, we predict the existence of a ground state persistent current in
coherent two-dimensional semiconductor quantum dot arrays pierced by an
external magnetic flux. The calculated persistent current, which arises from
the nontrivial dependence of the ground state energy on the external flux,
exists in isolated arrays without any periodic boundary condition. The
sensitivity of the calculated persistent current to interaction and disorder is
shown to reflect the intricacies of various Anderson-Mott-Hubbard quantum phase
transitions in two dimensional systems.
","[{""version"":""v1"",""created"":""Wed, 30 Oct 1996 02:08:15 GMT""}]","2009-10-28"
"cond-mat/9610211","Tobias Brandes","Arisato Kawabata and Tobias Brandes (Gakushuin University, Tokyo)","Interaction effects in multi-subband quantum wires","4 pages, style-files included. No figure. Appears in J. Phys. Soc.
  Japan (Letter)","J. Phys. Soc. Jap. (Letter) 65, p. 3712 (1996)","10.1143/JPSJ.65.3712",,"cond-mat.mes-hall",,"  We investigate the effect of electron-electron interactions on the transport
properties of disordered quasi one-dimensional quantum wires with two or more
subbands occupied. We apply two alternative methods to solve the logarithmic
divergent problem, namely the parquet graph theory and a renormalization group
calculation. We solve the group equations analytically in the weak coupling
limit and find a power-law for the temperature dependent conductivity of a
multi-channel system. The exponent is roughly equal to the inverse of the
number of the occupied subbands.
","[{""version"":""v1"",""created"":""Wed, 30 Oct 1996 07:28:23 GMT""}]","2009-10-28"
"cond-mat/9610213",,"Asimkumar Ghosh and Indrani Bose","Antiferromagnetic Spin Ladders with Odd and Even number of Chains","22 pages, LaTeX, 6 figures available upon request, submitted to Phys.
  Rev. B",,"10.1103/PhysRevB.55.3613",,"cond-mat.str-el",,"  We construct frustrated antiferromagnetic spin ladders with m chains for
which the exact ground state can be determined in a particular parameter
regime. The excitation spectrum is shown rigorously to be gapless ( with gap )
for odd ( even ) m. In a general parameter regime, the four-chain and periodic
ladders are studied using a mean-field theory based on the bond operator
formalism for spin $S=1/2$. The excitation spectrum and the spin-gap are
calculated in both the cases. The spin-gap of the frustrated ladder system has
a larger magnitude than in the case of non-frustrated ladders. For the
frustrated periodic ladder, the spin-gap vanishes at a critical value of the
interladder coupling strength which is larger than the critical value in the
case of non-frustrated periodic ladder.
","[{""version"":""v1"",""created"":""Wed, 30 Oct 1996 14:21:00 GMT""}]","2009-10-28"
"dg-ga/9610020","Leung Man Chun","Man Chun Leung","Asymptotic properties of energy of harmonic maps on asymptotically
  hyperbolic manifolds","LaTeX, 17 pages",,,,"dg-ga math.DG",,"  Asymptotic behavior of energy of a harmonic map defined on an asymptotically
hyperbolic manifold is considered. Using the growth of energy, we show that a
harmonic map defined on some asymptotically hyperbolic manifolds has to be
constant if the total energy is finite, or if the map approaches a point fast
enough, in terms of a defining function for the boundary.
","[{""version"":""v1"",""created"":""Wed, 30 Oct 1996 02:54:42 GMT""}]","2008-02-03"
"hep-ph/9610526",,"H. Nunokawa, A. Rossi, V. B. Semikoz and J. W. F. Valle","The MSW conversion of solar neutrinos and random matter density
  perturbations","latex file, 8 pages, including 8 postscript figures. Talk presented
  at the 17th Int. Conf. on Neutrino Physics and Astrophysics, Helsinki,
  Finland, 13-20 June 1996. To appear in the Proceedings",,,"FTUV/96-74; IFIC/96-83","hep-ph",,"  We present a generalization of the resonant neutrino conversion in matter,
including a random component in the matter density profile. The study is
focused on the effect of such matter perturbations upon both large and small
mixing angle MSW solutions to the solar neutrino problem. This is carried out
both for the active-active $\nu_e \to \nu_{\mu,\tau}$ as well as active-sterile
$\nu_e \to \nu_s$ conversion channels. We find that the small mixing MSW
solution is much more stable (especially in $\delta m^2$) than the large mixing
solution. Future solar neutrino experiments, such as Borexino, could probe
solar matter density noise at the few percent level.
","[{""version"":""v1"",""created"":""Tue, 29 Oct 1996 19:05:42 GMT""}]","2007-05-23"
"hep-ph/9610527","Nils A. Tornqvist","Nils A. Tornqvist and Matts Roos (University of Helsinki)","Reply to the Comment by Harada, Sannino and Schechter on ""Confirmation
  of the Sigma Meson""","2 pages, RevTeX, No Figures","Phys.Rev.Lett. 77 (1996) 2333","10.1103/PhysRevLett.77.2333",,"hep-ph",,"  We reply to the comment of Harada, Sannino and Schechter (hep-ph/9609428) on
our recent paper in the Phys. Rev. Letters on the sigma meson. This concerns
the question, raised by Isgur and Speth in another comment, of whether a
detailed crossing symmetric form is necessary to understand the data. The
discussion gives further support on the existence of the broad sigma near 500
MeV.
","[{""version"":""v1"",""created"":""Tue, 29 Oct 1996 16:01:16 GMT""}]","2009-10-30"
"hep-ph/9610528","Leonard Haakman","Leonard P.A. Haakman, Oleg V. Kancheli, Justus H. Koch","Monte Carlo calculations for the hard Pomeron","9 pages and 4 figures included. To appear in Phys.Lett.B","Phys.Lett. B391 (1997) 157-164","10.1016/S0370-2693(96)01438-4","NIKHEF 96-015","hep-ph",,"  Starting from the same input as the standard BFKL Pomeron, we directly
calculate the ``hard'' Pomeron as a gluonic ladder by using Monte Carlo
methods. We reproduce the characteristic features of the the BFKL Pomeron and
are now also able to evaluate new observables. The applicability of the BFKL
approach under realistic kinematical conditions can be tested and the influence
of the running coupling constant examined.
","[{""version"":""v1"",""created"":""Tue, 29 Oct 1996 16:41:39 GMT""}]","2009-10-30"
"hep-ph/9610529","Stefan Dittmaier","Stefan Dittmaier","Theoretical aspects of W-pair production in e+e- collisions","19 pages, latex, 5 postscript figures included, talk given at the 3rd
  International Symposium on Radiative Corrections, Cracow, Poland, August 1-5,
  1996","Acta Phys.Polon. B28 (1997) 619-633",,"BI-TP 96/45","hep-ph",,"  The most interesting theoretical features of W-pair production in e+e-
collisions are reviewed. Based on an analysis of on-shell W-pairs, it is shown
that the mere inclusion of leading $O(\alpha)$ corrections--such as
initial-state radiation, effects from the universal quantities $\Delta\alpha$
and $\Delta r$, and the Coulomb singularity--cannot be expected to approximate
the $O(\alpha)$-corrected cross-section of $e^+e^-\to W^+W^-\to 4f$ to better
than 1-2% for LEP2 energies. The importance of the gauge-invariance problem,
arising from the introduction of finite decay widths, is discussed. The
simplest consistent method to include $O(\alpha)$ corrections at least to the
doubly resonant contributions, viz. a pole expansion around the double
resonance, is also briefly described.
","[{""version"":""v1"",""created"":""Tue, 29 Oct 1996 16:59:59 GMT""}]","2007-05-23"
"hep-ph/9610530",,"N. Brambilla and G. M. Prosperi (Milano)","The relativistic and nonrelativistic quark-antiquark bound state problem
  in a Wilson loop context","latex, sprocl.sty required; Talk given at the international
  conference ""Quark Confinement and the hadron spectrum II""",,,,"hep-ph",,"  Taking advantage of a semirelativistic and a full relativistic representation
of the quark propagator in an external field we present an unified derivation
of the semirelativistic potential and of a Bethe-Salpeter like equation for the
quark-antiquark system. We consider three different models for the evaluation
of the Wilson loop: the Modified Area Law model (MAL), the Stochastic Vacuum
Model (SVM) and the Dual QCD (DQCD). We compare the corresponding potentials
and show that they all agree at the short and the long distances. In the case
of the Bethe-Salpeter equation we treat explicitly only the MAL model and give
an expression for the kernel. Then we show that an effective mass operator can
be obtained which agrees with the MAL potential in the semirelativistic limit.
In the light quark mass limit this mass operator produces straight Regge
trajectories with Nambu-Goto slope in agreement with the data. Finally we
briefly discuss the mass independence of the hyperfine splitting in the
heavy-light case.
","[{""version"":""v1"",""created"":""Tue, 29 Oct 1996 17:01:17 GMT""}]","2016-09-06"
"hep-ph/9610531","Konstantin Chetyrkin","K. G. Chetyrkin","Four and Three Loop Calculations in QCD: Theory and Applications","14 pages, LaTeX, 3 figures; epsfig.sty and subfig.sty are used.
  Invited talk at the Cracow International Symposium on Radiative Corrections
  1-5 August 1996, Cracow, Poland","Acta Phys.Polon.B28:725-738,1997",,"MPI/PhT/96-117","hep-ph",,"  The talk briefly reviews the current state of the art in doing multiloop QCD
calculations in a completely analytic way. In particular, we discuss recent
analytical calculation of 4-loop O(alpha_s**3) gluino contribution to R(s) and
its implications to the Z boson and tau-lepton decay rates.
","[{""version"":""v1"",""created"":""Tue, 29 Oct 1996 17:11:39 GMT""}]","2014-11-17"
"hep-ph/9610532","Adam Falk","Michael Booth, George Chiladze and Adam F. Falk","Quenched Chiral Perturbation Theory for Vector Mesons","18 pages, 8 figures, uses REVTeX and epsf.sty","Phys.Rev. D55 (1997) 3092-3100","10.1103/PhysRevD.55.3092","JHU-TIPAC-96016","hep-ph hep-lat",,"  We develop quenched chiral perturbation theory for vector mesons made of
light quarks, in the limit where the vector meson masses are much larger than
the pion mass. We use this theory to extract the leading nonanalytic dependence
of the vector meson masses on the masses of the light quarks. By comparing with
analogous quantities computed in ordinary chiral perturbation theory, we
estimate the size of quenching effects, observing that in general they can be
quite large. This estimate is relevant to lattice simulations, where the $\rho$
mass is often used to set the lattice spacing.
","[{""version"":""v1"",""created"":""Tue, 29 Oct 1996 19:12:20 GMT""}]","2009-10-30"
"hep-ph/9610533","G. Wu","Guo-Hong Wu and John N. Ng (TRIUMF)","T-Violation in $K^+ \to \mu^+ \nu \gamma$ Decay And Supersymmetry","Revtex, 29 pages including 4 epsf figures","Phys.Rev.D55:2806-2816,1997","10.1103/PhysRevD.55.2806","TRI-PP-96-57","hep-ph hep-ex",,"  Measurement of the transverse muon polarization $P^{\bot}_{\mu}$ in the $K^+
\rightarrow \mu^+\nu\gamma$ decay will be attempted for the first time at the
ongoing KEK E246 experiment and also at a proposed BNL experiment. We provide a
general analysis of how $P^{\bot}_{\mu}$ is sensitive to the physical
$CP$-violating phases in new physics induced four-Fermi interactions, and then
we calculate the dominant contributions to $P^{\bot}_{\mu}$ from squark family
mixings in generic supersymmetric models. Estimates of the upper bounds on
$P^{\bot}_{\mu}$ are also given. It is found that a supersymmetry-induced
right-handed quark current from $W$ boson exchange gives an upper limit on
$P^{\bot}_{\mu}$ as large as a few per cent, whereas with
charged-Higgs-exchange induced pseudoscalar interaction, $P^{\bot}_{\mu}$ is no
larger than a few tenths of a per cent. Possible correlations between the muon
polarization measurements in $K^+ \rightarrow \mu^+\nu\gamma$ and $K^+
\rightarrow \pi^0\mu^+\nu$ decays are discussed, and distinctive patterns of
this correlation from squark family-mixings and from the three-Higgs-doublet
model are noted.
","[{""version"":""v1"",""created"":""Tue, 29 Oct 1996 20:20:26 GMT""}]","2014-11-17"
"hep-ph/9610534","Aneesh Manohar","Michael Luke and Aneesh V. Manohar","Bound States and Power Counting in Effective Field Theories","23 pages, eps figures, uses revtex","Phys.Rev. D55 (1997) 4129-4140","10.1103/PhysRevD.55.4129","UTPT 96-14, UCSD/PTH 96-24","hep-ph nucl-th",,"  The problem of bound states in effective field theories is studied. A
rescaled version of nonrelativistic effective field theory is formulated which
makes the velocity power counting of operators manifest. Results obtained using
the rescaled theory are compared with known results from NRQCD. The same ideas
are then applied to study Yukawa bound states in 1+1 and 3+1 dimensions, and to
analyze when the Yukawa potential can be replaced by a delta-function
potential. The implications of these results for the study of nucleon-nucleon
scattering in chiral perturbation theory is discussed.
","[{""version"":""v1"",""created"":""Tue, 29 Oct 1996 22:20:50 GMT""}]","2016-09-06"
"hep-ph/9610535","Johan Rathsman","J. Rathsman (SLAC)","Differences between Monte Carlo models for DIS at small-x and the
  relation to BFKL dynamics","10 pages Latex, 4 eps figures","Phys.Lett. B393 (1997) 181-187","10.1016/S0370-2693(96)01637-1","SLAC-PUB-7344","hep-ph",,"  The differences between two standard Monte Carlo models, Lepto and Ariadne,
for deep inelastic scattering at small-x is analysed in detail. It is shown
that the difference arises from a `unorthodox' suppression factor used in
Ariadne which replaces the normal ratio of parton densities. This gives rise to
a factor that qualitatively is similar to what one would expect from BFKL
dynamics for some observables like the energy flow and forward jets but not for
the 2+1 jet cross-section. It is also discussed how one could use the 2+1 jet
cross-section as a probe for BFKL dynamics.
","[{""version"":""v1"",""created"":""Wed, 30 Oct 1996 01:52:39 GMT""}]","2009-10-30"
"hep-ph/9610536","Grigorios Poulis","G.I. Poulis (University of Adelaide)","Relativistic effects in parity-violating electron- deuteron scattering
  and strangeness in the nucleon","3 pages, single postscript file. Talk presented at 12th Int.
  Symposium on High-Energy Spin Physics, Amsterdam, 10-14 Sept. 1996; to appear
  in the proceedings",,,"ADP-96-38/T235","hep-ph",,"  Deuteron electrodisintegration is described in a relativistic PWIA framework.
The reduction to the factorized PWIA, and the effect thereof on the observables
accessible in parity-violating scattering, is discussed. The extent to which
such relativistic effects may affect the extraction of strangeness nucleon form
factors from measurements of the PV asymmetry, is investigated.
","[{""version"":""v1"",""created"":""Wed, 30 Oct 1996 12:50:17 GMT""},{""version"":""v2"",""created"":""Thu, 31 Oct 1996 01:11:21 GMT""}]","2008-02-03"
"hep-ph/9610537","Sergey Troshin","A. D. Krisch and S. M. Troshin","Small $P_{\perp}^2$ Elastic Proton-Proton Polarization near 300 GeV","4 pages, latex, no figures, talk given at Workshop on High Energy
  Polarimeters, Amsterdam, September 9, 1996",,,,"hep-ph",,"  Using two hopefully reasonable assumptions plus existing data on the
analyzing power in high energy proton-proton elastic scattering, we estimate
that the hadronic helicity-flip amplitude at $P^2_{\perp}$ of 0.003 (GeV/c)$^2$
is neglible near 300 GeV. This would allow the absolute calibration of a CNI
polarimeter.
","[{""version"":""v1"",""created"":""Wed, 30 Oct 1996 11:26:43 GMT""}]","2007-05-23"
"hep-ph/9610538","Bojan Golli","B. Golli (Faculty of Education and J. Stefan Institute, University of
  Ljubljana, Ljubljana, Slovenia) and M. Rosina (Faculty of Mathematics and
  Physics and J. Stefan Institute, University of Ljubljana, Ljubljana,
  Slovenia)","The constituent quark as a soliton in a linear sigma-model","10 pages, LaTeX2e, uses elsart.cls, 2 Postscript figures","Phys.Lett. B393 (1997) 161-166","10.1016/S0370-2693(96)01596-1",,"hep-ph",,"  We study a stable, soliton-like solution in the linear $\sigma$-model where
the chiral fields are coupled to a single massless nonstrange quark. We
investigate a possibility that this solution represents the constituent quark
of Georgi and Manohar. We show that its properties are indeed consistent with
nucleon observables. Furthermore, we derive chiral meson exchange potentials
between such objects which are similar to recently used potentials in the
constituent quark models.
","[{""version"":""v1"",""created"":""Wed, 30 Oct 1996 09:05:19 GMT""}]","2009-10-30"
"hep-ph/9610539","Marek Pawlowski","Marek Pawlowski","Coupling Gravity and the Standard Model: a Conformal Approach","Dedicated to the memory of Ryszard Raczka, 6 pages, latex, no figures",,,,"hep-ph gr-qc hep-th",,"  In 1992 Professor Ryszard R\c{a}czka started to work on formulation of a
version of the Standard Model conformally coupled with gravity. Being his
student I had got the honour to participate in those researches. The
conformally invariant Higgs-Free Model was the result of our investigations.
Ryszard R\c{a}czka passed away on 26 August 1996. I present here a short
memorial survey of our results.
","[{""version"":""v1"",""created"":""Wed, 30 Oct 1996 11:56:23 GMT""}]","2007-05-23"
"hep-ph/9610540","Enrico Nardi","Enrico Nardi","Renormalization Group Induced Neutrino Mass in Supersymmetry without
  R-parity","21 pages, LaTex. Few points clarified, results unchanged. Final
  version to appear on Physical Review D","Phys. Rev. D 55, 5772 (1997)","10.1103/PhysRevD.55.5772","WIS-96/38/Oct-PH","hep-ph",,"  We study supersymmetric models without R parity and with universal soft
supersymmetry breaking terms. We show that as a result of the renormalization
group flow of the parameters, a misalignment between the directions in field
space of the down-type Higgs vacuum expectation value $v_d$ and of the $\mu$
term is always generated. This misalignment induces a mixing between the
neutrinos and the neutralinos, resulting in one massive neutrino. By means of a
simple approximate analytical expression, we study the dependence on the
different parameters that contribute to the misalignment and to $m_\nu$. In
large part of the parameter space this effect dominates over the standard
one-loop contributions to $m_\nu$; we estimate 1 MeV $\lsim m_\nu \lsim 1 GeV$.
Laboratory, cosmological and astrophysical constraints imply $m_\nu \lsim 100
eV$. To be phenomenologically viable, these models must be supplemented with
some additional mechanism to ensure approximate alignment and to suppress
$m_\nu$.
","[{""version"":""v1"",""created"":""Wed, 30 Oct 1996 13:38:15 GMT""},{""version"":""v2"",""created"":""Thu, 7 Nov 1996 21:34:45 GMT""},{""version"":""v3"",""created"":""Thu, 6 Feb 1997 11:13:42 GMT""}]","2016-08-24"
"hep-th/9610232","Klaus Behrndt","Klaus Behrndt","Quantum corrections for D=4 black holes and D=5 strings","Latex, 10 pages, errors/typos corrected (mainly in the appendix)","Phys.Lett. B396 (1997) 77-84","10.1016/S0370-2693(97)00075-0","HUB-EP-96/55","hep-th",,"  In recent times quantum corrections for N=2 black holes in 4 dimensions have
been addressed in the framework of double extreme black hole solutions, which
are characterised by constant scalar fields. In this paper we generalize these
solutions to non-constant scalar fields. This enables us to discuss quantum
corrections for massless black holes and for configurations that are
classically singular. We also discuss the relation to the 5-dimensional
magnetic string solution.
","[{""version"":""v1"",""created"":""Tue, 29 Oct 1996 16:41:45 GMT""},{""version"":""v2"",""created"":""Tue, 5 Nov 1996 14:49:06 GMT""},{""version"":""v3"",""created"":""Sat, 14 Jun 1997 15:22:50 GMT""}]","2009-10-30"
"hep-th/9610233","Berndt Mueller","Sergei G. Matinyan and Berndt M\""uller","Quantum Fluctuations and Dynamical Chaos: An Effective Potential
  Approach","12 pages, contribution to a special volume of ``Foundations in
  Physics'' commemorating L.C. Biedenharn (minor corrections)","Found.Phys. 27 (1997) 1237-1255","10.1007/BF02551526","DUKE-TH-96-132","hep-th",,"  We discuss the intimate connection between the chaotic dynamics of a
classical field theory and the instability of the one-loop effective action of
the associated quantum field theory. Using the example of massless scalar
electrodynamics, we show how the radiatively induced spontaneous symmetry
breaking stabilizes the vacuum state against chaos, and we speculate that
monopole condensation can have the same effect in non-Abelian gauge theories.
","[{""version"":""v1"",""created"":""Tue, 29 Oct 1996 19:39:48 GMT""},{""version"":""v2"",""created"":""Mon, 4 Nov 1996 16:03:23 GMT""}]","2009-10-30"
"hep-th/9610234","Edward Witten","Edward Witten","Five-Brane Effective Action In M-Theory","41 pp, harvmac","J.Geom.Phys.22:103-133,1997","10.1016/S0393-0440(97)80160-X",,"hep-th",,"  On the world-volume of an $M$-theory five-brane propagates a two-form with
self-dual field strength. As this field is non-Lagrangian, there is no obvious
framework for determining its partition function. An analogous problem exists
in Type IIB superstring theory for the self-dual five-form. The resolution of
these problems and definition of the partition function is explained. A more
complete analysis of perturbative anomaly cancellation for $M$-theory
five-branes is also presented, uncovering some surprising details.
","[{""version"":""v1"",""created"":""Tue, 29 Oct 1996 22:03:47 GMT""}]","2010-04-07"
"hep-th/9610235","Fermin Aldabe","F. Aldabe","Properties of Supermembrane Axions","25 pages, 2 figures. We no longer use the conjecture that M-theory is
  a theory of membranes. We use instead the coupling of the membrane to 11
  dimensional supergravity to support our results",,,,"hep-th",,"  In the presence of membranes, M-theory becomes in the low energy limit 11
dimensional supergravity action coupled to a supermembrane action. The fields
of the first action are the same fields which couple to the membrane. It is
shown that the axionic moduli of the membrane obtained by wrapping the three
form potential about three-cycles of a Calabi-Yau manifold can take nonzero
integer values. This novel property allows M-theory to have smooth transition
from the Kahler cone of a geometrical phase to a Kahler cone of another
geometrical phase. Nongeometrical phases which define the boundary of the
extended Kahler cone of the geometrical phases have discrete spectrum, and are
continuously connected to the geometric phases. Using this new property, we
relate the M-theory model dependent axion to the type IIA model dependent axion
and show that a potential develops for the type IIA axion in the strong
coupling regime which does not seem to be generated by instantons. Evidence is
presented, using these moduli, which supports the Strominger conjecture on the
winding p-branes.
","[{""version"":""v1"",""created"":""Wed, 30 Oct 1996 01:01:03 GMT""},{""version"":""v2"",""created"":""Sat, 30 Nov 1996 00:03:10 GMT""}]","2008-02-03"
"hep-th/9610236","Michael Douglas","Micha Berkooz and Michael R. Douglas","Five-branes in M(atrix) Theory","harvmac, 10 pp","Phys.Lett. B395 (1997) 196-202","10.1016/S0370-2693(97)00014-2","RU-96-100","hep-th",,"  We propose a construction of five-branes which fill both light-cone
dimensions in Banks, Fischler, Shenker and Susskind's matrix model of M theory.
We argue that they have the correct long-range fields and spectrum of
excitations. We prove Dirac charge quantization with the membrane by showing
that the five-brane induces a Berry phase in the membrane world-volume theory,
with a familiar magnetic monopole form.
","[{""version"":""v1"",""created"":""Wed, 30 Oct 1996 01:29:22 GMT""}]","2009-10-30"
"hep-th/9610237","Jeffrey Harvey","Jeffrey A. Harvey and Gregory Moore","Fivebrane Instantons and $R^2$ couplings in $N=4$ String Theory","16 pages, harvmac, no figures","Phys. Rev. D 57, 2323 (1998)","10.1103/PhysRevD.57.2323","EFI-96-38,YCTP-P21-96","hep-th",,"  We compute the gravitational coupling $F_1$ for IIA string theory on $K3
\times T^2$ and use string-string duality to deduce the corresponding term for
heterotic string on $T^6$. The latter is an infinite sum of gravitational
instanton effects which we associate with the effects of Euclidean fivebranes
wrapped on $T^6$. These fivebranes are the neutral fivebranes or zero size
instantons of heterotic string theory.
","[{""version"":""v1"",""created"":""Wed, 30 Oct 1996 04:17:27 GMT""}]","2016-08-25"
