"astro-ph/9610263",,"V. Berezinsky","Dark matter particles","Invited Talk at International Conference ""Neutrino-96""-Helsinki",,,,"astro-ph",,"  The baryonic and cold dark matter are reviewed in the context of cosmological
models. The theoretical search for the particle candidates is limited by
supersymmetric extension of the Standard Model. Generically in such models
there are just two candidates associated with each other: generalized
neutralino, which components are usual neutralino and axino, and axion which is
a partner of axino in supermultiplet. The status of these particles as DM
candidates is described.
","[{""version"":""v1"",""created"":""Thu, 31 Oct 1996 13:00:38 GMT""}]","2007-05-23"
"astro-ph/9610264","Adrick H. Broeils","Adrick H. Broeils (Stockholm Observatory) and Stephane Courteau
  (NOAO/KPNO)","Modeling the Mass Distribution in Spiral Galaxies","8 pages LaTeX, including 5 figures. Uses paspconf.sty, epsf.sty and
  natbib209.sty. To appear in ""Dark and Visible Matter in Galaxies and
  Cosmological Implications"", eds. M. Persic and P. Salucci, A.S.P. Conference
  Series. 1997",,,"87","astro-ph",,"  We use deep r-band photometry and Halpha rotation curves for a sample of 290
late-type spirals to model their mass distribution within the optical radius.
We examine luminosity profile decompositions into bulge and disk carefully and
confirm that bulge light is best modeled by a seeing-convolved exponential
profile. The optical rotation curves are well-reproduced with a combination of
bulge and ""maximum"" disk components only. No dark halo is needed. The disk
mass-to-light ratios (M/L's) correlate with the ""size"" of galaxies, as measured
by mass, luminosity, or disk scale length. Correcting for this scale effect
yields a narrow distribution of intrinsic M/L's for this galaxy population. By
combining these models with HI data for other samples, we confirm that the
luminous mass fraction increases with galaxy ""size"".
","[{""version"":""v1"",""created"":""Thu, 31 Oct 1996 13:46:21 GMT""}]","2007-05-23"
"astro-ph/9610266","Juan I. Collar","J.I. Collar, T.A. Girard, D. Limagne and G. Waysand","Superheated Droplet Detectors as CDM Detectors: The SIMPLE Experiment","6 pages, including 4 figures. To appear in the Proceedings of the
  Intl. Workshop on the Identification of Dark Matter (Sheffield, Sept. 96)",,,,"astro-ph hep-ph physics.ins-det",,"  Superheated Droplet Detectors (SDDs) are becoming commonplace in neutron
personnel dosimetry. Their total insensitivity to minimum ionizing radiation
(while responsive to nuclear recoils of energies ~ few keV), together with
their low cost, ease of production, and operation at room temperature and 1 atm
makes them ideal for Cold Dark Matter (CDM) searches. SDD's are optimal for the
exploration of the spin-dependent neutralino coupling due to their high
fluorine content. The status of SIMPLE (Superheated Instrument for Massive
ParticLe Experiments) is presented. Under realistic background considerations,
we expect an improvement in the present Cold Dark Matter sensitivity of 2-3
orders of magnitude after ~1 kg-y of data acquisition.
","[{""version"":""v1"",""created"":""Thu, 31 Oct 1996 14:57:45 GMT""}]","2008-02-03"
"chao-dyn/9610020","Bronius Kaulakys","B. Kaulakys, F. Ivanauskas and T. Meskauskas","Synchronization in the identically driven systems","4 pages, LaTeX, 2 figures (included in text). Published in Intern.
  Conf. Nonlinearity, Bifurcations and Chaos, Lodz, September 16-18, 1996, p.
  145-148",,,,"chao-dyn nlin.CD",,"  We investigate a transition from chaotic to nonchaotic behavior and
synchronization in an ensemble of systems driven by identical random forces. We
analyze the synchronization phenomenon in the ensemble of particles moving with
friction in the time-dependent potential and driven by the identical noise. We
define the threshold values of the parameters for transition from chaotic to
nonchaotic behavior and investigate dependencies of the Lyapunov exponents and
power spectral density on the nonlinearity of the systems and character of the
driven force.
","[{""version"":""v1"",""created"":""Thu, 31 Oct 1996 14:29:33 GMT""}]","2008-02-03"
"cmp-lg/9610006","Wolfgang Lezius","Wolfgang Lezius, Reinhard Rapp and Manfred Wettler (University of
  Paderborn)","A Morphology-System and Part-of-Speech Tagger for German","10 pages","In:D.Gibbon,ed.,Natural Language Processing and Speech Technology.
  Results of the 3rd KONVENS Conference. Mouton de Gruyter, Berlin, 1996.",,,"cmp-lg cs.CL",,"  This paper presents an integrated tool for German morphology and statistical
part-of-speech tagging which aims at making some well established methods
widely available. The software is very user friendly, runs on any PC and can be
downloaded as a complete package (including lexicon and documentation) from the
World Wide Web. Compared with the performance of other tagging systems the
tagger produces similar results.
","[{""version"":""v1"",""created"":""Wed, 30 Oct 1996 17:34:30 GMT""}]","2008-02-03"
"cond-mat/9610212","Brian Davies","Brian Davies and Ingo Peschel (FU Berlin)","A unified treatment of Ising model magnetizations","Plain Tex, 30 pages, 21 figures in eps format. Revised for
  publication in Annalen der Physik","Annalen Phys. 6 (1997) 176-214","10.1002/andp.19975090304",,"cond-mat.stat-mech hep-th",,"  We show how the spontaneous bulk, surface and corner magnetizations in the
square lattice Ising model can all be obtained within one approach. The method
is based on functional equations which follow from the properties of corner
transfer matrices and vertex operators and which can be derived graphically. In
all cases, exact analytical expressions for general anisotropy are obtained.
Known results, including several for which only numerical computation was
previously possible, are verified and new results related to general anisotropy
and corner angles are obtained.
","[{""version"":""v1"",""created"":""Wed, 30 Oct 1996 21:00:00 GMT""},{""version"":""v2"",""created"":""Tue, 26 Nov 1996 14:02:00 GMT""}]","2009-10-28"
"cond-mat/9610214","Richard Berkovits","R. Berkovits and B. L. Altshuler","Compressibility, capacitance and ground state energy fluctuations in a
  weakly interacting quantum dot","REVTeX, 23 pages, 6 figures, accepted for publication in PRB","Phys. Rev. B 55, 5297 (1997).","10.1103/PhysRevB.55.5297",,"cond-mat.mes-hall",,"  We study the effect of electron-electron (e-e) interactions on
compressibility, capacitance and inverse compressibility of electrons in a
quantum dot or a small metallic grain. The calculation is performed in the
random-phase approximation. As expected, the ensemble-averaged compressibility
and capacitance decreases as a function of the interaction strength, while the
mean inverse compressibility increases. Fluctuations of the compressibility are
found to be strongly suppressed by the e-e interactions. Fluctuations of the
capacitance and inverse compressibility also turn out to be much smaller than
their averages. The analytical calculations are compared with the results of a
numerical calculation for the inverse compressibility of a disordered
tight-binding model. Excellent agreement for weak interaction values is found.
Implications for the interpretation of current experimental data are discussed.
","[{""version"":""v1"",""created"":""Wed, 30 Oct 1996 16:45:44 GMT""}]","2009-10-28"
"cond-mat/9610215","Mark Bowick","Mark Bowick, Philippe Di Francesco, Olivier Golinelli and Emmanuel
  Guitter","Discrete Folding","LaTeX, 13 pages, 11 eps/ps figures: To appear in the Proceedings of
  the 4th Chia Meeting on ""Condensed Matter and High-Energy Physics"" (World
  Scientific, Singapore)",,,"SU-4240-636 & Saclay T96/069","cond-mat.stat-mech hep-th",,"  Models of folding of a triangular lattice embedded in a discrete space are
studied as simple models of the crumpling transition of fixed-connectivity
membranes. Both the case of planar folding and three-dimensional folding on a
face-centered-cubic lattice are treated. The 3d-folding problem corresponds to
a 96-vertex model and exhibits a first-order folding transition from a crumpled
phase to a completely flat phase as the bending rigidity increases.
","[{""version"":""v1"",""created"":""Wed, 30 Oct 1996 20:59:34 GMT""}]","2008-02-03"
"cond-mat/9610216",,"Christoph J. Halboth and Walter Metzner","Fermi Surface of the 2D Hubbard Model at Weak Coupling","4 pages, LaTeX2e, 5 embedded EPS figures, accepted to be published in
  Z. Phys. B",,"10.1007/s002570050318",,"cond-mat.str-el",,"  We calculate the interaction-induced deformation of the Fermi surface in the
two-dimensional Hubbard model within second order perturbation theory. Close to
half-filling, interactions enhance anisotropies of the Fermi surface, but they
never modify the topology of the Fermi surface in the weak coupling regime.
","[{""version"":""v1"",""created"":""Wed, 30 Oct 1996 17:45:27 GMT""},{""version"":""v2"",""created"":""Mon, 2 Dec 1996 13:45:28 GMT""}]","2009-10-28"
"cond-mat/9610218","Bernhard Mikeska","Bernhard Mikeska (University Hamburg, Germany)","A Monte Carlo Renormalization Group Approach to the Bak-Sneppen model","11 pages, REVTex, 2 Postscript figures included","Phys.Rev. E55 (1997) 3708-3711","10.1103/PhysRevE.55.3708","DESY 96-227","cond-mat adap-org nlin.AO",,"  A recent renormalization group approach to a modified Bak-Sneppen model is
discussed. We propose a self-consistency condition for the blocking scheme to
be essential for a successful RG-method applied to self-organized criticality.
A new method realizing the RG-approach to the Bak-Sneppen model is presented.
It is based on the Monte-Carlo importance sampling idea. The new technique
performs much faster than the original proposal. Using this technique we
cross-check and improve previous results.
","[{""version"":""v1"",""created"":""Thu, 31 Oct 1996 14:07:07 GMT""}]","2009-10-28"
"cond-mat/9610219","Jean Marc Robin","J. M. Robin","Spectral Functions for the Holstein Model","3 pages, Latex file, 1 postscript figure","Phys. Rev. B, 56 (1997) 13 634",,,"cond-mat.str-el",,"  We perform an unitary transformation for the symmetric phonon mode of the
Holstein molecular crystal hamiltonian. We show how to compute the electronic
spectral functions by exact numerical diagonalisation of an effective
hamiltonian fully taking account of the symmetric phonon mode, usually
discarded.
","[{""version"":""v1"",""created"":""Thu, 31 Oct 1996 15:19:26 GMT""},{""version"":""v2"",""created"":""Tue, 5 Nov 1996 14:44:10 GMT""}]","2008-02-03"
"cond-mat/9610220","Fujimoto Satoshi","Satoshi Fujimoto (Department of Physics, Kyoto University) and Norio
  Kawakami (Department of Applied Physics, and Department of Material and Life
  Science, Osaka University)","Effect of Umklapp Scattering on the Conductance in Quantum Wires","8 pages, style files included, to appear in J. Phys. Soc. Jpn",,"10.1143/JPSJ.65.3700",,"cond-mat.mes-hall",,"  We investigate the system-size dependence as well as the temperature
dependence of the conductance in 1D electron systems, paying particular
attention to the effect of Umklapp scattering. By taking into account the
renormalization of the external potential due to electron-electron interaction,
the correction to the conductance, 2e^2/h, due to Umklapp scattering is
estimated perturbatively. The Tomonaga-Luttinger liquid parameter appears in
the conductance via the system-size and temperature dependence.
","[{""version"":""v1"",""created"":""Thu, 31 Oct 1996 14:12:04 GMT""}]","2009-10-28"
"cond-mat/9610221","German Sierra","G. Sierra and T. Nishino","The Density Matrix Renormalization Group Method applied to Interaction
  Round a Face Hamiltonians","22 pages, Latex, 18 figures in Postscript files","Nucl.Phys. B495 (1997) 505","10.1016/S0550-3213(97)00217-4",,"cond-mat.stat-mech hep-lat hep-th",,"  Given a Hamiltonian with a continuous symmetry one can generally factorize
that symmetry and consider the dynamics on invariant Hilbert Spaces. In
Statistical Mechanics this procedure is known as the vertex-IRF map, and in
certain cases, like rotational invariant Hamiltonians, can be implemented via
group theoretical techniques. Using this map we translate the DMRG method,
which applies to 1d vertex Hamiltonians, into a formulation adequate to study
IRF Hamiltonians. The advantage of the IRF formulation of the DMRG method ( we
name it IRF-DMRG), is that the dimensions of the Hilbert Spaces involved in
numerical computations are smaller than in the vertex-DMRG, since the
degeneracy due to the symmetry has been eliminated. The IRF-DMRG admits a
natural and geometric formulation in terms of the paths or string algebras used
in Exactly Integrable Systems and Conformal Field Theory. We illustrate the
IRF-DMRG method with the study of the SOS model which corresponds to the spin
1/2 Heisenberg chain and the RSOS models with Coxeter diagram of type A, which
correspond to the quantum group invariant XXZ chain.
","[{""version"":""v1"",""created"":""Thu, 31 Oct 1996 15:22:32 GMT""}]","2009-10-28"
"gr-qc/9610068","Jose Geraldo Pereira","R. Aldrovandi and J. G. Pereira","The Case for a Gravitational de Sitter Gauge Theory","20 pages, standard latex, no figures",,,"IFT-P.052/95","gr-qc",,"  With the exception of gravitation, the known fundamental interactions of
Nature are mediated by gauge fields. A comparison of the candidate groups for a
gauge theory possibly describing gravitation favours the Poincar\'e group as
the obvious choice. This theory gives Einstein's equations in a particular
case, and Newton's law in the static non-relativistic limit, being seemingly
sound at the classical level. But it comes out that it is not quantizable. The
usual procedure of adding counterterms to make it a consistent and
renormalizable theory leads to two possible theories, one for each of the two
de Sitter groups, SO(4,1) and SO(3,2). The consequences of changing from the
Poincar\'e to the de Sitter group, as well as the positive aspects,
perspectives and drawbacks of the resulting theory are discussed.
","[{""version"":""v1"",""created"":""Wed, 30 Oct 1996 21:25:23 GMT""}]","2007-05-23"
"gr-qc/9610069","Carsten Gundlach","Carsten Gundlach","Echoing and scaling in Einstein-Yang-Mills critical collapse","13 pages, Revtex, one important reference corrected","Phys.Rev. D55 (1997) 6002-6013","10.1103/PhysRevD.55.6002",,"gr-qc",,"  We confirm recent numerical results of echoing and mass scaling in the
gravitational collapse of a spherical Yang-Mills field by constructing the
critical solution and its perturbations as an eigenvalue problem. Because the
field equations are not scale-invariant, the Yang-Mills critical solution is
asymptotically, rather than exactly, self-similar, but the methods for dealing
with discrete self-similarity developed for the real scalar field can be
generalized. We find an echoing period Delta = 0.73784 +/- 0.00002 and critical
exponent for the black hole mass gamma = 0.1964 +/- 0.0007.
","[{""version"":""v1"",""created"":""Wed, 30 Oct 1996 19:01:15 GMT""},{""version"":""v2"",""created"":""Mon, 4 Nov 1996 15:58:06 GMT""}]","2009-10-28"
"gr-qc/9610070","Luis Anchordoqui","Luis A. Anchordoqui, Santiago Perez Bergliaffa and Diego F. Torres","Brans-Dicke wormholes in nonvacuum spacetime","Minor corrections, to be published in Phys. Rev. D","Phys.Rev. D55 (1997) 5226-5229","10.1103/PhysRevD.55.5226",,"gr-qc",,"  Analytical wormhole solutions in Brans-Dicke theory in the presence of matter
are presented. It is shown that the wormhole throat must not be necessarily
threaded with exotic matter.
","[{""version"":""v1"",""created"":""Wed, 30 Oct 1996 23:36:13 GMT""},{""version"":""v2"",""created"":""Tue, 4 Mar 1997 18:40:37 GMT""}]","2009-10-28"
"gr-qc/9610071","Jorma Louko","Jorma Louko, Jonathan Z. Simon, and Stephen N. Winters-Hilt","Hamiltonian thermodynamics of a Lovelock black hole","22 pages, REVTeX v3.0","Phys.Rev.D55:3525-3535,1997","10.1103/PhysRevD.55.3525","PP97--52, WISC--MILW--96--TH--26","gr-qc hep-th",,"  We consider the Hamiltonian dynamics and thermodynamics of spherically
symmetric spacetimes within a one-parameter family of five-dimensional Lovelock
theories. We adopt boundary conditions that make every classical solution part
of a black hole exterior, with the spacelike hypersurfaces extending from the
horizon bifurcation three-sphere to a timelike boundary with fixed intrinsic
metric. The constraints are simplified by a Kucha\v{r}-type canonical
transformation, and the theory is reduced to its true dynamical degrees of
freedom. After quantization, the trace of the analytically continued Lorentzian
time evolution operator is interpreted as the partition function of a
thermodynamical canonical ensemble. Whenever the partition function is
dominated by a Euclidean black hole solution, the entropy is given by the
Lovelock analogue of the Bekenstein-Hawking entropy; in particular, in the low
temperature limit the system exhibits a dominant classical solution that has no
counterpart in Einstein's theory. The asymptotically flat space limit of the
partition function does not exist. The results indicate qualitative robustness
of the thermodynamics of five-dimensional Einstein theory upon the addition of
a nontrivial Lovelock term.
","[{""version"":""v1"",""created"":""Wed, 30 Oct 1996 22:56:56 GMT""}]","2014-11-17"
"gr-qc/9610072","Jose Ademir Sales de Lima","A. Maia Jr.(Brown and Unicamp) and J. A. S. Lima (UFRN and Brown)","D-Dimensional Radiative Plasma: A Kinetic Approach","28 pages, 1 figure, uses REVTEX","Class.Quant.Grav.15:2271-2288,1998","10.1088/0264-9381/15/8/011","BROWN-HET-1059","gr-qc",,"  The covariant kinetic approach for the radiative plasma, a mixture of a
relativistic moving gas plus radiation quanta (photons, neutrinos, or
gravitons) is generalized to D spatial dimensions. The operational and physical
meaning of Eckart's temperature is reexamined and the D-dimensional expressions
for the transport coefficients (heat conduction, bulk and shear viscosity) are
explicitly evaluated to first order in the mean free time of the radiation
quanta. Weinberg's conclusion that the mixture behaves like a relativistic
imperfect simple fluid (in Eckart's formulation) depends neither on the number
of spatial dimensions nor on the details of the collisional term. The case of
Thomson scaterring is studied in detail, and some consequences for higher
dimensional cosmologies are also discussed.
","[{""version"":""v1"",""created"":""Thu, 31 Oct 1996 03:45:43 GMT""}]","2008-11-26"
"gr-qc/9610073",,"Alexandr K. Guts, Egor B. Grinkevich","Toposes in General Theory of Relativity","13 pages, LATEX, email guts@univer.omsk.su, grinkev@univer.omsk.su",,,,"gr-qc",,"  We study in this paper different topos-theoretical approaches to the problem
of construction of General Theory of Relativity. In general case the resulting
space-time theory will be non-classical, different from that of the usual
Einstein theory of space-time. This is a new theory of space-time, created in a
purely logical manner. Four possibitities are investigated: axiomatic approach
to causal theory of space-time, the smooth toposes as a models of Theory of
Relativity, Synthetic Theory of Relativity, and space-time as Grothendieck
topos.
","[{""version"":""v1"",""created"":""Thu, 31 Oct 1996 14:18:34 GMT""}]","2007-05-23"
"hep-ex/9610009","Marina Artuso","Marina Artuso (Syracuse University)","B Decay Studies at Cleo","25 pages, 11 figures, Latex","Nucl.Instrum.Meth. A384 (1996) 39-47","10.1016/S0168-9002(96)00948-5","HEPSY 96-2","hep-ex hep-ph",,"  Weak decays of heavy flavored hadrons are sensitive probes of several facets
of the Standard Model. In particular the experimental study of B meson
semileptonic decaysis starting to pin down the quark mixing parameters in the
Cabibbo Kobayashi Maskawa matrix. In addition, some features of the
non--perturbative regime of the strong interaction are probed by these decays.
New results from the CLEO experiment at the CESR electron-positron collider,
based on a data sample of up to 3.5 inverse femtobarn, provide crucial
information on both of these aspects of heavy flavor phenomenology.
","[{""version"":""v1"",""created"":""Thu, 31 Oct 1996 15:24:30 GMT""}]","2009-10-28"
"hep-ph/9610541","R. Kauffman","Russel P. Kauffman, Satish V. Desai, Dipesh Risal (Franklin and
  Marshall College)","Production of a Higgs Boson Plus Two Jets in Hadronic Collisions","21 pages, Latex, 10 Postscript figures, submitted to Phys. Rev. D","Phys.Rev.D55:4005-4015,1997; Erratum-ibid.D58:119901,1998","10.1103/PhysRevD.55.4005 10.1103/PhysRevD.58.119901","F&M96/3","hep-ph",,"  We consider the production of a Standard Model Higgs boson accompanied by two
jets in hadronic collisions. We work in the limit that the top quark is much
heavier than the Higgs boson and use an effective Lagrangian for the
interactions of gluons with the Higgs boson. In addition to the previously
computed four-gluon process, we compute the the amplitudes involving two
quarks, two gluons and the Higgs boson and those involving four quarks and the
Higgs boson. We exhibit the form of our results in the small-p_H and
factorization limits. We present numerical results for root S of 14 TeV and
root S of 2 TeV. We find that the dominant processes are gg -> ggH and qg -> qg
H with the former (latter) contributing about 60% (40%) of the cross section at
root S of 14 TeV and the two processes each contributing about half the cross
section at root S of 2 TeV. All other processes are negligible at both
energies.
","[{""version"":""v1"",""created"":""Wed, 30 Oct 1996 16:42:35 GMT""}]","2014-11-17"
"hep-ph/9610542","Maggie Best","John N. Bahcall and Marc H. Pinsonneault","Status of Solar Models","LaTeX file, 15 pages. Problem with postscript figure placement fixed.
  To appear in proceedings of NEUTRINO 96, Helsinki, Finland, June 13-19, 1996
  (World Scientific, Singapore)","in Neutrino 96, Proceedings of the 17th International Conference
  on Neutrino Physics and Astrophysics, Helsinki, Finland, June 13-19, 1996,
  eds. Kari Enqvist, Katri Huitu, and Jukka Maalampi (World Scientific,
  Singapore, 1997), pp. 56-70",,"IASSNS-AST 96/53","hep-ph astro-ph nucl-ex",,"  The neutrino fluxes calculated from 14 standard solar models published
recently in refereed journals are inconsistent with the results of the 4
pioneering solar neutrino experiments if nothing happens to the neutrinos after
they are created in the solar interior. The sound speeds calculated from
standard solar models are in excellent agreement with helioseismological
measurements of sound speeds. Some statements made by Dar at Neutrino 96 are
answered here.
","[{""version"":""v1"",""created"":""Wed, 30 Oct 1996 17:04:49 GMT""},{""version"":""v2"",""created"":""Thu, 31 Oct 1996 16:06:37 GMT""}]","2008-02-03"
"hep-ph/9610543","Changhao Jin","Changhao Jin","Nonperturbative QCD Contributions to the Semileptonic Decay Width of the
  B Meson","16 pages, Latex, 3 eps figures included, published version
  (discussion extended, references updated, the main result unchanged)","Phys.Rev.D56:2928-2933,1997","10.1103/PhysRevD.56.2928","LMU 08/96","hep-ph",,"  Nonperturbative QCD contributions to the inclusive semileptonic decay of the
B meson consist of the dynamic and kinematic components. We calculate the decay
width in an approach based on the light-cone expansion and the heavy quark
effective theory, which is able to include both components of nonperturbative
QCD contributions. The kinematic component results in the phase-space extension
and is shown to be quantitatively crucial, which could increase the decay width
significantly. We find that the semileptonic decay width is enhanced by
long-distance strong interactions by +(9\pm 6)%. This analysis is used to
determine the CKM matrix element |V_{cb}| with a controlled theoretical error.
Implications of the phase-space effects for the nonleptonic decay widths of b
hadrons are briefly discussed. The experimental evidence for the phase-space
effects is pointed out.
","[{""version"":""v1"",""created"":""Wed, 30 Oct 1996 19:19:55 GMT""},{""version"":""v2"",""created"":""Fri, 19 Sep 1997 13:53:37 GMT""}]","2014-11-17"
"hep-ph/9610544","Ian Hinchliffe","I. Hinchliffe, F.E. Paige, M.D. Shapiro, J. Soderqvist, and W. Yao","Precision SUSY Measurements at LHC","52 pages, Latex with 42 postscript figures. Postscript version also
  at http://www-physics.lbl.gov/www/theorygroup/papers/39412.ps","Phys.Rev.D55:5520-5540,1997","10.1103/PhysRevD.55.5520","LBNL-39412","hep-ph",,"  If supersymmetry exists at the electroweak scale, then it should be
discovered at the LHC. Determining masses, of supersymmetric particles however,
is more difficult. In this paper, methods are discussed to determine
combinations of masses and of branching ratios precisely from experimentally
observable distributions. In many cases such measurements alone can greatly
constrain the particular supersymmetric model and determine its parameters with
an accuracy of a few percent. Most of the results shown correspond to one year
of running at LHC at ``low luminosity'.
","[{""version"":""v1"",""created"":""Wed, 30 Oct 1996 17:59:48 GMT""}]","2008-11-26"
