"hep-ph/9610545","Rainer Plaga","R. Plaga (Max-Planck-Institut fuer Physik)","A demonstration that the observed neutrinos are not Majorana particles","This manuscript is incorrect, and is replaced by a completely
  rewritten version hep-ph/0108052. Following the advice of arXiv.org I leave
  the original version on the server. See http://hegra1.mppmu.mpg.de/majorana
  for further information",,,,"hep-ph",,"  Please see revised version hep-ph/0108052. The ps version of the manuscript
contains the original abstract and body.
","[{""version"":""v1"",""created"":""Wed, 30 Oct 1996 18:20:05 GMT""},{""version"":""v2"",""created"":""Tue, 1 Apr 1997 11:46:49 GMT""},{""version"":""v3"",""created"":""Mon, 6 Aug 2001 10:08:48 GMT""}]","2008-02-03"
"hep-ph/9610546","D'Hoker Eric","Eric D'Hoker, Yukihiro Mimura and Norisuke Sakai","Gauge Symmetry Breaking through Soft Masses in Supersymmetric Gauge
  Theories","Contribution to Inauguration Conferference of Asia Pacific Center for
  Theoretical Physics, 4-10 June, 1996, Seoul National University; LaTeX, no
  macros needed",,,"UCLA/96/TEP/39, TIT/HEP-340","hep-ph",,"  Effects of soft breaking in N=1 supersymmetric gauge theories are studied.
For N_f < N_c, we include the dynamics of the non-perturbative superpotential
and use the original (s)quark and gauge fields. For N_f > N_c +1, we formulate
the dynamics in terms of dual (s)quarks and a dual gauge group SU(N_f-N_c). The
mass squared of the squarks can be negative triggering spontaneous breakdown of
flavor and color symmetry. The general condition for stability of the vacuum is
derived. We determine the breaking pattern, determine the spectrum and argue
that the masses vary smoothly as one crosses from the Higgs phase into the
confining phase, thus exhibiting complementarity.
","[{""version"":""v1"",""created"":""Thu, 31 Oct 1996 02:27:20 GMT""}]","2007-05-23"
"hep-ph/9610550","Sergio Lupia","S. Lupia (Max-Planck-Inst. fuer Physik, Munich)","The soft limit of the energy spectra in QCD jets","LaTeX, 7 pages, 1 figure, uses sprocl.sty and epsfig.sty, to appear
  in Proc. of the XXVI International Symposium on Multiparticle Dynamics, Faro,
  Portugal, September 1st-5th, 1996",,,"MPI-PhT/96-91","hep-ph",,"  A scaling law for the one-particle invariant density E dn/d^3p at small
momenta is observed in experimental data. We show that these results are
consistent with the predictions of the analytical QCD approach, based on
Modified Leading Log Approximation plus Local Parton Hadron Duality, which
includes colour coherence in soft gluon bremsstrahlung.
","[{""version"":""v1"",""created"":""Thu, 31 Oct 1996 11:00:42 GMT""}]","2007-05-23"
"hep-ph/9610551","Nikolai Kochelev","N.I. Kochelev, (JINR, Dubna)","Anomalous Quark Chromomagnetic Moment Induced by Instantons","5 pages, Latex, no figures. Talk presented at the XIII International
  Seminar on High Energy Physics Problems, 2-7 September, Dubna, Russia. One
  reference is corrected","Phys.Lett. B426 (1998) 149-153","10.1016/S0370-2693(98)00262-7",,"hep-ph",,"  It is shown that the quark-gluon interaction induced by instantons leads to
the quark anomalous chromomagnetic moment. In the instanton-liquid model for
the QCD vacuum, the chromomagnetic moment is $\mu_a=-\frac{\pi f}{2\alpha_s}$,
where f is the packing fraction of instantons in the vacuum.
","[{""version"":""v1"",""created"":""Thu, 31 Oct 1996 10:44:28 GMT""},{""version"":""v2"",""created"":""Sat, 9 Nov 1996 07:58:07 GMT""}]","2009-10-30"
"hep-th/9610243","Mariusz Dabrowski","Mariusz P. Dabrowski and Arne. L. Larsen","Null Strings in Schwarzschild Spacetime","16 pages, REVTEX, no figures","Phys.Rev.D55:6409-6414,1997","10.1103/PhysRevD.55.6409","Alberta Thy 38-96","hep-th gr-qc",,"  The null string equations of motion and constraints in the Schwarzschild
spacetime are given. The solutions are those of the null geodesics of General
Relativity appended by a null string constraint in which the ""constants of
motion"" depend on the world-sheet spatial coordinate. Because of the extended
nature of a string, the physical interpretation of the solutions is completely
different from the point particle case. In particular, a null string is
generally not propagating in a plane through the origin, although each of its
individual points is. Some special solutions are obtained and their physical
interpretation is given. Especially, the solution for a null string with a
constant radial coordinate $r$ moving vertically from the south pole to the
north pole around the photon sphere, is presented. A general discussion of
classical null/tensile strings as compared to massless/massive particles is
given. For instance, tensile circular solutions with a constant radial
coordinate $r$ do not exist at all. The results are discussed in relation to
the previous literature on the subject.
","[{""version"":""v1"",""created"":""Thu, 31 Oct 1996 11:57:29 GMT""}]","2014-11-18"
"hep-th/9610244","Yusuke Taniguchi","M. Bando, Y. Taniguchi and S. Tanimura","Dynamical Gauge Boson and Strong-Weak Reciprocity","19 pages, latex, 6 eps figures, a numbers of corrections are made in
  the text","Prog.Theor.Phys. 97 (1997) 665-678","10.1143/PTP.97.665","KU-AMP 96014, KUNS-1420 HE(TH) 96/15","hep-th",,"  It is proposed that asymptotically nonfree gauge theories are consistently
interpreted as theories of composite gauge bosons. It is argued that when
hidden local symmetry is introduced, masslessness and coupling universality of
dynamically generated gauge boson are ensured. To illustrate these ideas we
take a four dimensional Grassmannian sigma model as an example and show that
the model should be regarded as a cut-off theory and there is a critical
coupling at which the hidden local symmetry is restored. Propagator and vertex
functions of the gauge field are calculated explicitly and existence of the
massless pole is shown. The beta function determined from the $ Z $ factor of
the dynamically generated gauge boson coincides with that of an asymptotic
nonfree elementary gauge theory. Using these theoretical machinery we construct
a model in which asymptotic free and nonfree gauge bosons coexist and their
running couplings are related by the reciprocally proportional relation.
","[{""version"":""v1"",""created"":""Thu, 31 Oct 1996 13:15:17 GMT""},{""version"":""v2"",""created"":""Mon, 18 Nov 1996 11:30:22 GMT""}]","2009-10-30"
"hep-th/9610245","Gabor Etesi","Gabor Etesi","On the Strong CP Problem without Axion Field","This early trial has been withdrawn by the author. For a completed
  and published version cf. hep-th/0011157",,,,"hep-th gr-qc",,"  A detailed analysis of the vacuum structure of non-Abelian Yang--Mills
theories over generic asymptotically flat space-times is carried out in
hep-th/0011157.
","[{""version"":""v1"",""created"":""Thu, 31 Oct 1996 13:15:12 GMT""},{""version"":""v2"",""created"":""Tue, 12 May 1998 09:56:15 GMT""},{""version"":""v3"",""created"":""Wed, 13 May 1998 12:08:59 GMT""},{""version"":""v4"",""created"":""Fri, 29 May 1998 10:30:22 GMT""},{""version"":""v5"",""created"":""Fri, 17 Jul 1998 13:27:15 GMT""},{""version"":""v6"",""created"":""Thu, 6 May 1999 17:11:40 GMT""},{""version"":""v7"",""created"":""Wed, 11 Apr 2007 17:25:53 GMT""}]","2008-02-03"
"math/9610220",,"Boju Jiang, Shicheng Wang, Ying-Qing Wu","Homeomorphisms of 3-manifolds and the realization of Nielsen Number",,,,"MSRI 1996-074","math.GT",,"  The Nielsen Conjecture for Homeomorphisms asserts that any homeomorphism $f$
of a closed manifold is isotopic to a map realizing the Nielsen number of $f$,
which is a lower bound for the number of fixed points among all maps homotopic
to $f$. The main theorem of this paper proves this conjecture for all
orientation preserving maps on geometric or Haken 3-manifolds. It will also be
shown that on many manifolds all maps are isotopic to fixed point free maps.
  The proof is based on the understanding of homeomorphisms on 2-orbifolds and
3-manifolds. Thurston's classification of surface homeomorphisms will be
generalized to 2-dimensional orbifolds, which is used to study fiber preserving
maps of Seifert fiber spaces. Maps on most Seifert fiber spaces are indeed
isotopic to fiber preserving maps, with the exception of four manifolds and
orientation reversing maps on lens spaces or $S^3$. It will also be determined
exactly which manifolds have a unique Seifert fibration up to isotopy. These
informations will be used to deform a map to certain standard map on each piece
of the JSJ decomposition, as well as on the neighborhood of the decomposition
tori, which will make it possible to shrink each fixed point class to a single
point, and remove inessential fixed point classes.
","[{""version"":""v1"",""created"":""Thu, 31 Oct 1996 00:00:00 GMT""}]","2016-09-06"
"math/9610221",,"J. Maurice Rojas","Extensions and Corrections for: ``A Convex Geometric Approach to
  Counting the Roots of a Polynomial System''",,,,"MSRI 1996-075","math.AG cs.DS",,"  This brief note corrects some errors in the paper quoted in the title,
highlights a combinatorial result which may have been overlooked, and points to
further improvements in recent literature.
","[{""version"":""v1"",""created"":""Thu, 31 Oct 1996 00:00:00 GMT""}]","2008-02-03"
"nucl-th/9610047","Craig Roberts","Yu. Kalinovsky, K. L. Mitchell and C. D. Roberts","K_{l 3} and \pi_{e 3} transition form factors","11 pages (incl. 3 figures), elsart.sty, epsf.sty","Phys.Lett.B399:22-28,1997","10.1016/S0370-2693(97)00271-2","ANL-PHY-8585-TH-96, TRI-PP-96-63","nucl-th hep-ph",,"  $K_{\ell 3}$ and $\pi_{e 3}$ transition form factors are calculated as an
application of Dyson-Schwinger equations. The role of nonanalytic contributions
to the quark--W-boson vertex is elucidated. A one-parameter model for this
vertex provides a uniformly good description of these transitions, including
the value of the scalar form factor of the kaon at the Callan-Treiman point.
The $K_{\ell 3}$ form factors, $f_\pm^K$, are approximately linear on $t\in
[m_e^2,m_\mu^2]$ and have approximately the same slope. $f_-^K(0)$ is a measure
of the Euclidean constituent-quark mass ratio: $M^E_s/M^E_u$. In the isospin
symmetric limit: $-f_+^\pi(0)= F_\pi(t)$, the electromagnetic pion form factor,
and $f_-^\pi(t)\equiv 0$.
","[{""version"":""v1"",""created"":""Wed, 30 Oct 1996 23:22:29 GMT""}]","2010-03-04"
"nucl-th/9610048","Tomoyuki Maruyama","Tomoyuki Maruyama, Hiromasa Shin, Hirotsugu Fujii, Toshitaka Tatsumi","K+(K0)- Condensation in Highly Dense Matter with the Relativistic
  Mean-Field Theory","12pages, Latex is used, 3 Postscript figures are available by request
  from tomo@hadron05.tokai.jaeri.go.jp","Prog.Theor.Phys. 102 (1999) 809-818","10.1143/PTP.102.809",,"nucl-th",,"  Properties of dense hadronic matter including strange particles are studied
within the relativistic mean-field theory (RMFT). The possibility of kaon
condensation is reexamined, and a simple condition is found for the parameters
included in RMFT.
","[{""version"":""v1"",""created"":""Thu, 31 Oct 1996 13:51:09 GMT""},{""version"":""v2"",""created"":""Fri, 1 Nov 1996 19:13:57 GMT""}]","2009-10-30"
"physics/9610021","Lenderink G.","G. Lenderink and R.J. Haarsma (KNMI, The Netherlands)","On the mechanism of decadal oscillations in a coarse resolution ocean
  model","45 pages, Latex, psfig, submitted to J. Phys. Oceanogr",,,"KNMI/VO-96-02","physics.ao-ph",,"  The mechanism that causes an interdecadal oscillation in a coarse resolution
sector ocean model forced by mixed boundary conditions is studied. The
oscillation is characterized by large fluctuations in convective activity and
air/sea heat exchange on a decadal time scale. When the convective activity is
large, a strengthening of the southeastward surface flow advects more
relatively fresh water from the northwestern part of the basin into the
convective area, which reduces the convective activity. Similarly, when the
convective activity is small, the flow of relatively fresh water is weak, which
enables the expansion of the convective area. The oscillation critically
depends on how the ocean circulation, and especially the surface circulation,
responds to anomalous convective activity. Horizontal boundaries turn out to
play an important role in the dynamical response of the ocean circulation. That
the dynamical reponse is essential to the oscillation is confirmed with two
simple (conceptual) models, and some idealized ocean experiments.
","[{""version"":""v1"",""created"":""Wed, 30 Oct 1996 16:18:23 GMT""}]","2008-02-03"
"physics/9610022","Athanassios","Kenji Kiyohara, Keith E. Gubbins and Athanassios Z. Panagiotopoulos","Phase Coexistence Properties of Polarizable Stockmayer Fluids","11 pages, including 9 figures. Data for figures available from
  http://argo.cheme.cornell.edu/papers/pol_st_96/ . Submitted to J. Chem. Phys",,"10.1063/1.473082",,"physics.chem-ph cond-mat.soft cond-mat.stat-mech physics.comp-ph",,"  We report the phase coexistence properties of polarizable Stockmayer fluids
of reduced permanent dipoles equal to 1.0 and 2.0 and reduced polarizabilities
equal to 0.00, 0.03, and 0.06, calculated by a series of grand canonical Monte
Carlo simulations with the histogram reweighting method. In the histogram
reweighting method, the distributions of density and energy calculated in Grand
Canonical Monte Carlo simulations are stored in histograms and analyzed to
construct the grand canonical partition function of the system. All
thermodynamic properties are calculated from the grand partition function. The
results are compared with Wertheim's renormalization perturbation theory.
Deviations between theory and simulation results for the coexistence envelope
are near 2% for the lower dipole moment and 10 % for the higher dipole moment
we studied.
","[{""version"":""v1"",""created"":""Wed, 30 Oct 1996 18:21:37 GMT""}]","2009-10-30"
"physics/9610023","Ronald Cohen","Lars Stixrude, Ronald E. Cohen, Rici Yu and Henry Krakauer","Prediction of Phase Transition in CaSiO$_3$ Perovskite and Implications
  for Lower Mantle Structure","latex, revtex, 3 ps figures","American Mineralogist, 81, 1293-1296 (1996)",,,"physics.geo-ph cond-mat.mtrl-sci",,"  First principles linear response calculations are used to investigate the
lattice dynamics of what is thought to be the third most abundant phase in the
lower mantle, CaSiO_3 perovskite. The commonly assumed cubic structure (Pm3m)
is found to be dynamically unstable at all pressures, exhibiting unstable modes
along the Brillouin zone edge from the M-point to the R-point. Based on these
results, we predict that the ground state structure of CaSiO_3 perovskite is a
distorted phase with lower than cubic symmetry. We predict that a phase
transition occurs in CaSiO_3 perovskite within the earth's lower mantle from
the low temperature distorted phase to the cubic phase at high temperature. The
predicted phase transition provides a possible explanation of some of the
seismological observations of reflective features within the lower mantle.
","[{""version"":""v1"",""created"":""Thu, 31 Oct 1996 14:12:15 GMT""}]","2016-09-08"
"quant-ph/9610046","Tommaso Calarco","Tommaso Calarco (Dipartimento di fisica - INFN, Ferrara, Italy) and
  Roberto Onofrio (Dipartimento di fisica - INFN, Padova, Italy)","Quantum nondemolition measurements on two-level atomic systems and
  temporal Bell inequalities","7 pages, 2 figures, to appear in Appl. Phys. B",,"10.1007/s003400050158",,"quant-ph",,"  The evolution of a two-level system subjected to stimulated transitions which
is undergoing a sequence of measurements of the level occupation probability is
evaluated. Its time correlation function is compared to the one obtained
through the pure Schroedinger evolution. Systems of this kind have been
recently proposed for testing the quantum mechanical predictions against those
of macrorealistic theories, by means of temporal Bell inequalities. The
classical requirement of noninvasivity, needed to define correlation functions
in the realistic case, finds a quantum counterpart in the quantum nondemolition
condition. The consequences on the observability of quantum mechanically
predicted violations to temporal Bell inequalities are drawn and compared to
the already dealt case of the rf-SQUID dynamics.
","[{""version"":""v1"",""created"":""Thu, 31 Oct 1996 12:48:40 GMT""}]","2009-10-30"
"solv-int/9610013","Nalini Joshi","Nalini Joshi and Johannes A. Petersen","Complex Blow-Up in Burgers' Equation: an Iterative Approach","11 pages in LaTeX. To appear in Bull. Aust. Math. Soc",,,,"solv-int nlin.SI",,"  We show that for a given holomorphic noncharacteristic surface S in
two-dimensional complex space, and a given holomorphic function on S, there
exists a unique meromorphic solution of Burgers' equation which blows up on S.
This proves the convergence of the formal Laurent series expansion found by the
Painlev\'e test. The method used is an adaptation of Nirenberg's iterative
proof of the abstract Cauchy-Kowalevski theorem.
","[{""version"":""v1"",""created"":""Thu, 31 Oct 1996 00:57:13 GMT""}]","2008-02-03"
