"astro-ph/9608039","Rachel Pildis","Rachel A. Pildis (CfA) and Stacy S. McGaugh (DTM)","Could a Local Group X-Ray Halo Affect the X-Ray and Microwave
  Backgrounds?","8 pages, to appear in The Astrophysical Journal Letters, paper can
  also be obtained at http://hea-www.harvard.edu/~pildis/smio.html",,"10.1086/310304",,"astro-ph",,"  Suto et al. (1996, astro-ph/9602061 and ApJ, 461, L33) have suggested that an
X-ray halo in the Local Group might explain both the observed low-energy excess
in the X-ray background and the quadrupole anisotropy in the cosmic microwave
background. Recent observations of poor groups of galaxies by the ROSAT PSPC
set reasonable limits on how extensive and dense such a halo could be. The poor
groups most similar to the Local Group do not have a detectable halo, and the
upper limits of these observations suggest that any Local Group halo would be
nearly two orders of magnitude too tenuous to produce the effects Suto et al.
(1996) discuss. In particular, the Sunyaev-Zel'dovich effect cannot contribute
significantly to the quadrupole anisotropy measured by COBE.
","[{""version"":""v1"",""created"":""Thu, 8 Aug 1996 18:17:00 GMT""}]","2009-10-28"
"astro-ph/9608041","Tom Abel","Peter Anninos, Yu Zhang, Tom Abel and Michael L. Norman (Laboratory
  for Computational Astrophysics at the National Center for Supercomputing
  Applications)","Cosmological Hydrodynamics with Multi-Species Chemistry and
  Nonequilibrium Ionization and Cooling","Latex and postscript, 24 pages, with 6 figures. The paper is also
  available at http://zeus.ncsa.uiuc.edu:8080/~abel/PGas/bib.html Submitted to
  New Astronomy",,"10.1016/S1384-1076(97)00009-2",,"astro-ph",,"  We have developed a method of solving for multi-species chemical reaction
flows in non--equilibrium and self--consistently with the hydrodynamic
equations in an expanding FLRW universe. The method is based on a backward
differencing scheme for the required stability when solving stiff sets of
equations and is designed to be efficient for three-dimensional calculations
without sacrificing accuracy. In all, 28 kinetic reactions are solved including
both collisional and radiative processes for the following nine separate
species: H, H+, He, He+, He++, H-, H2+, H2, and e-. The method identifies those
reactions (involving H- and H2+) ocurring on the shortest time scales,
decoupling them from the rest of the network and imposing equilibrium
concentrations to good accuracy over typical cosmological dynamical times.
Several tests of our code are presented, including radiative shock waves,
cosmological sheets, conservation constraints, and fully three-dimensional
simulations of CDM cosmological evolutions in which we compare our method to
results obtained when the packaged routine LSODAR is substituted for our
algorithms.
","[{""version"":""v1"",""created"":""Fri, 9 Aug 1996 02:16:12 GMT""}]","2009-10-28"
"astro-ph/9608042","David Wands","David Wands and Juan Garcia-Bellido","Density Perturbations from Two-field Inflation","LaTeX 4 pages, talk presented at Les Journees Relativistes'96","Helv.Phys.Acta 69 (1996) 211-214",,"SUSSEX-AST-96/7-6, RCG-96/09","astro-ph",,"  We discuss metric perturbations produced during a period of inflation in the
early universe where two scalar fields evolve. The final scalar perturbation
spectrum can be calculated in terms of the perturbed expansion along
neighbouring trajectories in field-space. In the usual single field case this
is fixed by the values of the fields at horizon-crossing, but in the presence
of more than one field there is no longer a unique slow-roll trajectory. The
presence of entropy as well as adiabatic fluctuations means that the
super-horizon-sized metric perturbation $\zeta$ may no longer be conserved and
the evolution must be integrated along the whole of the subsequent trajectory.
In general there is an inequality between the ratio of tensor to scalar
perturbations and the tilt of the gravitational wave spectrum, which becomes an
equality when only adiabatic perturbations are possible and $\zeta$ is
conserved.
","[{""version"":""v1"",""created"":""Fri, 9 Aug 1996 09:49:13 GMT""}]","2007-05-23"
"astro-ph/9608043","Ian DellAntonio","Ian P. Dell'Antonio and J. Anthony Tyson (Bell Laboratories, Lucent
  Technologies)","Galaxy Dark Matter: Galaxy-Galaxy Lensing in the Hubble Deep Field","11 pages with 3 encapsulated postscript figures, Submitted to ApJL",,"10.1086/310378",,"astro-ph",,"  In this Letter we present calibrated observations of the average mass of
galaxies with 22< I < 25 in the Hubble Deep Field. We measure the mean mass
profile using the statistical gravitational lens distortion of faint blue
background galaxies, based on 2221 foreground-background pairs. The observed
weak lensing distortion is calibrated via full 3-D simulations and other HST
data on a foreground cluster of known mass. Inside a projected radius of 5
arcsec we find a 3\sigma detection of shear. Fitting to an isothermal mass
distribution, we find a shear of 0.066^{+0.018}_{-0.019} at a radius of
2\arcsec\ (\sim 8 ~ h^{-1} kpc). The (1\sigma) limits on the parameters for the
truncated isothermal model are \sigma_v =185^{+30}_{-35} km s^{-1}, r_{outer}
\ge 15 ~ h^{-1} kpc, and r_{core}= 0.6^{+1.3}_{-0.6} ~ h^{-1} kpc. This
corresponds to an average galaxy mass interior to 20 h^{-1} kpc of
5.9^{+2.5}_{-2.7}\times 10^{11} h^{-1} M_\odot. Inside 10 h^{-1} kpc, we find
an average rest-frame V band mass-to-light ratio of 11.4^{+6.0}_{-6.7} h
(M/L_V)_\odot.
","[{""version"":""v1"",""created"":""Fri, 9 Aug 1996 15:49:33 GMT""}]","2009-10-28"
"chao-dyn/9608008","prof. Victor Lvov","Emily S.C. Ching (Department of Physics, The Chinese University of
  Hong Kong, Shatin, Hong Kong) Victor S. L'vov (Department of Chemical
  Physics, Weizmann Institute of Science, Rehovot, Israel), Evgeni Podivilov
  (Institute of Automation and Electrometry, Ac. Sci. of Russia, Novosibirsk,
  Russia), and Itamar Procaccia (Department of Chemical Physics,
  WeizmannInstitute of Science, Rehovot, Israel)","On Conditional Statistics in Scalar Turbulence: Theory vs. Experiment","Phys. Rev. E, Submitted. REVTeX, 10 pages, 5 figs. (not included) PS
  Source of the paper with figure available at
  http://lvov.weizmann.ac.il/onlinelist.html#unpubl",,"10.1103/PhysRevE.54.6364",,"chao-dyn nlin.CD",,"  We consider turbulent advection of a scalar field $T(\B.r)$, passive or
active, and focus on the statistics of gradient fields conditioned on scalar
differences $\Delta T(R)$ across a scale $R$. In particular we focus on two
conditional averages $\langle\nabla^2 T\big|\Delta T(R)\rangle$ and
$\langle|\nabla T|^2\big|\Delta T(R) \rangle$. We find exact relations between
these averages, and with the help of the fusion rules we propose a general
representation for these objects in terms of the probability density function
$P(\Delta T,R)$ of $\Delta T(R)$. These results offer a new way to analyze
experimental data that is presented in this paper. The main question that we
ask is whether the conditional average $\langle\nabla^2 T\big| \Delta
T(R)\rangle$ is linear in $\Delta T$. We show that there exists a dimensionless
parameter which governs the deviation from linearity. The data analysis
indicates that this parameter is very small for passive scalar advection, and
is generally a decreasing function of the Rayleigh number for the convection
data.
","[{""version"":""v1"",""created"":""Fri, 9 Aug 1996 10:13:13 GMT""}]","2009-10-28"
"chao-dyn/9608009","Dr. Luca Salasnich, . D.","Fabio Sattin and Luca Salasnich","Chaotic features in classical scattering processes between ions and
  atoms","10 pages, Latex, 3 figures (available upon request to the authors),
  submitted to Journal of Physics B",,"10.1088/0953-4075/29/19/003",,"chao-dyn atom-ph nlin.CD",,"  A numerical study has been done of collisions between protons and hydrogen
atoms, treated as classical particles, at low impact velocities. The presence
of chaos has been looked for by investigating the processes with standard
techniques of the chaotic--scattering theory. The evidence of a sharp
transition from nearly regular scattering to fully developed chaos has been
found at the lower velocities.
","[{""version"":""v1"",""created"":""Fri, 9 Aug 1996 13:19:16 GMT""}]","2009-10-28"
"chao-dyn/9608010","Detlef Lohse","Michael Brenner (1), Sascha Hilgenfeldt (2), Detlef Lohse (2); ((1)
  Dept. of Math, MIT (2) Fachbereich Physik der Universit\""at Marburg, Germany)","Why air bubbles in water glow so easily","to appear in ``Nonlinear Physics of Complex Systems -- Current Status
  and Future Trends'', edited by J. Parisi, S. C. Mueller, and W. Zimmermann,
  (Springer, Berlin, October 1996)",,"10.1007/BFb0105431","Preprint 1996-6, Cambridge and Marburg","chao-dyn nlin.CD",,"  Sound driven gas bubbles in water can emit light pulses (sonoluminescence).
Experiments show a strong dependence on the type of gas dissolved in water. Air
is found to be one of the most friendly gases towards this phenomenon.
Recently, \cite{loh96} have suggested a chemical mechanism to account for the
strong dependence on the gas mixture: the dissociation of nitrogen at high
temperatures and its subsequent chemical reactions to highly water soluble
gases such as NO, NO$_2$, and/or NH$_3$. Here, we analyze the consequences of
the theory and offer detailed comparison with the experimental data of
Putterman's UCLA group. We can quantitatively account for heretofore
unexplained results. In particular, we understand why the argon percentage in
air is so essential for the observation of stable SL.
","[{""version"":""v1"",""created"":""Fri, 9 Aug 1996 13:39:01 GMT""}]","2009-10-28"
"chem-ph/9608002","Juergen Stockburger","Juergen T. Stockburger and C.H. Mak (University of Southern
  California, Los Angeles)","A Dynamical Theory of Electron Transfer: Crossover from Weak to Strong
  Electronic Coupling","11 pages, LaTeX, 8 Postscript figures to be published in J. Chem.
  Phys",,"10.1063/1.472667",,"chem-ph cond-mat physics.chem-ph",,"  We present a real-time path integral theory for the rate of electron transfer
reactions. Using graph theoretic techniques, the dynamics is expressed in a
formally exact way as a set of integral equations. With a simple approximation
for the self-energy, the rate can then be computed analytically to all orders
in the electronic coupling matrix element. We present results for the crossover
region between weak (nonadiabatic) and strong (adiabatic) electronic coupling
and show that this theory provides a rigorous justification for the salient
features of the rate expected within conventional electron transfer theory.
Nonetheless, we find distinct characteristics of quantum behavior even in the
strongly adiabatic limit where classical rate theory is conventionally thought
to be applicable. To our knowledge, this theory is the first systematic
dynamical treatment of the full crossover region.
","[{""version"":""v1"",""created"":""Thu, 8 Aug 1996 23:27:11 GMT""},{""version"":""v2"",""created"":""Fri, 9 Aug 1996 00:27:08 GMT""}]","2009-10-28"
"cmp-lg/9608004","Rob Freeman","Robert John Freeman","Patterns of Language - A Population Model for Language Structure","6 pages, Postscript",,,,"cmp-lg cs.CL",,"  A key problem in the description of language structure is to explain its
contradictory properties of specificity and generality, the contrasting poles
of formulaic prescription and generative productivity. I argue that this is
possible if we accept analogy and similarity as the basic mechanisms of
structural definition. As a specific example I discuss how it would be possible
to use analogy to define a generative model of syntactic structure.
","[{""version"":""v1"",""created"":""Fri, 9 Aug 1996 04:31:55 GMT""}]","2008-02-03"
"cond-mat/9608046","Thom Mason","T.E. Mason (University of Toronto) and G. Aeppli (NEC Research
  Institute)","Neutron Scattering Studies of Heavy Fermion Systems","17 pages, 9 figures (7 eps with epsfig and 2 ps), review to be
  published in Proceedings of the Copenhagen Symposium on Magnetism in Metals",,,,"cond-mat",,"  We review the results of recent studies of the elastic and inelastic neutron
scattering from a variety of heavy fermion compounds. This class of materials
exhibits a rich variety of ground states: antiferromagnetically ordered,
superconducting, semiconducting, and paramagnetic. Neutron scattering from
single crystals and powders has been a productive tool for probing the magnetic
order and fluctuations in all four cases. This review deals with work on UPt_3,
UPd_2Al_3, UNi_2Al_3, UNi_4B, CeNiSn, Y_{1-x}U_xPd_3, and UCu_{5-x}Pd_x.
","[{""version"":""v1"",""created"":""Thu, 8 Aug 1996 21:18:07 GMT""}]","2007-05-23"
"cond-mat/9608047","Vladan Celebonovic","V.Celebonovic (Inst.of Physics, Beograd, Yugoslavia)","A simple expression for the cold compression curve","3 pages of plain TeX.To be presented at the XI National Conference of
  Yugoslav Astronomers, October 1996, Beograd",,,,"cond-mat",,"  The aim of this contribution is to present expressions for the bulk modulus
of a material and its pressure derivative,obtained by using the semiclassical
theory of dense matter proposed by P.Savic and R.Kasanin. Some possibilities
for the application of these expressions are briefly discussed.
","[{""version"":""v1"",""created"":""Fri, 9 Aug 1996 11:42:46 GMT""}]","2007-05-23"
"cond-mat/9608048","John M. Tranquada","J. M. Tranquada, J. D. Axe, N. Ichikawa, A. R. Moodenbaugh, Y.
  Nakamura, S. Uchida","Coexistence of, and Competition between, Superconductivity and
  Charge-Stripe Order in La(1.6-x)Nd(0.4)Sr(x)CuO(4)","REVTEX, 5 pages, 2 col., 4 epsf figures included with psfig.sty",,"10.1103/PhysRevLett.78.338",,"cond-mat",,"  Previously we have presented evidence for stripe order of holes and spins in
La(1.6-x)Nd(0.4)Sr(x)CuO(4) with x=0.12. Here we show, via neutron diffraction
measurements of magnetic scattering, that similar order occurs in crystals with
x=0.15 and 0.20. Zero-field-cooled magnetization measurements show that all 3
compositions are also superconducting, with the superconducting transition
temperature increasing as the low-temperature staggered magnetization
decreases.
","[{""version"":""v1"",""created"":""Fri, 9 Aug 1996 15:08:59 GMT""}]","2009-10-28"
"dg-ga/9608002","Xianzhe Dai","Xianzhe Dai and Weiping Zhang","Higher spectral flow","Latex, 35 pages",,,,"dg-ga math.DG",,"  For a continuous curve of families of Dirac type operators we define a higher
spectral flow as a $K$-group element. We show that this higher spectral flow
can be computed analytically by $\heta$-forms, and is related to the family
index in the same way as the spectral flow is related to the index. We
introduce a notion of Toeplitz family and relate its index to the higher
spectral flow. Applications to family indices for manifolds with boundary are
also given.
","[{""version"":""v1"",""created"":""Thu, 8 Aug 1996 17:48:50 GMT""}]","2008-02-03"
"dg-ga/9608003","E. Loubea","Eric Loubeau","Pseudo Harmonic Morphisms","AMS-LaTex v1.2b, 13 pages",,,"Leeds University Preprint Series no. 13 (1996)","dg-ga math.DG",,"  We study a geometrical condition (PHWC) which is weaker than horizontal weak
conformality. In particular, we show that harmonic maps satisfying this
condition, which will be called {\em pseudoharmonic morphisms}, include
harmonic morphisms and can be described as pulling back certain germs to
certain other germs. Finally, we construct a canonical f-structure associated
to every map satisfying (PHWC) and find conditions on this f-structure to
ensure the harmonicity of the map.
","[{""version"":""v1"",""created"":""Fri, 9 Aug 1996 13:19:23 GMT""}]","2008-02-03"
"funct-an/9608001","Ken Dykema","Ken Dykema, Uffe Haagerup, Mikael Rordam","The stable rank of some free product C*-algebras","30 pages, Latex. This revision includes an extra section where the
  special case of the reduced C*-algebra of the free group on two generators is
  considered separately. This has the advantage of making the main ideas more
  transparent",,,,"funct-an math.OA",,"  It is proved that the reduced group C*-algebra C*_{red}(G) has stable rank
one (i.e. its group of invertible elements is a dense subset) if G is a
discrete group arising as a free product G_1*G_2 where |G_1|>=2 and |G_2|>=3.
This follows from a more general result where it is proved that if (A,tau) is
the reduced free product of a family (A_i,tau_i), i\in I, of unital C*-algebras
A_i with normalized faithful traces tau_i, and if the family satisfies the
Avitzour condition (i.e. the traces, tau_i, are not too lumpy in a specific
sense), then A has stable rank one.
","[{""version"":""v1"",""created"":""Fri, 9 Aug 1996 13:26:11 GMT""},{""version"":""v2"",""created"":""Thu, 12 Sep 1996 12:22:27 GMT""}]","2008-02-03"
"gr-qc/9608021","Galtsov Dmitzi","D.V. Gal'tsov","Square of General Relativity","A talk at the First Australasian Conference on General Relativity and
  Gravitation, Adelaide, February 12--17, 1996, to be published in the
  Proceedings",,,"DTP-MSU/96-14","gr-qc hep-th",,"  We consider dilaton--axion gravity interacting with $p\;\, U(1)$ vectors
($p=6$ corresponding to $N=4$ supergravity) in four--dimensional spacetime
admitting a non--null Killing vector field. It is argued that this theory
exibits features of a ``square'' of vacuum General Relativity. In the
three--dimensional formulation it is equivalent to a gravity coupled
$\sigma$--model with the $(4+2p)$--dimensional target space
$SO(2,2+p)/(SO(2)\times SO(2+p))$. K\""ahler coordinates are introduced on the
target manifold generalising Ernst potentials of General Relativity. The
corresponding K\""ahler potential is found to be equal to the logarithm of the
product of the four--dimensional metric component $g_{00}$ in the Einstein
frame and the dilaton factor, independently on presence of vector fields. The
K\""ahler potential is invariant under exchange of the Ernst potential and the
complex axidilaton field, while it undergoes holomorphic/antiholomorphic
transformations under general target space isometries. The ``square'' property
is also manifest in the two--dimensional reduction of the theory as a matrix
generalization of the Kramer--Neugebauer map.
","[{""version"":""v1"",""created"":""Thu, 8 Aug 1996 20:46:41 GMT""}]","2007-05-23"
"gr-qc/9608022","Hideo Kodama","Hideo Kodama(Yukawa Institute) and Takashi Hamazaki(Dept. of Phys.,
  Kyoto University)","Evolution of cosmological perturbations in a stage dominated by an
  oscillatory scalar field","Revised version, 23 pages, no figure, plain LaTeX, minor errors in
  some equations are corrected, no change in the main results and the
  conclusion","Prog.Theor.Phys. 96 (1996) 949-970","10.1143/PTP.96.949","YITP-96-28, KUNS 1406","gr-qc",,"  In the investigation of the evolution of cosmological perturbations in
inflationary universe models the behavior of perturbations during the reheating
stage is the most unclear point. In particular in the early reheating phase in
which a rapidly oscillating scalar field dominates the energy density, the
behavior of perturbations are not known well because their evolution equation
expressed in terms of the curvature perturbation becomes singular. In this
paper it is shown that in spite of this singular behavior of the evolution
equation the Bardeen parameter stays constant in a good accuracy during this
stage for superhorizon-scale perturbations except for a sequence of negligibly
short intervals around the zero points of the time derivative of the scalar
field. This justifies the conventional formula relating the amplitudes of
quantum fluctuations during inflation and those of adiabatic perturbations at
horizon crossing in the Friedmann stage, except for possible corrections
produced by the energy transfer from the scalar field to radiation in the late
stage of reheating. It is further shown that outside the above sequence of time
intervals the behavior of the perturbations coincides in a good accuracy with
that for a perfect fluid system obtained from the original scalar field system
by the WKB approximation and a spacetime averaging over a Hubble horizon scale.
","[{""version"":""v1"",""created"":""Fri, 9 Aug 1996 07:56:40 GMT""},{""version"":""v2"",""created"":""Fri, 27 Sep 1996 07:11:49 GMT""}]","2009-10-28"
"gr-qc/9608023","Patricio Anibal Letelier","D.V. Gal'tsov and P.S. Letelier","Reissner-Nordstr\""om Type Black Holes in Dilaton-Axion Gravity","Some comments added, few misprints corrected",,,,"gr-qc hep-th",,"  A $2p + 5$ parametric family of black holes is constructed in dilaton--axion
gravity with $p$ vector fields using a holomorphic representation of U--duality
in three dimensions. The metric of the non--extremal black holes has a
Reissner--Nordstr\""om type structure and generically possesses an internal
horizon. However in the extremal limit the generic solution exhibits a
dilatonic type null singularity. Only in the case of the orthogonal electric
and magnetic charges (if $p>1$) the extremal solution may have a non--singular
event horizon.
","[{""version"":""v1"",""created"":""Fri, 9 Aug 1996 13:33:09 GMT""},{""version"":""v2"",""created"":""Fri, 16 Aug 1996 18:19:44 GMT""}]","2008-02-03"
"hep-lat/9608040","Stephan Guesken","SESAM-Collaboration: N. Eicker, U. Gl\""assner, S. G\""usken H. Hoeber,
  Th. Lippert, G. Ritzenh\""ofer, K. Schilling, G. Siegert A. Spitz, P.
  Ueberholz, and J. Viehoff","Evaluating Sea Quark Contributions to Flavour-Singlet Operators in
  Lattice QCD","11 pages, uuencoded, latex and 15 postscript figures","Phys.Lett. B389 (1996) 720-726","10.1016/S0370-2693(96)80015-3","WUB 96-27, HLRZ 53/96","hep-lat",,"  In a full QCD lattice study with $N_f = 2$ Wilson fermions, we seek to
optimize the signals for the disconnected contributions to the matrix element
of flavour-singlet operators between nucleon states, which are indicative for
sea quark effects. We demonstrate, in form of a fluctuation analysis to the
noisy estimator technique, that -- in order to achieve a tolerable signal to
noise-ratio in full QCD -- it is advantageous to work with a $Z_2$-noise source
rather than to rely only on gauge invariance to cancel non-gauge-invariant
background. In the case of the $\pi$N $\sigma$-term, we find that 10
$Z_2$-noise sources suffice on our sample ( about 150 independent QCD
configurations at $\beta = 5.6$ on $16^3\times32$ with $\kappa_{sea} = 0.157$,
equivalent to $M_{\pi}/M_{\rho} = 0.76(1)$), to achieve decent signals and
adequate fluctuations, rather than 300 such sources as recently used in
quenched simulations.
","[{""version"":""v1"",""created"":""Thu, 8 Aug 1996 16:54:40 GMT""}]","2015-06-25"
"hep-lat/9608041","Arjan van der Sijs","A.J. van der Sijs (University of Zaragoza, Spain)","Laplacian Abelian Projection","Three pages, latex, figures included. Talk presented at
  LATTICE96(topology)","Nucl.Phys.Proc.Suppl. 53 (1997) 535-537","10.1016/S0920-5632(96)00710-4","DFTUZ/96/17","hep-lat",,"  A new partial gauge fixing condition for the abelian projection is
introduced. It is based on the lowest-lying eigenvector of a covariant
Laplacian operator. This gauge is smooth and free of lattice Gribov copies.
These properties are important for an unambiguous computation of the abelian
projected gauge field configuration.
","[{""version"":""v1"",""created"":""Thu, 8 Aug 1996 18:30:47 GMT""}]","2009-10-28"
"hep-lat/9608042","Simon Catterall","S. Catterall, G. Thorleifsson, R. Renken and J. Kogut","Simplicial Gravity in Dimension Greater than Two","Talk presented at LATTICE96(gravity)","Nucl.Phys.Proc.Suppl. 53 (1997) 756-759","10.1016/S0920-5632(96)00773-6",,"hep-lat",,"  We consider two issues in the DT model of quantum gravity. First, it is shown
that the triangulation space for D>3 is dominated by triangulations containing
a single singular (D-3)-simplex composed of vertices with divergent dual
volumes. Second we study the ergodicity of current simulation algorithms.
Results from runs conducted close to the phase transition of the
four-dimensional theory are shown. We see no strong indications of ergodicity
br eaking in the simulation and our data support recent claims that the
transition is most probably first order. Furthermore, we show that the critical
properties of the system are determined by the dynamics of remnant singular
vertices.
","[{""version"":""v1"",""created"":""Thu, 8 Aug 1996 16:12:33 GMT""}]","2009-10-28"
"hep-lat/9608043","Thomas Neuhaus","T. Neuhaus","Multicanonical Study of Continuum Physics in the D=2 $O(3)$ Nonlinear
  Sigma Model","unix script file of Wuppertal WUB 96-30 of about 350K",,,,"hep-lat",,"  Employing a variant of the Multicanonical Ensemble we study twisted spin
configurations on periodic boxes in the $D=2$ $O(3)$ nonlinear sigma model for
$\beta$-values inbetween $1.55$ to $3.1$. The free energy difference of twisted
spin configurations is determined from the constraint effective potential. The
finite size scaling behavior is in accordance with the asymptotically free
nature of the continuum theory. Upon certain reasonable assumptions we
determine the $\Delta \beta( \beta)$-shift of the stiffness correlation length
$\xi_s$. The mass-gap as determined by our analysis is
${m_0}=79.6(1.9)~\Lambda_{latt}$. This value agrees with the analytical result
of the thermodynamic Bethe Ansatz ${m_0}=80.1~\Lambda_{latt}$.
","[{""version"":""v1"",""created"":""Thu, 8 Aug 1996 19:49:33 GMT""}]","2007-05-23"
