"hep-lat/9608044","Marco Falcioni","M.J. Bowick, S. Catterall, M. Falcioni, G. Thorleifsson (Syracuse U.)
  and K. Anagnostopoulos (NBI)","The flat phase of fixed-connectivity membranes","7 pages, 5 figures, 3 tables. LaTeX w/epscrc2.sty, combined
  contribution of M. Falcioni and M. Bowick to LATTICE96(gravity), to appear in
  Nucl. Phys. B (proc. suppl.)","Nucl.Phys.Proc.Suppl. 53 (1997) 746-752","10.1016/S0920-5632(96)00771-2",,"hep-lat",,"  The statistical mechanics of flexible two-dimensional surfaces (membranes)
appears in a wide variety of physical settings. In this talk we discuss the
simplest case of fixed-connectivity surfaces. We first review the current
theoretical understanding of the remarkable flat phase of such membranes. We
then summarize the results of a recent large scale Monte Carlo simulation of
the simplest conceivable discrete realization of this system \cite{BCFTA}. We
verify the existence of long-range order, determine the associated critical
exponents of the flat phase and compare the results to the predictions of
various theoretical models.
","[{""version"":""v1"",""created"":""Thu, 8 Aug 1996 20:19:16 GMT""}]","2009-10-28"
"hep-lat/9608045","Kimball A. Milton","Kimball A. Milton","Finite-element quantum field theory","Talk presented at LATTICE96(theoretical developments), 3 pages,
  LATEX, uses espcrc2.sty","Nucl.Phys.Proc.Suppl. 53 (1997) 847-849","10.1016/S0920-5632(96)00799-2","OKHEP-96-06","hep-lat hep-th",,"  An alternative approach to lattice gauge theory has been under development
for the past decade. It is based on discretizing the operator Heisenberg
equations of motion in such a way as to preserve the canonical commutation
relations at each lattice site. It is now known how to formulate a non-Abelian
gauge theory within this framework. The formulation appears to be free of
fermion doubling. Since the theory is unitary, a time-development operator
(Hamiltonian) can be constructed.
","[{""version"":""v1"",""created"":""Thu, 8 Aug 1996 23:00:28 GMT""}]","2009-10-28"
"hep-lat/9608046","Meinulf Goeckeler","M. Goeckeler, R. Horsley, E.-M. Ilgenfritz, H. Perlt, P. Rakow, G.
  Schierholz, A. Schiller","Lattice computation of structure functions","Plenary talk presented at LATTICE96, LaTeX, 7 pages, 5 figures,
  espcrc2.sty and epsfig.sty included","Nucl.Phys.Proc.Suppl.53:81-87,1997","10.1016/S0920-5632(96)00601-9","DESY 96-151, HLRZ 96-55, HUB-EP-96/38","hep-lat",,"  Recent lattice calculations of hadron structure functions are described.
","[{""version"":""v1"",""created"":""Fri, 9 Aug 1996 09:55:49 GMT""}]","2008-11-26"
"hep-lat/9608047","Frithjof Karsch","F. Karsch, B. Beinlich, J. Engels, R. Joswig, E. Laermann, A. Peikert
  and B. Petersson","QCD Thermodynamics with Improved Actions","Talk presented at LATTICE96(finite temperature) 4 pages, LaTeX2e
  file, 6 eps-files","Nucl.Phys.Proc.Suppl. 53 (1997) 413-416","10.1016/S0920-5632(96)00674-3","BI-TP 96/34","hep-lat",,"  The thermodynamics of the SU(3) gauge theory has been analyzed with tree
level and tadpole improved Symanzik actions. A comparison with the continuum
extrapolated results for the standard Wilson action shows that improved actions
lead to a drastic reduction of finite cut-off effects already on lattices with
temporal extent $N_\tau=4$. Results for the pressure, the critical temperature,
surface tension and latent heat are presented. First results for the
thermodynamics of four-flavour QCD with an improved staggered action are also
presented. They indicate similarly large improvement factors for bulk
thermodynamics.
","[{""version"":""v1"",""created"":""Fri, 9 Aug 1996 10:12:45 GMT""}]","2009-10-28"
"hep-lat/9608048","Hubert Simma","K.Jansen, C.Liu, H.Simma, D.Smith","Low-Lying Eigenvalues of the Wilson-Dirac Operator","Poster presented at LATTICE96(poster). 4 pages, LaTeX, fully coloured
  versions of Figs. 4 and 5 are included as separate gzipped PostScript files
  or can be obtained from
  http://www.desy.de/library/cgi-bin/showprep.pl?desy-rep%2F1996153","Nucl.Phys.Proc.Suppl. 53 (1997) 262-265","10.1016/S0920-5632(96)00631-7","DESY 96-153","hep-lat",,"  An exploratory study of the low-lying eigenvalues of the Wilson-Dirac
operator and their corresonding eigenvectors is presented. Results for the
eigenvalues from quenched and unquenched simulations are discussed. The
eigenvectors are studied with respect to their localization properties in the
quenched approximation for the cases of SU(2) and SU(3).
","[{""version"":""v1"",""created"":""Fri, 9 Aug 1996 11:36:13 GMT""}]","2009-10-28"
"hep-lat/9608049","Hartmut Wittig","M. L\""uscher, S. Sint, R. Sommer, P. Weisz, H. Wittig and U. Wolff","Some new results in O(a) improved lattice QCD","Talks presented at LATTICE96(improvement), 9 LaTeX pages plus 5
  postscript figures, espcrc2.sty (included)","Nucl.Phys.Proc.Suppl. 53 (1997) 905-913","10.1016/S0920-5632(96)00815-8","DESY 96-157, CERN-TH/96-217","hep-lat",,"  It is shown how on-shell O(a) improvement can be implemented
non-perturbatively in lattice QCD with Wilson quarks. Improvement conditions
are obtained by requiring the PCAC relation to hold exactly in certain matrix
elements. These are derived from the QCD Schr\""odinger functional which enables
us to simulate directly at vanishing quark masses. In the quenched
approximation and for bare couplings in the range $0\leq g_0\leq 1$, we
determine the improved action, the improved axial current, the additive
renormalization of the quark mass and the isospin current normalization
constants Z_A and Z_V.
","[{""version"":""v1"",""created"":""Fri, 9 Aug 1996 15:22:51 GMT""}]","2009-10-28"
"hep-ph/9608264","D. P. Roy","Debajyoti Choudhury and D.P. Roy","An R-Parity Breaking SUSY Solution to the R_b and ALEPH Anomalies","Latex file (11 pages) including 4 ps files containing 3 figures","Phys.Rev. D54 (1996) 6797-6802","10.1103/PhysRevD.54.6797","CERN-TH/96-203","hep-ph",,"  We discuss an optimal $R$-parity breaking SUSY solution to the $R_b$ excess
as well as the ALEPH 4-jet anomaly. The latter arises from the pair production
of stop via chargino decay at LEP1.5, followed by its $R$--violating decay into
a light quark pair. The model satisfies top quark and $Z$--boson decay
constraints along with gaugino mass unification.
","[{""version"":""v1"",""created"":""Thu, 8 Aug 1996 16:56:21 GMT""}]","2009-10-28"
"hep-ph/9608270","Mihail Tchijov","D.P.Kirilova and M.V.Chizhov","Nonequilibrium Neutrino Oscillations and Primordial Production of He-4","LaTeX, 7 pages, 6 Postscript figures, figures are included in the
  revised text (epsf.sty)","Phys.Lett. B393 (1997) 375-382","10.1016/S0370-2693(96)01626-7","Preprint TAC-1996-018","hep-ph",,"  We studied nonequilibrium oscillations between left-handed electron neutrinos
and nonthermalized sterile neutrinos in medium for resonant and nonresonant
cases. The exact kinetic equations for neutrinos, written in terms of neutrino
density matrix in {\it momentum space} were analyzed. The evolution of neutrino
density matrix was numerically calculated. This allowed to study precisely the
evolution of the neutrino number densities, energy spectrum distortion and the
asymmetry between neutrinos and antineutrinos for each momentum mode. The
influence of nonequilibrium oscillations on the primordial production of He-4
was calculated. Cosmological constraints on the oscillation parameters were
obtained.
","[{""version"":""v1"",""created"":""Thu, 8 Aug 1996 16:14:34 GMT""},{""version"":""v2"",""created"":""Mon, 12 Aug 1996 09:29:38 GMT""}]","2009-10-28"
"hep-ph/9608271","Per Elmfors","Per Elmfors","Hard thermal loops in a magnetic field and the chiral anomaly","30 pages, 5 figures, latex","Nucl.Phys. B487 (1997) 207-230","10.1016/S0550-3213(96)00666-9","CERN-TH/96-207","hep-ph",,"  The fermionic dispersion relation in the presence of a background magnetic
field and a high temperature QED plasma is calculated exactly in the external
field, using the Hard Thermal Loop effective action. As the field strength
increases there is a smooth transition from the weak-field ($qB\ll q^2T^2$)
thermal dispersion relations to the vacuum Landau levels when the background
field is much stronger than any thermal effects ($qB\gg q^2T^2$). The
self-energy at finite field strength acquires an imaginary part. The spectral
width becomes important for critical field strengths ($qB \sim q^2T^2$),
necessitating the use of the full spectral function. It is shown that the
spectral function satisfies the usual condition of normalization and causality.
Using the exact spectral function I also show that the production of chirality
in an external electromagnetic field at high temperature is unaffected by the
presence of the thermal masses of the fermions.
","[{""version"":""v1"",""created"":""Thu, 8 Aug 1996 16:50:56 GMT""}]","2009-10-28"
"hep-ph/9608272","Nikolaos Tetradis","N. Tetradis (CERN)","The Electroweak Phase Transition through the Renormalization Group","48 pages, 17 figures (some additions to the labels included in the
  captions), LaTeX file","Nucl.Phys. B488 (1997) 92-140","10.1016/S0550-3213(97)00037-0","CERN-TH/96-190","hep-ph hep-lat hep-th",,"  We study the high-temperature phase transitions for the Abelian and $SU(2)$
Higgs models, using the exact renormalization group. The evolution equation for
a properly-defined coarse-grained free energy is solved. The phase diagram of
the Abelian Higgs model has a region of second-order phase transitions governed
by fixed points, for which we calculate critical exponents and crossover
curves. It also has a region of first-order phase transitions, which we discuss
in terms of the coarse-grained free energy. The $SU(2)$ Higgs model for small
Higgs field masses has only first-order phase transitions. We derive their
properties and compare with lattice and perturbative results. For larger Higgs
field masses the strength of the first-order phase transitions diminishes. For
masses larger than 80-100 GeV we find evidence that they are replaced by
analytical crossovers.
","[{""version"":""v1"",""created"":""Thu, 8 Aug 1996 16:51:32 GMT""}]","2009-10-28"
"hep-ph/9608273","Stuart Raby","Tomas Blazek, Marcela Carena, Stuart Raby, Carlos Wagner","A Global $\chi^2$ Analysis of Electroweak Data (including Fermion Masses
  and Mixing Angles) in SO(10) SUSY GUTs","8 pages, LateX type, talk presented by S. Raby at the Fourth
  International Conference on Supersymmetry (SUSY96), College Park, MD, May
  29,1996","Nucl.Phys.Proc.Suppl.52A:133-140,1997","10.1016/S0920-5632(96)00549-X","OHSTPY-HEP-T-96-014","hep-ph",,"  We present a global $\chi^2$ analysis of electroweak data, including fermion
masses and mixing angles, in SO(10) SUSY GUTs. Just as precision electroweak
data is used to test the Standard Model, the well determined Standard Model
parameters are the precision electroweak data for testing theories beyond the
Standard Model. In this talk we use the latest experimentally measured values
for these parameters. We study several models discussed in the literature. One
of these models provides an excellent fit to the low energy data with $\chi^2
\sim 1$ for 3 degrees of freedom. We present our predictions for a few selected
points in parameter space.
","[{""version"":""v1"",""created"":""Thu, 8 Aug 1996 17:51:36 GMT""}]","2009-10-28"
"hep-ph/9608274",,"Thomas G. Rizzo","Determination of the $Z'$ Mass and Couplings Below Threshold at the NLC","11 pages, 6 figures, uuencoded postscript file",,,"SLAC-PUB-7250","hep-ph",,"  We investigate the capability of the NLC to indirectly determine both the
mass as well as the couplings to leptons and $b$-quarks of a new neutral gauge
boson below direct production threshold. By using data collected at several
different values of the collider center of mass energy, we demonstrate how this
can be done in an anonymous and model-independent manner. The procedure can be
easily extended to the top and charm quark couplings.[To appear in the
Proceedings of the 28th International Conference on High Energy Physics,
Warsaw, Poland, 25-31 July 1996]
","[{""version"":""v1"",""created"":""Thu, 8 Aug 1996 19:06:38 GMT""}]","2007-05-23"
"hep-ph/9608275","Jorge L. Lopez","J. Lopez and D. Nanopoulos","Experimental consequences of no-scale supergravity in light of the CDF
  $ee\gamma\gamma$ event","36 pages, LaTeX, 19 figures (included)","Phys. Rev. D 55, 4450 (1997)","10.1103/PhysRevD.55.4450","DOE/ER/40717-32, CTP-TAMU-32/96","hep-ph",,"  We explore two possible interpretations for the CDF
$ee\gamma\gamma+E_T\hskip-13pt/\quad$ event in the context of a recently
proposed one-parameter no-scale supergravity model with a light gravitino. We
delineate the region in parameter space consistent with the kinematics of the
event interpreted either as selectron pair-production ($p\bar p\to\tilde
e^+\tilde e^-\,X$, $\tilde e=\tilde e_R,\tilde e_L$) or as chargino
pair-production ($p\bar p\to\chi^+_1\chi^-_1\,X$). In the context of this
model, the selectron interpretation requires $\tilde e=\tilde e_R$ and predicts
comparable rates for $\ell^\pm\gamma\gamma+E_T\hskip-13pt/\quad$, whereas the
chargino interpretation predicts comparable rates for
$(\ell^\pm\ell^{'+}\ell^{'-},\ell^+\ell^-,\ell^+\ell^-jj)\,\gamma\gamma
+E_T\hskip-13pt/\quad$. We also consider the constraints from LEP~1.5 and the
expectations for LEP~2. We point out that one of the acoplanar photon pairs
observed by the OPAL collaboration at LEP~1.5 may be attributable to
supersymmetry in the present model via $e^+e^-\to\chi^0_1\chi^0_1\to
\gamma\gamma+E_T\hskip-13pt/\quad$. We also show how similar future events at
LEP~2 may be used to deduce the neutralino mass.
","[{""version"":""v1"",""created"":""Thu, 8 Aug 1996 20:42:30 GMT""}]","2016-08-24"
"hep-ph/9608276","Ola Tornkvist","A. Riotto, O. Tornkvist (Fermilab), R.N. Mohapatra (Univ. of Maryland)","Higgs Boson Mass in Models with Gauge-Mediated Supersymmetry Breaking","revtex, 13 pages, 2 separate postscript figures, uses aps.sty,
  prl.sty, preprint.sty. Submitted to Phys. Lett. B","Phys.Lett. B388 (1996) 599-604","10.1016/S0370-2693(96)01186-0","FERMILAB-Pub-96/213-A, UMD-PP-97-17","hep-ph",,"  We present the predictions for the mass $M_h$ of the lightest Higgs boson in
models with gauge-mediated supersymmetry breaking as a function of the
SUSY-breaking scale. We include all radiative corrections up to two loops and
point out that if the CDF e+ e- two-photon event is interpreted in terms of
these models, then the lightest Higgs boson should be lighter than 110 GeV.
","[{""version"":""v1"",""created"":""Thu, 8 Aug 1996 23:08:46 GMT""},{""version"":""v2"",""created"":""Fri, 9 Aug 1996 21:14:56 GMT""}]","2009-10-28"
"hep-ph/9608277","Liu Chun","Yuan-ben Dai, Chao-shang Huang, Ming-qiu Huang, and Chun Liu","QCD Sum Rule Analysis for the \Lambda_b to \Lambda_c Semileptonic Decay","LateX, 16 pages including 3 figs, to appear in Phys. Lett.B","Phys.Lett.B387:379-385,1996","10.1016/0370-2693(96)01029-5","AS-ITP-96-08","hep-ph",,"  The 1/m_c and 1/m_b corrections to the \Lambda_b to \Lambda_c semi- leptonic
decay are analyzed by QCD sum rules. Within the framework of heavy quark
effective theory,the subleading baryonic Isgur-Wise func- tion of \Lambda_b to
\Lambda_c has been calculated. It is shown that the corrections due to the 1/m
Lagrangian insertion are negligibly small. The sizable 1/m_Q effect to the
decay lies only in the weak current. The decay spectrum and the branching ratio
are given.
","[{""version"":""v1"",""created"":""Fri, 9 Aug 1996 01:08:30 GMT""}]","2011-01-27"
"hep-ph/9608278","Dr Tony Williams","A.G. Williams, K. Kusaka and K.M. Simpson","Covariant Solutions of the Bethe-Salpeter Equation","6 pages of LaTeX, uses lprocl.sty and epsfig.sty with 3 figures. Talk
  presented at the workshop on Quantum Chromodynamics: Collision, Confinement,
  and Chaos, at the American University of Paris, France, June 1996, to appear
  in the conference proceedings. Entire manuscript available as a ps file at
  http://www.physics.adelaide.edu.au/theory/home.html or
  ftp://adelphi.adelaide.edu.au/pub/theory/ADP-96-26.T225.ps",,,"ADP-96-26/T225","hep-ph",,"  There is a need for covariant solutions of bound state equations in order to
construct realistic QCD based models of mesons and baryons. Furthermore, we
ideally need to know the structure of these bound states in all kinematical
regimes, which makes a direct solution in Minkowski space (without any
3-dimensional reductions) desirable. The Bethe-Salpeter equation (BSE) for
bound states in scalar theories is reformulated and solved for arbitrary
scattering kernels in terms of a generalized spectral representation directly
in Minkowski space (K. Kusaka et al., PRD 51, 7026 '95). This differs from the
conventional Euclidean approach, where the BSE can only be solved in ladder
approximation after a Wick rotation.
","[{""version"":""v1"",""created"":""Fri, 9 Aug 1996 05:55:17 GMT""}]","2007-05-23"
"hep-ph/9608280","Kurt Riesselmann","Kurt Riesselmann and Scott Willenbrock","Ruling Out a Strongly-Interacting Standard Higgs Model","29 pages, 6 figures. The complete paper including figures is also
  available via WWW at
  http://www.physik.tu-muenchen.de/tumphy/d/T30d/PAPERS/TUM-HEP-236-96.ps.gz","Phys.Rev.D55:311-321,1997","10.1103/PhysRevD.55.311","TUM-HEP-236/96, ILL-(TH)-96-4","hep-ph hep-lat",,"  Previous work has suggested that perturbation theory is unreliable for Higgs-
and Goldstone-boson scattering, at energies above the Higgs mass, for
relatively small values of the Higgs quartic coupling $\lambda(\mu)$. By
performing a summation of nonlogarithmic terms, we show that perturbation
theory is in fact reliable up to relatively large coupling. This eliminates the
possibility of a strongly-interacting standard Higgs model at energies above
the Higgs mass, complementing earlier studies which excluded strong
interactions at energies near the Higgs mass. The summation can be formulated
in terms of an appropriate scale in the running coupling,
$\mu=\sqrt{s}/e\approx\sqrt{s}/2.7$, so it can easily be incorporated in
renormalization-group improved tree-level amplitudes as well as higher-order
calculations.
","[{""version"":""v1"",""created"":""Fri, 9 Aug 1996 11:56:44 GMT""}]","2014-11-17"
"hep-ph/9608281","Peter Soldan","P.H. Soldan (Dortmund)","epsilon'/epsilon Computation -- Long-distance Evolution","Invited talk at Workshop on K physics, Orsay, France, 30 May -- 4 Jun
  1996, 11 pp., LATEX, 4 eps figures",,,"DO-TH 96/15","hep-ph",,"  We present a status report on our study of long-distance contributions to the
decay amplitudes A(K^0 --> pi pi, I) in the framework of the 1/N expansion. We
argue that a modified prescription for the identification of meson momenta in
the chiral loop corrections has to be used to gain a self-consistent picture
which allows an appropriate matching with the short-distance part. Possible
uncertainties in the analysis of the density-density operators Q_6 and Q_8
which dominate the CP violation parameter epsilon'/epsilon are discussed. As a
first result we present the long-distance 1/N correction to the gluon penguin
operator Q_6 in the chiral limit.
","[{""version"":""v1"",""created"":""Fri, 9 Aug 1996 14:53:57 GMT""}]","2007-05-23"
"hep-ph/9608282","Steven Bass","S.D. Bass and D. Sch\""utte","The role of the pion cloud in the interpretation of the valence
  light-cone wavefunction of the nucleon","Expanded Discussion of Phenomenology and Spin Physics","Z.Phys.A357:85-93,1997","10.1007/s002180050218","Bonn TK-96-17","hep-ph",,"  The pion cloud renormalises the light-cone wavefunction of the nucleon which
is measured in hard, exclusive photon-nucleon reactions. We discuss the leading
twist contributions to high-energy exclusive reactions taking into account both
the pion cloud and perturbative QCD physics. The nucleon's electromagnetic
form-factor at high $Q^2$ is proportional to the bare nucleon probability $Z$
and the cross-sections for hard (real at large angle or deeply virtual) Compton
scattering are proportional to $Z^2$. Our present knowledge of the pion-nucleon
system is consistent with $Z = 0.7 \pm 0.2$. If we apply just perturbative QCD
to extract a light-cone wavefunction directly from these hard exclusive
cross-sections, then the light-cone wavefunction that we extract measures the
three valence quarks partially screened by the pion cloud of the nucleon. We
discuss how this pion cloud renormalisation effect might be understood at the
quark level in terms of the (in-)stability of the perturbative Dirac vacuum in
low energy QCD.
","[{""version"":""v1"",""created"":""Fri, 9 Aug 1996 12:32:11 GMT""},{""version"":""v2"",""created"":""Tue, 20 Aug 1996 12:01:05 GMT""}]","2010-11-19"
"hep-ph/9608283","Leonid Glozman","L.Ya. Glozman","Binding of Quarks and the pi-N sigma-Term","7 pages, LaTeX file, essential modifications in the text have been
  made",,,"UNIGRAZ-UTP 09-08-96","hep-ph nucl-th",,"  It is shown that the binding effect that is associated with the short range
part of the Goldstone boson exchange interaction between constituent quarks
provides a good description of the $\pi N$ $\sigma$-term.
","[{""version"":""v1"",""created"":""Fri, 9 Aug 1996 14:01:00 GMT""},{""version"":""v2"",""created"":""Wed, 14 Aug 1996 11:35:04 GMT""},{""version"":""v3"",""created"":""Thu, 17 Oct 1996 11:44:22 GMT""}]","2008-02-03"
"hep-ph/9608284","Adam","H. F. Jones, A. Ritz, and I. L. Solovtsov","A New Approach to QCD Sum Rules and Inclusive $\tau$ Decay","8 pages, RevTeX, 1 postscript figure",,,"Imperial/TP/95-96/62","hep-ph",,"  We show that renormalization group improvement, making use of analyticity and
the structure of the operator product expansion, combined with a
non-perturbative expansion method allows one to describe quarkonium states via
QCD sum rules without the need for explicit power corrections. This technique
also allows an accurate determination of parameters related to the inclusive
decay of the $\tau$ lepton.
","[{""version"":""v1"",""created"":""Fri, 9 Aug 1996 14:32:40 GMT""}]","2007-05-23"
"hep-ph/9608285","Margaret Gabler","Frank Wilczek (Institute for Advanced Study)","Particle Physics for Cosmology","Talk given at ""Critical Dialogues in Cosmology"" conference, June
  1996. 26 pages latex with 8 embedded figures",,,"IASSNS-HEP 96/79","hep-ph astro-ph hep-th",,"  I discuss some central issues in particle physics which are potentially
relevant to cosmology. I first briefly review the present (glorious)
experimental status of the Standard Model, emphasizing that it provides a firm
foundation both for early Universe cosmology and for further exploration toward
the basic laws of Nature. I then provide a critique, arguing that while there
are no clear discrepancies, there are several major, specific deficiencies of
the Standard Model which clearly point up its provisional character. I
elaborate on the story theorists have made up to address one of these problems,
the problem of scattered multiplets, and show how upon following it out one
finds, within existing experiments, encouragement -- bordering on evidence --
for certain ambitious ideas regarding unification and supersymmetry. I briefly
describe and contrast two paradigms of supersymmetry breaking, which have
markedly different experimental and cosmological consequences. I call attention
to specific connections with cosmology where appropriate throughout; and near
the end I make some more global remarks. Finally I venture a speculation
suggesting, in a fairly concrete way, the possibility that the laws of physics
cannot, in principle, be disentangled from cosmology.
","[{""version"":""v1"",""created"":""Fri, 9 Aug 1996 15:48:22 GMT""}]","2007-05-23"
"hep-th/9608046","Thomas","Kenneth Intriligator and Scott Thomas","Dual Descriptions of Supersymmetry Breaking","16 pages, harvmac",,,"SLAC-PUB-7143","hep-th hep-ph",,"  Dynamical supersymmetry breaking is considered in models which admit
descriptions in terms of electric, confined, or magnetic degrees of freedom in
various limits. In this way, a variety of seemingly different theories which
break supersymmetry are actually inter-related by confinement or duality.
Specific examples are given in which there are two dual descriptions of the
supersymmetry breaking ground state.
","[{""version"":""v1"",""created"":""Thu, 8 Aug 1996 18:05:21 GMT""}]","2007-05-23"
"hep-th/9608047","Joseph A. Minahan","Joseph A. Minahan and Dennis Nemeschansky","An N=2 Superconformal Fixed Point with E_6 Global Symmetry","12 pages, harvmac (b)","Nucl.Phys. B482 (1996) 142-152","10.1016/S0550-3213(96)00552-4","USC-96/18","hep-th",,"  We obtain the elliptic curve corresponding to an $N=2$ superconformal field
theory which has an $E_6$ global symmetry at the strong coupling point
$\tau=e^{\pi i/3}$. We also find the Seiberg-Witten differential $\lambda_{SW}$
for this theory. This differential has 27 poles corresponding to the
fundamental representation of $E_6$. The complex conjugate representation has
its poles on the other sheet. We also show that the $E_6$ curve reduces to the
$D_4$ curve of Seiberg and Witten. Finally, we compute the monodromies and use
these to compute BPS masses in an $F$-Theory compactification.
","[{""version"":""v1"",""created"":""Thu, 8 Aug 1996 18:05:36 GMT""}]","2009-10-30"
