"hep-th/9608048","Kimball A. Milton","Carl M. Bender and Kimball A. Milton","Nonperturbative calculation of symmetry breaking in quantum field theory","12 pages, no figures, REVTeX","Phys.Rev.D55:3255-3259,1997","10.1103/PhysRevD.55.3255","IMPERIAL/TP/95-96/56","hep-th",,"  A new version of the delta expansion is presented, which, unlike the
conventional delta expansion, can be used to do nonperturbative calculations in
a self-interacting scalar quantum field theory having broken symmetry. We
calculate the expectation value of the scalar field to first order in delta,
where delta is a measure of the degree of nonlinearity in the interaction term.
","[{""version"":""v1"",""created"":""Thu, 8 Aug 1996 20:21:06 GMT""}]","2009-12-30"
"hep-th/9608049","Victor de Oliveira Rivelles","Marcelo M. Leite and Victor O. Rivelles","Black Holes in the Gauge Theoretic Formulation of Dilatonic Gravity","Action is improved to be reparametrization invariant. Misprintings
  corrected. 10 pages, Latex","Phys.Lett. B392 (1997) 305-310","10.1016/S0370-2693(96)01579-1","IFUSP-P/1229","hep-th gr-qc",,"  We show that two-dimensional topological BF theories coupled to particles
carrying non-Abelian charge admit a new coupling involving the Lagrange
multiplier field. When applied to the gauge theoretic formulation of dilatonic
gravity it gives rise to a source term for the gravitational field. We show
that the system admits black hole solutions.
","[{""version"":""v1"",""created"":""Thu, 8 Aug 1996 22:29:59 GMT""},{""version"":""v2"",""created"":""Mon, 2 Sep 1996 14:48:36 GMT""}]","2009-10-30"
"hep-th/9608050","Hidenori Sonoda","Hidenori Sonoda","Understanding Chiral Anomaly in Coordinate Space","6 pages, plain TeX, uses harvmac","Phys. Rev. D 55, 5245 (1997)","10.1103/PhysRevD.55.5245","UCLA/96/TEP/24","hep-th",,"  By completing the old discussion of K.~Wilson, we express the chiral anomaly
in terms of a double integral of a three-point function of chiral currents over
an arbitrarily small region in the coordinate space. An integrability condition
provides an important finite local counterterm to the integral.
","[{""version"":""v1"",""created"":""Thu, 8 Aug 1996 23:19:43 GMT""}]","2016-08-24"
"hep-th/9608051","Ali Mostafazadeh","Ali Mostafazadeh","Adiabatic Geometrical Phase for Scalar Fields in a Curved Spacetime","Expanded Version",,,"University of Alberta preprint THY 28-96","hep-th gr-qc",,"  A convenient framework is developed to generalize Berry's investigation of
the adiabatic geometrical phase for a classical relativistic charged scalar
field in a curved background spacetime which is minimally coupled to
electromagnetism and an arbitrary (non-electromagnetic) scalar potential. It
involves a two-component formulation of the corresponding Klein-Gordon
equation. A precise definition of the adiabatic approximation is offered and
conditions of its validity are discussed. It is shown that the adiabatic
geometric phase can be computed without making a particular choice for an inner
product on the space of solutions of the field equations. What is needed is
just an inner product on the Hilbert space of the square integrable functions
defined on the spatial hypersurfaces. The two-component formalism is applied in
the investigation of the adiabatic geometric phases for several specific
examples, namely, a rotating magnetic field in Minkowski space, a rotating
cosmic string, and an arbitrary spatially homogeneous cosmological background.
It is shown that the two-component formalism reproduces the known results for
the first two examples. It also leads to several interesting results for the
case of spatially homogeneous cosmological models. In particular, it is shown
that the adiabatic geometric phase angles vanish for Bianchi type I models. The
situation is completely different for Bianchi type IX models where a variety of
nontrivial non-Abelian adiabatic geometrical phases can occur. The analogy
between the adiabatic geometric phases induced by the Bianchi type IX
backgrounds and those associated with the well-known time-dependent nuclear
quadrupole Hamiltonians is also pointed out.
","[{""version"":""v1"",""created"":""Fri, 9 Aug 1996 01:24:56 GMT""},{""version"":""v2"",""created"":""Thu, 5 Sep 1996 22:19:42 GMT""},{""version"":""v3"",""created"":""Tue, 24 Jun 1997 20:08:22 GMT""}]","2009-09-25"
"hep-th/9608052","Kazuo Fujikawa","Kazuo Fujikawa (Dept. of Physics, Univ. of Tokyo)","Exact path integral of the hydrogen atom and the Jacobi's principle of
  least action","10 pages. Talk presented at Inauguration Conference of Asia Pacific
  Center for Theoretical Physics, Seoul, Korea, June 4-10,1996 (To be published
  in the Proceedings(World Scientific, Singapore))",,,"UT-756, 1996","hep-th",,"  The general treatment of a separable Hamiltonian of Liouville-type is
well-known in operator formalism. A path integral counterpart is formulated if
one starts with the Jacobi's principle of least action, and a path integral
evaluation of the Green's function for the hydrogen atom by Duru and Kleinert
is recognized as a special case. The Jacobi's principle of least action for
given energy is reparametrization invariant, and the separation of variables in
operator formalism corresponds to a choice of gauge in path integral. The
Green's function is shown to be gauge independent,if the operator ordering is
properly taken into account. These properties are illustrated by evaluating an
exact path integral of the Green's function for the hydrogen atom in parabolic
coordinates.
","[{""version"":""v1"",""created"":""Fri, 9 Aug 1996 07:39:37 GMT""}]","2007-05-23"
"hep-th/9608054","Naoki Sasakura","Katsushi Ito (Univ. of Tsukuba) and Naoki Sasakura (Tohoku Univ.)","Exact and microscopic one-instanton calculations in N=2 supersymmetric
  Yang-Mills theories","34 pages, LaTeX","Nucl.Phys. B484 (1997) 141-166","10.1016/S0550-3213(96)00598-6","TU-508","hep-th",,"  We study the low-energy effective theory in N=2 super Yang-Mills theories by
microscopic and exact approaches. We calculate the one-instanton correction to
the prepotential for any simple Lie group from the microscopic approach. We
also study the Picard-Fuchs equations and their solutions in the semi-
classical regime for classical gauge groups with rank r \leq 3. We find that
for gauge groups G=A_r, B_r, C_r (r \leq 3) the microscopic results agree with
those from the exact solutions.
","[{""version"":""v1"",""created"":""Fri, 9 Aug 1996 11:40:48 GMT""}]","2009-10-30"
"hep-th/9608055","Nial J. MacKay","G.M. Gandenberger and N.J. MacKay","Remarks on excited states of affine Toda solitons","8pp, LaTeX. Comments and one reference added; version to appear in
  Phys.Lett.B","Phys.Lett. B390 (1997) 185-188","10.1016/S0370-2693(96)01351-2","DAMTP-96-70","hep-th",,"  The identification in affine Toda field theory of the quantum particle with
the lowest breather allows us to re-interpret discrete modes of excitation of
solitons as breathers bound to solitons, and thus to investigate them through
the proposed soliton-breather S-matrices. There are implications for the
physical spectrum and for the semiclassical soliton mass corrections.
","[{""version"":""v1"",""created"":""Fri, 9 Aug 1996 11:55:28 GMT""},{""version"":""v2"",""created"":""Mon, 7 Oct 1996 18:12:13 GMT""}]","2009-10-30"
"hep-th/9608056","Emili Elizalde","E. Elizalde","Complete determination of the singularity structure of zeta functions","LaTeX, 10 pages, a couple of typos corrected","J.Phys.A30:2735-2744,1997","10.1088/0305-4470/30/8/019","DESY 96-155","hep-th funct-an math.FA",,"  Series of extended Epstein type provide examples of non-trivial zeta
functions with important physical applications. The regular part of their
analytic continuation is seen to be a convergent or an asymptotic series. Their
singularity structure is completely determined in terms of the Wodzicki residue
in its generalized form, which is proven to yield the residua of all the poles
of the zeta function, and not just that of the rightmost pole (obtainable from
the Dixmier trace). The calculation is a very down-to-earth application of
these powerful functional analytical methods in physics.
","[{""version"":""v1"",""created"":""Fri, 9 Aug 1996 12:41:45 GMT""},{""version"":""v2"",""created"":""Mon, 12 Aug 1996 10:54:28 GMT""}]","2008-11-26"
"hep-th/9608057","Fosco","C.D. Fosco and F.A. Schaposnik","Bosonization of Vector and Axial-Vector Currents in 3+1 Dimensions","13 pages, LateX. Typographical error corrected","Phys.Lett. B391 (1997) 136-143","10.1016/S0370-2693(96)01428-1",,"hep-th",,"  The bosonization of a massless fermionic field coupled to both vector and
axial-vector external sources is developed, following a path-integral approach.
The resulting bosonized theory contains two antisymmetric tensor fields whose
actions consist of non-local Kalb-Ramond-like terms plus interactions. Exact
bosonization rules that take the axial anomaly for the axial current into
account are derived, and an approximated bosonized action is constructed.
","[{""version"":""v1"",""created"":""Fri, 9 Aug 1996 13:30:35 GMT""},{""version"":""v2"",""created"":""Mon, 12 Aug 1996 13:30:20 GMT""}]","2009-10-30"
"nucl-th/9608012","Arturo De Pace","A. De Pace (1), C. Garcia-Recio (2) and E. Oset (3) ((1) INFN -
  Sezione di Torino, Italy, (2) Departamento de Fisica Moderna - Granada,
  Spain, (3) Departamento de Fisica Teorica and Instituto de Fisica
  Corpuscular, Valencia, Spain)","Quasielastic K-nucleus scattering","21 pages, uses REVTeX and epsfig, 9 postscript figures; replaced
  version corrects a few minor errors in the text","Phys.Rev.C55:1394-1403,1997","10.1103/PhysRevC.55.1394",,"nucl-th",,"  Quasielastic K^+ - nucleus scattering data at q=290, 390 and 480 MeV/c are
analyzed in a finite nucleus continuum random phase approximation framework,
using a density-dependent particle-hole interaction. The reaction mechanism is
consistently treated according to Glauber theory, keeping up to two-step
inelastic processes. A good description of the data is achieved, also providing
a useful constraint on the strength of the effective particle-hole interaction
in the scalar-isoscalar channel at intermediate momentum transfers. We find no
evidence for the increase in the effective number of nucleons participating in
the reaction which has been reported in the literature.
","[{""version"":""v1"",""created"":""Thu, 8 Aug 1996 16:47:58 GMT""},{""version"":""v2"",""created"":""Mon, 10 Mar 1997 13:40:11 GMT""}]","2008-11-26"
"nucl-th/9608013","Berndt Mueller","Kari J. Eskola, Berndt M\""uller, and Xin-Nian Wang","Self-Screened Parton Cascades","Talk presented at the RHIC'96 Workshop, BNL, July 1996",,,"DUKE-TH-96-120","nucl-th hep-ph",,"  The high density of scattered partons predicted in nuclear collisions at very
high energy makes color screening effects significant. We explain how these
screening mechanisms may suppress nonperturbative, soft QCD processes,
permitting a consistent calculation of quark-gluon plasma formation within the
framework of perturbative QCD. We present results of a model calculation of
these effects including predictions for the initial thermalized state for heavy
nuclei colliding at RHIC and LHC.
","[{""version"":""v1"",""created"":""Thu, 8 Aug 1996 18:51:02 GMT""}]","2007-05-23"
"nucl-th/9608014",,"Y. Pang, D. E. Kahana, S. H. Kahana, H. Crawford","Pbar Annihilation in Au+Au at AGS Energies","1 page in revtex, 1 postscript file","Phys.Rev.Lett. 78 (1997) 3418","10.1103/PhysRevLett.78.3418",,"nucl-th",,"  Antinucleon production in heavy ion collisions is potentially an excellent
signal for unusual phenomena in hot and dense matter. However, at the low
energies available at the AGS the annihilation process must be handled with
care. In this Comment, we consider the case of Au + Au collisions at
approximately 11 GeV/c, applying the ARC treatment of pbar production and
annihilation to the analysis of experiment E878. It is apparent that classical
screening introduced for Si + Au is crucial in the understanding of data
obtained with the more massive projectile. Unfortunately, there seems no
necessity for invoking unusual behaviour in the Au + Au system.
","[{""version"":""v1"",""created"":""Thu, 8 Aug 1996 18:48:57 GMT""}]","2009-10-30"
"nucl-th/9608015","Thomas Schaefer","Thomas Schaefer (INT, Seattle)","The Chiral Phase Transition","13 pages, 9 PS figures, to appear in QM96 proceedings (Nucl. Phys. A)","Nucl.Phys. A610 (1996) 13c-25c","10.1016/S0375-9474(96)00339-9","DOE/ER/40561-277-INT96-00-137","nucl-th",,"  I review the current understanding of the chiral phase transition in QCD,
with particular emphasis on recent results obtained in the instanton liquid
model.
","[{""version"":""v1"",""created"":""Thu, 8 Aug 1996 22:12:03 GMT""}]","2009-10-30"
"quant-ph/9608011","Andrew Steane","Andrew M. Steane (Department of Physics, University of Oxford)","The Ion Trap Quantum Information Processor","This is an invited contribution for Applied Physics B. It will be
  submitted at the end of September (1996), and I would greatly appreciate any
  constructive criticism or suggested additions before then (email
  a.steane@physics.ox.ac.uk). 37 pages plus 8 figures. Replaced version
  corrects figure references","Appl.Phys. B64 (1997) 623","10.1007/s003400050225",,"quant-ph",,"  An introductory review of the linear ion trap is given, with particular
regard to its use for quantum information processing. The discussion aims to
bring together ideas from information theory and experimental ion trapping, to
provide a resource to workers unfamiliar with one or the other of these
subjects. It is shown that information theory provides valuable concepts for
the experimental use of ion traps, especially error correction, and conversely
the ion trap provides a valuable link between information theory and physics,
with attendant physical insights. Example parameters are given for the case of
calcium ions. Passive stabilisation will allow about 200 computing operations
on 10 ions; with error correction this can be greatly extended.
","[{""version"":""v1"",""created"":""Thu, 8 Aug 1996 18:21:50 GMT""},{""version"":""v2"",""created"":""Fri, 9 Aug 1996 14:32:50 GMT""}]","2009-10-30"
"quant-ph/9608012","Raymond LaFlamme","Emanuel Knill and Raymond Laflamme","Concatenated Quantum Codes","16 pages in PostScirpt, the paper is also avalaible at
  http://qso.lanl.gov/qc/",,,,"quant-ph",,"  One of the main problems for the future of practical quantum computing is to
stabilize the computation against unwanted interactions with the environment
and imperfections in the applied operations. Existing proposals for quantum
memories and quantum channels require gates with asymptotically zero error to
store or transmit an input quantum state for arbitrarily long times or
distances with fixed error. In this report a method is given which has the
property that to store or transmit a qubit with maximum error $\epsilon$
requires gates with error at most $c\epsilon$ and storage or channel elements
with error at most $\epsilon$, independent of how long we wish to store the
state or how far we wish to transmit it. The method relies on using
concatenated quantum codes with hierarchically implemented recovery operations.
The overhead of the method is polynomial in the time of storage or the distance
of the transmission. Rigorous and heuristic lower bounds for the constant $c$
are given.
","[{""version"":""v1"",""created"":""Thu, 8 Aug 1996 23:13:46 GMT""}]","2007-05-23"
"quant-ph/9608013","Juan Leon","J. Leon (LAEFF and IMAFF, Madrid)","Time-of-arrival formalism for the relativistic particle","16 pages, no figures, uses LaTeX. The section ""Interpretation"" has
  been completely rewritten and some errors corrected","J.Phys.A30:4791-4802,1997","10.1088/0305-4470/30/13/027","LAEFF 96/17","quant-ph",,"  A suitable operator for the time-of-arrival at a detector is defined for the
free relativistic particle in 3+1 dimensions. For each detector position, there
exists a subspace of detected states in the Hilbert space of solutions to the
Klein Gordon equation. Orthogonality and completeness of the eigenfunctions of
the time-of-arrival operator apply inside this subspace, opening up a standard
probabilistic interpretation.
","[{""version"":""v1"",""created"":""Fri, 9 Aug 1996 14:58:58 GMT""},{""version"":""v2"",""created"":""Tue, 26 Nov 1996 14:20:03 GMT""}]","2008-11-26"
