"alg-geom/9608030",,"Eleny Ionel","Genus one enumerative invariants in P^n with fixed j invariant","LaTeX, 38 pages",,,,"alg-geom math.AG",,"  We prove recursive formulas for $\tau_d$, the number of degree $d$ elliptic
curves with fixed j-invariant in P^n. We use analysis to relate the classical
invariant $\tau_d$ to the genus one perturbed invariant $RT_{1,d}$ defined
recently by Ruan and Tian (the later invariant can be computed inductively). By
considering a sequence of perturbations converging to zero, we then apply
Taubes' Obstruction Bundle method to compute the difference between the two
invariants.
","[{""version"":""v1"",""created"":""Mon, 26 Aug 1996 20:34:00 GMT""}]","2008-02-03"
"alg-geom/9608031","Herbert Kanarek","Herbert Kanarek","Monodromy of hypergeometric functions arising from arrangements of
  hyperplanes","LaTex file, 33 pages, 6 figures",,,,"alg-geom math.AG",,"  Given an arrangement of hyperplanes in $\P^n$, possibly with non-normal
crossings, we give a vanishing lemma for the cohomology of the sheaf of
$q$-forms with logarithmic poles along our arrangement. We give a basis for the
ideal $\cal J$ of relations for the Orlik-Solomon's algebra. Under certain
genericity conditions it was shown by H.~Esnault, V.~Schechtman and E.~Viehweg
that the cohomology of a local system is given by the Aomoto complex. We
generalize this result to a deformation of local systems obtained via a
deformation of our arrangement. We calculate the Gau\ss-Manin connection for
this case. We give a basis for the Gau\ss-Manin bundle for which, with help of
the basis for $\cal J$, we give then a method to calculate a representation of
this connection. From here, with the results of K-T.~Chen or P.~Deligne, one
can calculate the monodromy representation. This gives a generalization of the
hypergeometric functions.
","[{""version"":""v1"",""created"":""Mon, 26 Aug 1996 21:45:37 GMT""}]","2008-02-03"
"alg-geom/9608032","Jun Li","Jun Li and Gang Tian","Virtual moduli cycles and Gromov-Witten invariants of general symplectic
  manifolds","LaTex. We updated the bibliography in the revised version",,,,"alg-geom math.AG",,"  We construct Gromov-Witten invariants of general symplectic manifolds.
","[{""version"":""v1"",""created"":""Mon, 26 Aug 1996 22:17:17 GMT""},{""version"":""v2"",""created"":""Wed, 18 Sep 1996 00:56:25 GMT""},{""version"":""v3"",""created"":""Thu, 19 Sep 1996 18:38:09 GMT""}]","2008-02-03"
"astro-ph/9608169","Krzysztof Stanek","M. Kiraga (Warsaw University), B. Paczynski, K. Z. Stanek (Princeton
  University)","The Color--Magnitude Diagram in Baade's Window Revisited","submitted to the Astrophysical Journal, 17 pages, 9 figures, 4
  figures included; all figures are available using
  ftp://www.astro.princeton.edu/stanek/Kiraga",,"10.1086/304441",,"astro-ph",,"  We have reanalyzed the OGLE $V$ and $I$ photometry of $\sim 500,000$ stars in
Baade's Window, and we confirm the extinction map published by Stanek (1996).
However, we find that the interpretation of the OGLE color--magnitude diagram
for the disk stars proposed by Paczy\'nski et al. (1994) was incorrect: the
dominant disk population in Baade's Window is old, and we find no evidence for
a large hole in the inner Galactic disk. We find evidence for a small
systematic error in the OGLE photometry for stars below the ``red clump'': the
faint stars with $V>18$ have their $(V-I)$ color indices too red by $\sim
0.1\;mag$. We find tentative evidence from the OGLE and HST photometry that the
the bulge main sequence turn--off point is brighter by $\sim 0.5 \;mag$ than it
is in either 47~Tuc or NGC~6791, indicating that the dominant population of the
Galactic bulge is considerably younger than those clusters.
","[{""version"":""v1"",""created"":""Mon, 26 Aug 1996 17:13:03 GMT""}]","2009-10-28"
"astro-ph/9608170","Paul Nandra","K. Nandra, I.M. George, R.F. Mushotzky, T.J. Turner, T. Yaqoob (LHEA,
  NASA/GSFC)","ASCA observations of Seyfert 1 galaxies: I. Data Analysis, Imaging and
  Timing","30 pages, 5 figures. LaTeX with encapsulated postscript. To appear in
  the Astrophysical Journal. Also available via
  http://lheawww.gsfc.nasa.gov/~nandra/pubs/paper1/abstract.html","Astrophys.J.Suppl.113:23,1997","10.1086/313053",,"astro-ph",,"  We present the first in a series of papers describing the X-ray properties of
a sample of 18 Seyfert 1 galaxies, using data obtained by \asca. The imaging
data reveal a number of serendipitous hard X-ray sources in some source fields,
but none contribute significantly to the hard X-ray flux of the AGN. All but
one of the Seyferts show evidence for variability on timescales of
minutes-hours, with the amplitude anti-correlated with the source luminosity,
confirming previous results. In at least 8 sources, there is evidence that the
variability amplitude below 2 keV is greater than that in the hard X-ray band,
perhaps indicating variable components other than the power-law in the soft
band. Ultra-rapid variability, implying significant power at frequencies $>
10^{-3}$~Hz is detected in at least 5 sources, but is difficult to detect in
most cases, due to the sampling and signal-to-noise ratio. In Mrk 766 and
MCG-6-30-15 there is also an indication that the high--frequency power--spectra
are variable in shape and/or intensity. There is similar evidence in NGC 4151,
but on longer time scales.
","[{""version"":""v1"",""created"":""Mon, 26 Aug 1996 19:51:26 GMT""}]","2008-11-26"
"astro-ph/9608171","Paul Nandra","K. Nandra, R.F. Mushotzky, T. Yaqoob, I.M. George, T.J. Turner (LHEA,
  NASA/GSFC)","Variability of the iron K-emission line in the Seyfert 1 galaxy NGC 3516","4 pages, 3 figures. LaTeX with encapsulated postscript. To appear in
  Monthly Notices of the Royal Astronomical Society Also available via
  http://lheawww.gsfc.nasa.gov/~nandra/pubs/3516/abstract.html",,"10.1093/mnras/284.2.L7",,"astro-ph",,"  We present strong evidence for variability of the flux of the iron K$\alpha$
emission line in the Seyfert 1 galaxy, NGC 3516. Two ASCA observations,
separated by $\sim 1$~yr, showed a marked decrease in continuum flux by $\sim
60$~per cent. The flux in the broad, iron K$\alpha$ line decreased by the same
factor in this time period, with no evidence for changes in the line profile.
The line variability is significant at $>99$~per cent confidence and rules out
models in which the line is produced in a molecular torus located at $>1$~pc
from the nucleus. An accretion disk is considerably more likely.
","[{""version"":""v1"",""created"":""Mon, 26 Aug 1996 21:32:22 GMT""}]","2016-01-13"
"astro-ph/9608172","Q. Daniel Wang","Q. Daniel Wang and Taisheng Ye","Under the Shadow of the Magellanic Bridge: A Measurement of the
  Extragalactic Background at $\sim 0.7$~keV","To appear in New Astronomy, 13 pages, including 4 Encapsulated
  Postscript figures, also available at
  http://www.astro.nwu.edu/astro/wqd/bridge",,"10.1016/S1384-1076(96)00017-6",,"astro-ph",,"  We measured the extragalactic 0.7 keV X-ray background by observing the X-ray
shadow of a neutral gas cloud in the Magellanic Bridge region. Two \rosat PSPC
observations of total 104~ks were complemented by a detailed H I mapping of the
cloud with both the Parkes 64~m telescope and the Australia Telescope Compact
Array. From the detected anti-correlation between the observed background
intensity and the \ion{H}{1} column density of the cloud, we derived the
unabsorbed extragalactic background intensity as 28 keV s^{-1} cm^{-2} keV^{-1}
sr^{-1} at 0.7~keV. The 95% confidence lower limit 18 keV s^{-1} cm^{-2} keV^
{-1} sr^{-1}} is greater than the expected point-like source contribution < 14
keV s^{-1} cm^{-2} keV^{-1} sr^{-1}, constrained by the mean source spectrum
together with the total background intensity in the 1-2 keV band. A significant
fraction of the 0.7 keV background likely arises in a diffuse hot intergalactic
medium of a few million degrees, as has been predicted in hydrodynamic
simulations of cosmological structure formation.
","[{""version"":""v1"",""created"":""Mon, 26 Aug 1996 22:46:38 GMT""}]","2009-10-28"
"astro-ph/9608173","Max Tegmark","Max Tegmark, Jens Villumsen","Is lensing of point sources a problem for future CMB experiments?","Expanded to match published version. 14 pages, with 3 figures
  included. Color figures at http://www.sns.ias.edu/~max/lensing.html (faster
  from the US), from http://www.mpa-garching.mpg.de/~max/lensing.html (faster
  from Europe) or from max@ias.edu","Mon.Not.Roy.Astron.Soc.289:169-174,1997","10.1093/mnras/289.1.169",,"astro-ph",,"  Weak gravitational lensing from large-scale structure enhances and reduces
the fluxes from extragalactic point sources with an rms amplitude of order 15%.
In cosmic microwave background (CMB) experiments, sources exceeding some flux
threshold are removed, which means that lensing will modulate the brightness
map of the remaining unresolved sources. Since this mean brightness is of order
100 micro-Kelvin at 30 GHz for a reasonable flux cut, one might be concerned
that this modulation could cause substantial problems for future CMB
experiments. We present a detailed calculation of this effect and, fortunately,
find that its power spectrum is always smaller than the normal point source
power spectrum. Thus although this effect should be taken into account when
analysing future high-precision CMB measurements, it will not substantially
reduce the accuracy with which cosmological parameters can be measured.
","[{""version"":""v1"",""created"":""Tue, 27 Aug 1996 10:56:37 GMT""},{""version"":""v2"",""created"":""Wed, 26 Mar 1997 16:41:02 GMT""}]","2015-06-24"
"astro-ph/9608174",,"R. Turolla, S. Zane, L. Zampieri and L. Nobili","Dynamical Comptonization in spherical flows: black hole accretion and
  stellar winds","11 pages with 3 ps figures, MNRAS to appear",,"10.1093/mnras/283.3.881",,"astro-ph",,"  The transport of photons in steady, spherical, scattering flows is
investigated. The moment equations are solved analytically for accretion onto a
Schwarzschild black hole, taking into full account relativistic effects. We
show that the emergent radiation spectrum is a power law at high frequencies
with a spectral index smaller (harder spectrum) than in the non--relativistic
case. Radiative transfer in an expanding envelope is also analyzed. We find
that adiabatic expansion produces a drift of injected monochromatic photons
towards lower frequencies and the formation of a power--law, low--energy tail
with spectral index $-3$.
","[{""version"":""v1"",""created"":""Tue, 27 Aug 1996 13:17:38 GMT""}]","2015-06-24"
"astro-ph/9608176","Diego Saez","D. S\'aez (1) and J.V. Arnau (2) ((1) Departamento de Astronom\'ia y
  Astrof\'isica. Universidad de Valencia. Burjassot. Valencia. Spain, (2)
  Departamento de Matem\'atica Aplicada. Universidad de Valencia. Burjassot.
  Valencia. Spain)","Learning from observations of the microwave background at small angular
  scales","15 pages (LATEX), 2 postcript figures, accepted in ApJ",,"10.1086/303622",,"astro-ph",,"  In this paper, we focus our attention on the following question: How well can
we recover the power spectrum of the cosmic microwave background from the maps
of a given experiment?. Each experiment is described by a a pixelization scale,
a beam size, a noise level and a sky coverage. We use accurate numerical
simulations of the microwave sky and a cold dark matter model for structure
formation in the universe. Angular scales smaller than those of previous
simulations are included. The spectrum obtained from the simulated maps is
appropriately compared with the theoretical one. Relative deviations between
these spectra are estimated. Various contributions to these deviations are
analyzed. The method used for spectra comparisons is discussed.
","[{""version"":""v1"",""created"":""Tue, 27 Aug 1996 15:29:38 GMT""}]","2016-08-15"
"atom-ph/9608002","Mark Hillery","Mark Hillery and Leonard Mlodinow","Quantized Fields in a Nonlinear Dielectric Medium: A Microscopic
  Approach","44 pages LaTex, no figures, submitted for publication",,"10.1103/PhysRevA.55.678",,"atom-ph physics.atom-ph",,"  Theories which have been used to describe the quantized electromagnetic field
interacting with a nonlinear dielectric medium are either phenomenological or
derived by quantizing the macroscopic Maxwell equations. Here we take a
different approach and derive a Hamiltonian describing interacting fields from
one which contains both field and matter degrees of freedom. The medium is
modelled as a collection of two-level atoms, and these interact with the
electromagnetic field. The atoms are grouped into effective spins and the
Holstein- Primakoff representation of the spin operators is used to expand them
in one over the total spin. When the lowest-order term is combined with the
free atomic and field Hamiltonians, a theory of noninteracting polaritons
results. When higher-order terms are expressed in terms of polariton operators,
standard nonlinear optical interactions emerge.
","[{""version"":""v1"",""created"":""Mon, 26 Aug 1996 20:26:02 GMT""}]","2016-08-31"
"chao-dyn/9608016","Arnd Baecker","R. Aurich, A. B\""acker, and F. Steiner","Mode fluctuations as fingerprint of chaotic and non-chaotic systems","44 pages, Postscript. The figures are included in low resolution
  only. A full version is available at
  http://www.physik.uni-ulm.de/theo/qc/baecker.html","Int. J. Mod. Phys. B 11 (1997) 805-849","10.1142/S0217979297000459",,"chao-dyn nlin.CD",,"  The mode-fluctuation distribution $P(W)$ is studied for chaotic as well as
for non-chaotic quantum billiards. This statistic is discussed in the broader
framework of the $E(k,L)$ functions being the probability of finding $k$ energy
levels in a randomly chosen interval of length $L$, and the distribution of
$n(L)$, where $n(L)$ is the number of levels in such an interval, and their
cumulants $c_k(L)$. It is demonstrated that the cumulants provide a possible
measure for the distinction between chaotic and non-chaotic systems. The
vanishing of the normalized cumulants $C_k$, $k\geq 3$, implies a Gaussian
behaviour of $P(W)$, which is realized in the case of chaotic systems, whereas
non-chaotic systems display non-vanishing values for these cumulants leading to
a non-Gaussian behaviour of $P(W)$. For some integrable systems there exist
rigorous proofs of the non-Gaussian behaviour which are also discussed. Our
numerical results and the rigorous results for integrable systems suggest that
a clear fingerprint of chaotic systems is provided by a Gaussian distribution
of the mode-fluctuation distribution $P(W)$.
","[{""version"":""v1"",""created"":""Mon, 26 Aug 1996 16:43:29 GMT""}]","2009-10-28"
"chem-ph/9608004","Bo Soderberg","Bo Soderberg (Dept. of Theoretical Physics, Lund Univ.)","Relation between a Screened Polyelectrolyte and a Field Theory","Important references added, and corresponding changes done. LaTeX
  file (using REVTeX), and two PostScript figures included with psfig",,,"LU TP 96-22","chem-ph cond-mat hep-lat mtrl-th physics.chem-ph",,"  There exists a generic relationship between the thermodynamics of a
continuous polymer with a generic self-interaction and the two-point function
of an interacting field-theory. In addition, the (2N)-point function of the
resulting field theory is similarly related to a system of N interacting
polymers.
  In the present paper, this relation is explored for the special case of a
polyelectrolyte, characterized by a screened Coulomb pair potential. The
corresponding field theory can be recast in a particularly simple form,
corresponding to a quantum-mechanical particle, self-interacting via the
emission and absorption of a massive scalar field.
  This is particularly useful in a perturbative treatment: perturbative
expansions for the polyelectrolyte can be simply derived from the loop
expansion for the related field-theoretical two-point function, for which
established computational methods exist.
","[{""version"":""v1"",""created"":""Tue, 27 Aug 1996 15:30:43 GMT""},{""version"":""v2"",""created"":""Wed, 11 Dec 1996 19:16:16 GMT""}]","2008-02-03"
"cmp-lg/9608017","Xu Donghua","Donghua Xu, Chew Lim Tan (National University of Singapore)","Automatic Alignment of English-Chinese Bilingual Texts of CNS News","9 pages, Postscript only. In the Proceedings of International
  Conference on Chinese Computing'96",,,,"cmp-lg cs.CL",,"  In this paper we address a method to align English-Chinese bilingual news
reports from China News Service, combining both lexical and satistical
approaches. Because of the sentential structure differences between English and
Chinese, matching at the sentence level as in many other works may result in
frequent matching of several sentences en masse. In view of this, the current
work also attempts to create shorter alignment pairs by permitting finer
matching between clauses from both texts if possible. The current method is
based on statiscal correlation between sentence or clause length of both texts
and at the same time uses obvious anchors such as numbers and place names
appearing frequently in the news reports as lexcial cues.
","[{""version"":""v1"",""created"":""Tue, 27 Aug 1996 09:05:04 GMT""}]","2008-02-03"
"cond-mat/9608121","Mikhail N. Kiselev","K.A.Kikoin, M.N.Kiselev and A.S.Mishchenko","Spin liquid in 3D Kondo lattice. High temperature regime","LaTeX, 8 pages plus 2 Encapsulated Postscript figures, Proceedings of
  SCES'96, to be published in Physica B",,"10.1016/S0921-4526(96)00623-0",,"cond-mat",,"  The mechanism explaining the key role of AFM correlations in formation of the
heavy fermion state is offered. It is shown that in the case of $(T^*-T_N)/T_N
<< 1$ the critical spin fluctuations transform the mean-field second-order
transition to RVB state into the crossover from high-temperature paramagnetic
behavior of localized spins to strongly correlated spin liquid with quasi
itinerant character of susceptibility. Thus the spin liquid state {\it by its
origin} is close to magnetic instability, so either short-range or long-range
AFM order should arise at low T.
","[{""version"":""v1"",""created"":""Mon, 26 Aug 1996 18:23:16 GMT""}]","2009-10-28"
"cond-mat/9608122",,"Flordivino Basco, Hiroshi Kohno, Hidetoshi Fukuyama (Department of
  Physics, University of Tokyo, Japan) and Ganapathy Baskaran (Institute of
  Advanced Studies, Princeton, NJ, USA)","g-on Mean Field Theory of the t-J Model","18 pages, 11 figures two of them are figure 8; submitted to Phys.
  Rev. B; notes and citations are added, as seen in page 17; E-mails:
  basco@monet.phys.s.u-tokyo.ac.jp, fukuyama@monet.phys.s.u-tokyo.ac.jp",,"10.1143/JPSJ.65.687",,"cond-mat",,"  Implication of our recent proposal [J. Phys. Soc. Jpn. 65 (1996) 687] to
treat large-amplitude gauge-field fluctuations around the slave-boson
mean-field theory for the t-J model has been explored in detail. By attaching
gauge flux to spinons and holons and then treating them as free g-on's which
respect the time-reversal symmetry, the optimum exclusion (g) and exchange (\a)
statistics have been determined in the plane of doping rate and temperature.
Two different relations between \a and g have been investigated, namely g=|\a|
(Case1) and g=|\a|(2-|\a|) (Case2). The results indicate that slave fermion is
favored at low doping while slave boson at high doping. For two dimension, in
Case1 intermediate statistics are found in between, while in Case2 no
intermediate statistics are found. The consequences of varying the
dimensionality and strength of J have been studied also. The latter has no
qualitative effect for both cases, while the former has a profound effect in
Case1.
","[{""version"":""v1"",""created"":""Mon, 26 Aug 1996 17:19:45 GMT""},{""version"":""v2"",""created"":""Sun, 15 Sep 1996 06:26:09 GMT""}]","2009-10-28"
"cond-mat/9608123","Wen-Sheng Zeng","W.-S.Zeng, O.Jepsen and V.Heine","The Structure of Barium in the hcp Phase Under High Pressure","29 pages, 8 figures",,"10.1088/0953-8984/9/17/001",,"cond-mat",,"  Recent experimental results on two hcp phases of barium under high pressure
show interesting variation of the lattice parameters. They are here interpreted
in terms of electronic structure calculation by using the LMTO method and
generalized pseudopotential theory (GPT) with a NFE-TBB approach. In phase II
the dramatic drop in c/a is an instability analogous to that in the group II
metals but with the transfer of s to d electrons playing a crucial role in Ba.
Meanwhile in phase V, the instability decrease a lot due to the core repulsion
at very high pressure. PACS numbers: 62.50+p, 61.66Bi, 71.15.Ap, 71.15Hx,
71.15La
","[{""version"":""v1"",""created"":""Mon, 26 Aug 1996 16:31:01 GMT""}]","2009-10-28"
"cond-mat/9608124","Sudip Chakravarty","Sudip Chakravarty","Dimensional Crossover in Quantum Antiferromagnets","RevTeX, 4 pages, 1 embedded postscript figure","Phys. Rev. Lett. 77, 4446 (1996).","10.1103/PhysRevLett.77.4446",,"cond-mat",,"  The dimensional crossover in a spin-$S$ nearest neighbor Heisenberg
antiferromagnet is discussed as it is tuned from a two-dimensional square
lattice, of lattice spacing $a$, towards a spin chain by varying the width
$L_y$ of a semi-infinite strip $L_x\times L_y$. For integer spins and arbitrary
$L_y$, and for half integer spins with $L_y/a$ an arbitrary even integer,
explicit analytical expressions for the zero temperature correlation length and
the spin gap are given. For half integer spins and $L_y/a$ an odd inetger, it
is shown that the $c=1$ behavior of the $SU(2)_1$ WZW fixed point is squeezed
out as the width $L_y\to \infty$; here $c$ is the conformal charge. The results
specialized to $S=1/2$ are relevant to spin-ladder systems.
","[{""version"":""v1"",""created"":""Mon, 26 Aug 1996 22:06:50 GMT""}]","2009-10-28"
"cond-mat/9608125","Misha Portnoi","M. E. Portnoi and E. I. Rashba","Theory of anyon excitons: Relation to excitons of nu=1/3 and nu=2/3
  incompressible liquids","26 pages with 9 figures, typos corrected","Phys. Rev. B 54 (1996) 13791","10.1103/PhysRevB.54.13791",,"cond-mat.mes-hall",,"  Elementary excitations of incompressible quantum liquids (IQL's) are anyons,
i.e., quasiparticles carrying fractional charges and obeying fractional
statistics. To find out how the properties of these quasiparticles manifest
themselves in the optical spectra, we have developed the anyon exciton model
(AEM) and compared the results with the finite-size data for excitons of nu=1/3
and nu=2/3 IQL's. The model considers an exciton as a neutral composite
consisting of three quasielectrons and a single hole. The AEM works well when
the separation between electron and hole confinement planes, h, is larger than
the magnetic length l. In the framework of the AEM an exciton possesses
momentum k and two internal quantum numbers, one of which can be chosen as the
angular momentum, L, of the k=0 state. Existence of the internal degrees of
freedom results in the multiple branch energy spectrum, crater-like electron
density shape and 120 degrees density correlations for k=0 excitons, and the
splitting of the electron shell into bunches for non-zero k excitons. For h
larger than 2l the bottom states obey the superselection rule L=3m (m are
integers starting from 2), all of them are hard core states. For h nearly 2l
there is one-to-one correspondence between the low-energy spectra found for the
AEM and the many- electron exciton spectra of the nu=2/3 IQL, whereas some
states are absent from the many-electron spectra of the nu=1/3 IQL. We argue
that this striking difference in the spectra originates from the different
populational statistics of the quasielectrons of charge conjugate IQL's and
show that the proper account of the statistical requirements eliminates
excessive states from the spectrum. Apparently, this phenomenon is the first
manifestation of the exclusion statistics in the anyon bound states.
","[{""version"":""v1"",""created"":""Mon, 26 Aug 1996 22:58:18 GMT""},{""version"":""v2"",""created"":""Tue, 26 May 1998 15:48:11 GMT""}]","2009-10-28"
"cond-mat/9608126","Takashi meijin Kimura","Takashi Kimura, Kazuhiko Kuroki, Hideo Aoki","Correlation functions in the three-chain Hubbard ladder","10 pages, revtex, to appear in Physical Review B as a Rapid
  Communication",,"10.1103/PhysRevB.54.R9608",,"cond-mat",,"  In order to check whether odd-numbered Tomonaga-Luttinger ladders are
dominated by antiferromagnetic correlations associated with gapless spin
excitations, correlation functions of the doped three-chain Hubbard model are
obtained with the bosonization at the renormalization-group fixed point. The
correlation of the singlet superconducting pairing across the central and edge
chains is found to be dominant, reflecting two gapful spin modes, while the
intra-edge spin density wave correlation, reflecting the gapless mode, is only
subdominant. This implies that, when there are multiple spin modes, a dominant
superconductivity can arise from the presence of {\it some} spin gap(s) despite
the coexistence of power-law correlated spins.
","[{""version"":""v1"",""created"":""Tue, 27 Aug 1996 03:00:34 GMT""}]","2009-10-28"
