"nucl-th/9608057","Roelof Bijker","R. Bijker (ICN/UNAM), F. Iachello (Yale) and A. Leviatan (Hebrew U.)","Strong decays of qqq baryons","Revised manuscript, 27 pages Revtex, 11 tables and 4 figures, to be
  published in Phys. Rev. D, February 1997","Phys.Rev. D55 (1997) 2862-2873","10.1103/PhysRevD.55.2862",,"nucl-th hep-ph",,"  We study strong decays of nonstrange baryons by making use of the algebraic
approach to hadron structure. Within this framework we derive closed
expressions for decay widths in an elementary-meson emission model and use
these to analyze the experimental data for N* -> N + pi, N* -> Delta + pi, N*
-> N + eta, Delta* -> N + pi, Delta* -> Delta + pi and Delta* -> Delta + eta
decays.
","[{""version"":""v1"",""created"":""Mon, 26 Aug 1996 17:14:45 GMT""},{""version"":""v2"",""created"":""Mon, 18 Nov 1996 17:53:42 GMT""}]","2009-10-30"
"nucl-th/9608058","Stephane Pepin","S. Pepin, Fl. Stancu (Liege University), M. Genovese, J.-M. Richard
  (Grenoble)","Multiquark Systems in a Constituent Quark Model with Chiral Dynamics","6 pages, Plain Latex, Contribution to the Workshop''Quark Confinement
  and the Hadron Spectrum II'', Como, Italy, June 26--29, 1996, to appear in
  the Proceedings, ed. Nora Brambilla, World Scientific",,,"ISN 96-94","nucl-th hep-ph",,"  We discuss the stability of multiquark systems within the recent model of
Glozman et al. where the chromomagnetic hyperfine interaction is replaced by
pseudoscalar-meson exchange. We find that such an interaction binds a heavy
tetraquark system $QQ\bar q\bar q$ ($Q=c, b$ and $q=u, d)$ by $0.2-0.4$ GeV.
This is at variance with results of previous models where $cc\bar q\bar q$ is
unstable.
","[{""version"":""v1"",""created"":""Tue, 27 Aug 1996 14:01:13 GMT""}]","2016-09-08"
"patt-sol/9608009","Todd Kapitula","Todd Kapitula","Bifurcating bright and dark solitary waves of the nearly nonlinear
  cubic-quintic Schrodinger equation","Latex, 39 pages, 7 figures (type ""latex main"" to latex the paper)",,,,"patt-sol nlin.PS",,"  The existence of bright and dark multi-bump solitary waves for
Ginzburg-Landau type perturbations of the cubic-quintic Schrodinger equation is
considered. The waves in question are not perturbations of known analytic
solitary waves, but instead arise as a bifurcation from a heteroclinic cycle in
a three dimensional ODE phase space. Using geometric singular perturbation
techniques, regions in parameter space for which 1-bump bright and dark
solitary waves will bifurcate are identified. The existence of N-bump dark
solitary waves is shown via an application of the Exchange Lemma with
Exponentially Small Error. N-bump bright solitary waves are shown to exist as a
consequence of the previous work of S. Maier-Paape and this author.
","[{""version"":""v1"",""created"":""Mon, 26 Aug 1996 20:25:27 GMT""}]","2008-02-03"
"q-alg/9608022","Chongying Dong","C. Dong, H. Li, G. Mason, P. Montague","The radical of a vertex operator algebra","tex 10 pages, to appear in : Proc. of the Conference on the Monster
  and Lie algebras at The Ohio State University, May 1996",,,,"q-alg math.QA",,"  The radical $J(V)$ of a vertex operator algebra $V$ is defined to be the
subspace of $V$ consisting of vectors $v$ such that the zero mode $o(v)=0$ on
$V$ where $o(v)=v_{wt v-1}$ if $v$ is homogeneous. We establish various facts
about $o(v),$ including the determination of $J(V)$ which is shown to be
essentially equal to $(L(0)+L(-1))V.$
","[{""version"":""v1"",""created"":""Mon, 26 Aug 1996 20:02:22 GMT""}]","2008-02-03"
"quant-ph/9608038","Todd A. Brun","T.A. Brun (Physics, Queen Mary and Westfield, London), N. Gisin (GAP,
  University of Geneva), P.F. O'Mahony and M. Rigo (Mathematics, Royal
  Holloway, London)","From quantum trajectories to classical orbits","7 pages RevTeX 3.0 + 2 figures (postscript). Submitted to Physical
  Review Letters",,"10.1016/S0375-9601(97)00217-X","QMW-PH-96-22","quant-ph",,"  Recently it has been shown that the evolution of open quantum systems may be
``unraveled'' into individual ``trajectories,'' providing powerful numerical
and conceptual tools. In this letter we use quantum trajectories to study
mesoscopic systems and their classical limit. We show that in this limit,
Quantum Jump (QJ) trajectories approach a diffusive limit very similar to the
Quantum State Diffusion (QSD) unraveling. The latter follows classical
trajectories in the classical limit. Hence, both unravelings show the rise of
classical orbits. This is true for both regular and chaotic systems (which
exhibit strange attractors).
","[{""version"":""v1"",""created"":""Mon, 26 Aug 1996 16:10:06 GMT""}]","2009-10-30"
"quant-ph/9608039","Ricardo Moritz Cavalcanti","R. M. Cavalcanti (PUC-Rio) and C. A. A. de Carvalho (UFRJ)","Subtleties in Quantum Mechanical Metastability","8 pages, revtex, a few minor changes, some references added",,,,"quant-ph cond-mat hep-th",,"  We present a detailed discussion of some features of quantum mechanical
metastability. We analyze the nature of decaying (quasistationary) states and
the regime of validity of the exponencial law, as well as decays at finite
temperature. We resort to very simple systems and elementary techniques to
emphasize subtle aspects of the problem.
","[{""version"":""v1"",""created"":""Mon, 26 Aug 1996 16:51:51 GMT""},{""version"":""v2"",""created"":""Tue, 27 May 1997 02:13:14 GMT""}]","2008-02-03"
"quant-ph/9608040","Alan Kostelecky","Robert Bluhm, Alan Kostelecky, and Bogdan Tudose","Revival Structure of Stark Wave Packets","latex file, 11 pages","Phys.Rev.A55:819,1997","10.1103/PhysRevA.55.819","IUHET 327, January 1996","quant-ph",,"  The revival structure of Stark wave packets is considered. These wave packets
have energies depending on two quantum numbers and are characterized by two
sets of classical periods and revival times. The additional time scales result
in revival structures different from those of free Rydberg wave packets. We
show that Stark wave packets can exhibit fractional revivals. We also show that
these wave packets exhibit particular features unique to the Stark effect. For
instance, the wave functions can be separated into distinct sums over even and
odd values of the principal quantum number. These even and odd superpositions
interfere in different ways, which results in unexpected periodicities in the
interferograms of Stark wave packets.
","[{""version"":""v1"",""created"":""Mon, 26 Aug 1996 21:48:50 GMT""}]","2009-09-25"
"quant-ph/9608041","Thorsten Koehler","Thorsten Koehler","Quantum jumps in hydrogen-like systems","7 pages RevTeX + 2 figures Phys. Rev A accepted",,"10.1103/PhysRevA.54.4553",,"quant-ph",,"  In this paper it is shown that the Lyman-$\alpha$ transition of a single
hydrogen-like system driven by a laser exhibits macroscopic dark periods,
provided there exists an additional constant electric field. We describe the
photon-counting process under the condition that the polarization of the laser
coincides with the direction of the constant electric field. The theoretical
results are given for the example of $^4{He}^+$. We show that the emission
behavior depends sensitively on the Lamb shift (W.E. Lamb, R.C. Retherford,
Phys. Rev. 72, 241 (1947)) between the $2s_{1/2}$ and $2p_{1/2}$ energy levels.
A possibly realizable measurement of the mean duration of the dark periods
should give quantitative information about the above energy difference by using
the proposed photon-counting process.
","[{""version"":""v1"",""created"":""Tue, 27 Aug 1996 08:49:04 GMT""}]","2016-09-08"
"solv-int/9608009","Kakei Saburo","Saburo Kakei","Common Algebraic Structure for the Calogero-Sutherland Models","7 pages, LaTeX, no figures, some text and references added, minor
  misprints corrected","J. Phys. A29 (1996) L619-L624","10.1088/0305-4470/29/24/002",,"solv-int cond-mat hep-th math.QA nlin.SI q-alg",,"  We investigate common algebraic structure for the rational and trigonometric
Calogero-Sutherland models by using the exchange-operator formalism. We show
that the set of the Jack polynomials whose arguments are Dunkl-type operators
provides an orthogonal basis for the rational case.
","[{""version"":""v1"",""created"":""Tue, 27 Aug 1996 05:13:43 GMT""},{""version"":""v2"",""created"":""Tue, 29 Oct 1996 03:58:20 GMT""}]","2009-10-30"
"solv-int/9608010","Jarmo Hietarinta","Jarmo Hietarinta","Nambu tensors and commuting vector fields","9 pages in LaTeX2e",,,,"solv-int hep-th nlin.SI",,"  Takhtajan has recently studied the consistency conditions for Nambu brackets,
and suggested that they have to be skew-symmetric, and satisfy Leibnitz rule
and the Fundamental Identity (FI, it is a generalization of the Jacobi
identity). If the n'th order Nambu brackets in dimension N is written in terms
of the Nambu tensor \eta, the FI implies two conditions on it, one algebraic
and one differential. The algebraic part of FI implies decomposability of \eta
and in this letter we show that the Nambu bracket can then be written in terms
of the usual totally antisymmetric n-dimensional tensor and n vector fields D.
Our main result is that the differential part of the FI is satisfied iff the
vector fields D commute. Examples are provided by integrable Hamiltonian
systems. It turns out that then the Nambu bracket itself guarantees that the
motions stays on the manifold defined by the constants of motion of the
integrable system, while the n-1 Nambu Hamiltonians determine the (possibly
non-integrable) motion on this manifold.
","[{""version"":""v1"",""created"":""Tue, 27 Aug 1996 13:15:29 GMT""}]","2008-02-03"
