"cond-mat/9608127","Dr Robert J. Bursill","G. A. Gehring (University of Sheffield, UK), R. J. Bursill (UNSW,
  Australia) and T. Xiang (IRC for Superconductivity, Cambridge)","Applications of the density matrix renormalisation group to problems in
  magnetism","14 pages, Standard Latex File + 4 PostScript figures available on
  request. To appear in Acta Physica Polonica. Corrects some references","Acta Physica Polonica A, 1997, Vol.91, pp.105-119",,"SHEF-PHYS-1097424","cond-mat",,"  We review White's density matrix renormalisation group method, an
increasingly popular method for the solution of low dimensional quantum
Hamiltonians. We describe some applications to frustrated spin systems, quantum
critical phenomena, two dimensional classical and one dimensional quantum
systems at non-zero temperature, and low energy properties of two dimensional
quantum models such as the Hubbard and Heisenberg Hamiltonians.
","[{""version"":""v1"",""created"":""Tue, 27 Aug 1996 14:27:06 GMT""},{""version"":""v2"",""created"":""Fri, 30 Aug 1996 02:01:36 GMT""}]","2008-02-03"
"cond-mat/9608128",,"Yu-Liang Liu, Zhao-Bin Su, and Lu Yu (ICTP, Trieste, Italy and ITP,
  CAS, Beijing, China)","Non-Fermi liquid behavior in an extended Anderson model","REVTEX, 17 pages, no figures, to be published in Phys. Rev. B",,"10.1103/PhysRevB.54.15185","IC/96/155","cond-mat",,"  An extended Anderson model, including screening channels (non-hybridizing,
but interacting with the local orbit), is studied within the Anderson-Yuval
approach, originally devised for the single-channel Kondo problem. By comparing
the perturbation expansions of this model and a generalized resonant level
model, the spin-spin correlation functions are calculated which show non-Fermi
liquid exponent depending on the strength of the scattering potential. The
relevance of this result to experiments in some heavy fermion systems is
briefly discussed.
","[{""version"":""v1"",""created"":""Tue, 27 Aug 1996 10:01:46 GMT""}]","2009-10-28"
"cond-mat/9608129","Guido Goldoni","G. Goldoni (1), F. Rossi (1), E. Molinari (1), A. Fasolino (1,2) R.
  Rinaldi (3), and R. Cingolani (3) ((1) Dipartimento di Fisica, Univ. of
  Modena, Italy (2) Inst. of Theor. Physics, Univ. of Nijmegen, The Netherlands
  (3) Dipartimento di Scienza dei Materiali, Univ. of Lecce, Italy)","Valence band spectroscopy in V-grooved quantum wires","To be published in Appl. Phys. Lett. (8 pages in REVTeX, two
  postscipt figures)","App. Phys. Lett. V. 69, 2965 (1996)","10.1063/1.117745",,"cond-mat",,"  We present a combined theoretical and experimental study of the anisotropy in
the optical absorption of V-shaped quantum wires. By means of realistic band
structure calculations for these structures, we show that detailed information
on the heavy- and light-hole states can be singled out from the anisotropy
spectra {\em independently of the electron confinement}, thus allowing accurate
valence band spectroscopy.
","[{""version"":""v1"",""created"":""Tue, 27 Aug 1996 10:54:29 GMT""}]","2009-10-28"
"cond-mat/9608130",,"C. N. Likos, Saverio Moroni and Gaetano Senatore","Density-functional theory of freezing of quantum liquids at zero
  temperature using exact liquid-state linear response","15 pages, REVTeX, 10 figures",,"10.1103/PhysRevB.55.8867",,"cond-mat",,"  We apply density functional theory to study the freezing of superfluid
{$^{4}\rm{He}$}, charged bosons and charged fermions at zero temperature. We
employ accurate Quantum Monte Carlo data for the linear response function in
the uniform phase of these systems, a quantity that has different behavior for
large values of the wavevector than previously assumed. We find that, as a
result of this {\it{exact}} behavior, different approximations in the density
functional theory of freezing that involve linear response, all fail to
correctly describe the crystallization in {\it{three dimensions}}, while
yielding satisfactory predictions in {\it{two dimensions}}. This demonstrates
the shortcomings of the currently popular density functional approximate
theories to describe $3d$-freezing in the quantum regime. We also investigate
the consequences of the exact asymptotic behavior of response functions on the
form of effective interactions and polarization potentials in the electron gas,
at small distances.
","[{""version"":""v1"",""created"":""Tue, 27 Aug 1996 12:57:35 GMT""}]","2009-10-28"
"cond-mat/9608132","Giuseppe G. N. Angilella","Giuseppe G.N. Angilella, Renato Pucci, and Fabio Siringo","Interplay among critical temperature, hole content, and pressure in the
  cuprate superconductors","REVTeX 8 pages, including 5 embedded PostScript figures; other
  required macros included; to be published in Phys. Rev. B (vol. 54)","Phys. Rev. B 54, 15471 (1996)","10.1103/PhysRevB.54.15471","PP.DipFis.UniCT:95/12","cond-mat supr-con",,"  Within a BCS-type mean-field approach to the extended Hubbard model, a
nontrivial dependence of T_c on the hole content per unit CuO_2 is recovered,
in good agreement with the celebrated non-monotonic universal behaviour at
normal pressure. Evaluation of T_c at higher pressures is then made possible by
the introduction of an explicit dependence of the tight-binding band and of the
carrier concentration on pressure P. Comparison with the known experimental
data for underdoped Bi2212 allows to single out an `intrinsic' contribution to
d T_c / d P from that due to the carrier concentration, and provides a
remarkable estimate of the dependence of the inter-site coupling strength on
the lattice scale.
","[{""version"":""v1"",""created"":""Tue, 27 Aug 1996 13:57:01 GMT""}]","2007-05-23"
"gr-qc/9608062","Gregory Harry","Ho Jung Paik","Spheres - Omni-directional multi-mode gravitational-wave antennas for
  the next generation","15 pages, 4 figures. To appear in Proceedings of the Pacific
  Conference on Gravitation and Cosmology",,"10.1007/978-94-011-5812-1_54",,"gr-qc",,"  The construction of a massive (~ 40 ton) spherical antennas for gravitational
wave astronomy has been proposed by a number of groups worldwide. Summed over
all five quadrupole modes, the sphere has a direction-independent cross
section, permitting full-sky coverage. Combined with its enhanced sensitivity
due to its multi-nature and increased mass, sphereical detectors make ideal
instruments for observational astronomy. Numerical calculations have shown that
gravitational-wave signals from coalescing neutron star binaries and dynamic
instabilities of rapidly rotating stars in the Virgo cluster can be resolved
with a spherical antenna with a near quantum-limited sensitivity.
","[{""version"":""v1"",""created"":""Mon, 26 Aug 1996 20:17:29 GMT""}]","2016-01-27"
"gr-qc/9608063","Anzhong Wang","Anzhong Wang and Henrique P. de Oliveira","Critical phenomena of collapsing massless scalar wave packets","Latex file, including 2 figures, avalaible upon request","Phys.Rev.D56:753-761,1997","10.1103/PhysRevD.56.753",,"gr-qc",,"  An analytical model that represents the collapse of a massless scalar wave
packet with continuous self-similarity is constructed, and critical phenomena
are found. In the supercritical case, the mass of black holes is finite and has
the form $M \propto (p - p^{*})^{\gamma}$, with $\gamma = 1/2$.
","[{""version"":""v1"",""created"":""Mon, 26 Aug 1996 20:36:18 GMT""},{""version"":""v2"",""created"":""Wed, 28 Aug 1996 16:02:14 GMT""}]","2009-09-25"
"hep-lat/9608139","Andreas S. Kronfeld","Andreas S. Kronfeld","Binding Energies in Nonrelativistic Field Theories","4 pages, 1 figure, poster presented at LATTICE96(heavy quarks)","Nucl.Phys.Proc.Suppl. 53 (1997) 401-404","10.1016/S0920-5632(96)00671-8","FERMILAB-CONF-96/237-T","hep-lat",,"  Relativistic corrections communicate the binding energy of a bound state to
its kinetic mass. This mechanism is reviewed and used to explain anomalous
results of Collins, Edwards, Heller, and Sloan (hep-lat/9512026), which
compared rest and kinetic masses of heavy-light mesons and quarkonia.
","[{""version"":""v1"",""created"":""Mon, 26 Aug 1996 19:47:22 GMT""}]","2009-10-28"
"hep-lat/9608140","Roy Luo","Yubing Luo","Staggered fermions and their $O(a)$ improvements","3 pages, talk presented at LATTICE'96(Improvement)","Nucl.Phys.Proc.Suppl. 53 (1997) 902-904","10.1016/S0920-5632(96)00814-6","CU-TP-779","hep-lat",,"  Expanding upon the arguments of Sharpe, we explicitly implement the Symanzik
improvement program demonstrating the absence of order $a$ terms in the
staggered fermion action. We propose a general program to improve fermion
operators to remove $O(a)$ corrections from their matrix elements, and
demonstrate this program for the examples of matrix elements of fermion
bilinears and $B_K$. We also determine the additional operators which must be
added to improve the staggered fermion currents.
","[{""version"":""v1"",""created"":""Mon, 26 Aug 1996 17:21:15 GMT""}]","2015-06-25"
"hep-lat/9608141","Frithjof Karsch","B. Beinlich, F. Karsch and A. Peikert","SU(3) Latent Heat and Surface Tension from Tree Level and Tadpole
  Improved Actions","11 pages, LaTeX2e File, 3 Postscript figures","Phys.Lett. B390 (1997) 268-274","10.1016/S0370-2693(96)01401-3","BI-TP 96/24","hep-lat",,"  We analyze the latent heat and surface tension at the SU(3) deconfinement
phase transition with tree level and tadpole improved Symanzik actions on
lattices with temporal extent $N_\tau = 3$ and 4 and spatial extent $N_\sigma/
N_\tau = 4$, 6 and 8. In comparison to the standard Wilson action we do find a
drastic reduction of cut-off effects already with tree level improved actions.
On lattices with temporal extent $N_\tau=4$ results for the surface tension and
latent heat obtained with a tree level improved action agree well with those
obtained with a tadpole improved action. A comparison with $N_\tau=3$
calculations, however, shows that results obtained with tadpole action remain
unaffected by cut-off effects even on this coarse lattice, while the tree level
action becomes sensitive to the cut-off. For the surface tension and latent
heat we find $\sigma_I/ T_c^3 = 0.0155~(16)$ and $\Delta\epsilon/T_c^4 =
1.40~(9)$, respectively.
","[{""version"":""v1"",""created"":""Tue, 27 Aug 1996 09:49:56 GMT""}]","2009-10-28"
"hep-lat/9608142","Shoji Hashimoto","JLQCD Collaboration: S. Aoki, M. Fukugita, S. Hashimoto, N. Ishizuka,
  Y. Iwasaki, K. Kanaya, Y. Kuramashi, H. Mino, M. Okawa, A. Ukawa and T.
  Yoshie","Continuum Limit of the Heavy-Light Decay Constant with the Quenched
  Wilson Quark Action","3 pages including 5 figures, Talk presented at LATTICE96(heavy
  quarks) by S. Hashimoto","Nucl.Phys.Proc.Suppl. 53 (1997) 355-357","10.1016/S0920-5632(96)00658-5",,"hep-lat",,"  We explore the problems in calculating the decay constant for heavy-light
mesons using the quenched Wilson quark action for both heavy and light quarks.
We find that the continuum limit of the decay constant is reasonably converged
among different prescriptions after the continuum limit is taken. A number of
technical problems associated with prescriptions are also addressed.
","[{""version"":""v1"",""created"":""Tue, 27 Aug 1996 12:59:18 GMT""}]","2009-10-28"
"hep-ph/9608436",,"M. Peter","Threshold Top Quark Production in $e^+e^-$ Annihilation: Rescattering
  Corrections","17 pages LaTeX, 8 figures. Talk presented at the XXXVI Cracow School
  of Theoretical Physics, Zakopane, June 1-10. The complete paper, including
  figures, is also available via anonymous ftp at
  ftp://www-ttp.physik.uni-karlsruhe.de/ , or via www at
  http://www-ttp.physik.uni-karlsruhe.de/cgi-bin/preprints/","Acta Phys.Polon.B27:3805-3818,1996",,"TTP96-36","hep-ph",,"  Top quark pair production close to threshold at a next linear collider is
discussed, with special focus on the influence of rescattering corrections.
Numerical results are shown for the differential cross-section, i.e. the
momentum distribution and the forward backward asymmetry, and for moments of
the angular distribution of leptons arising from the semileptonic top quark
decay.
","[{""version"":""v1"",""created"":""Mon, 26 Aug 1996 17:56:46 GMT""}]","2011-03-02"
"hep-ph/9608442","Agustin Nieto","Agustin Nieto (Ohio State University)","Thermodynamics of QCD at high temperature","4 pages, LaTeX using sprocl.sty. Invited talk presented at DPF96 in
  Minneapolis, August 1996",,,"OHSTPY-HEP-T-96-021","hep-ph",,"  A hierarchy of effective field theories is used to separate the contributions
from different momentum scales and to calculate the free energy of QCD at high
temperature in powers of the coupling constant up to order $g^5$. The behavior
of the perturbative series will also be discussed.
","[{""version"":""v1"",""created"":""Mon, 26 Aug 1996 16:26:42 GMT""}]","2007-05-23"
"hep-ph/9608443","Alberto Santoro","G.Alves(LAFEX/CBPF), E.Levin(FNAL/St.Petersburg) and A. Santoro
  (FNAL/LAFEX,CBPF)","Diffractive Production of $b \bar b$ in Proton - Antiproton Collision at
  the Tevatron","23 pages, 10 figures, latex file","Phys. Rev. D 55, 2683 (1997)","10.1103/PhysRevD.55.2683","FERMILAB-PUB-96-242-t;CBPF-NF-046/96","hep-ph",,"  We show that the cross section of the diffractive production of $b \bar b$
can be described as the sum of two contributions: the first is proportional to
the probability of finding a small size $b \bar b$ color dipole in the fast
hadron wave function before the interaction with a target, while the second is
the $b \bar b$-production after or during the interaction with the target. The
formulae are presented as well as the discussion of the interralation between
these two contributions and the Ingelman- Schlein and coherent diffraction
mechanisms. The main precdition is that the coherent diffraction mechanism
dominates at least at the Tevatron Energies, giving the unique possibility to
study it experimentally.
","[{""version"":""v1"",""created"":""Mon, 26 Aug 1996 17:05:36 GMT""}]","2016-08-24"
"hep-ph/9608444","Debajyoti Choudhury","Debajyoti Choudhury (MPI, Munich)","Light Gluino and Tevatron Data","LaTeX, 8 pages, 2 figs (embedded)",,,"MPI-PTh/96-74","hep-ph",,"  A very light gluino ($m_{\tilde g} \lsim 2 \gev$) is still consistent with
experimental data and is attractive from a theoretical standpoint. This has
been shown to lead to a small gluino content of the proton. We use this effect
to demonstrate that such a light gluino could lead to a striking enhancement,
at Tevatron, of monojets accompanied by large missing momentum. A reanalysis of
the existing data may thus rule out a light gluino for a common squark mass of
upto $\sim 600 \gev$.
","[{""version"":""v1"",""created"":""Mon, 26 Aug 1996 20:53:00 GMT""}]","2007-05-23"
"hep-ph/9608445","Hai-Yang Cheng","Hai-Yang Cheng","Baryonic Form Factors in the Nonrelativistic Quark Model","To appear in proceedings of the 1996 DPF Meeting of the American
  Physical Society, Minneapolis, Minnesota, Aug 10-15, 1996, 3 pages",,,,"hep-ph",,"  Weak current-induced baryonic form factors at zero recoil are evaluated in
the rest frame of the heavy parent baryon using the nonrelativistic quark
model. Contrary to previous similar work in the literature, our quark model
results do satisfy the constraints imposed by heavy quark symmetry for
heavy-heavy baryon transitions. Assuming a dipole $q^2$ behavior, we have
applied the quark model form factors to nonleptonic, semileptonic and weak
radiative decays of the heavy baryons.
","[{""version"":""v1"",""created"":""Mon, 26 Aug 1996 23:06:48 GMT""}]","2007-05-23"
"hep-ph/9608446","Hai-Yang Cheng","Hai-Yang Cheng","Mesonic Form Factors in the Light-Front Quark Model","To appear in proceedings of the 1996 DPF Meeting of the American
  Physical Society, Minneapolis, Minnesota, Aug 10-15, 1996, 4 pages",,,,"hep-ph",,"  Form factors for $P\to P$ and $P\to V$ transitions due to the valence-quark
configuration are calculated directly in the physical time-like range of
momentum transfer within the light-front quark model. It is pointed out that
the Bauer-Stech-Wirbel type of light-front wave function fails to give a
correct normalization for the Isgur-Wise function at zero recoil in $P\to V$
transition. Some of the $P\to V$ form factors are found to depend on the
recoiling direction of the daughter mesons relative to their parents. Thus, the
inclusion of the non-valence contribution arising from quark-pair creation is
mandatory in order to ensure that the physical form factors are independent of
the recoiling direction.
","[{""version"":""v1"",""created"":""Mon, 26 Aug 1996 23:07:00 GMT""}]","2007-05-23"
"hep-ph/9608447","Teshima Tadayuki","Tadayuki Teshima and Toyokazu Sakai","Violation of universal Yukawa coupling and quark masses","20 pages, abstract is replaced","Prog.Theor.Phys. 97 (1997) 653-664","10.1143/PTP.97.653","CU/TP-96-5","hep-ph",,"  We analyse the quark mass hierarchy and CKM matrix using the universal Yukawa
coupling model with small violations precisely. We estimate the ranges of the
values of 8 violation parameters (delta1u, delta2u, delta3u, delta1d, delta2d,
delta3d, phi2, phi3) in our quark mass matrices satisfying quark mass ratios
and CKM matrix, where phi2, phi3 are phases. Without these phases, the solution
  satisfying quark mass ratios and CKM matrix is not obtained. These parameters
obtained can explain the CP violation effects.
","[{""version"":""v1"",""created"":""Tue, 27 Aug 1996 00:56:51 GMT""},{""version"":""v2"",""created"":""Wed, 28 Aug 1996 02:09:22 GMT""}]","2016-09-06"
"hep-ph/9608448",,"Aiichi Iwazaki","Ferromagnetic Domain Wall and Primeval Magnetic Field","zero point energy missed in previous version is included","Phys.Rev. D56 (1997) 2435-2438","10.1103/PhysRevD.56.2435",,"hep-ph",,"  We show that coherent magnetic field is generated spontaneously when a large
domain wall is created in the early universe. It is caused by two dimensional
massless fermions bounded to the domain wall soliton. We point out that the
magnetic field is a candidate of primordial magnetic field.
","[{""version"":""v1"",""created"":""Tue, 27 Aug 1996 03:18:36 GMT""},{""version"":""v2"",""created"":""Thu, 27 Feb 1997 01:39:19 GMT""}]","2009-10-28"
"hep-ph/9608449",,"Christoph Greub, Tobias Hurth","Towards a next-to-leading logarithmic result in $B \to X_s \gamma$","5 pages, 1 figure included, uses sprocl.sty and psfig.sty. Submitted
  for the DPF96 proceedings",,,"SLAC-PUB-7267; ITP-SB-96-46","hep-ph",,"  The calculation of the $O(\a_s)$ virtual corrections to the matrix element of
the inclusive decay $b \to s \gamma$ is reported. These contributions
drastically reduce the large renormalization scale dependence of the leading
logarithmic calculation. Combining these results with the preliminary result
for the Wilson coefficient $C_7(m_b)$ calculated recently by Chetyrkin, Misiak,
and M\""unz, we estimate the branching ratio to be $BR(B \to X_s \gamma)=(3.25
\pm 0.50) \times 10^{-4}$.
","[{""version"":""v1"",""created"":""Tue, 27 Aug 1996 06:22:23 GMT""}]","2007-05-23"
"hep-ph/9608450","Martti Raidal","G. Barenboim, J. Bernabeu and M. Raidal","Spontaneous CP violation in the left-right model and the kaon system","22 pages, LATEX, 6 postscript figures included","Nucl.Phys.B478:527-543,1996","10.1016/0550-3213(96)00441-5","FTUV/96-24, IFIC/96-26","hep-ph",,"  A left-right model with spontaneous $CP$ breakdown, consistent with the
particle physics phenomenology, is presented. Constraints on free parameters of
the model: mass of the new right handed gauge boson $M_2$ and ratio $r$ of the
two vacuum expectation values of the bidoublet, are found from the measurement
of $\epsilon$ in the kaon system. For most of the parameter space, $M_2$ is
restricted to be below 10 TeV. Higher masses can be achieved only by fine
tuning of Kobayashi-Maskawa matrix elements, quark masses, $r$ and the phase
$\alpha$ which is the unique source of $CP$-violation in the model. Large
number of combinations of signs of quark masses, which are observables of the
model, are found to be not allowed since they contradict with data. The range
of $\epsilon'/\epsilon$ the model predicts is around $10^{-4}$ in magnitude.
","[{""version"":""v1"",""created"":""Tue, 27 Aug 1996 08:09:07 GMT""}]","2010-11-23"
"hep-ph/9608451",,"Marco Genovese","A Unified picture of glueball candidates $f_0(1500)$ and $f_0(1700)$","7 pages",,,"ISN 96.93","hep-ph",,"  A simple mixing scheme describing the $f_0(1500)$ and the $f_0(1700)$ as
mixed states of a $\bar s s$ meson and a digluonium is reconsidered at the
light of new experimental data.
","[{""version"":""v1"",""created"":""Tue, 27 Aug 1996 11:55:37 GMT""}]","2007-05-23"
"hep-th/9608173",,"P.M. Cowdall, H. Lu, C.N. Pope, K.S. Stelle and P.K. Townsend","Domain Walls in Massive Supergravities","latex, 32 papes, no figures, further comments and references added","Nucl.Phys.B486:49-76,1997","10.1016/S0550-3213(96)00609-8","CTP TAMU-26/96, DAMPT-R/96/32, Imperial/TP/95-96/68, SISSA 124/96/EP","hep-th",,"  We show how toroidally-compactified eleven-dimensional supergravity can be
consistently truncated to yield a variety of maximally-supersymmetric
``massive'' supergravities in spacetime dimensions $D\le 8$. The mass terms
arise as a consequence of making a more general ansatz than that in usual
Kaluza-Klein dimensional reduction, in which one or more axions are given an
additional linear dependence on one of the compactification coordinates. The
lower-dimensional theories are nevertheless consistent truncations of
eleven-dimensional supergravity. Owing to the fact that the generalised
reduction commutes neither with U-duality nor with ordinary dimensional
reduction, many different massive theories can result. The simplest examples
arise when just a single axion has the additional linear coordinate dependence.
We find five inequivalent such theories in D=7, and 71 inequivalent ones in
D=4. The massive theories admit no maximally-symmetric vacuum solution, but
they do admit $(D-2)$-brane solutions, i.e. domain walls, which preserve half
the supersymmetry. We present examples of these solutions, and their oxidations
to D=11. Some of the latter are new solutions of D=11 supergravity.
","[{""version"":""v1"",""created"":""Mon, 26 Aug 1996 16:26:29 GMT""},{""version"":""v2"",""created"":""Mon, 16 Sep 1996 15:45:41 GMT""},{""version"":""v3"",""created"":""Tue, 5 Nov 1996 00:43:22 GMT""}]","2009-10-07"
"hep-th/9608174","Andrew Waldron","Peter van Nieuwenhuizen and Andrew Waldron","On Euclidean spinors and Wick rotations","19 pages, LaTex","Phys.Lett. B389 (1996) 29-36","10.1016/S0370-2693(96)01251-8","ITP-SB-96-44","hep-th",,"  We propose a continuous Wick rotation for Dirac, Majorana and Weyl spinors
from Minkowski spacetime to Euclidean space which treats fermions on the same
footing as bosons. The result is a recipe to construct a supersymmetric
Euclidean theory from any supersymmetric Minkowski theory. This Wick rotation
is identified as a complex Lorentz boost in a five-dimensional space and acts
uniformly on bosons and fermions. For Majorana and Weyl spinors our approach is
reminiscent of the traditional Osterwalder Schrader approach in which spinors
are ``doubled'' but the action is not hermitean. However, for Dirac spinors our
work provides a link to the work of Schwinger and Zumino in which hermiticity
is maintained but spinors are not doubled. Our work differs from recent work by
Mehta since we introduce no external metric and transform only the basic
fields.
","[{""version"":""v1"",""created"":""Mon, 26 Aug 1996 20:04:37 GMT""}]","2009-10-30"
"hep-th/9608175","Christian Schubert","Denny Fliegner, Michael G. Schmidt, Christian Schubert","Three Applications of the String-Inspired Technique to Quantum
  Electrodynamics","10 pages, uuencoded Postscript-File, talk given by C. Schubert at the
  Zeuthen Workshop on Elementary Particle Theory: QCD and QED in Higher Orders,
  Rheinsberg, Germany, 21-26 Apr 1996","Nucl.Phys.Proc.Suppl. 51C (1996) 174-182","10.1016/S0920-5632(96)90022-5","HD-THEP-96/18, HUB-EP-96/19","hep-th",,"  We discuss the following recent applications of the ``string-inspired''
worldline technique to calculations in quantum electrodynamics: i) Photon
splitting in a constant magnetic field, ii) The two-loop Euler-Heisenberg
Lagrangian, iii) A progress report on a recalculation of the three-loop QED
beta -- function.
","[{""version"":""v1"",""created"":""Mon, 26 Aug 1996 23:16:53 GMT""}]","2015-06-26"
"hep-th/9608176","Yutaka Hosotani","Yutaka Hosotani and Ramon Rodriguez","Anomalous Behavior in the Massive Schwinger Model","14 pages. LaTex with epsf.sty. 6 ps figures included","Phys.Lett. B389 (1996) 121-128","10.1016/S0370-2693(96)01252-X","UMN-TH-1504/96, NUC-MINN-96/13-T","hep-th",,"  We evaluate the chiral condensate and Polyakov loop in two-dimensional QED
with a fermion of an arbitrary mass ($m$). We find discontinuous $m$ dependence
in the chiral condensate and anomalous temperature dependence in Polyakov loops
when the vacuum angle $\theta$$\sim$$\pi$ and $m$=O($e$). These nonperturbative
phenomena are due to the bifurcation process in the solutions to the vacuum
eigenvalue equation.
","[{""version"":""v1"",""created"":""Tue, 27 Aug 1996 15:57:10 GMT""}]","2009-10-30"
